username;date;retweets;favorites;text;geo;mentions;hashtags;id;permalink
;2016-02-24 14:12;2;3;"First time since 1975 that the President's budget is denied a hearing. Crass partisanship. http://www. c-span.org/video/?c458224 0/rep-pascrell-calls-budget-hearing … pic.twitter.com/MQMtHY9dhK";;;;"702586804034207744";https://twitter.com/BillPascrell/status/702586804034207744
;2016-02-23 15:54;6;8;"I stand with @RepSandyLevin against the #TPP trade agreement. Millions of American jobs are at stake. https:// twitter.com/willmauldin/st atus/700361835988586497 …";;@RepSandyLevin;#TPP;"702250296077066240";https://twitter.com/BillPascrell/status/702250296077066240
;2016-02-23 12:20;1;1;"American people’s business grinds to a halt as majority bows to Tea Party & weasels out of bipartisan budget deal. http://www. politico.com/story/2016/02/ tom-price-gop-budget-impasse-219620 …";;;;"702196226687631361";https://twitter.com/BillPascrell/status/702196226687631361
;2016-02-22 15:02;2;0;"Celebrated #BlackHistoryMonth at Calvary Baptist Church yesterday. Thank you, Rev. Lassiter, for having me. pic.twitter.com/6svCO84b5E";;;#BlackHistoryMonth;"701874852823695361";https://twitter.com/BillPascrell/status/701874852823695361
;2016-02-19 12:02;7;5;"Clean drinking water is vital. That's why I asked @PVWC to create a task force to deal with lead in our water. http://www. northjersey.com/news/pascrell- prods-utility-to-communicate-with-public-on-lead-in-drinking-water-1.1514382 …";;@PVWC;;"700742375174488065";https://twitter.com/BillPascrell/status/700742375174488065
;2016-02-18 09:15;3;1;". @RepLoBiondo & I led bipartisan letter asking @NJTRANSIT to protect commuters by solving labor dispute. #njcommute http://www. nj.com/traffic/index. ssf/2016/02/settle_contract_to_avoid_strike_members_of_congres.html …";;@RepLoBiondo @NJTRANSIT;#njcommute;"700337851150557188";https://twitter.com/BillPascrell/status/700337851150557188
;2016-02-17 08:01;3;4;"Congratulations Milton "Manny" Shucard, WWII Civil Air Patrolman & fellow Patersonian, on Congressional Gold Medal. http://www. northjersey.com/news/paramus-m an-receives-congressional-gold-medal-for-service-as-wwii-pilot-1.1512863 …";;;;"699956897034715136";https://twitter.com/BillPascrell/status/699956897034715136
;2016-02-11 16:03;7;6;"It's the duty of government to protect from all threats, including from the faucet. Glad to co-sponsor this bill. http://www. cbsnews.com/news/house-pas ses-drinking-water-safety-bill/ …";;;;"697903922007162880";https://twitter.com/BillPascrell/status/697903922007162880
;2016-02-11 09:05;2;5;"Proud to score 100 on @AAUW Voting Review for my record of fighting for equity for women & girls in Washington D.C. https://www. aauwaction.org/voter-educatio n/congressional-voting-record/ …";;@AAUW;;"697798518908547072";https://twitter.com/BillPascrell/status/697798518908547072
;2016-02-10 09:46;2;2;"The 9/11 Memorial & Museum at the World Trade Center, our sanctum of healing & hope, should be a National Memorial. http://www. c-span.org/video/?c458004 1/rep-pascrell-speaks-regarding-911-memorial …";;;;"697446557738729472";https://twitter.com/BillPascrell/status/697446557738729472
;2016-02-08 11:00;3;5;"Stood today with @SenatorMenendez & @CoryBooker to encourage investment in our water infrastructure. We cannot wait. pic.twitter.com/Hf9sEiVs9b";;@SenatorMenendez @CoryBooker;;"696740370042978304";https://twitter.com/BillPascrell/status/696740370042978304
;2016-02-08 08:21;0;2;"Thanks for your service. It was great to see you in Washington! https:// twitter.com/HCPOProsecutor /status/695660613666734080 …";;;;"696700280554000384";https://twitter.com/BillPascrell/status/696700280554000384
;2016-02-05 09:39;2;3;"Grades are in. @NEAToday gave me an A on the 2016 Report Card. I'll continue to back public education & educators! http://www. nea.org/home/19413.htm";;@NEAToday;;"695632902449733633";https://twitter.com/BillPascrell/status/695632902449733633
;2016-02-04 12:38;3;5;"As mayor, I swore in Paterson's First Black Fire Dept. Captain, Larry Franklin, in 1994. #BlackHistoryMonth #TBT pic.twitter.com/NAAYXR3TkN";;;#BlackHistoryMonth #TBT;"695315436783681536";https://twitter.com/BillPascrell/status/695315436783681536
;2016-02-04 09:49;5;2;"Millions of Americans are coping with brain injuries. We talked research, treatment, and outlook on 'To The Point.' https://www. youtube.com/watch?v=v4L80l EOCxA …";;;;"695273094152323073";https://twitter.com/BillPascrell/status/695273094152323073
;2016-02-03 09:12;14;26;"I want to thank Ken Stabler & family for committing his brain for CTE research. Congress has made this a priority. https:// twitter.com/nytimes/status /694855117653303296 …";;;;"694901380096606208";https://twitter.com/BillPascrell/status/694901380096606208
;2016-02-02 15:25;5;3;"Only @GovChristie can ask HUD how NJ missed out on $300M in Sandy-related funds. House members want to know, too. http:// pascrell.house.gov/sites/pascrell .house.gov/files/Ltr%20to%20Gov%20Christie%20on%20NDRC%20Application.pdf …";;@GovChristie;;"694632827866988544";https://twitter.com/BillPascrell/status/694632827866988544
;2016-02-02 13:56;1;1;"Met with President of Macedonian Parliament Trajko Veljanovski & talked bilateral relations, NATO & refugee crisis. pic.twitter.com/EEPgpGwMx6";;;;"694610406501961729";https://twitter.com/BillPascrell/status/694610406501961729
;2016-02-02 08:33;4;5;"This $1.8M #NationalParks grant is part of a big investment in Paterson’s National Park. http://www. northjersey.com/news/paterson- s-great-falls-park-gets-4-3m-for-great-lawn-near-industrial-ruins-1.1503405 … pic.twitter.com/Tkb8i4M3jU";;;#NationalParks;"694528964702830593";https://twitter.com/BillPascrell/status/694528964702830593
;2016-02-01 15:19;4;5;"Thanks to Dir. Jarvis of @NatlParkService for support. Paterson deserves first-rate park! http:// bit.ly/1RVHbL8 pic.twitter.com/MIYXJUeaZn";;@NatlParkService;;"694268843192160257";https://twitter.com/BillPascrell/status/694268843192160257
;2016-01-29 14:06;7;5;"Kudos @AGSchneiderman for exposing ticket-buying bots. Working on an update to BOSS Act to take on secondary sales! https:// twitter.com/observer/statu s/692532165473615872 …";;@AGSchneiderman;;"693163316340985856";https://twitter.com/BillPascrell/status/693163316340985856
;2016-01-29 13:10;6;4;"Seven years ago, @POTUS signed Lilly Ledbetter Fair Pay Act. Equal pay strengthens economy for everyone. Let’s recommit: RT for #EqualPay !";;@POTUS;#EqualPay;"693149143640846342";https://twitter.com/BillPascrell/status/693149143640846342
;2016-01-28 11:23;9;11;"Great taping of To The Point today w @LeonardMarshal6 & others re: concussions and TBI research. cc @bennetomalu9168 pic.twitter.com/PPiC0cYFSq";;@LeonardMarshal6 @bennetomalu9168;;"692759963110920192";https://twitter.com/BillPascrell/status/692759963110920192
;2016-01-27 16:19;3;1;". @HumaneSociety just released their 2015 Humane Scorecard & I'm proud to announce I scored 100% for standing up to animal cruelty & abuse.";;@HumaneSociety;;"692472069972455424";https://twitter.com/BillPascrell/status/692472069972455424
;2016-01-27 16:00;2;4;"Remember what Benjamin Franklin said: “You may delay, but time will not.” https:// twitter.com/Alystocracy/st atus/692448811202015232 …";;;;"692467261991419904";https://twitter.com/BillPascrell/status/692467261991419904
;2016-01-25 15:53;7;9;"Spoke to our 30 newest firefighters today at @PatersonFire Academy Graduation. The $7.5M SAFER grant is paying off! pic.twitter.com/u8Rty2xLjR";;@PatersonFire;;"691740622865195008";https://twitter.com/BillPascrell/status/691740622865195008
;2016-01-25 11:40;0;1;"Thanks to my co-chair @WhipHoyer and all of the other well-wishers today! https:// twitter.com/WhipHoyer/stat us/691661081308184576 …";;@WhipHoyer;;"691677085568471040";https://twitter.com/BillPascrell/status/691677085568471040
;2016-01-22 13:24;3;1;"Please be safe this weekend & clear your hydrant to help your local firefighters! https:// twitter.com/Readygov/statu s/690598490389495808 …";;;;"690616067585150976";https://twitter.com/BillPascrell/status/690616067585150976
;2016-01-22 11:42;2;1;"Completely unacceptable. https:// twitter.com/JDSalant/statu s/690398073885974530 …";;;;"690590261177614336";https://twitter.com/BillPascrell/status/690590261177614336
;2016-01-22 09:21;5;5;"Speaking to stakeholders of Paterson National Park. Making the Great Falls a jewel in the National Park System! pic.twitter.com/QwLKiinCSr";;;;"690554886384177152";https://twitter.com/BillPascrell/status/690554886384177152
;2016-01-21 15:30;1;1;"It was only through vigilance & bravery from our fire & rescue workers that no lives were lost one year ago today. http://www. northjersey.com/news/avalon-at -edgewater-inferno-one-year-later-more-time-for-healing-1.1495511 …";;;;"690285345158623232";https://twitter.com/BillPascrell/status/690285345158623232
;2016-01-21 15:17;4;1;"HUD gave feedback to improve NJ's application, yet somehow the final application looked darn close to the original. https:// twitter.com/ericlandskrone r/status/690281139840405505 …";;;;"690282107411775489";https://twitter.com/BillPascrell/status/690282107411775489
;2016-01-21 11:40;33;56;"Amir Hekmati, a former US Marine, is returning home after being held for 4+ years in Iran. Welcome back! #FreedAmir pic.twitter.com/gmqObk8u8n";;;#FreedAmir;"690227516494188544";https://twitter.com/BillPascrell/status/690227516494188544
;2016-01-19 15:45;0;0;"Visited @DiamondChem today & spoke with Harold Diamond re: tax benefits made permanent in end-of-year budget package pic.twitter.com/Id392PR3ft";;@DiamondChem;;"689564481324781568";https://twitter.com/BillPascrell/status/689564481324781568
;2016-01-15 12:20;5;7;"Great to see NJ's bald eagle pop. back from low of 1 in the 1970s. I'm proud to count some of them as constituents! http:// bit.ly/1RLcPeB";;;;"688063335582052353";https://twitter.com/BillPascrell/status/688063335582052353
;2016-01-12 18:07;3;12;"Great to meet & hear @bennetomalu9168 on discovery of CTE & commitment to TBI research @RepJohnConyers @RepSpeier pic.twitter.com/70wDhqreLn";;@bennetomalu9168 @RepJohnConyers @RepSpeier;;"687063501316173824";https://twitter.com/BillPascrell/status/687063501316173824
;2016-01-12 10:09;2;0;"Does your family need health insurance? Enroll by Jan. 15 for coverage on Feb. 1. Go to http://www. healthcare.gov . pic.twitter.com/kPOv55p2jq";;;;"686942983367692289";https://twitter.com/BillPascrell/status/686942983367692289
;2016-01-11 15:49;1;1;"Joining @repsandylevin @SenSherrodBrown for forum today on Trans-Pacific Partnership. #StopTPP You can watch live: https://www. youtube.com/watch?v=5R36CQ YYRJU …";;@repsandylevin @SenSherrodBrown;#StopTPP;"686666200206716928";https://twitter.com/BillPascrell/status/686666200206716928
;2016-01-11 15:16;5;4;"Happy birthday Alexander Hamilton, great American & founder of Paterson. Still fighting for his place on $10 bill. http:// on.fb.me/22VREd8";;;;"686657861858922496";https://twitter.com/BillPascrell/status/686657861858922496
;2016-01-08 11:10;2;2;"We continue to see sustained job growth. After all the doom & gloom, silence from GOP candidates speaks volumes. pic.twitter.com/dCFJ3vc5AD";;;;"685508973982789632";https://twitter.com/BillPascrell/status/685508973982789632
;2016-01-07 08:31;4;6;"Once again, the Great Falls can be the engine for economic growth in Paterson and beyond. http://www. northjersey.com/news/feds-unve il-long-awaited-plan-for-paterson-s-great-falls-national-park-1.1485914 … pic.twitter.com/0wGOIIoAeg";;;;"685106434128908289";https://twitter.com/BillPascrell/status/685106434128908289
;2016-01-06 12:42;5;4;"Very thoughtful article by @AdelyReporter on the Syrian family we welcomed to Paterson. http://www. northjersey.com/news/syrian-re fugee-family-in-paterson-happy-with-new-home-attention-1.1485292 … pic.twitter.com/0Xh7TNtXkA";;@AdelyReporter;;"684807242646958082";https://twitter.com/BillPascrell/status/684807242646958082
;2016-01-05 14:47;5;4;". @POTUS is strengthening our background checks & ensuring existing gun safety laws are enforced. #StopGunViolence pic.twitter.com/WoliJAqGQ0";;@POTUS;#StopGunViolence;"684476405497860098";https://twitter.com/BillPascrell/status/684476405497860098
;2015-12-30 11:10;4;3;"Taking away #healthcare for millions without offering an alternative? New Speaker, but same misguided priorities. https:// twitter.com/SpeakerRyan/st atus/682205373462384640 …";;;#healthcare;"682247378988998656";https://twitter.com/BillPascrell/status/682247378988998656
;2015-12-24 10:56;3;2;"I hope the season of joy finds you well this year! https:// youtu.be/SAIC683VlDw";;;;"680069649585836032";https://twitter.com/BillPascrell/status/680069649585836032
;2015-12-17 15:02;3;1;"The tax bill is far from perfect, but I can't vote against it to prove a point. The relief is critical to families. http:// cs.pn/1mqcaSu";;;;"677594700262584320";https://twitter.com/BillPascrell/status/677594700262584320
;2015-12-16 12:56;5;2;"Due to unprecedented demand, the health insurance deadline has been extended. Go to http:// healthcare.gov to #GetCovered before 12/17.";;;#GetCovered;"677200551638138881";https://twitter.com/BillPascrell/status/677200551638138881
;2015-12-16 12:25;7;6;"Zadroga Act renewal should not have been a bargaining chip. Nevertheless, I'm pleased with the long term extension. #Renew911Health";;;#Renew911Health;"677192881183043585";https://twitter.com/BillPascrell/status/677192881183043585
;2015-12-11 16:23;5;6;"North Jersey deserves a better rail system with interconnectivity between Passaic, Bergen, and Hudson counties. http://www. northjersey.com/opinion/region al-rail-plan-shows-great-promise-1.1472569 …";;;;"675440874822742016";https://twitter.com/BillPascrell/status/675440874822742016
;2015-12-08 10:14;1;3;"We are working hard in Washington to finish a bipartisan budget and avoid any costly shutdown. http://www. c-span.org/video/?c456573 0/rep-pascrell-budget-process …";;;;"674260891995676672";https://twitter.com/BillPascrell/status/674260891995676672
;2015-12-07 15:03;4;4;"Paterson is being aggressive about the future. Proud to announce another $2.5M grant today http:// bit.ly/21KjvMZ pic.twitter.com/wB6S6PCSlk";;;;"673971181368709120";https://twitter.com/BillPascrell/status/673971181368709120
;2015-12-02 17:10;23;45;"No words describe horror of #SanBernadino . Response must be action to stop tomorrow’s mass shooting and the gun violence epidemic. Period.";;;#SanBernadino;"672191063365443584";https://twitter.com/BillPascrell/status/672191063365443584
;2015-11-19 13:14;2;2;"Thank you Dawn. These are good people who need our help. https:// twitter.com/DawGraham/stat us/667359779556343808 …";;;;"667420766313562114";https://twitter.com/BillPascrell/status/667420766313562114
;2015-11-19 11:16;11;10;"We can maintain security & remain a safe harbor. We should not be turning away victims of civil war at our gates. https://www. youtube.com/watch?v=Vfo77w kk8Yo …";;;;"667391102069161985";https://twitter.com/BillPascrell/status/667391102069161985
;2015-11-16 16:44;4;15;"Yogi Berra is being honored with the Pres. Medal of Freedom, the Nation's highest civilian honor! Cc @lindsayberra http:// 1.usa.gov/1lrLhwZ";;@lindsayberra;;"666386485101375488";https://twitter.com/BillPascrell/status/666386485101375488
;2015-11-16 16:32;4;4;"Yogi Berra is going to be honored with the Presidential Medal of Freedom! I only wish Yogi was here to celebrate. http:// 1.usa.gov/1lrLhwZ";;;;"666383422013730816";https://twitter.com/BillPascrell/status/666383422013730816
;2015-11-12 20:56;3;1;"Passionate folks @CWS_global #Benefit4Change in NYC. Need more US leadership/action on Syrian refugee crisis. pic.twitter.com/DHfU4Ci8fN";;@CWS_global;#Benefit4Change;"665000276982657024";https://twitter.com/BillPascrell/status/665000276982657024
;2015-11-12 17:24;5;4;"Some think we must cut Social Security benefits - I want to expand the system bc we need for today and future: http:// politi.co/1krKbRB";;;;"664947016624185344";https://twitter.com/BillPascrell/status/664947016624185344
;2015-11-12 09:41;2;1;"Nostalgia as Paterson Armory comes down. #TBT to it hosting Babe Ruth in a basketball game. #history @Cut4 pic.twitter.com/mDThxW1vDL";;@Cut4;#TBT #history;"664830334085832708";https://twitter.com/BillPascrell/status/664830334085832708
;2015-11-11 06:51;2;0;"Cut ribbon at ACA enrollment center in Clifton with Mayor and @HHSRegion2 . Staff there can help you #GetCovered http://www. northjersey.com/news/obamacare -enrollment-center-officially-opens-in-clifton-shopping-plaza-1.1452465 …";;@HHSRegion2;#GetCovered;"664425229050118144";https://twitter.com/BillPascrell/status/664425229050118144
;2015-11-06 16:30;5;4;"Enjoyed morning @NorthAtlUPSers with #UPS Saddle Brook team as they presented @clf4kids with a generous donation. pic.twitter.com/WWIobURbnM";;@NorthAtlUPSers @clf4kids;#UPS;"662758929022210048";https://twitter.com/BillPascrell/status/662758929022210048
;2015-11-05 09:04;1;2;"Great kicker: "They should add in the bipartisan Renacci-Pascrell plan [to the highway bill]." http:// tinyurl.com/oxm9lol - @washingtonpost";;@washingtonpost;;"662284327208755200";https://twitter.com/BillPascrell/status/662284327208755200
;2015-11-03 16:04;3;3;"Testified w @RepJimRenacci on our fed highway/transit finance plan - now we need a full House vote. #regularorder pic.twitter.com/LxtuCb7IJf";;@RepJimRenacci;#regularorder;"661665219127693312";https://twitter.com/BillPascrell/status/661665219127693312
;2015-11-03 12:08;6;7;"50 years of gains must be protected - this Election Day I renew my call for Congress to #RestoreTheVOTE so that every voice is heard.";;;#RestoreTheVOTE;"661605853859049476";https://twitter.com/BillPascrell/status/661605853859049476
;2015-11-03 08:32;0;2;"Glad @POTUS saw the @HamiltonMusical - he can let the @USTreasury know why we should keep Hamilton on the 10 and put a @WomenOn20s";;@POTUS @HamiltonMusical @USTreasury @WomenOn20s;;"661551608501772288";https://twitter.com/BillPascrell/status/661551608501772288
;2015-09-25 10:33;2;0;"My statement on @SpeakerBoehner 's resignation: pic.twitter.com/DZUaO8vSmY";;@SpeakerBoehner;;"647433716156006400";https://twitter.com/BillPascrell/status/647433716156006400
;2015-09-24 12:01;1;1;"Looking forward to joining @MSNBC host @craigmelvin today at 1:30pm to discuss #PopeInDC . Tune in!";;@MSNBC @craigmelvin;#PopeInDC;"647093609355976704";https://twitter.com/BillPascrell/status/647093609355976704
;2015-09-16 14:49;5;6;"Joined Jon Stewart today to urge Congress to #Renew911Health and take care of our nation's 9/11 heroes. pic.twitter.com/B31jAtOvuw";;;#Renew911Health;"644236585895096321";https://twitter.com/BillPascrell/status/644236585895096321
;2015-09-16 11:55;4;2;"First responders risked their lives in toxic fumes on 9/11. Now it's up to Congress to #Renew911Health !";;;#Renew911Health;"644192783184609280";https://twitter.com/BillPascrell/status/644192783184609280
;2015-09-11 14:30;0;2;"I commend @HHSGov for elevating fed TBI program & recognizing the important role it serves in the lives of so many→ http:// 1.usa.gov/1i4pcT3";;@HHSGov;;"642420065229500416";https://twitter.com/BillPascrell/status/642420065229500416
;2015-09-10 16:57;2;0;"Pleased to see @POTUS heed my call. A good start, but we need to do much more to address this humanitarian crisis. https:// twitter.com/StateDept/stat us/642023540120653824 …";;@POTUS;;"642094693619269632";https://twitter.com/BillPascrell/status/642094693619269632
;2015-09-09 12:05;5;6;"Congrats to my friend and fellow New Jerseyan @StephenAtHome on last night's debut of @colbertlateshow #JerseyPride pic.twitter.com/sKlRBTUgZb";;@StephenAtHome @colbertlateshow;#JerseyPride;"641658769277976577";https://twitter.com/BillPascrell/status/641658769277976577
;2015-09-08 09:42;3;1;"After intensive study of the deal presented, I have decided to support the Iran nuclear deal. My full statement → http:// 1.usa.gov/1UyBUv6";;;;"641260317918502912";https://twitter.com/BillPascrell/status/641260317918502912
;2015-09-07 08:03;8;5;"Our nation’s strength lies in its greatest resource – our people and their unrivaled work ethic. #LaborDay";;;#LaborDay;"640872957758304256";https://twitter.com/BillPascrell/status/640872957758304256
;2015-08-31 15:04;1;0;"I'm offering NJ09 residents tix to view outdoor simulcast in DC of #PopeFrancis address to Joint Meeting of Congress→ http:// 1.usa.gov/1UnPdJk";;;#PopeFrancis;"638442358506422272";https://twitter.com/BillPascrell/status/638442358506422272
;2015-08-31 12:34;1;1;"ICYMI: Great column in today's Bergen Record on the tireless efforts of congressional caseworkers http:// bit.ly/1JHcdl1 via @record_dc";;@record_dc;;"638404554472693760";https://twitter.com/BillPascrell/status/638404554472693760
;2015-08-26 14:19;1;0;"Grateful for the support of @WomenOn20s #WomensEqualityDay https:// twitter.com/WomenOn20s/sta tus/636594997010169856 …";;@WomenOn20s;#WomensEqualityDay;"636618889208709120";https://twitter.com/BillPascrell/status/636618889208709120
;2015-08-26 14:06;4;4;"Be sure to check out my open letter w/ @StaceyPlaskett on @HuffingtonPost in honor of #WomensEqualityDay @WomenOn20s https:// twitter.com/HuffPostWomen/ status/636586583924285440 …";;@StaceyPlaskett @HuffingtonPost @WomenOn20s;#WomensEqualityDay;"636615755828699136";https://twitter.com/BillPascrell/status/636615755828699136
;2015-08-25 14:02;1;1;"Congrats to our summer 2015 interns on completing their term! Appreciative for all their hard work… https:// instagram.com/p/60T4sPB-fb/";;;;"636252244422344704";https://twitter.com/BillPascrell/status/636252244422344704
;2015-08-25 13:34;4;3;"Proud to count @NatlParkService as a constituent with the Paterson Great Falls. Wishing you the best on your 99th birthday! #NPS99";;@NatlParkService;#NPS99;"636245289490382848";https://twitter.com/BillPascrell/status/636245289490382848
;2015-08-06 11:02;3;2;"As we celebrate the significant progress of #VRA50 , we call on our GOP colleagues to #RestoreTheVRA . pic.twitter.com/eAaoARFPuW";;;#VRA50 #RestoreTheVRA;"629321735452684288";https://twitter.com/BillPascrell/status/629321735452684288
;2015-08-03 12:08;2;1;"Joined #NJDOT Comm Fox and @NJTRANSIT ED Hakim in announcing rail safety improvements in Elmwood Park @skywayrehab pic.twitter.com/i5GukrH86D";;@NJTRANSIT @skywayrehab;#NJDOT;"628251013053575168";https://twitter.com/BillPascrell/status/628251013053575168
;2015-07-31 12:24;3;3;"Gaining momentum to #SaveHamilton → Lawmakers call for keeping Hamilton on $10 bill http:// bit.ly/1DW6qSs via @thehilltweets @cimarcos";;@thehilltweets @cimarcos;#SaveHamilton;"627168002530787328";https://twitter.com/BillPascrell/status/627168002530787328
;2015-07-31 10:42;4;3;"Continuing my fight to urge @USTreasury to #SaveHamilton and instead put #WomenOn20s @StaceyPlaskett @Lin_Manuel https:// twitter.com/CQnow/status/6 27127849200152576 …";;@USTreasury @StaceyPlaskett @Lin_Manuel;#SaveHamilton #WomenOn20s;"627142224032174080";https://twitter.com/BillPascrell/status/627142224032174080
;2015-07-30 11:22;3;2;"Led a group of 64 colleagues in urging @USTreasury to #SaveHamilton and instead put #WomenOn20s http:// 1.usa.gov/1SP7Q8i @WomenOn20s";;@USTreasury @WomenOn20s;#SaveHamilton #WomenOn20s;"626790054619402241";https://twitter.com/BillPascrell/status/626790054619402241
;2015-07-23 12:11;6;7;"#tbt Representing my #PioneerPride at the 2001 Congressional Baseball Game. @wpunj_edu @WPUPioneers #WillPower pic.twitter.com/h8kkLVqK78";;@wpunj_edu @WPUPioneers;#tbt #PioneerPride #WillPower;"624265714925498369";https://twitter.com/BillPascrell/status/624265714925498369
;2015-07-23 09:26;4;7;"Great to join @SetonHall Prez Esteban and @SetonHallAlumni at 12th annual #HallOnTheHill event in DC #HallAlumni pic.twitter.com/HO4tU8aFVu";;@SetonHall @SetonHallAlumni;#HallOnTheHill #HallAlumni;"624223993923567616";https://twitter.com/BillPascrell/status/624223993923567616
;2015-07-22 16:41;5;2;"Met with Rabbis from northern New Jersey to discuss the #Iran deal. Looking forward to keep the dialogue going. pic.twitter.com/AtJn9TVKDd";;;#Iran;"623971069217644544";https://twitter.com/BillPascrell/status/623971069217644544
;2015-07-21 11:34;0;0;"My thoughts are with young Jason and the entire Leider family this week → http:// bit.ly/1JeBFyq via @NorthJerseybrk";;@NorthJerseybrk;;"623531500076703744";https://twitter.com/BillPascrell/status/623531500076703744
;2015-07-20 16:06;2;1;"Convened a meeting of my Cong Biz Advisory Comm to discuss econ policies impacting NJ @njchamber @MR_Chamber @SBAgov pic.twitter.com/8j4n0c0gmO";;@njchamber @MR_Chamber @SBAgov;;"623237635285327872";https://twitter.com/BillPascrell/status/623237635285327872
;2015-07-20 09:18;1;1;"ICYMI: Be sure to check out my op-ed in today's @rollcall on right-wing extremism → http:// bit.ly/1IeO6v8";;@rollcall;;"623134910698622976";https://twitter.com/BillPascrell/status/623134910698622976
;2015-07-16 17:43;2;1;"My thoughts & prayers are with #Chattanooga today in the wake of yet another senseless shooting. Tragic loss of 4 of our nation's bravest.";;;#Chattanooga;"621812454348029952";https://twitter.com/BillPascrell/status/621812454348029952
;2015-07-15 15:13;4;0;"Proud to accept @NPCA Friend of the National Parks award for my work at @GreatFallsNPS #ParkChamp pic.twitter.com/OZPbv8vy5h";;@NPCA @GreatFallsNPS;#ParkChamp;"621412391755120642";https://twitter.com/BillPascrell/status/621412391755120642
;2015-07-14 15:55;14;8;"Today I led a bipartisan letter urging the @StateDept to continue to advocate for #Macedonia ’s membership in #NATO . http:// 1.usa.gov/1DfcTHX";;@StateDept;#Macedonia #NATO;"621060354232205312";https://twitter.com/BillPascrell/status/621060354232205312
