username;date;retweets;favorites;text;geo;mentions;hashtags;id;permalink
;2011-11-05 12:50;1;0;"Let 'er buck! #GoPokes !";;;#GoPokes;"132877422323433472";https://twitter.com/CynthiaLummis/status/132877422323433472
;2011-11-04 17:01;0;0;"In case you missed it, here is the link to today's FOX News interview: http:// ow.ly/7jBKH";;;;"132578280825028608";https://twitter.com/CynthiaLummis/status/132578280825028608
;2011-11-04 09:13;1;0;"At 9:10 a.m. (MT), I’ll be on FOX talking about the letter I sent to the supercommittee calling for at least $3.8 trillion more in cuts.";;;;"132460402306060290";https://twitter.com/CynthiaLummis/status/132460402306060290
;2011-11-03 09:25;3;0;"These stacks of paper encompass all of the new 2011 federal regulations placed on American businesses so far this year: http:// ow.ly/7hPef";;;;"132101071643475969";https://twitter.com/CynthiaLummis/status/132101071643475969
;2011-11-01 10:52;3;1;"My op-ed in Sunday's Casper Star Tribune: USPS should close urban, not rural post offices: http:// ow.ly/7fvCn";;;;"131398315471421440";https://twitter.com/CynthiaLummis/status/131398315471421440
;2011-10-26 17:07;1;0;"Track the Progress of the House Republican Plan for America's Job Creators with the Jobs Tracker here: http:// ow.ly/7a58x #WeCantWait";;;#WeCantWait;"129318168870133761";https://twitter.com/CynthiaLummis/status/129318168870133761
;2011-10-24 16:44;2;0;". @SenateDems should pass H.R. 1938, North American-Made Energy Security Act: http:// ow.ly/77ysD immediately. #Forgotten15 #WeCantWait";;@SenateDems;#Forgotten15 #WeCantWait;"128587670870966272";https://twitter.com/CynthiaLummis/status/128587670870966272
;2011-10-24 16:25;0;0;"Job-creating bills like H.R. 2021, the Jobs & Energy Permitting Act: http:// ow.ly/77xjE has yet 2 be picked up in the Senate. #Forgotten15";;;#Forgotten15;"128582843780706306";https://twitter.com/CynthiaLummis/status/128582843780706306
;2011-10-24 16:16;4;0;"H.R. 1231, the Reversing President Obama’s Offshore Moratorium Act: http:// ow.ly/77wTs still has not been considered by the Senate....";;;;"128580725078368256";https://twitter.com/CynthiaLummis/status/128580725078368256
;2011-10-24 16:06;0;0;"Stalled by @SenateDems : H.R. 1315, Consumer Financial Protection & Soundness Improvement Act: http:// ow.ly/77wb8 #Forgotten15";;@SenateDems;#Forgotten15;"128578100014493697";https://twitter.com/CynthiaLummis/status/128578100014493697
;2011-10-24 16:03;1;0;"#WeCantWait to pass H.R. 1229, the Putting the Gulf of Mexico Back to Work Act: http:// ow.ly/77vW9 #Forgotten15";;;#WeCantWait #Forgotten15;"128577339633311745";https://twitter.com/CynthiaLummis/status/128577339633311745
;2011-10-24 15:39;0;0;"The House passed H.R. 1230, the Restarting American Offshore Leasing Now Act: http:// ow.ly/77uaJ ; now is the time for action. #WeCantWait";;;#WeCantWait;"128571221104271360";https://twitter.com/CynthiaLummis/status/128571221104271360
;2011-10-24 15:31;0;0;". @SenateDems have yet to take up H.R. 2273, the Coal Residuals Reuse and Management Act: http:// ow.ly/77tNn #Forgotten15 #WeCantWait";;@SenateDems;#Forgotten15 #WeCantWait;"128569287509155841";https://twitter.com/CynthiaLummis/status/128569287509155841
;2011-10-24 15:26;0;0;"H.R. 2250, the EPA Regulatory Relief Act: http:// ow.ly/77tlQ , is one of the House-passed #Forgotten15 bills #WeCantWait on.";;;#Forgotten15 #WeCantWait;"128568139230359553";https://twitter.com/CynthiaLummis/status/128568139230359553
;2011-10-24 15:02;0;0;"H.R. 2681, The Cement Sector Regulatory Relief Act: http:// ow.ly/77rLT , is awaiting action by @SenateDems #Forgotten15";;@SenateDems;#Forgotten15;"128562017274564608";https://twitter.com/CynthiaLummis/status/128562017274564608
;2011-10-24 14:55;1;0;"#WeCantWait on the #Forgotten15 , including H.R. 2401, Transparency In Regulatory Analysis Of Impacts On The Nation: http:// ow.ly/77rbF";;;#WeCantWait #Forgotten15;"128560236075290627";https://twitter.com/CynthiaLummis/status/128560236075290627
;2011-10-24 14:36;0;0;"Another #Forgotten15 #jobs bill: The Protecting Jobs From Government Interference Act: http:// ow.ly/77pIO @SenateDems , stop delaying.";;@SenateDems;#Forgotten15 #jobs;"128555517751734272";https://twitter.com/CynthiaLummis/status/128555517751734272
;2011-10-24 14:12;0;0;"Americans are saying #WeCantWait 4 @SenateDems 2 consider #jobs bills like the Clean Water Cooperative Federalism Act: http:// ow.ly/77o7u";;@SenateDems;#WeCantWait #jobs;"128549330134122496";https://twitter.com/CynthiaLummis/status/128549330134122496
;2011-10-24 13:45;0;0;"Urge the Senate to get to work on the House-passed #Forgotten15 , including H.J. Res. 37: http:// ow.ly/77lU3 #WeCantWait #4jobs";;;#Forgotten15 #WeCantWait #4jobs;"128542550909911040";https://twitter.com/CynthiaLummis/status/128542550909911040
;2011-10-24 13:24;0;0;"#WeCantWait for bills like H.R. 910, the Energy Tax Prevention Act: http:// ow.ly/77kgQ , passed by the House, still waiting in Senate.";;;#WeCantWait;"128537308185108480";https://twitter.com/CynthiaLummis/status/128537308185108480
;2011-10-24 13:08;2;0;"H.R. 872, the Reducing Regulatory Burdens Act: http:// ow.ly/77iAv , 1 of the #Forgotten15 bills awaiting action by @SenateDems . #WeCantWait";;@SenateDems;#Forgotten15 #WeCantWait;"128533348925714432";https://twitter.com/CynthiaLummis/status/128533348925714432
;2011-10-24 12:52;2;0;"#WeCantWait for @SenateDems to start holding votes on the #Forgotten15 #jobs bills.";;@SenateDems;#WeCantWait #Forgotten15 #jobs;"128529311803244545";https://twitter.com/CynthiaLummis/status/128529311803244545
;2011-10-15 13:32;0;0;"Enjoying UW homecoming in Laramie. Let's go Pokes!";;;;"125278000957763584";https://twitter.com/CynthiaLummis/status/125278000957763584
;2011-10-13 10:32;0;0;"It was a great privilege to greet Wyoming's WWII heroes at the WWII Memorial in Washington, D.C yesterday: http:// ow.ly/6WlQs";;;;"124507895864889344";https://twitter.com/CynthiaLummis/status/124507895864889344
;2011-10-12 08:41;0;0;"Heading over to the WWII Memorial to greet Wyoming's WWII heroes for their Honor Flight trip to Washington, D.C. this morning!";;;;"124117432058130432";https://twitter.com/CynthiaLummis/status/124117432058130432
;2011-10-06 09:41;0;0;"Don't forget to "like" my Facebook page! Here's the link: http://ow.ly/6PmRi";;;;"121958207773093888";https://twitter.com/CynthiaLummis/status/121958207773093888
;2011-10-04 16:23;3;0;""Wyoming’s nearly decade-long saga on the fully recovered gray wolf is, I hope, coming to an end." Find out more here: http://ow.ly/6NuUH";;;;"121334695534399489";https://twitter.com/CynthiaLummis/status/121334695534399489
;2011-09-21 17:03;3;0;"I cannot support raising the level of discretionary spending for next year while America hemorrhages debt. More here: http://ow.ly/6Bc7s";;;;"116633694772531200";https://twitter.com/CynthiaLummis/status/116633694772531200
;2011-09-21 13:06;3;0;"Senator Wallop was all Wyoming, all the time. I salute a great man who did great things for his state: http://ow.ly/6AWZn";;;;"116573962560995329";https://twitter.com/CynthiaLummis/status/116573962560995329
;2011-09-11 09:54;3;0;"We will never forget.";;;;"112901831960698880";https://twitter.com/CynthiaLummis/status/112901831960698880
;2011-09-09 09:46;4;0;"Wyoming people understand that the government can create work, but only the private sector can create jobs: http://ow.ly/6pSX4";;;;"112175053982007296";https://twitter.com/CynthiaLummis/status/112175053982007296
;2011-09-07 12:37;2;0;"Lummis on FOX Business regarding the President's jobs speech: "We need to go bold." Click here to watch: http://ow.ly/6nYbC";;;;"111493318822723584";https://twitter.com/CynthiaLummis/status/111493318822723584
;2011-09-02 13:33;3;2;"My full statement on the President’s withdrawal of ozone regulations here: http://ow.ly/6k7sW";;;;"109695480627331072";https://twitter.com/CynthiaLummis/status/109695480627331072
;2011-09-02 13:31;1;1;"For the sake of all Americans I am hopeful the President’s jobs speech Thurs will be in line with today’s withdrawal of EPA’s ozone regs.";;;;"109694946717597696";https://twitter.com/CynthiaLummis/status/109694946717597696
;2011-08-12 12:45;4;0;"Appeals Court: Obamacare mandate is unconstitutional. More here: http://ow.ly/61TAM";;;;"102073229002285057";https://twitter.com/CynthiaLummis/status/102073229002285057
;2011-08-12 11:53;2;0;"When will the Obama Administration wake up to the consequences of its irresponsible approach to domestic energy production?";;;;"102060112839057408";https://twitter.com/CynthiaLummis/status/102060112839057408
;2011-08-12 11:52;2;0;"Signing the U.S. up to be Brazil’s next big oil customer will set us back in our efforts to achieve energy independence: http://ow.ly/61Qbu";;;;"102060016747544576";https://twitter.com/CynthiaLummis/status/102060016747544576
;2011-08-11 11:05;1;0;"Looking forward to the Dry Fork Station dedication ceremony in Gillette this morning.";;;;"101685653804302336";https://twitter.com/CynthiaLummis/status/101685653804302336
;2011-08-03 14:29;0;0;"I applaud Governor Matt Mead’s successful efforts to reach agreement on a wolf management plan for Wyoming. More here: http://ow.ly/5Utd9";;;;"98837968097255424";https://twitter.com/CynthiaLummis/status/98837968097255424
;2011-08-01 18:19;5;0;"Welcome back, Representative Gabrielle Giffords! Wonderful to see her.";;;;"98171071882203136";https://twitter.com/CynthiaLummis/status/98171071882203136
;2011-07-29 18:25;2;0;"Lummis Votes to Prevent Debt Default, Cut Spending. Statement on tonight's debt ceiling vote here: http://ow.ly/5QSXx";;;;"97085313318531072";https://twitter.com/CynthiaLummis/status/97085313318531072
;2011-07-29 17:30;9;0;"The House passed 2 plans in the past 2 weeks to end the debt crisis @barackobama . Where is your plan? #leadership";;@barackobama;#leadership;"97071508635127808";https://twitter.com/CynthiaLummis/status/97071508635127808
;2011-07-29 10:40;1;0;"FOX Business interview from this morning on the debt ceiling: http://ow.ly/5QveV";;;;"96968250184843264";https://twitter.com/CynthiaLummis/status/96968250184843264
;2011-07-27 12:45;2;0;"In case you missed it, here is my interview on MSNBC from this morning: http://ow.ly/5OLWJ";;;;"96274916030160896";https://twitter.com/CynthiaLummis/status/96274916030160896
;2011-07-27 10:00;2;0;"I'll be MSNBC at 9:05 a.m. (MT) this morning with Thomas Richards to talk about the debt ceiling debate. Tune in!";;;;"96233629553917952";https://twitter.com/CynthiaLummis/status/96233629553917952
;2011-07-25 11:43;5;0;"My op-ed in today's Roll Call: Lummis: Vehicle Miles Traveled Tax Would Be Unfair to Rural Americans. Read it here: http://ow.ly/5MKBC";;;;"95534548531687425";https://twitter.com/CynthiaLummis/status/95534548531687425
;2011-07-24 09:19;1;0;"Had a great time riding in Saturday's CFD parade! http://ow.ly/i/eNll";;;;"95135951654895616";https://twitter.com/CynthiaLummis/status/95135951654895616
;2011-07-22 16:29;0;0;"Now, off to Cheyenne Frontier Days. Hope to see you there!";;;;"94519579811917824";https://twitter.com/CynthiaLummis/status/94519579811917824
;2011-07-22 16:29;0;0;"My remarks can be found here at the 6:02 mark: http://ow.ly/5LjCz.";;;;"94519395086368770";https://twitter.com/CynthiaLummis/status/94519395086368770
;2011-07-22 16:28;2;0;"At House Leadership press conf. today, I called on Senate and President Obama to pass Cut, Cap and Balance, or come up with their own plan.";;;;"94519285350797312";https://twitter.com/CynthiaLummis/status/94519285350797312
;2011-07-21 10:08;0;0;"How do YOU think Washington should resolve the debt ceiling debate?";;;;"94061282654822400";https://twitter.com/CynthiaLummis/status/94061282654822400
;2011-07-20 13:06;2;0;"CCB is common sense path forward to cut current spending, cap future spending, & ensure Washington begins to live within its means.";;;;"93743701070843905";https://twitter.com/CynthiaLummis/status/93743701070843905
;2011-07-20 13:04;1;0;"Last night, I voted in favor of H.R. 2560, the Cut, Cap and Balance Act, which passed the House 234-190. http://ow.ly/5Jh1J";;;;"93743169430224896";https://twitter.com/CynthiaLummis/status/93743169430224896
;2011-07-15 17:05;3;0;"Moody's Investors Services said Wed that raising debt ceiling isn't enough; the U.S. needs long term deficit reduction: http://ow.ly/5FO0N";;;;"91991722623647745";https://twitter.com/CynthiaLummis/status/91991722623647745
;2011-07-15 17:03;2;0;"The Wyoming Broadband Summit scheduled for Tuesday, July 19, has been postponed due to a last minute change in the Congressional schedule.";;;;"91991241385971712";https://twitter.com/CynthiaLummis/status/91991241385971712
;2011-07-15 10:56;0;0;"The Summit is a unique opportunity to discuss how we can collectively improve our broadband status in Wyo. Details here: http://ow.ly/5FuA8";;;;"91898911429623809";https://twitter.com/CynthiaLummis/status/91898911429623809
;2011-07-15 10:54;0;0;"I am hosting the Wyoming Broadband Summit with special guest Governor Mead on Tuesday in Cheyenne.";;;;"91898502342393857";https://twitter.com/CynthiaLummis/status/91898502342393857
;2011-07-14 08:28;0;0;"I will be talking about the debt ceiling with Stuart Varney on FOX Business this morning at 7:45 (MT)/9:45 (ET). Tune in!";;;;"91499272633200640";https://twitter.com/CynthiaLummis/status/91499272633200640
;2011-07-08 11:54;2;0;"Passing a budget is a lawmaker’s fundamental responsibility. Today marks #800Days since Dems have completed this most basic of duties.";;;#800Days;"89376931778273280";https://twitter.com/CynthiaLummis/status/89376931778273280
;2011-07-06 15:39;1;0;"This provision is a crucial puzzle piece 2 the long-awaited conclusion of the delisting of the fully-recovered gray wolf: http://ow.ly/5yfuH";;;;"88708579330236416";https://twitter.com/CynthiaLummis/status/88708579330236416
;2011-07-06 12:02;0;1;"Employers want 2 hire and grow but your policies r only growing economic uncertainty. When will u cut the red-tape & spending? #AskObama";;;#AskObama;"88653951834144768";https://twitter.com/CynthiaLummis/status/88653951834144768
;2011-07-06 10:49;3;0;"National unemployment has held at or above 8 percent for 28 consecutive months. Americans want to know, where are the jobs? #AskObama";;;#AskObama;"88635588508520448";https://twitter.com/CynthiaLummis/status/88635588508520448
;2011-07-06 10:38;0;1;"When will your Administration reverse its irresponsible approach to domestic energy production? #AskObama";;;#AskObama;"88632900353921024";https://twitter.com/CynthiaLummis/status/88632900353921024
;2011-07-06 10:29;0;0;"Any questions for Obama on jobs and the economy? White House is holding a Twitter TownHall at 12 pm. Tweet Qs w/hashtag #AskObama .";;;#AskObama;"88630711694802944";https://twitter.com/CynthiaLummis/status/88630711694802944
;2011-07-04 16:22;0;0;"They are shining examples of what America stands for: freedom, bravery and liberty.";;;;"87994714812448769";https://twitter.com/CynthiaLummis/status/87994714812448769
;2011-07-04 16:21;1;0;"As always, be sure to keep in mind America’s service men and women and their families.";;;;"87994578258501632";https://twitter.com/CynthiaLummis/status/87994578258501632
;2011-07-04 16:21;0;0;"I hope this 235th celebration of our country’s independence is a safe and happy one for you and your family!";;;;"87994361165529088";https://twitter.com/CynthiaLummis/status/87994361165529088
;2011-06-23 16:51;0;0;"President Obama's move to release from the Strategic Petroleum Reserves is like putting a band-aid on a gaping wound. http://ow.ly/5p5fT";;;;"84015809600569344";https://twitter.com/CynthiaLummis/status/84015809600569344
;2011-06-21 10:08;0;0;"Thanks for the mentions @DawnRachel13 , @twittersuggets, @opphoto , @girliegirlgop !";;@DawnRachel13 @twittersuggets @opphoto @girliegirlgop;;"83189619163799552";https://twitter.com/CynthiaLummis/status/83189619163799552
;2011-06-21 09:37;1;0;"Today's NYT: “ 'It’s a legacy of unemployment and high energy costs.' Ms. Lummis said in a statement." Read more here: http://ow.ly/5mOL2";;;;"83181729040445440";https://twitter.com/CynthiaLummis/status/83181729040445440
;2011-06-20 12:14;2;0;"My bill, the Gov. Litigation Savings Act, will prevent EAJA’s abuse, restore its integrity, and return it to Congress’ original intent.";;;;"82858772497833986";https://twitter.com/CynthiaLummis/status/82858772497833986
;2011-06-20 12:09;3;0;"Here’s a must-read: A self-described environmentalist explains how bad EAJA abuse by extremist organizations has gotten: http://ow.ly/5m0DO";;;;"82857643269554176";https://twitter.com/CynthiaLummis/status/82857643269554176
;2011-06-19 22:57;0;0;"I hope all the Dads out there had a great day - Happy Father's Day!";;;;"82658272519262208";https://twitter.com/CynthiaLummis/status/82658272519262208
;2011-06-15 12:34;1;0;"Great news for Sweetwater County: CST: FMC plans to double size of Granger soda ash facility: http://ow.ly/5izpI";;;;"81051894449053696";https://twitter.com/CynthiaLummis/status/81051894449053696
;2011-06-10 15:11;2;0;"I am getting close to 4,000 followers- Please help push me over the top by asking your followers to follow @cynthialummis . Thanks!";;@cynthialummis;;"79279486130065408";https://twitter.com/CynthiaLummis/status/79279486130065408
;2011-06-10 12:23;1;0;"GOP plan #4jobs takes on the staggering debt, increases #americanenergy production, & encourages our job creators : http://ow.ly/5f1Va.";;;#4jobs #americanenergy;"79237266274402304";https://twitter.com/CynthiaLummis/status/79237266274402304
;2011-06-10 11:52;0;0;"We need to awaken American ingenuity and free our job creators to do what they do best – put their fellow Americans back to work.";;;;"79229524595851264";https://twitter.com/CynthiaLummis/status/79229524595851264
;2011-06-10 11:49;3;0;"We must replace these backward economic policies with job-focused, entrepreneurial economic policies that will awaken American ingenuity.";;;;"79228617011363841";https://twitter.com/CynthiaLummis/status/79228617011363841
;2011-06-10 11:44;0;0;"Reckless spending and tax hikes are a disastrous combination for America’s job creators. #wherearethejobs";;;#wherearethejobs;"79227494779191296";https://twitter.com/CynthiaLummis/status/79227494779191296
;2011-06-09 16:15;0;0;"Do you approve or disapprove the way President Obama is handling the deficit?";;;;"78933320565661697";https://twitter.com/CynthiaLummis/status/78933320565661697
;2011-06-08 11:12;1;0;"Neat story from the NY Times: Mets’ Top Pick Wants to Put Wyoming on the Baseball Map. Read more here: http://ow.ly/5d9NU";;;;"78494507183771650";https://twitter.com/CynthiaLummis/status/78494507183771650
;2011-06-02 15:41;1;0;"The amend. I offered today protects U.S. Border Patrol agents from DOI policies that block their access to public lands: http://ow.ly/58TCv";;;;"76387995586019329";https://twitter.com/CynthiaLummis/status/76387995586019329
;2011-05-31 18:10;1;0;"Just voted to reject President Obama’s budget request for an unconditional increase of the debt limit. More info here: http://ow.ly/579tc";;;;"75700794409758720";https://twitter.com/CynthiaLummis/status/75700794409758720
;2011-05-30 15:03;0;0;"So grateful to our nation's service men and women. Their bravery, sacrifice and selflessness can't be matched. #HappyMemorialDay .";;;#HappyMemorialDay;"75291369962340352";https://twitter.com/CynthiaLummis/status/75291369962340352
;2011-05-26 14:49;2;1;"Here is the House #GOP 's Plan For America's Jobs Creators: http://j.mp/mtWquW #4Jobs #tcot";;;#GOP #4Jobs #tcot;"73838270391386113";https://twitter.com/CynthiaLummis/status/73838270391386113
;2011-05-26 11:52;1;0;"House Republicans are unveiling a plan #4jobs for Americans while Democrats won’t even do their own jobs and propose a budget.";;;#4jobs;"73793725414899712";https://twitter.com/CynthiaLummis/status/73793725414899712
;2011-05-26 10:43;1;0;"House GOP has repealed the job-crushing 1099 #hcr provision #4jobs .";;;#hcr #4jobs;"73776399344865280";https://twitter.com/CynthiaLummis/status/73776399344865280
;2011-05-26 10:22;15;0;"House GOP’s budget cuts job-destroying spending by $6.2 trillion. That’s what we’re doing #4Jobs .";;;#4Jobs;"73770954572050432";https://twitter.com/CynthiaLummis/status/73770954572050432
;2011-05-25 13:50;1;0;"Senator Barrasso sponsored the companion measure of the Equal Access to Justice Act in the U.S. Senate. More here: http://ow.ly/52Ww5";;;;"73460909745520640";https://twitter.com/CynthiaLummis/status/73460909745520640
;2011-05-25 13:48;3;0;"Today, I introduced a bill that relieves taxpayers of the burden of paying for the litigation machines of deep-pocketed environmental orgs.";;;;"73460348069482496";https://twitter.com/CynthiaLummis/status/73460348069482496
;2011-05-18 10:05;3;0;"Regular unleaded gas price during my visit to Rock Springs yesterday: $3.79/gallon: http://ow.ly/4XoLM";;;;"70867735713812480";https://twitter.com/CynthiaLummis/status/70867735713812480
;2011-05-11 14:26;8;0;"Just voted to end the de facto moratorium on American energy production in the Gulf of Mexico. House passed H.R. 1229 by 263 to 163.";;;;"68396498970357760";https://twitter.com/CynthiaLummis/status/68396498970357760
;2011-05-05 10:11;5;0;"Today, I’ll be voting for H.R. 1230, the Restarting American Offshore Leasing Now Act. #AmericanEnergyInitiative";;;#AmericanEnergyInitiative;"66158171567304706";https://twitter.com/CynthiaLummis/status/66158171567304706
;2011-05-05 10:10;5;0;"House Republicans are taking action 2 expand domestic energy production, create jobs & provide relief @the pump. #AmericanEnergyInitiative";;@the;#AmericanEnergyInitiative;"66157789185191938";https://twitter.com/CynthiaLummis/status/66157789185191938
;2011-05-03 08:16;0;0;"I'll be on FOX Business with Stuart Varney this morning at 7:45 (MT), 9:45 (ET) to talk Bin Laden and the fiscal challenges ahead. Tune in!";;;;"65404266554195968";https://twitter.com/CynthiaLummis/status/65404266554195968
;2011-05-02 11:01;1;1;"Let this valiant effort serve as a reminder to those seeking to destroy our way of life that they will be defeated.";;;;"65083612470587392";https://twitter.com/CynthiaLummis/status/65083612470587392
;2011-05-02 11:00;0;0;"We can’t thank them enough.";;;;"65083344450363392";https://twitter.com/CynthiaLummis/status/65083344450363392
;2011-05-02 11:00;0;0;"It truly is a tribute to the resolve, tireless dedication and sacrifice of the men and women who so bravely serve our country.";;;;"65083287902756864";https://twitter.com/CynthiaLummis/status/65083287902756864
;2011-05-02 11:00;0;0;"What a momentous victory for America and for the rest of the world.";;;;"65083229278965760";https://twitter.com/CynthiaLummis/status/65083229278965760
;2011-04-27 14:01;0;0;"I stopped by KGAB to talk with Dave Chaffin and his listeners about the upcoming debt ceiling debate. Take a listen here: http://ow.ly/4IlDZ";;;;"63316859885322240";https://twitter.com/CynthiaLummis/status/63316859885322240
;2011-04-27 11:21;2;1;"Check out the new Congressional Western Caucus website here: http://ow.ly/4Id0Z";;;;"63276541194407936";https://twitter.com/CynthiaLummis/status/63276541194407936
;2011-04-18 18:21;0;0;"As if we needed another reminder: Stocks sink after S&P issues warning on US debt http://ow.ly/4CX2o. It’s time 2 clean up our fiscal mess.";;;;"60120693085442048";https://twitter.com/CynthiaLummis/status/60120693085442048
;2011-04-13 11:17;1;0;"“On Mr. Obama's watch, the EPA's budget has risen sharply, to $10.3 billion in the 2010 fiscal year...” @WSJ article: http://ow.ly/4zsxN";;@WSJ;;"58202054098812928";https://twitter.com/CynthiaLummis/status/58202054098812928
;2011-04-13 11:15;2;0;"Republicans win $1.6 billion in spending cuts to the EPA. Read the @WSJ article here: http://ow.ly/4zs8v";;@WSJ;;"58201772115755008";https://twitter.com/CynthiaLummis/status/58201772115755008
;2011-04-12 16:32;0;0;"Upholding Judge Johnson’s ruling is crucial to advancing negotiations on a common sense wolf management plan. More here: http://ow.ly/4yPZW";;;;"57919094468517888";https://twitter.com/CynthiaLummis/status/57919094468517888
;2011-04-08 12:38;1;0;"I'll be talking about the budget battle with Tamron Hall on MSNBC at noon (MT) today. Tune in!";;;;"56410674083004416";https://twitter.com/CynthiaLummis/status/56410674083004416
;2011-04-06 15:05;0;0;"I will be talking about the budget today with Gerri Willis on FOX Business’ the Willis Report at 3 P.M. (MT). Tune in!";;;;"55722802950578176";https://twitter.com/CynthiaLummis/status/55722802950578176
;2011-04-05 16:51;0;0;"Today's bipartisan effort to repeal the 1099 reporting mandate is a victory for America's small business owners: http://ow.ly/4tTIt";;;;"55387189281947648";https://twitter.com/CynthiaLummis/status/55387189281947648
;2011-04-05 16:23;0;0;"#GOP Path to Prosperity changes the course of Washington's wayward fiscal ship: http://ow.ly/4tSDG.";;;#GOP;"55380140980576256";https://twitter.com/CynthiaLummis/status/55380140980576256
;2011-04-04 14:21;0;0;"Ending Washington’s addiction to spending is the first step to restoring certainty to America’s small businesses and growing the economy.";;;;"54987029305507840";https://twitter.com/CynthiaLummis/status/54987029305507840
;2011-04-04 14:21;0;0;"I will continue to fight for the largest spending cuts possible.";;;;"54986975723274240";https://twitter.com/CynthiaLummis/status/54986975723274240
;2011-04-04 14:20;1;0;"Because of the Senate’s inaction, Congress has relied on short-term resolutions to keep the gov running. The latest resolution expires Fri.";;;;"54986638912258048";https://twitter.com/CynthiaLummis/status/54986638912258048
;2011-04-04 14:19;0;0;"Forty-four days ago, House Republicans passed H.R. 1, a bill that cut a historic $100 billion from the President’s FY2011 rqst.";;;;"54986343935250433";https://twitter.com/CynthiaLummis/status/54986343935250433
