username;date;retweets;favorites;text;geo;mentions;hashtags;id;permalink
;2010-07-01 12:19;0;0;"National debt soars to highest level since WWII: http://ow.ly/25SlM";;;;"17507710274";https://twitter.com/CynthiaLummis/status/17507710274
;2010-06-26 17:19;1;0;"Our country's debt crisis won't fix itself: http://ow.ly/23GS4.";;;;"17121335719";https://twitter.com/CynthiaLummis/status/17121335719
;2010-06-23 16:38;5;0;"The failure to craft a budget resolution is an act of irresponsibility within the Democratic Majority. Learn more at http://ow.ly/22rth";;;;"16878963772";https://twitter.com/CynthiaLummis/status/16878963772
;2010-06-20 16:40;0;0;"Happy Father's Day!";;;;"16646534033";https://twitter.com/CynthiaLummis/status/16646534033
;2010-06-17 11:53;0;0;"Catch me today at 12 pm (MT) on CNBC's Street Signs discussing the Gulf Oil Spill.";;;;"16402668173";https://twitter.com/CynthiaLummis/status/16402668173
;2010-06-17 10:43;1;0;"Abbey agrees Congress should look into rigs certified by foreign governments.";;;;"16398076129";https://twitter.com/CynthiaLummis/status/16398076129
;2010-06-17 10:42;0;0;"Mr. Abbey says we do need to learn how to better respond to oil spills.";;;;"16398037376";https://twitter.com/CynthiaLummis/status/16398037376
;2010-06-17 10:23;0;0;"A father and son pair inspected the gulf well. They brought their union lawyer along when questioned after the well blew.";;;;"16396656176";https://twitter.com/CynthiaLummis/status/16396656176
;2010-06-17 10:21;0;0;"Abbey - inspection funding, inspection training and qualifications will change - good!";;;;"16396578157";https://twitter.com/CynthiaLummis/status/16396578157
;2010-06-17 10:21;0;0;"Mr. Abbey says DOI has new ethics standards, has cancelled lease sales, and will reorganize MMS into 3 departments.";;;;"16396525240";https://twitter.com/CynthiaLummis/status/16396525240
;2010-06-17 10:16;1;0;"Mr. Lamborn - why stop drilling for six months? This spill was human error. Killing jobs makes Americans suffer.";;;;"16396185266";https://twitter.com/CynthiaLummis/status/16396185266
;2010-06-17 10:03;0;0;"Mr. Costa, chairman of today's hearing, supports offshore drilling but wants better oversight of it -- that's a good start.";;;;"16395318282";https://twitter.com/CynthiaLummis/status/16395318282
;2010-06-17 10:02;1;0;"I'm live-tweeting from the Natural Resources Committee hearing over the Mineral Management Service. You can tune in at http://ow.ly/1ZNt6";;;;"16395268528";https://twitter.com/CynthiaLummis/status/16395268528
;2010-06-16 16:05;0;0;"Want to know what's happening in Washington? Click here to sign up for my e-newsletter: http://ow.ly/1ZtzN.";;;;"16335081315";https://twitter.com/CynthiaLummis/status/16335081315
;2010-06-16 10:34;0;0;"Democrats lack of budget is a failure to lead http://ow.ly/1ZimT";;;;"16314972085";https://twitter.com/CynthiaLummis/status/16314972085
;2010-06-12 16:47;0;0;"@Worland Patriot Salute with Sen. Barrasso, Gov. Freudenthal & Adj. Gen. Wright. Spoke w brave troops who returned from war zone in Kuwait.";;@Worland;;"16031478901";https://twitter.com/CynthiaLummis/status/16031478901
;2010-06-12 12:49;0;0;"Still raining hard in Lander. Many agencies and volunteers at the command center.";;;;"16018636970";https://twitter.com/CynthiaLummis/status/16018636970
;2010-06-12 12:47;1;0;"Great display of America at Guard Salute in Lander. Very moving welcoming them all back with 100 percent no casualties.";;;;"16018565524";https://twitter.com/CynthiaLummis/status/16018565524
;2010-06-12 11:01;0;0;"Drove through Hudson many sandbags and berms along Little Wind.";;;;"16012114713";https://twitter.com/CynthiaLummis/status/16012114713
;2010-06-11 16:56;1;0;"Saturday morning I’m heading to Fremont County to assess the flooding damage. Please keep those affected in your thoughts and prayers!";;;;"15958008538";https://twitter.com/CynthiaLummis/status/15958008538
;2010-06-10 08:12;0;0;"Catch me on K2 Radio today at 7:15 a.m. mt!";;;;"15849292060";https://twitter.com/CynthiaLummis/status/15849292060
;2010-06-09 10:00;0;0;"At 2 p.m. (MT) today, I'll be on FOX Business to discuss Washington's unsustainable spending.Tune in!";;;;"15785975563";https://twitter.com/CynthiaLummis/status/15785975563
;2010-06-06 09:37;0;0;"Fabulous evening in Evanston at the annual Renewal Ball last night-- 500+ people there to promote a strong and vibrant Evanston.";;;;"15559341974";https://twitter.com/CynthiaLummis/status/15559341974
;2010-06-05 10:55;0;0;"Stopping in at the Rotary District Conference in Casper!";;;;"15495433427";https://twitter.com/CynthiaLummis/status/15495433427
;2010-06-04 18:59;0;0;"Catch me on K2TV tonight during the 6 P.M. (MT) program!";;;;"15451054925";https://twitter.com/CynthiaLummis/status/15451054925
;2010-06-03 15:28;0;0;"SV #AmericaSpeakingOut group full of great ideas. Talked about accountability and changing the nation’s attitude to reshape our economy.";;;#AmericaSpeakingOut;"15349697217";https://twitter.com/CynthiaLummis/status/15349697217
;2010-06-02 14:19;0;0;"Join the debate at http://americaspeakingout.com/.";;;;"15271705075";https://twitter.com/CynthiaLummis/status/15271705075
;2010-05-31 20:58;0;0;"A Memorial Day message:http://ow.ly/1Sgby";;;;"15147325695";https://twitter.com/CynthiaLummis/status/15147325695
;2010-05-31 10:14;0;0;"They are shining examples of what America stands for: freedom, bravery and liberty.";;;;"15113681050";https://twitter.com/CynthiaLummis/status/15113681050
;2010-05-31 10:14;0;0;"We honor our nation’s heroes today --those serving, those who served and those who died fighting for our freedom in defense of our country.";;;;"15113635192";https://twitter.com/CynthiaLummis/status/15113635192
;2010-05-26 15:39;2;0;"House Republican proposal would save taxpayers $1.3 trillion: http://ow.ly/1QkX6. We need these savings -- National debt hit $13 trillion.";;;;"14786982127";https://twitter.com/CynthiaLummis/status/14786982127
;2010-05-20 16:08;0;0;"Wyoming heroes visit D.C. : http://ow.ly/1NQOZ";;;;"14385438420";https://twitter.com/CynthiaLummis/status/14385438420
;2010-05-20 13:37;0;0;"I co-introduced a bill today to halt the sprawl of government. For more information click here: http://ow.ly/1NMaH.";;;;"14378640584";https://twitter.com/CynthiaLummis/status/14378640584
;2010-05-19 15:42;0;0;"I would like to hear your concerns for America's future. Please take this poll and tell me what your priorities are: http://ow.ly/1Njfl";;;;"14315328181";https://twitter.com/CynthiaLummis/status/14315328181
;2010-05-17 10:22;0;0;"To get updates on what's going on in Washington and how it will affect you and your family click here: http://ow.ly/1Kaxb";;;;"14167180405";https://twitter.com/CynthiaLummis/status/14167180405
;2010-05-15 10:43;0;0;"Thinking of our service men and women on this Armed Forces Day. Grateful for the sacrifices they and their families make for our country.";;;;"14043933731";https://twitter.com/CynthiaLummis/status/14043933731
;2010-05-14 15:04;0;0;"@RepLynnJenkins #FF";;@RepLynnJenkins;#FF;"13994749757";https://twitter.com/CynthiaLummis/status/13994749757
;2010-05-14 14:49;1;0;"Small business group NFIB joins 20 states in lawsuit challenging the new health care reform law: http://ow.ly/1LgrM";;;;"13994105089";https://twitter.com/CynthiaLummis/status/13994105089
;2010-05-14 14:11;0;0;"I’ll be giving the LCCC commencement address in Cheyenne this Saturday. Congrats to all graduates!";;;;"13992399313";https://twitter.com/CynthiaLummis/status/13992399313
;2010-05-13 12:26;1;0;"We must change the culture of Washington spending- Make your voice heard! What programs would #YouCut ? Check this out:http://ow.ly/1KI5s";;;#YouCut;"13925198765";https://twitter.com/CynthiaLummis/status/13925198765
;2010-05-12 11:11;0;0;"Please sign up for my newsletter here: http://ow.ly/1Kaxb to get updates on what’s happening in Washington and how it can affect Wyoming.";;;;"13858933033";https://twitter.com/CynthiaLummis/status/13858933033
;2010-05-11 17:17;0;0;"Good news for our veterans: http://ow.ly/1JPXc.";;;;"13812542417";https://twitter.com/CynthiaLummis/status/13812542417
;2010-05-10 13:46;0;0;"Lummis Announces Carbon County office hours: http://ow.ly/1JdZd";;;;"13742035237";https://twitter.com/CynthiaLummis/status/13742035237
;2010-05-07 10:44;4;1;"I’m proud to be a founding member of the 10th Amendment Task Force. Learn more here: http://ow.ly/1If7W.";;;;"13555201149";https://twitter.com/CynthiaLummis/status/13555201149
;2010-05-04 11:31;0;0;"They are all state experts. We're covering very complex and important agriculture issues in Cheyenne.";;;;"13372659743";https://twitter.com/CynthiaLummis/status/13372659743
;2010-05-04 11:30;0;0;"The House Ag Committee is hearing from Wyoming's ranchers, farmers and forest managers right now at LCCC in Cheyenne.";;;;"13372633275";https://twitter.com/CynthiaLummis/status/13372633275
;2010-04-27 16:11;1;0;"House Committee holds a hearing on my Heart Mountain bill. Click here to read more: http://ow.ly/1DSAk.";;;;"12965332456";https://twitter.com/CynthiaLummis/status/12965332456
;2010-04-22 08:47;0;0;"Tune in today at 8:06 a.m. (MT) for my live interview with Glenn Woods of 1270 AM KIML Gillette!";;;;"12639718328";https://twitter.com/CynthiaLummis/status/12639718328
;2010-04-20 13:07;1;0;"No budget, no problem? http://ow.ly/1AOD1";;;;"12529748166";https://twitter.com/CynthiaLummis/status/12529748166
;2010-04-12 20:15;0;0;"I'm heading back to Washington with the thoughts and concerns you shared with me. Thank you all for a great spring district work period!";;;;"12077363891";https://twitter.com/CynthiaLummis/status/12077363891
;2010-04-12 20:15;1;0;"Tonight's town hall in Casper was a great discussion about many issues important to Wyoming- health care, the Constitution, energy and more.";;;;"12077339805";https://twitter.com/CynthiaLummis/status/12077339805
;2010-04-11 09:33;0;0;"Looking forward to my town hall meeting in Casper tomorrow! See you all at 5 p.m. at the Casper City Council Chambers (200 North David).";;;;"11993369853";https://twitter.com/CynthiaLummis/status/11993369853
;2010-04-08 15:55;0;0;"I will be holding a town hall meeting in Casper on 4/12/10 from 5 - 6 p.m. at the City Council Chambers (200 North David). Please join me!";;;;"11842925922";https://twitter.com/CynthiaLummis/status/11842925922
;2010-04-05 10:03;1;0;"Here are some pictures of the Wyoming National Guard homecoming: http://ow.ly/1uHFI.";;;;"11644657140";https://twitter.com/CynthiaLummis/status/11644657140
;2010-04-05 10:02;0;1;"I had the privilege of welcoming back the final group of Wyoming National Guard soldiers on Friday. We in Wyoming are so grateful!";;;;"11644624341";https://twitter.com/CynthiaLummis/status/11644624341
;2010-03-30 12:22;1;1;"Currently touring the beautiful new Safeway Store in Lander. What a great addition!";;;;"11318958395";https://twitter.com/CynthiaLummis/status/11318958395
;2010-03-27 11:36;4;1;"Just welcomed home 100 soldiers in casper.";;;;"11151504899";https://twitter.com/CynthiaLummis/status/11151504899
;2010-03-27 09:58;0;0;"Just about to casper to greet troops at nc airport.";;;;"11147079261";https://twitter.com/CynthiaLummis/status/11147079261
;2010-03-24 15:40;1;0;"Just got done talking to students from Powell, Upton and Lusk on the front steps of the Capitol. What a great group of kids!";;;;"10997162319";https://twitter.com/CynthiaLummis/status/10997162319
;2010-03-22 14:30;1;0;"Lummis announces the launch of her new official website: http://ow.ly/1pvEk";;;;"10887048831";https://twitter.com/CynthiaLummis/status/10887048831
;2010-03-22 10:12;1;0;"Video: U.S. Rep. Cynthia Lummis, R-Wyo., slams the Democrat’s $1 trillion job-killing government takeover of... http://tumblr.com/xpv7pb1go";;;;"10876187163";https://twitter.com/CynthiaLummis/status/10876187163
;2010-03-21 22:19;4;0;"Lummis stands with American people against Obama Care: http://ow.ly/1paXV";;;;"10853671341";https://twitter.com/CynthiaLummis/status/10853671341
;2010-03-21 21:46;16;0;"Pelosi wins. America loses.";;;;"10851995078";https://twitter.com/CynthiaLummis/status/10851995078
;2010-03-21 21:23;0;0;"The great philosophical divide in America is represented in this debate.";;;;"10850933482";https://twitter.com/CynthiaLummis/status/10850933482
;2010-03-21 20:52;0;0;"Great summaries by Ryan, Pence, Cantor. Great American debates.";;;;"10849503083";https://twitter.com/CynthiaLummis/status/10849503083
;2010-03-21 19:09;3;0;"Prediction: Employers will slow hiring in 4 yrs. Business will suffer. Will people remember it's due to health care?";;;;"10845087334";https://twitter.com/CynthiaLummis/status/10845087334
;2010-03-21 18:54;3;2;"Now Ways n Means controls the debate. Then Labor. Then Budget. Votes at 9 or 10.";;;;"10844475948";https://twitter.com/CynthiaLummis/status/10844475948
;2010-03-21 18:33;1;0;"Procedural motions have passed. Now we debate the bill. Energy n Commerce Cmte controls the debate first.";;;;"10843623017";https://twitter.com/CynthiaLummis/status/10843623017
;2010-03-21 15:08;0;0;"High drama. Stupak doing news conf. Right now. Obama will agree to admin order on abortion. Stupak group capitulates.";;;;"10835894893";https://twitter.com/CynthiaLummis/status/10835894893
;2010-03-21 15:04;1;0;"Voting on the procedural vote on earmarks now.";;;;"10835740031";https://twitter.com/CynthiaLummis/status/10835740031
;2010-03-21 13:35;1;0;"Paul Ryan attacks cost, Patrick Kennedy promotes legacy.";;;;"10832415187";https://twitter.com/CynthiaLummis/status/10832415187
;2010-03-21 13:24;2;0;"At 2 pm House Rules Committee begins procedural maneuvers. Here we go.";;;;"10831991512";https://twitter.com/CynthiaLummis/status/10831991512
;2010-03-19 13:49;0;0;"Lummis announces Park and Hot Springs county office hours: http://ow.ly/1oBnJ";;;;"10736019475";https://twitter.com/CynthiaLummis/status/10736019475
;2010-03-19 08:42;0;0;"My interview with DC's Fox 5 this morning on health care: http://ow.ly/1orKk";;;;"10722711738";https://twitter.com/CynthiaLummis/status/10722711738
;2010-03-19 06:09;1;0;"Going to be on DC's Fox 5 in 20 minutes to talk about health care";;;;"10717350043";https://twitter.com/CynthiaLummis/status/10717350043
;2010-03-16 13:03;0;0;"Lummis announces Sheridan office hours: http://ow.ly/1n00M";;;;"10580685690";https://twitter.com/CynthiaLummis/status/10580685690
;2010-03-16 09:22;0;0;"Lummis announces Fremont County office hours: http://ow.ly/1mSon";;;;"10571877677";https://twitter.com/CynthiaLummis/status/10571877677
;2010-03-15 22:17;3;0;"Just after 11 p.m., Paul Ryan summary woke everyone up. All are laughing, smiling, and leaving.";;;;"10550999351";https://twitter.com/CynthiaLummis/status/10550999351
;2010-03-15 22:16;1;0;"11 p.m. -- Many squinty eyes and much yawning now. There is one more motion from the Dems.";;;;"10550964677";https://twitter.com/CynthiaLummis/status/10550964677
;2010-03-15 22:15;4;0;"Wow -- Mr. Latta named a few of the new gov't agencies under the health bill -- what a tangled web we weave";;;;"10550929383";https://twitter.com/CynthiaLummis/status/10550929383
;2010-03-15 21:46;2;0;"10:45 p.m. -- We're on Repub motion #10 on federal gov't expansion. Still a good debate, aided by shark bites (they're like gummi bears).";;;#10;"10549537440";https://twitter.com/CynthiaLummis/status/10549537440
;2010-03-15 21:45;1;0;"10:30 p.m. -- Finally, a unanimous voice vote -- supporting coverage for pregnant or battered women";;;;"10549476765";https://twitter.com/CynthiaLummis/status/10549476765
;2010-03-15 20:48;1;0;"It's 9:45 p.m. now. I'm getting restless -- I got up at 4 a.m. this morning to catch a plane from Wyo to Washington";;;;"10546759576";https://twitter.com/CynthiaLummis/status/10546759576
;2010-03-15 20:47;3;0;"Mr. Scott says we are going to take a vote on health care. Last week they talked of "deeming" it passed.";;;;"10546701580";https://twitter.com/CynthiaLummis/status/10546701580
;2010-03-15 20:28;3;0;"Mr. Hensarling: let's be honest about the magnitude of the tax increases this bill will bring about";;;;"10545845457";https://twitter.com/CynthiaLummis/status/10545845457
;2010-03-15 20:27;4;0;"Mr: Hensarling: Americans want jobs more than unpaid-for Pell grants.";;;;"10545799769";https://twitter.com/CynthiaLummis/status/10545799769
;2010-03-15 20:26;1;1;"Mr. Jordan: No American believes we can give more gov't money away and not increase deficits or debt";;;;"10545772189";https://twitter.com/CynthiaLummis/status/10545772189
;2010-03-15 20:26;4;2;"Now we're debating Pell (college) grants in the middle of a 2,000+ page health care budget reconciliation bill. I repeat, Holy Cow.";;;;"10545739627";https://twitter.com/CynthiaLummis/status/10545739627
;2010-03-15 19:59;2;0;"It's 9 pm, in 3 more hours they pull the plug on this bill for tonight";;;;"10544518626";https://twitter.com/CynthiaLummis/status/10544518626
;2010-03-15 19:59;5;0;"We just debated the gov't takeover of the student loan program (yes, its in the health care bill!)";;;;"10544506784";https://twitter.com/CynthiaLummis/status/10544506784
;2010-03-15 19:58;4;0;"Mr. Ryan: rationing is the only way to bend the cost curve down under govt run health care";;;;"10544492719";https://twitter.com/CynthiaLummis/status/10544492719
;2010-03-15 19:58;1;0;"Mr. Garrett: Dem's approach is "buy it or else"";;;;"10544484663";https://twitter.com/CynthiaLummis/status/10544484663
;2010-03-15 19:24;1;0;"@SusanAnneHiller http://www.youtube.com/watch?v=WVoYHGERENk";;@SusanAnneHiller;;"10543000335";https://twitter.com/CynthiaLummis/status/10543000335
;2010-03-15 19:23;4;0;"But Medicare is going broke, so the Dems want to take a half trillion from it and not fix it? That's irresponsible.";;;;"10542949961";https://twitter.com/CynthiaLummis/status/10542949961
;2010-03-15 19:23;2;0;"Repubs agree -- doing nothing is not an option and we need reasonable reforms.";;;;"10542928960";https://twitter.com/CynthiaLummis/status/10542928960
;2010-03-15 19:20;3;0;"Debate over the Stupak (abortion) amend. was respectful, but it failed by two votes";;;;"10542805482";https://twitter.com/CynthiaLummis/status/10542805482
;2010-03-15 17:41;6;0;"Video: Lummis fights for health care freedom -- http://ow.ly/1llh9";;;;"10538703543";https://twitter.com/CynthiaLummis/status/10538703543
;2010-03-15 17:13;3;0;"Dems defeat my motion on keeping the gov’t out of your health care choices by a party line vote of 15-20.";;;;"10537586903";https://twitter.com/CynthiaLummis/status/10537586903
;2010-03-15 16:36;2;0;"Offering my motion to prevent the government from limiting the freedom of individuals and families to choose a plan that works for them";;;;"10536200111";https://twitter.com/CynthiaLummis/status/10536200111
;2010-03-15 16:27;2;0;"We know we are giving the next generation a lower standard of living. Holy Cow! Yet we spend... and spend...";;;;"10535868297";https://twitter.com/CynthiaLummis/status/10535868297
;2010-03-15 16:27;4;0;"Medicare and medicaid are going to eventually consume the entire budget. This bill cuts medicare AND creates new entitlements.";;;;"10535847777";https://twitter.com/CynthiaLummis/status/10535847777
;2010-03-15 15:40;3;0;"Video: U.S. Rep. Cynthia Lummis, R-Wyo., a member of the House Budget Committee, delivers a statement during... http://tumblr.com/xpv7g9gnm";;;;"10534100482";https://twitter.com/CynthiaLummis/status/10534100482
;2010-03-15 15:13;2;0;"My turn to speak is coming up. You can watch by going to http://cspan.org";;;;"10533107812";https://twitter.com/CynthiaLummis/status/10533107812
;2010-03-15 14:52;1;0;"The sham bill having passed 21-16, now long night begins: "instructions to House Rules Committee."";;;;"10532305247";https://twitter.com/CynthiaLummis/status/10532305247
;2010-03-15 14:51;2;0;"Rep. Ryan: it didn't have to be this way; this process is not worthy of your support or your vote";;;;"10532286500";https://twitter.com/CynthiaLummis/status/10532286500
;2010-03-15 14:50;1;0;"Rep. Ryan says we r here because Scott Brown was elected in MA";;;;"10532222122";https://twitter.com/CynthiaLummis/status/10532222122
;2010-03-15 14:49;3;0;"Rep. Ryan summed it up: real reform is needed but this is a sham";;;;"10532193695";https://twitter.com/CynthiaLummis/status/10532193695
;2010-03-15 14:36;1;0;"First motion offered by Rep. Mack, to protect the doctor-patient relationship from federal bureaucrat interference.";;;;"10531738111";https://twitter.com/CynthiaLummis/status/10531738111
;2010-03-15 14:34;2;0;"Now we move on motions to change the substance of the bill";;;;"10531647010";https://twitter.com/CynthiaLummis/status/10531647010
;2010-03-15 14:34;1;0;"I just voted against reporting the bill from the budget committee to rules committee, it passed 21-16";;;;"10531640493";https://twitter.com/CynthiaLummis/status/10531640493
;2010-03-15 13:12;7;0;"I will live-tweet the Budget Committee’s reconciliation markup on the Dem’s health care bill today starting at 3 p.m. ET. #hcr";;;#hcr;"10528621199";https://twitter.com/CynthiaLummis/status/10528621199
;2010-03-11 14:23;1;0;"Lummis praises House Republican ban on earmarks: http://ow.ly/1hibR";;;;"10338125589";https://twitter.com/CynthiaLummis/status/10338125589
;2010-03-08 16:10;1;0;"Lummis supports bill to cut pay for members of Congress: http://ow.ly/1fNvM";;;;"10190276152";https://twitter.com/CynthiaLummis/status/10190276152
;2010-03-04 09:37;0;0;"My interview with DC's Fox 5 this morning regarding President's latest health care proposal http://ow.ly/1eb5J";;;;"9978167337";https://twitter.com/CynthiaLummis/status/9978167337
;2010-03-03 10:31;0;0;"RT @NatResourcesGOP : Rep. Hastings OpEd in WA Times: Obama's budget reveals true agenda on energy http://bit.ly/93IPVd";;@NatResourcesGOP;;"9930771426";https://twitter.com/CynthiaLummis/status/9930771426
;2010-03-02 15:01;0;0;"Lummis leads bipartisan effort to shine light on lawsuit payments: http://ow.ly/1doRu";;;;"9891070194";https://twitter.com/CynthiaLummis/status/9891070194
;2010-03-02 10:52;2;0;"Wyo delegation gets an "A" from national taxpayer group: http://ow.ly/1dhRx";;;;"9881974906";https://twitter.com/CynthiaLummis/status/9881974906
;2010-03-01 16:23;1;0;"Application Deadline Approaches for Summer Internships with Wyo Delegation: http://ow.ly/1cYkE";;;;"9844536983";https://twitter.com/CynthiaLummis/status/9844536983
;2010-03-01 08:57;1;0;"Read my op-ed in yesterday's Casper Star about the need for transparency regarding Equal Access to Justice Act payments: http://ow.ly/1cLhc";;;;"9827933661";https://twitter.com/CynthiaLummis/status/9827933661
;2010-02-24 13:53;0;0;"http://twitpic.com/154emp - Lummis meets with Henry Reed from Sheridan. Henry is with the National Youth Leadership Forum on Nat'l Security.";;;;"9589954072";https://twitter.com/CynthiaLummis/status/9589954072
;2010-02-24 12:45;1;0;"Wyoming Will Have Its Say at Health Care Summit - I am pleased that both of Wyoming’s senators, Mike Enzi and... http://tumblr.com/xpv6rroin";;;;"9587539437";https://twitter.com/CynthiaLummis/status/9587539437
;2010-02-23 12:00;0;0;"Video: Lummis discusses the White House’s health care summit. http://tumblr.com/xpv6qhv79";;;;"9535894790";https://twitter.com/CynthiaLummis/status/9535894790
;2010-02-17 09:02;1;0;"Wyo delegation calls for ‘sense of urgency' on upcoming grasshopper epidemic: http://ow.ly/18ghn";;;;"9237000955";https://twitter.com/CynthiaLummis/status/9237000955
;2010-02-16 16:22;0;0;"Lummis Announces Uinta & Lincoln County Office Hours: http://ow.ly/181O5";;;;"9204919788";https://twitter.com/CynthiaLummis/status/9204919788
;2010-02-05 14:28;0;0;"Going to be on MSNBC at 4 p.m. ET with Dylan Ratigan.";;;;"8692090389";https://twitter.com/CynthiaLummis/status/8692090389
;2010-02-04 15:19;4;0;"Democrats refuse to address dire fiscal problems. Today, they raised the debt ceiling by $1.9 trillion! http://ow.ly/13Z2c";;;;"8648137978";https://twitter.com/CynthiaLummis/status/8648137978
;2010-02-02 16:15;0;0;"@butterbob http://www.wyomingwhiskey.com/";;@butterbob;;"8560474435";https://twitter.com/CynthiaLummis/status/8560474435
;2010-02-02 16:03;1;0;"WY is getting its first whiskey distillery";;;;"8560059907";https://twitter.com/CynthiaLummis/status/8560059907
;2010-02-02 16:03;0;0;"Rep. Yarmuth: last in, first out accounting benefits bourbon and wine industry, was not aware but need to learn";;;;"8560054251";https://twitter.com/CynthiaLummis/status/8560054251
;2010-02-02 16:02;0;0;"Orszag: 1) product demand 2) access to capital 3) good workers... All more important than lower taxes";;;;"8560008583";https://twitter.com/CynthiaLummis/status/8560008583
;2010-02-02 15:54;0;0;"My statement to the Budget Committee on Obama's budget proposal: http://ow.ly/13a4U";;;;"8559709611";https://twitter.com/CynthiaLummis/status/8559709611
;2010-02-02 15:38;1;0;"My thought: 2.15 million federal employees, let's reduce vacated positions by attrition, just like we did in Wyoming when times were tough!";;;;"8559156448";https://twitter.com/CynthiaLummis/status/8559156448
;2010-02-02 15:37;0;0;"Fun fight - definitely. But productive? We'll see.";;;;"8559127572";https://twitter.com/CynthiaLummis/status/8559127572
;2010-02-02 15:37;0;0;"Paul Ryan loves the give and take. So does Orszag.";;;;"8559119389";https://twitter.com/CynthiaLummis/status/8559119389
;2010-02-02 15:36;0;0;"Mr. Edwards: back to blaming Bush. Also hating on Paul Ryan's proposal.";;;;"8559083668";https://twitter.com/CynthiaLummis/status/8559083668
;2010-02-02 15:36;0;0;"Rep. Diaz-Balart: families get together and solve their budget problems, why can't we? Good question.";;;;"8559074829";https://twitter.com/CynthiaLummis/status/8559074829
;2010-02-02 15:35;0;0;"Orszag: the hole is so deep, we must do it together, we have not done enough";;;;"8559050977";https://twitter.com/CynthiaLummis/status/8559050977
;2010-02-02 15:35;0;0;"Rep Austria: focus should be on jobs";;;;"8559041357";https://twitter.com/CynthiaLummis/status/8559041357
