username;date;retweets;favorites;text;geo;mentions;hashtags;id;permalink
;2017-06-14 16:46;5748;31252;"Just met with Capitol Police officers Crystal Griner and David Bailey at the hospital. Thanked them for saving my life.";;;;"875107090292977664";https://twitter.com/JeffFlake/status/875107090292977664
;2017-06-13 17:44;20;64;"Great to meet #UpwardBound #AZ students participating in @ASU 's TRIO program. Keep up the good work! pic.twitter.com/DEOsBuUJ8v";;@ASU;#UpwardBound #AZ;"874759466998222848";https://twitter.com/JeffFlake/status/874759466998222848
;2017-06-10 22:02;58;152;"I just published “Don’t the Cuban People Have it Tough Enough?” https:// medium.com/p/dont-the-cub an-people-have-it-tough-enough-410136a1df36 …";;;;"873737048242274306";https://twitter.com/JeffFlake/status/873737048242274306
;2017-06-07 15:45;22;24;"Introduced CBP HiRe Act with @SenatorHeitkamp to solve #CBP staffing shortages that threaten security & trade in #AZ https://www. flake.senate.gov/public/index.c fm/press-releases?ID=4D79D630-613E-40C5-A0E2-85FAD17448E8 … pic.twitter.com/n3AOdC7Gwb";;@SenatorHeitkamp;#CBP #AZ;"872555230407397376";https://twitter.com/JeffFlake/status/872555230407397376
;2017-06-07 14:19;13;32;"Hope the Senate follows the House's lead & quickly sets a vote for my #BootsOnTheBorder Act w/ @SenJohnMcCain , @SenRonJohnson & @RepMcSally";;@SenJohnMcCain @SenRonJohnson @RepMcSally;#BootsOnTheBorder;"872533399965237248";https://twitter.com/JeffFlake/status/872533399965237248
;2017-06-07 10:15;10;30;"Great to see @EPA finally working with Arizonans. Nowhere are the flaws in the ozone rule more evident than #AZ https://www. flake.senate.gov/public/index.c fm/press-releases?ID=99C81860-43D2-4DE3-A9D5-F7CC724E7071 …";;@EPA;#AZ;"872472090036850688";https://twitter.com/JeffFlake/status/872472090036850688
;2017-06-06 12:28;40;151;"Thank you to those who sacrificed on the beaches of Normandy 73 years ago on #DDay .";;;#DDay;"872143080832610304";https://twitter.com/JeffFlake/status/872143080832610304
;2017-06-05 15:42;21;54;"Great to hear so many #Arizonans share how #NAFTA supports jobs, opportunity & economic growth in #AZ #nafta4az https://www. flake.senate.gov/public/index.c fm/press-releases?ID=92CC6C94-C606-41BB-B3CF-1ABAD8E20926 …";;;#Arizonans #NAFTA #AZ #nafta4az;"871829706970214400";https://twitter.com/JeffFlake/status/871829706970214400
;2017-06-05 14:59;34;68;"Kudos to @dougducey for taking action to address the growing number of opioid deaths in #Arizona https:// azgovernor.gov/governor/news/ 2017/06/governor-ducey-declares-statewide-health-emergency-opioid-epidemic …";;@dougducey;#Arizona;"871818708506771458";https://twitter.com/JeffFlake/status/871818708506771458
;2017-06-05 09:59;7;15;"If you think you've herd it all, come by my office and #alpaca copy of #TaxRackets @CBSThisMorning https://www. flake.senate.gov/public/index.c fm/press-releases?ID=1102AA3C-75E7-4E77-8B3D-2DB5682A32A9 … pic.twitter.com/3VPFG5qVTj";;@CBSThisMorning;#alpaca #TaxRackets;"871743183591309312";https://twitter.com/JeffFlake/status/871743183591309312
;2017-06-02 21:57;26;148;"At the Tucson LDS Temple open house with @MittRomney pic.twitter.com/XEBNmeYtiC";;@MittRomney;;"870836870954991617";https://twitter.com/JeffFlake/status/870836870954991617
;2017-06-02 17:02;10;38;"Thanks @Raytheon for the tour of your #Tucson facility. pic.twitter.com/Jqr8arhjo4";;@Raytheon;#Tucson;"870762487397834752";https://twitter.com/JeffFlake/status/870762487397834752
;2017-06-01 15:41;25;37;"Thanks @AzMxCom for opportunity to speak on free trade at #AMCSummit17 . #NAFTA4AZ pic.twitter.com/80UFAVBx0v";;@AzMxCom;#AMCSummit17 #NAFTA4AZ;"870379881711812608";https://twitter.com/JeffFlake/status/870379881711812608
;2017-05-31 19:38;16;52;"Another great statement an Arizona businessman about NAFTA's benefits to Arizona. Keep 'em coming! https:// twitter.com/FelipeGarciaVR /status/870062532731387905 …";;;;"870076965155250176";https://twitter.com/JeffFlake/status/870076965155250176
;2017-05-31 19:35;11;33;"Excellent commentary from Matt Mandel on the benefits of NAFTA for Arizona https:// twitter.com/SunFedMatt/sta tus/870068613964627968 …";;;;"870076356209426432";https://twitter.com/JeffFlake/status/870076356209426432
;2017-05-31 17:14;18;30;"Here's a great tweet supporting NAFTA from the AZ Farm Bureau. https:// twitter.com/azfb/status/87 0034075762827264 …";;;;"870040912348430336";https://twitter.com/JeffFlake/status/870040912348430336
;2017-05-31 16:58;8;13;"Good comments on NAFTA from the Fresh Produce Association https:// twitter.com/FreshProduceAA /status/869974437805805568 …";;;;"870036901163450368";https://twitter.com/JeffFlake/status/870036901163450368
;2017-05-31 15:45;8;12;"Thanks @PCFRArizona for inviting me to address your annual business mtg. #NAFTA4AZ pic.twitter.com/jL7lK9Gj6q";;@PCFRArizona;#NAFTA4AZ;"870018341116575746";https://twitter.com/JeffFlake/status/870018341116575746
;2017-05-31 13:11;7;13;"Honored to participate at 3rd Annual Law Enforcement and Firefighter Prayer Breakfast @GCU . pic.twitter.com/19eJ4ITtmX";;@GCU;;"869979684703838209";https://twitter.com/JeffFlake/status/869979684703838209
;2017-05-31 11:16;8;8;"Tune into @kjzzphoenix at 9:15am to learn more about my #nafta4az initiative & then share your story at https:// flake.senate.gov/nafta4az";;@kjzzphoenix;#nafta4az;"869950603333586944";https://twitter.com/JeffFlake/status/869950603333586944
;2017-05-31 10:55;3;6;"Great tweet from AREDF’s Mignonne Hollis https:// twitter.com/mignonnehollis /status/869939257485402113 …";;;;"869945352958337025";https://twitter.com/JeffFlake/status/869945352958337025
;2017-05-31 08:16;56;89;"Pleased to launch my #nafta4az initiative to gather personal stories from Arizonans positively impacted by #NAFTA https://www. flake.senate.gov/nafta4az pic.twitter.com/YuoCBolafC";;;#nafta4az #NAFTA;"869905423087927298";https://twitter.com/JeffFlake/status/869905423087927298
;2017-05-30 23:31;46;261;"Nice to see near universal, bipartisan, condemnation of Kathy Griffen's attempt at humor. Pictures like these are never funny.";;;;"869773287856799744";https://twitter.com/JeffFlake/status/869773287856799744
;2017-05-30 19:10;7;9;"Enjoyed discussion w/ leaders from @GlendaleChamber @PeoriaChamberAZ @WickChamber @SWVChamber & Buckeye Valley! pic.twitter.com/vOCrPS9QbK";;@GlendaleChamber @PeoriaChamberAZ @WickChamber @SWVChamber;;"869707540732321792";https://twitter.com/JeffFlake/status/869707540732321792
;2017-05-30 16:57;13;25;"Great afternoon mtg employees @apsFYI #PaloVerdeGen . #nuclear #carbonfree pic.twitter.com/giMdbAGv8f";;@apsFYI;#PaloVerdeGen #nuclear #carbonfree;"869674181859753984";https://twitter.com/JeffFlake/status/869674181859753984
;2017-05-30 13:40;11;12;". @BuckeyeAZGov & @AZGFD provided a good overview of tamarisk issue facing the city & state. pic.twitter.com/Lwt2Et2t0n";;@BuckeyeAZGov @AZGFD;;"869624667945836544";https://twitter.com/JeffFlake/status/869624667945836544
;2017-05-30 12:56;6;14;"Thanks @SubZeroWolf for the tour of your mfg facility in #GoodyearAZ w/ @MayorGLord . pic.twitter.com/PN2DnGemnw";;@SubZeroWolf @MayorGLord;#GoodyearAZ;"869613479900073984";https://twitter.com/JeffFlake/status/869613479900073984
;2017-05-29 10:36;17;70;"Remembering those who sacrificed all on #MemorialDay";;;#MemorialDay;"869216001895702528";https://twitter.com/JeffFlake/status/869216001895702528
;2017-05-25 18:05;8;15;"Encouraged by #SFRC Chairman @SenBobCorker 's intent to take up an #AUMF during the upcoming #Senate work period http://www. rollcall.com/news/politics/ senators-make-another-bid-authorize-war-isis …";;@SenBobCorker;#SFRC #AUMF #Senate;"867879410837463040";https://twitter.com/JeffFlake/status/867879410837463040
;2017-05-25 13:32;20;31;"An #AUMF against ISIS, Al-Qaeda, and the Taliban will make clear to our warfighters, our allies, and our adversaries that we are united pic.twitter.com/D3LPzx5TEt";;;#AUMF;"867810525027192832";https://twitter.com/JeffFlake/status/867810525027192832
;2017-05-25 10:51;11;12;"A must-read editorial from @azcentral . A stronger, modernized #NAFTA will bring jobs and economic growth to #AZ http://www. azcentral.com/story/opinion/ editorial/2017/05/25/arizona-won-nafta/344142001/ …";;@azcentral;#NAFTA #AZ;"867770013297586177";https://twitter.com/JeffFlake/status/867770013297586177
;2017-05-24 17:10;42;134;"Joining @timkaine at noon tomorrow in the @SenateRadioTV gallery for a press conference announcing the introduction of our bipartisan #AUMF";;@timkaine @SenateRadioTV;#AUMF;"867503122712858625";https://twitter.com/JeffFlake/status/867503122712858625
;2017-05-23 18:04;11;47;"Serving up family biscuits & gravy recipe for the @MarchofDimes gala pic.twitter.com/LirEVIeZwr";;@MarchofDimes;;"867154273695674368";https://twitter.com/JeffFlake/status/867154273695674368
;2017-05-23 17:35;13;16;". @ArizonaDEQ director Misael Cabrera testified at @EPWGOP on my bill to rein in EPA's flawed ozone implementation pic.twitter.com/L9UiTKaZCG";;@ArizonaDEQ @EPWGOP;;"867146983437414400";https://twitter.com/JeffFlake/status/867146983437414400
;2017-05-23 12:36;11;19;"Enjoyed meeting with @RepDavidCook to discuss moving the ball on solving the Mexican Gray Wolf issue in #Arizona pic.twitter.com/9b8a5uHZXF";;@RepDavidCook;#Arizona;"867071669919244288";https://twitter.com/JeffFlake/status/867071669919244288
;2017-05-23 11:36;7;7;"Having pushed for patent venue reform in Congress, I can say #TCHeartland decision is a step in the right direction https://www. flake.senate.gov/public/index.c fm/press-releases?ID=47D174B4-D536-4BDD-B735-77D4A55E7C27 …";;;#TCHeartland;"867056662116433920";https://twitter.com/JeffFlake/status/867056662116433920
;2017-05-19 09:51;89;145;"Good piece here on how our opening to Cuba has enhanced our national security http://www. politico.com/agenda/story/2 017/05/17/trump-cuba-policy-threat-national-security-000442 …";;;;"865580788875759618";https://twitter.com/JeffFlake/status/865580788875759618
;2017-05-18 18:17;19;26;"DOI Dep Sec nominee and #water expert David Bernhardt will be central to efforts to protect #CORiver and @AZWater https:// youtu.be/yKbf41mC0Yo";;@AZWater;#water #CORiver;"865345634571890690";https://twitter.com/JeffFlake/status/865345634571890690
;2017-05-18 13:33;27;94;"With admin taking a fresh look at #NAFTA , I've sent letter signed by 18 senators stressing its economic benefits https://www. flake.senate.gov/public/index.c fm/press-releases?ID=B55E4435-C896-4489-A739-FFDF780057C8 …";;;#NAFTA;"865274158506180609";https://twitter.com/JeffFlake/status/865274158506180609
;2017-05-17 21:00;74;497;"We are fortunate that Bob Mueller has accepted the role of Special Counsel in the Russia probe. He is a respected public servant.";;;;"865024286997827584";https://twitter.com/JeffFlake/status/865024286997827584
;2017-05-17 17:38;14;46;"#Arizona 's local law enforcement officers have my support, my respect, and my thanks – year-round #PoliceWeek pic.twitter.com/RdkP3Zc5dI";;;#Arizona #PoliceWeek;"864973327517011968";https://twitter.com/JeffFlake/status/864973327517011968
;2017-05-17 14:29;20;29;"Committee passes #BootsOnTheBorder ! Bill helps CBP fill jobs w/ highly-vetted law enforcement officers & veterans https://www. flake.senate.gov/public/index.c fm/press-releases?ID=8C22D0FE-1DD9-45E2-B984-7607DD0F7427 …";;;#BootsOnTheBorder;"864925747512823810";https://twitter.com/JeffFlake/status/864925747512823810
;2017-05-16 20:17;1252;4707;"Congress needs to see the Comey memo.";;;;"864651094269538304";https://twitter.com/JeffFlake/status/864651094269538304
;2017-05-15 19:53;25;233;"My view right now. The U.S. Capitol at dusk. pic.twitter.com/EhPTd8TnC0";;;;"864282675225526276";https://twitter.com/JeffFlake/status/864282675225526276
;2017-05-15 16:22;82;155;"#NAFTA will benefit from strengthening & modernization but to abandon it will have devastating economic consequences https://www. flake.senate.gov/public/index.c fm/press-releases?ID=B55E4435-C896-4489-A739-FFDF780057C8 …";;;#NAFTA;"864229526569668609";https://twitter.com/JeffFlake/status/864229526569668609
;2017-05-11 21:30;11;136;"Hey, it's good to be back home again. #AZ pic.twitter.com/zKMKTN7SWP";;;#AZ;"862857543474790400";https://twitter.com/JeffFlake/status/862857543474790400
;2017-05-11 14:52;14;48;"#CleanUpTheVA starts by ridding VA of doctors who lose their licenses & employees convicted of work-related felonies https://www. flake.senate.gov/public/index.c fm/press-releases?ID=ADA751A2-19D6-4329-A131-9C12D9F2A44E …";;;#CleanUpTheVA;"862757272652574721";https://twitter.com/JeffFlake/status/862757272652574721
;2017-05-10 22:10;20;80;"Congrats Gov. @DougDucey & #AZ Legislature on another successful session!";;@DougDucey;#AZ;"862505137222418432";https://twitter.com/JeffFlake/status/862505137222418432
;2017-05-10 16:35;10;47;"Students from #Phx Day School for the Deaf, Sequoia Deaf School & AZ State Schools for the Deaf & Blind @asdbazgov pic.twitter.com/vQ2XJhQToh";;@asdbazgov;#Phx;"862420885579464704";https://twitter.com/JeffFlake/status/862420885579464704
;2017-05-10 09:26;15;47;"Thanks to @nvca for giving me the opportunity to pitch #Arizona as a premier destination for venture investment pic.twitter.com/1fe1xkyxNA";;@nvca;#Arizona;"862312902824525824";https://twitter.com/JeffFlake/status/862312902824525824
;2017-05-09 20:58;20574;53966;"I've spent the last several hours trying to find an acceptable rationale for the timing of Comey's firing. I just can't do it.";;;;"862124755339685888";https://twitter.com/JeffFlake/status/862124755339685888
;2017-05-09 16:43;30;278;"My favorite thing about Arizona as seen from my favorite place in Arizona #MyFavAZ #Snowflake pic.twitter.com/Y37XugJLgH";;;#MyFavAZ #Snowflake;"862060447738060800";https://twitter.com/JeffFlake/status/862060447738060800
;2017-05-09 12:56;12;55;"No small task getting water bill benefitting #AZ thru Congress & to @POTUS . Big win for the state @SenJohnMcCain https://www. flake.senate.gov/public/index.c fm/press-releases?ID=7328FCD5-A1D5-41D5-9B68-AAAEACB1898C …";;@POTUS @SenJohnMcCain;#AZ;"862003385389764608";https://twitter.com/JeffFlake/status/862003385389764608
;2017-05-09 12:22;11;37;"Congrats to Lauren & Emery, from Gilbert #AZ recognized by @PruSpirit for outstanding volunteer work #pruspirit2017 pic.twitter.com/JAgr2yn5Tx";;@PruSpirit;#AZ #pruspirit2017;"861994718221262848";https://twitter.com/JeffFlake/status/861994718221262848
;2017-05-08 17:24;8;21;"Congrats @HeatherAnWilson on your confirmation to be Secretary of the @USAirForce . Hope to host you in #AZ soon! @LukeAFB @DMAFB @162ndFW";;@HeatherAnWilson @USAirForce @LukeAFB @DMAFB @162ndFW;#AZ;"861708301523976192";https://twitter.com/JeffFlake/status/861708301523976192
;2017-05-08 09:44;16;34;". @FBI 's experience successfully administering polygraph exams could be the answer to @CustomsBorder hiring problems https://www. flake.senate.gov/public/index.c fm/press-releases?ID=3A2EFD44-08A0-4F99-B7FF-E8F3176EBF15 …";;@FBI @CustomsBorder;;"861592707164188672";https://twitter.com/JeffFlake/status/861592707164188672
;2017-05-04 13:43;17;34;"Wrote this bill with AZ police & sheriffs who serve on the front line of immigration enforcement bc they deserve to know we have their backs pic.twitter.com/Eto1qsezn6";;;;"860203161277091840";https://twitter.com/JeffFlake/status/860203161277091840
;2017-05-04 11:56;7;11;"Enjoyed meeting with @DodieLondenEIPS National Excellence in Public Service participants from #AZ this morning pic.twitter.com/UHxy6Fe3KG";;@DodieLondenEIPS;#AZ;"860176423633420288";https://twitter.com/JeffFlake/status/860176423633420288
;2017-05-03 23:38;10;52;"What a fitting tribute. What an incredible family. #hugsfromhollyday http://www. azcentral.com/story/news/loc al/mesa/2017/05/02/hugs-holly-day-todd-heap/308686001/ …";;;#hugsfromhollyday;"859990585989582852";https://twitter.com/JeffFlake/status/859990585989582852
;2017-05-02 13:28;862;2979;"No, we don't need a government shutdown, and no, we shouldn't change senate rules on the legislative filibuster";;;;"859474579189792768";https://twitter.com/JeffFlake/status/859474579189792768
;2017-05-01 18:38;8;26;"Great read from @CatoInstitute on my bill to help folks save money tax-free with Universal Savings Accounts #USAs https:// sen.gov/0P6P";;@CatoInstitute;#USAs;"859190295447076864";https://twitter.com/JeffFlake/status/859190295447076864
;2017-04-28 14:40;64;161;"Since #NAFTA was signed in 1993, U.S.-MEX trade has grown from $81.5 billion to $525.1 billion, supporting 100,000 AZ jobs #BeforeAndNAFTA";;;#NAFTA #BeforeAndNAFTA;"858043205169938432";https://twitter.com/JeffFlake/status/858043205169938432
;2017-04-27 18:40;8;20;"Was it that obvious? https:// twitter.com/seungminkim/st atus/857720453485527040 …";;;;"857741280977321985";https://twitter.com/JeffFlake/status/857741280977321985
;2017-04-27 15:32;16;36;"Thank you to all of the first responders fighting the growing #SawmillFire in Southern #AZ . Visit https:// inciweb.nwcg.gov/incident/5164/ for latest info.";;;#SawmillFire #AZ;"857693964463464448";https://twitter.com/JeffFlake/status/857693964463464448
;2017-04-27 14:28;35;101;"#NAFTA is good for #AZ businesses & consumers and helps power economic growth. We should improve it, not abandon it. https:// sen.gov/LZNY";;;#NAFTA #AZ;"857677913264713729";https://twitter.com/JeffFlake/status/857677913264713729
;2017-04-27 07:52;284;645;"Before NAFTA, trade between the US and Mexico was around $50 billion. Now it stands at more than $500 billion. What's not to like?";;;;"857578274293248000";https://twitter.com/JeffFlake/status/857578274293248000
;2017-04-26 17:44;14;41;"Proud to support #Phoenix 's @Childhelp as they rescue abused and at-risk children #StopChildAbuse #NationalDayofHope pic.twitter.com/tQb8Af1lJH";;@Childhelp;#Phoenix #StopChildAbuse #NationalDayofHope;"857364890679463937";https://twitter.com/JeffFlake/status/857364890679463937
;2017-04-26 15:30;10;14;"Congrats Snowflake Jr High for winning the national #SamsungSolve STEAM Contest! Check out their innovative project: https://www. youtube.com/watch?v=Z6qd-r q-X30 …";;;#SamsungSolve;"857330943497035777";https://twitter.com/JeffFlake/status/857330943497035777
;2017-04-26 13:07;254;452;"Increasing trade barriers with CAN and MEX will result in lost jobs and higher consumer costs in #AZ . Strengthen #NAFTA , don't abandon it";;;#AZ #NAFTA;"857295010869497860";https://twitter.com/JeffFlake/status/857295010869497860
;2017-04-26 10:40;7;18;"Congrats to my alma mater, Snowflake Jr. HS, for selection as a '17 #SamsungSolve STEAM finalist. #SamsungSolveSJHS pic.twitter.com/RSXZwny23l";;;#SamsungSolve #SamsungSolveSJHS;"857257999991230464";https://twitter.com/JeffFlake/status/857257999991230464
;2017-04-25 17:12;4;11;"Great to meet @UofA and @CochiseCollege students and @HACUDC members today in Washington, DC. Thanks for visiting! pic.twitter.com/i3rxX0Ycur";;@UofA @CochiseCollege @HACUDC;;"856994274130501633";https://twitter.com/JeffFlake/status/856994274130501633
;2017-04-25 13:57;10;27;"#AZ continues to foster innovation. Glad @waymo picked greater PHX for first public trials of self-driving cars https:// sen.gov/Q10L";;@waymo;#AZ;"856945275625144320";https://twitter.com/JeffFlake/status/856945275625144320
;2017-04-25 12:44;8;18;"Congrats @BASISScottsdale @BASISTucsNorth @BASISOroValley @BASISPeoria for ranking in top 5 best HS in country. https:// twitter.com/USNewsEducatio n/status/856876457007730688 …";;@BASISScottsdale @BASISTucsNorth @BASISOroValley @BASISPeoria;;"856927013629833216";https://twitter.com/JeffFlake/status/856927013629833216
;2017-04-24 14:58;13;26;"The future for renewables is bright, but there's still work to do. Thx @azcentral for setting the record straight https:// sen.gov/J1J0";;@azcentral;;"856598204439199751";https://twitter.com/JeffFlake/status/856598204439199751
;2017-04-21 14:28;18;39;"Impressed by #Ruger 's manufacturing facility in #AZ . Thanks for showing me around! pic.twitter.com/GsOz7VrGTo";;;#Ruger #AZ;"855503444378923008";https://twitter.com/JeffFlake/status/855503444378923008
;2017-04-21 14:24;6;10;"Thank you, @Cobham_plc for the tour of your facility in Prescott this morning! pic.twitter.com/qJMi5dUrHZ";;@Cobham_plc;;"855502459338346496";https://twitter.com/JeffFlake/status/855502459338346496
;2017-04-21 11:21;6;17;"I'm saddened by the loss of Sharon Giese. Her life, dedication and service to the Republican Party in Arizona will be long remembered.";;;;"855456401803558912";https://twitter.com/JeffFlake/status/855456401803558912
;2017-04-20 10:56;20;25;"Teaming up with @GeneralBrnovich to expand #veteran access to treatment courts. Read @azcentral op-ed: https://www. flake.senate.gov/public/index.c fm/op-eds?ID=E383581A-2D2C-4AEC-92CE-F49FC570705E …";;@GeneralBrnovich @azcentral;#veteran;"855087804426014724";https://twitter.com/JeffFlake/status/855087804426014724
;2017-04-19 17:21;4;13;"Visited w/ employees at the @CoxComm Deer Valley location today. Great facility in #AZ ! pic.twitter.com/TLMsVrnisp";;@CoxComm;#AZ;"854822368342024192";https://twitter.com/JeffFlake/status/854822368342024192
;2017-04-19 15:29;10;34;"Thank you @AZChamber @GlennHamer for inviting me and @SenJohnMcCain to #UCH2017 to discuss latest policies in D.C. pic.twitter.com/ILAauCtQAn";;@AZChamber @GlennHamer @SenJohnMcCain;#UCH2017;"854794187140513792";https://twitter.com/JeffFlake/status/854794187140513792
;2017-04-18 17:13;4;12;"Good meetings w/ @BoeingDefense & @AZCWR & @ArmyChiefStaff General Milley & Mesa Industry and Defense Council pic.twitter.com/CywgXU9rzV";;@BoeingDefense @AZCWR @ArmyChiefStaff;;"854457854979325952";https://twitter.com/JeffFlake/status/854457854979325952
;2017-04-16 22:12;15;28;"I just published “Power to the People” https:// medium.com/p/power-to-the -people-f277ee82124f …";;;;"853808430624235520";https://twitter.com/JeffFlake/status/853808430624235520
;2017-04-14 00:15;113;428;"This is what democracy looks like! Thanks to everyone who attended my #TownHall pic.twitter.com/lTT6VovEjL";;;#TownHall;"852752114535104512";https://twitter.com/JeffFlake/status/852752114535104512
;2017-04-12 09:35;9;13;"@AZGOP Chairman @JWLines made two great hires w/ @MattKenneyUSA & @TorunnSinclair . Congrats!";;@AZGOP @JWLines @MattKenneyUSA @TorunnSinclair;;"852168193124605952";https://twitter.com/JeffFlake/status/852168193124605952
;2017-04-11 23:38;72;263;"Cheryl and I enjoyed having President George W. Bush in Arizona to help kick off our #AZSEN campaign pic.twitter.com/qWhwHn8uCq";;;#AZSEN;"852018168792928256";https://twitter.com/JeffFlake/status/852018168792928256
;2017-04-10 18:08;124;79;"Join me on Thursday, April 13 for a #TownHall at the Mesa Convention Center. More info at: https://www. flake.senate.gov/public/index.c fm?p=town-hall … pic.twitter.com/HmVrYWLy9H";;;#TownHall;"851572740431634432";https://twitter.com/JeffFlake/status/851572740431634432
;2017-04-10 10:54;8;7;". @SwiftTransport merger w/ @DriveKnight is great news for #AZ ! More proof Arizona is best for business https://www. wsj.com/articles/truck ers-swift-and-knight-to-merge-1491796861 …";;@SwiftTransport @DriveKnight;#AZ;"851463427260207104";https://twitter.com/JeffFlake/status/851463427260207104
;2017-04-10 10:34;10;38;"Proud to have voted for such an accomplished jurist to serve on the Supreme Court. Congratulations, Justice Gorsuch. https:// sen.gov/LZ3Y";;;;"851458291616043008";https://twitter.com/JeffFlake/status/851458291616043008
;2017-04-07 20:51;14;21;"“My thoughts on Syria” — @JeffFlake https:// medium.com/@JeffFlake/my- thoughts-on-syria-9b624e0b845c#---0-268 …";;@JeffFlake @JeffFlake;#;"850526577783951360";https://twitter.com/JeffFlake/status/850526577783951360
;2017-04-07 16:23;17;37;"Spoke on-camera this afternoon about my support for @POTUS ' #SyriaStrikes & my effort w/ @timkaine & @SenJohnMcCain on an #AUMF against ISIS pic.twitter.com/hOLzqmo03I";;@POTUS @timkaine @SenJohnMcCain;#SyriaStrikes #AUMF;"850459162756644865";https://twitter.com/JeffFlake/status/850459162756644865
;2017-04-07 11:36;16;65;"Proud to have voted to confirm #JudgeGorsuch , an accomplished, mainstream jurist with a judicial philosophy worthy of Justice Scalia’s seat pic.twitter.com/e8jNvzgX2x";;;#JudgeGorsuch;"850386864670474243";https://twitter.com/JeffFlake/status/850386864670474243
;2017-04-07 11:01;24;96;"We have a new Supreme Court Justice: #NeilGorsuch";;;#NeilGorsuch;"850378120704262144";https://twitter.com/JeffFlake/status/850378120704262144
;2017-04-07 10:44;10;11;"Joined @KFYI 's @broomheadshow to discuss my support for @POTUS ' #SyriaStrikes & why I'm voting to put #NeilGorsuch on the #SupremeCourt pic.twitter.com/KAfXgTnnvs";;@KFYI @broomheadshow @POTUS;#SyriaStrikes #NeilGorsuch #SupremeCourt;"850373600062394369";https://twitter.com/JeffFlake/status/850373600062394369
;2017-04-06 12:08;15;31;"My statement on today's #Senate vote to prevent the filibustering of well-qualified #SupremeCourt nominees https://www. flake.senate.gov/public/index.c fm/press-releases?ID=3957FEC2-A35A-4316-83DD-20407D66FC5D …";;;#Senate #SupremeCourt;"850032474788962304";https://twitter.com/JeffFlake/status/850032474788962304
;2017-04-05 12:51;8;4;"Another oversight report, another surprise trip to the @SenatePress Galley. Download your own copy of #TaxRackets at https://www. flake.senate.gov/public/index.c fm/press-releases?ID=1102AA3C-75E7-4E77-8B3D-2DB5682A32A9 … pic.twitter.com/VqWswflvWZ";;@SenatePress;#TaxRackets;"849680798924013568";https://twitter.com/JeffFlake/status/849680798924013568
;2017-04-05 10:41;18;34;"Check out #TaxRackets - my new oversight report on outrageous tax loopholes for alpacas, gambling trips & more https://www. flake.senate.gov/public/index.c fm/press-releases?ID=1102AA3C-75E7-4E77-8B3D-2DB5682A32A9 … pic.twitter.com/8yHEquyRXH";;;#TaxRackets;"849648169352916993";https://twitter.com/JeffFlake/status/849648169352916993
