username;date;retweets;favorites;text;geo;mentions;hashtags;id;permalink
;2016-06-23 15:31;10;29;"Hoping @Dbacks don't call me up before tonight's charity #CongressionalBaseballGame #tbt @BGCGW @WASHLIT pic.twitter.com/PniI5uAWfr";;@Dbacks @BGCGW @WASHLIT;#CongressionalBaseballGame #tbt;"746078152754106369";https://twitter.com/JeffFlake/status/746078152754106369
;2016-06-23 11:22;14;31;"Pleased #SCOTUS reaffirmed that @POTUS exceeded executive authority in attempting to unilaterally rewrite US immigration law";;@POTUS;#SCOTUS;"746015465848315904";https://twitter.com/JeffFlake/status/746015465848315904
;2016-06-21 17:31;23;75;"Proud of this bipartisan #NoFlyNoBuy effort for choosing good policy over playing politics http://www. flake.senate.gov/public/index.c fm/2016/6/video-flake-speaks-at-press-conference-supporting-no-fly-no-buy-legislation … https:// amp.twimg.com/v/d5db66be-3d0 9-4990-9bc6-132b8b49ef54 …";;;#NoFlyNoBuy;"745383653958574080";https://twitter.com/JeffFlake/status/745383653958574080
;2016-06-21 15:19;10;32;"Good read: @azcentral explaining how a strong trade partnership with Mexico benefits both the US and #Arizona http://www. azcentral.com/story/opinion/ editorial/2016/06/20/arizona-border-flake-ducey-trade/86150454/ …";;@azcentral;#Arizona;"745350456034140161";https://twitter.com/JeffFlake/status/745350456034140161
;2016-06-21 12:24;34;93;"Terrorists shouldn't have access to guns and this legislation has the teeth to make sure they don't #NoFlyNoBuy https:// amp.twimg.com/v/b3d24d59-620 e-4ecc-b6d8-fdd104462697 …";;;#NoFlyNoBuy;"745306449388068865";https://twitter.com/JeffFlake/status/745306449388068865
;2016-06-21 09:47;5;31;"Speaking on the #Senate floor at 10:50 ET to discuss bipartisan, compromise #NoFlyNoBuy legislation I've been writing w/ @SenatorCollins";;@SenatorCollins;#Senate #NoFlyNoBuy;"745266782169145344";https://twitter.com/JeffFlake/status/745266782169145344
;2016-06-21 08:52;4;19;"Joining @SenatorCollins & others in #SenatePressGallery at 1:45 ET to unveil bipartisan compromise #NoFlyNoBuy legislation @SenatePress";;@SenatorCollins @SenatePress;#SenatePressGallery #NoFlyNoBuy;"745253143898898432";https://twitter.com/JeffFlake/status/745253143898898432
;2016-06-20 18:08;30;39;"We expect to get a vote this week on bipartisan #NoFlyNoBuy legislation I've been writing w/ @SenatorCollins and others.";;@SenatorCollins;#NoFlyNoBuy;"745030470568640512";https://twitter.com/JeffFlake/status/745030470568640512
;2016-06-20 14:16;105;124;". @realDonaldTrump implies Muslim Americans don't cooperate in rooting out homegrown terrorism. This says otherwise: https://www. washingtonpost.com/posteverything /wp/2016/06/20/i-reported-omar-mateen-to-the-fbi-trump-is-wrong-that-muslims-dont-do-our-part/ …";;@realDonaldTrump;;"744972083269079040";https://twitter.com/JeffFlake/status/744972083269079040
;2016-06-19 18:16;46;130;"Myth busted... #118degrees pic.twitter.com/L8i0zMdsGS";;;#118degrees;"744670154986913792";https://twitter.com/JeffFlake/status/744670154986913792
;2016-06-19 17:24;8;39;"Dry heat or not, this is hot... pic.twitter.com/Mdg3FnWZks";;;;"744657256982077440";https://twitter.com/JeffFlake/status/744657256982077440
;2016-06-19 10:15;2;58;"There's no man on earth I respect more than my own father. Happy Father's Day, dad! pic.twitter.com/m1gWclTtrk";;;;"744549213657128960";https://twitter.com/JeffFlake/status/744549213657128960
;2016-06-16 16:31;5;10;"Pleased @USFWS heard public opposition & will not proceed with plans to limit recreational boating at #LakeHavasu http://www. flake.senate.gov/public/index.c fm/press-releases?ID=BBA59D17-658E-46D4-BA56-2001CBD932A2 …";;@USFWS;#LakeHavasu;"743556707826143232";https://twitter.com/JeffFlake/status/743556707826143232
;2016-06-15 21:13;4;15;"Monitoring the #CederCreekFire near my hometown in Arizona's White Mountains.";;;#CederCreekFire;"743265328210251776";https://twitter.com/JeffFlake/status/743265328210251776
;2016-06-14 12:25;56;124;"Appreciative of @SpeakerRyan 's leadership in speaking out against @realDonaldTrump 's ban on Muslims entering the US http://www. politico.com/story/2016/06/ ryan-trump-muslim-ban-224312 …";;@SpeakerRyan @realDonaldTrump;;"742770069202206720";https://twitter.com/JeffFlake/status/742770069202206720
;2016-06-12 12:40;16;47;"Following horrific events in Orlando. Deep sorrow for the victims of this tragedy.";;;;"742048976635977729";https://twitter.com/JeffFlake/status/742048976635977729
;2016-06-09 19:50;6;51;"My view right now. Sunset over the Potomac. pic.twitter.com/a1MfpXdkUI";;;;"741069921543684096";https://twitter.com/JeffFlake/status/741069921543684096
;2016-06-08 18:48;6;8;"Hoping it's not long before this bill to rein in overreaching EPA regs like the ozone standard lands on @POTUS ' desk http://www. flake.senate.gov/public/index.c fm/press-releases?ID=544885AC-3C71-41D5-80F5-C7C4A13EE317 …";;@POTUS;;"740691972885753857";https://twitter.com/JeffFlake/status/740691972885753857
;2016-06-03 18:29;578;693;". @realDonaldTrump 's comments were ignorant, offensive & suggest a troubling disregard for the separation of powers http://www. wsj.com/articles/donal d-trump-keeps-up-attacks-on-judge-gonzalo-curiel-1464911442 …";;@realDonaldTrump;;"738875307256512514";https://twitter.com/JeffFlake/status/738875307256512514
;2016-05-26 23:19;7;117;"Life is good. #HSgraduation pic.twitter.com/50KoYOc3z3";;;#HSgraduation;"736049087963791360";https://twitter.com/JeffFlake/status/736049087963791360
;2016-05-26 09:57;6;82;"Can't believe this boy graduates from HS today. Where does the time go. #TBT pic.twitter.com/EMAjcr6RxR";;;#TBT;"735847417044570112";https://twitter.com/JeffFlake/status/735847417044570112
;2016-05-25 12:02;6;7;"Appreciate @drdavidhu 's thoughtful response to #20questions . I'd welcome any input on how to better ID & curb waste http:// blogs.scientificamerican.com/guest-blog/con fessions-of-a-wasteful-scientist/ …";;@drdavidhu;#20questions;"735516293022003200";https://twitter.com/JeffFlake/status/735516293022003200
;2016-05-25 10:22;5;9;"With #earmarks gone, #steermarks ought to be public enemy number one in the effort against wasteful spending http://www. flake.senate.gov/public/index.c fm/press-releases?ID=D1E8976D-0406-425E-8083-90A2D439C312 …";;;#earmarks #steermarks;"735491266620850176";https://twitter.com/JeffFlake/status/735491266620850176
;2016-05-24 12:53;2;19;"At the Capitol with Erica and @Max_Scherzer and @SenJohnMcCain pic.twitter.com/iGF7M8dZSV";;@Max_Scherzer @SenJohnMcCain;;"735166764535926784";https://twitter.com/JeffFlake/status/735166764535926784
;2016-05-19 17:39;5;20;"Looking for another reason to be a proud member of the #birdgang ? Our @AZCardinals never took a dime to honor troops http://www. flake.senate.gov/public/index.c fm/press-releases?ID=B1D142EF-66B2-45BE-9788-89D43D8472E8 …";;@AZCardinals;#birdgang;"733426886731145217";https://twitter.com/JeffFlake/status/733426886731145217
;2016-05-19 17:05;1;13;"Thinking of David Glasser, his family & @phoenixpolice . Grateful for selfless public servants like this man http://www. azcentral.com/story/news/loc al/phoenix/2016/05/19/phoenix-shooting-police-officer-critical-condition/84596760/ …";;@phoenixpolice;;"733418210377129984";https://twitter.com/JeffFlake/status/733418210377129984
;2016-05-19 14:43;5;30;"Going to miss watching the legendary #MorleySafer . A good man & credit to his profession. Condolences to his family pic.twitter.com/6gUmJpMNF0";;;#MorleySafer;"733382694508322818";https://twitter.com/JeffFlake/status/733382694508322818
;2016-05-18 12:03;13;56;"With @SpeakerRyan 's signature, small business & consumers are now looking to @POTUS sign our #MTB reforms into law pic.twitter.com/lhs0sdKyzi";;@SpeakerRyan @POTUS;#MTB;"732979848113717249";https://twitter.com/JeffFlake/status/732979848113717249
;2016-05-17 18:50;12;24;"Celebrity cook off with @speakerryan for the #MODgourmetgala pic.twitter.com/ND28YeG3hN";;@speakerryan;#MODgourmetgala;"732719904852414464";https://twitter.com/JeffFlake/status/732719904852414464
;2016-05-17 12:53;30;58;"We have an ambassador to Mexico! Roberta Jacobson is sworn in by the Vice President. pic.twitter.com/vhPXs9TCH5";;;;"732630066753069057";https://twitter.com/JeffFlake/status/732630066753069057
;2016-05-16 10:30;26;36;"I'm voting yes on #Prop123 . Our kids attend public schools, and it's the best way to provide additional resources with no tax increase.";;;#Prop123;"732231691880665089";https://twitter.com/JeffFlake/status/732231691880665089
;2016-05-12 08:07;15;25;"Yes, and it was a terrible suggestion. Glad he's walking it back. http://www. cnn.com/2016/05/12/pol itics/donald-trump-muslim-ban/index.html …";;;;"730746174211280896";https://twitter.com/JeffFlake/status/730746174211280896
;2016-05-11 18:08;2;9;"The dynamic internet we've come to rely on likely wouldn't exist if @FCC regs like this had been imposed in the past http://www. flake.senate.gov/public/index.c fm?p=press-releases&id=E2E5A96F-C07A-4D6D-9E9E-B3116274D696 …";;@FCC;;"730534955508486144";https://twitter.com/JeffFlake/status/730534955508486144
;2016-05-11 12:08;6;11;"What a LEGEN...wait for it...DARY waste of taxpayer dollars #20questions @OfficialHIMYM @CBS8 @MarcellaCBS8 https:// amp.twimg.com/v/12d5987f-5ab 6-49c5-80d0-f9dc512947c8 …";;@OfficialHIMYM @CBS8 @MarcellaCBS8;#20questions;"730444558064979968";https://twitter.com/JeffFlake/status/730444558064979968
;2016-05-10 12:22;2;5;"Getting ready to worm my way into the @SenatePress Gallery for a 1:30pm pen-and-pad on my #20questions report pic.twitter.com/jUp57zrRmj";;@SenatePress;#20questions;"730085686385250305";https://twitter.com/JeffFlake/status/730085686385250305
;2016-05-10 08:02;9;17;"Thanks to @foxandfriends for having me on to preview my new oversight report #20questions https:// youtu.be/LENjAv1R-C8?li st=PLO4OiFWJQI4ybyRyBf4M9VUPASJO_deRa … https:// amp.twimg.com/v/2477a365-4e9 3-4178-b92e-0d7e4eb84e83 …";;@foxandfriends;#20questions;"730020141652541440";https://twitter.com/JeffFlake/status/730020141652541440
;2016-05-08 08:08;5;4;"I have been blessed in life to have a mother like mine. http:// m.wmicentral.com/mobile/opinion /editorials/small-town-matriarch-nerita-flake-mother-ranch-wife-writer/article_f27072da-10cf-11e6-b8be-43b50648cea6.html …";;;;"729296818002132992";https://twitter.com/JeffFlake/status/729296818002132992
;2016-05-08 00:24;13;22;"So sorry to hear of the passing of Ann Day. From the Lazy B Ranch to the State Legislature, she represented what is best about Arizona.";;;;"729180073207549953";https://twitter.com/JeffFlake/status/729180073207549953
;2016-05-06 21:36;6;3;"Large crowd at Yuma GOP dinner tonight. Thanks Jonathan Lines for the invite and your leadership. pic.twitter.com/cIJBgejgjW";;;;"728775530795827200";https://twitter.com/JeffFlake/status/728775530795827200
;2016-05-06 19:35;3;5;"Neat to stop by @yumafoodbank . Mike Ivers is doing a great job there. Thanks for what you do. pic.twitter.com/5jWVo7RoXf";;@yumafoodbank;;"728744935046844416";https://twitter.com/JeffFlake/status/728744935046844416
;2016-05-06 19:33;6;10;"Always a pleasure to see Sheriff Wilmot @yumasheriff . Thanks for the update and discussion. pic.twitter.com/2GraZ6PEMN";;@yumasheriff;;"728744468094943232";https://twitter.com/JeffFlake/status/728744468094943232
;2016-05-06 19:32;5;6;"It was good to touch base with members of the Yuma Board of Supervisors and get briefed on issues facing the County. pic.twitter.com/M3ZuOTfuf7";;;;"728744200905199616";https://twitter.com/JeffFlake/status/728744200905199616
;2016-05-06 18:10;1;11;"Great discussion with members of Yuma Agriculture community today. We appreciate your contribution to the state. pic.twitter.com/tqdJnNn8JO";;;;"728723562211598336";https://twitter.com/JeffFlake/status/728723562211598336
;2016-05-03 19:41;18;30;"Saddened by the tragic loss of Arcadia's Charlie Keating in Iraq. Cheryl & I send our condolences to his family, friends & fellow SEALs";;;;"727659488686133250";https://twitter.com/JeffFlake/status/727659488686133250
;2016-04-29 11:58;14;44;"Uh-oh. Looks like my grandson aspires to be an appropriator. Earmarks are back pic.twitter.com/WlKU5Uoaqb";;;;"726093196833357824";https://twitter.com/JeffFlake/status/726093196833357824
;2016-04-28 21:18;17;28;"Congrats to new US Ambassador to Mexico, Roberta Jacobson. This post requires a top diplomat. Now we've got one.";;;;"725871859141611520";https://twitter.com/JeffFlake/status/725871859141611520
;2016-04-28 15:01;3;6;"Nice to again be recognized as a cheapskate by the free-enterprise-oriented @club4growth http://www. clubforgrowth.org/key-votes/club -for-growth-releases-annual-congressional-scorecard/ …";;@club4growth;;"725776854230126596";https://twitter.com/JeffFlake/status/725776854230126596
;2016-04-28 13:29;8;7;"Pleased #SFRC approved #EndWildlifeTrafficking Act. Hoping it gets a vote soon @ChrisCoons http://www. flake.senate.gov/public/index.c fm/press-releases?ID=D9F22A7C-AF30-4796-B6EE-B103E61467A1 … https:// amp.twimg.com/v/92da76ae-1bc b-44f0-ac1c-25f762af4266 …";;@ChrisCoons;#SFRC #EndWildlifeTrafficking;"725753894056259584";https://twitter.com/JeffFlake/status/725753894056259584
;2016-04-27 15:01;7;18;"We shouldn't go another day, let alone another 10 months, w/o an amb. to Mexico. Returning to the senate floor now to urge a vote";;;;"725414709290274816";https://twitter.com/JeffFlake/status/725414709290274816
;2016-04-27 10:33;5;4;"Intro'd Care Veterans Deserve Act w @SenJohnMcCain to expand access to quality care & build on previous #VA reforms http://www. flake.senate.gov/public/index.c fm/press-releases?ID=228E1B64-02EC-41EF-91C7-A8ECFB5A025E …";;@SenJohnMcCain;#VA;"725347129921822721";https://twitter.com/JeffFlake/status/725347129921822721
;2016-04-26 18:24;15;28;"I plan to return to the senate floor as often as it takes to secure a vote to confirm a US ambassador to Mexico http://www. flake.senate.gov/public/index.c fm/press-releases?ID=EEEAF899-E81A-43F3-A61D-88B23E34EE8F …";;;;"725103175561302024";https://twitter.com/JeffFlake/status/725103175561302024
;2016-04-26 12:03;3;1;"Tough to square spending millions of dollars that no one requested on a duplicative program that few understand http://www. flake.senate.gov/public/index.c fm/2016/4/video-flake-offers-amendment-to-cut-69-million-in-wasteful-army-corps-funds …";;;;"725007306690297860";https://twitter.com/JeffFlake/status/725007306690297860
;2016-04-25 16:56;26;46;"Let's not #cheetah our grandkids out of seeing these extraordinary animals in the wild #EndWildlifeTrafficking pic.twitter.com/TpXBOo4I7F";;;#cheetah #EndWildlifeTrafficking;"724718797169516544";https://twitter.com/JeffFlake/status/724718797169516544
;2016-04-23 17:13;1;11;"Thanks for all who came out to our CCC breakfast this morning. Great crowd. Fun to see so many friends. pic.twitter.com/I5RVOVRQCC";;;;"723998130027417600";https://twitter.com/JeffFlake/status/723998130027417600
;2016-04-20 10:51;8;6;". @NSF can't teach old dogs new tricks but they can build robotic wet-dog-shake simulators #deepthoughts #20questions pic.twitter.com/jEFFM2qsj1";;@NSF;#deepthoughts #20questions;"722814903384350720";https://twitter.com/JeffFlake/status/722814903384350720
;2016-04-19 18:57;13;21;"Senate just passed amdt I intro'd w @SenJohnMcCain to return funds AZ paid to keep parks open during '13 shutdown http://www. flake.senate.gov/public/index.c fm/press-releases?ID=8EBBA8C5-5B81-4838-9A5F-6586826F6B76 …";;@SenJohnMcCain;;"722574826616000513";https://twitter.com/JeffFlake/status/722574826616000513
;2016-04-19 15:29;7;6;"Pleased @SenJohnMcCain & I were able to ensure #FAA bill had provision to address @PHXSkyHarbor flight path issue http://www. flake.senate.gov/public/index.c fm/press-releases?ID=6081240E-3A8E-41A6-BD2D-68B3AB3E41DF …";;@SenJohnMcCain @PHXSkyHarbor;#FAA;"722522452425904133";https://twitter.com/JeffFlake/status/722522452425904133
;2016-04-19 13:21;4;2;"Bad sign for DC & Hollywood when @DeptofDefense & @NSF produce something funnier than @ZoolanderMovie #20questions pic.twitter.com/lI6bzr7UpV";;@DeptofDefense @NSF @ZoolanderMovie;#20questions;"722490302435586049";https://twitter.com/JeffFlake/status/722490302435586049
;2016-04-18 15:11;9;1;"May it's just #taxday but an emoticon is the use our limited federal RE #DeepThoughts #20questions pic.twitter.com/0jiai01fsS";;;#taxday #DeepThoughts #20questions;"722155507587411968";https://twitter.com/JeffFlake/status/722155507587411968
;2016-04-15 11:52;8;9;"According to these #DeepThoughts , if your bees won’t dance, they may just need a little buzz #20questions #TaxDay pic.twitter.com/w4gIEa04Hb";;;#DeepThoughts #20questions #TaxDay;"721018354262106112";https://twitter.com/JeffFlake/status/721018354262106112
;2016-04-14 11:24;3;2;"Binge-drinking birds? The #ethanol mandate has gotten out of control #20questions pic.twitter.com/1qvMy5loRD";;;#ethanol #20questions;"720649038958354433";https://twitter.com/JeffFlake/status/720649038958354433
;2016-04-13 17:57;8;16;"Thanks @waynepacelle @mmarkarian & @HumaneSociety for supporting effort to #EndWildlifeTrafficking #HumaneAwards pic.twitter.com/t70LzxlAoG";;@waynepacelle @mmarkarian @HumaneSociety;#EndWildlifeTrafficking #HumaneAwards;"720385406676525056";https://twitter.com/JeffFlake/status/720385406676525056
;2016-04-13 16:09;5;14;"I disagree but I'm interested in hear these researchers out, especially the shrimp-on-a-treadmill folks #20questions pic.twitter.com/deFn64QWhr";;;#20questions;"720358361598808067";https://twitter.com/JeffFlake/status/720358361598808067
;2016-04-13 09:18;6;4;"The study that produced these #deepthoughts on dating also cites @OfficialHIMYM 's cheerleader theory #20questions pic.twitter.com/0GlIYpPavF";;@OfficialHIMYM;#deepthoughts #20questions;"720254779604140040";https://twitter.com/JeffFlake/status/720254779604140040
;2016-04-13 09:11;21;34;"Pigs, as it happens, don't like selfies. @GovWaste #PigBook2016 pic.twitter.com/hEGEizlawo";;@GovWaste;#PigBook2016;"720253024413884416";https://twitter.com/JeffFlake/status/720253024413884416
;2016-04-12 18:48;4;13;"Talking wasteful gov studies on sexy goldfish, drunk birds & coffee tonight on @ABCWorldNews @DavidMuir #20questions https://www. youtube.com/watch?v=_Q76x1 ysuHY …";;@ABCWorldNews @DavidMuir;#20questions;"720035972419858432";https://twitter.com/JeffFlake/status/720035972419858432
;2016-04-12 17:31;7;19;"Talking wasteful gov studies on sexy goldfish, drunk birds & coffee tonight on @ABCWorldNews @DavidMuir #20Questions pic.twitter.com/nFRBXd7M9E";;@ABCWorldNews @DavidMuir;#20Questions;"720016574242037766";https://twitter.com/JeffFlake/status/720016574242037766
;2016-04-12 13:07;2;1;"Good to hear Senate is dropping effort to attach costly tax credits benefitting a very few to #FAA bill http://www. atr.org/sens-flake-lee -lankford-and-sessions-voice-opposition-green-pork-faa-bill …";;;#FAA;"719950059480203264";https://twitter.com/JeffFlake/status/719950059480203264
;2016-04-12 09:39;5;8;"Beelieve it or not, these #DeepThoughts are from a taxpayer-funded @NSF study #20Questions #ItStingsTheNostrils pic.twitter.com/E5YiYPqnuQ";;@NSF;#DeepThoughts #20Questions #ItStingsTheNostrils;"719897773190090752";https://twitter.com/JeffFlake/status/719897773190090752
;2016-04-08 15:09;3;3;"Rex-cellent! The votes are in! @USDOT won this year’s #Egregious8 w/ a $36 million Dino-Themed Bus System. pic.twitter.com/8O0csUB1rV";;@USDOT;#Egregious8;"718531308943618049";https://twitter.com/JeffFlake/status/718531308943618049
;2016-04-07 20:00;451;525;"Okay, so perhaps my vote against this bill was a tad impetuous... pic.twitter.com/wsXy0H4ZJF";;;;"718242109741010944";https://twitter.com/JeffFlake/status/718242109741010944
;2016-04-07 09:14;4;9;"Good read on effort to ensure drought bill guarantees AZ water voluntary stored in Lake Mead stays in Lake Mead http:// tucson.com/news/science/e nvironment/arizona-wants-legal-assurances-california-won-t-take-its-stored/article_e7fd790b-208d-5c8f-a1cb-bb2c9755c429.html …";;;;"718079489780162560";https://twitter.com/JeffFlake/status/718079489780162560
;2016-04-06 18:18;7;10;"Measure @SenJohnMcCain & I intro'd should result in FAA review of negative impacts of new @PHXSkyHarbor flight paths http://www. flake.senate.gov/public/index.c fm/press-releases?ID=6E7C6636-16C2-44C7-86B8-01F25420B8D6 …";;@SenJohnMcCain @PHXSkyHarbor;;"717854102030524416";https://twitter.com/JeffFlake/status/717854102030524416
;2016-04-05 13:03;47;61;"Yet another unserious proposal from an unserious candidate... https://www. washingtonpost.com/politics/trump -would-seek-to-block-money-transfers-to-force-mexico-to-fund-border-wall/2016/04/05/c0196314-fa7c-11e5-80e4-c381214de1a3_story.html?hpid=hp_no-name_trumpwall-605am_1%3Ahomepage%2Fstory …";;;;"717412262772871168";https://twitter.com/JeffFlake/status/717412262772871168
;2016-04-05 09:10;2;5;"More than 1 #nationalchampionship Who will be crowned most wasteful? @USDA or @USDOT ? Vote@http:// goo.gl/NxEXDr pic.twitter.com/H83w1LbGtl";;@USDA @USDOT @http;#nationalchampionship;"717353808280612865";https://twitter.com/JeffFlake/status/717353808280612865
;2016-04-01 14:00;2;0;"Will @USAID #TravelnTerrors book their trip or get grilled by @USDA #PigEmAggies ? #Flagrant4 http://www. flake.senate.gov/public/index.c fm/vote-egregious-eight … pic.twitter.com/YF0jUvV9LG";;@USAID @USDA;#TravelnTerrors #PigEmAggies #Flagrant4;"715977110297387008";https://twitter.com/JeffFlake/status/715977110297387008
;2016-04-01 09:07;5;3;"Do @NIH #ballers roll on or will @USDOT #jurassicpork cheat extinction? #Flagrant4 #FinalFour http://www. flake.senate.gov/public/index.c fm/vote-egregious-eight … pic.twitter.com/P5pgS8Ovbu";;@NIH @USDOT;#ballers #jurassicpork #Flagrant4 #FinalFour;"715903325921615872";https://twitter.com/JeffFlake/status/715903325921615872
;2016-03-31 17:33;5;16;"Honored to join Gen Bob Johnston in awarding a well deserved Purple Heart to Mr. Harry Dursema. pic.twitter.com/M7Huh3GrXD";;;;"715668489847963648";https://twitter.com/JeffFlake/status/715668489847963648
;2016-03-31 16:53;7;3;"Important that the #Tucson #VA investigation is thorough & addresses individual allegations reported by local media pic.twitter.com/j8iZzTE5qF";;;#Tucson #VA;"715658248976633856";https://twitter.com/JeffFlake/status/715658248976633856
;2016-03-31 15:31;10;7;"Thanks to all the water leaders that came together in Tucson today to talk about AZ's water future. pic.twitter.com/QwqwtNzBvw";;;;"715637677458984960";https://twitter.com/JeffFlake/status/715637677458984960
;2016-03-31 08:19;12;32;"No place like Arizona at sunrise pic.twitter.com/BjxFxlNI5s";;;;"715529045484511232";https://twitter.com/JeffFlake/status/715529045484511232
;2016-03-30 07:51;5;5;"Lots of busted brackets heading into #FinalFour but none as ugly as my #Flagrant4 . Vote now! http://www. flake.senate.gov/public/index.c fm?p=vote-egregious-eight … pic.twitter.com/SVOW8E9Rbt";;;#FinalFour #Flagrant4;"715159429088415744";https://twitter.com/JeffFlake/status/715159429088415744
;2016-03-26 23:23;8;15;"Very thoughtful piece on Cuba by @TweetuhZurita https://www. washingtonpost.com/posteverything /wp/2016/03/25/yes-my-family-had-to-flee-cuba-but-staying-mad-about-it-doesnt-achieve-anything/?hpid=hp_no-name_opinion-card-c%3Ahomepage%2Fstory …";;@TweetuhZurita;;"713944621663948802";https://twitter.com/JeffFlake/status/713944621663948802
;2016-03-24 23:36;7;18;"Enjoyed fielding questions with @SenJohnMcCain today at a town hall in northern Arizona. pic.twitter.com/584fyRzZUT";;@SenJohnMcCain;;"713222914187796480";https://twitter.com/JeffFlake/status/713222914187796480
;2016-03-17 07:31;3;3;"@NIH is monkeying around while @NSF is sparing w/ fighting shrimp. What's your pick? Vote #egregious8 pic.twitter.com/xkynFQb4Al";;@NIH @NSF;#egregious8;"710443390547189761";https://twitter.com/JeffFlake/status/710443390547189761
;2016-03-16 18:01;14;22;"Tune into @foxandfriends at 7am when I'll tipoff my #Egregious8 tourney & unveil a new initiative to root out waste pic.twitter.com/2JIf536By2";;@foxandfriends;#Egregious8;"710239612497698817";https://twitter.com/JeffFlake/status/710239612497698817
;2016-03-15 10:35;22;46;"Person-to-person travel a boon to Cubans. More American travelers leads to more Cuban entrepreneurs who are less dependent on the regime";;;;"709765021568507906";https://twitter.com/JeffFlake/status/709765021568507906
;2016-03-15 09:23;18;41;"New #Cuba regs announced today allow individual people-to-people travel. This is a big deal. Great for Americans and Cubans";;;#Cuba;"709746798689181697";https://twitter.com/JeffFlake/status/709746798689181697
;2016-03-10 21:23;48;66;"Allowing Americans to travel to #Cuba isn't a concession to the Castros, it's an expression of freedom.";;;#Cuba;"708131086253985792";https://twitter.com/JeffFlake/status/708131086253985792
;2016-03-10 13:22;3;4;"News on push w @JohnMcCain to fix regs driving banks to close accounts in S. #AZ & stifling cross-border commerce http:// goo.gl/n4ix87";;@JohnMcCain;#AZ;"708010066537025537";https://twitter.com/JeffFlake/status/708010066537025537
;2016-03-10 08:14;94;147;"C'mon, @realDonaldTrump . First a "Total and complete Muslim ban." Now "Islam hates us." Republicans are better than this.";;@realDonaldTrump;;"707932736510693377";https://twitter.com/JeffFlake/status/707932736510693377
;2016-03-09 18:13;15;30;"“It’s long been puzzling to me that policy reforms allowing Americans to more…” — @JeffFlake https:// medium.com/@JeffFlake/it- s-long-been-puzzling-to-me-that-policy-reforms-allowing-americans-to-more-easily-travel-to-and-3bfe7bb20607#---0-180.ndet6vpmx … pic.twitter.com/wR1GRpXzIb";;@JeffFlake @JeffFlake;#;"707721091146489856";https://twitter.com/JeffFlake/status/707721091146489856
