username;date;retweets;favorites;text;geo;mentions;hashtags;id;permalink
;2013-10-28 14:17;4;1;"Good piece in @politico about #Obamacare . Problems much deeper than a poor website http://www. politico.com/story/2013/10/ obamacare-headaches-more-than-just-the-website-98909.html?hp=t1_3 …";;@politico;#Obamacare;"394905905289887745";https://twitter.com/JeffFlake/status/394905905289887745
;2013-10-25 10:16;6;2;"Good to see Senate Dems warming to Obamacare delay. I introduced a delay bill several weeks ago: http://www. arizonadailyindependent.com/2013/09/11/fla ke-introduces-bill-to-delay-obamacare/ …";;;;"393758013485367297";https://twitter.com/JeffFlake/status/393758013485367297
;2013-10-21 21:13;12;4;"Oh, big brother... HUD says AZ aprtmt complex built for the deaf has too many deaf occupants http://www. foxnews.com/politics/2013/ 10/21/feds-try-to-eliminate-housing-for-deaf-at-complex-built-for-hearing-impaired/I …";;;;"392473655155773442";https://twitter.com/JeffFlake/status/392473655155773442
;2013-10-21 11:02;9;2;"I have no doubt the healthcare website will eventually be fixed. Underlying structural problems can't be waved away with a speech";;;;"392319948682321920";https://twitter.com/JeffFlake/status/392319948682321920
;2013-10-16 22:19;13;1;"When DHHS is forced to reveal low #s signed up for Obamacare, they'll long for the days of attention-diverting govt shutdown.";;;#s;"390678339666456576";https://twitter.com/JeffFlake/status/390678339666456576
;2013-10-16 11:42;14;1;"Lost amid the noise of the deal: the BCA/sequester remains intact, preserving significant and hard-fought spending cuts.";;;;"390518005677187072";https://twitter.com/JeffFlake/status/390518005677187072
;2013-10-16 09:41;60;9;"Having exhausted all alternatives, today looks to be the day we do the right thing and end the shutdown.";;;;"390487786387566593";https://twitter.com/JeffFlake/status/390487786387566593
;2013-10-14 17:42;41;20;"My view right now. With any luck, and common sense, we'll have a deal by tomorrow to end the #shutdown pic.twitter.com/PGUp398usa";;;#shutdown;"389883948941074432";https://twitter.com/JeffFlake/status/389883948941074432
;2013-10-14 12:24;6;3;"Excellent piece by George Will on current status of negotiations http://www. washingtonpost.com/opinions/georg e-will-susan-collinss-fiscal-compromise-leaves-democrats-exposed/2013/10/14/ebb32a70-34e3-11e3-be86-6aeaa439845b_story.html?hpid=z2 …";;;;"389803830205898752";https://twitter.com/JeffFlake/status/389803830205898752
;2013-10-14 10:51;3;1;"Kudos to @SenatorCollins for putting forward a thoughtful and realistic package to deal with #shutdown and #debtceiling";;@SenatorCollins;#shutdown #debtceiling;"389780430850756610";https://twitter.com/JeffFlake/status/389780430850756610
;2013-10-13 11:45;17;8;"GOP attempt to defund ACA thru CR failed because ACA is current law. Memo to Dems trying now to skirt sequester: BCA is current law.";;;;"389431708509933569";https://twitter.com/JeffFlake/status/389431708509933569
;2013-10-11 18:53;6;1;"@GrandCanyonNPS opening tomorrow! Good work by @GovBrewer and her team to seal the deal.";;@GrandCanyonNPS @GovBrewer;;"388814606052757504";https://twitter.com/JeffFlake/status/388814606052757504
;2013-10-11 10:33;4;2;"In WH with Senate colleagues waiting for a meeting with POTUS re debt ceiling and shutdown";;;;"388688841319919616";https://twitter.com/JeffFlake/status/388688841319919616
;2013-10-10 21:52;2;1;"My take on the debt ceiling: https://www. facebook.com/JeffFlake1?ref =ts&fref=ts …";;;;"388497337405825024";https://twitter.com/JeffFlake/status/388497337405825024
;2013-10-10 14:04;13;3;"AP poll: 7% say Obamacare exchanges working well. Hmmm. Probably same elusive 7% that says Congress is working well. #lowbar";;;#lowbar;"388379517481279488";https://twitter.com/JeffFlake/status/388379517481279488
;2013-10-10 12:55;5;0;"Admin now allowing private funds to keep GC open. @SenJohnMcCain & I have been working on this. http:// wapo.st/1gtAStQ";;@SenJohnMcCain;;"388362199766683648";https://twitter.com/JeffFlake/status/388362199766683648
;2013-10-09 09:51;5;1;"Easy way to #shutdown wasteful spending: stop direct farm payments. Presser @2:30p. Sent this to leadership: http:// ht.ly/pEaZe";;@2;#shutdown;"387953511712837632";https://twitter.com/JeffFlake/status/387953511712837632
;2013-10-09 08:25;11;2;"Excellent piece by @RepPaulRyan on a path forward http:// online.wsj.com/article/SB1000 1424052702303442004579123943669167898.html?mod=hp_opinion …";;@RepPaulRyan;;"387931783649452033";https://twitter.com/JeffFlake/status/387931783649452033
;2013-10-07 17:58;153;118;"Wow. My view right now. At least Congress can't shut down the sunsets. pic.twitter.com/gQPsR5Fob8";;;;"387351306274230272";https://twitter.com/JeffFlake/status/387351306274230272
;2013-10-04 19:42;3;2;"My thoughts on Congress, Obamacare and the Continuing Resolution https://www. facebook.com/JeffFlake1?ref =ts&fref=ts …";;;;"386290326878429184";https://twitter.com/JeffFlake/status/386290326878429184
;2013-10-03 13:39;47;12;"Shots fired at the Capitol. No more details yet. My staff in D.C. are inside and ok.";;;;"385836483409879040";https://twitter.com/JeffFlake/status/385836483409879040
;2013-10-02 17:54;4;3;"My view right now. Hopefully not much longer. pic.twitter.com/7p32gQUVE0";;;;"385538380294914048";https://twitter.com/JeffFlake/status/385538380294914048
;2013-10-01 17:27;19;6;"POTUS compares Obamacare launch glitches to Apple's iOS-7. Hmmm. Probably more analogous to fate of Blackberry.";;;;"385169048205418497";https://twitter.com/JeffFlake/status/385169048205418497
;2013-09-30 23:11;85;32;"Nothing good happens after midnight, including government shutdowns. Not Congress' finest hour.";;;;"384893338467328000";https://twitter.com/JeffFlake/status/384893338467328000
;2013-09-27 18:22;13;26;"I hate to miss any vote, let alone important votes like we had today. But I was where I needed to be. pic.twitter.com/CWThBPElwb";;;;"383733382330343424";https://twitter.com/JeffFlake/status/383733382330343424
;2013-09-26 14:20;63;10;"Not supporting cloture on CR. Rate of spending exceeds budget cap in BCA and little chance for any real opportunity to cut spending.";;;;"383310091887194112";https://twitter.com/JeffFlake/status/383310091887194112
;2013-09-25 15:37;5;1;"Just spoke on the Senate floor on Continuing Resolution and Obamacare http://www. youtube.com/watch?v=PUk5Pg jBB2Q&feature=c4-overview&list=UUPSnRxko_G21KzwgXmOZaeQ …";;;;"382967207065444352";https://twitter.com/JeffFlake/status/382967207065444352
;2013-09-24 10:01;21;3;"Clear example of how #Obamacare will harm businesses + employees in AZ via @BrahmResnik @12news : http:// ht.ly/pa3SL";;@BrahmResnik @12news;#Obamacare;"382520074621681664";https://twitter.com/JeffFlake/status/382520074621681664
;2013-09-23 12:03;2;3;"Watching your kids get married is tough on parents. We'll go thru this ritual again this week. pic.twitter.com/U65BVIhMah";;;;"382188541754630144";https://twitter.com/JeffFlake/status/382188541754630144
;2013-09-20 09:39;4;2;"Received the Taxpayers’ Friend Award from @NTU : http:// ht.ly/p1HaN . Yes, I'm a cheapskate.";;@NTU;;"381065037042839552";https://twitter.com/JeffFlake/status/381065037042839552
;2013-09-19 12:23;5;1;"Sent letter to Leader Reid w/several colleagues urging him support CR within the budget cap in existing law. http:// ht.ly/p1Hec";;;;"380744083956072448";https://twitter.com/JeffFlake/status/380744083956072448
;2013-09-18 21:56;16;18;"Just exited the congress/journalist charity spelling bee on the word "malfeasance". For the record, I can't even SPELL malfeasance...";;;;"380525720612528129";https://twitter.com/JeffFlake/status/380525720612528129
;2013-09-18 14:58;7;4;"I'm participating in a spelling bee for charity tonight. Wish me luk! http:// hoh.rollcall.com/rekindled-hill -vs-hacks-rivalry-fuels-centennial-spelling-bee/ …";;;;"380420553992982528";https://twitter.com/JeffFlake/status/380420553992982528
;2013-09-18 10:00;9;5;"Whoa! POTUS just said that economists say our deficit is coming down too fast? That's not what's keeping me up at night...";;;;"380345670474809344";https://twitter.com/JeffFlake/status/380345670474809344
;2013-09-15 01:18;9;3;"Wow! What a finish go #ASU !";;;#ASU;"379127173686104064";https://twitter.com/JeffFlake/status/379127173686104064
;2013-09-14 22:31;0;0;"@heathpoulter called it right. Mogollon Rim off Highway 260. Here's another view pic.twitter.com/KyL0phe02T";;@heathpoulter;;"379085093723058176";https://twitter.com/JeffFlake/status/379085093723058176
;2013-09-14 20:31;2;5;"My view right now. Anybody know this AZ view? pic.twitter.com/v6JHLCSsBx";;;;"379054713762639874";https://twitter.com/JeffFlake/status/379054713762639874
;2013-09-14 13:43;1;4;"Nothing like being back in Snowflake, says Dallin pic.twitter.com/69udKw4U18";;;;"378952257191960576";https://twitter.com/JeffFlake/status/378952257191960576
;2013-09-13 17:55;7;5;"Wide support for bill I intro’d w/Rep. @MarciaBlackburn to delay implementation of Obamacare: http:// bit.ly/16215b4";;@MarciaBlackburn;;"378653089072283648";https://twitter.com/JeffFlake/status/378653089072283648
;2013-09-12 16:11;25;6;"In the chickens coming home to roost department: "The AFL-CIO has approved a resolution calling Obamacare “highly disruptive."";;;;"378264558475182080";https://twitter.com/JeffFlake/status/378264558475182080
;2013-09-11 22:22;13;6;"Oh, brother... http://www. nytimes.com/2013/09/12/opi nion/putin-plea-for-caution-from-russia-on-syria.html?ref=opinion …";;;;"377995554476666881";https://twitter.com/JeffFlake/status/377995554476666881
;2013-09-11 19:10;3;3;"My view right now. What a city. pic.twitter.com/dwYwB1LhMh";;;;"377947163910995968";https://twitter.com/JeffFlake/status/377947163910995968
;2013-09-11 19:02;4;4;"My view right now. pic.twitter.com/YRWUlHjS0P";;;;"377945242710065152";https://twitter.com/JeffFlake/status/377945242710065152
;2013-09-10 16:08;15;1;"Introduced legislation today to delay all provisions of Obamacare for one year http://www. flake.senate.gov/public/";;;;"377539075160305664";https://twitter.com/JeffFlake/status/377539075160305664
;2013-09-06 13:50;7;0;"Thoughtful piece on the broader implications of the Syria vote by former Senators Kyl and Lieberman http:// online.wsj.com/article/SB1000 1424127887324432404579053661192848056.html …";;;;"376054737537220608";https://twitter.com/JeffFlake/status/376054737537220608
;2013-09-05 21:37;3;5;"Baking in the bleachers. 106*F at 7:36 pm. Only in Arizona. pic.twitter.com/oPMQxwuenl";;;;"375809916012732417";https://twitter.com/JeffFlake/status/375809916012732417
;2013-09-02 16:08;9;2;"Congrats to @diananyad for her Cuba-Florida swim. Incredible feat, and on the 5th try. Great example of perseverance.";;@diananyad;;"374640060999532544";https://twitter.com/JeffFlake/status/374640060999532544
;2013-09-02 13:22;17;3;"Headed to DC today for Syria hearings in the Sen. Foreign Relations Committee. Will also have classified briefings.";;;;"374598202726445056";https://twitter.com/JeffFlake/status/374598202726445056
;2013-08-28 20:44;3;4;"Enjoyed a personal tour of the border today with rancher John Ladd. pic.twitter.com/3G5ro6Icr1";;;;"372897394381176833";https://twitter.com/JeffFlake/status/372897394381176833
;2013-08-28 13:40;1;0;"Thanks to Cochise County Sheriff Dannels and local police chiefs for taking the time to share your challenges along the border.";;;;"372790839887396864";https://twitter.com/JeffFlake/status/372790839887396864
;2013-08-28 12:02;5;1;"Great crowd of AZ leaders at the League of Cities and Towns Conf in Oro Valley. pic.twitter.com/jWhvh6JxBG";;;;"372766142105796608";https://twitter.com/JeffFlake/status/372766142105796608
;2013-08-26 18:51;2;1;"Thank you to Dr. and Mrs. Somers for coming in today to share story of their son, Daniel, and need for VA reforms http:// wapo.st/189puMa";;;;"372144181155606528";https://twitter.com/JeffFlake/status/372144181155606528
;2013-08-26 16:16;68;28;"Oh, whatever... http:// bit.ly/1feVK4m";;;;"372105417775517696";https://twitter.com/JeffFlake/status/372105417775517696
;2013-08-23 11:38;8;1;"Big shout out and congrats to the Sunnyside Little League softball team - World Series Champions! http:// ht.ly/oaP3u";;;;"370948123972993024";https://twitter.com/JeffFlake/status/370948123972993024
;2013-08-23 08:57;5;0;"Big congrats to the Rio Rico Little League team - 2013 Junior National champs and World Series runners-up! http:// ht.ly/oaNfc";;;;"370907568568152064";https://twitter.com/JeffFlake/status/370907568568152064
;2013-08-22 16:26;3;2;"With Dr. Wally Covington surveying flood mitigation efforts following Schultz fire near Flagstaff. pic.twitter.com/qqOjuPZ0kk";;;;"370658310740922368";https://twitter.com/JeffFlake/status/370658310740922368
;2013-08-19 23:21;4;4;"Reunited at EAC in Thatcher today with my English teacher, Mrs. Flamm. Not her fault I didn't learn good. pic.twitter.com/4WF2dC5uWE";;;;"369675407429087232";https://twitter.com/JeffFlake/status/369675407429087232
;2013-08-19 23:08;1;1;"Visited Freeport-McMoran's Morenci mine today and met with Greenlee County elected officials and execs pic.twitter.com/rnA9es8gFS";;;;"369672311999184896";https://twitter.com/JeffFlake/status/369672311999184896
;2013-08-18 20:56;6;4;"My take on the situation in Zimbabwe. http:// wapo.st/17WPmen";;;;"369276605308215297";https://twitter.com/JeffFlake/status/369276605308215297
;2013-08-17 16:32;4;1;"Watching Dallin's football scrimmage at 2:30pm. 109 *F. #sweatfest pic.twitter.com/e3KDXRvuaX";;;#sweatfest;"368847793080651777";https://twitter.com/JeffFlake/status/368847793080651777
;2013-08-16 11:20;0;0;"@tomfarley Bummer, Tom. Best treatment: Wait 24 hours. That'll do it.";;@tomfarley;;"368407037794742272";https://twitter.com/JeffFlake/status/368407037794742272
;2013-08-16 10:44;7;5;"Great townhall with Raytheon employees in Tucson yesterday. Thanks for all you do for our national security. pic.twitter.com/vRAnGvfF0G";;;;"368397852138946560";https://twitter.com/JeffFlake/status/368397852138946560
;2013-08-15 13:23;3;0;"Great crowd at Oro Valley Chamber of Commerce breakfast. Thanks for the invite! pic.twitter.com/WHuin5jMeh";;;;"368075430458163200";https://twitter.com/JeffFlake/status/368075430458163200
;2013-08-14 23:41;26;12;"The perils of living in the desert. This guy stung me today. #scorpion . pic.twitter.com/4ClrkxT0YV";;;#scorpion;"367868615208337408";https://twitter.com/JeffFlake/status/367868615208337408
;2013-08-13 11:25;1;1;"So sorry to hear about the death of Dave Sitton. Mr. Tucson. He will be deeply missed.";;;;"367321128475176960";https://twitter.com/JeffFlake/status/367321128475176960
;2013-08-01 19:03;3;11;"My view right now. Dusk at the Capitol. pic.twitter.com/HynGYlXvm0";;;;"363087713261453314";https://twitter.com/JeffFlake/status/363087713261453314
;2013-08-01 17:54;2;1;"Just finished colloquy on Senate floor with Senator @StabenowPress regarding direct farm payments. http://www. flake.senate.gov/public/index.c fm/press-releases?ID=057423ad-68db-40b3-8d81-c40d06398704 …";;@StabenowPress;;"363070258820562944";https://twitter.com/JeffFlake/status/363070258820562944
;2013-08-01 13:14;4;1;"Thanks to @NTU for supporting the bill I intro’d that would reduce tax bias against small biz investment (S. 1342) http:// ht.ly/nxekf";;@NTU;;"362999787685019648";https://twitter.com/JeffFlake/status/362999787685019648
;2013-07-31 14:21;0;3;"Enjoyed meeting with members of Vietnam's National Assembly. pic.twitter.com/rUVWBoS5dc";;;;"362654193628098560";https://twitter.com/JeffFlake/status/362654193628098560
;2013-07-30 19:06;2;5;"My view right now. Nothing like a run on the mall. pic.twitter.com/rSeuxVSteg";;;;"362363643301605376";https://twitter.com/JeffFlake/status/362363643301605376
;2013-07-30 14:44;26;4;"Is it just me, or does the President's new "grand bargain" sound an awful lot like another stimulus bill?";;;;"362297700655431680";https://twitter.com/JeffFlake/status/362297700655431680
;2013-07-29 19:13;5;15;"My view right now. What a city. pic.twitter.com/mKlbFpPO8M";;;;"362002866556243969";https://twitter.com/JeffFlake/status/362002866556243969
;2013-07-25 15:31;5;3;"Nice to be speaking out against budget-busting approps bills. I feel at home once again. http://www. youtube.com/watch?v=HvR21k mtyiI …";;;;"360497540665311236";https://twitter.com/JeffFlake/status/360497540665311236
;2013-07-25 15:27;3;1;"Not my 1st errant tweet, won't be my last. MT @dannowicki @TwitchyTeam tweaks Sen. @JeffFlake over deleted tweet: http:// bit.ly/11h3mA7";;@dannowicki @TwitchyTeam @JeffFlake;;"360496673778188289";https://twitter.com/JeffFlake/status/360496673778188289
;2013-07-25 13:20;4;3;"Just spoke on Senate floor in favor of Toomey Motion to Recommit THUD bill back to Approps committee to stay under BCA number.";;;;"360464641614286848";https://twitter.com/JeffFlake/status/360464641614286848
;2013-07-25 11:01;2;4;"Great to meet with AZ Boy Scouts. Thanks for coming in today. (I'm not Photoshopped into this pic, scouts honor!). pic.twitter.com/gWhuOuPiB4";;;;"360429616160206848";https://twitter.com/JeffFlake/status/360429616160206848
;2013-07-25 10:58;4;0;"Senate’s gearing up for a big debate re tax reform. Here are my goals: http:// ht.ly/njFxt";;;;"360428737969401856";https://twitter.com/JeffFlake/status/360428737969401856
;2013-07-23 19:15;5;8;"My view right now. Not bad at all. pic.twitter.com/TTYGS3EVVH";;;;"359829065416454145";https://twitter.com/JeffFlake/status/359829065416454145
;2013-07-22 17:23;6;4;"Great piece from @peggynoonannyc on why the IRS debacle continues to grow into a bigger scandal: http:// ht.ly/ndpJD";;@peggynoonannyc;;"359438678189289473";https://twitter.com/JeffFlake/status/359438678189289473
;2013-07-18 09:42;3;1;"Hat tip to AZ State Senator Adam Driggs, also in the picture, who dug up the old photo. #ThrowBackThursday pic.twitter.com/IUcXS4WT8r";;;#ThrowBackThursday;"357872940844478465";https://twitter.com/JeffFlake/status/357872940844478465
;2013-07-18 09:26;3;1;"#throwbackthursday . AZ Sen DeConcini staff. Intern Flake a right, next to Tim Roemer. #shortsleeves #80shair pic.twitter.com/Cs7LOr5Ihz";;;#throwbackthursday #shortsleeves #80shair;"357868968687570946";https://twitter.com/JeffFlake/status/357868968687570946
;2013-07-18 09:10;1;1;"#throwbackthursday . Former AZ Senator DeConcini staff. Intern Flake in upper right, next to former staffer Tim Roemer. #shortsleeves";;;#throwbackthursday #shortsleeves;"357864882688892930";https://twitter.com/JeffFlake/status/357864882688892930
;2013-07-17 21:36;28;10;"Wow. When the unions have gone south on #ObamaCare , it's a pretty good sign it's time to start over.";;;#ObamaCare;"357690270948655105";https://twitter.com/JeffFlake/status/357690270948655105
;2013-07-17 21:32;3;5;"Enjoyed meeting with the @ASU Capitol Scholars tonight. pic.twitter.com/O7wOntYnmD";;@ASU;;"357689306023870466";https://twitter.com/JeffFlake/status/357689306023870466
;2013-07-17 15:57;14;8;"Intro’d bill w/ @SenJohnMcCain to help reduce wildfire risks. @azcentral has more details: http:// ht.ly/n3RxL";;@SenJohnMcCain @azcentral;;"357604979671965697";https://twitter.com/JeffFlake/status/357604979671965697
;2013-07-06 17:20;6;4;"Received briefing today in Yarnell from Incident Management Team. #yarnellfire is 90% contained. pic.twitter.com/ljsi7WA2gI";;;#yarnellfire;"353639688642367488";https://twitter.com/JeffFlake/status/353639688642367488
;2013-07-06 14:47;4;2;"Walked in Prescott's Frontier Days Parade today with @SenJohnMcCain . Families of fallen firefighters led parade atop fire engine.";;@SenJohnMcCain;;"353601134998470657";https://twitter.com/JeffFlake/status/353601134998470657
;2013-07-05 23:18;7;5;"Along with @SenJohnMcCain , met with families of fallen firefighters in Prescott. Heartbreaking. Profiles in courage, all of them.";;@SenJohnMcCain;;"353367433643438082";https://twitter.com/JeffFlake/status/353367433643438082
;2013-06-30 23:47;11;4;"Spoke with Sheriff Masher, Speaker Tobin and Sen. Pierce. Calling WH and fed agencies to ensure all resources are brought to bear.";;;;"351562730882351105";https://twitter.com/JeffFlake/status/351562730882351105
;2013-06-30 22:48;114;20;"19 firefighters dead battling #yarnellfire . I am sick with the news. Prayers go out to all affected.";;;#yarnellfire;"351547816084111361";https://twitter.com/JeffFlake/status/351547816084111361
;2013-06-27 16:05;38;21;"Just passed strong #immigrationreform bill out of the Senate with a strong 68-32 vote. Good day for AZ.";;;#immigrationreform;"350359239815995392";https://twitter.com/JeffFlake/status/350359239815995392
;2013-06-27 14:25;4;3;"AZ’s Lisa Graham Keegan on why she supports the Senate #immigrationreform bill. Great op-ed, via the Glendale Star: http:// ht.ly/mrRfR";;;#immigrationreform;"350334141016981505";https://twitter.com/JeffFlake/status/350334141016981505
;2013-06-27 14:07;8;2;"Air Force locating 3 addtl. squadrons of F-35 fighter jets at Luke AFB. I join @SenJohnMcCain in welcoming new personnel + families.";;@SenJohnMcCain;;"350329592650809345";https://twitter.com/JeffFlake/status/350329592650809345
;2013-06-27 10:43;16;6;"Great call this morning with AZ border ranchers. They’re on the front lines and their input has been invaluable. #immigrationreform";;;#immigrationreform;"350278293452361728";https://twitter.com/JeffFlake/status/350278293452361728
;2013-06-24 17:30;16;3;"Must keep more foreign-born, highly-skilled workers in U.S to compete globally, says fmr. CEO of @Intel . http:// ht.ly/ml1dz";;@Intel;;"349293382868287488";https://twitter.com/JeffFlake/status/349293382868287488
;2013-06-24 14:22;8;0;"Just saw that @GovBrewer has endorsed border surge amendment, not underlying bill. http:// bit.ly/14T70S4";;@GovBrewer;;"349246165398716416";https://twitter.com/JeffFlake/status/349246165398716416
;2013-06-24 14:03;3;3;"Good to see @GovBrewer come out in favor of Senate #immigrationreform bill http:// bit.ly/14T70S4";;@GovBrewer;#immigrationreform;"349241355362516992";https://twitter.com/JeffFlake/status/349241355362516992
;2013-06-24 13:55;0;1;"Two senators, one Flake. @edatpost piece in @washingtonpost . http:// wapo.st/14ryfB9";;@edatpost @washingtonpost;;"349239306516307968";https://twitter.com/JeffFlake/status/349239306516307968
;2013-06-24 13:48;10;6;"Good to see @governorbrewer come out in favor of Senate #immigrationreform bill http:// bit.ly/14T70S4";;@governorbrewer;#immigrationreform;"349237697392545794";https://twitter.com/JeffFlake/status/349237697392545794
;2013-06-20 17:27;8;5;"I'll appear on the @oreillyfactor tonight to discuss immigration reform with @bill_oreilly_DN";;@oreillyfactor @bill_oreilly_DN;;"347843147759501312";https://twitter.com/JeffFlake/status/347843147759501312
;2013-06-20 17:22;13;11;"Happy to sit down with @jorgeramosnews for an interview today on the prospects for immigration reform.";;@jorgeramosnews;;"347841945323847680";https://twitter.com/JeffFlake/status/347841945323847680
;2013-06-19 16:29;17;10;"Tiime to put the death tax six feet under. Cosponsored @SenJohnThune ’s #deathtaxrepeal bill today.";;@SenJohnThune;#deathtaxrepeal;"347466128819363844";https://twitter.com/JeffFlake/status/347466128819363844
;2013-06-18 21:03;17;7;"CBO: Senate Immigration Bill saves $197 billion over first 10 years, $700 billion over next 10 years. Good stuff.";;;;"347172739427209217";https://twitter.com/JeffFlake/status/347172739427209217
;2013-06-18 16:40;25;8;"CBO score out. $700 billion in deficit reduction over ten years. Great news for those who favor immigration reform.";;;;"347106558670422016";https://twitter.com/JeffFlake/status/347106558670422016
;2013-06-18 14:14;4;3;"Grateful for @catoinstitute ’s strong advocacy on free trade. Thanks for having me today. pic.twitter.com/cDkKoUoLCj";;@catoinstitute;;"347069867972775936";https://twitter.com/JeffFlake/status/347069867972775936
;2013-06-11 16:06;14;1;"Wow, I just got called a "sock puppet" and "the new Dr. Evil" at the same press conference. I can't figure out which is worse...";;;;"344561362900512768";https://twitter.com/JeffFlake/status/344561362900512768
;2013-06-11 15:01;25;16;"Senate agrees, by a vote of 82-15, to begin debate on Immigration Bill. This is good news. #immigrationreform";;;#immigrationreform;"344544957736050688";https://twitter.com/JeffFlake/status/344544957736050688
;2013-06-10 13:56;1;4;"Stories like this http://www. azcentral.com/sports/asu/art icles/20130608arizona-diamondbacks-select-asu-baseballs-cory-hahn-in-mlb-draft.html … make me proud to be a @dbacks fan. #coryhahn";;@dbacks;#coryhahn;"344166319861665792";https://twitter.com/JeffFlake/status/344166319861665792
;2013-06-10 12:29;3;6;"It's the @rollcall Congressional Baseball this week. I'll be wearing a @Dbacks uniform playing third base. http://www. rollcall.com/news/gop_team_ spotlight_flake_at_the_hot_corner-225443-1.html …";;@rollcall @Dbacks;;"344144423229198336";https://twitter.com/JeffFlake/status/344144423229198336
;2013-06-09 00:10;8;3;"Cheryl and I enjoyed time with Yanira and Paul Maldonado and family/friends today. What a story #freeyanira pic.twitter.com/BJgY0oXkfy";;;#freeyanira;"343595898334490624";https://twitter.com/JeffFlake/status/343595898334490624
;2013-06-08 18:04;2;6;"Take me back to the island... pic.twitter.com/rwb5UxavJ1";;;;"343503907647008769";https://twitter.com/JeffFlake/status/343503907647008769
;2013-06-06 19:04;3;3;"Navy has named joint high speed vessel after city of #Yuma , citing city's strong support for military http://www. youtube.com/watch?v=TLmDeE 9pInQ …";;;#Yuma;"342794210388353024";https://twitter.com/JeffFlake/status/342794210388353024
;2013-06-05 13:42;7;7;"Just met with RSC members (conservative Republicans) in the House of Representatives to discuss Senate immigration reform bill";;;;"342350740746027008";https://twitter.com/JeffFlake/status/342350740746027008
