username;date;retweets;favorites;text;geo;mentions;hashtags;id;permalink
;2014-12-12 18:35;12;8;"Great day for AZ! Res Copper bill has now passed House and Senate and is headed to the President's desk. http://www. flake.senate.gov/public/index.c fm/press-releases?ID=8a950b73-766d-4679-a54f-db1e41266209 …";;;;"543564735351111681";https://twitter.com/JeffFlake/status/543564735351111681
;2014-12-12 12:03;2;3;"Sad to hear of the passing of former Phoenix Mayor John Driggs. The Valley is a better place to live because of his service. @AdamDriggs";;@AdamDriggs;;"543466306960642048";https://twitter.com/JeffFlake/status/543466306960642048
;2014-12-04 07:55;4;6;"On trade, the President may move beyond his own party and work with the GOP http://www. washingtonpost.com/politics/obama -says-he-willing-to-defy-democrats-on-his-support-of-trans-pacific-partnership/2014/12/03/25edcaf4-7b30-11e4-84d4-7c896b90abdc_story.html … It's a good sign.";;;;"540504658771718144";https://twitter.com/JeffFlake/status/540504658771718144
;2014-12-03 10:31;5;1;"Today marks five years that #AlanGross has been held in a #Cuban prison. It's time to bring him home http://www. cnn.com/2014/12/03/wor ld/americas/cuba-alan-gross/ …";;;#AlanGross #Cuban;"540181427711913984";https://twitter.com/JeffFlake/status/540181427711913984
;2014-12-02 18:16;7;3;"AZ adds to its long history of proactive water management w/ Sen passage of the Bill Williams River Water Rights Settlement #Time2TalkH2O";;;#Time2TalkH2O;"539936233242099712";https://twitter.com/JeffFlake/status/539936233242099712
;2014-12-02 16:11;2;2;"What do man caves, a secret agent & pig flatulence have in common? @EPA & your taxdollars #ScienceOfSplurging http://www. flake.senate.gov/public/index.c fm/press-releases?ID=1d0680da-723a-410e-8b0f-dca13f697e70 …";;@EPA;#ScienceOfSplurging;"539904666491170816";https://twitter.com/JeffFlake/status/539904666491170816
;2014-12-02 09:42;6;2;"For an agency keen to reg. every puddle from a storm, @EPA 's affairs are remarkably out of order #ScienceOfSplurging http://www. flake.senate.gov/public/index.c fm/2014/12/flake-s-science-of-splurging-puts-epa-spending-under-the-microscope …";;@EPA;#ScienceOfSplurging;"539806706512175104";https://twitter.com/JeffFlake/status/539806706512175104
;2014-12-02 07:50;11;3;"I look forward to speaking at CSIS this morning on Cuba policy. http:// csis.org/event/getting- normal-legal-pathway-us-cuba-policy-reform …";;;;"539778653371240448";https://twitter.com/JeffFlake/status/539778653371240448
;2014-12-01 09:55;6;2;"What do you see when you put @EPA spending under the microscope? The #ScienceOfSplurging comes into focus Dec. 2 https://www. youtube.com/watch?v=NA2tCI vHl7Q&feature=youtu.be …";;@EPA;#ScienceOfSplurging;"539447704234229761";https://twitter.com/JeffFlake/status/539447704234229761
;2014-11-24 17:49;6;3;"My statement w/ @SenJohnMcCain on the permanent removal of the former director of the Phoenix #VA Health Care System http://www. flake.senate.gov/public/index.c fm/2014/11/mccain-flake-statement-on-permanent-removal-of-former-director-of-phoenix-va-health-care-system …";;@SenJohnMcCain;#VA;"537030249863585792";https://twitter.com/JeffFlake/status/537030249863585792
;2014-11-22 20:52;4;6;"Snowflake High football. Go Lobos! Go @travisflake ! pic.twitter.com/tHKtDFjQj6";;@travisflake;;"536351634717417472";https://twitter.com/JeffFlake/status/536351634717417472
;2014-11-21 18:23;8;10;"How should Republicans respond to #ImmigrationAction ? I spoke to Dana @milbank about it. http://www. washingtonpost.com/opinions/dana- milbank-how-the-gop-can-poke-back-against-obamas-immigration-order/2014/11/21/681f13e4-717e-11e4-893f-86bd390a3340_story.html?hpid=z3 …";;@milbank;#ImmigrationAction;"535951637584412672";https://twitter.com/JeffFlake/status/535951637584412672
;2014-11-21 09:24;5;3;"Joining @KFYI 's @broomheadshow at 8:30 am MT to discuss how #Congress should respond to POTUS' #immigration order http://www. iheart.com/live/550-kfyi- 37/?autoplay=true&pname=622&campid=play_bar&cid=main.html …";;@KFYI @broomheadshow;#Congress #immigration;"535815942781939712";https://twitter.com/JeffFlake/status/535815942781939712
;2014-11-21 08:37;2;3;"Having trouble with a federal agency? Stop by my staff's bilingual #Tucson office hours today to see if we can help pic.twitter.com/UiATMqKri1";;;#Tucson;"535804259791433728";https://twitter.com/JeffFlake/status/535804259791433728
;2014-11-20 19:58;84;67;"The job of passing substantive and lasting #ImmigrationReform thru Congress just got tougher, but it still needs to be done. Let's do it.";;;#ImmigrationReform;"535613233458327552";https://twitter.com/JeffFlake/status/535613233458327552
;2014-11-20 08:58;4;1;"Pleased to cosponsor #WaterForTheWorld Act to ensure existing water development funds go to those countries that need it most #Time2TalkH2O";;;#WaterForTheWorld #Time2TalkH2O;"535447125715591168";https://twitter.com/JeffFlake/status/535447125715591168
;2014-11-20 08:55;3;0;"Having trouble with a federal agency? Stop by my staff's #Sahuarita office hours today to see if we can help. pic.twitter.com/nwpU1Cp6tv";;;#Sahuarita;"535446333281542144";https://twitter.com/JeffFlake/status/535446333281542144
;2014-11-19 10:16;2;1;"Having trouble with a federal agency? Stop by my staff's #GreenValley office hours tomorrow pic.twitter.com/WuVPTRCjLw";;;#GreenValley;"535104395885965313";https://twitter.com/JeffFlake/status/535104395885965313
;2014-11-18 16:29;2;5;"Congrats to Jason Chaffetz on getting House Oversight gavel. @jasoninthehouse";;@jasoninthehouse;;"534835936333676544";https://twitter.com/JeffFlake/status/534835936333676544
;2014-11-18 11:16;12;8;"I look forward to voting for the #KeystonePipeline tonight in the Senate. Moving forward with this project is long past due.";;;#KeystonePipeline;"534756994667008001";https://twitter.com/JeffFlake/status/534756994667008001
;2014-11-14 23:21;8;3;"Good news. House has reaffirmed earmark ban. Senate needs to follow suit. http:// thehill.com/policy/finance /224214-house-gop-overwhelmingly-rejects-proposal-to-bring-earmarks-back …";;;;"533489903212830720";https://twitter.com/JeffFlake/status/533489903212830720
;2014-11-14 15:56;21;16;". @SenJohnMcCain and I agree @EPA 's attempt to regulate water where there is none lacks even a drop of common sense http://www. flake.senate.gov/public/index.c fm/press-releases?ID=a90c3c2d-002f-4f61-ae5e-70fdde588173 …";;@SenJohnMcCain @EPA;;"533377911529930752";https://twitter.com/JeffFlake/status/533377911529930752
;2014-11-14 15:38;4;4;"It's just lunch, but it can make a bipartisan difference in the new Senate http://www. flake.senate.gov/public/index.c fm/press-releases?ID=0a5cf297-59d3-4fb3-b18d-cc539be26638 … @MartinHeinrich";;@MartinHeinrich;;"533373468122042370";https://twitter.com/JeffFlake/status/533373468122042370
;2014-11-13 16:13;4;2;"Pleased ENR cmte passed my bill for states like #AZ that stepped up to ensure access to parks during shutdown http://www. flake.senate.gov/public/index.c fm/2014/11/senate-committee-passes-flake-udall-alexander-mccain-national-park-access-act …";;;#AZ;"533019731964755969";https://twitter.com/JeffFlake/status/533019731964755969
;2014-11-13 12:43;7;13;"We are finding this week that we have too many Senate Republicans to comfortably fit in the LBJ room. Nice problem to have.";;;;"532966981549699072";https://twitter.com/JeffFlake/status/532966981549699072
;2014-11-13 10:29;5;5;"More on my & @SenatorTomUdall 's meeting with #AlanGross in #Cuba on @CNNSitRoom . Also covered #ISIL , #Ukraine https://www. youtube.com/watch?v=0i9UZy aWXFE&feature=youtu.be …";;@SenatorTomUdall @CNNSitRoom;#AlanGross #Cuba #ISIL #Ukraine;"532933186884751360";https://twitter.com/JeffFlake/status/532933186884751360
;2014-11-12 16:48;12;11;"Busy week in foreign relations. Getting ready to talk #Cuba , #ISIL and #Ukraine with @wolfblitzer in the @CNNSitRoom at 6:07 ET. #CNN";;@wolfblitzer @CNNSitRoom;#Cuba #ISIL #Ukraine #CNN;"532666374263672832";https://twitter.com/JeffFlake/status/532666374263672832
;2014-11-11 15:57;7;9;"To our nation's veterans - thank you for your service and your sacrifice on behalf of our freedom #VeteransDay";;;#VeteransDay;"532290955869945856";https://twitter.com/JeffFlake/status/532290955869945856
;2014-11-05 00:35;26;25;"Great night for the GOP. Here's hoping the greatest deliberative body on earth will now deliberate. #endofgridlock";;;#endofgridlock;"529884789315088385";https://twitter.com/JeffFlake/status/529884789315088385
;2014-11-04 18:09;9;10;"AP calls Kentucky for Sen Mitch @McConnellPress . If the rest of the night goes like this, good night, gridlock!";;@McConnellPress;;"529787550647341057";https://twitter.com/JeffFlake/status/529787550647341057
;2014-11-03 16:38;2;4;"Saddened to hear of the death of "Car Talk" host Tom Magliozzi @NPR . Long live brother Ray, and radio reruns of their show #CarTalk";;@NPR;#CarTalk;"529402318668570624";https://twitter.com/JeffFlake/status/529402318668570624
;2014-11-03 16:33;9;7;"Got @dougducey 's back in #LakeHavasuCity with @SenJohnMcCain and @RepGosar pic.twitter.com/5spgxeSdo6";;@dougducey @SenJohnMcCain @RepGosar;#LakeHavasuCity;"529401041347829760";https://twitter.com/JeffFlake/status/529401041347829760
;2014-11-01 01:07;12;16;"Great to have Sgt. Andrew #Tahmooressi back on U.S. soil. Congrats to all like @RepMattSalmon who worked to make it happen.";;@RepMattSalmon;#Tahmooressi;"528428032738869248";https://twitter.com/JeffFlake/status/528428032738869248
;2014-10-30 18:48;5;2;"#POTUS needs to resume prosecutions under Operation Streamline, drop plan to address immigration by executive order http://www. flake.senate.gov/public/index.c fm/press-releases?ID=1d2926a2-0c05-4c7a-b4d6-3cce19e7bffa …";;;#POTUS;"527970259106426881";https://twitter.com/JeffFlake/status/527970259106426881
;2014-10-29 18:28;10;15;"My thanks to @MartinHeinrich for one heck of a survival adventure. Here's to similar cooperation in the Senate. pic.twitter.com/DbvEDAkHIM";;@MartinHeinrich;;"527602869785358338";https://twitter.com/JeffFlake/status/527602869785358338
;2014-10-27 23:44;15;19;"Very funny guy, that Dave @Letterman pic.twitter.com/xFVGt01inq";;@Letterman;;"526957612408246272";https://twitter.com/JeffFlake/status/526957612408246272
;2014-10-23 09:36;5;1;"Reaching across the aisle, or isle, with @MartinHeinrich http://www. washingtonpost.com/opinions/two-o pposing-senators-a-deserted-island-and-an-idea/2014/10/21/127ef9e6-579c-11e4-bd61-346aee66ba29_story.html?hpid=z3 …";;@MartinHeinrich;;"525294741332561920";https://twitter.com/JeffFlake/status/525294741332561920
;2014-10-22 14:03;7;4;"Wondering what 2014's "shrimp on a treadmill" is? I'd bet it's mountain lions on a treadmill @TomCoburn 's #Wastebook http://www. coburn.senate.gov/public/index.c fm/pressreleases?ContentRecord_id=f9478504-be7e-4b8f-9ef8-baa0895a9579 …";;@TomCoburn;#Wastebook;"524999557026177024";https://twitter.com/JeffFlake/status/524999557026177024
;2014-10-22 12:34;8;6;"$387,000 to give Swedish massages to rabbits? That's a hare past ridiculous. @TomCoburn 's #Wastebook http://www. coburn.senate.gov/public/index.c fm/pressreleases?ContentRecord_id=f9478504-be7e-4b8f-9ef8-baa0895a9579 …";;@TomCoburn;#Wastebook;"524977050839310336";https://twitter.com/JeffFlake/status/524977050839310336
;2014-10-18 12:43;6;12;"Top of Piestewa Peak. Great climb. #Arizona pic.twitter.com/xxE6HKcxie";;;#Arizona;"523529900960264193";https://twitter.com/JeffFlake/status/523529900960264193
;2014-10-17 15:24;5;5;"Happy to be speak along with @SenJohnMcCaln at the #SRPHealthyForests Vibrant Economy Conference. pic.twitter.com/Rj77w2dVdX";;@SenJohnMcCaln;#SRPHealthyForests;"523207895190884352";https://twitter.com/JeffFlake/status/523207895190884352
;2014-10-16 12:15;9;9;"Many thanks to ranchers Dan Bell and Ted Noon for the excellent tour of the border near Nogales. pic.twitter.com/RMrfYEHt0v";;;;"522798097915604992";https://twitter.com/JeffFlake/status/522798097915604992
;2014-10-15 15:00;9;9;"Letter with @SenJohnMcCain & rest of #AZ delegation stressing need for more @CustomsBorder officers at AZ ports http://www. flake.senate.gov/public/index.c fm/press-releases?ID=98478acc-add2-4da7-beb2-8a24cf3ba01a …";;@SenJohnMcCain @CustomsBorder;#AZ;"522477250235871233";https://twitter.com/JeffFlake/status/522477250235871233
;2014-10-14 13:35;23;9;"I don't often recommend NYT editorials, but this one is spot on: http://www. nytimes.com/2014/10/12/opi nion/sunday/end-the-us-embargo-on-cuba.html?_r=0 …";;;;"522093316272168960";https://twitter.com/JeffFlake/status/522093316272168960
;2014-10-01 16:09;4;8;"Shame that taxpayers are being shaken down for $300M because Congress didnt have the backbone to end cotton subsidies http://www. reuters.com/article/2014/1 0/01/us-usa-brazil-trade-idUSKCN0HQ2QZ20141001 …";;;;"517420974741159936";https://twitter.com/JeffFlake/status/517420974741159936
;2014-09-29 11:44;4;4;"KHAAAAAAAAAN you believe this? h/t @ColbyItkowitz #StarTrek http://www. washingtonpost.com/blogs/in-the-l oop/wp/2014/09/26/inspector-general-watching-a-star-trek-movie-offered-no-professional-development-opportunities/ …";;@ColbyItkowitz;#StarTrek;"516629518673379328";https://twitter.com/JeffFlake/status/516629518673379328
;2014-09-29 10:06;6;3;"Still much more to be done, but confronting whistleblower retaliation is a good step toward a #VA culture change http://www. va.gov/opa/pressrel/p ressrelease.cfm?id=2635 …";;;#VA;"516604892501131264";https://twitter.com/JeffFlake/status/516604892501131264
;2014-09-25 11:01;27;13;"No cabinet official more consequential to #AZ than AG. New nom can expect thorough vetting when he comes before #senate judiciary cmte";;;#AZ #senate;"515169310399299584";https://twitter.com/JeffFlake/status/515169310399299584
;2014-09-23 11:59;4;5;"I support the President in his decision to order air strikes last night in Syria against #ISIS and #Khorasan";;;#ISIS #Khorasan;"514459098213937152";https://twitter.com/JeffFlake/status/514459098213937152
;2014-09-23 09:58;4;1;"Will join @KTAR923 's @BruceStJames & @Pamela_Hughes at 10:14 am PT to discuss US airstrikes in #Syria . Listen live at http:// player.liquidcompass.net/KTARFM";;@KTAR923 @BruceStJames @Pamela_Hughes;#Syria;"514428534513610752";https://twitter.com/JeffFlake/status/514428534513610752
;2014-09-18 16:36;8;8;"Nice to have @NTU confirm what my wife has known for years - that I'm a cheapskate http://www. flake.senate.gov/public/index.c fm/2014/9/ntu-names-flake-biggest-cheapskate-in-senate … pic.twitter.com/tSfyK2QWar";;@NTU;;"512716698483322880";https://twitter.com/JeffFlake/status/512716698483322880
;2014-09-18 14:40;1;1;"Intro'd Transparency in Education Act w/ @SenJohnMcCain to ensure gainful employment rulemaking is transparent & fair http://www. flake.senate.gov/public/index.c fm/2014/9/flake-mccain-introduce-bill-to-increase-transparency-in-gainful-employment-regs …";;@SenJohnMcCain;;"512687751783665664";https://twitter.com/JeffFlake/status/512687751783665664
;2014-09-17 19:28;9;1;"Questioned @JohnKerry today on how admins inconstant policies could undermine U.S. efforts to defeat #ISIL https://www. youtube.com/watch?v=YM0YCC xSkuI …";;@JohnKerry;#ISIL;"512397698407096321";https://twitter.com/JeffFlake/status/512397698407096321
;2014-09-17 16:04;0;0;"Having trouble with a federal agency? Stop by my staff's @Sahuarita_Az office hours tomorrow to see if we can help. pic.twitter.com/Wvb74Z6NX9";;@Sahuarita_Az;;"512346278571679746";https://twitter.com/JeffFlake/status/512346278571679746
;2014-09-17 15:50;3;2;"Having trouble with a federal agency? Stop by my staff's #GreenValley office hours tomorrow to see if we can help. pic.twitter.com/bCaRPlchGB";;;#GreenValley;"512342978091036674";https://twitter.com/JeffFlake/status/512342978091036674
;2014-09-17 11:25;3;1;"In my view, Congress’s role in #ForeignPolicy revolves around advancing 3 major goals. More in my speech to @CFR_org https://www. youtube.com/watch?v=a43pQp 1fm1o&feature=youtu.be …";;@CFR_org;#ForeignPolicy;"512276216922259456";https://twitter.com/JeffFlake/status/512276216922259456
;2014-09-17 09:23;4;3;"On @Morning_Joe to discuss #POTUS ' plan to confront #ISIL #ISIS ahead of @JohnKerry 's testimony before #SFRC today https://www. youtube.com/watch?v=3vWUYF my4pE&feature=youtu.be …";;@Morning_Joe @JohnKerry;#POTUS #ISIL #ISIS #SFRC;"512245492643024896";https://twitter.com/JeffFlake/status/512245492643024896
;2014-09-11 16:22;2;1;"Ajo episode is inexcusable. Here’s hoping resulting transparency will impact the way @DHSgov and @CustomsBorder spends funds in the future";;@DHSgov @CustomsBorder;;"510176557953212416";https://twitter.com/JeffFlake/status/510176557953212416
;2014-09-11 15:43;5;1;"In all, IG found that in total @CustomsBorder spent $17M on employee housing in Ajo, where the average home price was about $86,500";;@CustomsBorder;;"510166883430322176";https://twitter.com/JeffFlake/status/510166883430322176
;2014-09-11 15:36;0;0;"@CustomsBorder homes in Ajo also had 3 car garages with 27-foot ceilings http://www. oig.dhs.gov/assets/Mgmt/20 14/OIG_14-131_Sep14.pdf …";;@CustomsBorder;;"510165109956960256";https://twitter.com/JeffFlake/status/510165109956960256
;2014-09-11 14:24;2;1;". @CustomsBorder IG report identifies at least $4.6M in taxpayer funds wasted on employee housing in Ajo http://www. oig.dhs.gov/assets/Mgmt/20 14/OIG_14-131_Sep14.pdf …";;@CustomsBorder;;"510147001749864449";https://twitter.com/JeffFlake/status/510147001749864449
;2014-09-11 09:22;7;1;"Agree w/ Yuma Sheriff Leon Wilmot - DOJ plan to cease some Op. Streamline prosecutions undermines #AZ law enforcement http://www. flake.senate.gov/public/index.c fm/press-releases?ID=b3009df0-0b17-4dc0-a18f-2a03dc425038 …";;;#AZ;"510071009312247808";https://twitter.com/JeffFlake/status/510071009312247808
;2014-09-11 08:01;5;7;"On the anniversary of the 9/11 attacks, we remember those we've lost and those who still sacrifice to keep us free.";;;;"510050414549827584";https://twitter.com/JeffFlake/status/510050414549827584
;2014-09-10 21:38;8;8;"I agree with #POTUS that #ISIS #ISIL must be confronted in Syria as well as Iraq.";;;#POTUS #ISIS #ISIL;"509893624164007936";https://twitter.com/JeffFlake/status/509893624164007936
;2014-09-06 14:44;12;6;"POTUS decision to act alone on ImmReform after election makes political move even more transparently political. Will stall genuine reform.";;;;"508340019698745344";https://twitter.com/JeffFlake/status/508340019698745344
;2014-09-04 10:13;5;4;"Teaming up with @StMarysFoodBank to #GoOrange for hunger awareness. More on how to help at http:// StMarysFoodBank.org pic.twitter.com/jFthI9suAg";;@StMarysFoodBank;#GoOrange;"507547005690728448";https://twitter.com/JeffFlake/status/507547005690728448
;2014-08-29 12:25;11;16;"Happy Birthday to @SenJohnMcCain from the guy known as "Arizona's other senator." Arizona, and the country, is fortunate to have you.";;@SenJohnMcCain;;"505405930335268864";https://twitter.com/JeffFlake/status/505405930335268864
;2014-08-28 18:53;20;16;"POTUS on Syria: "We don't have a strategy yet". Give him points for honesty, but hardly a confidence builder among our allies.";;;;"505141051183472641";https://twitter.com/JeffFlake/status/505141051183472641
;2014-08-28 00:26;2;11;"Freshman football. Wednesday night lights. Great stuff. pic.twitter.com/ANqYlOVN6n";;;;"504862642679193600";https://twitter.com/JeffFlake/status/504862642679193600
;2014-08-27 18:07;14;52;"Enjoyed speaking with 3 govt classes at Highland HS in Gilbert this morning. Thanks @jcwilla2 for the invitation. pic.twitter.com/t66afAlVPk";;@jcwilla2;;"504767251480723457";https://twitter.com/JeffFlake/status/504767251480723457
;2014-08-26 12:40;2;7;"Primary day in AZ! Being safely out of cycle, I can just relive old races, like this one. http://www. azcentral.com/story/opinion/ 2014/08/25/top-10-arizona-election-photos/14578393/ … pic.twitter.com/UjgfjIqTym";;;;"504322578383527936";https://twitter.com/JeffFlake/status/504322578383527936
;2014-08-25 13:47;8;2;"My condolences to the entire Gila River Indian Community on the passing of Mary Thomas http://www. azcentral.com/story/news/pol itics/2014/08/22/mary-thomas-first-woman-lead-gila-river-dies/14471267/ …";;;;"503976898108473344";https://twitter.com/JeffFlake/status/503976898108473344
;2014-08-12 19:55;5;3;"Good meeting with Mayor @JRothschildAZ to discuss potential solutions to challenges facing #Tucson pic.twitter.com/ZNfkd1qmkB";;@JRothschildAZ;#Tucson;"499358577169936384";https://twitter.com/JeffFlake/status/499358577169936384
;2014-08-12 19:54;7;2;". @customsborder in #Tucson briefed me on the UAC crisis and situation on AZ border pic.twitter.com/bQKVa08q6M";;@customsborder;#Tucson;"499358294683553792";https://twitter.com/JeffFlake/status/499358294683553792
;2014-08-12 17:53;4;2;"Great meeting today with Cochise County Sheriff Mark Dannels. @cc_sheriff pic.twitter.com/rHnc62eBBj";;@cc_sheriff;;"499327904673570816";https://twitter.com/JeffFlake/status/499327904673570816
;2014-08-12 13:45;7;3;"The Sierra Vista United Veterans Council is doing great work on behalf of #AZ vets. Honored to join them today. pic.twitter.com/b1pd0vYprs";;;#AZ;"499265326370922496";https://twitter.com/JeffFlake/status/499265326370922496
;2014-08-12 12:55;3;1;"Productive meeting with local officials from #SierraVista and #CochiseCounty pic.twitter.com/mzvzkBeLZ3";;;#SierraVista #CochiseCounty;"499252756406730752";https://twitter.com/JeffFlake/status/499252756406730752
;2014-08-12 12:02;5;3;"Spotlight Breakfast in Sierra Vista pic.twitter.com/SIxWsBbddh";;;;"499239421158232065";https://twitter.com/JeffFlake/status/499239421158232065
;2014-08-11 10:47;28;24;"At home in Arizona doing Jury Duty. Wondering how many people will answer when they call "Flake" pic.twitter.com/QnsOnp2fh4";;;;"498858349178265600";https://twitter.com/JeffFlake/status/498858349178265600
;2014-08-07 20:32;6;11;"Gorgeous high country view in AZ White Mountains this afternoon. pic.twitter.com/s6xTQJx99L";;;;"497555797774049280";https://twitter.com/JeffFlake/status/497555797774049280
;2014-08-07 20:29;6;3;"A big thanks to the @USFSSouthwest for a tour of the San Juan fire site. More evidence that forest treatments work. pic.twitter.com/joSEpa5Dto";;@USFSSouthwest;;"497555088575979520";https://twitter.com/JeffFlake/status/497555088575979520
;2014-08-07 20:25;7;6;"Had a good town hall in Show Low today. Thanks to all who participated. pic.twitter.com/oR9DLunszA";;;;"497554069339140096";https://twitter.com/JeffFlake/status/497554069339140096
;2014-08-07 20:23;4;3;"Enjoyed speaking with members of the @ShowLowChamber today. Thanks for the invitation! pic.twitter.com/DYToLNmdPS";;@ShowLowChamber;;"497553612692668417";https://twitter.com/JeffFlake/status/497553612692668417
;2014-08-06 14:21;9;5;"Congrats to the Nogales Little League All-Star team the 2014 Intermediate World Series champs! http://www. nogalesinternational.com/news/scc-histo ry-road-ends-on-top-of-the-world-after/article_c26319e0-1c51-11e4-8124-0019bb2963f4.html …";;;;"497100068344709120";https://twitter.com/JeffFlake/status/497100068344709120
;2014-08-04 20:30;14;3;"Chester Crandell was a good legislator and a great man. My condolences go out to his family, friends, and constituents. We'll miss him.";;;;"496468281377566720";https://twitter.com/JeffFlake/status/496468281377566720
;2014-07-31 19:52;8;5;"Pleased to support compromise bill to provide the #VA with additional resources & flexibility necessary to give vets the care they deserve";;;#VA;"495009046161031168";https://twitter.com/JeffFlake/status/495009046161031168
;2014-07-31 14:38;11;7;"Disappointed that the House pulled the border bill. Hoping they'll change their mind.";;;;"494930141408419841";https://twitter.com/JeffFlake/status/494930141408419841
;2014-07-31 11:57;6;9;"Kudos to @EricCantor for a moving speech on the House floor, his last as Majority Leader. Eric is a class act.";;@EricCantor;;"494889680975171585";https://twitter.com/JeffFlake/status/494889680975171585
;2014-07-30 20:25;0;1;"@McFarland78 Ya got me there.";;@McFarland78;;"494654943975190528";https://twitter.com/JeffFlake/status/494654943975190528
;2014-07-30 18:27;11;20;"Tough to beat the view from the Lincoln Memorial at dusk. pic.twitter.com/XeGm8QsfRT";;;;"494625292460490752";https://twitter.com/JeffFlake/status/494625292460490752
;2014-07-30 13:43;3;2;"The fed govt should stop monkeying around & just say no to such costly studies #primatecuts http://www. flake.senate.gov/public/index.c fm/press-releases?ID=d8170198-93c5-48e5-b177-541e00476453 … pic.twitter.com/X5gckZSODZ";;;#primatecuts;"494553784404959232";https://twitter.com/JeffFlake/status/494553784404959232
;2014-07-30 10:48;3;4;"The #HighwayTrustFund needs an overhaul, not another bailout. https://www. youtube.com/watch?v=WT6EPl xnQgw&feature=youtu.be …";;;#HighwayTrustFund;"494509969371566080";https://twitter.com/JeffFlake/status/494509969371566080
;2014-07-29 20:11;5;6;"Best legislative team on Capitol Hill! Not bad at softball either. pic.twitter.com/veodfRVb7P";;;;"494289215262560256";https://twitter.com/JeffFlake/status/494289215262560256
;2014-07-28 16:12;5;1;"Having trouble with a federal agency? Stop by my staff's #Clifton office hours Tues to see if we can help #GreenleeCo pic.twitter.com/0zbgDE1O43";;;#Clifton #GreenleeCo;"493866696097411074";https://twitter.com/JeffFlake/status/493866696097411074
;2014-07-28 14:10;6;0;"Having trouble with a federal agency? Stop by my staff's #Safford office hours Tues to see if we can help #GrahamCo pic.twitter.com/ZL07bn5SvL";;;#Safford #GrahamCo;"493835827655770113";https://twitter.com/JeffFlake/status/493835827655770113
