username;date;retweets;favorites;text;geo;mentions;hashtags;id;permalink
;2015-11-05 18:08;3;2;"#KeystoneXL & #Arctic development = #energy security & #trade with our allies & friends, competition w/ Russia. cc: @POTUS @StateDept #TPP";;@POTUS @StateDept;#KeystoneXL #Arctic #energy #trade #TPP;"662421255476391936";https://twitter.com/lisamurkowski/status/662421255476391936
;2015-11-05 18:06;3;2;"If @POTUS wants to promote #trade , #energy security with our allies, he should urge @StateDept to approve #KeystoneXL . #TPP";;@POTUS @StateDept;#trade #energy #KeystoneXL #TPP;"662420725589008384";https://twitter.com/lisamurkowski/status/662420725589008384
;2015-11-05 18:05;2;1;"Burdensome federal delays are hurting America's ability to produce reliable, affordable #energy . #KeystoneXL #Shell";;;#energy #KeystoneXL #Shell;"662420589215391744";https://twitter.com/lisamurkowski/status/662420589215391744
;2015-11-05 18:05;3;3;". @StateDept has used delay to block a project that would create US #jobs & provide #energy security. #KeystoneXL";;@StateDept;#jobs #energy #KeystoneXL;"662420452703346689";https://twitter.com/lisamurkowski/status/662420452703346689
;2015-11-05 18:04;4;0;"It's ironic that after more than 7 years of review, the Obama admin says it doesn't want to delay its #KeystoneXL review any longer.";;;#KeystoneXL;"662420357849227264";https://twitter.com/lisamurkowski/status/662420357849227264
;2015-11-04 20:27;7;6;"My thanks to the @SBAgov & the Alaska VA for putting on and hosting a veterans’ forum on small business development. pic.twitter.com/Cm74pjYsug";;@SBAgov;;"662093786726735873";https://twitter.com/lisamurkowski/status/662093786726735873
;2015-11-04 17:11;6;10;"Congratulations to the Haines Brewing Company, Inc. – looking forward to coming back soon for a solar-powered beer! pic.twitter.com/SG72TgRke4";;;;"662044429558145024";https://twitter.com/lisamurkowski/status/662044429558145024
;2015-11-04 15:54;1;0;"Congrats Mat-Su Youth Court’s graduating class! You embody important AK values: civic engagement & accountability. pic.twitter.com/XuVWm1ZfyY";;;;"662025273542602752";https://twitter.com/lisamurkowski/status/662025273542602752
;2015-11-04 10:54;7;2;"And I oppose #WOTUS because it is yet another regulatory burden for Alaskans – on top of all the others. #DitchTheRule (4/4)";;;#WOTUS #DitchTheRule;"661949602736832512";https://twitter.com/lisamurkowski/status/661949602736832512
;2015-11-04 10:54;4;0;"B/c #WOTUS could further dampen efforts to begin new resource extraction projects, which we depend on for the majority of AK's budget. (3/4)";;;#WOTUS;"661949528946425856";https://twitter.com/lisamurkowski/status/661949528946425856
;2015-11-04 10:53;3;0;"Because Alaska is the only state that has permafrost, and we still have no idea whether those areas will be regulated under #WOTUS . (2/4)";;;#WOTUS;"661949418640449536";https://twitter.com/lisamurkowski/status/661949418640449536
;2015-11-04 10:53;3;0;"I oppose #WOTUS because of the uncertainty it will create, the delays it will deliver, and the costs it will impose. (1/4)";;;#WOTUS;"661949332837519360";https://twitter.com/lisamurkowski/status/661949332837519360
;2015-11-04 10:25;5;3;"#WOTUS would subject almost every project in AK to the federal permitting process. They'd cost more, take longer, be indefinitely delayed.";;;#WOTUS;"661942419336876032";https://twitter.com/lisamurkowski/status/661942419336876032
;2015-11-04 10:25;5;4;"Alaskans know regulatory decisions aren't always fair or logical & almost everything in #AK is near water/wetlands. pic.twitter.com/EaCiwoPyzY";;;#AK;"661942290143911936";https://twitter.com/lisamurkowski/status/661942290143911936
;2015-11-04 09:58;2;2;"#Alaska has 174M acres of wetlands - more than the rest of US combined. #WOTUS is bad for our communities located within 2mi of waterways.";;;#Alaska #WOTUS;"661935546416144384";https://twitter.com/lisamurkowski/status/661935546416144384
;2015-11-04 09:57;5;6;"#Alaska makes up 40% of the nation’s surface water resources, including >3 million lakes & >12,000 rivers. #WOTUS pic.twitter.com/A8PDbPG50v";;;#Alaska #WOTUS;"661935187740225536";https://twitter.com/lisamurkowski/status/661935187740225536
;2015-11-04 09:46;2;3;"I included a provision in Interior Approps to halt #WOTUS & I cosponsored both the bipartisan bill blocked yesterday & the resolution today.";;;#WOTUS;"661932609086349312";https://twitter.com/lisamurkowski/status/661932609086349312
;2015-11-04 09:46;8;4;"My position is simple: #WOTUS cannot be allowed to stand. EPA & Army Corps must go back to the drawing board. pic.twitter.com/l8W3EKBGz8";;;#WOTUS;"661932487229186048";https://twitter.com/lisamurkowski/status/661932487229186048
;2015-11-04 09:31;1;1;"Good morning AK! For any early birds that are up: I'll be discussing #WOTUS on the Senate floor soon. Watch here: http:// 1.usa.gov/1yT3oAX .";;;#WOTUS;"661928830458793984";https://twitter.com/lisamurkowski/status/661928830458793984
;2015-11-03 16:37;3;5;"Great to see so many Alaskans get involved in the @USCapitolTree ! https:// twitter.com/alexisreporter /status/661667508881985536 …";;@USCapitolTree;;"661673618603163649";https://twitter.com/lisamurkowski/status/661673618603163649
;2015-11-03 14:05;3;4;"(2/2) #WOTUS would dramatically expand the federal gov's ability to regulate private lands/waters, lessening economic opportunities in AK.";;;#WOTUS;"661635336674611200";https://twitter.com/lisamurkowski/status/661635336674611200
;2015-11-03 14:05;3;4;"(1/2) Just voted to advance legislation to overturn the overreaching #WOTUS rule, a showstopper for potential development in Alaska.";;;#WOTUS;"661635303137017856";https://twitter.com/lisamurkowski/status/661635303137017856
;2015-11-03 12:28;2;1;"Praying for the safety of the fire crews in Bethel today! https:// twitter.com/KYUKNews/statu s/661595535271309312 …";;;;"661610910486798336";https://twitter.com/lisamurkowski/status/661610910486798336
;2015-11-02 20:23;4;7;"Getting a lift to sign the @USCapitolTree banner before sending off the tree from @ChugachForestAK to DC. pic.twitter.com/dNyqUoUde9";;@USCapitolTree @ChugachForestAK;;"661368059026771968";https://twitter.com/lisamurkowski/status/661368059026771968
;2015-11-02 16:43;5;12;"Incredibly honored to visit the Children's Hospital at Providence. I credit my visit to an 11y/o w/ Turner Syndrome. pic.twitter.com/v2BBjw75iZ";;;;"661312823440441344";https://twitter.com/lisamurkowski/status/661312823440441344
;2015-11-02 13:59;0;0;"Be careful out there today! Stay safe, drive carefully, and take your time getting around Anchorage. https:// twitter.com/Ch2KTUU/status /661240439236747264 …";;;;"661271435311194113";https://twitter.com/lisamurkowski/status/661271435311194113
;2015-10-31 21:02;7;12;"Congrats to Anna DeVolld of Soldotna, winner of the @USCapitolTree Essay Contest! Anna will light the tree in DC! pic.twitter.com/OlNhjBGdfV";;@USCapitolTree;;"660638123248979968";https://twitter.com/lisamurkowski/status/660638123248979968
;2015-10-31 16:54;4;6;"Happy Halloween! If you are in Anchorage, come see the @USCapitolTree pic.twitter.com/uGFxbWbN6x";;@USCapitolTree;;"660575714601635840";https://twitter.com/lisamurkowski/status/660575714601635840
;2015-10-30 12:17;1;4;"Great news—communities in AK will receive add'l $2.2M from Interior Dept. for federal lands in their jurisdictions: http:// 1.usa.gov/1kYUBrX .";;;;"660143598768414720";https://twitter.com/lisamurkowski/status/660143598768414720
;2015-10-29 13:45;7;3;"On the line w/AK press discussing the anti-pirate fishing bill that passed. Making the distance btwn. AK & DC work! pic.twitter.com/o662lX94px";;;;"659803244496068608";https://twitter.com/lisamurkowski/status/659803244496068608
;2015-10-29 12:09;2;2;"Speaking to the National Mining Association Board of Directors today. https:// twitter.com/EnergyGOP/stat us/659772684549677056 …";;;;"659778984335564800";https://twitter.com/lisamurkowski/status/659778984335564800
;2015-10-28 15:33;6;4;"Unacceptable! Alaska is known world-wide for our top quality seafood. Consumers should be getting what they ask for. https:// twitter.com/NBCInvestigate s/status/659402981000007684 …";;;;"659468022575439872";https://twitter.com/lisamurkowski/status/659468022575439872
;2015-10-28 14:43;1;1;"Met w/ @CDCgov Director Dr. Tom Frieden on the alarming number of Spice-related transports to Alaska emergency rooms. pic.twitter.com/BaWTmh6le6";;@CDCgov;;"659455498077544449";https://twitter.com/lisamurkowski/status/659455498077544449
;2015-10-28 12:24;11;16;"The @USCapitolTree from the @ChugachForestAK has officially started it’s 4,000 mile long journey to DC! pic.twitter.com/NJzmkotFLU";;@USCapitolTree @ChugachForestAK;;"659420453442822144";https://twitter.com/lisamurkowski/status/659420453442822144
;2015-10-28 12:18;0;1;"This is excellent news! Energy is good for Alaska--and investments like these are critical for our state's economy. https:// twitter.com/COP_Alaska/sta tus/659141625378045952 …";;;;"659419037831667712";https://twitter.com/lisamurkowski/status/659419037831667712
;2015-10-27 11:21;4;7;"Proud to be named a @Campaign4Kids 2015 Defender of Children for work to #InvestInKids http:// bit.ly/1LXkNgp";;@Campaign4Kids;#InvestInKids;"659042146780102656";https://twitter.com/lisamurkowski/status/659042146780102656
;2015-10-26 11:37;2;1;"Great article highlighting a couple of schools in Fairbanks who've turned their auto programs into powerhouses in AK http:// bit.ly/1H4HAl0";;;;"658683964077445120";https://twitter.com/lisamurkowski/status/658683964077445120
;2015-10-22 17:03;3;1;"W/the countless threats facing our nation from all over the globe, I can’t believe the @POTUS would be willing to put our security at risk.";;@POTUS;;"657316266093518848";https://twitter.com/lisamurkowski/status/657316266093518848
;2015-10-22 17:02;0;4;"#NDAA was designed not only to keep this nation safe, but it also provides support for our troops, military retirees, and their families.";;;#NDAA;"657316049084416001";https://twitter.com/lisamurkowski/status/657316049084416001
;2015-10-22 17:00;3;2;"Our servicemembers & their families deserve our unqualified support. They should never be used as a pawn in the President’s political game.";;;;"657315590487547904";https://twitter.com/lisamurkowski/status/657315590487547904
;2015-10-22 16:13;9;1;"I think Alaskans would beg to differ. EPA’s overreach is stifling Alaska’s economy. https:// twitter.com/thehill/status /657289593776119809 …";;;;"657303827251613696";https://twitter.com/lisamurkowski/status/657303827251613696
;2015-10-22 15:06;3;3;"Deeply disappointed @POTUS vetoed #NDAA . Our natl. security & support for troops shouldn't be jeopardized, esp. to make a political point.";;@POTUS;#NDAA;"657286818149351424";https://twitter.com/lisamurkowski/status/657286818149351424
;2015-10-22 13:33;5;5;"Great to meet with @BillGates today! https:// twitter.com/EnergyGOP/stat us/657262374714494976 …";;@BillGates;;"657263433344270336";https://twitter.com/lisamurkowski/status/657263433344270336
;2015-10-22 09:33;3;1;"Our servicemembers and their families need our unqualified support and should not be made pawns in a larger agenda. https:// twitter.com/thehill/status /657175578055942144 …";;;;"657203066337390592";https://twitter.com/lisamurkowski/status/657203066337390592
;2015-10-21 17:22;1;2;"Sen. Indian Affairs Committee unanimously passed leg. @SenDanSullivan & I introduced to strengthen the 477 program. http:// 1.usa.gov/1OTrDVj";;@SenDanSullivan;;"656958714273005568";https://twitter.com/lisamurkowski/status/656958714273005568
;2015-10-20 21:27;4;0;"While I have some concerns with this legislation, this issue is serious enough that we need to have a debate and opportunity for amendments.";;;;"656658055434760192";https://twitter.com/lisamurkowski/status/656658055434760192
;2015-10-20 21:27;3;1;"This legislation, going after violent criminals, is a common sense solution to a serious problem and is essential to prevent similar crimes.";;;;"656657936828248064";https://twitter.com/lisamurkowski/status/656657936828248064
;2015-10-20 21:26;5;3;"We also must seek justice for families like that of Kate Steinle, gunned down by a convicted felon who was also an illegal immigrant.";;;;"656657821916884992";https://twitter.com/lisamurkowski/status/656657821916884992
;2015-10-20 21:26;4;2;"I voted to advance the #SanctuaryCities bill b/c we must have a conversation on protecting families from violent criminals here illegally.";;;#SanctuaryCities;"656657716694425604";https://twitter.com/lisamurkowski/status/656657716694425604
;2015-10-20 11:27;7;1;"October is National Seafood Month! But in Alaska, we celebrate seafood all year round. https:// instagram.com/p/9EOtNhGQ0p/";;;;"656507053058469888";https://twitter.com/lisamurkowski/status/656507053058469888
;2015-10-19 15:10;1;0;"Proud to have joined @SenDanSullivan to introduce legislation to repeal this harmful tax. https:// twitter.com/adndotcom/stat us/655985195837820928 …";;@SenDanSullivan;;"656200892413255680";https://twitter.com/lisamurkowski/status/656200892413255680
;2015-10-19 14:43;3;0;"Alaskan students in grades K-6 have until tomorrow night to participate in the @USCapitolTree Lighting Contest! http:// bit.ly/1PCqTEF";;@USCapitolTree;;"656193932125196292";https://twitter.com/lisamurkowski/status/656193932125196292
;2015-10-16 16:57;4;1;"There is not a lack of interest in the Arctic. If anything what we are seeing is a lack of interest in working w/ current DOI leadership.";;;;"655140436525256704";https://twitter.com/lisamurkowski/status/655140436525256704
;2015-10-16 16:55;9;4;"It is absurd that Interior Dept. has created a regulatory environment where operators cannot have commercially viable exploration programs.";;;;"655140143108505600";https://twitter.com/lisamurkowski/status/655140143108505600
;2015-10-16 16:55;6;1;"This is the latest in a destructive pattern of hostility toward energy production that began the 1st day this administration took office.";;;;"655139999898185728";https://twitter.com/lisamurkowski/status/655139999898185728
;2015-10-16 16:48;6;5;"This is a stunning, short-sighted move that betrays the Interior Department’s commitments to Alaska. http:// bit.ly/1RfZ2II";;;;"655138319647436801";https://twitter.com/lisamurkowski/status/655138319647436801
;2015-10-16 16:22;4;3;"#MyAlaskanHero today is Greta Schuerch from Kiana, a fierce advocate for improved public safety in rural Alaska. pic.twitter.com/bUMLnVZvxI";;;#MyAlaskanHero;"655131770724048896";https://twitter.com/lisamurkowski/status/655131770724048896
;2015-10-16 11:48;1;1;"Getting ready to speak at #AFN2015 in the next hour. Watch live here: http://www. nativefederation.org/afn-live/";;;#AFN2015;"655062798448246784";https://twitter.com/lisamurkowski/status/655062798448246784
;2015-10-15 23:27;3;2;"At Quyana for #AFN2015 . Janeen Barr from Brevig Mission checks off #6 on her bucket list - a selfie… https:// instagram.com/p/84ozVZmQ1e/";;;#AFN2015 #6;"654876247617613824";https://twitter.com/lisamurkowski/status/654876247617613824
;2015-10-15 19:10;1;3;"#MyAlaskanHero today is @ANSEP_AK for their ability to foster young AK leaders in fields of science & engineering. pic.twitter.com/53lG5vE8k4";;@ANSEP_AK;#MyAlaskanHero;"654811599841005568";https://twitter.com/lisamurkowski/status/654811599841005568
;2015-10-15 18:28;2;7;"Great to be @akwomenssummit with so many Alaskan women today! pic.twitter.com/MAEKozw04K";;@akwomenssummit;;"654800922246164480";https://twitter.com/lisamurkowski/status/654800922246164480
;2015-10-15 15:27;1;4;"Speaking @akwomenssummit . It's important we support each other and learn from one another. #TogetherWereBetter pic.twitter.com/RN71azVkx8";;@akwomenssummit;#TogetherWereBetter;"654755537863598080";https://twitter.com/lisamurkowski/status/654755537863598080
;2015-10-14 18:58;2;3;"On @KFQD right now. Listen in at http:// bit.ly/1Jgl4WD pic.twitter.com/S4lT78l2wH";;@KFQD;;"654446277690683392";https://twitter.com/lisamurkowski/status/654446277690683392
;2015-10-14 16:02;2;4;"Loved listening to the drumming at the Elders and Youth Conference! @Dena'ina Civic and Convention… https:// instagram.com/p/81P-SWmQxK/";;@Dena;;"654401958166577153";https://twitter.com/lisamurkowski/status/654401958166577153
;2015-10-14 12:54;7;11;"#MyAlaskanHero today is Byron Nicholai of Toksook Bay whose voice & passion is helping preserve the Yupi'k language. pic.twitter.com/wwEduauAnm";;;#MyAlaskanHero;"654354617539690496";https://twitter.com/lisamurkowski/status/654354617539690496
;2015-10-13 20:02;2;2;"Sending off our WWII and Korean War veterans on their way from Anchorage to DC for the Last Frontier… https:// instagram.com/p/8zDaznGQ4R/";;;;"654100012327129088";https://twitter.com/lisamurkowski/status/654100012327129088
;2015-10-13 15:14;0;2;"#MyAlaskanHero today is Vernor Wilson III, a proud Yup’ik Eskimo from Dillingham who has dedicated his life to advocating for Bristol Bay.";;;#MyAlaskanHero;"654027571613581316";https://twitter.com/lisamurkowski/status/654027571613581316
;2015-10-13 11:23;0;3;"Wonderful to participate in the Lights on Afterschool celebration in Fairbanks. Great kids,program&community support. pic.twitter.com/lBoTlBE49p";;;;"653969395329449984";https://twitter.com/lisamurkowski/status/653969395329449984
;2015-10-12 23:28;7;2;"Looking out the window today as we flew from McGrath to Fairbanks. #Denali from any view is awesome -… https:// instagram.com/p/8w60sNGQ7Q/";;;#Denali;"653789315701542912";https://twitter.com/lisamurkowski/status/653789315701542912
;2015-10-12 15:55;3;5;"#MyAlaskanHero today is Rico Lanaat’Worl, a young Tlingit artist who incorporates Native art to design skateboards: http:// bit.ly/1Hpp0Xj .";;;#MyAlaskanHero;"653675361612333056";https://twitter.com/lisamurkowski/status/653675361612333056
;2015-10-11 17:17;5;10;"#MyAlaskanHero today is Alexanna Salmon from Igiugig, for her work on behalf of her people and community. pic.twitter.com/YaD4O0n3he";;;#MyAlaskanHero;"653333690605510656";https://twitter.com/lisamurkowski/status/653333690605510656
;2015-10-11 11:09;1;1;"(2/2) I hope you’ll join and share your heroes on these posts! Use the hashtag #MyAlaskanHero . I look forward to reading your posts!";;;#MyAlaskanHero;"653240944574210048";https://twitter.com/lisamurkowski/status/653240944574210048
;2015-10-11 11:08;0;2;"(1/2) In the spirit of this year’s @NativeFed theme “Heroes in our Homeland” I'll be posting about some of my heroes on my FB page.";;@NativeFed;;"653240885761679360";https://twitter.com/lisamurkowski/status/653240885761679360
;2015-10-11 10:42;1;0;"Photo booth at HIPOW with Verne. https:// instagram.com/p/8s-YXqmQ5i/";;;;"653234188607430656";https://twitter.com/lisamurkowski/status/653234188607430656
;2015-10-10 11:49;0;2;"With possibly the most photographed moose in Alaska (here at Ted Stevens International Airport). Good… https:// instagram.com/p/8qhScGmQ-Q/";;;;"652888790797783040";https://twitter.com/lisamurkowski/status/652888790797783040
;2015-10-08 22:10;7;17;"#tbt to our road trip through #Denali last month. Ran out of gas but thanks to a kind Alaskan for the help! pic.twitter.com/JafIgFQLg5";;;#tbt #Denali;"652320313934528512";https://twitter.com/lisamurkowski/status/652320313934528512
;2015-10-08 13:52;8;6;". @POTUS veto threat on #oil #exports reveals fundamental misalignment within Administration. Stay tuned. http://www. energy.senate.gov/public/index.c fm?p=republican-news&id=FB2F07F0-71A2-4715-8FBC-9F04DEFFD410 …";;@POTUS;#oil #exports;"652194955465723904";https://twitter.com/lisamurkowski/status/652194955465723904
;2015-10-07 17:30;0;0;"Alaska knows the value and importance of our military better than any other. I would urge @POTUS to reconsider his #NDAA veto threat.";;@POTUS;#NDAA;"651887411941756928";https://twitter.com/lisamurkowski/status/651887411941756928
;2015-10-07 17:30;0;0;"Today I was proud to vote for #NDAA , one of the most important pieces of legislation Congress considers every year: http:// 1.usa.gov/1jdLiUr .";;;#NDAA;"651887370732720128";https://twitter.com/lisamurkowski/status/651887370732720128
;2015-10-07 14:44;21;14;"This makes it "official"! @McDonalds is the changing name of its McKinley Mac to the Denali Mac: http:// radiokenai.net/mckinley-mac-t o-be-renamed/ … .";;@McDonalds;;"651845571708366848";https://twitter.com/lisamurkowski/status/651845571708366848
;2015-10-07 11:33;6;6;"Productive meeting with @AkGovBillWalker & @LtGovMallott this morning! Always great to see fellow Alaskans in D.C. pic.twitter.com/KTmeVQQyJz";;@AkGovBillWalker @LtGovMallott;;"651797542938804224";https://twitter.com/lisamurkowski/status/651797542938804224
;2015-10-06 14:11;14;12;"In spite of @POTUS veto threat, Senate just voted overwhelmingly to advance defense bill. Victory for service members & military families.";;@POTUS;;"651474914873069568";https://twitter.com/lisamurkowski/status/651474914873069568
;2015-10-06 12:02;7;5;"Friendly reminder that it’s election day for communities all across Alaska. Polls are open until 8pm--don’t forget to vote!";;;;"651442291597553668";https://twitter.com/lisamurkowski/status/651442291597553668
;2015-10-05 16:52;0;3;"Happy #WorldTeachersDay ! I thank all teachers for their dedication, hard work, & determination to help every child achieve his or her dream.";;;#WorldTeachersDay;"651153005903872000";https://twitter.com/lisamurkowski/status/651153005903872000
;2015-10-02 14:10;3;6;"Honor to meet w/ members of Anchorage Fire Department who are in D.C. for Natl.Fallen Firefighters Memorial Weekend. pic.twitter.com/s7NcLhKS83";;;;"650025180778119168";https://twitter.com/lisamurkowski/status/650025180778119168
;2015-10-01 15:31;2;2;"Congrats to Bea Kristovich for being the first woman to ever be elected 2nd Traditional Chief of the AVCP! http:// bit.ly/1LmOnxu";;;;"649683044916445185";https://twitter.com/lisamurkowski/status/649683044916445185
;2015-10-01 12:01;1;2;"Great to see that delegates of 56 tribes attended AVCP convention in Bethel. Hope it was a productive gathering! pic.twitter.com/xxvZUSZOvt";;;;"649630233210056704";https://twitter.com/lisamurkowski/status/649630233210056704
;2015-09-30 10:40;1;2;"While this CR only a short-term extension to fund the government, I believe we can reach a long-term solution: http:// 1.usa.gov/1FIdNDo .";;;;"649247377640026112";https://twitter.com/lisamurkowski/status/649247377640026112
;2015-09-30 10:40;4;6;"Troubling that a #governmentshutdown was even an option, causing great economic hardship to the 15,000 Alaskans employed by the fed. gov.";;;#governmentshutdown;"649247333977300992";https://twitter.com/lisamurkowski/status/649247333977300992
;2015-09-30 10:39;1;5;"I’m pleased that my Senate colleagues and I have passed a 10-week continuing resolution to fund the government through December 11.";;;;"649247239223812096";https://twitter.com/lisamurkowski/status/649247239223812096
;2015-09-28 19:59;26;20;"Unreal. It took NASA 11 years and $2.6 billion to drill on #Mars . It took Shell 7 years and over $7 billion to drill in the #Chukchi Sea.";;;#Mars #Chukchi;"648663385672916992";https://twitter.com/lisamurkowski/status/648663385672916992
;2015-09-28 13:24;2;1;"I call on the admin. to work w/Alaskans to develop a legitimate plan, with our input, to ensure resources in our federal areas are produced.";;;;"648564024200830977";https://twitter.com/lisamurkowski/status/648564024200830977
;2015-09-28 13:24;8;2;"What we need–but still don't have–is a predictable/sensible regulatory system that encourages companies to make investments in AK's future.";;;;"648563990428262400";https://twitter.com/lisamurkowski/status/648563990428262400
;2015-09-28 13:24;5;1;"It's clear that the federal regulatory environment (uncertain and everchanging) was a significant factor in Shell’s decision.";;;;"648563929384398849";https://twitter.com/lisamurkowski/status/648563929384398849
;2015-09-28 13:24;2;2;"Disappointed by Shell’s decision to suspend drilling operations in the Chukchi just as I've been frustrated by the long path that led to it.";;;;"648563870785765376";https://twitter.com/lisamurkowski/status/648563870785765376
;2015-09-25 13:17;2;2;"Alaskans- October 1st is the last day to send in your ornaments to decorate this year's @USCapitolTree . http:// bit.ly/1KHsbsv";;@USCapitolTree;;"647475038472564736";https://twitter.com/lisamurkowski/status/647475038472564736
;2015-09-24 18:40;3;23;"Thank you to my friend @SenatorDurbin for capturing this moment! #PopeInDC pic.twitter.com/KSz09rjlNi";;@SenatorDurbin;#PopeInDC;"647194031743729664";https://twitter.com/lisamurkowski/status/647194031743729664
;2015-09-24 11:55;4;10;"This morning, #PopeFrancis blessed 2 rosaries very special to me. An experience I will never forget!… https:// instagram.com/p/8BU37pGQ74/";;;#PopeFrancis;"647092003784818689";https://twitter.com/lisamurkowski/status/647092003784818689
;2015-09-24 08:49;2;4;"Looking forward to hearing @Pontifex 's message to Congress in just a few moments. Watch live here: http:// cs.pn/1VaKgcy .";;@Pontifex;;"647045219603619840";https://twitter.com/lisamurkowski/status/647045219603619840
;2015-09-23 14:59;2;2;"Good news--USPS has temporarily extended hours & increased staff at the Wasilla Post Office’s Main Branch. pic.twitter.com/WFeyWk1vWV";;;;"646775881940140033";https://twitter.com/lisamurkowski/status/646775881940140033
;2015-09-23 12:45;2;4;"View from Polychrome Pass in Denali National Park. Lots of snow but the road was clear so the drive… https:// instagram.com/p/7-2NGMGQ2p/";;;;"646742284843749376";https://twitter.com/lisamurkowski/status/646742284843749376
;2015-09-21 15:08;0;3;"Limited #of tickets left for Alaskans to watch Pope's speech from the National Mall. Call 202-224-6665 for info. pic.twitter.com/yG4QIVCc4v";;;#of;"646053449302454276";https://twitter.com/lisamurkowski/status/646053449302454276
