username;date;retweets;favorites;text;geo;mentions;hashtags;id;permalink
;2012-03-28 13:55;3;0;"Approval of Shell’s response plan is major step toward Arctic exploration this summer- Good news for AK & the economy: http://www. murkowski.senate.gov/public/index.c fm?p=PressReleases&ContentRecord_id=6be6447f-7c3c-4b6e-b21a-053a30865972 …";;;;"185077791593725953";https://twitter.com/lisamurkowski/status/185077791593725953
;2012-03-28 12:46;3;0;"It is too late to do justice to Senator Stevens or the people of Alaska. But we must do justice to the Constitution: http://www. murkowski.senate.gov/public/index.c fm?p=PressReleases&ContentRecord_id=7f950c68-2961-47ef-a01a-ba199158b471 …";;;;"185060347084931072";https://twitter.com/lisamurkowski/status/185060347084931072
;2012-03-28 08:59;0;0;"Alaska, a live webcast is about to start on the independent investigation of the Stevens trial. Watch here: http:// bit.ly/GY0r7L";;;;"185003137835347968";https://twitter.com/lisamurkowski/status/185003137835347968
;2012-03-27 16:46;1;1;"Alaska, tune into C-SPAN2 – I’m walking down to the floor to speak about domestic oil production. Watch LIVE - http://www. c-span.org/Live-Video/C-S PAN2/ …";;;;"184758365065461760";https://twitter.com/lisamurkowski/status/184758365065461760
;2012-03-27 15:40;1;0;"How much money is it going to cost to have the Air Force save money in #Alaska with the Eielson F-16s? I asked today: http://www. youtube.com/watch?v=o8RlQV cbIV0 …";;;#Alaska;"184741620028145665";https://twitter.com/lisamurkowski/status/184741620028145665
;2012-03-27 13:53;1;1;"Is the Air Force attempting to go around BRAC laws with its Eielson F-16 proposal? I asked DOD officials today: http://www. murkowski.senate.gov/public/index.c fm?p=PressReleases&ContentRecord_id=27470121-3a84-4398-80c1-6601c2539e79 …";;;;"184714731070828546";https://twitter.com/lisamurkowski/status/184714731070828546
;2012-03-26 17:32;6;0;"Seward's greatest achievement? "The purchase of #Alaska , but it will take the people a generation to find it out" http:// bit.ly/HaYleJ";;;#Alaska;"184407627411898369";https://twitter.com/lisamurkowski/status/184407627411898369
;2012-03-26 11:03;12;1;"Happy Seward’s Day #Alaska ! Today we celebrate the #AK Purchase in 1867. Here’s a replica of the check: pic.twitter.com/fdplTVPg";;;#Alaska #AK;"184309649720344576";https://twitter.com/lisamurkowski/status/184309649720344576
;2012-03-23 12:17;0;0;"Congrats to #Alaska 's 2012 State History Day winners! 43 AK students will rep our state at the nationals in June: http://www. alaskahistoryday.com/2012-winners.h tml …";;;#Alaska;"183241032949956608";https://twitter.com/lisamurkowski/status/183241032949956608
;2012-03-22 17:20;1;0;"Remove 3 of 4 fed courthouses in #Alaska & force all to Anchorage for court? Geography trumps economics in this case: http://www. murkowski.senate.gov/public/index.c fm?p=PressReleases&ContentRecord_id=bb3fde9b-eec0-4616-aded-a575f92f2dc7 …";;;#Alaska;"182954831185580032";https://twitter.com/lisamurkowski/status/182954831185580032
;2012-03-22 16:45;0;0;"I asked Sec. Bryson if stock assessments & catch share programs could be negatively impacted in ’13 budget: http://www. youtube.com/watch?v=m1U-lo jo2oE … #Alaska";;;#Alaska;"182946003182297090";https://twitter.com/lisamurkowski/status/182946003182297090
;2012-03-22 14:53;2;0;"I’m concerned about Commerce Sec. Bryson's focus on Alaska’s fisheries. Today I asked about his priorities: http://www. youtube.com/watch?v=-2ldFV ofy-8 … #Alaska";;;#Alaska;"182917920823853056";https://twitter.com/lisamurkowski/status/182917920823853056
;2012-03-22 13:03;6;1;"The President’s speech today in front of the rolled pipe in Cushing, OK is a PR ploy – not #energy policy. http:// bit.ly/GGcyW0";;;#energy;"182890266942910464";https://twitter.com/lisamurkowski/status/182890266942910464
;2012-03-22 10:55;2;1;"DC may hit 80 degrees tomorrow, but earlier this month I had snow higher than my windows in Alaska! http:// twitpic.com/8zsspu";;;;"182858092701155328";https://twitter.com/lisamurkowski/status/182858092701155328
;2012-03-21 16:44;9;1;"What USA Today missed: Ft. Yukon #Alaska gas is $8.00/gal and home heating oil is $6.88/gal #GasPrices";;;#Alaska #GasPrices;"182583599529328642";https://twitter.com/lisamurkowski/status/182583599529328642
;2012-03-21 16:18;10;0;"$6/gallon gas in Alaska may be news to USA Today, but we've been watching this for awhile. http:// usat.ly/GDAeF4";;;;"182576892136783872";https://twitter.com/lisamurkowski/status/182576892136783872
;2012-03-21 16:06;1;0;"#TSA cargo fees add to travel costs and to the price of goods in Alaska. Today I asked the TSA how to keep fees low: http://www. youtube.com/watch?v=DicKXx o0pWg&list=UUaigku16AErqvD0wRuwGb9A&index=2&feature=plcp …";;;#TSA;"182574014563237888";https://twitter.com/lisamurkowski/status/182574014563237888
;2012-03-21 14:14;3;0;"Many Alaskans travel with special medical needs. What is the #TSA doing to help them? http://www. youtube.com/watch?v=FZ5pfd mkaWw&list=UUaigku16AErqvD0wRuwGb9A&index=1&feature=plcp …";;;#TSA;"182545734921498624";https://twitter.com/lisamurkowski/status/182545734921498624
;2012-03-21 13:51;3;0;"TSA’s “one size fits all” approach doesn’t work for many rural Alaskan communities. I asked abt these policies today: http://www. youtube.com/watch?v=3TTEka b1Iw0&list=UUaigku16AErqvD0wRuwGb9A&index=3&feature=plcp …";;;;"182539959729790976";https://twitter.com/lisamurkowski/status/182539959729790976
;2012-03-21 13:28;3;0;"Heading to the Senate floor to salute my colleague @SenatorBarb Mikulski for becoming the longest-serving woman in Congress.";;@SenatorBarb;;"182534052077772800";https://twitter.com/lisamurkowski/status/182534052077772800
;2012-03-21 12:48;0;0;"Thanks to Sen. Enzi for joining as a co-sponsor on my Fairness in Disclosure of Evidence Act: http:// bit.ly/A0qTbL";;;;"182523986352152577";https://twitter.com/lisamurkowski/status/182523986352152577
;2012-03-20 15:50;2;0;"March 20 is National Native AIDS/HIV Awareness Day- promoting HIV testing in Native communities to combat rising rates http:// indiancountrytodaymedianetwork.com/2012/03/20/nat ional-native-aids-day-promotes-hiv-testing-as-infection-rates-are-rising-in-indian-country-103612 …";;;;"182207490291793922";https://twitter.com/lisamurkowski/status/182207490291793922
;2012-03-20 14:01;6;0;"Best of luck to the @UAASeawolves as they compete in the @NCAA Elite Eight WBB game at 11:30 am #AK time! #Alaska pic.twitter.com/yZzPuDnt";;@UAASeawolves @NCAA;#AK #Alaska;"182180023753646080";https://twitter.com/lisamurkowski/status/182180023753646080
;2012-03-19 16:47;2;1;"Rookie Jan Steves officially ended the #Iditarod at 2:57 am this morning – earning the Red Lantern award: http://www. adn.com/2012/03/19/237 9336/iditarod-ends-with-steves-winning.html …";;;#Iditarod;"181859561651707906";https://twitter.com/lisamurkowski/status/181859561651707906
;2012-03-19 14:28;1;1;"After the Stevens trial report, @adndotcom @newsminer & @washingtonpost agree - my bill will bring justice to the DoJ: http:// bit.ly/w7ymPg";;@adndotcom @newsminer @washingtonpost;;"181824560168046592";https://twitter.com/lisamurkowski/status/181824560168046592
;2012-03-19 11:04;0;0;"Starting off the week by congratulating my old high school for being Alaska state 3A basketball champs - way to go, Monroe Rams!";;;;"181773080023138304";https://twitter.com/lisamurkowski/status/181773080023138304
;2012-03-16 19:08;2;0;"Village Built Clinics are critical to health in #Alaska , yet the facilities are falling apart. I asked IHS why: http://www. murkowski.senate.gov/public/index.c fm?p=PressReleases&ContentRecord_id=3a4f5f02-a420-450d-9d6b-307cf7039422 …";;;#Alaska;"180807791118778368";https://twitter.com/lisamurkowski/status/180807791118778368
;2012-03-16 11:27;4;0;"Ted Stevens faced prosecutorial misconduct, while his accuser, Bill Allen, faces no charges for sex trafficking. Why? http://www. murkowski.senate.gov/public/index.c fm?p=PressReleases&ContentRecord_id=76512399-9c74-4415-b8da-0e53999cbeac …";;;;"180691801315868673";https://twitter.com/lisamurkowski/status/180691801315868673
;2012-03-15 19:13;1;0;"I agree w/ @kaybaileyhutch The prosecutors responsible for misconduct in the Stevens case should no longer work for DOJ http://www. facebook.com/video/video.ph p?v=10100150713296165&saved …";;@kaybaileyhutch;;"180446655143886848";https://twitter.com/lisamurkowski/status/180446655143886848
;2012-03-15 17:39;3;0;"I agree with Ted Stevens’ attorney:Ted would have loved to see this day & read the report about misconduct in his case http://www. youtube.com/watch?v=TQA2RF f91Qo …";;;;"180423118546931713";https://twitter.com/lisamurkowski/status/180423118546931713
;2012-03-15 16:23;2;0;"In the Stevens case, justice was blindly ignored. My new bill ensures those injustices would never happen again: http://www. murkowski.senate.gov/public/index.c fm?p=PressReleases&ContentRecord_id=5b41d548-ab47-464f-a627-8b1702b75145 …";;;;"180403802615189505";https://twitter.com/lisamurkowski/status/180403802615189505
;2012-03-15 14:46;1;0;"Beaming into the Tanana Chiefs Conference Convention right now - Thanks for letting me beam in! http:// twitpic.com/8wq8h1";;;;"180379549996040192";https://twitter.com/lisamurkowski/status/180379549996040192
;2012-03-15 11:58;1;0;"The Vietnam Veterans Memorial Moving Wall will head to 6 Alaskan communities in May– first stop is Ketchikan: http:// bit.ly/wSv0vv #Alaska";;;#Alaska;"180337265166389250";https://twitter.com/lisamurkowski/status/180337265166389250
;2012-03-14 18:45;2;0;"I asked top Air Force officials for details of their plan to move the Eielson F-16s to JBER. Watch their answers: http://www. murkowski.senate.gov/public/index.c fm?p=PressReleases&ContentRecord_id=5e30c50b-f882-4e85-ab13-f8e047a411bc …";;;;"180077229441679360";https://twitter.com/lisamurkowski/status/180077229441679360
;2012-03-14 16:29;4;1;"Legacy oil wells in #Alaska were left open by the fed. gov't 40 years ago I want a commitment from BLM to clean them up http://www. murkowski.senate.gov/public/index.c fm?p=PressReleases&ContentRecord_id=d62703da-47d6-4a0d-bbbf-a416352def29 …";;;#Alaska;"180042916406890496";https://twitter.com/lisamurkowski/status/180042916406890496
;2012-03-14 12:30;3;0;"Pres Obama says #oil production is at an all time high, DOI data shows otherwise. I tried to get to the bottom of it: http://www. murkowski.senate.gov/public/index.c fm?p=PressReleases&ContentRecord_id=22e4308b-5e7f-405c-9371-fffb18ed9549 …";;;#oil;"179982848625876994";https://twitter.com/lisamurkowski/status/179982848625876994
;2012-03-14 11:03;0;0;"Just wrapped up questioning of General Schwartz, continuing to ask him questions about the F-16s at Eielson. http:// twitpic.com/8w8tvf";;;;"179961035741069313";https://twitter.com/lisamurkowski/status/179961035741069313
;2012-03-13 22:28;6;0;"Congratulations to Dallas Seavey & his team on their remarkable victory in this year’s #Iditarod at 25, he’s the youngest musher to ever win";;;#Iditarod;"179770900781076481";https://twitter.com/lisamurkowski/status/179770900781076481
;2012-03-13 19:47;0;0;"Dallas Seavey is now out of Safety- the last checkpoint before the Burled Arch in Nome! #Iditarod";;;#Iditarod;"179730405199589378";https://twitter.com/lisamurkowski/status/179730405199589378
;2012-03-13 19:08;5;0;"To the 1st Stryker Brigade Combat Team, 25th Infantry Division, welcome home- you have made you nation proud http://www. murkowski.senate.gov/public/index.c fm?p=PressReleases&ContentRecord_id=50c95c9a-a971-485e-866b-4e238bb95263 …";;;;"179720685743116288";https://twitter.com/lisamurkowski/status/179720685743116288
;2012-03-13 13:06;2;0;"What's stopping DOE from making mistakes like Solyndra again? Today I asked Sec. Chu abt the loan guarantee program: http://www. youtube.com/watch?v=Lx-ZcT JXB-o …";;;;"179629614610661376";https://twitter.com/lisamurkowski/status/179629614610661376
;2012-03-13 11:15;1;0;"Mushers are expected in Nome this afternoon. Dallas Seavey is in the lead & poised to make #Iditarod history: http:// community.adn.com/adn/node/160318";;;#Iditarod;"179601675995201538";https://twitter.com/lisamurkowski/status/179601675995201538
;2012-03-12 18:30;3;0;"I'm proud to have been a co-sponsor of the Year of the Girl & 100th Anniversary of the Girl Scouts Resolution, which just passed the Senate";;;;"179348778313203712";https://twitter.com/lisamurkowski/status/179348778313203712
;2012-03-12 17:10;0;1;"March Madness #Alaska tips off today with the small schools basketball tournament- good luck to all the 1A & 2A teams! http:// bit.ly/wVq4RW";;;#Alaska;"179328581728600064";https://twitter.com/lisamurkowski/status/179328581728600064
;2012-03-12 15:28;5;0;"Congrats to UAF Nanooks Women's Hockey for making it to the D2 @ACHAwomenshky Championship! Good luck as they take on Wisconsin-Stout today.";;@ACHAwomenshky;;"179302837380055040";https://twitter.com/lisamurkowski/status/179302837380055040
;2012-03-12 11:08;3;0;"From a former Girl Scout, happy 100th! I'm celebrating with my favorite cookies: http:// bit.ly/xwjXdj #GirlScouts100 pic.twitter.com/LNlNTufF";;;#GirlScouts100;"179237459056541697";https://twitter.com/lisamurkowski/status/179237459056541697
;2012-03-11 20:57;4;0;"The Ted Stevens case was not unique- which is why I will introduce legislation to restore justice to the system: http:// bit.ly/wNsAh2";;;;"179023371718246403";https://twitter.com/lisamurkowski/status/179023371718246403
;2012-03-11 19:35;4;0;"I am shocked & disturbed by reports that a U.S. soldier shot civilians in #Afghanistan - my condolences to the families http:// 1.usa.gov/zzGeJy";;;#Afghanistan;"179002527004622848";https://twitter.com/lisamurkowski/status/179002527004622848
;2012-03-11 16:40;0;1;"#Alaska Seafood Marketing Institute is also here @Int'l Boston Seafood Show. http:// twitpic.com/8v3vsl";;@Int;#Alaska;"178958617955930112";https://twitter.com/lisamurkowski/status/178958617955930112
;2012-03-11 15:11;0;0;"It's good to catch up with my friends from Copper River Seafood at the Int'l Boston Seafood Show. http:// twitpic.com/8v2uul";;;;"178936293298929666";https://twitter.com/lisamurkowski/status/178936293298929666
;2012-03-11 14:18;0;0;"Having a great time at the Int'l Boston Seafood Show, showing off #Alaska King Crab bisque. http:// twitpic.com/8v28h1";;;#Alaska;"178922904845684736";https://twitter.com/lisamurkowski/status/178922904845684736
;2012-03-11 13:40;3;0;"It's always an honor and thrill to show off #Alaska seafood at the Int'l Boston Seafood Show. http:// twitpic.com/8v1rvh";;;#Alaska;"178913182935552000";https://twitter.com/lisamurkowski/status/178913182935552000
;2012-03-09 20:31;2;0;"Spring temps in Wash. DC and 21.5 feet of snow in Cordova #Alaska ! Check out the latest snow totals here: http:// bit.ly/z1ppgN";;;#Alaska;"178307065922596864";https://twitter.com/lisamurkowski/status/178307065922596864
;2012-03-09 13:17;0;0;"You never know what might happen next in the #Iditarod - Aliy Zirkle just took over the lead from the Seaveys: http:// community.adn.com/?q=adn/node/16 0213 …";;;#Iditarod;"178197813165953026";https://twitter.com/lisamurkowski/status/178197813165953026
;2012-03-08 17:37;0;0;"$5.50/trip increase in #TSA fees may sound small, but can add up- I asked Sec. Napolitano about #Alaska impacts: http:// 1.usa.gov/yCDuk6";;;#TSA #Alaska;"177900905927163905";https://twitter.com/lisamurkowski/status/177900905927163905
;2012-03-08 16:38;1;0;"It will take $860M to build an icebreaker but only $8M is in the DHS budget. I asked Sec Napolitano if it’s a priority: http:// murkowski.senate.gov/public/index.c fm?p=PressReleases&ContentRecord_id=2d43078a-cb3a-4d7f-a6f9-6ba0926caafd …";;;;"177886093734191105";https://twitter.com/lisamurkowski/status/177886093734191105
;2012-03-08 14:09;3;0;"Prosecutors in Stevens case using $1.8M for defense & to keep details of the case secret? I asked Eric Holder why: http:// 1.usa.gov/wmly53";;;;"177848595872092160";https://twitter.com/lisamurkowski/status/177848595872092160
;2012-03-08 12:37;0;0;"#Iditarod update: Jim Lanier is leading out of Ophir. But for how long? Read about who is catching up here: http:// community.adn.com/adn/node/160170 #Alaska";;;#Iditarod #Alaska;"177825390247677952";https://twitter.com/lisamurkowski/status/177825390247677952
;2012-03-07 18:25;0;0;"I am deeply troubled the Air Force is planning to move the F-16s from Eielson without looking at all possible impacts http:// 1.usa.gov/z3Z30U";;;;"177550635594555393";https://twitter.com/lisamurkowski/status/177550635594555393
;2012-03-07 17:24;0;0;"We're continuously updating the #Iditarod standings here at my DC office – for all Alaskan visitors. pic.twitter.com/nKuN2Wp5";;;#Iditarod;"177535103025676289";https://twitter.com/lisamurkowski/status/177535103025676289
;2012-03-07 15:33;0;1;"The Anchorage ATHENA Society announced its 2012 inductees today. Congrats to the 11 women being recognized: http://www. anchoragechamber.org/cms/FileLib/20 12ATHENAInductees.pdf … #Alaska";;;#Alaska;"177507218487377921";https://twitter.com/lisamurkowski/status/177507218487377921
;2012-03-07 13:54;1;0;"#Alaska has more coastline than any other state- which is why I asked Navy Sec. Mabus about his #Arctic plans: http:// bit.ly/AsTuUA";;;#Alaska #Arctic;"177482392846610433";https://twitter.com/lisamurkowski/status/177482392846610433
;2012-03-07 12:54;4;0;"Congrats to Kikkan Randall - the 1st American to become a World Cup sprint skiing champion since 1982! http://www. adn.com/2012/03/07/235 6885/randall-clinches-sprint-skiing.html … #Alaska";;;#Alaska;"177467245751054337";https://twitter.com/lisamurkowski/status/177467245751054337
;2012-03-07 10:58;0;0;"Great meeting w/NORAD Commander General Charles Jacoby this morning discussing Alaska's role in protecting the US http:// twitpic.com/8t82ba";;;;"177437975263723520";https://twitter.com/lisamurkowski/status/177437975263723520
;2012-03-06 17:53;1;0;"Aliy Zirkle - has the path covered from A to Z - is back at it with her smaller, lighter team out of Nikolai! #Iditarod";;;#Iditarod;"177180184661860352";https://twitter.com/lisamurkowski/status/177180184661860352
;2012-03-06 15:35;1;0;"Had a great conversation with the students at Gambell School about curbing substance abuse among teens. #Alaska pic.twitter.com/kjvBtIJM";;;#Alaska;"177145349977288705";https://twitter.com/lisamurkowski/status/177145349977288705
;2012-03-06 13:41;2;0;"Southeast #Alaska can’t survive on stewardship contracts alone. We need the US Forest Service to recognize that: http:// vimeo.com/38037255";;;#Alaska;"177116782132338688";https://twitter.com/lisamurkowski/status/177116782132338688
;2012-03-05 13:24;3;0;"The Iditarod is giving Texas childen a learning tool for math, science and geography! http:// bit.ly/yUAzh9";;;;"176750133164261378";https://twitter.com/lisamurkowski/status/176750133164261378
;2012-03-03 16:20;3;0;"Having the best hotdog in America! MA's Dogs in Downtown Anchorage- my post #Iditarod tradition http:// twitpic.com/8rmls7";;;#Iditarod;"176069640143900673";https://twitter.com/lisamurkowski/status/176069640143900673
;2012-03-03 15:10;2;0;"Here at the #Iditarod - doesn't get any better! http://www. facebook.com/photo.php?v=10 100139525516565 … #Alaska";;;#Iditarod #Alaska;"176051928298553345";https://twitter.com/lisamurkowski/status/176051928298553345
;2012-03-03 13:32;1;0;"Verne & I are ready for #Iditarod 40! Come to Downtown Anchorage and join us for the start of the Last Great Race! pic.twitter.com/xCX3F4ST";;;#Iditarod;"176027314835038208";https://twitter.com/lisamurkowski/status/176027314835038208
;2012-03-03 13:01;1;1;"Let the Last Great Race begin! http://www. facebook.com/photo.php?v=10 100139456624625 … #Iditarod #Alaska";;;#Iditarod #Alaska;"176019405321416704";https://twitter.com/lisamurkowski/status/176019405321416704
;2012-03-02 13:23;2;0;"Less than 24 hours before the Iditarod! Teachers nationwide use it as a great Alaskan learning tool. http:// 1.usa.gov/wAcKAN";;;;"175662550476791808";https://twitter.com/lisamurkowski/status/175662550476791808
;2012-03-01 20:28;2;0;"My SECURE IT bill ensures our nation’s cyber security without new layers of bureaucracy & regulation. http:// 1.usa.gov/wQPAqU";;;;"175407311270055936";https://twitter.com/lisamurkowski/status/175407311270055936
;2012-03-01 16:16;0;1;"I met w/ Alaskan Major Shannon Thompson today (Bartlett HS Grad) and thanked him for his service. http:// twitpic.com/8qqmoi";;;;"175343777777594368";https://twitter.com/lisamurkowski/status/175343777777594368
;2012-02-29 18:54;0;0;"Should fisheries be managed by Salazar & the Interior Dept.? See more about the possible NOAA restructuring here: http:// 1.usa.gov/x2T0sW";;;;"175021269299896321";https://twitter.com/lisamurkowski/status/175021269299896321
;2012-02-29 17:01;4;0;"The Indian Health Service is severely underfunded in #Obama ’s budget- I am fighting to keep up with costs http:// 1.usa.gov/wz8SBU";;;#Obama;"174992775253737472";https://twitter.com/lisamurkowski/status/174992775253737472
;2012-02-29 15:14;3;0;"Should the US raise royalty rates for #oil development on public land? Salazar thinks so- I asked him about it today: http:// 1.usa.gov/vZfbVM";;;#oil;"174965858689499136";https://twitter.com/lisamurkowski/status/174965858689499136
;2012-02-28 14:14;1;0;"The Federal Gov't has made promises to #Alaska that it has not kept. Today I demanded an action plan from Sec. Salazar: http:// vimeo.com/37604536";;;#Alaska;"174588378384314368";https://twitter.com/lisamurkowski/status/174588378384314368
;2012-02-27 19:11;1;0;"Alaska holds energy opportunity. We must get started today for the tomorrows of Bethel, Yakutat and Fairbanks. http:// bit.ly/zjeOgL";;;;"174300685498724352";https://twitter.com/lisamurkowski/status/174300685498724352
;2012-02-27 14:20;1;0;"Alaska, I'm heading down to the Senate floor to talk about the gas prices we're all dealing with. C-SPAN2, soon.";;;;"174227463818321921";https://twitter.com/lisamurkowski/status/174227463818321921
;2012-02-27 10:05;1;0;"Congrats to former Fairbanksan Ben Grossman for his #Oscar last night! http:// bit.ly/y0bjNL";;;#Oscar;"174163165091864576";https://twitter.com/lisamurkowski/status/174163165091864576
;2012-02-23 18:05;0;0;"Spent the afternoon at Gastineau Elementary visiting with the wonderful students in Mrs. Walker's 1st Grade class. pic.twitter.com/6Z0Nrs1B";;;;"172834366022615040";https://twitter.com/lisamurkowski/status/172834366022615040
;2012-02-23 12:35;2;0;"On way to give my annual address to the legislature, wanted to see the new portrait of Uncle Ted. http:// twitpic.com/8npsli";;;;"172751378928762880";https://twitter.com/lisamurkowski/status/172751378928762880
;2012-02-23 12:00;3;0;"I’m in Juneau for my annual address with the #Alaska State Legislature. Watch live at 10am: http:// gavelalaska.org /";;;#Alaska;"172742618034343937";https://twitter.com/lisamurkowski/status/172742618034343937
;2012-02-19 14:45;2;1;"What happens at Eielson AFB won’t only impact Fairbanks, this is a statewide issue Watch the entire community meeting: http:// bit.ly/yF9GLX";;;;"171334674042470400";https://twitter.com/lisamurkowski/status/171334674042470400
;2012-02-18 16:15;1;0;"Thanks to all the Fairbanksans who took part in the community meeting today. Great, honest points made.";;;;"170994826882461699";https://twitter.com/lisamurkowski/status/170994826882461699
;2012-02-17 19:49;2;0;"I love #Alaska on the Big Screen! “On the Ice” was shot in Barrow with Inupiaq actors & it's on AK screens tonight http:// bit.ly/y73sYp";;;#Alaska;"170686422515318784";https://twitter.com/lisamurkowski/status/170686422515318784
;2012-02-17 11:54;1;1;"The payroll tax cut for the rest of 2012 means about $1000 a year back in the pockets of #Alaskans http:// 1.usa.gov/yDJpEY";;;#Alaskans;"170566764676132864";https://twitter.com/lisamurkowski/status/170566764676132864
;2012-02-16 12:09;4;0;"Moments ago, I asked Energy Secretary Chu if he views AK's natural gas differently from the lower 48 supply. http:// bit.ly/Al4mKg";;;;"170208285608251392";https://twitter.com/lisamurkowski/status/170208285608251392
;2012-02-16 10:17;3;0;"Today is Elizabeth Peratrovich Day. I shared my thoughts of her on the 100th anniversary of her birth last year. http:// bit.ly/kdwQRT";;;;"170180107388989440";https://twitter.com/lisamurkowski/status/170180107388989440
;2012-02-15 19:00;2;1;"A new formula in the Fed highway bill would unravel efforts in #Alaska which is why I spoke to the Senate about it: http:// 1.usa.gov/yVIEt8";;;#Alaska;"169949181987917824";https://twitter.com/lisamurkowski/status/169949181987917824
;2012-02-15 17:14;0;0;"Army Maj Gen Thomas Katkus clinched victory in the Top Brass Sled Dog Race with world-champions Cooper, Eeyore & Lizzy: http:// 1.usa.gov/yWzGEI";;;;"169922447246753793";https://twitter.com/lisamurkowski/status/169922447246753793
;2012-02-15 16:35;1;0;"Heading to the Senate floor to explain to my colleagues how AK could be unfairly harmed by the Highway Bill. (C-SPAN2 in moments)";;;;"169912821025488896";https://twitter.com/lisamurkowski/status/169912821025488896
;2012-02-14 17:35;1;0;"Happy Valentine's Day to my husband, Verne - but also Happy 19th Birthday to my son Matt! Love to you both.";;;;"169565450596913153";https://twitter.com/lisamurkowski/status/169565450596913153
;2012-02-14 13:40;1;0;"Every woman needs to know the risks for heart disease, but more importantly, how they can prevent it from happening: http:// 1.usa.gov/zQBWQs";;;;"169506236172206080";https://twitter.com/lisamurkowski/status/169506236172206080
;2012-02-13 15:30;1;0;"I’m happy to announce my Juneau office is now open! Juneauites, if you need to reach me – I’m right down the street: http:// 1.usa.gov/wCFG0V";;;;"169171617530920961";https://twitter.com/lisamurkowski/status/169171617530920961
