username;date;retweets;favorites;text;geo;mentions;hashtags;id;permalink
;2013-08-12 15:07;1;0;"PHOTO: Looking up at the Rotunda at #Idaho State Capitol w/ Congressional Award winners. #education pic.twitter.com/SiP2dxEkrr";;;#Idaho #education;"367014371320270848";https://twitter.com/Raul_Labrador/status/367014371320270848
;2013-08-12 14:45;5;2;"Very good piece by @StephenMooreWSJ in today's @WSJ , "The Budget #Sequester is a Success": http:// goo.gl/KiHLYn";;@StephenMooreWSJ @WSJ;#Sequester;"367008978707824641";https://twitter.com/Raul_Labrador/status/367008978707824641
;2013-08-12 10:20;3;0;"PHOTO: Speaking at the Congressional Award at #Idaho State Capitol pic.twitter.com/qKDIbw5wUQ";;;#Idaho;"366942205669154817";https://twitter.com/Raul_Labrador/status/366942205669154817
;2013-08-12 09:40;2;1;"PHOTO: On the air now, 670 Boise pic.twitter.com/cZ4W8NtNF7";;;;"366932080942256131";https://twitter.com/Raul_Labrador/status/366932080942256131
;2013-08-12 09:38;1;0;"I'll be on 670 KBOI shortly";;;;"366931601130668033";https://twitter.com/Raul_Labrador/status/366931601130668033
;2013-08-09 18:48;3;0;"PHOTO: Thanks to everyone who came to today's town hall in #Council ! pic.twitter.com/KBgrbKTAsn";;;#Council;"365982837150720001";https://twitter.com/Raul_Labrador/status/365982837150720001
;2013-08-09 15:08;2;0;"PHOTO: Over-flight of Sheep Fire and Salvage Sale area. #Grangeville pic.twitter.com/RW01KqWFdL";;;#Grangeville;"365927615619543040";https://twitter.com/Raul_Labrador/status/365927615619543040
;2013-08-09 15:03;2;0;"PHOTO: Mtg in #Grangeville today w/ BLM/Forest Service to discuss timber & wildfire management pic.twitter.com/Vvpg7IRPSs";;;#Grangeville;"365926231302086656";https://twitter.com/Raul_Labrador/status/365926231302086656
;2013-08-09 13:52;2;0;"PHOTO: Mill tour, #Idaho Forest Group, state of the art facility in #Grangeville pic.twitter.com/7l4Qu7jsyn";;;#Idaho #Grangeville;"365908370177261568";https://twitter.com/Raul_Labrador/status/365908370177261568
;2013-08-09 10:26;2;0;"UPDATE: New time for town hall in Adams County today. It will be from 4-5 pm MT. Hope you can make it!: http:// goo.gl/DMWfZ4";;;;"365856613883592705";https://twitter.com/Raul_Labrador/status/365856613883592705
;2013-08-08 22:57;2;0;"PHOTO: Thanks to everyone who came to tonight's town hall in #Grangeville . It was a big success! pic.twitter.com/jyrGs7tEoE";;;#Grangeville;"365683294936903680";https://twitter.com/Raul_Labrador/status/365683294936903680
;2013-08-08 20:09;2;0;"PHOTO: Factory tour today, Ende Machine & Foundry, #Craigmont pic.twitter.com/geivpagxRj";;;#Craigmont;"365640882344570883";https://twitter.com/Raul_Labrador/status/365640882344570883
;2013-08-08 20:06;1;0;"Great day in #Lewiston included a great meeting with the Nez Perce Tribal Committee today";;;#Lewiston;"365640227991199745";https://twitter.com/Raul_Labrador/status/365640227991199745
;2013-08-08 20:01;3;0;"UPDATE: I've added another town hall to the schedule. It will be in Adams County on Friday. Details here: http:// goo.gl/DMWfZ4";;;;"365638911734722561";https://twitter.com/Raul_Labrador/status/365638911734722561
;2013-08-08 17:52;3;0;"PHOTO: Meeting with farmers in #Leland today pic.twitter.com/NkkG1gbgIZ";;;#Leland;"365606485520162818";https://twitter.com/Raul_Labrador/status/365606485520162818
;2013-08-08 09:57;2;0;"And don't forget, we have another town hall in #Grangeville tonight, starting at 7 pm!";;;#Grangeville;"365486971189075969";https://twitter.com/Raul_Labrador/status/365486971189075969
;2013-08-08 09:41;0;0;"PHOTO: Thanks to everyone who came to last night's town hall in #Lewiston . Great crowd and great discussion! pic.twitter.com/WsHNU2Atm8";;;#Lewiston;"365482793112846336";https://twitter.com/Raul_Labrador/status/365482793112846336
;2013-08-07 11:48;3;0;"Don't forget, we have a town hall in #Lewiston tonight, another one in #Grangeville tomorrow. Next week is Meridian: http:// goo.gl/vpSiv2";;;#Lewiston #Grangeville;"365152598627590145";https://twitter.com/Raul_Labrador/status/365152598627590145
;2013-08-02 14:27;2;0;"Please read my weekly e-newsletter, "A Big Win for #Idaho 's Rural Communities": http:// labrador.house.gov/e-newsletter/";;;#Idaho;"363380537945096192";https://twitter.com/Raul_Labrador/status/363380537945096192
;2013-08-02 14:17;3;0;"ADVISORY: Labrador to Host Town Halls in #Meridian , #Lewiston , & #Grangeville : http:// goo.gl/D1A8bP";;;#Meridian #Lewiston #Grangeville;"363378025183707136";https://twitter.com/Raul_Labrador/status/363378025183707136
;2013-08-02 13:30;2;0;"RELEASE: Labrador Votes for #REINS Act: http:// goo.gl/pXLnJu";;;#REINS;"363366225998385153";https://twitter.com/Raul_Labrador/status/363366225998385153
;2013-08-02 10:51;4;1;"ADVISORY: Labrador to Visit #California & #Arizona as part of Congressional #Southwest Border Trip: http:// goo.gl/xMVop2 #immigration";;;#California #Arizona #Southwest #immigration;"363326122324271106";https://twitter.com/Raul_Labrador/status/363326122324271106
;2013-07-31 13:48;3;0;"RELEASE/VIDEO: Labrador Plan to Empower #Idaho 's Rural Communities Approved by @NatResources : http:// goo.gl/Oq6aiH #SRS";;@NatResources;#Idaho #SRS;"362646012508114944";https://twitter.com/Raul_Labrador/status/362646012508114944
;2013-07-26 16:02;11;1;"Please read my weekly e-newsletter about our fight in Congress 2 stop #NSA 's surveillance prgm of innocent Americans: http:// goo.gl/8QFWfc";;;#NSA;"360867621899485185";https://twitter.com/Raul_Labrador/status/360867621899485185
;2013-07-24 21:09;0;0;"@dysinger It was self-deprecating humor. I was referring to myself and all conservatives who voted for the amendment.";;@dysinger;;"360220107403837440";https://twitter.com/Raul_Labrador/status/360220107403837440
;2013-07-24 16:44;103;15;"I'll be voting 4 #AmashConyers amendment to stop #NSA surveillance of innocent Americans. RT to show your support! @repjustinamash";;@repjustinamash;#AmashConyers #NSA;"360153524904005632";https://twitter.com/Raul_Labrador/status/360153524904005632
;2013-07-24 08:54;2;0;"Don't forget, we have Conversations with Conservatives today, starting at 11:30 AM ET. Watch live here: http:// goo.gl/2LUMvH #CWC";;;#CWC;"360035360652271617";https://twitter.com/Raul_Labrador/status/360035360652271617
;2013-07-23 13:43;2;0;"For more info on Conversations with Conservatives, go to: http:// goo.gl/R3P3Om #CWC";;;#CWC;"359745562230272001";https://twitter.com/Raul_Labrador/status/359745562230272001
;2013-07-23 13:33;3;0;"The next Conversations with Conservatives will be tomorrow, July 24 at 11:30 AM ET. Watch live here: http:// goo.gl/2LUMvH #CWC";;;#CWC;"359742971635175424";https://twitter.com/Raul_Labrador/status/359742971635175424
;2013-07-19 15:20;3;0;"ICYMI: I talked with @IngrahamAngle about #immigration reform yesterday. Very good discussion. Listen here: http:// goo.gl/aeTw8";;@IngrahamAngle;#immigration;"358320514231582720";https://twitter.com/Raul_Labrador/status/358320514231582720
;2013-07-19 13:26;3;2;"Very proud to vote for Student Success Act, landmark education bill that will encourage federalism & innovation: http:// goo.gl/Z49yj";;;;"358291685941321730";https://twitter.com/Raul_Labrador/status/358291685941321730
;2013-07-18 09:04;15;4;"Very pleased the House has voted to protect all Americans from #Obamacare ’s employer & individual mandates: http:// goo.gl/gCpHm";;;#Obamacare;"357863380071088128";https://twitter.com/Raul_Labrador/status/357863380071088128
;2013-07-18 08:02;4;0;"I'll be on @IngrahamAngle at 9:30 am today to discuss #immigration . Check local listings: http://www. lauraingraham.com/stationfinder";;@IngrahamAngle;#immigration;"357847913466036224";https://twitter.com/Raul_Labrador/status/357847913466036224
;2013-07-15 09:55;3;1;"VIDEO: Proud to join @AllenWest for @Next_GenTV interview on #ObamaCare & #immigration : http:// goo.gl/mt4vr";;@AllenWest @Next_GenTV;#ObamaCare #immigration;"356789163770650625";https://twitter.com/Raul_Labrador/status/356789163770650625
;2013-07-11 08:55;3;1;"VIDEO: I was on PBS @NewsHour last night discussing #immigration . My part starts at 07:54: http:// goo.gl/FpVrr";;@NewsHour;#immigration;"355324433579253760";https://twitter.com/Raul_Labrador/status/355324433579253760
;2013-07-10 16:48;3;3;"I'll be on PBS @Newshour tonight talking about #immigration . Please check local listings.";;@Newshour;#immigration;"355081145177739265";https://twitter.com/Raul_Labrador/status/355081145177739265
;2013-07-10 15:24;5;2;"VIDEO: I discussed #immigration reform with @NowWithAlex on @msnbc today: http:// nbcnews.to/15wCI7V";;@NowWithAlex @msnbc;#immigration;"355059890101821440";https://twitter.com/Raul_Labrador/status/355059890101821440
;2013-07-10 09:53;4;1;"I'll be on @NowWithAlex on @MSNBC at 12:15 pm ET/10:15 am MT today. Topic: #Immigration . Please tune in!";;@NowWithAlex @MSNBC;#Immigration;"354976606701363200";https://twitter.com/Raul_Labrador/status/354976606701363200
;2013-07-01 00:04;3;0;"Pray for their families - “ @RepGosar : My heart weeps for those who lost their lives and were affected by today’s Yarnell Hill Fire. #AZ ”";;@RepGosar;#AZ;"351566918613872640";https://twitter.com/Raul_Labrador/status/351566918613872640
;2013-06-28 08:23;2;0;"Proud to vote for #SKILLSAct , which has been approved by @HouseJudiciary : http:// goo.gl/uVFTU";;@HouseJudiciary;#SKILLSAct;"350605338304712705";https://twitter.com/Raul_Labrador/status/350605338304712705
;2013-06-25 11:21;2;1;"An example to all, Velma Morrison’s love of the arts & philanthropic spirit will be missed. Our thoughts and prayers are with her family.";;;;"349563047603486721";https://twitter.com/Raul_Labrador/status/349563047603486721
;2013-06-21 09:29;12;3;"Still no good answers from @TheJusticeDept on discrepancies in Eric Holder's testimony: http:// goo.gl/X0NcA @HouseJudiciary";;@TheJusticeDept @HouseJudiciary;;"348085284459659266";https://twitter.com/Raul_Labrador/status/348085284459659266
;2013-06-20 15:05;4;1;"Bowe Bergdahl & his family continue to be in my thoughts and prayers; #Idaho delegation is following news closely: http:// goo.gl/0XkHF";;;#Idaho;"347807329472872448";https://twitter.com/Raul_Labrador/status/347807329472872448
;2013-06-20 11:59;19;9;"Proud to cosponsor my friend @repjustinamash ‘s bill to scale back #NSA surveillance: http:// goo.gl/p2nzS";;@repjustinamash;#NSA;"347760563578880000";https://twitter.com/Raul_Labrador/status/347760563578880000
;2013-06-20 11:57;6;0;"So, @FBIPressOffice : Why can't you tell us how many #drones we have? Did we lose any to Mexico?: http:// goo.gl/X7joq #fastandfurious";;@FBIPressOffice;#drones #fastandfurious;"347760201513967619";https://twitter.com/Raul_Labrador/status/347760201513967619
;2013-06-19 14:13;2;1;"VIDEO:Speaking at @TPPatriots rally "Audit the #IRS " today on Capitol Hill: http:// goo.gl/Z2ZcP";;@TPPatriots;#IRS;"347432052997632000";https://twitter.com/Raul_Labrador/status/347432052997632000
;2013-06-19 11:46;4;0;"Proud to vote 4 #SAFE Act, important step in fixing broken #immigration system: http:// goo.gl/ZS38b @HouseJudiciary";;@HouseJudiciary;#SAFE #immigration;"347395066815447040";https://twitter.com/Raul_Labrador/status/347395066815447040
;2013-06-17 09:49;1;0;"Very glad @NatResources approved my bill, HR 657, the Grazing Improvement Act: http:// goo.gl/4rwGj";;@NatResources;;"346640827046572033";https://twitter.com/Raul_Labrador/status/346640827046572033
;2013-06-14 08:34;4;0;"Happy Flag Day & Happy 238th Birthday to @USArmy !";;@USArmy;;"345534709301919744";https://twitter.com/Raul_Labrador/status/345534709301919744
;2013-06-14 08:28;8;2;"Must-read by @PeggyNoonanNYC on #NSA , #IRS + other govt abuses: Privacy Isn't All We're Losing: http:// goo.gl/1rzrm";;@PeggyNoonanNYC;#NSA #IRS;"345533171842023424";https://twitter.com/Raul_Labrador/status/345533171842023424
;2013-06-14 08:24;4;2;"Great piece by @GeorgeWillRSS - Scowling Face of the State: http:// dlvr.it/3W5Phj #NSA #IRS";;@GeorgeWillRSS;#NSA #IRS;"345532243936169985";https://twitter.com/Raul_Labrador/status/345532243936169985
;2013-06-13 15:51;4;0;"VIDEO: I questioned #FBI Director Mueller about Administration abuses at today's @HouseJudiciary hearing: http:// goo.gl/SQoEa #NSA";;@HouseJudiciary;#FBI #NSA;"345282185131069440";https://twitter.com/Raul_Labrador/status/345282185131069440
;2013-06-13 10:59;3;2;"VIDEO: I was on @foxandfriends this morning talking about #immigration + #NSA surveillance: http:// goo.gl/8iRtA";;@foxandfriends;#immigration #NSA;"345208896333438977";https://twitter.com/Raul_Labrador/status/345208896333438977
;2013-06-13 09:09;3;1;"Very good perspective on #IRS scandal by @RichLowry - "The Cincinnati Lie": http:// goo.gl/9ctRF";;@RichLowry;#IRS;"345181091931488256";https://twitter.com/Raul_Labrador/status/345181091931488256
;2013-06-12 18:04;3;1;"I'll be on @IngrahamAngle tomorrow at 9:30 am ET/7:30 ET to talk about #immigration + other news. Tune in live here: http://www. lauraingraham.com /";;@IngrahamAngle;#immigration;"344953307091054593";https://twitter.com/Raul_Labrador/status/344953307091054593
;2013-06-12 16:34;1;1;"I'll be on @foxandfriends tomorrow at 6:45 am MT/8:45 ET to talk about #immigration + news of the day. Hope you can tune in.";;@foxandfriends;#immigration;"344930682017030144";https://twitter.com/Raul_Labrador/status/344930682017030144
;2013-06-12 10:51;11;2;"VIDEO: Watch my House floor speech today, talking about #NSA abuse of power + need for #PatriotAct reexamination: http:// goo.gl/ZtaaM";;;#NSA #PatriotAct;"344844398120558593";https://twitter.com/Raul_Labrador/status/344844398120558593
;2013-06-12 08:12;21;4;"Check out my new op-ed in @TheHill : "Perils of the #PatriotAct ": http:// goo.gl/XgRBR #NSA abuse of power must stop; Congress must act.";;@TheHill;#PatriotAct #NSA;"344804307071295488";https://twitter.com/Raul_Labrador/status/344804307071295488
;2013-06-11 08:57;14;5;"Very good piece by @Instapundit : Abuse of Power -- the Common Thread in the Obama Scandals http://www. usatoday.com/story/opinion/ 2013/06/10/nsa-spying-obama-column/2405991/ … … #NSA #IRS";;@Instapundit;#NSA #IRS;"344453451616505856";https://twitter.com/Raul_Labrador/status/344453451616505856
;2013-06-07 15:46;8;0;"When it comes to #NSA , even @NYTimes Editorial Board says "Administration has now lost all credibility": http:// goo.gl/WNfxC @WhiteHouse";;@NYTimes @WhiteHouse;#NSA;"343106771902152705";https://twitter.com/Raul_Labrador/status/343106771902152705
;2013-06-07 10:06;30;9;"Proud to join w/ @repjustinamash , signing letter to #NSA & #FBI demanding answers on #PatriotAct tracking: http:// facebook.com/repjustinamash /posts/556394431066634 … ….";;@repjustinamash;#NSA #FBI #PatriotAct;"343021190882922498";https://twitter.com/Raul_Labrador/status/343021190882922498
;2013-06-06 13:06;5;0;"Crazy, I agree RT @algore In digital era, privacy must be a priority. Is it just me, or is secret blanket surveillance obscenely outrageous?";;@algore;;"342704016893026304";https://twitter.com/Raul_Labrador/status/342704016893026304
;2013-06-06 10:06;1;0;"On this 69th anniversary of #DDay , I am grateful for all those who served our country in WWII + kept the world safe 4 freedom.";;;#DDay;"342658867576049664";https://twitter.com/Raul_Labrador/status/342658867576049664
;2013-06-05 18:59;56;8;"I left Group of 8 #immigration talks today; after today's meeting, framework of bill had changed in a way that I could no longer support";;;#immigration;"342430552428797952";https://twitter.com/Raul_Labrador/status/342430552428797952
;2013-06-05 15:09;1;0;"@WhiteHouse : Where incompetence gets you promoted: 1st Stephen Seok at #IRS , now @AmbassadorRice , http:// goo.gl/4UcLK";;@WhiteHouse @AmbassadorRice;#IRS;"342372510630821888";https://twitter.com/Raul_Labrador/status/342372510630821888
;2013-06-05 10:37;6;1;"9 years ago today, one of America's greatest leaders, Ronald Reagan, passed away. Let's reflect on his vision 4 America + vow 2 protect it.";;;;"342304126656475136";https://twitter.com/Raul_Labrador/status/342304126656475136
;2013-06-05 10:36;2;0;"@UNrightswire: Iran must release #Boise pastor Saeed Abedin and do it now. RT if you agree. http:// goo.gl/NozA4 @FreePastorSaeed";;@UNrightswire @FreePastorSaeed;#Boise;"342303944321691648";https://twitter.com/Raul_Labrador/status/342303944321691648
;2013-06-04 18:24;3;0;"VIDEO: I questioned witnesses at today's @NatResources hearing on #ESA abuses + need for reform, not litigation: http:// goo.gl/k9F4d";;@NatResources;#ESA;"342059341576282113";https://twitter.com/Raul_Labrador/status/342059341576282113
;2013-06-03 15:20;0;0;"Learn about changes to my DC + #Idaho teams. New staffers will keep top-notch constituent service & policy expertise: http://goo.gl/c4TrM";;;#Idaho;"341650729582346240";https://twitter.com/Raul_Labrador/status/341650729582346240
;2013-05-22 15:46;3;0;"House Oversight Committee also has a general whistleblower site: http:// tinyurl.com/36wssuf";;;;"337308415003074561";https://twitter.com/Raul_Labrador/status/337308415003074561
;2013-05-22 15:45;7;0;"Check out the House Ways & Means site to share your story of IRS political discrimination: http:// tinyurl.com/nloyhkm";;;;"337308136035717121";https://twitter.com/Raul_Labrador/status/337308136035717121
;2013-05-13 09:40;4;1;"This is completely unacceptable. http://www. usatoday.com/story/news/pol itics/2013/05/10/irs-apology-conservative-groups-2012-election/2149939/ …";;;;"333954973329137664";https://twitter.com/Raul_Labrador/status/333954973329137664
;2013-05-10 12:05;7;2;"I have cosponsored H.Res.36 which would establish a House Select Committee to investigate the Benghazi attack | http:// online.wsj.com/article/SB1000 1424127887324244304578473350240211308.html?mod=WSJ_Opinion_AboveLEFTTop …";;;;"332904346205446144";https://twitter.com/Raul_Labrador/status/332904346205446144
;2013-05-10 11:48;1;0;"Rep. Labrador talks about reforming the federal land in Idaho | http://www. ktvb.com/on-tv/viewpoin t/May-5---US-Congressman-Raul-Labrador-talks-about-reforming-the-federal-land-in-Idaho-206332121.html …";;;;"332899979809148929";https://twitter.com/Raul_Labrador/status/332899979809148929
;2013-05-07 16:16;4;2;"Great meeting with Idaho members of the Women's Mining Coalition. pic.twitter.com/UsA6UImtZ3";;;;"331880218207846401";https://twitter.com/Raul_Labrador/status/331880218207846401
;2013-05-06 15:06;2;1;"Worth the read: Republicans are doing more with less to fix the budget http:// dyn.politico.com/printstory.cfm ?uuid=9305702C-6A7F-49E6-B049-76EEEAFA4D06 …";;;;"331500128491958273";https://twitter.com/Raul_Labrador/status/331500128491958273
;2013-05-06 11:06;3;0;"Labrador carries independence to D.C. via @SpokesmanReview http://www. spokesman.com/stories/2013/m ay/05/labrador-carries-independence-to-dc/ …";;@SpokesmanReview;;"331439940539928576";https://twitter.com/Raul_Labrador/status/331439940539928576
;2013-05-03 16:17;0;0;"Enjoyed lunch with business owners in Nampa this week. pic.twitter.com/3FUH5QXT55";;;;"330431061588836352";https://twitter.com/Raul_Labrador/status/330431061588836352
;2013-05-03 12:33;2;0;"Please be sure to tune into Channel 7 on Sunday at 9 a.m. to watch Rep. Labrador on Viewpoint. http://www. ktvb.com/news/Labrador- ready-for-battle-over-immigration-reform-205888621.html …";;;;"330374601467101184";https://twitter.com/Raul_Labrador/status/330374601467101184
;2013-05-02 12:26;0;0;"Great meeting with ranchers and elected officials in Owyhee County. I look forward to continuing to work with them.";;;;"330010500299640832";https://twitter.com/Raul_Labrador/status/330010500299640832
;2013-05-01 12:41;0;0;"Idaho Delegation Encourages Public Comment On Gateway West Project EIS | http:// labrador.house.gov/press-releases /idaho-delegation-encourages-public-comment-on-gateway-west-project-eis/ …";;;;"329651747251433474";https://twitter.com/Raul_Labrador/status/329651747251433474
;2013-04-30 16:44;4;0;"Worth the read: The Coming ObamaCare Shock http:// online.wsj.com/article/SB1000 1424127887324874204578441032081716170.html?mod=WSJ_Opinion_LEADTop …";;;;"329350620094009346";https://twitter.com/Raul_Labrador/status/329350620094009346
;2013-04-29 09:59;3;2;"Families in this economy have had to increase their thrift and frugality. Wash., DC must also exercise the common sense to practice its own.";;;;"328886191007084544";https://twitter.com/Raul_Labrador/status/328886191007084544
;2013-04-24 17:44;1;0;"Enjoyed today’s Conversations with Conservatives. Lots of interesting discussion about immigration and fiscal issues. pic.twitter.com/Trptw1E4E9";;;;"327191428067373056";https://twitter.com/Raul_Labrador/status/327191428067373056
;2013-04-24 09:21;3;0;"Conversations with Conservatives starts soon at 11:00 a.m. EDT. Check Twitter for #cwc113 - http:// labrador.house.gov/press-releases /conversations-with-conservatives-april-2013/ …";;;#cwc113;"327064836003491840";https://twitter.com/Raul_Labrador/status/327064836003491840
;2013-04-23 17:29;0;0;"Have a question you would want asked at a hearing about federal impediments to water rights? Please let me know! https://www. facebook.com/raul.r.labrado r/posts/576826862350898 …";;;;"326825117038542848";https://twitter.com/Raul_Labrador/status/326825117038542848
;2013-04-22 16:34;1;1;"The next Conversations with Conservatives is this Wednesday at 11:00 a.m. EDT, check Twitter on Wednesday for #cwc113 http:// labrador.house.gov/press-releases /conversations-with-conservatives-april-2013/ …";;;#cwc113;"326448947990257664";https://twitter.com/Raul_Labrador/status/326448947990257664
;2013-04-18 11:32;0;0;"ICYMI: The Atlantic highlights Rep. Labrador's principled stands on issues like immigration in Congress. http://www. theatlantic.com/politics/archi ve/2013/04/does-the-fate-of-immigration-reform-depend-on-this-idaho-congressman/275029/ …";;;;"324923314260811777";https://twitter.com/Raul_Labrador/status/324923314260811777
;2013-04-17 10:25;1;0;"ICYMI: Financial Times profile about Rep. Labrador's key role in the immigration debate http://www. ft.com/intl/cms/s/0/9 70c6310-a37a-11e2-8f9c-00144feabdc0.html …";;;;"324544191235506177";https://twitter.com/Raul_Labrador/status/324544191235506177
;2013-04-16 09:36;2;0;"#PrayForBoston , the victims and their families in this difficult time. pic.twitter.com/exqvGE6xcF";;;#PrayForBoston;"324169452558114817";https://twitter.com/Raul_Labrador/status/324169452558114817
;2013-04-15 15:29;0;0;"My prayers go out to everyone impacted by the tragedy at the Boston Marathon.";;;;"323895915242999809";https://twitter.com/Raul_Labrador/status/323895915242999809
;2013-04-15 09:00;12;0;"Today is Tax Day. It serves as a reminder that a simpler and fairer tax code is a better platform for more jobs and a more robust economy.";;;;"323797936402231296";https://twitter.com/Raul_Labrador/status/323797936402231296
;2013-04-12 19:01;2;0;"At a hearing this week, I questioned USFS Chief Tom Tidwell about the effectiveness of the SRS program. http:// youtu.be/NNErQzuNq1c";;;;"322861983508602880";https://twitter.com/Raul_Labrador/status/322861983508602880
;2013-04-10 11:33;1;1;"Great to join Sen. @TomCoburn to examine wasteful spending at the DOJ. Gov't must be responsible w/ taxpayers’ money. http:// judiciary.house.gov/news/04092013. html …";;@TomCoburn;;"322024622826594307";https://twitter.com/Raul_Labrador/status/322024622826594307
;2013-04-10 11:07;4;1;"President Obama’s budget is late and misguided. It keeps us on the path of debt and decline with more spending and more taxes.";;;;"322018024137830400";https://twitter.com/Raul_Labrador/status/322018024137830400
;2013-04-09 14:35;9;2;"Plenty of ways to cut spending: New GAO report finds billions wasted annually on duplicative federal programs http://www. usatoday.com/story/news/pol itics/2013/04/09/wasteful-government-spending/2063511/ …";;;;"321707970729762816";https://twitter.com/Raul_Labrador/status/321707970729762816
;2013-04-08 15:04;0;0;"Former British Prime Minister Margaret Thatcher inspired a generation of leaders through her convictions. http:// labrador.house.gov/press-releases /congressman-labrador-statement-on-the-passing-of-former-prime-minister-margaret-thatcher/ …";;;;"321352900876054528";https://twitter.com/Raul_Labrador/status/321352900876054528
;2013-04-06 15:15;6;1;"ICYMI: Bloomberg profile about Rep. Labrador as top Republican on immigration reform http://www. bloomberg.com/news/2013-04-0 5/puerto-rico-born-labrador-top-republican-on-immigration.html …";;;;"320630804952793088";https://twitter.com/Raul_Labrador/status/320630804952793088
;2013-04-04 16:54;0;0;"Enjoyed meeting with juniors and seniors on Tuesday at New Plymouth High School. pic.twitter.com/a2QEFnSbXs";;;;"319930921954447360";https://twitter.com/Raul_Labrador/status/319930921954447360
;2013-04-04 08:53;0;1;"Great to talk with business owners and leaders about events in Congress and the business climate in Payette County. pic.twitter.com/WG5qB9ehqX";;;;"319809954137661441";https://twitter.com/Raul_Labrador/status/319809954137661441
;2013-04-01 13:39;4;2;"ICYMI: Rep. Labrador Op-Ed: Immigration Reform -- A Conservative Approach http://www. latimes.com/news/opinion/c ommentary/la-oe-0331-labrador-immigration-tea-party-20130331,0,5351681.story …";;;;"318794856375934976";https://twitter.com/Raul_Labrador/status/318794856375934976
;2013-03-31 11:50;1;2;"Happy Easter! I hope you have a wonderful time with your loved ones on this beautiful day.";;;;"318404830836166656";https://twitter.com/Raul_Labrador/status/318404830836166656
;2013-03-28 12:54;3;2;"Lots of great points in this article about Congressional oversight. Worth the read: http:// nationalinterest.org/article/congre ssional-abdication-8138 …";;;;"317334010101628929";https://twitter.com/Raul_Labrador/status/317334010101628929
