username;date;retweets;favorites;text;geo;mentions;hashtags;id;permalink
;2017-06-14 08:36;14;29;"(2 of 2) Thank you to all those who reached out expressing concern. My staff and I were not present. We are fine.";;;;"874983798177398785";https://twitter.com/Raul_Labrador/status/874983798177398785
;2017-06-14 08:35;21;32;"My thoughts and prayers are with @SteveScalise and all those affected by today's shooting. Grateful to Capitol Police. (1 of 2)";;@SteveScalise;;"874983705655357441";https://twitter.com/Raul_Labrador/status/874983705655357441
;2017-06-13 16:28;2;9;"(2 of 2) It will give @DeptVetAffairs Secretary power to expeditiously remove, demote, or suspend any employee 4 performance or misconduct.";;@DeptVetAffairs;;"874740217990848513";https://twitter.com/Raul_Labrador/status/874740217990848513
;2017-06-13 16:27;3;9;"Our #vets deserve the best. That’s why I just voted 4 (& the House passed) a great bill to improve @DeptVetAffairs accountability (1 of 2)";;@DeptVetAffairs;#vets;"874740130875047938";https://twitter.com/Raul_Labrador/status/874740130875047938
;2017-06-13 10:08;0;2;"It was great meeting with @AARPIdaho leaders - Dr. Tom Trail (AARP #Idaho State President) & Lupe Wissel (AARP Idaho State Director) pic.twitter.com/l30tVKhzmO";;@AARPIdaho;#Idaho;"874644693530882049";https://twitter.com/Raul_Labrador/status/874644693530882049
;2017-06-12 15:13;1;7;"Glad 2 meet Jacob Folwell of Caldwell, grand prize winner of Youth Video & Poster Contest by @ISRI & @JASONLearning : http:// goo.gl/TtCr9D pic.twitter.com/pQynQsSUik";;@ISRI @JASONLearning;;"874359022606069761";https://twitter.com/Raul_Labrador/status/874359022606069761
;2017-06-09 14:11;5;9;"#CHOICEAct passage great news for Main Street #Idaho & small banks, credit unions. More in newsletter: http:// bit.ly/2rewzfh pic.twitter.com/AXcQ56KSm9";;;#CHOICEAct #Idaho;"873256181711724545";https://twitter.com/Raul_Labrador/status/873256181711724545
;2017-06-09 12:37;0;1;"VIDEO: Speaking at @NatResources hearing on how litigation & bureaucracy are hurting national forest management: http:// goo.gl/jxrkmE";;@NatResources;;"873232690031595521";https://twitter.com/Raul_Labrador/status/873232690031595521
;2017-06-09 09:57;3;12;". @RepGoodlatte & I have introduced a bill 2 to reform our #refugee program/strengthen #security : http:// goo.gl/7Jxr8i @HouseJudiciary";;@RepGoodlatte @HouseJudiciary;#refugee #security;"873192428559323137";https://twitter.com/Raul_Labrador/status/873192428559323137
;2017-06-08 16:49;2;8;"Plaudits to @SecretaryZinke for thinking of real people in #Idaho and the West on sage grouse policy: More: http:// bit.ly/2s10hsm pic.twitter.com/rjMMIqRisO";;@SecretaryZinke;#Idaho;"872933523354726401";https://twitter.com/Raul_Labrador/status/872933523354726401
;2017-06-08 14:32;7;21;"So far this year, the #Republican -led House has passed 158 bills, making it the most productive in the modern era: http:// goo.gl/oec158";;;#Republican;"872899221812326400";https://twitter.com/Raul_Labrador/status/872899221812326400
;2017-06-08 11:05;2;5;"Hearing will explore how litigation & red tape hurt forest health, costs jobs, waste timber. Watch at noon MT: http:// bit.ly/2rZTmPQ pic.twitter.com/4NfSdNlTzr";;;;"872846992862568450";https://twitter.com/Raul_Labrador/status/872846992862568450
;2017-06-07 12:09;30;65;"Proud 2 cosponsor @RepMarkMeadows ' bill 2 improve #infrastructure by removing outdated regulations & updating tech: http:// goo.gl/a83Kpp";;@RepMarkMeadows;#infrastructure;"872500887268331525";https://twitter.com/Raul_Labrador/status/872500887268331525
;2017-06-07 10:07;22;31;"Congress should not reauthorize Section 702 of #FISA w/out real, meaningful safeguards 4 the American people. More: http:// goo.gl/w5Xioc";;;#FISA;"872470133083709441";https://twitter.com/Raul_Labrador/status/872470133083709441
;2017-06-06 16:40;3;7;"Congrats to Mark Schell of Athol enrolling @AF_Academy , Mitchell McHugh of Post Falls @WestPoint_USMA . More: http:// bit.ly/2sdYkcy pic.twitter.com/gTiUnfhQkZ";;@AF_Academy @WestPoint_USMA;;"872206636676374529";https://twitter.com/Raul_Labrador/status/872206636676374529
;2017-06-06 10:43;7;14;"Remembering D-Day: @IdahoStatesman has video http:// bit.ly/2rI2tCT , Ernie Pyle http:// bit.ly/2s0fCtG & story http:// bit.ly/2qTCK9a pic.twitter.com/ucA0S4bhze";;@IdahoStatesman;;"872116698349961217";https://twitter.com/Raul_Labrador/status/872116698349961217
;2017-06-05 15:44;36;78;"Great op-ed in @TheHill : Davis-Oliver Act Would Make Trump's #Immigration Agenda Law of the Land: http:// goo.gl/4j3xPG @FAIRImmigration";;@TheHill @FAIRImmigration;#Immigration;"871830111615627265";https://twitter.com/Raul_Labrador/status/871830111615627265
;2017-06-05 13:26;5;2;"PSA for #Idaho 's #Veterans : @DeptVetAffairs & @ENERGY are looking 4 volunteers 4 new health research program: http:// goo.gl/ct35tS";;@DeptVetAffairs @ENERGY;#Idaho #Veterans;"871795313488654336";https://twitter.com/Raul_Labrador/status/871795313488654336
;2017-06-02 10:45;5;11;"It's important we honor #veterans every day. My top focus is constituent service. Today's Labrador Letter: http:// bit.ly/2qIEJgo pic.twitter.com/AW715aSNIU";;;#veterans;"870667812167180288";https://twitter.com/Raul_Labrador/status/870667812167180288
;2017-05-30 12:03;2;9;"#MemorialDay17 speech included tribute to family member killed on the USS Arizona Dec. 7, 1941. My remarks: http:// bit.ly/2sitJXr pic.twitter.com/UkkeyCs6SJ";;;#MemorialDay17;"869600232459440129";https://twitter.com/Raul_Labrador/status/869600232459440129
;2017-05-29 12:07;5;25;"A great honor to attend #MemorialDay17 ceremony at Idaho State Veterans Cemetery. God bless those who serve and their families. pic.twitter.com/JeBTuTd2un";;;#MemorialDay17;"869238858805727232";https://twitter.com/Raul_Labrador/status/869238858805727232
;2017-05-26 14:26;8;34;"1st step in fixing our #immigration system is enforcing existing law. This week @HouseJudiciary made progress. More: http:// goo.gl/aGKQ5U";;@HouseJudiciary;#immigration;"868186636479320066";https://twitter.com/Raul_Labrador/status/868186636479320066
;2017-05-26 12:37;0;5;"Congratulations to 3 Centennial High #Idaho students for best commercial in @National_BPA competition! http:// bit.ly/2riSVRr";;@National_BPA;#Idaho;"868159082598989826";https://twitter.com/Raul_Labrador/status/868159082598989826
;2017-05-26 10:02;0;5;"It was great meeting Amy Little, Pres/CEO of the #Idaho Nonprofit Center. I enjoyed hearing about @idahononprofits & their valuable work. pic.twitter.com/RWLkYAlSRL";;@idahononprofits;#Idaho;"868120101492592641";https://twitter.com/Raul_Labrador/status/868120101492592641
;2017-05-25 15:14;2;6;"Today I was honored to meet Det. Eric Kjorness of #Moscow who received the Missing Children’s Child Protection Award from @TheJusticeDept pic.twitter.com/nv3Qe7hHYc";;@TheJusticeDept;#Moscow;"867836225482137605";https://twitter.com/Raul_Labrador/status/867836225482137605
;2017-05-25 10:06;2;9;"Kudos to #Eagle High School for being recognized by @NAMM for having one of the #best music education programs in America. Very exciting!";;@NAMM;#Eagle #best;"867758747271274496";https://twitter.com/Raul_Labrador/status/867758747271274496
;2017-05-24 17:29;3;7;"Had a great meeting w/ Gen Sayler & staff from the Governor’s office to discuss how to get the F-35’s in #Idaho @GowenStrong @124FighterWing";;@GowenStrong @124FighterWing;#Idaho;"867507782865436672";https://twitter.com/Raul_Labrador/status/867507782865436672
;2017-05-24 16:20;4;3;"ICYMI: Oversight Hearing Examines Impacts of Federal Natural Resources Laws Gone Astray: http:// goo.gl/I5xHej @NatResources";;@NatResources;;"867490564639531008";https://twitter.com/Raul_Labrador/status/867490564639531008
;2017-05-24 15:22;10;39;"Very pleased @HouseJudiciary approved my bill to strengthen #immigration enforcement. Details: http:// goo.gl/58eIgt";;@HouseJudiciary;#immigration;"867475937180471299";https://twitter.com/Raul_Labrador/status/867475937180471299
;2017-05-23 16:36;2;9;"Today, I supported House passage of 6 bills to improve benefits for #Idaho 's #veterans . We can't forget our heroes: http:// goo.gl/jo76zM";;;#Idaho #veterans;"867132052193280000";https://twitter.com/Raul_Labrador/status/867132052193280000
;2017-05-22 14:39;3;17;"It was great meeting w/ students from Christian Center School in Hayden, #Idaho . They came all the way to #DC & I'm so glad they stopped by. pic.twitter.com/8LiHBZl6LU";;;#Idaho #DC;"866740244162502656";https://twitter.com/Raul_Labrador/status/866740244162502656
;2017-05-22 10:25;0;8;"Kudos to @boisestatelive undergrads testing TULIPS device at @NASA all week. More: http:// bit.ly/2rKZ84B & https:// go.nasa.gov/2fl7qhl pic.twitter.com/0KBVF0MQbA";;@boisestatelive @NASA;;"866676306750164993";https://twitter.com/Raul_Labrador/status/866676306750164993
;2017-05-19 10:33;4;10;"Marking #NationalPoliceWeek , Idahoans joined the nation in honoring those who serve and protect. More: http:// bit.ly/2q11H21 pic.twitter.com/RfibNHEAF2";;;#NationalPoliceWeek;"865591172684754944";https://twitter.com/Raul_Labrador/status/865591172684754944
;2017-05-18 12:25;2;6;"VIDEO: Speaking at @HouseJudiciary markup on Davis-Oliver Act, my #immigration enforcement bill: https:// youtu.be/trQld59bMd4";;@HouseJudiciary;#immigration;"865256976196009984";https://twitter.com/Raul_Labrador/status/865256976196009984
;2017-05-18 11:35;1;8;"Honored to receive @Club4Growth "Defender of Economic #Freedom " Award; one of only 31 Members of #Congress to receive it pic.twitter.com/3Lm3YuP2Xx";;@Club4Growth;#Freedom #Congress;"865244579674693632";https://twitter.com/Raul_Labrador/status/865244579674693632
;2017-05-18 07:31;34;52;"Check out my op-ed w/ @RepGoodlatte about my #immigration enforcement bill being considered by @HouseJudiciary 2day: http:// goo.gl/ZBbrUo";;@RepGoodlatte @HouseJudiciary;#immigration;"865183126192103424";https://twitter.com/Raul_Labrador/status/865183126192103424
;2017-05-17 08:59;1;2;"I'll be live w/ @BumpColley on @topstoryklix at 8:15 am MT. Topic: my new #immigration enforcement bill. Tune in: http:// newsradio1310.com /";;@BumpColley @topstoryklix;#immigration;"864842740315684864";https://twitter.com/Raul_Labrador/status/864842740315684864
;2017-05-17 06:35;4;10;"I'll be live w/ @kevinmillershow at 6:00 am MT 2 talk about my new #immigration enforcement bill. Tune in here: http:// 580kido.com /";;@kevinmillershow;#immigration;"864806530260094976";https://twitter.com/Raul_Labrador/status/864806530260094976
;2017-05-16 17:29;10;21;". @RepGoodlatte & I just introduced a new bill to strengthen #immigration enforcement. Details: http:// goo.gl/l1jX2Y @HouseJudiciary";;@RepGoodlatte @HouseJudiciary;#immigration;"864608701751189504";https://twitter.com/Raul_Labrador/status/864608701751189504
;2017-05-16 16:15;1;2;"I'll be live w/ @NateShelman at 3:35 pm MT 2 talk about my new #immigration enforcement bill. Tune in here: http://www. kboi.com @kboi670";;@NateShelman @kboi670;#immigration;"864590049022758912";https://twitter.com/Raul_Labrador/status/864590049022758912
;2017-05-14 10:05;1;15;"Happy #MothersDay to my wonderful wife Becca and all the moms who help make America a better place. More: http:// bit.ly/2r1i7ve";;;#MothersDay;"863772216709611521";https://twitter.com/Raul_Labrador/status/863772216709611521
;2017-05-12 11:05;2;31;"In 1992 my wife Becca carried our 1st child as we graduated. That baby now has his @BYU diploma. More: http:// bit.ly/2r1i7ve pic.twitter.com/xbgTbXqbYb";;@BYU;;"863062696522117120";https://twitter.com/Raul_Labrador/status/863062696522117120
;2017-05-11 16:38;0;0;"@CdAPressNews profiles Art Contest winner Connor McMurray, his subject & and CdA High teacher Terri Leonard. http:// bit.ly/2q6QjEw pic.twitter.com/nMicIKLsXz";;@CdAPressNews;;"862783995930718208";https://twitter.com/Raul_Labrador/status/862783995930718208
;2017-05-10 13:34;2;11;"Connor McMurray wins Congressional Art Competition for Heart of a Miner. More great art by #Idaho students: http:// bit.ly/1OWWaNG pic.twitter.com/LFCEgaTGhx";;;#Idaho;"862375238469865472";https://twitter.com/Raul_Labrador/status/862375238469865472
;2017-05-10 09:35;1;3;"Enjoyed meeting w/ John Ragan, President of @TraffiCalm Systems, radar speed sign pioneers. Innovative company in Post Falls, #Idaho pic.twitter.com/cYbea3wTh3";;@TraffiCalm;#Idaho;"862315186459471876";https://twitter.com/Raul_Labrador/status/862315186459471876
;2017-05-09 09:28;1;11;"It was a pleasure meeting w/ #Idaho reps from Women's Mining Coalition last week. Great discussion about #mining issues; important for Idaho pic.twitter.com/LdYhRKFAKp";;;#Idaho #mining;"861950917129756673";https://twitter.com/Raul_Labrador/status/861950917129756673
;2017-05-08 11:40;3;16;"It was a pleasure meeting #Idaho State Librarian Ann Joslin last wk. It's exciting to hear about new services Idaho libraries are providing. pic.twitter.com/R6KXPJ7jtJ";;;#Idaho;"861621935725301762";https://twitter.com/Raul_Labrador/status/861621935725301762
;2017-05-05 10:12;21;24;"Remember, I'll be hosting town halls today in #Lewiston (11:00 am) & Coeur d’Alene (6:30 pm). Details here: http:// goo.gl/ThDIFL #Idaho pic.twitter.com/wQcKGV91Jd";;;#Lewiston #Idaho;"860512442044084225";https://twitter.com/Raul_Labrador/status/860512442044084225
;2017-05-04 20:03;0;4;"Is this the "cash for clunkers" czar. Brilliant! I bet he also thought the ACA would reduce premiums and out of pocket costs. #obamacarefail";;;#obamacarefail;"860298886908399616";https://twitter.com/Raul_Labrador/status/860298886908399616
;2017-05-04 16:01;2;11;"I'll discuss vote moving to repeal & replace ACA on @KBOI670 at 3:20 MT w/Nate Shelman. Listen: http:// kboi.com";;@KBOI670;;"860237895084285953";https://twitter.com/Raul_Labrador/status/860237895084285953
;2017-05-04 13:27;6;7;"To read my full press release, please click here: http:// goo.gl/SBX6XI #AHCA #healthcare #Idaho";;;#AHCA #healthcare #Idaho;"860199155364491265";https://twitter.com/Raul_Labrador/status/860199155364491265
;2017-05-04 13:26;29;63;"I just voted for the newest version of #AHCA ; it keeps @HouseGOP promise to lower #healthcare costs and protect the most vulnerable";;@HouseGOP;#AHCA #healthcare;"860198896705961984";https://twitter.com/Raul_Labrador/status/860198896705961984
;2017-05-03 15:37;2;10;"To read my full press release, please click here: http:// goo.gl/vooInz #Omnibus #Idaho";;;#Omnibus #Idaho;"859869432138608640";https://twitter.com/Raul_Labrador/status/859869432138608640
;2017-05-03 15:35;83;278;"I voted against the #Omnibus . It had some good things but 2 much spending & borrowing, not enough @RealDonaldTrump & @HouseGOP priorities.";;@RealDonaldTrump @HouseGOP;#Omnibus;"859869140550647808";https://twitter.com/Raul_Labrador/status/859869140550647808
;2017-05-03 14:37;6;7;"Proud to join @NatResources Chr Bishop to scrutinize spending by 2 Obama-era climate change programs. More: http:// bit.ly/2qFzb5Z";;@NatResources;;"859854396712243202";https://twitter.com/Raul_Labrador/status/859854396712243202
;2017-05-03 10:46;1;4;"Remember: Today is our next @Conversations with Conservatives (2:30 PM ET/12:30 PM MT). Watch live here: http:// goo.gl/V5ygB7 @Heritage";;@Conversations @Heritage;;"859796280423456772";https://twitter.com/Raul_Labrador/status/859796280423456772
;2017-05-03 09:50;1;3;"I’ll be live with Neal Larson & Cala Curtis on @kidnewsradio at 9:05 a.m MT. Hope you can tune in! Listen here: http:// 590kid.com /";;@kidnewsradio;;"859782273838743557";https://twitter.com/Raul_Labrador/status/859782273838743557
;2017-05-03 08:57;0;0;"I'll be live with @BumpColley on @topstoryklix at 8:15 am MT today. Lots to discuss; tune in here: http:// newsradio1310.com / #Idaho";;@BumpColley @topstoryklix;#Idaho;"859768925789310976";https://twitter.com/Raul_Labrador/status/859768925789310976
;2017-05-02 17:19;6;17;"Voted 4 & House passed Working Families Flexibility Act today. Common-sense bill mends 1938 law, gives workers more choice in compensation.";;;;"859532836797374465";https://twitter.com/Raul_Labrador/status/859532836797374465
;2017-05-02 09:49;0;3;"Our next @Conversations with Conservatives will be Wednesday at 2:30 PM ET/12:30 PM MT. Watch live here: http:// goo.gl/V5ygB7 @Heritage";;@Conversations @Heritage;;"859419704347250688";https://twitter.com/Raul_Labrador/status/859419704347250688
;2017-05-01 17:46;15;43;"Today, I was honored to receive @ACUConservative Award for #Conservative Excellence, based on 25 key votes in 2016: http:// goo.gl/WLGbpM";;@ACUConservative;#Conservative;"859177255234416641";https://twitter.com/Raul_Labrador/status/859177255234416641
;2017-05-01 12:08;0;4;"Today is the last day to cast a 'like' & help pick the District Choice Award in Congressional Art Competition: http:// bit.ly/2pAQWaj";;;;"859092295852986368";https://twitter.com/Raul_Labrador/status/859092295852986368
;2017-04-28 17:28;7;14;"As @realDonaldTrump nears his 100 day mark, check out my e-newsletter, where I discuss his accomplishments so far: http:// goo.gl/kRNEGS";;@realDonaldTrump;;"858085536107507713";https://twitter.com/Raul_Labrador/status/858085536107507713
;2017-04-27 17:38;6;7;"Two more town halls, on May 5: Lewiston at 11am, Coeur d'Alene at 6:30pm. Hope you can join us: http:// bit.ly/2qc3MIX pic.twitter.com/FFSJTWS0Rc";;;;"857725692972322816";https://twitter.com/Raul_Labrador/status/857725692972322816
;2017-04-26 17:21;0;3;"Cast a 'like' to help pick the District Choice Award in Congressional Art Competition. Vote thru May 1. http:// bit.ly/2pAQWaj pic.twitter.com/hNpPnkg7ax";;;;"857358966757699585";https://twitter.com/Raul_Labrador/status/857358966757699585
;2017-04-26 13:52;10;34;"Very glad @RealDonaldTrump is reviewing Antiquities Act. When it comes to land in #Idaho , Idahoans know best: http:// goo.gl/U6OA8o";;@RealDonaldTrump;#Idaho;"857306495180050434";https://twitter.com/Raul_Labrador/status/857306495180050434
;2017-04-26 10:24;3;6;"ICYMI: @NPR & @McClatchyDC note Idahoans value promise keeping. Listen: http:// n.pr/2oM2Slg Read: http:// bit.ly/2q5GpAJ pic.twitter.com/OIgNfCF2oK";;@NPR @McClatchyDC;;"857254150173851649";https://twitter.com/Raul_Labrador/status/857254150173851649
;2017-04-25 09:29;3;20;"2nd lively town hall, in #Nampa . Took 48 questions in 2 1/2 hours of civil discourse. Up North soon. Thanks to @maf_us for hall. pic.twitter.com/LqBjDm3yCK";;@maf_us;#Nampa;"856877801483509760";https://twitter.com/Raul_Labrador/status/856877801483509760
;2017-04-24 17:22;6;23;"Congrats 2 our new @USDA Secretary, Sonny Perdue, on earning Senate confirmation today. Look forward to working with him on #Idaho ag issues";;@USDA;#Idaho;"856634579012259841";https://twitter.com/Raul_Labrador/status/856634579012259841
;2017-04-24 07:58;4;6;"Remember, town hall tonight in #Nampa . It will be at Mission Aviation Fellowship, starting at 6:30 PM: http:// bit.ly/2onc4go pic.twitter.com/VSYjFXICHY";;;#Nampa;"856492453536436226";https://twitter.com/Raul_Labrador/status/856492453536436226
;2017-04-21 11:33;7;15;"I love meeting with Idahoans on their turf. My reflections on a great week in today's Labrador Letter: http:// bit.ly/2p3r8SS pic.twitter.com/s3JexDuVG2";;;;"855459546822782976";https://twitter.com/Raul_Labrador/status/855459546822782976
;2017-04-20 13:42;5;9;"Photos from my town hall in @IdahoStatesman : http:// goo.gl/ansxFK Credit: @KyleGreen43 Remember: Monday 6:30 pm Mission Aviation in Nampa pic.twitter.com/VZ41TqgN08";;@IdahoStatesman @KyleGreen43;;"855129534949097473";https://twitter.com/Raul_Labrador/status/855129534949097473
;2017-04-20 11:32;13;25;"Great @IdahoStatesman editorial: "Even if you don’t like @Raul_Labrador you respect his no-holds-barred town halls": http:// goo.gl/4ltX4H pic.twitter.com/HK3YpJ8xfN";;@IdahoStatesman @Raul_Labrador;;"855096782761730049";https://twitter.com/Raul_Labrador/status/855096782761730049
;2017-04-19 16:25;0;12;"Great time w/Jeff Clifford's American Govt class Eagle High. Excellent questions from students schooled in the principles of federalism. pic.twitter.com/IGLZMncaU8";;;;"854808285094039552";https://twitter.com/Raul_Labrador/status/854808285094039552
;2017-04-19 08:06;5;8;"Don't forget, town hall tonight at #Meridian Middle School (starting at 6:30 PM); also, #Nampa town hall on Monday: http:// bit.ly/2onc4go pic.twitter.com/PiPposjp2k";;;#Meridian #Nampa;"854682579743780866";https://twitter.com/Raul_Labrador/status/854682579743780866
;2017-04-18 16:47;2;15;"Great tour today @BMEFire . Using American steel, 95 Idahoans build equipment vital to firefighters at a Boise factory. pic.twitter.com/rZ00dy0KqW";;@BMEFire;;"854451372808339461";https://twitter.com/Raul_Labrador/status/854451372808339461
;2017-04-18 14:34;1;6;"Enter by Friday in Congressional Art Competition at my offices in Meridian, Lewiston, Coeur d'Alene. More: http:// bit.ly/25UWOaT pic.twitter.com/3yShaVE264";;;;"854417858989879296";https://twitter.com/Raul_Labrador/status/854417858989879296
;2017-04-17 15:32;0;4;"Join me at 3:05 pm MT/2:05PT on @KBOI670 with host Nate Shelman. Listen live: http://www. kboi.com /";;@KBOI670;;"854070111006806022";https://twitter.com/Raul_Labrador/status/854070111006806022
;2017-04-16 09:29;0;2;"To read the rest of my #Easter newsletter, please click here: http:// goo.gl/8Sba7U";;;#Easter;"853616392964329472";https://twitter.com/Raul_Labrador/status/853616392964329472
;2017-04-16 09:28;2;36;"Today, I would like to wish you and your family a wonderful #Easter . Wherever you find yourself on this sacred holiday, I wish you the best.";;;#Easter;"853615990629945348";https://twitter.com/Raul_Labrador/status/853615990629945348
;2017-04-12 08:39;1;2;"Join me at 9:05am MT with Paul J & Chris on @KBOI670 to discuss the issues of the day. 670 AM in Boise or http:// kboi.com";;@KBOI670;;"852154328739479552";https://twitter.com/Raul_Labrador/status/852154328739479552
;2017-04-11 15:53;17;31;"Town halls set: 6:30pm 4/19 Meridian Middle School; 4/24, Mission Aviation Fellowship, Nampa. Hope 2 C U. http:// bit.ly/2onc4go pic.twitter.com/VTfTcVd6q7";;;;"851901141839486977";https://twitter.com/Raul_Labrador/status/851901141839486977
;2017-04-07 12:03;7;12;"Please read the rest of my e-newsletter on the #Gorsuch confirmation here: http:// goo.gl/y2AlAj";;;#Gorsuch;"850393708042358787";https://twitter.com/Raul_Labrador/status/850393708042358787
;2017-04-07 12:03;13;50;"With the #Gorsuch confirmation, Idahoans who support the #Constitution have a big win to celebrate.";;;#Gorsuch #Constitution;"850393510335401984";https://twitter.com/Raul_Labrador/status/850393510335401984
;2017-04-07 11:09;4;11;"Please read my full statement on Judge #Gorsuch 's confirmation here: http:// goo.gl/gTm4rZ";;;#Gorsuch;"850379995025481728";https://twitter.com/Raul_Labrador/status/850379995025481728
;2017-04-07 11:08;69;222;"I applaud the Senate for confirming Judge #Gorsuch . I am confident he will make the people of #Idaho and of this great nation proud";;;#Gorsuch #Idaho;"850379691185889280";https://twitter.com/Raul_Labrador/status/850379691185889280
;2017-04-07 10:02;28;46;"Please read my full statement on #Syria here: http:// goo.gl/BsbqD1";;;#Syria;"850363179586772996";https://twitter.com/Raul_Labrador/status/850363179586772996
;2017-04-07 10:02;8;22;"I agree with many of the points @RealDonaldTrump has made, but his policy will be more effective when it has strong support in Congress";;@RealDonaldTrump;;"850363064042041344";https://twitter.com/Raul_Labrador/status/850363064042041344
;2017-04-07 10:01;31;71;"When it comes to #Syria , our response must be in the best interests of the American people and approved by Congress, per the #Constitution";;;#Syria #Constitution;"850362982890708992";https://twitter.com/Raul_Labrador/status/850362982890708992
;2017-04-06 11:24;8;20;"PHOTO: Great meeting @KipWingerRocks today as part of #GRAMMYsOnTheHill . Great discussion and great entertainment @Wingertheband pic.twitter.com/ipsaSB3lbm";;@KipWingerRocks @Wingertheband;#GRAMMYsOnTheHill;"850021347472416768";https://twitter.com/Raul_Labrador/status/850021347472416768
;2017-04-04 17:59;4;32;"PHOTO: With Hayden Crabb, a senior at Skyview HS in #Nampa & our District’s first ever winner of the App Challenge #HouseofCode #Idaho pic.twitter.com/IB4eYWZnNA";;;#Nampa #HouseofCode #Idaho;"849396026905694211";https://twitter.com/Raul_Labrador/status/849396026905694211
;2017-04-04 16:30;69;155;"VIDEO: Talking with @TeamCavuto about #Obamacare repeal - it's more important to do it right than to do it quickly: http:// goo.gl/74uo0w";;@TeamCavuto;#Obamacare;"849373623550914560";https://twitter.com/Raul_Labrador/status/849373623550914560
;2017-04-04 14:02;4;19;"I will be on @FoxNews @TeamCavuto at 2:20 pm MT today. Topic: Latest with #healthcare reform. Hope you can tune in! #Obamacare";;@FoxNews @TeamCavuto;#healthcare #Obamacare;"849336341003481088";https://twitter.com/Raul_Labrador/status/849336341003481088
;2017-04-04 08:25;22;58;"Thank you @FreedomWorks . I appreciate you naming me "Member of the Month." You are a great champion 4 shared values: http:// goo.gl/dJTcPK";;@FreedomWorks;;"849251602733174784";https://twitter.com/Raul_Labrador/status/849251602733174784
;2017-04-03 10:21;12;27;"Please check out my new e-newsletter, " #Healthcare Reform: What Needs to Happen Now": http:// goo.gl/baVlHp #Obamacare #AHCA";;;#Healthcare #Obamacare #AHCA;"848918355323092992";https://twitter.com/Raul_Labrador/status/848918355323092992
;2017-04-02 08:53;263;634;"Couldn't agree more. @justinamash is one of the most honorable people I have met in politics. You can always count on him to keep his word. https:// twitter.com/alyssafarah/st atus/848525561068756992 …";;@justinamash;;"848533890264211456";https://twitter.com/Raul_Labrador/status/848533890264211456
