username;date;retweets;favorites;text;geo;mentions;hashtags;id;permalink
;2016-05-24 09:36;19;24;"My bill amends Title IX to prevent President's exec. overreach in regards to public school bathrooms. Read more here https:// abraham.house.gov/media-center/p ress-releases/abraham-introduces-legislation-combat-executive-overreach-transgender …";;;;"735117365881516033";https://twitter.com/RepAbraham/status/735117365881516033
;2016-05-16 15:49;4;11;"Thanks to @ULM_Official for allowing me to share graduation day with your new graduates! #LA05 #TalonsOut pic.twitter.com/fkzlF2vgta";;@ULM_Official;#LA05 #TalonsOut;"732312142041513987";https://twitter.com/RepAbraham/status/732312142041513987
;2016-05-13 10:19;20;19;"My statement on the President's transgender bathroom decree regarding public schools. pic.twitter.com/8uR8iQYRcp";;;;"731141818067369989";https://twitter.com/RepAbraham/status/731141818067369989
;2016-03-15 16:01;1;6;"See attached for list of new parishes now under federal disaster declaration #LA05 pic.twitter.com/qQ9xCWQ7X6";;;#LA05;"709846980080615430";https://twitter.com/RepAbraham/status/709846980080615430
;2016-03-11 14:34;6;9;"NELA is flooded, but so is southern part of #LA05 . I'm in Bogalusa helping out at shelter. Pls pray for Louisiana. pic.twitter.com/LxNy8K7MLO";;;#LA05;"708390772459102208";https://twitter.com/RepAbraham/status/708390772459102208
;2016-03-11 13:53;7;8;"Yesterday's update on how my office has been engaged on the Louisiana flooding event. Our prayers are w/ our people. pic.twitter.com/hzwnniwj97";;;;"708380367477153793";https://twitter.com/RepAbraham/status/708380367477153793
;2016-03-10 07:41;1;3;"Met w/ OPPJ's Walt Caldwell & Sheriff Russell this morning. Heading to our rural parishes now. Stay safe folks #LA05 pic.twitter.com/hQneT5JDQb";;;#LA05;"707924296702668801";https://twitter.com/RepAbraham/status/707924296702668801
;2016-03-02 16:30;2;7;"Great meeting these student body presidents from across Louisiana! They are our future, and we need to support them. pic.twitter.com/9N7Li8SdjO";;;;"705158331162349568";https://twitter.com/RepAbraham/status/705158331162349568
;2016-03-02 09:04;0;2;"Welcome back to Earth, #ScottKelly ! #LA05";;;#ScottKelly #LA05;"705046094552702976";https://twitter.com/RepAbraham/status/705046094552702976
;2016-02-13 21:47;0;9;"Justice Scalia was a beacon of conservatism, a man of true integrity and a defender of our Constitution. We could use more men like him.";;;;"698715190729306116";https://twitter.com/RepAbraham/status/698715190729306116
;2016-01-16 15:45;2;4;"Making friends at the #AgExpo in West Monroe! #LA05 pic.twitter.com/mgyUfpy0gT";;;#AgExpo #LA05;"688477128334135296";https://twitter.com/RepAbraham/status/688477128334135296
;2016-01-13 09:34;2;2;"The South should not be a dumping ground for the #VA 's unwanted employees http://www. clarionledger.com/story/news/201 6/01/12/gulf-coast-lawmakers-oppose-va-transfer-region/78707508/ … #LA05";;;#VA #LA05;"687296566630178816";https://twitter.com/RepAbraham/status/687296566630178816
;2016-01-12 21:37;1;8;"Easily the best thing about tonight's #SOTU was that it's the last one this president will ever give #LA05";;;#SOTU #LA05;"687116109464600576";https://twitter.com/RepAbraham/status/687116109464600576
;2016-01-05 12:43;4;5;"POTUS exec. order on guns is a gross overreach of power that tramples on the rights of law abiding Americans and our Constitution #LA05";;;#LA05;"684445067877191680";https://twitter.com/RepAbraham/status/684445067877191680
;2015-12-24 16:23;5;11;"Welcome home to @LANationalGuard 1023rd Engineer Company! Glad to have you home for Christmas! #LA05 pic.twitter.com/u8eJd2yAQf";;@LANationalGuard;#LA05;"680151925044555776";https://twitter.com/RepAbraham/status/680151925044555776
;2015-12-18 10:53;7;12;"I voted against the omnibus. It spends too much money and achieves too few conservative priorities. Congress must do a better job #LA05";;;#LA05;"677894582986801153";https://twitter.com/RepAbraham/status/677894582986801153
;2015-12-12 19:46;3;1;"Congrats to #Neville on back-to-back state titles! #LHSAA #Prepclassic #LA05";;;#Neville #LHSAA #Prepclassic #LA05;"675854240422764545";https://twitter.com/RepAbraham/status/675854240422764545
;2015-12-11 19:37;1;1;"Congrats to #Kentwood on the 1A state championship! #PrepClassic #LHSAA #LA05";;;#Kentwood #PrepClassic #LHSAA #LA05;"675489642678984704";https://twitter.com/RepAbraham/status/675489642678984704
;2015-12-02 16:31;1;2;"Happy birthday to @MikeStrain4LA ! Thanks for what you do for agriculture in Louisiana!";;@MikeStrain4LA;;"672181407289106432";https://twitter.com/RepAbraham/status/672181407289106432
;2015-11-26 10:17;6;9;"Happy Thanksgiving! I'm spending mine in Afghanistan with the troops to show my appreciation for what they do for our country. #LA05";;;#LA05;"669912940032602113";https://twitter.com/RepAbraham/status/669912940032602113
;2015-11-17 15:27;44;15;"My friend @DavidVitter raises some very disturbing points in this speech concerning a missing Syrian refugee. https:// twitter.com/cspan/status/6 66728295166140416 …";;@DavidVitter;;"666729308942147584";https://twitter.com/RepAbraham/status/666729308942147584
;2015-11-14 09:27;9;6;"My statement on the terrorist attacks against Paris. #LA05 pic.twitter.com/0JH6GL3AZY";;;#LA05;"665551637105106945";https://twitter.com/RepAbraham/status/665551637105106945
;2015-11-06 11:36;4;3;"On #KeystoneXL , POTUS has again shown he values his supporters in the radical environmental lobby over Americans who just want to work #LA05";;;#KeystoneXL #LA05;"662685120076357632";https://twitter.com/RepAbraham/status/662685120076357632
;2015-11-04 10:22;1;3;"Happy Birthday, @USMC ! I went to a ceremony today honoring their contributions to preserving our freedom. #LA05 pic.twitter.com/aMh4CqALXY";;@USMC;#LA05;"661941658276245505";https://twitter.com/RepAbraham/status/661941658276245505
;2015-10-27 16:33;2;4;"The budget deal is an assault on rural America. It guts the crop insurance programs our farmers depend on. I will oppose this bad deal #LA05";;;#LA05;"659120827816742912";https://twitter.com/RepAbraham/status/659120827816742912
;2015-10-22 16:46;2;4;"My statement on the President's veto of the #NDAA : pic.twitter.com/1bYGbO5U4w";;;#NDAA;"657312015178989568";https://twitter.com/RepAbraham/status/657312015178989568
;2015-10-16 13:20;2;3;"Finally figured out how to work this Instagram thing that I heard the interns talk about in my office… https:// instagram.com/p/86BLI6vP7L/";;;;"655086000700461056";https://twitter.com/RepAbraham/status/655086000700461056
;2015-10-13 12:51;5;5;"I recognized Pilots for Patients on the House floor for the good work they're doing for sick folks in La. https:// youtu.be/AqfZKP3lS2M #LA05";;;#LA05;"653991552101011456";https://twitter.com/RepAbraham/status/653991552101011456
;2015-10-09 12:49;2;5;"I voted to #LiftTheBan to put more Louisianans back to work and allow the US to compete on the global energy market #LA05";;;#LiftTheBan #LA05;"652541320993579008";https://twitter.com/RepAbraham/status/652541320993579008
;2015-10-06 11:44;3;5;"I spoke on the floor to draw attention to the need for a strategy to defeat ISIS and Assad in Syria https:// youtu.be/CGFcUFSnf8k #LA05";;;#LA05;"651437811476877312";https://twitter.com/RepAbraham/status/651437811476877312
;2015-10-01 13:13;0;4;".@RepBoustany Good deal! My kitchen table needs more @TABASCO ! @LATechFB @ULRaginCajuns";;@RepBoustany @TABASCO @LATechFB @ULRaginCajuns;;"649648385075585024";https://twitter.com/RepAbraham/status/649648385075585024
;2015-10-01 12:37;1;4;".@RepBoustany, want to bet on the @LATechFB vs. @ULRaginCajuns game? I'll stake a box of Ruston peaches if the Bulldogs lose.";;@RepBoustany @LATechFB @ULRaginCajuns;;"649639349211021313";https://twitter.com/RepAbraham/status/649639349211021313
;2015-09-30 16:20;1;5;"I opposed the CR bc it funded Planned Parenthood. My statement is below #LA05 #DefundPlannedParenthood #prolife pic.twitter.com/Zdg9QK2r3J";;;#LA05 #DefundPlannedParenthood #prolife;"649333034504822784";https://twitter.com/RepAbraham/status/649333034504822784
;2015-09-29 08:59;1;2;"Today on National VFW Day, we celebrate the commitment and sacrifice of our veterans and service members. #VFWDay #LA05";;;#VFWDay #LA05;"648859696338743296";https://twitter.com/RepAbraham/status/648859696338743296
;2015-09-25 09:41;4;4;"My statement on Speaker Boehner's retirement announcement. #LA05 pic.twitter.com/PgmltIaZYo";;;#LA05;"647420675762847744";https://twitter.com/RepAbraham/status/647420675762847744
;2015-09-22 09:34;5;13;"Enjoyed meeting @MissTeenUSA Katherine Haik in Franklington on Sunday. Thanks for being a great ambassador for #LA05 ! pic.twitter.com/iVqdfBkZvH";;@MissTeenUSA;#LA05;"646331788806234112";https://twitter.com/RepAbraham/status/646331788806234112
;2015-09-21 09:08;0;3;"On Saturday I had the honor of speaking at a ceremony honoring the service of firefighters in Rapides Parish #LA05 pic.twitter.com/uMlOrPHS5N";;;#LA05;"645962865946587137";https://twitter.com/RepAbraham/status/645962865946587137
;2015-09-18 12:10;2;3;"I voted to #DefundPlannedParenthood . As a doctor, I believe in protecting life. Read my full statement here: https:// abraham.house.gov/media-center/p ress-releases/abraham-votes-defund-planned-parenthood … #LA05";;;#DefundPlannedParenthood #LA05;"644921485556076544";https://twitter.com/RepAbraham/status/644921485556076544
;2015-09-17 15:25;6;2;"I had a great meeting today w/ @LABI_biz about how to grow the economy and bring jobs to #Louisiana #LA05 pic.twitter.com/v06nDMpIv8";;@LABI_biz;#Louisiana #LA05;"644608121806168064";https://twitter.com/RepAbraham/status/644608121806168064
;2015-09-13 00:00;3;0;"Warhawks win. #LSU wins. Not a bad Saturday! #TalonsOut #GeauxTigers #LA05 pic.twitter.com/Dcenj1arLF";;;#LSU #TalonsOut #GeauxTigers #LA05;"642925745359179776";https://twitter.com/RepAbraham/status/642925745359179776
;2015-09-12 10:13;1;1;"I'm flipping the coin at the @ULM_FB game! Check out their sharp looking unis for Military Day #TalonsOut #LA05 pic.twitter.com/zEDOlAzk7E";;@ULM_FB;#TalonsOut #LA05;"642717797718560768";https://twitter.com/RepAbraham/status/642717797718560768
;2015-09-10 11:35;9;8;"I honored the memory of Tyrell Cameron today on the floor. See it here: https:// youtu.be/TvmBqN3xyN8 #TC48 #FlyHighTyrell #WeAreAllPatriots #LA05";;;#TC48 #FlyHighTyrell #WeAreAllPatriots #LA05;"642013486931947520";https://twitter.com/RepAbraham/status/642013486931947520
;2015-09-09 13:11;8;7;"I joined @realDonaldTrump and 100s of Americans on the Capitol lawn to rally against #IranDeal #StopIranDeal #LA05 pic.twitter.com/iADcGTlbi7";;@realDonaldTrump;#IranDeal #StopIranDeal #LA05;"641675311453732864";https://twitter.com/RepAbraham/status/641675311453732864
;2015-09-09 09:08;3;4;"I spoke on the House floor to honor LEOs who keep our communities safe. See the video here: https:// youtu.be/vZrZNXVVGeg #BlueLivesMatter #LA05";;;#BlueLivesMatter #LA05;"641614182580924416";https://twitter.com/RepAbraham/status/641614182580924416
;2015-09-04 22:48;11;9;"Dianne and I send our prayers to the young man who died in tonight's football game, his family and the Franklin Parish community.";;;;"640008544952172544";https://twitter.com/RepAbraham/status/640008544952172544
;2015-09-02 11:05;13;34;"Newest addition to the office, just in time for football season! @LATechFB @LATechSports #WeAreLaTech #LA05 pic.twitter.com/HAf400Leuo";;@LATechFB @LATechSports;#WeAreLaTech #LA05;"639106953847902208";https://twitter.com/RepAbraham/status/639106953847902208
;2015-08-26 09:28;2;1;"I'm meeting with @thenewsstar editorial board at 10 a.m. CST. Follow the link to watch the live stream http:// original.livestream.com/thenewsstar #LA05";;@thenewsstar;#LA05;"636545781672091648";https://twitter.com/RepAbraham/status/636545781672091648
;2015-08-17 10:56;6;2;"Take a look at this link for some of my thoughts on my trip to Israel and why we need to oppose the Iran Deal. http://www. knoe.com/home/headlines /Congressman-Abraham-returns-from-Israel--322006962.html …";;;;"633306452761948160";https://twitter.com/RepAbraham/status/633306452761948160
;2015-08-04 16:06;1;2;"Heading into a series of interviews with @MyArkLaMiss #la05 pic.twitter.com/BxERE7B72j";;@MyArkLaMiss;#la05;"628673319139586048";https://twitter.com/RepAbraham/status/628673319139586048
;2015-08-03 17:09;2;1;"About to go on live with @KNOE8 to give an update from this session #La05 pic.twitter.com/RUNxAxVSqs";;@KNOE8;#La05;"628326877975977985";https://twitter.com/RepAbraham/status/628326877975977985
;2015-07-29 09:44;0;1;"Please keep Ralph, Dianne and their family in your prayers due to the loss of his mother yesterday afternoon. - Dr. Abraham's Staff";;;;"626402971950161920";https://twitter.com/RepAbraham/status/626402971950161920
;2015-07-28 14:54;2;3;"Today, the House passed my bill to increase veterans' benefits. This was my first bill to clear the full House #LA05";;;#LA05;"626118439929802752";https://twitter.com/RepAbraham/status/626118439929802752
;2015-07-23 21:03;3;3;"Dianne and I are praying for the victims o the shooting in Lafayette.";;;;"624399591576870920";https://twitter.com/RepAbraham/status/624399591576870920
;2015-07-23 08:43;5;1;". @Guns_com featured my bill to stop Pres. Obama's Social Security gun grab. Read more here: http://www. guns.com/2015/07/22/gop -lawmakers-move-to-block-social-security-gun-grab/ … #LA05";;@Guns_com;#LA05;"624213324620800000";https://twitter.com/RepAbraham/status/624213324620800000
;2015-07-21 15:58;2;2;"I cosponsored bill to arm military at bases, recruitment cntrs. 4 Marines, sailor would be alive today if they could've protected themselves";;;;"623597967044382720";https://twitter.com/RepAbraham/status/623597967044382720
;2015-07-21 10:42;2;2;"I cosponsored VA Accountability Act to bring reform to VA. Our heroes took care of us, we must take care of them #VFWConvention #VFW #LA05";;;#VFWConvention #VFW #LA05;"623518496102719488";https://twitter.com/RepAbraham/status/623518496102719488
;2015-07-21 10:41;15;11;"When President speaks to #VFWConvention , I hope he explains to #VFW why he has only fired 3 employees involved in VA scandal #LA05 (1/2)";;;#VFWConvention #VFW #LA05;"623518217349296129";https://twitter.com/RepAbraham/status/623518217349296129
;2015-07-16 09:27;2;3;"On #TBThursday , I'm throwing back to last weekend when my grandkids came to see Dianne and me in DC #TBT #LA05 pic.twitter.com/Bvt3lXP6yi";;;#TBThursday #TBT #LA05;"621687727575146497";https://twitter.com/RepAbraham/status/621687727575146497
;2015-07-14 09:05;4;5;"#IranDeal gives Iran time to get stronger while buying time before it can build a bomb. I will not vote for a deal that puts US in danger.";;;#IranDeal;"620957318608515072";https://twitter.com/RepAbraham/status/620957318608515072
;2015-07-01 12:14;12;15;"My 2yo grandson Ralph Lee Abraham IV helped me hang up flags around my property in honor of #IndependenceDay #LA05 pic.twitter.com/BLY3s9yDDN";;;#IndependenceDay #LA05;"616293822398640129";https://twitter.com/RepAbraham/status/616293822398640129
;2015-06-25 11:37;1;2;"and make healthcare work for the citizens of Louisiana, not bureaucrats in Washington. (3/3)";;;;"614110290406416385";https://twitter.com/RepAbraham/status/614110290406416385
;2015-06-25 11:37;1;1;"that this does not mean the fight to repeal Obamacare is over. I will continue to work to repeal Obamacare (2/3)";;;;"614110252087287808";https://twitter.com/RepAbraham/status/614110252087287808
;2015-06-25 11:37;1;1;"I am deeply disappointed in the Supreme Court’s interpretation of the plain letter of the law. However, it is important to note (1/3)";;;;"614110148873875456";https://twitter.com/RepAbraham/status/614110148873875456
;2015-06-24 08:28;1;2;"Congratulations on being inducted into Florida Parishes Arena Wall of Fame, Dr. Bruno! http://www. ulm.edu/news/2015/0623 -bruno-honor.html …";;;;"613700161144008704";https://twitter.com/RepAbraham/status/613700161144008704
;2015-06-16 11:39;4;2;"#Iran MUST free the Americans it is holding prisoner. http://www. nola.com/politics/index .ssf/2015/06/house_votes_391-0_to_urge_iran.html#incart_story_package …";;;#Iran #incart_story_package;"610849145956515841";https://twitter.com/RepAbraham/status/610849145956515841
;2015-06-07 21:08;4;3;"Congrats to the #LSU Tigers for advancing to the #CWS ! #GeauxTigers #geauxmaha";;;#LSU #CWS #GeauxTigers #geauxmaha;"607730934150930432";https://twitter.com/RepAbraham/status/607730934150930432
;2015-06-06 09:04;2;3;"On #DDAY , we remember the incredible sacrifice our troops paid in the name of freedom. #LA05";;;#DDAY #LA05;"607186416884453376";https://twitter.com/RepAbraham/status/607186416884453376
;2015-06-05 12:12;3;8;"Welcome @LouisianaFFA to Monroe! As House Ag ( @HouseAgNews ) member, I do believe in the future of agriculture! #LA05 pic.twitter.com/eAaSePINHd";;@LouisianaFFA @HouseAgNews;#LA05;"606871112073527296";https://twitter.com/RepAbraham/status/606871112073527296
;2015-06-05 11:12;1;3;"Dodging gators on my daily run. All part of life on a #Louisiana farm! #LA05 http://www. thenewsstar.com/story/news/loc al/2015/06/05/louisiana-congressman-dodges-gators-daily-jogs/28535481/ …";;;#Louisiana #LA05;"606856191579455489";https://twitter.com/RepAbraham/status/606856191579455489
;2015-06-04 09:25;2;2;"The VA isn't paying its bills to Louisiana companies, and that is totally unacceptable #LA05 http://www. thetowntalk.com/story/news/pol itics/2015/06/03/ambulance-company-va-moving-fast-enough-claims/28439247/ …";;;#LA05;"606466881130799105";https://twitter.com/RepAbraham/status/606466881130799105
;2015-06-02 10:28;0;0;"Enjoyed discussing the issues w/ the good folks in Kentwood last week! http://www. tangilena.com/news-local/con gressman-ralph-abraham- … ‘meet-and-greet’-kentwood #LA05";;;#LA05;"605757829010423808";https://twitter.com/RepAbraham/status/605757829010423808
;2015-06-01 15:01;1;2;"Congrats to the @LSUbaseball team for advancing to the Super Regional! One more step toward seventh national championship! #CWS2015 #LSU";;@LSUbaseball;#CWS2015 #LSU;"605464250753134592";https://twitter.com/RepAbraham/status/605464250753134592
;2015-05-29 12:01;1;1;".@RepBoustany joined me for a speech in Ruston yesterday about the issues we're tackling together in DC http://www. rustonleader.com/node/61048 #LA05 #LA03";;@RepBoustany;#LA05 #LA03;"604331654648352768";https://twitter.com/RepAbraham/status/604331654648352768
;2015-05-27 15:12;2;4;"So happy that this hospital will continue its mission of serving Rayville and Richland Parish! #LA05 http://www. myarklamiss.com/story/d/story/ abraham-obtains-funds-to-keep-rayville-hospital-fr/13267/IH6FmZATT0uT0MXi0ADYDw …";;;#LA05;"603654973231132672";https://twitter.com/RepAbraham/status/603654973231132672
;2015-05-27 13:03;1;0;"Enjoyed meeting constituents in Alexandria yesterday. Here's a story from my visit #LA05 http://www. kalb.com/home/headlines /Congressman-Abraham-talks-about-progress-in-DC-and-Louisiana-305061591.html …";;;#LA05;"603622687769030656";https://twitter.com/RepAbraham/status/603622687769030656
;2015-05-26 14:58;3;1;"Constitution wins again! Fed. appeals court blocks executive amnesty orders. #LA05 http://www. politico.com/story/2015/05/ barack-obama-executive-action-immigration-setback-appeals-court-118290.html?hp=t3_r …";;;#LA05;"603289103292071936";https://twitter.com/RepAbraham/status/603289103292071936
;2015-05-26 10:46;3;0;"My column: Fighting EPA rule for our farmers http://www. thenewsstar.com/story/opinion/ columnists/2015/05/21/fighting-epa-rule-farmers/27719907/ … #WOTUS #LA05";;;#WOTUS #LA05;"603225602271895552";https://twitter.com/RepAbraham/status/603225602271895552
;2015-05-25 10:07;7;2;"On #MemorialDay , I say Thank You to those who sacrificed so much for our nation. You are why we enjoy the freedom we have today #LA05";;;#MemorialDay #LA05;"602853404084412416";https://twitter.com/RepAbraham/status/602853404084412416
;2015-05-20 15:47;0;1;"Proud to join @DarrellIssa & @jaredpolis in cosponsoring Financial Transparency Act to support #opendata #LA05 pic.twitter.com/pyIVSAp9bI";;@DarrellIssa @jaredpolis;#opendata #LA05;"601127036757921792";https://twitter.com/RepAbraham/status/601127036757921792
;2015-05-14 15:44;4;3;"I voted to require Congressional review for any deals with #Iran . We must protect the US, Israel and our allies from a bad nuke deal #LA05";;;#Iran #LA05;"598952004174635008";https://twitter.com/RepAbraham/status/598952004174635008
;2015-05-13 16:45;3;0;"As a doctor, I took an oath to protect life. Proud to have cosponsored #HR36 . My comments from the floor: https:// youtu.be/0RhoG4v-A8E #LA05";;;#HR36 #LA05;"598605012563005440";https://twitter.com/RepAbraham/status/598605012563005440
;2015-05-11 15:19;4;2;"Exciting news: The La. black bear is being removed from the endangered species list! #LA05 http://www. thenewsstar.com/story/news/loc al/2015/05/11/las-teddy-bear-removed-endangered-list/27114385/ …";;;#LA05;"597858538745102336";https://twitter.com/RepAbraham/status/597858538745102336
;2015-05-08 08:54;6;3;"Honored to speak at @Grambling1901 graduation today. Thank you graduates for allowing me to spend this special day w/ you #GramFam #LA05";;@Grambling1901;#GramFam #LA05;"596674514735525888";https://twitter.com/RepAbraham/status/596674514735525888
;2015-05-07 14:59;2;1;"Honored to have attended Joffre Hunter's @usairforce Academy appointment ceremony today in Richwood. #LA05 pic.twitter.com/ZITjDhzYuA";;@usairforce;#LA05;"596403946505252865";https://twitter.com/RepAbraham/status/596403946505252865
;2015-05-07 09:23;1;1;"I'm going to a service tonight at Philadelphia Baptist in Pineville to pray for servicemen & women, 1st responders & police. #LA05 2/2";;;#LA05;"596319472866168833";https://twitter.com/RepAbraham/status/596319472866168833
;2015-05-07 09:22;1;5;"Today, the 64th annual #NationalDayOfPrayer , let us put aside our differences, join together & pray for the future of our country #LA05 1/2";;;#NationalDayOfPrayer #LA05;"596319121706450946";https://twitter.com/RepAbraham/status/596319121706450946
;2015-05-04 16:02;7;8;"Congrats to Anna Catherine Graves from @EaglesOCS for winning this year's Congressional High School Art Competition! pic.twitter.com/kundpS6Pjj";;@EaglesOCS;;"595332810384252928";https://twitter.com/RepAbraham/status/595332810384252928
;2015-05-04 16:00;2;5;"Enjoyed meeting the kids & learning about #SchoolLunch at J.S. Clark Magnet school in Monroe today #LA05 pic.twitter.com/hhm3dF5Vgm";;;#SchoolLunch #LA05;"595332257839226880";https://twitter.com/RepAbraham/status/595332257839226880
;2015-05-02 20:29;1;2;"@RNRMississippi @RepJeffMiller I do support it. I'm an original cosponsor of the bill.";;@RNRMississippi @RepJeffMiller;;"594675057072480256";https://twitter.com/RepAbraham/status/594675057072480256
;2015-04-30 11:20;8;3;"Happy statehood day! Louisiana is 203 years old today after becoming the 18th state to join the USA on this date in 1812 #LA05";;;#LA05;"593812093339574272";https://twitter.com/RepAbraham/status/593812093339574272
;2015-04-30 10:35;2;3;"I’m overjoyed the group from NELA who was stranded in #Nepal will be coming home safely. Please continue to pray for those still hurting.";;;#Nepal;"593800735596347393";https://twitter.com/RepAbraham/status/593800735596347393
;2015-04-24 14:19;2;1;"Inspiring to spend time w/ #specialolympics athletes today in Rayville. See the album: https:// abraham.house.gov/media-center/p hoto-galleries/rayville-special-olympics-2015 … #LA05 pic.twitter.com/8NoWDWJew4";;;#specialolympics #LA05;"591682851701133312";https://twitter.com/RepAbraham/status/591682851701133312
;2015-04-22 11:29;3;0;"Questioning VA systemic mismanagement in our Veterans' Affairs Committee hearing. You can watch here: http://www. ustream.tv/channel/hclive 14 …";;;;"590915233029484544";https://twitter.com/RepAbraham/status/590915233029484544
;2015-04-20 08:57;4;1;"ICYMI: Check out my monthly column #LA05 http://www. hannapub.com/ouachitacitize n/opinion/columns/abraham-reflects-on-first-days-in-congress/article_c5d9ffa6-e37c-11e4-b533-47aca73c3b68.html …";;;#LA05;"590152215391821824";https://twitter.com/RepAbraham/status/590152215391821824
;2015-04-17 11:02;2;0;"Check out my video interview on @USATODAY 's website about my first 100 days in Congress #LA05 http:// usatoday30.usatoday.com/video/rep-ralp h-abraham-on-100th-day/4176410407001 …";;@USATODAY;#LA05;"589096608324841472";https://twitter.com/RepAbraham/status/589096608324841472
;2015-04-16 15:57;2;0;"Great look by @dberrygannett at my 100th day in Congress #LA05 http://www. thenewsstar.com/story/news/loc al/2015/04/16/abraham-sees-value-reaching-across-aisle/25886831/ …";;@dberrygannett;#LA05;"588808468511006720";https://twitter.com/RepAbraham/status/588808468511006720
;2015-04-15 16:16;0;0;"@jlholt1944 I would support that. A simple, flat tax would be the way to go. Until then, these bills passed today should help.";;@jlholt1944;;"588450781189115904";https://twitter.com/RepAbraham/status/588450781189115904
;2015-04-15 15:39;5;1;"The #IRS wants your money; I want to hold it accountable. I helped pass legislation to do just that and to make it more transparent #LA05";;;#IRS #LA05;"588441439865966592";https://twitter.com/RepAbraham/status/588441439865966592
;2015-04-15 08:35;4;2;"Today marks my 100th day in office. Thank you for your prayers and support. Keep them coming as I enter the next 100 days and beyond! #LA05";;;#LA05;"588334722453004288";https://twitter.com/RepAbraham/status/588334722453004288
;2015-04-14 13:38;1;2;"Sad to hear about the passing of #PercySledge . He had deep ties to #LA05 , including being inducted into the Delta Music Museum in Ferriday.";;;#PercySledge #LA05;"588048591471714304";https://twitter.com/RepAbraham/status/588048591471714304
