username;date;retweets;favorites;text;geo;mentions;hashtags;id;permalink
;2015-11-24 14:49;0;1;"Today I met with #SanAntonio officials & fellow members of congress to discuss the need for a new federal courthouse pic.twitter.com/pbjBRkU7yu";;;#SanAntonio;"669256602134945793";https://twitter.com/RepCuellar/status/669256602134945793
;2015-11-24 08:30;0;2;"My staffer Rafael Benavides attended a #SmallBusinessSaturday press conf on 11/19 at the Laredo Chamber of Commerce pic.twitter.com/FjUzv9SYvb";;;#SmallBusinessSaturday;"669161069319843840";https://twitter.com/RepCuellar/status/669161069319843840
;2015-11-23 08:00;0;1;"On 11/18 my staffer Alec Mtz honored 10 Laredo HS seniors 4 academic achievement at BP Youth of the Month Ceremony pic.twitter.com/h4AUEVHpo1";;;;"668791156919042048";https://twitter.com/RepCuellar/status/668791156919042048
;2015-11-22 14:00;1;1;"My staffer Nichole Hernandez participated in the City of Roma's Paving & Drainage Project Ribbon Cutting on 11/12 pic.twitter.com/5ytinJmfp3";;;;"668519372621635584";https://twitter.com/RepCuellar/status/668519372621635584
;2015-11-22 09:00;1;1;"On 11/17 my staffer Pete Arguello participated in a small biz employee health care workshop w/ @SBAgov #SanAntonio pic.twitter.com/05SRDcGFtq";;@SBAgov;#SanAntonio;"668443887006912512";https://twitter.com/RepCuellar/status/668443887006912512
;2015-11-21 11:00;0;1;"My staffer Gilbert Lafuente recently provided books from the @librarycongress to the La Vernia High School Library pic.twitter.com/X9dZTWfkYq";;@librarycongress;;"668111715637137408";https://twitter.com/RepCuellar/status/668111715637137408
;2015-11-21 08:00;0;0;"#BorderPatrol recruiters will be at @MallDelNorte Laredo today from 10-3pm to take apps & answer questions @DHSgov pic.twitter.com/c9xXKZUiDG";;@MallDelNorte @DHSgov;#BorderPatrol;"668066418462601216";https://twitter.com/RepCuellar/status/668066418462601216
;2015-11-20 23:22;15;12;"Today, 5 more Syrians presented themselves at the Laredo Port of Entry.";;;;"667936012631322624";https://twitter.com/RepCuellar/status/667936012631322624
;2015-11-19 13:13;3;3;"Great to talk to @PeterZampa about the Syrian refugee crisis pic.twitter.com/yBRNeTFcjZ";;@PeterZampa;;"667420537375838210";https://twitter.com/RepCuellar/status/667420537375838210
;2015-11-18 12:36;2;1;"High school students & parents in Laredo: Make plans to attend my Service Academy Info Session on Nov. 23 at @txamiu pic.twitter.com/xXYRYjt249";;@txamiu;;"667048724867244032";https://twitter.com/RepCuellar/status/667048724867244032
;2015-11-18 08:11;0;1;"Great talking to constituents from my district in a #teletownhall last night. Thanks for the great turnout! #TX28 pic.twitter.com/voJoAnCKU7";;;#teletownhall #TX28;"666981987446628353";https://twitter.com/RepCuellar/status/666981987446628353
;2015-11-17 17:16;2;3;"Congrats to Jose Villarreal on receiving the Mexican Order of the Aztec Eagle Award from @EmbamexEUA today in D.C. pic.twitter.com/xj1e3iFGef";;@EmbamexEUA;;"666756924831059968";https://twitter.com/RepCuellar/status/666756924831059968
;2015-11-17 15:35;1;3;"Hablé c/ @lourdesmeluza de @Univision sobre la seguridad nacional de EU después de los ataques terroristas en #Paris pic.twitter.com/gku088TRNh";;@lourdesmeluza @Univision;#Paris;"666731333352357889";https://twitter.com/RepCuellar/status/666731333352357889
;2015-11-17 13:00;1;0;"Read my column in the @DCExaminer : Cuellar: TPP right for Texas, America http:// washex.am/1RZM2rk";;@DCExaminer;;"666692390204260352";https://twitter.com/RepCuellar/status/666692390204260352
;2015-11-17 12:00;1;2;"Watch acceptance speech from a former intern Alejandro Alba. Highlights importance of cultural immersion & education https://www. youtube.com/watch?v=5Du-Zm uWXyI&feature=youtu.be …";;;;"666677218609750016";https://twitter.com/RepCuellar/status/666677218609750016
;2015-11-16 14:15;1;2;". @KGNSnews : TAMIU Class Explores Laredo's Historical Roots http:// bit.ly/1ObJRzV";;@KGNSnews;;"666348787078590464";https://twitter.com/RepCuellar/status/666348787078590464
;2015-11-16 13:00;0;1;". @mySA : TAMUSA accepting freshman, sophomore applications http:// bit.ly/1NWvO37";;@mySA;;"666330087172608000";https://twitter.com/RepCuellar/status/666330087172608000
;2015-11-16 11:45;0;0;"Get free health insurance assistance in Rio Grande City tmrw, 11/17 from 10am-2pm at the Starr County Self Help Ctr pic.twitter.com/Nj3lTjlz9J";;;;"666311040250941440";https://twitter.com/RepCuellar/status/666311040250941440
;2015-11-13 12:00;2;3;"Congrats to Alejandro Alba, former intern of mine and 1 of 2 winners of the Generation Study Abroad video contest. https:// youtu.be/VgT3a2tCszA";;;;"665227704044621827";https://twitter.com/RepCuellar/status/665227704044621827
;2015-11-12 18:00;4;4;"Thank you to Mayor Saenz & City of Laredo for proclamation of November 12 as "Henry Cuellar Spirit of Laredo Day" pic.twitter.com/NUAx6xGtM6";;;;"664955910788247553";https://twitter.com/RepCuellar/status/664955910788247553
;2015-11-12 15:07;5;1;"Today I spoke at first Mexican Customs facility at U.S. airport in #Laredo . Could expedite commerce thru region pic.twitter.com/vdI3MdleDE";;;#Laredo;"664912518175989760";https://twitter.com/RepCuellar/status/664912518175989760
;2015-11-11 16:26;1;2;"Thanks to American Legion Post 59 for presenting me with this award at today's Laredo Veterans Day Parade & Ceremony pic.twitter.com/oez5wgmZM3";;;;"664569794083950592";https://twitter.com/RepCuellar/status/664569794083950592
;2015-11-11 14:58;1;2;"It was great to speak to @sachamber yesterday as part of its #CongressionalSeriesLuncheon pic.twitter.com/zPfw3B5aSg";;@sachamber;#CongressionalSeriesLuncheon;"664547654416879616";https://twitter.com/RepCuellar/status/664547654416879616
;2015-11-11 13:00;1;1;"On #VeteransDay , we stop and reflect on the sacrifice made by those who have served in our armed forces. #neverforget";;;#VeteransDay #neverforget;"664518002088394752";https://twitter.com/RepCuellar/status/664518002088394752
;2015-11-11 12:38;2;3;"Today I spoke to Laredo veterans to thank them for their service & explain what I'm doing to help w/veterans issues pic.twitter.com/eVsIPPtcXw";;;;"664512616572674048";https://twitter.com/RepCuellar/status/664512616572674048
;2015-11-11 10:55;0;1;"Great read today by @SABizJournal : Why this San Antonio congressman broke party ranks on Keystone, crude oil exports http:// bit.ly/20Md5MH";;@SABizJournal;;"664486609916575744";https://twitter.com/RepCuellar/status/664486609916575744
;2015-11-11 10:02;0;1;"Having breakfast and discussing #veterans issues with Laredo Vietnam vets this morning. pic.twitter.com/dB6ghLA5OM";;;#veterans;"664473360168935424";https://twitter.com/RepCuellar/status/664473360168935424
;2015-11-11 10:00;1;2;"On #VeteransDay , I am honoring the memory of our veterans by speaking to the Laredo @AmericanLegion #neverforget";;@AmericanLegion;#VeteransDay #neverforget;"664472739906912261";https://twitter.com/RepCuellar/status/664472739906912261
;2015-11-10 08:53;1;1;"Yesterday I joined the City of Laredo & @COMCEoficial in signing an MOU to promote trade at the Port of Laredo http:// 1.usa.gov/1lh1Hbp";;@COMCEoficial;;"664093566608756736";https://twitter.com/RepCuellar/status/664093566608756736
;2015-11-06 14:56;1;2;"Check out my interview w/PBS @NewsHour tonight as I explain why @POTUS ' rejection of the #KeystoneXL is bad for TX pic.twitter.com/tIq7wBvQQZ";;@NewsHour @POTUS;#KeystoneXL;"662735202708381696";https://twitter.com/RepCuellar/status/662735202708381696
;2015-11-06 11:48;1;3;"I greatly disagree with President Obama’s decision to reject the Keystone XL today. Read my statement here: http:// 1.usa.gov/1L1sM7b";;;;"662688090008526848";https://twitter.com/RepCuellar/status/662688090008526848
;2015-11-06 09:00;0;2;". @washingtonpost : Economy adds 271,000 jobs in October; unemployment rate dips to 5 percent http:// wpo.st/kEdl0";;@washingtonpost;;"662645637821931521";https://twitter.com/RepCuellar/status/662645637821931521
;2015-11-06 08:30;5;6;". @TheEconomist ranked @txamiu as one of the best universities in the nation. Go Dustdevils! #Laredo http:// econ.st/1M3N6da";;@TheEconomist @txamiu;#Laredo;"662638102557528064";https://twitter.com/RepCuellar/status/662638102557528064
;2015-11-05 18:13;0;0;"Yesterday I had the pleasure of meeting @LeifBabin , author of @XtremeOwnership about how @us_navyseals lead and win. pic.twitter.com/UCGbBw45FO";;@LeifBabin @XtremeOwnership @us_navyseals;;"662422550677467136";https://twitter.com/RepCuellar/status/662422550677467136
;2015-11-05 17:01;4;1;"Esta mañana hablé con @FPizarro_DC de @Univision sobre la crisis migratoria en centroamérica y en la frontera. pic.twitter.com/uEg8nfe0So";;@FPizarro_DC @Univision;;"662404498623713280";https://twitter.com/RepCuellar/status/662404498623713280
;2015-11-05 15:56;0;1;"Hoy platiqué con la corresponsal @imolinarescnn sobre las aprehensiones de niños centroamericanos en la frontera pic.twitter.com/j9EsbfyNkL";;@imolinarescnn;;"662388066644987904";https://twitter.com/RepCuellar/status/662388066644987904
;2015-10-30 15:30;3;1;"Always great to talk to @PeterZampa - yesterday it was about @PRyan 's election as #SpeakerOfTheHouse pic.twitter.com/YKrs4PAiyI";;@PeterZampa @PRyan;#SpeakerOfTheHouse;"660191991028842496";https://twitter.com/RepCuellar/status/660191991028842496
;2015-10-30 14:00;1;1;"Great talking to @EVCMedia yesterday about the speaker's race, presidential race. Will air Sunday! pic.twitter.com/Zzd4cz0PvR";;@EVCMedia;;"660169403409936384";https://twitter.com/RepCuellar/status/660169403409936384
;2015-10-30 12:00;0;1;"Storms early Friday morning in Floresville – please heed warnings of local authorities";;;;"660139218069417984";https://twitter.com/RepCuellar/status/660139218069417984
;2015-10-30 11:24;1;1;"Storms early Friday morning in Central and South TX have damaged buildings. Read more here: http://www. khou.com/story/weather/ 2015/10/30/central-texas-bad-weather-and-damage-early-friday-morning/74861182/ …";;;;"660130199707779072";https://twitter.com/RepCuellar/status/660130199707779072
;2015-10-29 13:00;1;2;"Great story in @monitornews : Student from Peru has doors opened thks to @DHSgov and #STEM visa extensions. Read more http://www. themonitor.com/news/local/dhs -proposes-work-permit-extension-for-stem-college-graduates/article_b2d542be-7dd5-11e5-af28-17b3df6ec56f.html …";;@monitornews @DHSgov;#STEM;"659791847682760706";https://twitter.com/RepCuellar/status/659791847682760706
;2015-10-28 14:06;2;1;"Great talking to @FPizarro_DC about the speaker's race! pic.twitter.com/EUicZnmU9Y";;@FPizarro_DC;;"659446130271506432";https://twitter.com/RepCuellar/status/659446130271506432
;2015-10-27 15:40;2;1;"Did you know? Without the TPP, Texas fresh and processed vegetable exports face up to 90% tariff fees #TexasTPP";;;#TexasTPP;"659107328243798016";https://twitter.com/RepCuellar/status/659107328243798016
;2015-10-27 13:00;1;1;"Want to learn more about how #TPP will benefit Texas? Visit @TradeGov website at http://www. trade.gov #texastpp";;@TradeGov;#TPP #texastpp;"659067069254660096";https://twitter.com/RepCuellar/status/659067069254660096
;2015-10-27 11:00;1;1;"Did you know? Without the TPP, Texas wheat exports face up to 31% tariff fees #TexasTPP";;;#TexasTPP;"659036901651779584";https://twitter.com/RepCuellar/status/659036901651779584
;2015-10-27 09:00;1;1;"Did you know? $288 billion in total goods exported from Texas in 2014 #texastpp";;;#texastpp;"659006652687867907";https://twitter.com/RepCuellar/status/659006652687867907
;2015-10-26 19:50;2;0;"Did you know? @EximBankUS helps #TX28 by supporting $43 million in local authorizations from the bank #RenewExIm";;@EximBankUS;#TX28 #RenewExIm;"658808053932957696";https://twitter.com/RepCuellar/status/658808053932957696
;2015-10-26 19:26;1;0;"Did you know? The @EximBankUS helps #TX28 by supporting $269 million in total exports from the district #RenewExIm";;@EximBankUS;#TX28 #RenewExIm;"658801805397262338";https://twitter.com/RepCuellar/status/658801805397262338
;2015-10-26 16:35;0;1;"Great speaking to @VOANews about my work w/ @RepGusBilirakis & @AmericanHumane on their #HeroDogs on Hill briefing http:// bit.ly/1MfieSR";;@VOANews @RepGusBilirakis @AmericanHumane;#HeroDogs;"658758772660260864";https://twitter.com/RepCuellar/status/658758772660260864
;2015-10-26 15:00;1;0;"Did you know? Without the TPP, Texas beef exports face up to 50% tariff fees #TexasTPP";;;#TexasTPP;"658734916956385280";https://twitter.com/RepCuellar/status/658734916956385280
;2015-10-26 13:00;0;1;"TPP works for Texas by ensuring U.S. investors have same protections in TPP markets as at home #texastpp";;;#texastpp;"658704668571250688";https://twitter.com/RepCuellar/status/658704668571250688
;2015-10-26 11:00;4;2;"Did you know? 1,117,318 U.S. jobs supported by goods exported from Texas in 2014 #texastpp";;;#texastpp;"658674500540633088";https://twitter.com/RepCuellar/status/658674500540633088
;2015-10-26 09:00;0;0;"TPP works for Texas by establishing a fair, transparent dispute settlement mechanism #texastpp";;;#texastpp;"658644288926945280";https://twitter.com/RepCuellar/status/658644288926945280
;2015-10-25 20:24;7;5;"Good news from @USATODAY : Effects of #HurricanePatricia less than feared -- no deaths, major damage reported http://www. usatoday.com/story/news/wor ld/2015/10/25/hurricane-patricia-mexico-impact/74592084/ …";;@USATODAY;#HurricanePatricia;"658453997829910528";https://twitter.com/RepCuellar/status/658453997829910528
;2015-10-25 10:08;0;2;"Thanks! MT @joshbrodesky Great piece from @RepCuellar on our federal courthouse plight. http:// m.mysanantonio.com/opinion/commen tary/article/Federal-courthouse-s-shortcomings-demand-new-6587326.php …";;@joshbrodesky @RepCuellar;;"658299029919518720";https://twitter.com/RepCuellar/status/658299029919518720
;2015-10-23 21:11;3;5;"More info on #HurricanePatricia : http://www. nytimes.com/interactive/20 15/10/23/science/hurricane-patricia-what-you-need-to-know.html?hp&action=click&pgtype=Homepage&module=a-lede-package-region&region=top-news&WT.nav=top-news …";;;#HurricanePatricia;"657741178612355072";https://twitter.com/RepCuellar/status/657741178612355072
;2015-10-23 20:49;5;5;"#HurricanePatricia is not to be trifled with. Thinking of all those in its path -- please be careful. @NASA video https://www. youtube.com/watch?v=Gnc89G Fg61k …";;@NASA;#HurricanePatricia;"657735598028017664";https://twitter.com/RepCuellar/status/657735598028017664
;2015-10-23 20:25;42;56;"As #HurricanePatricia makes landfall in #Mexico , I pray for the safety of the children and families affected. Follow @USEmbassyMEX for info.";;@USEmbassyMEX;#HurricanePatricia #Mexico;"657729560742633472";https://twitter.com/RepCuellar/status/657729560742633472
;2015-10-23 13:00;0;0;"TPP works for Texas by supporting a single, global Internet, ensuring free flow of data #texastpp";;;#texastpp;"657617525241331713";https://twitter.com/RepCuellar/status/657617525241331713
;2015-10-23 09:00;2;0;"TPP works for Texas by establishing strong protections for patents, trademarks, copyrights #texastpp";;;#texastpp;"657557145794121728";https://twitter.com/RepCuellar/status/657557145794121728
;2015-10-22 13:46;1;2;"Yesterday I co-sponsored @repdinatitus ' bill to prevent an increase in Medicare premiums next year. Read more here: http:// 1.usa.gov/1W6Zeva";;@repdinatitus;;"657266875999588352";https://twitter.com/RepCuellar/status/657266875999588352
;2015-10-22 13:00;0;1;"Did you know? 18,197 companies from Texas exported goods to TPP countries in 2013. #texastpp";;;#texastpp;"657255161362931712";https://twitter.com/RepCuellar/status/657255161362931712
;2015-10-22 09:00;1;0;"Did you know? $156.6 billion in good exports from TX to TPP countries in 2014. #texastpp";;;#texastpp;"657194780212924416";https://twitter.com/RepCuellar/status/657194780212924416
;2015-10-21 15:22;5;9;"Enjoyed speaking at @AmericanHumane 's @HeroDogs briefing on Capitol Hill. Met finalist Sgt. Rambo from my district. pic.twitter.com/RBEpyDYHCr";;@AmericanHumane @HeroDogs;;"656928687246417920";https://twitter.com/RepCuellar/status/656928687246417920
;2015-10-21 15:07;2;1;"Did you know? 54% of Texas' goods exports went to #TPP countries in 2014. #texastpp";;;#TPP #texastpp;"656924693690056704";https://twitter.com/RepCuellar/status/656924693690056704
;2015-10-20 16:10;0;1;"Had a great time this a.m. at grant announcement for LDO's 406th District Court to treat those w/ alcohol dependency pic.twitter.com/wal41iM5nt";;;;"656578293970419712";https://twitter.com/RepCuellar/status/656578293970419712
;2015-10-19 17:06;0;1;"Enjoying hosting @MarioDB in Laredo as we visit #WorldTradeBridge , airport, meet city officials pic.twitter.com/coFsGX8sGA";;@MarioDB;#WorldTradeBridge;"656230066100269056";https://twitter.com/RepCuellar/status/656230066100269056
;2015-10-18 20:26;1;1;"Great lunch today with MX Congressman Baltazar Martínez Montemayor @palenquegrill about topics of interest to US, MX pic.twitter.com/0WtLiLQzto";;@palenquegrill;;"655918024139124736";https://twitter.com/RepCuellar/status/655918024139124736
;2015-10-18 16:12;3;0;"Great article from Fortune magazine showing the numbers that make up the #TPP http:// for.tn/1jvX3Wk";;;#TPP;"655854046180483074";https://twitter.com/RepCuellar/status/655854046180483074
;2015-10-18 15:05;2;1;"Great article -- great strides being made by allowing goods pre-clearance. I helped start program several years ago. http:// yhoo.it/1LiShEE";;;;"655837042455257088";https://twitter.com/RepCuellar/status/655837042455257088
;2015-10-17 11:47;2;0;"Anything that's wrong, the southern border gets blamed. Mistrust is to blame. -- discussing ISIS camps w/ @nachoaguilar at #ttf";;@nachoaguilar;#ttf;"655424853865009152";https://twitter.com/RepCuellar/status/655424853865009152
;2015-10-17 11:36;5;8;"We've got to see Mexico as a partner and start looking at our relationship differently #ttf";;;#ttf;"655422048341241858";https://twitter.com/RepCuellar/status/655422048341241858
;2015-10-17 11:34;2;1;"As a member of the Appropriations Committee, I know we're not giving as much foreign aid to Mexico as some think #ttf";;;#ttf;"655421706396389376";https://twitter.com/RepCuellar/status/655421706396389376
;2015-10-17 11:21;2;0;""I voted against sanctuary cities because we've got to follow the law we have right now." -- discussing sanctuary cities at #ttf";;;#ttf;"655418462836248576";https://twitter.com/RepCuellar/status/655418462836248576
;2015-10-17 11:17;1;3;"Currently discussing sanctuary cities with @nachoaguilar , Texas congressmen at #ttf";;@nachoaguilar;#ttf;"655417467590848512";https://twitter.com/RepCuellar/status/655417467590848512
;2015-10-17 10:58;0;3;"About to discuss homeland security with @nachoaguilar and other Texas congressmen at #ttf pic.twitter.com/HmpsvkSibb";;@nachoaguilar;#ttf;"655412630237138944";https://twitter.com/RepCuellar/status/655412630237138944
;2015-10-17 09:06;0;0;"The 10 most dangerous cities in the U.S. may surprise you. Looking forward to discussing at #ttf at 11:10 http://www. esquire.com/news-politics/ g2460/10-most-dangerous-cities/ …";;;#ttf;"655384275081109504";https://twitter.com/RepCuellar/status/655384275081109504
;2015-10-15 17:26;2;2;"My dep. chief of staff attended a @WhiteHouse #HispanicHeritageMonth reception on #education , Hispanics' future. pic.twitter.com/SQDCcE9drm";;@WhiteHouse;#HispanicHeritageMonth #education;"654785523286851585";https://twitter.com/RepCuellar/status/654785523286851585
;2015-10-15 16:55;2;1;"Today I joined @txamiu in celebrating 50th ann. of @VISTAbuzz & @TX_CNCS ' great work to eliminate poverty in Webb Co pic.twitter.com/E8vpJ4gHXm";;@txamiu @VISTAbuzz @TX_CNCS;;"654777618680512512";https://twitter.com/RepCuellar/status/654777618680512512
;2015-10-14 20:18;1;1;"Great talking about trade btwn Nuevo Laredo & Laredo, TX w/Mexican Congresswoman @YahleelAbdalaC today in MexicoCity pic.twitter.com/jaFW1z9wKx";;@YahleelAbdalaC;;"654466414690963456";https://twitter.com/RepCuellar/status/654466414690963456
;2015-10-14 12:07;2;4;"I'm at @borderalliance meeting in Mexico City to discuss the dev & expansion of border infrastructure & intl trade pic.twitter.com/iOCv9ejcEA";;@borderalliance;;"654342891758817280";https://twitter.com/RepCuellar/status/654342891758817280
;2015-10-12 21:00;3;5;"Showed my colleague @RepFrenchHill what real Mexican food is like @palenquegrill w/Dr. Ray M. Keck & Javier Santos pic.twitter.com/qQJq9dJ6kd";;@RepFrenchHill @palenquegrill;;"653752229631954944";https://twitter.com/RepCuellar/status/653752229631954944
;2015-10-12 19:09;2;1;"Fue un placer hablar c/Lupita Benavides de @TelemundoLaredo sobre la seguridad de nuestras comunidades fronterizas pic.twitter.com/cMIK69JkAi";;@TelemundoLaredo;;"653724209898651648";https://twitter.com/RepCuellar/status/653724209898651648
;2015-10-12 11:05;1;2;"@RepFrenchHill joins me in my hometown of #Laredo , Texas, today to tour the border and meet our community leaders. pic.twitter.com/ErlVj8AeJI";;@RepFrenchHill;#Laredo;"653602482048765952";https://twitter.com/RepCuellar/status/653602482048765952
;2015-10-10 12:16;1;3;"Happy to see all the great folks at the Floresville #PeanutFestival Parade this morning. pic.twitter.com/DWff0ADnKO";;;#PeanutFestival;"652895594604707840";https://twitter.com/RepCuellar/status/652895594604707840
;2015-10-09 11:10;1;0;""It's our job as members to ensure that our laws reflect the America of tomorrow." #HR702 Watch: https://www. youtube.com/watch?v=LDqg4f 0DBhQ …";;;#HR702;"652516504722915328";https://twitter.com/RepCuellar/status/652516504722915328
;2015-10-09 11:06;0;2;"Speaking on my amendment to #HR702 . Watch on @CSPAN .";;@CSPAN;#HR702;"652515472127209472";https://twitter.com/RepCuellar/status/652515472127209472
;2015-10-09 10:18;0;2;"Currently speaking on the floor in favor of #HR702 . Watch on @cspan . The crude oil export ban needs to go.";;@cspan;#HR702;"652503513994559488";https://twitter.com/RepCuellar/status/652503513994559488
;2015-10-08 19:30;2;1;"Why support #HR702 ? By exporting surplus light crude, gas prices can decrease, jobs can grow #energyjobs";;;#HR702 #energyjobs;"652279861310918657";https://twitter.com/RepCuellar/status/652279861310918657
;2015-10-08 18:00;0;1;"Why support #HR702 ? Light crude oil imports have dropped with plenty of domestic light product, according to @EIAgov .";;@EIAgov;#HR702;"652257235561676801";https://twitter.com/RepCuellar/status/652257235561676801
;2015-10-08 16:00;0;2;"Why support #HR702 ? We're not importing as much crude oil as some think. pic.twitter.com/TDc3Zf2nBP";;;#HR702;"652227041924792321";https://twitter.com/RepCuellar/status/652227041924792321
;2015-10-08 15:00;0;1;"Why support #HR702 ? @EIAgov has found negative effects would not accrue to U.S. consumers";;@EIAgov;#HR702;"652211925602861056";https://twitter.com/RepCuellar/status/652211925602861056
;2015-10-08 14:00;0;1;"Why support #HR702 ? For one thing, every major study to date has predicted a gas price decrease. pic.twitter.com/CCvce8ZPOj";;;#HR702;"652196846425649152";https://twitter.com/RepCuellar/status/652196846425649152
;2015-10-07 14:44;1;2;"My staffer Pete Arguello (ctr) met w/Live Oak Mayor Mary Dennis & Cm Aaron Dahl yesterday during #NationalNightOut pic.twitter.com/ISaeOq2aFB";;;#NationalNightOut;"651845638427164672";https://twitter.com/RepCuellar/status/651845638427164672
;2015-10-07 10:17;1;3;"Great talking to @PeterZampa this morning about crude oil exports #hr702 pic.twitter.com/H9Z639pzfn";;@PeterZampa;#hr702;"651778259785515008";https://twitter.com/RepCuellar/status/651778259785515008
;2015-10-06 10:48;3;1;"I was a proponent of #TPA this summer, so I look forward to reviewing #TPP over the coming days. Read my statement: http:// 1.usa.gov/1WKKODj";;;#TPA #TPP;"651423690039627776";https://twitter.com/RepCuellar/status/651423690039627776
;2015-10-05 17:00;0;0;"ICYMI: I hosted a roundtable for key players in US, Mexican energy worlds Friday. Read here: http:// bit.ly/1Nh8fm0 pic.twitter.com/IpZlVKV7CK";;;;"651154946096631809";https://twitter.com/RepCuellar/status/651154946096631809
;2015-10-05 15:00;1;1;"ICYMI: Friday’s energy roundtable was a great opportunity to strengthen discussions between the U.S., Mexico: http:// bit.ly/1Nh8fm0";;;;"651124778158305280";https://twitter.com/RepCuellar/status/651124778158305280
;2015-10-05 12:59;0;0;"ICYMI: I hosted a first-of-its-kind energy roundtable in Laredo on Friday. Read about it here: http:// 1.usa.gov/1WIDnfZ";;;;"651094418414522373";https://twitter.com/RepCuellar/status/651094418414522373
;2015-10-05 09:20;0;1;"Happy Monday! Good financial news: U.S. median annual household income is at a post-recession high of $55,794 http:// bit.ly/1FLvn9Z";;;;"651039218622402560";https://twitter.com/RepCuellar/status/651039218622402560
;2015-10-02 13:53;1;0;"Discussing educational opportunities @txamiu and demand for oil and gas in coming years after roundtable #energyjobs pic.twitter.com/imNxYHigSd";;@txamiu;#energyjobs;"650020879552937984";https://twitter.com/RepCuellar/status/650020879552937984
;2015-10-02 12:20;1;1;"Alex Mills, president of TX Alliance of Energy Producers, excited to work w/ Mexican, American reps to develop energy pic.twitter.com/4EbFBUzvlh";;;;"649997486665412608";https://twitter.com/RepCuellar/status/649997486665412608
;2015-10-02 11:38;1;1;"Alfonso Zegby, Mexican Agency of Security, Energy & Environment, speaking on working with @txrrc to work with industry to develop #EagleFord";;@txrrc;#EagleFord;"649986930478813184";https://twitter.com/RepCuellar/status/649986930478813184
;2015-10-02 11:09;3;2;"Gustavo Hernández García, head of energy unit of MX Min. of Economy, speaking about energy investments #energyjobs pic.twitter.com/vBMYA9jgcF";;;#energyjobs;"649979570020569089";https://twitter.com/RepCuellar/status/649979570020569089
