username;date;retweets;favorites;text;geo;mentions;hashtags;id;permalink
;2014-09-24 12:46;5;4;"I am a democrat, but my district, state and country come first before my party. #TribLive";;;#TribLive;"514833353426882560";https://twitter.com/RepCuellar/status/514833353426882560
;2014-09-24 12:42;1;1;". @evanasmith "Why won’t you switch parties?" Because I am a democrat and I will die as a democrat.";;@evanasmith;;"514832231249235968";https://twitter.com/RepCuellar/status/514832231249235968
;2014-09-24 12:38;1;0;"When a leader walks and he has no followers, he’s just taking a walk in the park. #TribLive";;;#TribLive;"514831154227449856";https://twitter.com/RepCuellar/status/514831154227449856
;2014-09-24 12:35;1;0;"I voted for healthcare reform; it was the right thing to do. We now have 2 extremes that want to repeal or make no changes #TribLive";;;#TribLive;"514830446379933696";https://twitter.com/RepCuellar/status/514830446379933696
;2014-09-24 12:32;4;1;"Negative rhetoric and misperceptions about the border makes it harder to bring doctors to #Laredo #TribLive";;;#Laredo #TribLive;"514829645746028544";https://twitter.com/RepCuellar/status/514829645746028544
;2014-09-24 12:24;0;0;"My father was born in Guerrero, Tamaulipas. He became a naturalized resident and then an American citizen #CIR #TribLive";;;#CIR #TribLive;"514827803398004738";https://twitter.com/RepCuellar/status/514827803398004738
;2014-09-24 12:24;0;1;"Even if we are in the minority, we need to try to get something done on #immigration reform #TribLive";;;#immigration #TribLive;"514827722254974976";https://twitter.com/RepCuellar/status/514827722254974976
;2014-09-24 12:21;3;1;"Watch the livestream of my conversation with @TexasTribune and @evanasmith now #TribLive http:// texastribune.org/livestream/ pic.twitter.com/LAGCTDHUbv";;@TexasTribune @evanasmith;#TribLive;"514826863236349952";https://twitter.com/RepCuellar/status/514826863236349952
;2014-09-24 12:20;2;0;"We are not sent to DC to take the easy votes – we have to take a stand one the tough issues like immigration #TribLive";;;#TribLive;"514826681325219840";https://twitter.com/RepCuellar/status/514826681325219840
;2014-09-24 12:14;0;2;"The American public wants to see #Congress be bipartisan – we can get so much done if the parties talk to each other #TribLive";;;#Congress #TribLive;"514825302934306818";https://twitter.com/RepCuellar/status/514825302934306818
;2014-09-24 12:11;1;4;"Thanks for your good work! @TheJbarr @GetCoveredTX @EnrollSA @UTSanAntonio";;@TheJbarr @GetCoveredTX @EnrollSA @UTSanAntonio;;"514824331739004928";https://twitter.com/RepCuellar/status/514824331739004928
;2014-09-24 12:10;0;2;"The American public is weary of war and we need to work with our regional partners to combat #ISIL";;;#ISIL;"514824207772172289";https://twitter.com/RepCuellar/status/514824207772172289
;2014-09-24 12:08;0;2;"ISIL is a different type of threat we are seeing and we have to take it very seriously #TribLiveTX";;;#TribLiveTX;"514823786622119936";https://twitter.com/RepCuellar/status/514823786622119936
;2014-09-24 12:00;0;0;"Oil and gas has helped spur #Texas #jobs . How has the recent boom changed your area of the state?";;;#Texas #jobs;"514821665822240768";https://twitter.com/RepCuellar/status/514821665822240768
;2014-09-24 11:56;2;1;"Watch the livestream now of my #TribLive Conversation! http:// texastribune.org/livestream/";;;#TribLive;"514820773027254272";https://twitter.com/RepCuellar/status/514820773027254272
;2014-09-24 11:09;0;1;"Just arrived in #SATX and doing interviews with media. Discussion with @TribliveTX at @UTSA to start in 1 hr! pic.twitter.com/1znuawzSPs";;@TribliveTX @UTSA;#SATX;"514808915432046593";https://twitter.com/RepCuellar/status/514808915432046593
;2014-09-24 10:56;0;0;"Looking forward to joining you for the #TribLive conversation shortly @aprilhinkle @evanasmith";;@aprilhinkle @evanasmith;#TribLive;"514805583539892224";https://twitter.com/RepCuellar/status/514805583539892224
;2014-09-24 10:00;4;4;"College costs & student loan debt are out of control. We need affordable & accessible #highered options for students http:// goo.gl/zzcAyW";;;#highered;"514791447225069568";https://twitter.com/RepCuellar/status/514791447225069568
;2014-09-24 09:13;1;0;"Today is the day! Join me for a live conversation with @TribLiveTX at @UTSA downtown. Watch the livestream here: http:// trib.it/1da7UtE";;@TribLiveTX @UTSA;;"514779597184184321";https://twitter.com/RepCuellar/status/514779597184184321
;2014-09-24 08:00;1;1;".@1200WAOI Guess What? Texas Roads Rank Near the Top in National Study http:// goo.gl/DBFvew";;@1200WAOI;;"514761213993951232";https://twitter.com/RepCuellar/status/514761213993951232
;2014-09-23 10:00;1;1;"It’s almost here! Tomorrow I chat with @EvanASmith of @TexasTribune at @UTSA Downtown. Last chance to RSVP: http:// trib.it/1tast4V #TribLive";;@EvanASmith @TexasTribune @UTSA;#TribLive;"514428999901003777";https://twitter.com/RepCuellar/status/514428999901003777
;2014-09-22 09:15;3;0;"My Mission staff welcomed a $30 million investment from Royal Technologies Corp. to the #RGV pic.twitter.com/bukE4NMtWZ";;;#RGV;"514055291726356480";https://twitter.com/RepCuellar/status/514055291726356480
;2014-09-22 09:00;1;2;"My staff met with @UANL Rector Jesus Ancer Rodriguez in McAllen to strengthen bonds between alumni and the community pic.twitter.com/NPazTMYeb8";;@UANL;;"514051562197360640";https://twitter.com/RepCuellar/status/514051562197360640
;2014-09-22 09:00;1;1;"Time is running out! 2 days until I sit down with @TexasTribune CEO @EvanASmith in #SATX . RSVP now: http:// trib.it/1tast4V #TribLive";;@TexasTribune @EvanASmith;#SATX #TribLive;"514051512520032257";https://twitter.com/RepCuellar/status/514051512520032257
;2014-09-22 08:45;4;3;"Forbes has named Laredo, Texas as the No. 3 Best Cities for Hispanic Entrepreneurs: http://www. forbes.com/sites/holliesl ade/2014/09/11/the-best-and-worst-cities-for-hispanic-entrepreneurs/?utm_campaign=forbestwittersf&utm_source=twitter&utm_medium=social …";;;;"514047758173368320";https://twitter.com/RepCuellar/status/514047758173368320
;2014-09-22 08:30;2;0;"Laredo has been named one of the “Best Cities for Working Parents” http:// finance.yahoo.com/news/best-citi es-working-parents-101500039.html … @nerdwallet @businessinsider";;@nerdwallet @businessinsider;;"514043995043807232";https://twitter.com/RepCuellar/status/514043995043807232
;2014-09-22 08:00;0;1;"My staff visited the Poth, Texas PD to congratulate Officer Robert Sanchez + Chief Lowell Hull on doing a stellar job pic.twitter.com/jFeLYvGgMg";;;;"514036462635843584";https://twitter.com/RepCuellar/status/514036462635843584
;2014-09-20 11:34;6;2;"Doing an interview in #Austin with @BBCWorld about the crisis on the US-Mexico border. pic.twitter.com/9xILP5vbvf";;@BBCWorld;#Austin;"513365537682755584";https://twitter.com/RepCuellar/status/513365537682755584
;2014-09-20 11:33;0;2;"It was great to meet fellow Laredoan and @UTAustin government major Bernardo Paredes. Study hard & Hook 'Em Horns! pic.twitter.com/mI3Bc5wVno";;@UTAustin;;"513365219947474944";https://twitter.com/RepCuellar/status/513365219947474944
;2014-09-20 11:21;0;1;"We've just finished our #TribuneFest panel on border security. I thank everyone who participated in this lively discussion.";;;#TribuneFest;"513362285595598848";https://twitter.com/RepCuellar/status/513362285595598848
;2014-09-20 10:48;2;1;"We need to combat them with intelligence and corporation with other countries. #tribunefest #TTimmigration";;;#tribunefest #TTimmigration;"513353975911813120";https://twitter.com/RepCuellar/status/513353975911813120
;2014-09-20 10:47;3;0;"Drug cartels are not just a Mexico problem; they are transnational organizations. #tribunefest #TTimmigration pic.twitter.com/fd3JfrI2W7";;;#tribunefest #TTimmigration;"513353785515593731";https://twitter.com/RepCuellar/status/513353785515593731
;2014-09-20 10:06;4;2;"We've just started a panel discussion on border security with #TribuneFest #TTimmigration pic.twitter.com/9Jc4hohTQG";;;#TribuneFest #TTimmigration;"513343405846302720";https://twitter.com/RepCuellar/status/513343405846302720
;2014-09-19 11:34;0;0;"Thank you, @benedictgal !";;@benedictgal;;"513003224111284224";https://twitter.com/RepCuellar/status/513003224111284224
;2014-09-19 11:03;0;0;"Thanks, @Cisc0kid !";;@Cisc0kid;;"512995417827844096";https://twitter.com/RepCuellar/status/512995417827844096
;2014-09-19 11:03;0;0;"Thanks, @poncho_nevarez !";;@poncho_nevarez;;"512995314018832384";https://twitter.com/RepCuellar/status/512995314018832384
;2014-09-19 10:25;0;1;"Joining @Varneyco in a few minutes to talk about this week's vote to combat #ISIL @FoxBusiness pic.twitter.com/mNUmQspnwu";;@Varneyco @FoxBusiness;#ISIL;"512985871281577984";https://twitter.com/RepCuellar/status/512985871281577984
;2014-09-19 10:16;0;1;". @Forbes has named #Laredo No. 3 in a list of Best Cities for Hispanic Entrepreneurs: http:// goo.gl/ePtsti";;@Forbes;#Laredo;"512983475373477888";https://twitter.com/RepCuellar/status/512983475373477888
;2014-09-19 08:03;0;0;"Thanks, @RepSinema !";;@RepSinema;;"512950064244088832";https://twitter.com/RepCuellar/status/512950064244088832
;2014-09-18 21:15;2;1;"Since the enactment of the ACA, Medicare and Medicaid costs were reduced by $188 billion http:// bit.ly/1qZ2Tya pic.twitter.com/WsXEgQzc7j";;;;"512786971769327616";https://twitter.com/RepCuellar/status/512786971769327616
;2014-09-18 15:45;16;11;"1 call to the #VeteransCrisisLine can save a life: 1-800-273-8255, Press 1 #ThePowerOf1 #stop22aday pic.twitter.com/9XB2MrWhjS";;;#VeteransCrisisLine #ThePowerOf1 #stop22aday;"512703909614202880";https://twitter.com/RepCuellar/status/512703909614202880
;2014-09-18 15:45;0;0;"1 call to the #VeteransCrisisLine can save a life: 1-800-273-8255, Press 1 #ThePowerOf1 #stop22aday pic.twitter.com/23DL9hNmMF";;;#VeteransCrisisLine #ThePowerOf1 #stop22aday;"512703885165596672";https://twitter.com/RepCuellar/status/512703885165596672
;2014-09-18 15:30;1;0;"1 call to the #VeteransCrisisLine can save a life: 1-800-273-8255, Press 1 #ThePowerOf1 #Stop22aDay pic.twitter.com/ANs0mvZjVT";;;#VeteransCrisisLine #ThePowerOf1 #Stop22aDay;"512700202319241216";https://twitter.com/RepCuellar/status/512700202319241216
;2014-09-18 14:50;1;0;"Thank you, President @poroshenkoold for addressing the US Congress & sharing your vision of #freedom for #Ukraine";;@poroshenkoold;#freedom #Ukraine;"512690081899880448";https://twitter.com/RepCuellar/status/512690081899880448
;2014-09-18 14:50;0;1;"As Americans, we are drawn to help the cause of freedom and democracy around the world";;;;"512690045447204864";https://twitter.com/RepCuellar/status/512690045447204864
;2014-09-18 14:50;0;0;"This morning, I participated in a Joint Meeting of Congress with #Ukrainian President Petro @poroshenkoold";;@poroshenkoold;#Ukrainian;"512690017244676096";https://twitter.com/RepCuellar/status/512690017244676096
;2014-09-18 09:30;4;4;"As a result of the #ACA , small businesses have saved more than $2.5 billion in lower upfront premiums and rebates http:// go.cms.gov/1qCoMWW";;;#ACA;"512609501891940352";https://twitter.com/RepCuellar/status/512609501891940352
;2014-09-18 09:00;1;1;"Since the enactment of the ACA, healthcare costs have grown at the slowest rate in 50 years http:// bit.ly/1qZ2Tya";;;;"512602006561644544";https://twitter.com/RepCuellar/status/512602006561644544
;2014-09-18 08:45;0;0;"Since #ACA became law, more than 90 of increase in employment has been in full-time jobs http:// 1.usa.gov/1rsoAUE";;;#ACA;"512598173508853760";https://twitter.com/RepCuellar/status/512598173508853760
;2014-09-18 08:30;0;0;"Since the #ACA was passed in 2010, the economy has created 10 million private sector jobs http:// 1.usa.gov/1rsoAUE pic.twitter.com/HdoMkmqW5S";;;#ACA;"512594456801865728";https://twitter.com/RepCuellar/status/512594456801865728
;2014-09-17 16:44;0;0;"We need to work closely with our allies and regional partners to look at all options to combat ISIL and ensure our citizens are protected.";;;;"512356350521651200";https://twitter.com/RepCuellar/status/512356350521651200
;2014-09-17 16:44;0;0;"The United States should have all tools at its disposal to confront the threat posed by this terrorist group.";;;;"512356328635785216";https://twitter.com/RepCuellar/status/512356328635785216
;2014-09-17 16:43;0;0;"ISIL clearly poses a new type of threat to the United States as it is well organized, well-funded, and extremely brutal";;;;"512356311212646400";https://twitter.com/RepCuellar/status/512356311212646400
;2014-09-17 16:43;3;1;"I voted today in favor of a plan to train and equip the moderate Syrian opposition groups so that they can combat the terrorist group ISIL";;;;"512356287099592704";https://twitter.com/RepCuellar/status/512356287099592704
;2014-09-17 15:40;3;2;"Happy #ConstitutionDay2014 ! The essential principles of our government were signed into law on this day in 1787 pic.twitter.com/SnYHVxCr0o";;;#ConstitutionDay2014;"512340223150546945";https://twitter.com/RepCuellar/status/512340223150546945
;2014-09-17 15:00;0;1;"RSVP now for my Wed 9/24 #TribLive lunch & conversation with @TexasTribune in #SATX . Free & open to the public! http:// trib.it/1tast4V";;@TexasTribune;#TribLive #SATX;"512330243453906944";https://twitter.com/RepCuellar/status/512330243453906944
;2014-09-17 13:00;0;2;"Great to meet with @AmericanCancer Society & Laredoan Rene Martinez in DC to express my support for fighting #cancer pic.twitter.com/ycYtnmj5e4";;@AmericanCancer;#cancer;"512300053252161536";https://twitter.com/RepCuellar/status/512300053252161536
;2014-09-17 12:43;0;0;"Wed 9/24: I chat on-the-record with @EvanASmith of @TexasTribune at @UTSA Downtown. Free & open to the public! RSVP: http:// trib.it/1tast4V";;@EvanASmith @TexasTribune @UTSA;;"512295828246261760";https://twitter.com/RepCuellar/status/512295828246261760
;2014-09-17 12:41;0;1;"As a former small business owner, I am pleased to accept @NFIBlive Guardian of #SmallBiz Award this morning pic.twitter.com/oFRN0rZQXb";;@NFIBlive;#SmallBiz;"512295188921065472";https://twitter.com/RepCuellar/status/512295188921065472
;2014-09-16 13:30;0;0;"New #ACA report shows significant decreases in the number of uninsured Americans http:// politi.co/1tYPYjm";;;#ACA;"511945160133865472";https://twitter.com/RepCuellar/status/511945160133865472
;2014-09-16 13:25;2;0;"Cuellar: Debate on Immigration Surge Set to Re-Emerge @nachoaguilar http:// bit.ly/1wo06Aj";;@nachoaguilar;;"511944041861492736";https://twitter.com/RepCuellar/status/511944041861492736
;2014-09-16 13:00;2;4;"As students head back to school, I encourage you to reach out, get involved, and work hard @TheCHLI http:// bit.ly/1r0ctCq";;@TheCHLI;;"511937653697048577";https://twitter.com/RepCuellar/status/511937653697048577
;2014-09-16 12:30;4;3;"Job well done by Laredo @CustomsBorder officers, who seized nearly $3 million in narcotics @KSATNews http:// bit.ly/1uFlNM2";;@CustomsBorder @KSATNews;;"511930041857372160";https://twitter.com/RepCuellar/status/511930041857372160
;2014-09-16 12:00;1;0;"Rep. Cuellar “If we do this right…we will be the new Middle East of the world when it comes to energy” @Newspapertree http:// bit.ly/1m6sWVs";;@Newspapertree;;"511922549559525376";https://twitter.com/RepCuellar/status/511922549559525376
;2014-09-16 10:45;1;2;"¡Este es el Mes de la Herencia Hispana! Juntos celebramos las contribuciones que la comunidad Hispana ha hecho a nuestro país. #latism";;;#latism;"511903617863806976";https://twitter.com/RepCuellar/status/511903617863806976
;2014-09-16 10:30;2;2;"This is Hispanic Heritage Month! Together we celebrate the contributions the Hispanic community has made to our country.";;;;"511899878083928066";https://twitter.com/RepCuellar/status/511899878083928066
;2014-09-16 10:15;0;1;"Joining my friends in South Texas to wish a happy Independence Day to México http:// bit.ly/1wzEVhI";;;;"511896061556715521";https://twitter.com/RepCuellar/status/511896061556715521
;2014-09-16 10:14;0;0;"An interesting perspective that everyone should read MT @jamesrhenson http:// nyti.ms/1m9CFdn";;@jamesrhenson;;"511895892287574017";https://twitter.com/RepCuellar/status/511895892287574017
;2014-09-16 10:09;0;1;"Hoy felicito a todos mis amigos mexicanos en su día de #IndependenciadeMéxico #HHM #Latism";;;#IndependenciadeMéxico #HHM #Latism;"511894715567210496";https://twitter.com/RepCuellar/status/511894715567210496
;2014-09-16 10:00;1;1;". @Callerdotcom Immigration backlog keeps people in limbo as waiting time hits average of a year and half http:// bit.ly/1oRfsbB";;@Callerdotcom;;"511892332388438017";https://twitter.com/RepCuellar/status/511892332388438017
;2014-09-16 09:00;2;2;"My staff welcomed Roma ISD's new Veterans Memorial Elementary School with a flag flown over the U.S. Capitol. pic.twitter.com/FgmbJ30eNg";;;;"511877214233563136";https://twitter.com/RepCuellar/status/511877214233563136
;2014-09-15 15:32;0;2;"Shorter waiting times at the international bridges on the border means more trade and commerce for our state. http:// bit.ly/1qXk4Aj";;;;"511613544937578496";https://twitter.com/RepCuellar/status/511613544937578496
;2014-09-15 14:30;1;2;"Congratulations to the new @TexasTech Chancellor, Robert Duncan! Great to meet with you in DC & discuss your plans pic.twitter.com/qvnx7u8rBQ";;@TexasTech;;"511597902892773378";https://twitter.com/RepCuellar/status/511597902892773378
;2014-09-15 13:34;1;2;"My office greeted six Laredo WWI veterans in DC on Honor Flight program. Thank you for your service & sacrifice! pic.twitter.com/PzVB1g7zib";;;;"511583741349994496";https://twitter.com/RepCuellar/status/511583741349994496
;2014-09-15 13:25;0;0;"What does Hispanic Heritage Month mean to you? Hard work, family values, and the American Dream #WhatLatinoMeanstoMe http:// bzfd.it/1q7Jes4";;;#WhatLatinoMeanstoMe;"511581476157411328";https://twitter.com/RepCuellar/status/511581476157411328
;2014-09-15 12:00;2;3;"I am looking forward to joining @nachoaguilar and @RepBetoORourke at this weekend’s #tribunefest on border security http://www. texastribune.org/festival/2014/ tracks/immigration/ …";;@nachoaguilar @RepBetoORourke;#tribunefest;"511560164055330818";https://twitter.com/RepCuellar/status/511560164055330818
;2014-09-15 10:27;0;2;"I will be speaking at the #tribunefest this Sat on #bordersecurity . Do you have questions for me or topics you want to hear about? #AskTX28";;;#tribunefest #bordersecurity #AskTX28;"511536714989723649";https://twitter.com/RepCuellar/status/511536714989723649
;2014-09-13 14:07;4;2;"District Judge Marina Garcia Marmolejo is the Hispanic National Bar Association Latina Judge of the Year. Congrats! pic.twitter.com/dN19evZFul";;;;"510867404029952000";https://twitter.com/RepCuellar/status/510867404029952000
;2014-09-12 10:17;1;1;"Great to meet with a group of @UTexasLaw students and grads this week & think back on my great experience there pic.twitter.com/BtRhvV8fJh";;@UTexasLaw;;"510447229082284032";https://twitter.com/RepCuellar/status/510447229082284032
;2014-09-11 17:17;0;1;"My thoughts and prayers continue to go out to the families of the two Americans who were brutally murdered by ISIL";;;;"510190538113712129";https://twitter.com/RepCuellar/status/510190538113712129
;2014-09-11 17:17;0;1;"Confronting threat of ISIL requires national unity and I urge the President & Congress to act swiftly and decisively on plan to defeat ISIL";;;;"510190509139451904";https://twitter.com/RepCuellar/status/510190509139451904
;2014-09-11 17:17;0;1;"Now is the time to rally behind the men and women of our armed forces and it is not a time to play politics.";;;;"510190480655921152";https://twitter.com/RepCuellar/status/510190480655921152
;2014-09-11 17:17;1;0;"Last night, the President announced that the United States will lead a broad coalition of our allies to defeat ISIL and deny them safe haven";;;;"510190456391892992";https://twitter.com/RepCuellar/status/510190456391892992
;2014-09-11 08:20;2;3;"We will #neverforget the tragedy and terrible loss of #911. Today we remember the first responders & the men and women who lost their lives";;;#neverforget #911;"510055357759365120";https://twitter.com/RepCuellar/status/510055357759365120
;2014-09-10 10:23;6;0;"Great to join @TomLatham @FedNewsRadio @NAPAWash to talk about one of my passions – gov't performance and efficiency pic.twitter.com/mNXsH8coJO";;@TomLatham @FedNewsRadio @NAPAWash;;"509723793410244610";https://twitter.com/RepCuellar/status/509723793410244610
;2014-09-10 10:15;1;0;"Check out how consumer spending has gone up under President Obama & in doing so has improved the American economy: http:// go.wh.gov/8yC5cu";;;;"509721744999841793";https://twitter.com/RepCuellar/status/509721744999841793
;2014-09-10 10:10;1;0;"The Dem #MiddleClassFirst agenda will modernize America's infrastructure by building roads, bridges & broadband tech: http:// Dems.gov/Jumpstart";;;#MiddleClassFirst;"509720502395351040";https://twitter.com/RepCuellar/status/509720502395351040
;2014-09-10 10:06;4;1;"On this week's anniversary of #VAWA , we recommit to strengthening protections for all victims! pic.twitter.com/gGllqwTs4Y";;;#VAWA;"509719598984593408";https://twitter.com/RepCuellar/status/509719598984593408
;2014-09-10 10:00;4;27;"My staff met with @LittleLizzieV this week to express my support to #EndBullyingSSIA #ImwithLizzie pic.twitter.com/6OIJH8328b";;@LittleLizzieV;#EndBullyingSSIA #ImwithLizzie;"509717973540413440";https://twitter.com/RepCuellar/status/509717973540413440
;2014-09-10 09:00;0;0;"Great meeting with #HongKong ’s new Commissioner to US to discuss our shared commitment to #trade pic.twitter.com/Kj1HwoinRN";;;#HongKong #trade;"509702879993540608";https://twitter.com/RepCuellar/status/509702879993540608
;2014-09-10 08:00;2;1;"Veteran unemployment has decreased over the past year http:// 1.usa.gov/1qCdHC9";;;;"509687774614536192";https://twitter.com/RepCuellar/status/509687774614536192
;2014-09-09 06:06;2;1;"Joining @Morning_Joe in a few minutes to talk about #immigration and #cir - hope you time in! pic.twitter.com/4mwddazhBE";;@Morning_Joe;#immigration #cir;"509296792484458496";https://twitter.com/RepCuellar/status/509296792484458496
;2014-09-07 10:00;1;2;"My staff visited constituents in Converse, TX to provide an overview of the services my office provides to #veterans pic.twitter.com/KGYuXm32W5";;;#veterans;"508630814116954112";https://twitter.com/RepCuellar/status/508630814116954112
;2014-09-06 10:30;1;0;"The CBO has been reducing its est. on how much fed govt will need to spend on #Medicare in the future years http:// nyti.ms/XZxGBu";;;#Medicare;"508275993228746753";https://twitter.com/RepCuellar/status/508275993228746753
;2014-09-05 14:00;0;2;"“CBP seizes counterfeit tablets worth 1.1 Million” Great work, @CBPSouthTexas ! http:// goo.gl/HBYFBo pic.twitter.com/wGfnDThPwU";;@CBPSouthTexas;;"507966450246488064";https://twitter.com/RepCuellar/status/507966450246488064
;2014-09-05 13:00;1;0;"What issues would you like #Congress to tackle?";;;#Congress;"507951311556317184";https://twitter.com/RepCuellar/status/507951311556317184
;2014-09-05 11:00;2;2;"I hosted a workshop with @HUDgov at @txamiu this week to discuss a revitalization plan and hopes for a #PromiseZone designation for Laredo";;@HUDgov @txamiu;#PromiseZone;"507921164396556288";https://twitter.com/RepCuellar/status/507921164396556288
;2014-09-05 10:30;0;0;".@HSSGov Regional Dir. Marjorie Petty visited my SA office to discuss outreach initiatives for Marketplace enrollment pic.twitter.com/B3nMsW72ZB";;@HSSGov;;"507913638506557440";https://twitter.com/RepCuellar/status/507913638506557440
;2014-09-05 10:00;2;1;"Production in #EagleFord Shale is keeping gas prices affordable: http:// goo.gl/OlbpwW pic.twitter.com/954paAWFp5";;;#EagleFord;"507906063417352192";https://twitter.com/RepCuellar/status/507906063417352192
;2014-09-05 09:00;5;0;"El Salvador consulate opens in McAllen where #RGV is at the forefront of this #bordercrisis http:// bit.ly/1prgNeh";;;#RGV #bordercrisis;"507890963553845248";https://twitter.com/RepCuellar/status/507890963553845248
;2014-09-05 08:00;0;0;". @ElPeriodico_USA : “El representante federal Cuéllar y diputados de México anuncian colaboración entre ambos países” #ReformaEnergetica";;@ElPeriodico_USA;#ReformaEnergetica;"507875832270819328";https://twitter.com/RepCuellar/status/507875832270819328
;2014-09-04 20:15;1;1;"I hosted a workshop with @HUDgov at @txamiu this week to discuss a revitalization plan and hopes for a #PromiseZone designation for Laredo";;@HUDgov @txamiu;#PromiseZone;"507698388221952000";https://twitter.com/RepCuellar/status/507698388221952000
;2014-09-04 19:16;0;0;".@elquiosco_mx: “Mejoran aeropuerto con inversión de 10 mdd” #Laredo http:// elquiosco.mx/mejoran-aeropu erto-con-inversion-de-10-mdd/ …";;@elquiosco_mx;#Laredo;"507683582731911169";https://twitter.com/RepCuellar/status/507683582731911169
;2014-09-04 19:15;1;1;"Downtown Laredo will soon have an outlet mall http:// youtu.be/MKk7COg-H-o #sales #jobs pic.twitter.com/ffxkTNFEak";;;#sales #jobs;"507683296927444992";https://twitter.com/RepCuellar/status/507683296927444992
;2014-09-04 10:00;1;0;"National Preparedness Month started September 1! Follow #NatlPrep for tips. More info: http://www. ready.gov/september";;;#NatlPrep;"507543664759828481";https://twitter.com/RepCuellar/status/507543664759828481
;2014-09-03 15:57;0;1;"It was great to meet @CaneloOficial at @peopleenespanol #FestivalPeople in #SATX this past weekend pic.twitter.com/ow1IjkUacV";;@CaneloOficial @peopleenespanol;#FestivalPeople #SATX;"507271098493579264";https://twitter.com/RepCuellar/status/507271098493579264
