username;date;retweets;favorites;text;geo;mentions;hashtags;id;permalink
;2013-08-14 11:03;2;3;"Great job @selcharrodeoro singing the National Anthem last night in #SanAntonio #Spurs pic.twitter.com/fC7xwJ79bk";;@selcharrodeoro;#SanAntonio #Spurs;"367677937622872066";https://twitter.com/RepCuellar/status/367677937622872066
;2013-08-13 17:36;2;0;"US Budget Deficit Down 37.6 Percent Through July, Lowest In 5 Years @CBSNews DC http:// cbsloc.al/17mQjxj";;@CBSNews;;"367414416330862593";https://twitter.com/RepCuellar/status/367414416330862593
;2013-08-10 14:19;1;0;"Pentagon reduces defense furloughs from 11 to 6 days http://www. washingtonpost.com/blogs/federal- eye/wp/2013/08/06/pentagon-to-reduce-defense-furloughs-again/ …";;;;"366277730767077376";https://twitter.com/RepCuellar/status/366277730767077376
;2013-08-09 13:26;1;0;"Thanks @3rdsalinas for having me on @periodicoenlace to talk #StarrCounty grants tour http:// periodicoenlacergv.com";;@3rdsalinas @periodicoenlace;#StarrCounty;"365901819278405632";https://twitter.com/RepCuellar/status/365901819278405632
;2013-08-09 12:24;5;1;"15 yrs ago I helped pass tax-free weekend legislation. Texans expected to save $79 million this tax-free weekend http:// shar.es/yjJuk";;;;"365886275829510145";https://twitter.com/RepCuellar/status/365886275829510145
;2013-08-08 11:11;1;0;"Check out pictures from Day 1 of Summer ’13 Grants Tour https://www. facebook.com/media/set/?set =a.10151748113896551.1073741864.152569121550&type=1&l=eb0e92db09 …";;;;"365505454140432384";https://twitter.com/RepCuellar/status/365505454140432384
;2013-08-07 17:32;9;1;"Hidalgo, Starr, and Webb counties ranked as counties that will benefit most from #ACA according to @CAPAction report http:// cap.af/17lZQ6C";;@CAPAction;#ACA;"365239141983731713";https://twitter.com/RepCuellar/status/365239141983731713
;2013-08-07 13:04;1;0;"Thx to @McCaulPressShop @RepKevinYoder @RepLeonardLance Webb County Sheriff Cuellar for visiting the border this week pic.twitter.com/MChewE9XIU";;@McCaulPressShop @RepKevinYoder @RepLeonardLance;;"365171702877024256";https://twitter.com/RepCuellar/status/365171702877024256
;2013-08-07 11:36;2;1;"Best wishes to Judson HS track team this coming school yr - let's continue State Championship tradition! #converse pic.twitter.com/Q6c5gq5hgS";;;#converse;"365149538870231041";https://twitter.com/RepCuellar/status/365149538870231041
;2013-08-06 14:49;3;0;"Administration announces new call center for small businesses to learn about healthcare enrollment - call 1-800-706-7893 for resources #ACA";;;#ACA;"364835702527115264";https://twitter.com/RepCuellar/status/364835702527115264
;2013-08-05 13:02;2;1;"Welcome to DC to #Hidalgo City Manager Joe Vera & family. See you in the #RGV soon! pic.twitter.com/kfVcTnrkDZ";;;#Hidalgo #RGV;"364446227015802880";https://twitter.com/RepCuellar/status/364446227015802880
;2013-08-05 10:18;10;4;"Texas ranked as most oil rich state in country #jobs #eaglefordshale http:// usat.ly/1ehi11d via @USATODAY";;@USATODAY;#jobs #eaglefordshale;"364404930234159106";https://twitter.com/RepCuellar/status/364404930234159106
;2013-08-05 08:49;1;0;"Great to greet two Laredo HS students here in DC @NancyRamirez @AugusteRamos pic.twitter.com/Qg4TmPXDmb";;@NancyRamirez @AugusteRamos;;"364382670177841152";https://twitter.com/RepCuellar/status/364382670177841152
;2013-08-03 08:56;1;1;"U.S. adds 162,000 jobs; unemployment rate at 7.4% #jobs http:// on.wsj.com/14nMoUN via @WSJ";;@WSJ;#jobs;"363659728183762944";https://twitter.com/RepCuellar/status/363659728183762944
;2013-07-31 22:50;3;0;"My staff members, Nichole Hernandez and Alexis Gallegos attended @OperationLnStr at Ringgold M.S. in #RioGrandeCity pic.twitter.com/GNgdxlN9Du";;@OperationLnStr;#RioGrandeCity;"362782426193342466";https://twitter.com/RepCuellar/status/362782426193342466
;2013-07-31 16:58;1;0;"My Customer Service bill HR 1660 passes the House! Watch my full statement at http://www. youtube.com/watch?v=jEijyj pqR6E&feature=youtu.be … .";;;;"362693795382444032";https://twitter.com/RepCuellar/status/362693795382444032
;2013-07-31 14:52;1;0;"Connecting federal funds 2 local needs thru grants conference 2day in #Laredo #Floresville #SanAntonio #RioGrandeCity pic.twitter.com/R5Ji30R6t9";;;#Laredo #Floresville #SanAntonio #RioGrandeCity;"362662121416314880";https://twitter.com/RepCuellar/status/362662121416314880
;2013-07-31 13:52;2;1;"My Outreach Rep Pete Arguello attended #CityofLiveOak council meeting and met with Mayor Mary M. Dennis pic.twitter.com/KiBseLlECj";;;#CityofLiveOak;"362647087541800960";https://twitter.com/RepCuellar/status/362647087541800960
;2013-07-30 18:43;1;1;"Met with Erika Rios today, student from Mission, and welcomed her to the Capitol. Hope you enjoyed your summer in DC! pic.twitter.com/6B5pZymWZW";;;;"362357869284302850";https://twitter.com/RepCuellar/status/362357869284302850
;2013-07-30 17:03;2;0;"I spoke to @JuniorStatesmenofAmerica summer school students today - thx for the great questions on #VRA #CIR pic.twitter.com/FaL4NmXXhW";;@JuniorStatesmenofAmerica;#VRA #CIR;"362332540964569089";https://twitter.com/RepCuellar/status/362332540964569089
;2013-07-30 16:11;0;0;"48 years ago today, former President Lyndon B. Johnson signed Medicare into law http://www. aarp.org/health/medicar e-insurance/info-07-2013/medicare-anniversary-july-30-1965.html?intcmp=HPBB2J …";;;;"362319507236200448";https://twitter.com/RepCuellar/status/362319507236200448
;2013-07-30 15:33;1;0;"joined @NancyPelosi @WhipHoyer @Clyburn @RepMarciaFudge @Rosa_DeLauro @RepAndrews to discuss race & justice in US pic.twitter.com/Owh4hLbKu0";;@NancyPelosi @WhipHoyer @Clyburn @RepMarciaFudge @Rosa_DeLauro @RepAndrews;;"362309921880027138";https://twitter.com/RepCuellar/status/362309921880027138
;2013-07-30 15:07;1;0;"AG Holder seeks to restore #preclearance for changes to district boundaries & election laws in #Texas . #VRA http://www. themonitor.com/opinion/the_mo nitor_view/article_40d995ec-f8a9-11e2-a20c-0019bb30f31a.html …";;;#preclearance #Texas #VRA;"362303365054607360";https://twitter.com/RepCuellar/status/362303365054607360
;2013-07-30 10:18;0;0;"My Outreach Rep Gilbert Lafuente w Krista Sherwood @Natl Parks Service Advisory Committee mtg pic.twitter.com/ym9eTtxpar";;@Natl;;"362230695428517888";https://twitter.com/RepCuellar/status/362230695428517888
;2013-07-30 08:41;0;0;"White House touts slow increase in health care costs http:// usat.ly/1e6I6zP via @USATODAY";;@USATODAY;;"362206374312148992";https://twitter.com/RepCuellar/status/362206374312148992
;2013-07-29 18:11;1;0;"Today, my Outreach Rep. Jorge Garcia met w/ Reps. from @WestCare and La Familia Consulting and Counseling Services. pic.twitter.com/VmDJp2yi8x";;@WestCare;;"361987249132412928";https://twitter.com/RepCuellar/status/361987249132412928
;2013-07-29 16:16;0;0;"@businessinsider named Laredo, TX one of the Top 20 safest cities in America";;@businessinsider;;"361958322062114816";https://twitter.com/RepCuellar/status/361958322062114816
;2013-07-28 12:11;1;0;"My outreach rep, Nichole Hernandez, attended Keepin' It Rio Market Days. Congrats to all performers! pic.twitter.com/7hYNBPWxaw";;;;"361534510074052609";https://twitter.com/RepCuellar/status/361534510074052609
;2013-07-28 11:33;1;0;"My outreach rep, Nichole Hernandez, attended Keepin' It Rio Market Days. Congrats to all performers! pic.twitter.com/0Kd3C5Fc1x";;;;"361524848478011392";https://twitter.com/RepCuellar/status/361524848478011392
;2013-07-26 11:02;3;1;"Attend next week’s "Summer of Success Series" @txamiu to attain a HUB certification for your small business! pic.twitter.com/YYBoFdGFsF";;@txamiu;;"360792313393467392";https://twitter.com/RepCuellar/status/360792313393467392
;2013-07-25 13:15;2;1;"Glad 2 #rethinktheborder today w @RepFilemonVela @RepJuanVargas @RepGrijalvaCS @RepBetoORourke @RepPeteGallego pic.twitter.com/2EFC4m92uM";;@RepFilemonVela @RepJuanVargas @RepGrijalvaCS @RepBetoORourke @RepPeteGallego;#rethinktheborder;"360463359595933696";https://twitter.com/RepCuellar/status/360463359595933696
;2013-07-24 16:22;2;1;"My Staff met with @SocialSecurity Disability to discuss pending issues w the agency in @HidalgoHidalgo & Starr County pic.twitter.com/5uqfkO2T3g";;@SocialSecurity @HidalgoHidalgo;;"360148063341395968";https://twitter.com/RepCuellar/status/360148063341395968
;2013-07-24 14:07;14;4;"Excited to introduce @IvonneOP to Ranking Member David Price and @RepJoseSerrano at today's FY '14 approps mark-up pic.twitter.com/AbsqV0dIub";;@IvonneOP @RepJoseSerrano;;"360113922453417984";https://twitter.com/RepCuellar/status/360113922453417984
;2013-07-24 11:05;1;2;"My District Staff toured Doctors Hospital at Renaissance in @edinburg to discuss better #healthcare for the #RGV pic.twitter.com/5yvwQ49R5y";;@edinburg;#healthcare #RGV;"360068318243196928";https://twitter.com/RepCuellar/status/360068318243196928
;2013-07-23 15:03;0;0;"July 31-12:30CT Housing Loans & Grants Video-conference For additional information and how to RSVP please click here http:// 1.usa.gov/1c0pWSc";;;;"359765800493658113";https://twitter.com/RepCuellar/status/359765800493658113
;2013-07-22 16:26;0;0;"Congratulations, Stacey Tisdale from Wilson County for winning the cover photo contest for this week! pic.twitter.com/A19cW8X8KW";;;;"359424302786957312";https://twitter.com/RepCuellar/status/359424302786957312
;2013-07-22 15:03;1;1;"Met w over 35 students participants of the Georgetown Community Scholars Summer program @Georgetown pic.twitter.com/ZGKU51VW3d";;@Georgetown;;"359403262903975937";https://twitter.com/RepCuellar/status/359403262903975937
;2013-07-19 16:51;3;0;"Thank you @TheCHLI for allowing me to participate at this year’s Future Leaders Conference in Washington, D.C. pic.twitter.com/OJOzwBuWdA";;@TheCHLI;;"358343358583799810";https://twitter.com/RepCuellar/status/358343358583799810
;2013-07-19 10:00;2;1;"Big “thank you” to the Summer 2013 congressional interns and for all of your assistance pic.twitter.com/KhrjhF8hJe";;;;"358239901143150592";https://twitter.com/RepCuellar/status/358239901143150592
;2013-07-18 09:08;1;0;"Met w three finalists of the Texas Farm Bureau ‘s Free Enterprise Speech Contest @TexasFarmBureau pic.twitter.com/l59SuPSlKY";;@TexasFarmBureau;;"357864357159370755";https://twitter.com/RepCuellar/status/357864357159370755
;2013-07-17 17:51;0;0;"#HSBC reported TX-based companies focused on international trade have 5% higher profit margins than their low-international counterparts";;;#HSBC;"357633583151718400";https://twitter.com/RepCuellar/status/357633583151718400
;2013-07-17 16:42;3;0;"Met today w three finalists of the Texas Farm Bureau ‘s Free Enterprise Speech Contest @TexasFarmBureau pic.twitter.com/MIwurGHjtk";;@TexasFarmBureau;;"357616367920373761";https://twitter.com/RepCuellar/status/357616367920373761
;2013-07-17 15:41;13;4;"My district is already reaping the benefits of #ACA ! Ex: 54,000 children with preexisting health conditions can no longer be denied coverage";;;#ACA;"357600977261559809";https://twitter.com/RepCuellar/status/357600977261559809
;2013-07-17 15:35;0;0;"Ready for a friendly competition? Send me a pic representative of our District via FB: http:// on.fb.me/18J52qZ pic.twitter.com/6Qj7CyzBEk";;;;"357599578742198272";https://twitter.com/RepCuellar/status/357599578742198272
;2013-07-16 19:18;1;0;"Met with District Attorney Isidro Alaniz in Washington, D.C. to discuss unique issues faced by border prosecutors. pic.twitter.com/rG4tWIA9PO";;;;"357293295967293440";https://twitter.com/RepCuellar/status/357293295967293440
;2013-07-16 11:02;1;0;"Thank you Antonio for having me on your program to discuss #ImmigrationReform @WCVI";;@WCVI;#ImmigrationReform;"357168374217850880";https://twitter.com/RepCuellar/status/357168374217850880
;2013-07-16 10:11;0;0;"U.S. consumer prices rose 0.5% in June, marking the biggest increase since Feb 2013 @MarketWatch http:// on.mktw.net/15K3qtT";;@MarketWatch;;"357155433242308609";https://twitter.com/RepCuellar/status/357155433242308609
;2013-07-15 18:45;2;1;"Happy to have stopped by the Roma Community Center to congratulate the Challenger Division #Baseball Game Players pic.twitter.com/P37lEeqGT5";;;#Baseball;"356922625689255936";https://twitter.com/RepCuellar/status/356922625689255936
;2013-07-15 18:30;3;0;"Tune in Pacific Public Radio at 6:35CT where I will be discussing #CIR on “Strategy Sessions Antonio Gonzalez” http://www. kpfk.org/index.php @WCVI";;@WCVI;#CIR;"356918744301305856";https://twitter.com/RepCuellar/status/356918744301305856
;2013-07-15 13:00;1;1;"Participated today at the historic unveiling ceremony of the Texas #Interstate69 @TxDOT pic.twitter.com/XCci8R5kqc";;@TxDOT;#Interstate69;"356835736705695746";https://twitter.com/RepCuellar/status/356835736705695746
;2013-07-12 16:52;0;0;"@NYTimes " A refusal to even sit at a bargaining table is another way of refusing to govern" We need #CIR & #FarmBill http:// nyti.ms/12qOrEu";;@NYTimes;#CIR #FarmBill;"355807001885945858";https://twitter.com/RepCuellar/status/355807001885945858
;2013-07-12 16:03;0;1;"Congratulations #GatewayCommHealth - #HHC funds will provide health asst. to uninsured members of the community #ACA pic.twitter.com/DXCamwOHOK";;;#GatewayCommHealth #HHC #ACA;"355794605779845120";https://twitter.com/RepCuellar/status/355794605779845120
;2013-07-12 12:14;0;3;"Today, I attended the groundbreaking ceremony of the new Gold’s Gym location in #Laredo @GoldsGym pic.twitter.com/uAIeBeXywM";;@GoldsGym;#Laredo;"355736997513531392";https://twitter.com/RepCuellar/status/355736997513531392
;2013-07-12 07:33;1;0;"Data released by International Trade Admin show SA area exports reached $14billion in 2012 Read more: http:// bit.ly/134akVB @SABizJournal";;@SABizJournal;;"355666106129715203";https://twitter.com/RepCuellar/status/355666106129715203
;2013-07-11 18:14;2;2;"Watch my remarks at Border Caucus press conference addressing immigration reform and border security http://www. c-spanvideo.org/clip/4458484";;;;"355465106685034497";https://twitter.com/RepCuellar/status/355465106685034497
;2013-07-11 09:01;2;0;"Met with Mr. Roper, from @LacklandISD, Mr. Walker and Mr. Johnson from @rfisd to discuss the Impact Aid program pic.twitter.com/kk1aPz6MGr";;@LacklandISD @rfisd;;"355325956359086080";https://twitter.com/RepCuellar/status/355325956359086080
;2013-07-10 16:51;3;1;"Participated at Border Caucus press conference on #ImmigrationReform with Leader Pelosi @Nancypelosi pic.twitter.com/vzVxRWJynH";;@Nancypelosi;#ImmigrationReform;"355081806745309184";https://twitter.com/RepCuellar/status/355081806745309184
;2013-07-10 15:53;1;0;"HHS awards $150m in grant funds to over 1,000 health centers across the nation #ACA";;;#ACA;"355067349524676609";https://twitter.com/RepCuellar/status/355067349524676609
;2013-07-09 07:23;1;0;"Thank you Tim for having me on your show this morning to discuss #immigrationreform @MorningBriefing";;@MorningBriefing;#immigrationreform;"354576450067767299";https://twitter.com/RepCuellar/status/354576450067767299
;2013-07-08 15:48;3;1;"Join me for coffee at the Rancho Cafe next Saturday, July 13, at 10:00 a.m. I look forward to seeing you there. pic.twitter.com/s9ZqQCbffV";;;;"354341152658427905";https://twitter.com/RepCuellar/status/354341152658427905
;2013-07-08 12:39;6;2;"Congratulations @TAMIU for ranking top ten in the nation’s most affordable colleges list #TXED #highered #fachat #emchat";;@TAMIU;#TXED #highered #fachat #emchat;"354293746944315392";https://twitter.com/RepCuellar/status/354293746944315392
;2013-07-03 11:34;1;0;"Key #ACA requirement delayed for one year. http:// politi.co/17Tca4n Learn more about Health Insurance Marketplace here https://www. healthcare.gov /";;;#ACA;"352465413948448768";https://twitter.com/RepCuellar/status/352465413948448768
;2013-07-03 11:16;0;1;"Congratulations @ConverseEDC for receiving the 2013 Green Practitioner Award! #Go #Green";;@ConverseEDC;#Go #Green;"352460778797940737";https://twitter.com/RepCuellar/status/352460778797940737
;2013-07-02 13:40;0;0;"@CMSGov @US_IMLS partnered to prepare librarians to help people learn about the new Health Insurance Marketplace. http:// 1.usa.gov/1cIwTEU";;@CMSGov @US_IMLS;;"352134586488209410";https://twitter.com/RepCuellar/status/352134586488209410
;2013-07-02 09:04;12;1;"We have one more chance to prevent student loan rate doubling before the school year begins #July10 #Education #Affordability #emchat";;;#July10 #Education #Affordability #emchat;"352065266739458053";https://twitter.com/RepCuellar/status/352065266739458053
;2013-06-30 12:39;2;2;"Prontamente estaré grabando una entrevista en Telemundo SA donde discutiré la reforma migratoria @GMorenoKVDA @TelemundoKVDA";;@GMorenoKVDA @TelemundoKVDA;;"351394570413686784";https://twitter.com/RepCuellar/status/351394570413686784
;2013-06-30 11:18;5;4;"Tune in to @FoxNews where I will be discussing #immigrationreform with @ShannonBream @ANHQDC";;@FoxNews @ShannonBream @ANHQDC;#immigrationreform;"351374237614882816";https://twitter.com/RepCuellar/status/351374237614882816
;2013-06-28 16:44;6;1;"“7.4 million borrowers will be affected on July 1st by the student loan rate doubling from 3.4-6.8%.” #Affordable #Education #emchat";;;#Affordable #Education #emchat;"350731414599237633";https://twitter.com/RepCuellar/status/350731414599237633
;2013-06-28 16:12;3;2;"Always humbled to welcome constituents to #DC I met with a big family group from the #RioGrandeValley to the #Capitol pic.twitter.com/5zqQLZ0133";;;#DC #RioGrandeValley #Capitol;"350723415050711040";https://twitter.com/RepCuellar/status/350723415050711040
;2013-06-27 18:18;6;4;"Today is a historic day for every American. Comprehensive Immigration Reform passed the Senate 68-32. I urge the House to act. #CIR #latism";;;#CIR #latism;"350392835863875586";https://twitter.com/RepCuellar/status/350392835863875586
;2013-06-27 14:37;6;2;"Welcomed former Pres of Colombia Alvaro Uribe as Senior Fellow @MarioDB @BPC_Bipartisan @RosLehtinen @treyradel pic.twitter.com/KQVa1Vq6Xy";;@MarioDB @BPC_Bipartisan @RosLehtinen @treyradel;;"350337067466772480";https://twitter.com/RepCuellar/status/350337067466772480
;2013-06-26 17:53;6;4;"Today, I welcomed Alexandra Mascareno & Natalie Gonzalez from Laredo who are currently participating in @CloseUpDC pic.twitter.com/KbKtq8Xa70";;@CloseUpDC;;"350023996655415296";https://twitter.com/RepCuellar/status/350023996655415296
;2013-06-26 16:07;2;1;"Congrats to Venancia Armijo, from #SanAntonio , TX on winning the 2013 Congressional Art Competition pic.twitter.com/Tt0UBSQJpi";;;#SanAntonio;"349997363659669504";https://twitter.com/RepCuellar/status/349997363659669504
;2013-06-26 12:53;1;1;"If student loan interest rate doubles in5 days every loan holder will owe an additional $1K #fachat #emchat #highered pic.twitter.com/divNfqkQbz";;;#fachat #emchat #highered;"349948607560024067";https://twitter.com/RepCuellar/status/349948607560024067
;2013-06-25 15:02;3;3;"Congratulations to #SanAntonio – ranked high on @CNN #Moneylist of top small-business cities in America #Economy#Growth#Texas";;@CNN;#SanAntonio #Moneylist #Economy #Growth #Texas;"349618629551206401";https://twitter.com/RepCuellar/status/349618629551206401
;2013-06-25 15:01;1;1;"Seminars will continue in Laredo for businesses interested in contracting with the govt. Call (956) 725-0639 for info pic.twitter.com/bm1HzlYok1";;;;"349618349510115330";https://twitter.com/RepCuellar/status/349618349510115330
;2013-06-25 14:57;3;3;"Old federal courthouse transferred to City of Laredo last Friday #GSA #Collaboration pic.twitter.com/23waEAMB7K";;;#GSA #Collaboration;"349617320605401088";https://twitter.com/RepCuellar/status/349617320605401088
;2013-06-25 08:01;2;0;"Thank you Tim for having me on your show this morning to discuss #ImmigrationReform @MorningBriefing";;@MorningBriefing;#ImmigrationReform;"349512760310247425";https://twitter.com/RepCuellar/status/349512760310247425
;2013-06-24 15:36;2;0;"7 days left until student loan interest rates double to 6.8% #DontDoubleMyRates #fachat #emchat #highered pic.twitter.com/iWdirjCyTh";;;#DontDoubleMyRates #fachat #emchat #highered;"349264915732779008";https://twitter.com/RepCuellar/status/349264915732779008
;2013-06-21 15:26;0;0;"Texas’s Eagle Ford shale formation rose 54%, producing 530,689 barrels of crude daily @BloombergNews #TexasRailroadComission";;@BloombergNews;#TexasRailroadComission;"348175053483024385";https://twitter.com/RepCuellar/status/348175053483024385
;2013-06-21 12:23;0;0;"@SBA has revised standards to determine which small biz qualify for assistant, learn more http:// 1.usa.gov/gAqKDD";;@SBA;;"348129039619350528";https://twitter.com/RepCuellar/status/348129039619350528
;2013-06-21 12:09;0;0;"ADP(R): May’13 private sector franchise jobs increased by 19,160 @MarketWatch http:// on.mktw.net/12ZOY2C";;@MarketWatch;;"348125434032037889";https://twitter.com/RepCuellar/status/348125434032037889
;2013-06-21 09:24;2;0;"Texas families eligible for $46 million in health care insurance rebates #ACA @Houstonchron @HealthCareGov";;@Houstonchron @HealthCareGov;#ACA;"348083951648243712";https://twitter.com/RepCuellar/status/348083951648243712
;2013-06-20 20:47;5;5;"Let's bring that championship home once again #SpursNation";;;#SpursNation;"347893557878730753";https://twitter.com/RepCuellar/status/347893557878730753
;2013-06-20 18:00;7;0;"Read my statement on Customs and Border Protection plan to avoid sequester furloughs and AUO cuts here: http:// cuellar.house.gov/news/documents ingle.aspx?DocumentID=339993 …";;;;"347851376736468992";https://twitter.com/RepCuellar/status/347851376736468992
;2013-06-19 18:22;2;2;"Katie, it was delightful meeting you today. You are an inspiration to many of us @HarpKT @childrenshospsa pic.twitter.com/3gXnxRvko7";;@HarpKT @childrenshospsa;;"347494718747316226";https://twitter.com/RepCuellar/status/347494718747316226
;2013-06-19 17:10;3;1;"Met w. Katie Sanchez and Gabriela Dominguez, two talented students participating in @CloseUp_DC @lmtnews #Laredo pic.twitter.com/eaBGpmQ5Tw";;@CloseUp_DC @lmtnews;#Laredo;"347476592253100033";https://twitter.com/RepCuellar/status/347476592253100033
;2013-06-19 15:38;6;3;"12 days before #student #loan interest rates double from 3.4% to 6.4% #HigherEd #emchat #fachat pic.twitter.com/7FKUUqeEgr";;;#student #loan #HigherEd #emchat #fachat;"347453304541937664";https://twitter.com/RepCuellar/status/347453304541937664
;2013-06-19 11:59;2;1;"Construction Housing Starts have increased 6.8% as of this May, 29% higher than last year. #Economy#Growth http:// online.wsj.com/article/SB1000 1424127887323566804578553161561122732.html?mod=rss_economy …";;;#Economy #Growth;"347398317178761217";https://twitter.com/RepCuellar/status/347398317178761217
;2013-06-19 10:50;0;1;"Congratulations Ms.MaElena Montemayor from #Laredo HIV/AIDS Consortia on dedication to serving the #community pic.twitter.com/ygy7VFzP5K";;;#Laredo #community;"347380953477435392";https://twitter.com/RepCuellar/status/347380953477435392
;2013-06-19 09:37;6;0;"The moment to act is now. #CBO Reports #Immigration Bill would reduce deficit by $197 billion over 10 years. http://www. cbo.gov /";;;#CBO #Immigration;"347362425269542913";https://twitter.com/RepCuellar/status/347362425269542913
;2013-06-19 07:23;1;0;"I addressed @AGA_AdvanceGov & discussed govt performance & #GPRA pic.twitter.com/JHADfGHdE0";;@AGA_AdvanceGov;#GPRA;"347328672652484608";https://twitter.com/RepCuellar/status/347328672652484608
;2013-06-18 19:00;0;0;"Congrats Emily Landa of Santa Elena & Joel Leal of Mission for winning @TexasCoopPower speech contest! @monitornews pic.twitter.com/S8CQ2cWsfV";;@TexasCoopPower @monitornews;;"347141683667939328";https://twitter.com/RepCuellar/status/347141683667939328
;2013-06-18 10:00;1;1;"@USSupremeCourt ruled against #Proposition200 which would have implemented a proof-of-citizenship requirement, prior to voter registration.";;@USSupremeCourt;#Proposition200;"347005838839390208";https://twitter.com/RepCuellar/status/347005838839390208
;2013-06-18 09:53;9;3;"I urge the Speaker to bring the Student Loan Relief Act of 2013 to a vote now #HigherEd #emchat #sachat pic.twitter.com/8YlOWLC7th";;;#HigherEd #emchat #sachat;"347004101382520832";https://twitter.com/RepCuellar/status/347004101382520832
;2013-06-17 17:28;3;0;"Laredo businesses – interested in contracting services to government entities? Join me this Friday - http:// tinyurl.com/m29ekm7";;;;"346756215126253568";https://twitter.com/RepCuellar/status/346756215126253568
;2013-06-17 12:36;7;1;"In 14 days #student #loan interest rates will double to 6.8%. Congress must act now. #HigherEd#emchat";;;#student #loan #HigherEd #emchat;"346682777967669248";https://twitter.com/RepCuellar/status/346682777967669248
;2013-06-14 10:30;3;2;"Proud to have signed Courtney discharge petition to prevent the doubling of student loan rates expected to start on July 1 #HigherEd#emchat";;;#HigherEd #emchat;"345563815351558144";https://twitter.com/RepCuellar/status/345563815351558144
;2013-06-13 11:02;1;1;"Honored to meet young students participating in @CloseUp_DC program from #SanAntonio , #Floresville , & #UniversalCity pic.twitter.com/daDqSGhZRw";;@CloseUp_DC;#SanAntonio #Floresville #UniversalCity;"345209596723470338";https://twitter.com/RepCuellar/status/345209596723470338
;2013-06-13 09:18;1;0;"Provisions in #ACA will improve mental health coverage @PsychCentral http:// bit.ly/19533ue";;@PsychCentral;#ACA;"345183409544499202";https://twitter.com/RepCuellar/status/345183409544499202
;2013-06-12 14:00;3;1;"Proud to have become a member of the new Congressional Cancer Research and Reform Task Force.";;;;"344891962631016449";https://twitter.com/RepCuellar/status/344891962631016449
