username;date;retweets;favorites;text;geo;mentions;hashtags;id;permalink
;2015-01-23 09:47;11;2;"RT @repjustinamash : #ff @RepDeSantis @RepFleming @RepGarrett @Jim_Jordan @Raul_Labrador @RepMarkMeadows @RepMickMulvaney @RepMattSalmon";;@repjustinamash @RepDeSantis @RepFleming @RepGarrett @Jim_Jordan @Raul_Labrador @RepMarkMeadows @RepMickMulvaney @RepMattSalmon;#ff;"558652176365789184";https://twitter.com/RepGarrett/status/558652176365789184
;2015-01-06 17:00;6;6;"Welcome! MT @RepStefanik : Honored to be sworn in today to serve as New York's 21st Representative to Congress! #NY21 pic.twitter.com/vf2L0wbpwx";;@RepStefanik;#NY21;"552600543286546434";https://twitter.com/RepGarrett/status/552600543286546434
;2015-01-06 13:53;9;11;"It's an honor to be sworn-in to the 114th Congress today. I promise to faithfully serve the people of New Jersey’s 5th District.";;;;"552553518046142464";https://twitter.com/RepGarrett/status/552553518046142464
;2015-01-06 12:02;494;126;"Many constituents have called on me for new leadership. I agree. Today I supported Rep. Daniel Webster for Speaker of the House. #PJNET";;;#PJNET;"552525689464029185";https://twitter.com/RepGarrett/status/552525689464029185
;2014-12-22 10:27;342;13;"Check out my op-ed in @NorthJerseybrk about our desperate need for tax reform. #TCOT #PJNET http:// bit.ly/16JeT1p";;@NorthJerseybrk;#TCOT #PJNET;"547065907231879168";https://twitter.com/RepGarrett/status/547065907231879168
;2014-12-19 09:44;340;7;"Take a moment to watch a recap of the legislative initiatives I pursued this year. #PJNET http:// bit.ly/1zcunH2";;;#PJNET;"545967951665696769";https://twitter.com/RepGarrett/status/545967951665696769
;2014-12-10 10:39;0;0;"RT @SpeakerBoehner : This is the highest award Congress can give to express the appreciation of the American people. http:// youtu.be/rzdHuQ3zklA";;@SpeakerBoehner;;"542720340951306241";https://twitter.com/RepGarrett/status/542720340951306241
;2014-12-09 14:40;368;31;"Wishing all our troops the best this holiday season! Click here http:// 1.usa.gov/1D4EJvd to do the same. #PJNET pic.twitter.com/QtnDkvPO9O";;;#PJNET;"542418654436917248";https://twitter.com/RepGarrett/status/542418654436917248
;2014-11-21 11:02;0;0;"About to join @Varneyco to discuss #immigration . Be sure to tune in!";;@Varneyco;#immigration;"535840670603571201";https://twitter.com/RepGarrett/status/535840670603571201
;2014-11-18 10:43;6;6;"Today’s terrorist attack in Israel is yet another tragic reminder that not everyone in the world respects human life, liberty, and dignity.";;;;"534748743485386752";https://twitter.com/RepGarrett/status/534748743485386752
;2014-09-17 14:45;391;91;"Today, @RepCardenas & I introduced the #FAIRAct to protect Americans from unconstitutional property seizures. #PJNET http:// 1.usa.gov/1s6Yg99";;@RepCardenas;#FAIRAct #PJNET;"512326416604864512";https://twitter.com/RepGarrett/status/512326416604864512
;2014-09-17 11:00;354;40;"On this day in 1787, the U.S. Constitution was signed. RT to tell me why you love the Constitution. Happy #ConstitutionDay2014 ! #PJNET";;;#ConstitutionDay2014 #PJNET;"512269777629614080";https://twitter.com/RepGarrett/status/512269777629614080
;2014-09-11 11:05;3;3;"Today, I join you as we remember those we lost and pray for those who fight to protect our freedom. #NeverForget pic.twitter.com/L7SDrSjicB";;;#NeverForget;"510096888394436608";https://twitter.com/RepGarrett/status/510096888394436608
;2014-09-04 15:43;1;0;"#FSOC irresponsibly & inappropriately designated another U.S. business as too-big-to-fail today. Learn more: http:// 1.usa.gov/1wb2bzw #TBTF";;;#FSOC #TBTF;"507630039270055936";https://twitter.com/RepGarrett/status/507630039270055936
;2014-07-29 12:09;3;2;"Are you part of this group? This is not okay: http:// bit.ly/UyBmYC "";;;;"494167844016250881";https://twitter.com/RepGarrett/status/494167844016250881
;2014-07-29 08:22;2;1;"LIVE MARKUP—> Watch @FinancialCmte discuss legislation on #Fed and more http:// 1.usa.gov/1kkIjZB #4jobs";;@FinancialCmte;#Fed #4jobs;"494110744573513728";https://twitter.com/RepGarrett/status/494110744573513728
;2014-07-29 08:21;2;1;"Fed’s regulatory process is not transparent and fails to consider regulatory costs http:// 1.usa.gov/1kkIjZB #4jobs #finserv";;;#4jobs #finserv;"494110546413625345";https://twitter.com/RepGarrett/status/494110546413625345
;2014-07-28 18:47;1;4;"Thx u @FIAPTG ! MT: Thxs @RepGarrett for hosting a thoughtful & productive discussion on market structure. @OptiverUS pic.twitter.com/i6UVG6ami2";;@FIAPTG @RepGarrett @OptiverUS;;"493905648648609793";https://twitter.com/RepGarrett/status/493905648648609793
;2014-07-28 07:16;3;0;"Excited to host an equity mrkt structure roundtable today! #4jobs #Economy";;;#4jobs #Economy;"493731693803487232";https://twitter.com/RepGarrett/status/493731693803487232
;2014-07-17 14:41;6;2;"My thoughts & prayers are w/ @WaldwickPD NJ as they mourn the loss of Officer Goodell.";;@WaldwickPD;;"489857361948180480";https://twitter.com/RepGarrett/status/489857361948180480
;2014-07-17 14:38;1;0;"RT @NJSP : RIP @WaldwickPD Officer Christopher Goodell. Godspeed brother... #GoneButNeverForgotten pic.twitter.com/YhzOZIJJ43";;@NJSP @WaldwickPD;#GoneButNeverForgotten;"489856725642915840";https://twitter.com/RepGarrett/status/489856725642915840
;2014-07-16 12:01;1;0;"RT @RepCloakroom : The Rep. Garrett (R-NJ) { @RepGarrett } Amendment was adopted by voice";;@RepCloakroom @RepGarrett;;"489454867606695937";https://twitter.com/RepGarrett/status/489454867606695937
;2014-07-15 14:37;2;5;"Lots of adoptable pets at the Capitol today. Support local #NJ shelters & take home a furry friend like this guy: pic.twitter.com/So78SYV51R";;;#NJ;"489131642192408578";https://twitter.com/RepGarrett/status/489131642192408578
;2014-07-15 11:56;0;2;"Thx! MT @AEIecon : We will be live-tweeting the event "Can committees create financial stability?" with @RepGarrett starting... now!";;@AEIecon @RepGarrett;;"489091147214897152";https://twitter.com/RepGarrett/status/489091147214897152
;2014-07-15 08:34;5;0;"RT if this frustrates you... I'm just a bill, yes I'm only a bill, and I'm sitting here on @SenatorReid 's desk: http:// bit.ly/1n3ThCK";;@SenatorReid;;"489040282969989120";https://twitter.com/RepGarrett/status/489040282969989120
;2014-07-10 11:53;25;12;"As #Israel defends itself against rocket attacks from Hamas, it shouldn’t have to defend itself against @WhiteHouse http:// 1.usa.gov/1mjVLvu";;@WhiteHouse;#Israel;"487278523057717248";https://twitter.com/RepGarrett/status/487278523057717248
;2014-07-10 09:03;3;1;"Fed’s regulatory process is not transparent and fails to consider regulatory costs WATCH LIVE http:// 1.usa.gov/VOHgWn";;;;"487235770420572160";https://twitter.com/RepGarrett/status/487235770420572160
;2014-06-24 12:28;259;5;"Lew sure knows how to avoid a direct request for info. Check out my exchange w/ him here: http:// bit.ly/UG5GAU #emptybox #PJNET";;;#emptybox #PJNET;"481489145131708416";https://twitter.com/RepGarrett/status/481489145131708416
;2014-06-24 10:29;5;3;"Happy Birthday, New Jersey! That's right, the Garden State is 350 years old today. #NJ350";;;#NJ350;"481459051449290752";https://twitter.com/RepGarrett/status/481459051449290752
;2014-06-20 12:19;1;1;"I had a chance to check out the great work being done by the Musconetcong Watershed Assoc. Keeping #NJ beautiful! pic.twitter.com/emoO15ChYu";;;#NJ;"480037160914272256";https://twitter.com/RepGarrett/status/480037160914272256
;2014-06-20 11:03;1;1;"RT @RepSteveStivers : Pleasure serving on @FinancialCmte with @RepSeanDuffy , @RepFincherTN08 , @RepFitzpatrick #FF "";;@RepSteveStivers @FinancialCmte @RepSeanDuffy @RepFincherTN08 @RepFitzpatrick;#FF;"480018200461987843";https://twitter.com/RepGarrett/status/480018200461987843
;2014-06-17 16:52;9;11;"The House honored fallen Waldwick Marine Joseph D’Augustine by voting to rename the Waldwick Post Office in his name. http:// bit.ly/1lQ4ZPG";;;;"479018783856918529";https://twitter.com/RepGarrett/status/479018783856918529
;2014-06-12 11:16;245;14;"Americans deserve to know how their money is spent. Check out my interview on @CNBC today http:// bit.ly/1pNdLhE #PJNET #TCOT";;@CNBC;#PJNET #TCOT;"477122232654000128";https://twitter.com/RepGarrett/status/477122232654000128
;2014-06-10 14:30;276;29;"Today, the House voted to ensure that our heroes will never again end up on a secret waiting list. #PJNET #VA http:// 1.usa.gov/1oJTAlm";;;#PJNET #VA;"476446213836144640";https://twitter.com/RepGarrett/status/476446213836144640
;2014-06-10 11:59;253;15;"Great op-ed in @USATODAY about how regulation destroys your ability to get better goods and services. #PJNET #tcot http:// usat.ly/1kT69uu";;@USATODAY;#PJNET #tcot;"476408405973028865";https://twitter.com/RepGarrett/status/476408405973028865
;2014-06-06 10:07;290;48;"Remembering all the Allied forces whose bravery & courage forever changed the world. #DDay70 #PJNET pic.twitter.com/PnEZzfjRLn";;;#DDay70 #PJNET;"474930477426835456";https://twitter.com/RepGarrett/status/474930477426835456
;2014-06-06 09:47;3;4;"Today we honor the 70th anniversary of #DDay . The bravery of the Allied forces exemplifies what it means to be free. pic.twitter.com/PnEZzfjRLn";;;#DDay;"474925530849247232";https://twitter.com/RepGarrett/status/474925530849247232
;2014-06-04 11:40;1;3;"Thanks to all of the #NJ05 high schoolers who participated in my Model Congress this past weekend. pic.twitter.com/xql4Ldxc5r";;;#NJ05;"474229230898012160";https://twitter.com/RepGarrett/status/474229230898012160
;2014-06-03 12:58;231;6;"Glad my NJ colleagues joined me in a letter to area #VA facilities requesting info about treatment of NJ vets. #PJNET http:// 1.usa.gov/1rHVNBi";;;#VA #PJNET;"473886434055954432";https://twitter.com/RepGarrett/status/473886434055954432
;2014-06-02 13:14;0;0;"RT @RepPaulRyan: @WSJ tells Congress to pass @RepGarrett plan for fair-value accounting of government loan programs. http:// on.wsj.com/T7xKwe";;@RepPaulRyan @WSJ @RepGarrett;;"473528103047024640";https://twitter.com/RepGarrett/status/473528103047024640
;2014-06-02 09:40;244;9;"Congress must stop misleading America about cost of fed credit programs. RT for fair-value accounting #TCOT #PJNET http:// on.wsj.com/1hQHi4B";;;#TCOT #PJNET;"473474292684840960";https://twitter.com/RepGarrett/status/473474292684840960
;2014-05-27 13:29;0;0;"To keep up with what’s happening in Congress and New Jersey's 5th district, please sign up for my newsletter! http:// 1.usa.gov/1mAbBkb";;;;"471357481688764417";https://twitter.com/RepGarrett/status/471357481688764417
;2014-05-27 11:17;1;0;"RT @FinancialCmte : ICYMI: Take a look at our Weekly Video Message w/ me - @RepGarrett - on #FSOC http:// bit.ly/S0UsW0";;@FinancialCmte @RepGarrett;#FSOC;"471324423149330432";https://twitter.com/RepGarrett/status/471324423149330432
;2014-05-23 11:38;2;2;"To the soldiers, sailors, airmen, marines and coast guardsmen who paid the ultimate price, thank you. #MemorialDay pic.twitter.com/CMtBEvsYzw";;;#MemorialDay;"469879960686297088";https://twitter.com/RepGarrett/status/469879960686297088
;2014-05-22 10:05;284;27;"Join me in condemning Sudan for the death sentence of #Christian Mariam Ibrahim. #PJNET #SaveMariam http:// 1.usa.gov/1jGE8FX";;;#Christian #PJNET #SaveMariam;"469494174438674432";https://twitter.com/RepGarrett/status/469494174438674432
;2014-05-22 09:58;239;14;"READ my ltr to @StateDept asking to condemn Sudan for the death sentence of #Christian mother Mariam Ibrahim. #PJNET http:// 1.usa.gov/1jGE8FX";;@StateDept;#Christian #PJNET;"469492542904733696";https://twitter.com/RepGarrett/status/469492542904733696
;2014-05-15 11:46;377;75;"Wise words from Pres Reagan. RT if you know that Washington needs to live within its means. #Budget2014 #PJNET #TCOT pic.twitter.com/mcLaYnJ87X";;;#Budget2014 #PJNET #TCOT;"466982912844640257";https://twitter.com/RepGarrett/status/466982912844640257
;2014-05-08 09:54;235;5;"America's growing national #debt weighs down #economy & undermines global standing WATCH http:// 1.usa.gov/1hzNkGj #pjnet";;;#debt #economy #pjnet;"464418017519366144";https://twitter.com/RepGarrett/status/464418017519366144
;2014-05-07 15:16;0;2;"Glad to meet with you! @LLSNJPS pic.twitter.com/HvplM8lrOi #ideclare4LLS";;@LLSNJPS;#ideclare4LLS;"464136614315589632";https://twitter.com/RepGarrett/status/464136614315589632
;2014-05-07 09:19;1;1;"WATCH LIVE as @FinancialCmte continues to help create #jobs , grow the #economy and expand #opportunities http:// 1.usa.gov/1kWWtfS";;@FinancialCmte;#jobs #economy #opportunities;"464046965651558402";https://twitter.com/RepGarrett/status/464046965651558402
;2014-05-07 08:44;233;8;"Want to end taxpayer bailouts? I do. Check out my piece in @IBDinvestors about how we can. http:// bit.ly/1lYcvHI #TCOT #PJNET #PATHACT";;@IBDinvestors;#TCOT #PJNET #PATHACT;"464038061978841088";https://twitter.com/RepGarrett/status/464038061978841088
;2014-05-06 14:00;2;1;"Great discussion at @AEI #FinServices conference. Big takeaway: SIFIs = TBTF. Cap Markets Subcmte to examine soon. pic.twitter.com/UC0eJL29W3";;@AEI;#FinServices;"463755245139791873";https://twitter.com/RepGarrett/status/463755245139791873
;2014-05-06 10:06;0;0;"Looking forward to giving the keynote at @AEI #FinancialServices conference this afternoon.";;@AEI;#FinancialServices;"463696336756699137";https://twitter.com/RepGarrett/status/463696336756699137
;2014-04-30 11:05;252;11;"RPT: China's economy set to pass US this year. We need smart, pro-growth policies now. RT if you agree #PJNET #TCOT http:// on.ft.com/1fypyit";;;#PJNET #TCOT;"461536863082536960";https://twitter.com/RepGarrett/status/461536863082536960
;2014-04-29 14:26;215;5;"Are the markets rigged? SEC Chair White says no. WATCH it here: http:// bit.ly/1haTexx #PJNET #TCOT";;;#PJNET #TCOT;"461225028236103680";https://twitter.com/RepGarrett/status/461225028236103680
;2014-04-29 10:35;0;0;"Thanks @Reuters_Summits for having me yesterday for #ReutersFinReg14 . #financialservices pic.twitter.com/QELkGrSzHe";;@Reuters_Summits;#ReutersFinReg14 #financialservices;"461166859836850176";https://twitter.com/RepGarrett/status/461166859836850176
;2014-04-29 10:32;1;1;"MT @Reuters_Summits : "Son of Fannie & Freddie is not reform," Rep. Garrett tells the #ReutersFinReg14 Summit. VIDEO: http:// reut.rs/1mUEzvb";;@Reuters_Summits;#ReutersFinReg14;"461166092141199361";https://twitter.com/RepGarrett/status/461166092141199361
;2014-04-29 09:26;213;1;"WATCH LIVE – SEC Chairman Mary Jo White testify http:// 1.usa.gov/1pJS31g @SEC_News #Oversight #pjnet";;@SEC_News;#Oversight #pjnet;"461149479421628416";https://twitter.com/RepGarrett/status/461149479421628416
;2014-04-23 10:49;236;11;"These 1800 kids r victims of #ACA in #NJ . Do u agree it must be delayed-not just temporarily but permanently? #pjnet http:// bit.ly/1mTwybO";;;#ACA #NJ #pjnet;"458996177980358656";https://twitter.com/RepGarrett/status/458996177980358656
;2014-04-22 10:26;245;13;"Yesterday was #taxfreedomday but I believe we should be fighting for #taxreform every day. RT if u agree #pjnet #tcot http:// bit.ly/1f021qR";;;#taxfreedomday #taxreform #pjnet #tcot;"458627932534358016";https://twitter.com/RepGarrett/status/458627932534358016
;2014-04-15 09:11;259;22;"American taxpayers deserve a simpler, fairer tax code. My #TaxDay op-ed here: http:// bit.ly/1gB3hyX #pjnet #IRS #fairness";;;#TaxDay #pjnet #IRS #fairness;"456072261515378688";https://twitter.com/RepGarrett/status/456072261515378688
;2014-04-11 12:03;281;44;"In honor of Thomas Jefferson’s birthday this weekend. May we never lose sight of #liberty . #tcot #PJNET pic.twitter.com/TxNYQnmFp4";;;#liberty #tcot #PJNET;"454665939208794112";https://twitter.com/RepGarrett/status/454665939208794112
;2014-04-09 09:15;219;7;"RT if you agree: #Smart regulation is needed to maintain fair, orderly and efficient markets WATCH http:// 1.usa.gov/1eepcNK #SmallBiz #pjnet";;;#Smart #SmallBiz #pjnet;"453898941063757824";https://twitter.com/RepGarrett/status/453898941063757824
;2014-04-09 09:14;208;7;"LIVE HEARING—> Proposals to Enhance Capital Formation for #SmallBiz WATCH http:// 1.usa.gov/1eepcNK #pjnet";;;#SmallBiz #pjnet;"453898808993529856";https://twitter.com/RepGarrett/status/453898808993529856
;2014-04-07 18:09;238;21;"House passed my budget and accounting transparency bill. Time for the Senate to act. #PJNET #TCOT http:// 1.usa.gov/1qgHuhf";;;#PJNET #TCOT;"453308494679388161";https://twitter.com/RepGarrett/status/453308494679388161
;2014-04-07 17:17;223;10;"Fannie & Freddie need to be on-budget. House will vote tonight. #tcot #pjnet #onbudget";;;#tcot #pjnet #onbudget;"453295630279258112";https://twitter.com/RepGarrett/status/453295630279258112
;2014-04-07 15:24;226;25;"There is no such thing as a #freelunch . #tcot #PJNET";;;#freelunch #tcot #PJNET;"453267189534298113";https://twitter.com/RepGarrett/status/453267189534298113
;2014-04-07 15:17;221;11;"The Budget and Accounting Transparency Act is a #commonsense attempt to bring “sunshine” to our budget process. #PJNET";;;#commonsense #PJNET;"453265440727633920";https://twitter.com/RepGarrett/status/453265440727633920
;2014-04-07 15:12;215;8;"On the House Floor advocating #commonsense #budget reform. #transparency #pjnet http:// cs.pn/1iq64cv";;;#commonsense #budget #transparency #pjnet;"453264037653254145";https://twitter.com/RepGarrett/status/453264037653254145
;2014-04-04 15:45;241;23;"The future of our nation depends on our ability to educate our children. http:// 1.usa.gov/1mQnS64 #LearnAct #pjnet pic.twitter.com/Uqbi1iGUvm";;;#LearnAct #pjnet;"452185141062811648";https://twitter.com/RepGarrett/status/452185141062811648
;2014-04-04 15:31;240;14;"Can Washington educate our children better than our parents & teachers? http:// 1.usa.gov/1mQnS64 #LearnAct #PJNET pic.twitter.com/UeW5hWFbjG";;;#LearnAct #PJNET;"452181691860148224";https://twitter.com/RepGarrett/status/452181691860148224
;2014-04-04 15:22;240;14;"The time has come to put our children first. RT if you agree. http:// 1.usa.gov/1mQnS64 #LearnAct #Pjnet pic.twitter.com/Ky2hlXrRzS";;;#LearnAct #Pjnet;"452179390437138432";https://twitter.com/RepGarrett/status/452179390437138432
;2014-04-04 08:49;248;24;"It's time to put #education back in state, local hands. My Op-Ed: http:// NJ.com http:// dlvr.it/5Jyqrd #LearnAct #CommonCore #pjnet";;;#education #LearnAct #CommonCore #pjnet;"452080419975213056";https://twitter.com/RepGarrett/status/452080419975213056
;2014-04-04 08:43;241;11;"Some officeholders don’t trust people outside Washington to come up w #education solutions. RT if you disagree #LearnAct #CommonCore #pjnet";;;#education #LearnAct #CommonCore #pjnet;"452079101332180992";https://twitter.com/RepGarrett/status/452079101332180992
;2014-04-02 11:21;1;0;"Always glad to talk to NJ-05 resident varneyco about our #capmarkets . http:// instagram.com/p/mS0JGfjmG0/";;;#capmarkets;"451394115394347008";https://twitter.com/RepGarrett/status/451394115394347008
;2014-04-02 09:16;0;0;"On @Varneyco Today: @ClaytonMorris @RepGosar @RepGarrett @tariqfarid @veroderugy @keithablow @CeciConnolly & CEO Darren Jamison";;@Varneyco @ClaytonMorris @RepGosar @RepGarrett @tariqfarid @veroderugy @keithablow @CeciConnolly;;"451362619593867264";https://twitter.com/RepGarrett/status/451362619593867264
;2014-04-01 11:44;2;1;"Today the House Budget Cmte unveiled its FY2015 Budget Resolution. Read more here: http:// budget.house.gov/fy2015/";;;;"451037345677332480";https://twitter.com/RepGarrett/status/451037345677332480
;2014-03-28 11:58;224;8;"Excited to join @DennisDMZ to talk about #HobbyLobby . Be sure to tune in. http:// bit.ly/1g7DwBS #PJNET";;@DennisDMZ;#HobbyLobby #PJNET;"449591331925803008";https://twitter.com/RepGarrett/status/449591331925803008
;2014-03-26 16:40;291;28;"h/t to @RepSteveStivers : Another day, another White House, #Obamacare delay... pic.twitter.com/6ab2kDK1Mi #pjnet #tcot";;@RepSteveStivers;#Obamacare #pjnet #tcot;"448937510564298753";https://twitter.com/RepGarrett/status/448937510564298753
;2014-03-26 13:24;281;18;"h/t @RepKevinBrady : Another day, another White House delay. pic.twitter.com/6D8KYf4t5s #pjnet #BrokenPromises";;@RepKevinBrady;#pjnet #BrokenPromises;"448888168910422016";https://twitter.com/RepGarrett/status/448888168910422016
;2014-03-25 15:28;0;0;"Glad to speak with @SeanHannity this afternoon about #HobbyLobby hearing before #SCOTUS . http://www. hannity.com/show/2014/03/25";;@SeanHannity;#HobbyLobby #SCOTUS;"448557120020283392";https://twitter.com/RepGarrett/status/448557120020283392
;2014-03-25 09:06;300;27;"#SCOTUS hears @HobbyLobbyCase 2day. RT if you think #ReligiousFreedom extends to Americans IN & OUT of church #pjnet #religiousfreedomforall";;@HobbyLobbyCase;#SCOTUS #ReligiousFreedom #pjnet #religiousfreedomforall;"448460950770057216";https://twitter.com/RepGarrett/status/448460950770057216
;2014-03-25 08:54;244;10;"In 2030, entitlements plus interest will consume ALL tax revenues HOW? WATCH: http:// 1.usa.gov/1ljfifD #DebtCrisis #pjnet #tcot";;;#DebtCrisis #pjnet #tcot;"448457774826291200";https://twitter.com/RepGarrett/status/448457774826291200
;2014-03-13 15:52;345;43;"Thx @politico for drawing attention to this. RT if you think this is crazy. #pjnet #tcot pic.twitter.com/gSQH4EqOpU";;@politico;#pjnet #tcot;"444214536661258240";https://twitter.com/RepGarrett/status/444214536661258240
;2014-03-13 09:50;0;0;"RT @RepFincherTN08 : At the House @FinancialCmte Full Committee Markup. Watch hre: http:// 1.usa.gov/1lC0oy8 #pjnet";;@RepFincherTN08 @FinancialCmte;#pjnet;"444123396348313600";https://twitter.com/RepGarrett/status/444123396348313600
;2014-03-13 09:48;218;13;"Excessive and costly gov regs hinder efforts of #smallbiz to grow & create jobs WATCH—> http:// 1.usa.gov/1lC0oy8 #pjnet";;;#smallbiz #pjnet;"444122763360751616";https://twitter.com/RepGarrett/status/444122763360751616
;2014-03-11 15:05;3;7;"I just met with Teaneck resident Joshua Meier, a finalist in the @Intel Science Talent Search. pic.twitter.com/xcMdonsmaP";;@Intel;;"443477783360978944";https://twitter.com/RepGarrett/status/443477783360978944
;2014-03-05 14:42;206;6;"ICYMI-Be sure to take a moment to read my op-ed on the Culture of Control: http:// 1.usa.gov/1kycYRN #PJNET #TCOT";;;#PJNET #TCOT;"441312740800749571";https://twitter.com/RepGarrett/status/441312740800749571
;2014-03-05 13:15;1;3;"The Stanley Cup was at the Capitol Building today. I found the inscriptions of the @NHLDevils championship teams. pic.twitter.com/GfWZh2jC07";;@NHLDevils;;"441290806440108033";https://twitter.com/RepGarrett/status/441290806440108033
;2014-02-27 13:46;205;10;"Dangerously powerful + dangerously unaccountable = @CFPB —> TRANSPARENCY NOW http:// 1.usa.gov/1lnsKig #pjnet";;@CFPB;#pjnet;"439124442204372992";https://twitter.com/RepGarrett/status/439124442204372992
;2014-02-27 13:46;0;0;"Reform the @CFPB ! Become a Citizen Cosponsor NOW—> http:// bit.ly/1fWXcIH";;@CFPB;;"439124308133433344";https://twitter.com/RepGarrett/status/439124308133433344
;2014-02-26 13:37;2;1;"LIVE HEARING STARTS NOW—>The Dodd-Frank Act’s Impact on Asset-Backed Securities http:// 1.usa.gov/Nxmbvk";;;;"438759622212861952";https://twitter.com/RepGarrett/status/438759622212861952
;2014-02-26 13:36;0;0;"Why is small biz spending more to refinance loans? WATCH LIVE HEARING NOW—> http:// 1.usa.gov/Nxmbvk";;;;"438759482567692288";https://twitter.com/RepGarrett/status/438759482567692288
;2014-02-26 13:09;0;0;"#DoddFrank impact on asset-backed securities increases costs for biz & consumers WATCH--> http:// 1.usa.gov/Nxmbvk";;;#DoddFrank;"438752647668318209";https://twitter.com/RepGarrett/status/438752647668318209
;2014-02-25 11:18;5;1;"RT @SpeakerBoehner The Obama Admin doesn’t want you to know the truth. #ObamaCare means higher premiums → pic.twitter.com/ekq7Ix8neH";;@SpeakerBoehner;#ObamaCare;"438362318876184576";https://twitter.com/RepGarrett/status/438362318876184576
;2014-02-11 13:03;3;1;"#FSC hearing w/ #Fed Reserve Chair Janet Yellen today. pic.twitter.com/2FiYnos6z3";;;#FSC #Fed;"433315444489867264";https://twitter.com/RepGarrett/status/433315444489867264
;2014-02-10 14:52;220;10;"We’re now learning about the devastating impact #ObamaCare will have on our economy. My op-ed on it: http:// bit.ly/M6iA6V #pjnet";;;#ObamaCare #pjnet;"432980523074748416";https://twitter.com/RepGarrett/status/432980523074748416
;2014-02-06 10:15;387;119;"Happy Birthday, Ronald Reagan! #TCOT #PJNET pic.twitter.com/xYmCmWu3bH";;;#TCOT #PJNET;"431461091084742656";https://twitter.com/RepGarrett/status/431461091084742656
;2014-02-05 10:57;1;1;"Thx to Diane, Peggy, Raymond & Michael, BOE members from #NJ05 , for stopping by my DC office to discuss education pic.twitter.com/9KnO31mQqa";;;#NJ05;"431109212123697152";https://twitter.com/RepGarrett/status/431109212123697152
;2014-01-28 20:23;4;4;"RT @RepAnnWagner : It’s time the President started working with Congress and not around us. #SOTU";;@RepAnnWagner;#SOTU;"428352640855310336";https://twitter.com/RepGarrett/status/428352640855310336
;2014-01-28 20:14;179;11;"Waiting for the President to address the nation. Are you tuned in? #SOTU #pjnet pic.twitter.com/C0DPdxDKF3";;;#SOTU #pjnet;"428350454322302976";https://twitter.com/RepGarrett/status/428350454322302976
;2014-01-28 18:23;179;7;"What would you like @BarackObama to discuss tonight during his #SOTU address? #PJNET #tcot";;@BarackObama;#SOTU #PJNET #tcot;"428322503862542336";https://twitter.com/RepGarrett/status/428322503862542336
;2014-01-28 09:16;2;0;". @CFPB has & will hurt consumers by restricting access to credit & dictating what you can buy & at what cost. http:// go.usa.gov/BCCV";;@CFPB;;"428184722137952257";https://twitter.com/RepGarrett/status/428184722137952257
