username;date;retweets;favorites;text;geo;mentions;hashtags;id;permalink
;2014-01-28 09:12;0;0;"Real consumer protection puts power where it belongs: in the hands of consumers, not Washington bureaucrats. http:// go.usa.gov/BCCV";;;;"428183809553879040";https://twitter.com/RepGarrett/status/428183809553879040
;2014-01-27 15:43;228;18;"RT to spread the word,the FRAT Act will foster greater accountability and transparency at the #Fed #pjnet #GarrettFed pic.twitter.com/H9hpIIdFZh";;;#Fed #pjnet #GarrettFed;"427919820177174528";https://twitter.com/RepGarrett/status/427919820177174528
;2014-01-27 15:02;191;3;"Historically, transparency & accountability haven't been hallmarks of the #Fed - the #FRATAct will change that. #GarrettFed #pjnet";;;#Fed #FRATAct #GarrettFed #pjnet;"427909484607184896";https://twitter.com/RepGarrett/status/427909484607184896
;2014-01-27 15:00;180;4;"The #FRATAct applies commonsense reforms that foster greater accountability & transparency at the #Fed #GarrettFed #PJnet";;;#FRATAct #Fed #GarrettFed #PJnet;"427908890861531136";https://twitter.com/RepGarrett/status/427908890861531136
;2014-01-27 14:22;2;1;"“With great power comes great responsibility.” Fed’s fraternity-like veil of secrecy wrt reg policy must come down. #FRATAct #GarrettFed";;;#FRATAct #GarrettFed;"427899326527209473";https://twitter.com/RepGarrett/status/427899326527209473
;2014-01-24 12:14;210;21;"Do you agree? A new @Gallup poll claims a majority of Americans view the federal government as too big. #pjnet #tcot http:// bit.ly/1d0JX87";;@Gallup;#pjnet #tcot;"426779970577240064";https://twitter.com/RepGarrett/status/426779970577240064
;2014-01-24 10:50;0;1;"Great job! RT: @NJHerald Students show courtroom smarts at mock trial competition http:// bit.ly/1hr5nQl pic.twitter.com/R262fbhSie";;@NJHerald;;"426758905562030080";https://twitter.com/RepGarrett/status/426758905562030080
;2014-01-22 10:31;183;3;"Check out today's #WSJ to read my op-ed on #Fed transparency http:// on.wsj.com/1msPv0u #tcot #pjnet #FRATAct";;;#WSJ #Fed #tcot #pjnet #FRATAct;"426029282797043712";https://twitter.com/RepGarrett/status/426029282797043712
;2014-01-15 14:39;180;6;"ICYMI: I spoke on the in support of #HR2274 . It passed 422-0. http:// bit.ly/1j7pcQi @RepHuizenga #smallbiz #pjnet #4jobs";;@RepHuizenga;#HR2274 #smallbiz #pjnet #4jobs;"423554939328024576";https://twitter.com/RepGarrett/status/423554939328024576
;2014-01-15 11:04;0;1;"RT @RepKevinBrady : RT @FixOurTaxCode : VIDEO: Americans deserve a tax code that works for them. RT If you agree http:// bit.ly/K2eXOv";;@RepKevinBrady @FixOurTaxCode;;"423500874624032769";https://twitter.com/RepGarrett/status/423500874624032769
;2014-01-15 10:55;195;9;"#HR2274 will go a long way toward helping #smallbiz & entrepreneurs by reducing burdensome regulations & costs. @RepHuizenga #4jobs #pjnet";;@RepHuizenga;#HR2274 #smallbiz #4jobs #pjnet;"423498580947513344";https://twitter.com/RepGarrett/status/423498580947513344
;2014-01-15 10:54;0;0;"RT: @HouseFloor Passed: #HR2274 :Small Business Mergers, Acquisitions, Sales, and Brokerage Simplification Act of 2013 http:// j.mp/1m4rH5I";;@HouseFloor;#HR2274;"423498392438702081";https://twitter.com/RepGarrett/status/423498392438702081
;2014-01-15 10:52;8;4;"RT @SpeakerBoehner : Mr. President, we use the #Constitution to get things done. pic.twitter.com/SUrVUJbB0o";;@SpeakerBoehner;#Constitution;"423497944604884992";https://twitter.com/RepGarrett/status/423497944604884992
;2014-01-14 16:35;2;0;"As always, great to talk to you @tperkins -- Keep up the fight on #DCwatchlive";;@tperkins;#DCwatchlive;"423221949691867136";https://twitter.com/RepGarrett/status/423221949691867136
;2014-01-14 13:25;189;10;"On this day in 1784, the #TreatyofParis was ratified by the Continental Congress, ending the #RevolutionaryWar . http:// 1.usa.gov/1fovXMO #PJNET";;;#TreatyofParis #RevolutionaryWar #PJNET;"423174079701458945";https://twitter.com/RepGarrett/status/423174079701458945
;2014-01-14 10:36;1;0;"RT: @financialCmte The @CFPB ’s #QM Rule benefits lawyers & regulatory compliance consultants — not consumers.";;@financialCmte @CFPB;#QM;"423131589187358720";https://twitter.com/RepGarrett/status/423131589187358720
;2014-01-13 13:19;1;1;"Happy #KoreanAmericanDay ! I am proud to represent the Korean-American community in #NJ05 .";;;#KoreanAmericanDay #NJ05;"422810066241085440";https://twitter.com/RepGarrett/status/422810066241085440
;2014-01-13 13:14;225;12;"Be sure to RT this. The “Truth” behind #Obamacare 6 million coverage figure @CNNMoney http:// yhoo.it/1a2ydr6 #Pjnet #tcot";;@CNNMoney;#Obamacare #Pjnet #tcot;"422808949549584384";https://twitter.com/RepGarrett/status/422808949549584384
;2014-01-09 09:53;2;0;"RT: @financialcmte Monetary Policy & Trade Subcmte meets at 10 a.m. to discuss the international impacts of #QE . http:// go.usa.gov/ZvXV";;@financialcmte;#QE;"421308847853019136";https://twitter.com/RepGarrett/status/421308847853019136
;2014-01-08 10:10;1;0;"Welcome to the HOR @RepByrne – I look forward to working with you!";;@RepByrne;;"420950728832987136";https://twitter.com/RepGarrett/status/420950728832987136
;2014-01-08 10:09;7;5;"RT: @SpeakerJohnBoehner The ultimate solution for joblessness is more jobs. RT if you agree: pic.twitter.com/xLm9jZjt0K";;@SpeakerJohnBoehner;;"420950467934703616";https://twitter.com/RepGarrett/status/420950467934703616
;2014-01-08 10:09;235;21;"HoR has passed dozens of bills that foster job growth. Do you think #Senate will finally vote on them in 2014? #PJNET pic.twitter.com/rwO1BIcqQp";;;#Senate #PJNET;"420950388959744000";https://twitter.com/RepGarrett/status/420950388959744000
;2014-01-06 11:48;1;0;"ICYMI – I recapped my work in the first session of the 113th Congress. You can watch it here: http:// bit.ly/1gB1zvR";;;;"420250550895013888";https://twitter.com/RepGarrett/status/420250550895013888
;2014-01-03 14:15;3;0;"Sub-zero temperatures are expected tonight. If you must travel, be careful! #staysafe #njsnow";;;#staysafe #njsnow;"419200425644920832";https://twitter.com/RepGarrett/status/419200425644920832
;2014-01-03 13:50;1;0;"RT: @NJTransit #NJTRail update: service now subject to up to 30min delays systemwide due to winter weather conditions. #NJsnow #staysafe";;@NJTransit;#NJTRail #NJsnow #staysafe;"419194145308028928";https://twitter.com/RepGarrett/status/419194145308028928
;2014-01-03 13:21;2;0;"Be careful on the roads, and only drive if absolutely necessary. #njsnow #staysafe";;;#njsnow #staysafe;"419186650510401537";https://twitter.com/RepGarrett/status/419186650510401537
;2014-01-03 13:01;2;1;"While the roads are looking better, please be cautious when making your way outside today. #NJsnow #staysafe";;;#NJsnow #staysafe;"419181768969687040";https://twitter.com/RepGarrett/status/419181768969687040
;2013-12-20 09:56;2;0;"#NJ05 , Would you like to stay up-to-date on my work here in Congress? Sign up for my newsletter here: https:// garrett.house.gov/contact/newsle tter …";;;#NJ05;"414061648874176513";https://twitter.com/RepGarrett/status/414061648874176513
;2013-12-20 09:55;1;0;"This week, I met w/ many exceptional students to discuss Ratification Day in #NJ05 You can read about my visits here: http:// bit.ly/19XFt1x";;;#NJ05;"414061529000980480";https://twitter.com/RepGarrett/status/414061529000980480
;2013-12-06 08:26;4;2;"The #NationalChristmasTree at the White House is from #NJ05 . Check out the lighting ceremony tonight! http:// bit.ly/IOElXA";;;#NationalChristmasTree #NJ05;"408965607237767168";https://twitter.com/RepGarrett/status/408965607237767168
;2013-11-22 14:25;2;2;"Glad to be joining @loudobbsnews tonight to talk about how #Obamacare is just not fixable. Tune in at 7p ET on @FoxBusiness";;@loudobbsnews @FoxBusiness;#Obamacare;"403982513820803074";https://twitter.com/RepGarrett/status/403982513820803074
;2013-11-19 13:48;0;0;"ICYMI @WSJ story on @PatrickMcHenry & my ltr to SEC Chair White on expanding the definition of accredited investors http:// on.wsj.com/I1i8Vs";;@WSJ @PatrickMcHenry;;"402886212987269120";https://twitter.com/RepGarrett/status/402886212987269120
;2013-11-19 09:17;0;0;"At 10a @PatrickMcHenry will hold a hearing examining the Disparate Impact Theory in his @FinancialCmte Sbcmte. WATCH: http:// bit.ly/qbiaom";;@PatrickMcHenry @FinancialCmte;;"402818008822738944";https://twitter.com/RepGarrett/status/402818008822738944
;2013-11-19 08:45;3;1;"Take a min to read this: @TIMEPolitics piece - ‘You Can Keep Your Doctor’: Obamacare’s Next Broken Promise? http:// swampland.time.com/2013/11/19/you -can-keep-your-doctor-obamacares-next-broken-promise/ …";;@TIMEPolitics;;"402809856001732608";https://twitter.com/RepGarrett/status/402809856001732608
;2013-11-14 08:59;1;0;"Tune in now as the @FinancialCmte works to address excessive & costly regulations that hinder growth & job creation. http:// go.usa.gov/WnRd";;@FinancialCmte;;"401001443848499200";https://twitter.com/RepGarrett/status/401001443848499200
;2013-11-08 14:51;1;2;"These bright young men and women stopped by my D.C. office to talk about U.S.-Israel relations this week. #NJ05 pic.twitter.com/VLKbWaB52c";;;#NJ05;"398915665441988609";https://twitter.com/RepGarrett/status/398915665441988609
;2013-11-08 14:46;1;1;"I enjoyed meeting with these ladies to talk about their work with the United Methodist Church and our community #NJ05 pic.twitter.com/jMHdmENZYp";;;#NJ05;"398914393661911040";https://twitter.com/RepGarrett/status/398914393661911040
;2013-10-31 11:05;1;0;"ICYMI: CBO: #PATHAct Reduces Deficit by $5.7 Billion. #GSEreform http:// 1.usa.gov/17tuFwF";;;#PATHAct #GSEreform;"395944702916050944";https://twitter.com/RepGarrett/status/395944702916050944
;2013-10-30 09:05;195;21;". @BarackObama knew millions could not keep plans under Obamacare, @NBCNews . #pjnet http:// nbcnews.to/1aPVfLP";;@BarackObama @NBCNews;#pjnet;"395552103440986114";https://twitter.com/RepGarrett/status/395552103440986114
;2013-10-29 15:19;136;2;"“He Really Didn’t Mean It,” @SpeakerBoehner . #Pjnet http:// 1.usa.gov/HdQq7m";;@SpeakerBoehner;#Pjnet;"395283647537754112";https://twitter.com/RepGarrett/status/395283647537754112
;2013-10-29 15:18;0;0;"RT @FinancialCmte :The @CFPB is dangerously unaccountable because it is subject to virtually no checks & balances. http:// go.usa.gov/WCTw";;@FinancialCmte @CFPB;;"395283550670311424";https://twitter.com/RepGarrett/status/395283550670311424
;2013-10-24 11:42;0;0;"Who do you like this weekend? Friday and Saturday are filled with great football match-ups all across #NJ05 ! http:// bit.ly/H4wzrg";;;#NJ05;"393417146262245376";https://twitter.com/RepGarrett/status/393417146262245376
;2013-10-23 14:35;147;5;"I know people are having problems w/ #ObamaCare ; the site is obviously still not working. #ACAfail #PJNET pic.twitter.com/MHgQ5FRzCS";;;#ObamaCare #ACAfail #PJNET;"393098410141577217";https://twitter.com/RepGarrett/status/393098410141577217
;2013-10-23 09:52;130;3;"I’ll be LIVE on @CNBC ’s @SquawkStreet w/ @Carl Quintanilla at 11:30a. Be sure to tune in! #budget #PJNET";;@CNBC @SquawkStreet @Carl;#budget #PJNET;"393027164649828352";https://twitter.com/RepGarrett/status/393027164649828352
;2013-10-18 10:28;146;11;"A vigilant press is essential for good-government. http:// bit.ly/19PZpUN #PJnet";;;#PJnet;"391224263593979904";https://twitter.com/RepGarrett/status/391224263593979904
;2013-10-18 10:12;159;8;"What r we leaving for the future generations of our nation, @MegynKelly ? An irresponsible $17 trill of debt. http:// bit.ly/18sLkhJ #PJNET";;@MegynKelly;#PJNET;"391220242275635200";https://twitter.com/RepGarrett/status/391220242275635200
;2013-10-16 21:41;12;4;"Our kids & grandkids are another step closer to being forever burdened w a future of higher taxes & massive unemployment thx to our inaction";;;;"390668902373818368";https://twitter.com/RepGarrett/status/390668902373818368
;2013-10-09 15:51;2;1;"My statement on the nomination of Dr. Yellen to be the next Chairman of the Federal Reserve http:// 1.usa.gov/15VUfcR";;;;"388044163217764352";https://twitter.com/RepGarrett/status/388044163217764352
;2013-10-05 11:59;1;0;"Looking forward to joining @CNN @FWhitfield at 1:15 p.m. ET. Hope you tune in!";;@CNN @FWhitfield;;"386536014967488512";https://twitter.com/RepGarrett/status/386536014967488512
;2013-10-04 11:26;16;7;"Disappointed the Obama administration is concerned about ‘winning’ and not about opening the government #LetsTalk pic.twitter.com/1UBDTkLilp";;;#LetsTalk;"386165513392361473";https://twitter.com/RepGarrett/status/386165513392361473
;2013-10-03 14:02;2;0;"Praying for the safety of Capitol Police and others that may be involved.";;;;"385842358173966336";https://twitter.com/RepGarrett/status/385842358173966336
;2013-10-02 20:03;4;0;"Today, the House voted to keep funding cancer research, and keep our national parks and museums, and DC schools and services running.";;;;"385570824125571072";https://twitter.com/RepGarrett/status/385570824125571072
;2013-10-02 20:01;13;0;"After House Democrats voted against opening services last night, Republicans came to work today to end #HarryReidsShutdown";;;#HarryReidsShutdown;"385570144740581376";https://twitter.com/RepGarrett/status/385570144740581376
;2013-09-30 09:02;3;1;"While the House worked to avoid a shutdown, the Senate took time off http:// j.mp/1dQvjTS #SenateMustAct";;;#SenateMustAct;"384679611910475776";https://twitter.com/RepGarrett/status/384679611910475776
;2013-09-25 16:29;1;0;"My statement on reports of a possible #FHA bailout http:// 1.usa.gov/1bGFWdG";;;#FHA;"382980297278513153";https://twitter.com/RepGarrett/status/382980297278513153
;2013-09-20 14:42;290;40;"#ObamaCare continues to be a train wreck. Today I joined my colleagues in the House to defund it. RT if you stand w/ us. #pjnet #tcot";;;#ObamaCare #pjnet #tcot;"381141238722101248";https://twitter.com/RepGarrett/status/381141238722101248
;2013-09-20 14:39;167;33;"Today I voted for a bill that would fund the government in full, except for #ObamaCare #PJNET #TCOT";;;#ObamaCare #PJNET #TCOT;"381140693185744897";https://twitter.com/RepGarrett/status/381140693185744897
;2013-09-19 06:52;1;0;"Glad to be joining @cspanwj this morning to talk about #budget #CR #WPRrepeal and more. Be sure to tune in!";;@cspanwj;#budget #CR #WPRrepeal;"380660621248720896";https://twitter.com/RepGarrett/status/380660621248720896
;2013-09-18 16:05;0;0;"Happy birthday, @usairforce !";;@usairforce;;"380437565175648258";https://twitter.com/RepGarrett/status/380437565175648258
;2013-09-17 12:56;110;12;"I will continue to uphold my oath of office to defend the liberties that our Founding Fathers fought to secure #ConstitutionDay #PJNET";;;#ConstitutionDay #PJNET;"380027597679108097";https://twitter.com/RepGarrett/status/380027597679108097
;2013-09-17 11:10;112;9;"Our Constitution has provided our nation with a template for longevity and enduring success. #ConstitutionDay #PJNET #TCOT";;;#ConstitutionDay #PJNET #TCOT;"380000876602990592";https://twitter.com/RepGarrett/status/380000876602990592
;2013-09-17 10:09;123;16;"I will continue to honor my oath of office to preserve, protect & defend our #Constitution . #ConstitutionDay #PJNET pic.twitter.com/yIkEcZ4ucu";;;#Constitution #ConstitutionDay #PJNET;"379985351609028608";https://twitter.com/RepGarrett/status/379985351609028608
;2013-09-17 09:13;105;9;"Today & every day, I strive to defend and protect the Constitution. Happy #ConstitutionDay . #PJNET #tcot";;;#ConstitutionDay #PJNET #tcot;"379971320944926720";https://twitter.com/RepGarrett/status/379971320944926720
;2013-09-16 14:05;98;1;"Want to stay up-to-date on my work in Congress? Sign up for my newsletter here: http:// 1.usa.gov/1eW6dEH #pjnet #tcot";;;#pjnet #tcot;"379682417466150912";https://twitter.com/RepGarrett/status/379682417466150912
;2013-09-11 11:29;3;0;"My thoughts & prayers are w/ every person mourning this horrific event today & every day. #NeverForget #UnitedWeStand pic.twitter.com/ojLDbLqZro";;;#NeverForget #UnitedWeStand;"377831335152201728";https://twitter.com/RepGarrett/status/377831335152201728
;2013-09-09 15:57;0;0;"TUNE IN to @seanhannity at 5PM ET. I'm talking w/ Sean about #Syria & #WarPowers . http:// bit.ly/kG39vn";;@seanhannity;#Syria #WarPowers;"377173970950586369";https://twitter.com/RepGarrett/status/377173970950586369
;2013-09-09 15:34;175;31;"Today I introduced a bill to repeal the War Powers Res. and return the power to go to war to Congress. http:// 1.usa.gov/1dWcWQ7 #tcot #pjnet";;;#tcot #pjnet;"377168253023289345";https://twitter.com/RepGarrett/status/377168253023289345
;2013-09-05 15:52;528;54;"RT if you agree with me and are against the president’s resolution to go to war in #Syria #PJNET http:// 1.usa.gov/17bAAmd";;;#Syria #PJNET;"375723155504918528";https://twitter.com/RepGarrett/status/375723155504918528
;2013-09-05 15:26;32;11;"I am against the president’s resolution to go to war in #Syria . More from my release: http:// 1.usa.gov/17bAAmd";;;#Syria;"375716672818008065";https://twitter.com/RepGarrett/status/375716672818008065
;2013-09-04 15:44;1;2;"Happy New Year to all those celebrating Rosh Hashanah at sundown today in #NJ05 !";;;#NJ05;"375358607979593728";https://twitter.com/RepGarrett/status/375358607979593728
;2013-08-29 11:55;219;27;"RT if you agree, #LetsDebate #Syria #pjnet pic.twitter.com/LINuYoMjA1";;;#LetsDebate #Syria #pjnet;"373126742296109056";https://twitter.com/RepGarrett/status/373126742296109056
;2013-08-29 11:52;5;5;"#LetsDebate #Syria pic.twitter.com/YVJvIcIg9M";;;#LetsDebate #Syria;"373125954492592129";https://twitter.com/RepGarrett/status/373125954492592129
;2013-08-27 13:01;2;0;"Thx for leading on #Syria MT @RepScottRigell : Thx for joining our letter 2 #POTUS re: #warpowers @RepGarrett @RepMcClintock @CongressmanDan";;@RepScottRigell @RepGarrett @RepMcClintock @CongressmanDan;#Syria #POTUS #warpowers;"372418637727948800";https://twitter.com/RepGarrett/status/372418637727948800
;2013-08-22 11:16;13;7;"RT if you agree w/ President Calvin Coolidge. #Liberty #tcot pic.twitter.com/613feWIEUG";;;#Liberty #tcot;"370580342962266112";https://twitter.com/RepGarrett/status/370580342962266112
;2013-08-22 10:47;1;2;"I enjoyed meeting with the @UnitedWay of Northern Jersey to discuss our children’s’ education. pic.twitter.com/YQKyY78ztP";;@UnitedWay;;"370572988657065984";https://twitter.com/RepGarrett/status/370572988657065984
;2013-08-20 11:39;1359;54;"Proud to support H.Res.36. http:// ow.ly/o06zL #PJNET #Benghazi";;;#PJNET #Benghazi;"369861289629483008";https://twitter.com/RepGarrett/status/369861289629483008
;2013-08-20 11:17;1;0;". @GWRNEWS Congratulations to GWR holder, Joseph Scavone Jr., for recording the fastest mile hopped on one foot! http:// bit.ly/16WL5IN";;@GWRNEWS;;"369855819707215872";https://twitter.com/RepGarrett/status/369855819707215872
;2013-08-20 10:06;0;1;"It was great to meet w/ a few of Warren County’s mayors to discuss local issues! pic.twitter.com/2ztfgZgpoH";;;;"369837858942509056";https://twitter.com/RepGarrett/status/369837858942509056
;2013-08-19 13:58;1;2;"I enjoyed sitting down w/ members of the Korean-American Association of New Jersey! pic.twitter.com/bL4JFoKlTe";;;;"369533837077790720";https://twitter.com/RepGarrett/status/369533837077790720
;2013-08-19 12:21;0;3;"It was great to meet w/ such passionate health care professionals at BACHS Home Health Care Supply in Hackettstown. pic.twitter.com/00JWSKpRCR";;;;"369509552829366272";https://twitter.com/RepGarrett/status/369509552829366272
;2013-08-16 09:47;99;5;"I've asked Sec. Lew a handful of very straightforward questions that merit answers. #TCOT #PJNET http:// bit.ly/1dbMBeI";;;#TCOT #PJNET;"368383516683157504";https://twitter.com/RepGarrett/status/368383516683157504
;2013-08-16 09:15;280;56;"The American people have a right to understand the full depth of the #IRS scandal. #TCOT #PJNET pic.twitter.com/u5gULawEU5";;;#IRS #TCOT #PJNET;"368375407612923904";https://twitter.com/RepGarrett/status/368375407612923904
;2013-08-15 13:46;0;1;"Thank you, Rev Fiorelli & Manny, for your work.The Emmanuel Christian Fellowship is a great benefit to our community. pic.twitter.com/4i7mytjBPK";;;;"368081211006013442";https://twitter.com/RepGarrett/status/368081211006013442
;2013-08-15 13:29;1;0;"Congratulations to Bergen County’s Summer Softball League champs: the Westwood's U12 travel softball team! http:// bit.ly/14C59NF";;;;"368077038222995456";https://twitter.com/RepGarrett/status/368077038222995456
;2013-08-15 13:08;0;2;"A very big thank you to Kevin for all his hard-work interning in my Newton office. pic.twitter.com/EO1wxBnilW";;;;"368071709380730881";https://twitter.com/RepGarrett/status/368071709380730881
;2013-08-14 11:40;0;1;"Congratulations to this year’s Senior of The Year: Joseph Lashendock! pic.twitter.com/PI5BeBAsoo";;;;"367687235237187584";https://twitter.com/RepGarrett/status/367687235237187584
;2013-08-14 11:30;0;1;"Great meeting with you Daryl & Adam @StartupValley to talk about your efforts to revive our stagnant economy! pic.twitter.com/kNkTk6hedu";;@StartupValley;;"367684767367454720";https://twitter.com/RepGarrett/status/367684767367454720
;2013-08-14 10:34;0;0;"My Newton office is currently accepting interns for the Fall. Those interested in an internship should contact my staff at 973-300-2000.";;;;"367670637365448704";https://twitter.com/RepGarrett/status/367670637365448704
;2013-08-14 10:28;144;11;"RT if you also support H.RES.36 calling for an investigation regarding the attack on the U.S. consulate in #Benghazi #TCOT #PJNET";;;#Benghazi #TCOT #PJNET;"367669104490336256";https://twitter.com/RepGarrett/status/367669104490336256
;2013-08-13 15:07;4;0;"Great speaking with @larry_kudlow about the #PATHAct , listen here: http:// bit.ly/1eHCTie";;@larry_kudlow;#PATHAct;"367376873933639680";https://twitter.com/RepGarrett/status/367376873933639680
;2013-08-13 13:20;4;0;"ICYMI – My Op-Ed in @usnews “Government Mortgage Guarantees Are Bad for the Economy.” http:// bit.ly/15zi8Qh #PATHAct";;@usnews;#PATHAct;"367350082061873152";https://twitter.com/RepGarrett/status/367350082061873152
;2013-08-06 15:35;4;1;"My statement on @BarackObama ’s housing finance speech #ABetterBargain http:// 1.usa.gov/13E0HlF";;@BarackObama;#ABetterBargain;"364847219679039489";https://twitter.com/RepGarrett/status/364847219679039489
;2013-08-01 06:47;3;0;"About to join @cspanwj to talk about #budget issues & what's on the agenda in Congress. TUNE in to WATCH LIVE.";;@cspanwj;#budget;"362902435443912704";https://twitter.com/RepGarrett/status/362902435443912704
;2013-07-30 11:29;113;21;"RT if you agree with President George Washington #PJNET #TCOT pic.twitter.com/NKHPdDZiYg";;;#PJNET #TCOT;"362248692792713217";https://twitter.com/RepGarrett/status/362248692792713217
;2013-07-29 10:24;2;0;"ICYMI: The Record’s “Preserving Liberty” editorial on my vote to protect privacy and limit the #NSA http:// bit.ly/13plWnh";;;#NSA;"361869798600228865";https://twitter.com/RepGarrett/status/361869798600228865
;2013-07-25 14:06;63;4;"MT @cobrown : #Podcast : @repgarrett discusses the sweeping new powers in #DoddFrank . http:// bit.ly/137UkXn #PJNET #TCOT";;@cobrown @repgarrett;#Podcast #DoddFrank #PJNET #TCOT;"360476109369901056";https://twitter.com/RepGarrett/status/360476109369901056
;2013-07-19 11:18;58;1;". #StudentSuccess Act empowers parents to take a greater role in their children’s education #tcot #pjnet";;;#StudentSuccess #tcot #pjnet;"358259606415351809";https://twitter.com/RepGarrett/status/358259606415351809
;2013-07-19 10:15;60;2;"#PATHAct protects ordinary Americans from future bailouts. RT if you support it. #TCOT #PJNET pic.twitter.com/4ELfF621Kc";;;#PATHAct #TCOT #PJNET;"358243772867428352";https://twitter.com/RepGarrett/status/358243772867428352
;2013-07-19 10:13;59;3;"RT if you agree that #PATHAct will end taxpayer bailouts to Fannie Mae and Freddie Mac. #TCOT #PJNET pic.twitter.com/A6KuoaLwLf";;;#PATHAct #TCOT #PJNET;"358243283413106690";https://twitter.com/RepGarrett/status/358243283413106690
;2013-07-19 10:12;8;1;"A Va Court of Appeals agrees: @BarackObama NLRB recess appointments were unconstitutional http:// nbcnews.to/1aXJcl3 #UnconstitutionalPrez";;@BarackObama;#UnconstitutionalPrez;"358243014247841793";https://twitter.com/RepGarrett/status/358243014247841793
;2013-07-17 14:04;7;1;". @BarackObama threatens to veto legislation validating his employer mandate delay. #Unconstitutionalprez http:// 1.usa.gov/1bGzwJK";;@BarackObama;#Unconstitutionalprez;"357576602181312512";https://twitter.com/RepGarrett/status/357576602181312512
;2013-07-17 13:55;0;0;"If @BarackObama wants to delay the employer mandate, why is he opposed to legislative action? #Unconstitutionalprez http:// 1.usa.gov/1bGzwJK";;@BarackObama;#Unconstitutionalprez;"357574404126949377";https://twitter.com/RepGarrett/status/357574404126949377
;2013-07-12 13:59;50;2;"Are you on Facebook as well? Be sure to “like” my page http:// on.fb.me/12yyTKQ #tcot #pjnet";;;#tcot #pjnet;"355763486623670272";https://twitter.com/RepGarrett/status/355763486623670272
;2013-07-11 15:21;1;0;"The #PATHAct will reform America’s housing markets by increasing competition, enhancing transparency and maximizing consumer choice.";;;#PATHAct;"355421658829430784";https://twitter.com/RepGarrett/status/355421658829430784
;2013-07-11 15:21;4;3;"House Republicans have a housing finance plan that’s sustainable for homeowners, respectful of hard-working taxpayers, and built to last.";;;;"355421585106149378";https://twitter.com/RepGarrett/status/355421585106149378
;2013-07-11 15:20;4;2;"Today, taxpayers remain on the hook for $5.1 trillion in gov't mortgage guarantees. That’s roughly one-third of our entire economy.";;;;"355421418210590720";https://twitter.com/RepGarrett/status/355421418210590720
