username;date;retweets;favorites;text;geo;mentions;hashtags;id;permalink
;2013-11-25 16:48;4;1;"Watch my segment w/ @TheRevAl about the #ACA and the complaint that men have to pay for maternity care. http://www. youtube.com/watch?v=rNKkw3 Itvz0&feature=c4-overview&list=UUaghNJXAOo8VgJMKANvN1dg …";;@TheRevAl;#ACA;"405105700864417792";https://twitter.com/RepJimMcDermott/status/405105700864417792
;2013-11-21 13:56;10;6;"71% of Americans in individual market can get financial help with #ACA ! Great news from @FamiliesUSA : http:// goo.gl/9LX8D5";;@FamiliesUSA;#ACA;"403612875899408384";https://twitter.com/RepJimMcDermott/status/403612875899408384
;2013-11-19 15:45;5;1;"I recently introduced 3 bills to help #veterans and their families. Read more here! http:// goo.gl/SOINUM";;;#veterans;"402915642942038017";https://twitter.com/RepJimMcDermott/status/402915642942038017
;2013-11-15 10:37;1;0;"Next time! RT @therealmix : @Negretude @RepJimMcDermott I tried to get Mr McDermott on stage to do the first verse.";;@therealmix @Negretude @RepJimMcDermott;;"401388590627708928";https://twitter.com/RepJimMcDermott/status/401388590627708928
;2013-11-14 17:33;5;1;"I recently tried to help an army interpreter whose life was in danger. Here's the story, complete with happy ending: http://www. newyorker.com/online/blogs/c omment/2013/11/an-afghan-interpreters-flight-to-america.html …";;;;"401130823459414016";https://twitter.com/RepJimMcDermott/status/401130823459414016
;2013-11-11 14:16;3;0;"Thank you to the men and women who have given so much to serve this country, along with their families. Happy #VeteransDay !";;;#VeteransDay;"399994057122148352";https://twitter.com/RepJimMcDermott/status/399994057122148352
;2013-11-08 14:26;30;21;"Thanks to @StephenAtHome for introducing me to the music of @therealmix . I really enjoyed the concert last weekend! pic.twitter.com/yr8ir0t7Pi";;@StephenAtHome @therealmix;;"398909434929221632";https://twitter.com/RepJimMcDermott/status/398909434929221632
;2013-11-07 16:10;4;2;"#ENDA passed the Senate today with 10 GOP votes. Now it's time for @SpeakerBoehner to bring it to the House. pic.twitter.com/FKlCZ9wLJ6";;@SpeakerBoehner;#ENDA;"398573105586515968";https://twitter.com/RepJimMcDermott/status/398573105586515968
;2013-11-07 15:03;1;0;"Photoset: repmarktakano: Help me welcome Congressman Jim McDermott to Tumblr by following his new page: The... http:// tmblr.co/Zs5kKszm6hcj";;;;"398556449816969216";https://twitter.com/RepJimMcDermott/status/398556449816969216
;2013-11-06 09:42;42;103;"Our vets have given so much, it's our duty to give back. @Starbucks ' initiative to #hireavet , or 10K, is a great start!";;@Starbucks;#hireavet;"398113070771228672";https://twitter.com/RepJimMcDermott/status/398113070771228672
;2013-11-06 09:36;4;5;"Proud to join @Starbucks this morning to honor our veterans and their families. #hireavet";;@Starbucks;#hireavet;"398111585782091776";https://twitter.com/RepJimMcDermott/status/398111585782091776
;2013-11-04 15:41;8;1;"Seattle has seen it's share of this scam. Don't be a victim! pic.twitter.com/K8hV5jwWuG";;;;"397478849669132289";https://twitter.com/RepJimMcDermott/status/397478849669132289
;2013-11-01 13:52;4;2;"A great #ACA success story from Aaron in Seattle. http:// tmblr.co/Zs5kKszCfFwc";;;#ACA;"396349044601397248";https://twitter.com/RepJimMcDermott/status/396349044601397248
;2013-10-31 14:48;1;2;"Due to Tumblr troubles, my site is moving! If you follow it, please follow the new Medicine Cabinet here: http:// goo.gl/dR0X6G";;;;"396000772602613760";https://twitter.com/RepJimMcDermott/status/396000772602613760
;2013-10-31 14:40;3;0;"Happy Halloween, Twitterverse! pic.twitter.com/bkUEWB7198";;;;"395998702340685824";https://twitter.com/RepJimMcDermott/status/395998702340685824
;2013-10-30 14:11;6;0;"Obamacare saved my family from financial ruin - The GOP opposes a policy that my son desperately needs. This... http:// tmblr.co/Zs5kKsz2afk7";;;;"395628970819219456";https://twitter.com/RepJimMcDermott/status/395628970819219456
;2013-10-29 15:42;2;1;"Read more from my Ways and Means hearing statement: http:// goo.gl/svz6Nu";;;;"395289504791023616";https://twitter.com/RepJimMcDermott/status/395289504791023616
;2013-10-29 15:40;28;11;"While some #redstates use #ObamaCare to help, more leave millions behind. Every state deserves better. pic.twitter.com/8ebfEgS9N3";;;#redstates #ObamaCare;"395289038820634624";https://twitter.com/RepJimMcDermott/status/395289038820634624
;2013-10-29 15:17;9;3;"While states like WA are helping thousands, TX, FL, and many others refuse to help the working poor. http:// tmblr.co/ZpwjkqyzUAXk";;;;"395283391660429312";https://twitter.com/RepJimMcDermott/status/395283391660429312
;2013-10-28 15:42;2;2;"Thanks, Anna and Teresa! MT @allycoalition : @Gucci from your district asks you to sponsor Safe Schools #MostNights pic.twitter.com/keHdKtS07N";;@allycoalition @Gucci;#MostNights;"394927176660688896";https://twitter.com/RepJimMcDermott/status/394927176660688896
;2013-10-28 15:39;7;0;"Tell your #GetCovered story on my Tumblr to share with Congress. Please leave a name and city too! http:// goo.gl/CqLdpK";;;#GetCovered;"394926480079085568";https://twitter.com/RepJimMcDermott/status/394926480079085568
;2013-10-28 15:37;10;1;"Do you have an #ObamaCare success story? I'd like to share it with my followers and colleagues! http:// goo.gl/CqLdpK";;;#ObamaCare;"394925814308823040";https://twitter.com/RepJimMcDermott/status/394925814308823040
;2013-10-25 14:27;12;4;"Don't forget that the #ACA exchanges aren't just online. There are 4 ways to sign up! http:// tmblr.co/ZpwjkqycB97T";;;#ACA;"393821186481999872";https://twitter.com/RepJimMcDermott/status/393821186481999872
;2013-10-25 11:00;19;3;"Did you know 1 in 8 women will be diagnosed with breast cancer? Spread the word about early detection! pic.twitter.com/wFQiOBT5R0";;;;"393768936392519681";https://twitter.com/RepJimMcDermott/status/393768936392519681
;2013-10-24 16:51;5;0;"Almost all of our families came from somewhere else. The #TimeIsNow for #CIR";;;#TimeIsNow #CIR;"393494916174585856";https://twitter.com/RepJimMcDermott/status/393494916174585856
;2013-10-22 17:44;5;0;"GREAT news! MT@stoneworkdesign: Today enrolled for health care @WAplanfinder . Thrilled saving over $500/mth. #Obamacare";;@stoneworkdesign @WAplanfinder;#Obamacare;"392783576615251968";https://twitter.com/RepJimMcDermott/status/392783576615251968
;2013-10-22 12:22;4;2;"This adorable monkey is worried about your health. Don't let him down! ! http:// tmblr.co/ZpwjkqyLVx8l";;;;"392702598312370177";https://twitter.com/RepJimMcDermott/status/392702598312370177
;2013-10-21 15:35;5;1;"On Friday, I spoke with @PoliticsNation about the #GOP agenda on Friday. You can watch it here! http://www. youtube.com/watch?v=fJCwVO Az5Y0&feature=c4-overview&list=UUaghNJXAOo8VgJMKANvN1dg …";;@PoliticsNation;#GOP;"392388635753869312";https://twitter.com/RepJimMcDermott/status/392388635753869312
;2013-10-16 17:07;0;2;"@Nerdista @jsm1713 Here you go! http:// thinkprogress.org/justice/2013/0 9/26/2680541/how-guns-at-home-can-make-women-less-safe/ …";;@Nerdista @jsm1713;;"390599829040009216";https://twitter.com/RepJimMcDermott/status/390599829040009216
;2013-10-16 14:05;0;0;"If you missed my interview with KUOW yesterday, you can hear it here! http:// goo.gl/OYZtUN";;;;"390554014560972800";https://twitter.com/RepJimMcDermott/status/390554014560972800
;2013-10-15 13:54;6;1;"Classic French film or exposé of the current GOP? You decide! http:// goo.gl/AYuvd5 #GOPShutdown";;;#GOPShutdown;"390189028609249280";https://twitter.com/RepJimMcDermott/status/390189028609249280
;2013-10-12 16:28;37;23;"Today I signed the dispatch petition to vote on a clean CR. The #GOPshutdown must end. pic.twitter.com/xOmQempxyh";;;#GOPshutdown;"389140442438066176";https://twitter.com/RepJimMcDermott/status/389140442438066176
;2013-10-11 11:15;5;3;"I talked to the WSJ about Congress' sanity. Spoiler: I have serious doubts about it. http:// blogs.wsj.com/washwire/2013/ 10/10/house-dems-on-gop-plan-what-about-the-government/ …";;;;"388699374101860352";https://twitter.com/RepJimMcDermott/status/388699374101860352
;2013-10-11 10:41;7;1;"This is what the #ACA is all about: " #Obamacare saved my family from financial ruin" http:// tmblr.co/ZpwjkqxN089V";;;#ACA #Obamacare;"388690825162788864";https://twitter.com/RepJimMcDermott/status/388690825162788864
;2013-10-10 11:45;8;1;"In honor of #WMHD2013 , #HiddenPictures is screening for free all day. Watch now: http:// bit.ly/hidpicsfilm pic.twitter.com/0VHMY3NED1";;;#WMHD2013 #HiddenPictures;"388344669177790464";https://twitter.com/RepJimMcDermott/status/388344669177790464
;2013-10-08 15:59;0;0;"If you missed my interview with @repjimmoran on @Hardball , you can watch it here: https://www. youtube.com/watch?v=OVAhXb 3z5NM …";;@repjimmoran @Hardball;;"387683813737783296";https://twitter.com/RepJimMcDermott/status/387683813737783296
;2013-10-07 17:05;1;1;"I'll be joining @Hardball tonight at 7:45 E, 4:45 P to talk about the #GOPShutdown";;@Hardball;#GOPShutdown;"387337919599345664";https://twitter.com/RepJimMcDermott/status/387337919599345664
;2013-10-07 16:15;48;15;"You can have your own opinions, but not your own facts. The Senate CR is already a compromise. http:// goo.gl/Us0oo5 #GOPShutdown";;;#GOPShutdown;"387325320136642560";https://twitter.com/RepJimMcDermott/status/387325320136642560
;2013-10-03 11:37;11;7;"Thanks, @Disney , @WaltDisneyWorld , for stepping up to help your workers under #ACA ! #corporategood http:// goo.gl/iIw7Yw";;@Disney @WaltDisneyWorld;#ACA #corporategood;"385805938772279296";https://twitter.com/RepJimMcDermott/status/385805938772279296
;2013-10-02 13:46;62;18;"#GOPShutdown costs America $150 million a day. This is a mistake we can't afford. pic.twitter.com/u7kVWSG652";;;#GOPShutdown;"385475976525672448";https://twitter.com/RepJimMcDermott/status/385475976525672448
;2013-10-01 12:23;9;5;"Over 1 million people have visited http:// HealthCare.gov in the last day alone. Millions want to #GetCovered";;;#GetCovered;"385092594377555969";https://twitter.com/RepJimMcDermott/status/385092594377555969
;2013-10-01 10:44;6;3;"In happier news, the #ObamaCare exchanges open today as planned. This is a great day for the uninsured! pic.twitter.com/Uisz15254B";;;#ObamaCare;"385067595134533633";https://twitter.com/RepJimMcDermott/status/385067595134533633
;2013-10-01 10:06;5;4;"Read my statement on the #GOPShutdown here: http:// goo.gl/AtNCMB";;;#GOPShutdown;"385058113075703808";https://twitter.com/RepJimMcDermott/status/385058113075703808
;2013-10-01 10:05;6;3;"The #GOP leadership and its rabid fringe ought to be ashamed of this failure of governance. #GOPShutdown #EnoughAlready";;;#GOP #GOPShutdown #EnoughAlready;"385057944858923008";https://twitter.com/RepJimMcDermott/status/385057944858923008
;2013-10-01 10:04;11;2;"One party, in one branch of Congress, is holding us hostage to override our Constitutional process. #GOPShutdown #EnoughAlready";;;#GOPShutdown #EnoughAlready;"385057666789146624";https://twitter.com/RepJimMcDermott/status/385057666789146624
;2013-09-30 17:22;22;7;"#GOPShutdown of '95 cost taxpayers $1.4 billion. We can't afford another. #EnoughAlready";;;#GOPShutdown #EnoughAlready;"384805477655138305";https://twitter.com/RepJimMcDermott/status/384805477655138305
;2013-09-30 16:16;9;4;"This is not the time to negotiate the 43rd failed attempt at repealing #ObamaCare . #GOPShutdown will hurt the economy.";;;#ObamaCare #GOPShutdown;"384788859717812224";https://twitter.com/RepJimMcDermott/status/384788859717812224
;2013-09-30 13:57;10;3;"Here's my interview from Disrupt w/Karen Finney on the #GOPShutdown . Thanks, @finneyk ! http:// video.msnbc.msn.com/disrupt/531408 18#53140818 …";;@finneyk;#GOPShutdown #53140818;"384753794820489216";https://twitter.com/RepJimMcDermott/status/384753794820489216
;2013-09-26 16:39;3;2;"Photo: A Boost for ObamaCare: Premiums cost less than Expected “With less than one week to go before health... http:// tmblr.co/Zpwjkqw53Duu";;;;"383345159251173376";https://twitter.com/RepJimMcDermott/status/383345159251173376
;2013-09-26 13:47;3;0;"You can find out more about Amir's story here: http:// freeamir.org / #FreeAmir";;;#FreeAmir;"383301743095738368";https://twitter.com/RepJimMcDermott/status/383301743095738368
;2013-09-26 13:44;4;0;"Iranian American and U.S. vet, Amir Hekmati, is being wrongfully imprisoned. It's time to #FreeAmir ! pic.twitter.com/55BN7eWmLQ";;;#FreeAmir;"383301133659168770";https://twitter.com/RepJimMcDermott/status/383301133659168770
;2013-09-25 12:16;12;3;"In just 6 days, #ObamaCare exchanges will open. It's almost time to #GetCovered ! pic.twitter.com/OzYStmvKjA";;;#ObamaCare #GetCovered;"382916496160071680";https://twitter.com/RepJimMcDermott/status/382916496160071680
;2013-09-21 10:00;6;1;"Congratulations on 20 years of service, @americorps ! Here's to many, many more!";;@americorps;;"381432778429956096";https://twitter.com/RepJimMcDermott/status/381432778429956096
;2013-09-20 09:57;0;0;"youtharethefuture asked: Hello I am a Seattle, WA resident. I recently turned 20 and when I turned 19 they... http:// tmblr.co/ZpwjkqvXDsNT";;;;"381069643718610944";https://twitter.com/RepJimMcDermott/status/381069643718610944
;2013-09-19 10:16;4;2;"Happy that you like it! MT @IDECLAIRMEDIA : Tyou for this: http:// youtu.be/k3DP4QfmovU "Dr. McDermott Explains It All: Exchanges"";;@IDECLAIRMEDIA;;"380712085161652224";https://twitter.com/RepJimMcDermott/status/380712085161652224
;2013-09-18 14:26;4;0;"In today's segment of #TheDrExplains , I talk about the #ObamaCare exchanges. http:// tmblr.co/ZpwjkqvO2YJy";;;#TheDrExplains #ObamaCare;"380412549977882624";https://twitter.com/RepJimMcDermott/status/380412549977882624
;2013-09-18 14:11;4;1;"You can watch my full speech on why we need #SNAP funding here: http:// goo.gl/z4Gcf5 #EndHungerNow";;;#SNAP #EndHungerNow;"380408788945092609";https://twitter.com/RepJimMcDermott/status/380408788945092609
;2013-09-18 14:09;9;0;"The #GOP is trying to cut food help for 200,000+ kids. Enough is enough. #EndHungerNow pic.twitter.com/FD7Hm4bWFP";;;#GOP #EndHungerNow;"380408347771420672";https://twitter.com/RepJimMcDermott/status/380408347771420672
;2013-09-17 13:44;2;0;"More good news about #ObamaCare ! Rate reviewing saves consumers $1.2 billion. http:// tmblr.co/ZpwjkqvIb_SD";;;#ObamaCare;"380039542499463168";https://twitter.com/RepJimMcDermott/status/380039542499463168
;2013-09-16 18:52;5;4;"My heart goes out to the Navy Yard victims & families tonight. Thank you, to the 1st responders who work to protect us. #DCStrong";;;#DCStrong;"379754757054668800";https://twitter.com/RepJimMcDermott/status/379754757054668800
;2013-09-16 12:02;9;2;"Photo: This can’t end soon enough. http:// tmblr.co/ZpwjkqvCjVpu";;;;"379651502962659328";https://twitter.com/RepJimMcDermott/status/379651502962659328
;2013-09-14 13:27;2;0;"Thank you! RT @isquiesque : Get to know the 7th District! http:// goo.gl/wAljkB ( @RepJimMcDermott , you did a great job!)";;@isquiesque @RepJimMcDermott;;"378948132052037632";https://twitter.com/RepJimMcDermott/status/378948132052037632
;2013-09-14 13:27;2;1;"Happy to now know that Seattle is the hometown of rap royalty! RT @therealmix : @JamieLynnDrohan @ColbertReport I did?";;@therealmix @JamieLynnDrohan @ColbertReport;;"378948020772929536";https://twitter.com/RepJimMcDermott/status/378948020772929536
;2013-09-14 13:18;1;2;"I was sadly unaware of your classic hit, but I've since been educated! MT @therealmix : @JamieLynnDrohan @ColbertReport I did?";;@therealmix @JamieLynnDrohan @ColbertReport;;"378945755169320960";https://twitter.com/RepJimMcDermott/status/378945755169320960
;2013-09-14 13:07;1;3;"Thank you! MT @JustAnotherRich : By far best-handled "Know Ur District" interview so far. Reminds me of how awesome people in the PNW are.";;@JustAnotherRich;;"378943208127877120";https://twitter.com/RepJimMcDermott/status/378943208127877120
;2013-09-13 12:38;13;10;"Now I know! MT @briscoepelkey : You let down @therealmix on Colbert! Voters trust politicians who like #BigButts because they can not lie!";;@briscoepelkey @therealmix;#BigButts;"378573498592927744";https://twitter.com/RepJimMcDermott/status/378573498592927744
;2013-09-13 12:17;1;0;"But they did clean up afterward! MT@KyungMSong: Last night's Colbert show with McDermott, Salmon toss in Cannon building left mess.";;@KyungMSong;;"378568127614697472";https://twitter.com/RepJimMcDermott/status/378568127614697472
;2013-09-13 11:50;4;0;"Missed my segment with @StephenAtHome ? http:// goo.gl/wAljkB Teaser: Stephen reveals deep insecurities on a very special #BKAD";;@StephenAtHome;#BKAD;"378561389624713216";https://twitter.com/RepJimMcDermott/status/378561389624713216
;2013-09-13 09:56;5;1;"That sums it up! MT @Glencaren : @StephenAtHome asked McDermott if he liked big butts, if he would make out w/ him, & threw salmon around. #LOL";;@Glencaren @StephenAtHome;#LOL;"378532600513429504";https://twitter.com/RepJimMcDermott/status/378532600513429504
;2013-09-12 17:37;1;0;"I hope constituents--or anyone-- will find it helpful! MT @ritchie4wa8: @RepJimMcDermott Thank you for doing this!";;@ritchie4wa8 @RepJimMcDermott;;"378286196280926210";https://twitter.com/RepJimMcDermott/status/378286196280926210
;2013-09-12 17:01;3;1;"If you'd like to ask me a question about #ObamaCare , you can submit one here: http:// themedicinecabinet.tumblr.com/ask #TheDrExplains";;;#ObamaCare #TheDrExplains;"378277337193668608";https://twitter.com/RepJimMcDermott/status/378277337193668608
;2013-09-12 16:59;4;0;"Confused about #ObamaCare ? I'm making some videos to explain aspects of reform. Here's the first! http:// goo.gl/JF9R8u #TheDrExplains";;;#ObamaCare #TheDrExplains;"378276625357344768";https://twitter.com/RepJimMcDermott/status/378276625357344768
;2013-09-10 18:21;4;0;"I didn't win, but I did enjoy taking on National Champ, Andrew Borracchini for @NationalGrocers "Best Bagger." pic.twitter.com/GD1vedCZNl";;@NationalGrocers;;"377572650316333056";https://twitter.com/RepJimMcDermott/status/377572650316333056
;2013-09-10 14:00;0;0;". @AARP helps you remind your (big) kids to check out new affordable insurance options! http:// goo.gl/6yFX02 pic.twitter.com/ATzkGu4hDD";;@AARP;;"377506884845973504";https://twitter.com/RepJimMcDermott/status/377506884845973504
;2013-09-09 15:20;2;2;"Thank you, to everyone who came out to the #Syria listening session last night. Great turnout for an important discussion.";;;#Syria;"377164699713822720";https://twitter.com/RepJimMcDermott/status/377164699713822720
;2013-09-05 14:16;4;3;"I'm hosting a listening session this Sunday to hear from my constituents on #Syria . http:// goo.gl/qDEpVR";;;#Syria;"375699028479967232";https://twitter.com/RepJimMcDermott/status/375699028479967232
;2013-09-04 18:30;1;2;"For those celebrating tonight, have a sweet Rosh Hashanah. L' Shanah Tovah!";;;;"375400621446164480";https://twitter.com/RepJimMcDermott/status/375400621446164480
;2013-08-30 18:17;2;1;"I'm excited to talk about #Syria with Chris Hayes on @AllinWithChris tonight at 8E/5P. Don't miss it!";;@AllinWithChris;#Syria;"373585337303314432";https://twitter.com/RepJimMcDermott/status/373585337303314432
;2013-08-30 15:19;10;2;"We must ask: What is our national interest here? What is our end goal? Read my statement on #Syria here: http:// goo.gl/IhUKjU";;;#Syria;"373540389619113984";https://twitter.com/RepJimMcDermott/status/373540389619113984
;2013-08-29 14:08;16;3;"Think fast food workers are mostly kids saving up for a car? Think again! http:// goo.gl/avW0Fu #raisethewage #829strike";;;#raisethewage #829strike;"373160332237090816";https://twitter.com/RepJimMcDermott/status/373160332237090816
;2013-08-29 13:28;22;10;"I stand in #solidarity with the striking workers in Seattle and across the country. All labor has dignity. #raisethewage #829strike";;;#solidarity #raisethewage #829strike;"373150180930891776";https://twitter.com/RepJimMcDermott/status/373150180930891776
;2013-08-28 14:49;8;2;"Today we honor the heroes & martyrs who fought for justice and remember to keep moving forward. #MLKDream50 pic.twitter.com/tD4v3SNJgj";;;#MLKDream50;"372808153781370881";https://twitter.com/RepJimMcDermott/status/372808153781370881
;2013-08-26 16:08;7;6;"Happy #WomensEqualityDay ! Let's keep fighting for equal pay, protection under the law, and representation!";;;#WomensEqualityDay;"372103261928435714";https://twitter.com/RepJimMcDermott/status/372103261928435714
;2013-08-23 16:47;2;0;"It may be an exhibition game, but good luck to the @Seahawks tonight!";;@Seahawks;;"371025827267244032";https://twitter.com/RepJimMcDermott/status/371025827267244032
;2013-08-21 14:49;1;1;"It's no wonder our middle class is suffocating. RT @EzraSays : Between 2000 and 2012, American wages grew not at all http:// wapo.st/1d2EnYX";;@EzraSays;;"370271345893863424";https://twitter.com/RepJimMcDermott/status/370271345893863424
;2013-08-20 15:57;4;0;"Congrats to Eastlake, who just advanced in Little League World Series! Good luck tonight against Nashville! #LLWS";;;#LLWS;"369926216129581056";https://twitter.com/RepJimMcDermott/status/369926216129581056
;2013-08-16 12:47;0;0;"Great news! MT @Mandy4Action : @NIH give Seattle lab $16.6 million to study #TB http:// goo.gl/IkXwhI";;@Mandy4Action @NIH;#TB;"368428864835297280";https://twitter.com/RepJimMcDermott/status/368428864835297280
;2013-08-14 11:26;4;0;"I'm about to go on the Ed Schultz Show to discuss #ObamaCare with @WeGotEd . Listen live at http://www. bigeddieradio.com/listen/#top";;@WeGotEd;#ObamaCare #top;"367683545591861248";https://twitter.com/RepJimMcDermott/status/367683545591861248
;2013-08-12 15:19;14;3;"In 50 days the #ObamaCare exchanges open for enrollment. Know the facts to save $ and #GetCovered . http:// goo.gl/dHTNZF";;;#ObamaCare #GetCovered;"367017588670218240";https://twitter.com/RepJimMcDermott/status/367017588670218240
;2013-08-07 15:54;5;2;"I sent a letter to the FCC urging the defense of free & open internet in light of the CBS/TWC dispute. Check it out! http:// goo.gl/ooiWhk";;;;"365214344532856833";https://twitter.com/RepJimMcDermott/status/365214344532856833
;2013-08-06 16:32;6;0;"48 years ago today, the Voting Rights Act was signed into law, but SCOTUS desicion put protections in danger again. It's time to act! #VRA";;;#VRA;"364861560981700609";https://twitter.com/RepJimMcDermott/status/364861560981700609
;2013-08-05 14:05;3;0;"20 years of Family and Medical Leave Act today! But #FMLA doesn't help if you can't afford to take it. #PaidLeaveNow";;;#FMLA #PaidLeaveNow;"364462163093499904";https://twitter.com/RepJimMcDermott/status/364462163093499904
;2013-08-02 15:19;6;0;"Good read from . @Michael_Shank : "The fact is that America will never be able to drone-strike its way to peace." http://www. washingtonpost.com/blogs/on-faith /wp/2013/08/02/advertising-against-muslims-not-with-my-tax-dollars/ …";;@Michael_Shank;;"363393610948943874";https://twitter.com/RepJimMcDermott/status/363393610948943874
;2013-08-02 11:40;6;1;"We have better things to work on. RT @WaysMeansCmte : The #REPEALicans #Obamacare Obsession in One Graph. pic.twitter.com/bbOzBBGrJR";;@WaysMeansCmte;#REPEALicans #Obamacare;"363338456031707136";https://twitter.com/RepJimMcDermott/status/363338456031707136
;2013-08-02 10:13;1;2;"Great article on my #Iran Letter: Meet the 20 Lawmakers Who Stood Up to the War Lobby http:// huff.to/19AD2WL via @HuffPostWorld";;@HuffPostWorld;#Iran;"363316756359561217";https://twitter.com/RepJimMcDermott/status/363316756359561217
;2013-08-02 09:18;0;0;"@Aine These provisions will start in January of 2014. They can apply for the exchanges October 1!";;@Aine;;"363302911645716480";https://twitter.com/RepJimMcDermott/status/363302911645716480
;2013-08-01 16:33;0;0;"@Niuncentav0 The short answer is yes, everyone must get insurance through their job or the exchanges. Stay tuned for the long answer!";;@Niuncentav0;;"363049900319051776";https://twitter.com/RepJimMcDermott/status/363049900319051776
;2013-08-01 15:23;0;0;"@_Middleman Ideally, everyone should be able to afford insurance (w/subsidies if need be) through the exchanges starting 1/1/2014.";;@_Middleman;;"363032273110581249";https://twitter.com/RepJimMcDermott/status/363032273110581249
;2013-08-01 15:04;1;1;"@Aine Your friends can sign up here: http://www. colorado.gov/healthreform";;@Aine;;"363027523128410112";https://twitter.com/RepJimMcDermott/status/363027523128410112
;2013-08-01 15:03;1;1;"@Aine Exchanges will open October 1 and they will be a one-stop-shop. If you qualify for any subsidies they will direct you.";;@Aine;;"363027323731181568";https://twitter.com/RepJimMcDermott/status/363027323731181568
;2013-08-01 14:58;0;0;"@Aine Are you in Washington State?";;@Aine;;"363025876314628097";https://twitter.com/RepJimMcDermott/status/363025876314628097
;2013-08-01 14:36;0;0;"@Aine Actually, individuals making under 45k a year should be eligible for expanded medicaid or subsidies to make it more affordable.";;@Aine;;"363020524902817794";https://twitter.com/RepJimMcDermott/status/363020524902817794
;2013-08-01 14:29;0;0;"@John_de_Vashon How they can do that in good conscience? I can't answer that one.";;@John_de_Vashon;;"363018792491696129";https://twitter.com/RepJimMcDermott/status/363018792491696129
;2013-08-01 14:17;4;2;"There's a lot of confusion going around about #ObamaCare . Is there anything you wish someone would explain in plain terms?";;;#ObamaCare;"363015559643803648";https://twitter.com/RepJimMcDermott/status/363015559643803648
;2013-08-01 12:36;3;3;"Thanks to #ObamaCare , we're had a year of no co-pay #birthcontrol and other preventative services. #ObamaCareWorks";;;#ObamaCare #birthcontrol #ObamaCareWorks;"362990299791896577";https://twitter.com/RepJimMcDermott/status/362990299791896577
