username;date;retweets;favorites;text;geo;mentions;hashtags;id;permalink
;2011-06-03 22:43;1;1;"Do you think my tax bill is a good idea or a bad idea? Join the discussion by commenting here please http:// j.mp/kEeF8Y . I'll reply there.";;;;"76856656088137729";https://twitter.com/RepJimMcDermott/status/76856656088137729
;2011-06-03 19:06;1;0;"Great article on taxing health benefits for married & unmarried couples equally http://j.mp/l0QnZj by Kristina Peterson of DowJonesNews @WSJ";;@WSJ;;"76802028940165120";https://twitter.com/RepJimMcDermott/status/76802028940165120
;2011-06-03 18:29;6;0;"Many companies, even @MillerCoors , extend health care to their workers' non-spouses but they're unfairly hit w/ a big tax http://j.mp/k74q0h";;@MillerCoors;;"76792602254520321";https://twitter.com/RepJimMcDermott/status/76792602254520321
;2011-06-03 18:11;8;0;"Workers deserve equal access to health benefits - companies like @Microsoft @Boeing & many others agree & support my bill http://j.mp/k74q0h";;@Microsoft @Boeing;;"76788193290227712";https://twitter.com/RepJimMcDermott/status/76788193290227712
;2011-06-03 15:11;3;0;"Video: workers should have equal access to health benefits & my tax fairness bill seems to be getting some attention http://j.mp/lt8mL4 @HRC";;@HRC;;"76742753748389888";https://twitter.com/RepJimMcDermott/status/76742753748389888
;2011-06-03 11:09;6;0;"I'm progressive & support tax cuts that are fair. I just introduced a bill that cuts taxes for companies & their workers http:// j.mp/iAGneq";;;;"76681948780699648";https://twitter.com/RepJimMcDermott/status/76681948780699648
;2011-06-02 20:27;4;0;"Simply put, the bill I introduced today would end unfair tax treatment of employees. Read & let me know what you think http://j.mp/iAGneq";;;;"76460037714870272";https://twitter.com/RepJimMcDermott/status/76460037714870272
;2011-06-02 20:24;2;0;"My Bill: Companies wouldn't be penalized for recognizing employee diversity & providing more inclusive health plans http://j.mp/iAGneq @HRC";;@HRC;;"76459301220253696";https://twitter.com/RepJimMcDermott/status/76459301220253696
;2011-06-01 22:28;5;2;"Glad Senate Democrats & Republicans are working on a similar foster care bill that just passed the House http://j.mp/ingU6v @childrensrights";;@childrensrights;;"76127940097753089";https://twitter.com/RepJimMcDermott/status/76127940097753089
;2011-06-01 22:20;6;0;"The US House passed my foster care bill that builds upon the 2008 Fostering Connections law that I wrote http://j.mp/ingU6v @childrensrights";;@childrensrights;;"76126005412102144";https://twitter.com/RepJimMcDermott/status/76126005412102144
;2011-06-01 21:07;4;1;"Improving our foster care system shouldn't be a partisan issue - yesterday, I am happy to report, the House proved this: http://j.mp/ingU6v";;;;"76107726131970048";https://twitter.com/RepJimMcDermott/status/76107726131970048
;2011-06-01 11:48;8;0;"At 1:30 PM EST I'm going to be on the radio discussing Republican political games with the debt ceiling. Listen: http://j.mp/frTsXI @WeGotEd";;@WeGotEd;;"75966933278785538";https://twitter.com/RepJimMcDermott/status/75966933278785538
;2011-06-01 10:41;3;0;"Look for post from @aterkel and @samsteinhp on @HuffingtonPost . Talking to them right now about debt ceiling & Medicare. http:// yfrog.com/h4wpzhtj";;@aterkel @samsteinhp @HuffingtonPost;;"75950192079278081";https://twitter.com/RepJimMcDermott/status/75950192079278081
;2011-05-30 22:50;1;0;"To those currently returning from or serving abroad on this #MemorialDay , and the 364 other days of the year, thank you. http:// on.fb.me/lGEGmY";;;#MemorialDay;"75408707961364481";https://twitter.com/RepJimMcDermott/status/75408707961364481
;2011-05-30 22:44;0;0;"I recorded a short video message about the importance of #MemorialDay and veterans: http:// on.fb.me/lGEGmY .";;;#MemorialDay;"75407362730627072";https://twitter.com/RepJimMcDermott/status/75407362730627072
;2011-05-30 22:42;2;0;"#MemorialDay is a time to remember those who lost their lives for our nation. It dates back to the Civil War: http:// on.fb.me/lGEGmY";;;#MemorialDay;"75406745106788352";https://twitter.com/RepJimMcDermott/status/75406745106788352
;2011-05-26 18:08;1;0;"@RepJimMcDermott @msnbc Here is the video of the interview I did on MSNBC about an hour ago http://bit.ly/mbzL5D. Let me know what you think";;@RepJimMcDermott @msnbc;;"73888157107634176";https://twitter.com/RepJimMcDermott/status/73888157107634176
;2011-05-26 16:59;0;0;"On @msnbc in few minutes (3pm pacific) to talk about Medicare. Tune in if you can. I'll send the video around after. #Medicare #GOP";;@msnbc;#Medicare #GOP;"73870934280388608";https://twitter.com/RepJimMcDermott/status/73870934280388608
;2011-05-25 20:27;21;3;"Still stunned @how Republicans treated Elizabeth Warren. She deserves respect: I commented w/ a video link of her here http://bit.ly/iuUEh4";;@how;;"73560889302859776";https://twitter.com/RepJimMcDermott/status/73560889302859776
;2011-05-25 19:38;7;0;"Today I talked to Ms. Warren about the Bureau and how to continue making progress despite Republican sabotage. Photo/info http://j.mp/iuUEh4";;;;"73548428638035968";https://twitter.com/RepJimMcDermott/status/73548428638035968
;2011-05-25 18:49;12;0;"As many of you know, Republicans were very rude yesterday to Elizabeth Warren, Obama's consumer advocate adviser. Video: http://j.mp/iFN9nV";;;;"73536310178103296";https://twitter.com/RepJimMcDermott/status/73536310178103296
;2011-05-24 18:27;4;0;"Wrong direction: Republicans' starting point to "fix" Medicare is a plan to essentially end the program. Interesting read http://j.mp/kKfUNk";;;;"73168158873235456";https://twitter.com/RepJimMcDermott/status/73168158873235456
;2011-05-24 17:36;2;0;"Republicans say they're now ready for a "serious conversation" about Medicare. Last year, though, "death plans" were okay http://j.mp/m1bF0W";;;;"73155517916258304";https://twitter.com/RepJimMcDermott/status/73155517916258304
;2011-05-24 17:10;4;0;"Millions rely on Medicare. Now Republicans want to privatize the program, which would have devastating effects http://j.mp/m1bF0W Thoughts?";;;;"73148843901992961";https://twitter.com/RepJimMcDermott/status/73148843901992961
;2011-05-23 20:54;3;0;"I'm going to be on @MSNBC at the top of the hour. Tune in if you can. Will be talking about Republican plans to end Medicare as we know it.";;@MSNBC;;"72842971560681472";https://twitter.com/RepJimMcDermott/status/72842971560681472
;2011-05-23 10:12;10;1;"If you don’t have time to read the full @ezraklein piece. Here’s the story in one simple graph: http://twitpic.com/51jce2";;@ezraklein;;"72681294345150464";https://twitter.com/RepJimMcDermott/status/72681294345150464
;2011-05-23 10:06;7;1;". @ezraklein concisely explains where our debt comes from. The Bush tax cuts, to no surprise, are the biggest contributor: http://j.mp/lDazg7";;@ezraklein;;"72679863517057024";https://twitter.com/RepJimMcDermott/status/72679863517057024
;2011-05-23 09:03;2;1;""New polling says overwhelming majority want Social Security left alone" http:// bit.ly/mA5ihU Its not a deficit problem & should be protected";;;;"72663976604991488";https://twitter.com/RepJimMcDermott/status/72663976604991488
;2011-05-19 11:22;1;0;"GOP Sen. Coburn acknowledges making millionaires pay their fair share in taxes is good policy, and what Americans demand. http://j.mp/iFXhOv";;;;"71249317754712064";https://twitter.com/RepJimMcDermott/status/71249317754712064
;2011-05-19 11:10;1;0;"#MESpeech is now actually live. Watch: http://wh.gov/live";;;#MESpeech;"71246342944604160";https://twitter.com/RepJimMcDermott/status/71246342944604160
;2011-05-19 10:46;11;0;"Great news: Senate GOP has essentially given up on House GOP budget plan to slash Medicare. http://j.mp/lJUmNl Keep up the pressure #p2";;;#p2;"71240255356936192";https://twitter.com/RepJimMcDermott/status/71240255356936192
;2011-05-19 10:41;2;0;"Link for live stream of the President's upcoming #MESpeech for all interested: http://wh.gov/live Use #MESpeech to join conversation.";;;#MESpeech #MESpeech;"71238969999900673";https://twitter.com/RepJimMcDermott/status/71238969999900673
;2011-05-19 10:11;1;1;"President Obama is making his speech on the Middle East in about 30 minutes. @acarvin is taking questions. Submit yours using #mespeech #p2";;@acarvin;#mespeech #p2;"71231427525611520";https://twitter.com/RepJimMcDermott/status/71231427525611520
;2011-05-18 15:23;5;0;"More reasons why we need to break our oil addiction from @CommerceGov http://go.usa.gov/jEe";;@CommerceGov;;"70947702644555776";https://twitter.com/RepJimMcDermott/status/70947702644555776
;2011-05-18 15:21;1;0;"My @smshow visit today: http://j.mp/mviZGg Topics include debt ceiling and my single-payer bill. #p2 #healthcare";;@smshow;#p2 #healthcare;"70947034793918465";https://twitter.com/RepJimMcDermott/status/70947034793918465
;2011-05-17 20:05;6;0;"Newt Gingrich apologizes for saying right thing on Sunday!? So Republican plans to end Medicare are no longer "radical"? http:// politi.co/krOzUR";;;;"70656220586967040";https://twitter.com/RepJimMcDermott/status/70656220586967040
;2011-05-17 10:08;3;0;"Joined http://tweetprogress.us a directory of progressives on twitter. #p2";;;#p2;"70505994215620609";https://twitter.com/RepJimMcDermott/status/70505994215620609
;2011-05-17 10:06;9;1;"Agreed. RT @SenatorDurbin $1 trillion profits over last 10yrs... it’s fair to say that oil companies don’t need more taxpayer handouts. #p2";;@SenatorDurbin;#p2;"70505373022429185";https://twitter.com/RepJimMcDermott/status/70505373022429185
;2011-05-16 17:31;5;1;"Does anyone really think the American people will just forget about the radical plans Republicans have pursued thus far in Congress?";;;;"70255066757603330";https://twitter.com/RepJimMcDermott/status/70255066757603330
;2011-05-16 17:28;3;0;"@SpeakerBoehner even tried to back away from his party's End Medicare plans, saying he is “not wedded to one single idea” http://j.mp/k9KMjR";;@SpeakerBoehner;;"70254319588487168";https://twitter.com/RepJimMcDermott/status/70254319588487168
;2011-05-16 17:19;3;1;"In case you missed it, Republicans running away from their "End Medicare" plans http://j.mp/iGJae1. At 3:30 PDT, I'm on @msnbc to discuss.";;@msnbc;;"70252086054498304";https://twitter.com/RepJimMcDermott/status/70252086054498304
;2011-05-16 15:35;12;1;"GOP using debt ceiling to cut pensions. Awful. RT @daveweigel pensions traded away in debt ceiling deal http://slate.me/mE4qxp #WIeverywhere";;@daveweigel;#WIeverywhere;"70225951375634432";https://twitter.com/RepJimMcDermott/status/70225951375634432
;2011-05-16 13:06;1;0;"Great news. RT @Mb_society HB 1128 has been signed by @GovGregoire ! Press release featuring @RepJimMcDermott here: http:// bit.ly/jIrGA4 .";;@Mb_society @GovGregoire @RepJimMcDermott;;"70188463944769536";https://twitter.com/RepJimMcDermott/status/70188463944769536
;2011-05-14 18:06;54;0;"I'm extremely concerned about violence in #Bahrain , especially against medical professionals. I'm working on legislation http:// on.fb.me/jZXYrG";;;#Bahrain;"69539104727117824";https://twitter.com/RepJimMcDermott/status/69539104727117824
;2011-05-13 11:03;1;0;"A full recording of the town hall I held on the 10th is now available: http://youtu.be/6Gpziz1nI-w";;;;"69070262607425536";https://twitter.com/RepJimMcDermott/status/69070262607425536
;2011-05-13 10:32;2;0;"Remember when Republicans openly supported cutting oil subsidies too? http://youtu.be/aJE3npRyQMA";;;;"69062574548844544";https://twitter.com/RepJimMcDermott/status/69062574548844544
;2011-05-13 09:52;13;1;"Who's responsible for the debt again? Seems clear to me. #notdems http://twitpic.com/4x2hpd";;;#notdems;"69052462669115392";https://twitter.com/RepJimMcDermott/status/69052462669115392
;2011-05-11 21:48;1;0;"@7:50ish (Pacific), I'm going to be on @msnbc , talking about Republicans -Newt for Prez, House Repubs & a new poll showing voters R unhappy";;@7 @msnbc;;"68507869795987457";https://twitter.com/RepJimMcDermott/status/68507869795987457
;2011-05-11 20:21;6;0;"Today, I spoke on KUOW (Seattle's NPR station) about my single-payer measure and how it builds off the health care law: http://bit.ly/jxcxqM";;;;"68485832612397056";https://twitter.com/RepJimMcDermott/status/68485832612397056
;2011-05-11 20:05;20;2;"Yesterday I unveiled a bill that would give states the option to adopt a single-payer health care system if they want to: http://j.mp/iJnEsa";;;;"68481812636237826";https://twitter.com/RepJimMcDermott/status/68481812636237826
;2011-05-11 20:01;4;0;"Last year's health care law was a good one, but I think we need to strengthen it so that it control health care costs. http://j.mp/iJnEsa";;;;"68480913427808256";https://twitter.com/RepJimMcDermott/status/68480913427808256
;2011-05-11 15:16;0;0;"@WeAreECS I really enjoyed it. Just disappointed we didn't get three points.";;@WeAreECS;;"68409174198976512";https://twitter.com/RepJimMcDermott/status/68409174198976512
;2011-05-11 13:30;0;0;"Joining @KUOWconvo at 12:10 pm Pacific to discuss the #singlepayer bill I intro'd with @senatorsanders yesterday. Listen: http://j.mp/15CA3G";;@KUOWconvo @senatorsanders;#singlepayer;"68382421741088770";https://twitter.com/RepJimMcDermott/status/68382421741088770
;2011-05-11 13:16;1;0;"I will be live on @KUOW in about an hour to discuss my #singlepayer bill. Here's a link to listen live: http://www.kuow.org/listen/";;@KUOW;#singlepayer;"68378971695353857";https://twitter.com/RepJimMcDermott/status/68378971695353857
;2011-05-11 11:07;7;1;"Inconvenient for @johnboehner that his economic views are contradicted by... facts. http://j.mp/iAqGRt";;@johnboehner;;"68346511049768960";https://twitter.com/RepJimMcDermott/status/68346511049768960
;2011-05-11 11:05;9;2;"Bizarre and disappointing. GOP attempted to "repeal" an EPA scientific finding. http://j.mp/mwzZhJ #climatechange";;;#climatechange;"68345904142368768";https://twitter.com/RepJimMcDermott/status/68345904142368768
;2011-05-10 21:10;0;0;"My telephone town hall is live. Listen and participate online now! - #repjimmcdermott live on http://livestream.com/repjimmcdermott";;;#repjimmcdermott;"68135752608915456";https://twitter.com/RepJimMcDermott/status/68135752608915456
;2011-05-09 19:34;5;1;"Seattleites, I'm hosting a tele-town hall tomorrow. Here is a 30-second video on why I am doing it & how you can join in: http://j.mp/kR7xEl";;;;"67749200540082176";https://twitter.com/RepJimMcDermott/status/67749200540082176
;2011-05-09 12:24;1;1;"Heartening. RT @LeilZahra Sign: Muslim & I love my Christian brother, we are all Egyptian at Imbaba demonstration. http://twitpic.com/4vkktk";;@LeilZahra;;"67641158301523968";https://twitter.com/RepJimMcDermott/status/67641158301523968
;2011-05-07 18:32;0;0;"Today's neighborhood coffee event in Capitol Hill was terrific - we talked about a number of issues. Pictures & details: http://j.mp/lSH1fg.";;;;"67008823998681088";https://twitter.com/RepJimMcDermott/status/67008823998681088
;2011-05-07 18:02;14;2;"Without teachers, we wouldn’t get anywhere – they open the world to us. Who was your favorite teacher? http://on.fb.me/ioMRmy #thankateacher";;;#thankateacher;"67001420183900160";https://twitter.com/RepJimMcDermott/status/67001420183900160
;2011-05-07 17:00;2;0;"It's teacher appreciation week - share a story about the best teacher you had here: http://on.fb.me/ioMRmy @neamedia @neatoday";;@neamedia @neatoday;;"66985839615410177";https://twitter.com/RepJimMcDermott/status/66985839615410177
;2011-05-07 13:56;0;0;"Thank you to all my Cap Hill constituents that came out and had a cup of coffee and good conversation w/ me. Pictures forthcoming.";;;;"66939593676693504";https://twitter.com/RepJimMcDermott/status/66939593676693504
;2011-05-07 10:51;1;0;"I'm looking forward to having coffee with my constituents @Capitol Hill's Caffé Vita today at 10 a.m. More information: http://j.mp/lG5tDa";;@Capitol;;"66892933412044802";https://twitter.com/RepJimMcDermott/status/66892933412044802
;2011-05-05 19:26;2;0;"Republicans keep pursuing their go-nowhere agenda & spent time today focusing on "their regular whipping boy: Unions" http://j.mp/m61mpq";;;;"66297784696975360";https://twitter.com/RepJimMcDermott/status/66297784696975360
;2011-05-04 12:25;6;0;"GOP finally sees gas prices are hurting citizens. I wonder, will they back alternative energy to get us off foreign oil? http://j.mp/lrSGZU";;;;"65829362250944512";https://twitter.com/RepJimMcDermott/status/65829362250944512
;2011-05-04 10:33;11;0;".@RepPaulRyan @RepJoeWalsh @RepMickMulvaney Voting one way, talking to voters another. How can you explain this? http://j.mp/kPnbxe";;@RepPaulRyan @RepJoeWalsh @RepMickMulvaney;;"65801212846538752";https://twitter.com/RepJimMcDermott/status/65801212846538752
;2011-05-04 10:29;13;0;"Classic. Republicans vote to preserve Big Oil handouts despite record profits. Then tell voters they oppose them. http://thkpr.gs/kM2dlk";;;;"65800200568061952";https://twitter.com/RepJimMcDermott/status/65800200568061952
;2011-05-04 10:19;0;0;"@CitizenWonk thanks for including @thenation Medicare article. Great piece.";;@CitizenWonk @thenation;;"65797721226874880";https://twitter.com/RepJimMcDermott/status/65797721226874880
;2011-05-03 18:05;3;0;"Lots going on: economy, bin Laden, GOP's nonstop effort to repeal Roe v. Wade & health care. Join me in conference call http://bit.ly/l8TTRr";;;;"65552683901267968";https://twitter.com/RepJimMcDermott/status/65552683901267968
;2011-05-03 15:05;1;0;"Great piece by @elleexplains in the Hill today. Our nation must do more to help children in foster care. http://j.mp/kHDU8Q";;@elleexplains;;"65507252894834689";https://twitter.com/RepJimMcDermott/status/65507252894834689
;2011-05-02 13:01;2;0;"An interesting opportunity for those in Ballard: http://j.mp/mqV2Lz Free Norwegian classes.";;;;"65113697789554690";https://twitter.com/RepJimMcDermott/status/65113697789554690
;2011-05-02 11:02;0;0;"@directorLCSNW Well said. I've retweeted your response.";;@directorLCSNW;;"65083668200296449";https://twitter.com/RepJimMcDermott/status/65083668200296449
;2011-05-02 10:11;4;0;"Here's just one of the many reasons I oppose the Medicare cut. http://twitpic.com/4secul";;;;"65070946192605185";https://twitter.com/RepJimMcDermott/status/65070946192605185
;2011-05-02 10:04;3;0;"Show @RepPaulRyan you are opposed to the plan to end Medicare because you *are* informed. Tweet why you're opposed.";;@RepPaulRyan;;"65069114410020864";https://twitter.com/RepJimMcDermott/status/65069114410020864
;2011-05-02 10:02;6;0;"Republican Rep. @RepPaulRyan is trying to blame opposition to ending Medicare as we know it on "misinformation". http://j.mp/llb6bT";;@RepPaulRyan;;"65068531917660161";https://twitter.com/RepJimMcDermott/status/65068531917660161
;2011-05-02 09:28;7;2;"Republicans are doing everything they can to obfuscate that they are advocating effectively ending Medicare. http://j.mp/jvLePH";;;;"65060093321936896";https://twitter.com/RepJimMcDermott/status/65060093321936896
;2011-05-02 09:17;2;0;"For anyone who may have missed it, Pres Obama's White House Correspondents' Dinner remarks are worth a watch. http://youtu.be/n9mzJhvC-8E";;;;"65057324670271488";https://twitter.com/RepJimMcDermott/status/65057324670271488
;2011-04-30 01:40;8;0;"Good news: “ @ABC : Court Lifts Federal Stem Cell Ban http:// abcn.ws/kU2UQc ”";;@ABC;;"64217594114211840";https://twitter.com/RepJimMcDermott/status/64217594114211840
;2011-04-28 23:27;5;0;"Another day of record #of tornadoes across U.S. Thoughts & prayers are w/ those recovering and their families http:// j.mp/iZmjDg @redcross";;@redcross;#of;"63821571701215232";https://twitter.com/RepJimMcDermott/status/63821571701215232
;2011-04-28 17:38;5;1;"Good news: GOP open to ending oil tax subsidies. Want to ensure all have working link to Pres. Obama's letter: http://j.mp/mUjM65 @PressSec";;@PressSec;;"63733764777447426";https://twitter.com/RepJimMcDermott/status/63733764777447426
;2011-04-28 17:10;6;0;"I'm happy to see Florida Republicans standing up against discrimination of public unions/employees. Read this article: http://huff.to/kp4fFg";;;;"63726803826655232";https://twitter.com/RepJimMcDermott/status/63726803826655232
;2011-04-28 15:37;2;0;"Some stunning photos of the aftermath of the tornadoes that struck 5 southern states this week. http://j.mp/jJSVAW";;;;"63703334640562177";https://twitter.com/RepJimMcDermott/status/63703334640562177
;2011-04-28 15:25;1;0;"Egyptians optimistic about the country's future outnumber pessimists by nearly 4 to 1. http://j.mp/lwRZKn";;;;"63700331804114944";https://twitter.com/RepJimMcDermott/status/63700331804114944
;2011-04-28 15:08;1;0;"A fascinating look from Pew into how the Egyptian people themselves feel about their revolution. http://j.mp/lwRZKn";;;;"63696160820428800";https://twitter.com/RepJimMcDermott/status/63696160820428800
;2011-04-28 13:47;1;0;"How much does a WA wine cost in Seoul, South Korea? Check my guest blog for @commercegov from South Korea. http://j.mp/lzEGhj";;@commercegov;;"63675604960153600";https://twitter.com/RepJimMcDermott/status/63675604960153600
;2011-04-27 08:37;0;0;"@The5ideals Could you send me a source on this? This is definitely something I'm interested in.";;@The5ideals;;"63235272036454402";https://twitter.com/RepJimMcDermott/status/63235272036454402
;2011-04-26 00:31;6;0;"Republicans simply think lowering taxes will solve everything. Our tax system is broken & this one-size-fits-all plan isn't the fix.";;;;"62750651377139713";https://twitter.com/RepJimMcDermott/status/62750651377139713
;2011-04-25 10:21;20;1;"Unjustifiable. http://twitpic.com/4pejbw";;;;"62536735342600193";https://twitter.com/RepJimMcDermott/status/62536735342600193
;2011-04-25 09:31;2;0;"The right decision. Supreme Court rejects Virginia AG's challenge to health care law. http://j.mp/f09PH0";;;;"62524149100326912";https://twitter.com/RepJimMcDermott/status/62524149100326912
;2011-04-23 18:40;6;1;"As a senior member of Congress' tax-writing committee, I pledge to support incentives for renewable energy http:j.mp/fnyntz @EarthDayNetwork";;@EarthDayNetwork;;"61937482031300608";https://twitter.com/RepJimMcDermott/status/61937482031300608
;2011-04-23 18:11;3;0;"The "A Billion Acts of Green" project has made it easy to declare your act of green on this Earth Day: http:// j.mp/fnyntz @EarthDayNetwork";;@EarthDayNetwork;;"61930239131004928";https://twitter.com/RepJimMcDermott/status/61930239131004928
;2011-04-22 09:26;3;0;"Reports coming in from BBC that there are "tens of thousands" on the streets in #Syria . #ArabSpring";;;#Syria #ArabSpring;"61435663278551040";https://twitter.com/RepJimMcDermott/status/61435663278551040
;2011-04-21 12:34;0;1;"@RepPaulRyan booed by own constituents for denying that Medicare is more important than tax breaks for top 1% http://youtu.be/h5kgnE1Xvec";;@RepPaulRyan;;"61120537530867715";https://twitter.com/RepJimMcDermott/status/61120537530867715
;2011-04-21 09:41;0;0;". @DeptofDefense providing live feed of report from US & DE military officers in Afghanistan. They are fielding press Q's http://j.mp/hDo3Pw";;@DeptofDefense;;"61077146893950976";https://twitter.com/RepJimMcDermott/status/61077146893950976
;2011-04-20 13:49;2;0;"Great page. "The Best Writing on the BP Oil Spill" via @treehugger http://j.mp/ewrtpy";;@treehugger;;"60777137073958912";https://twitter.com/RepJimMcDermott/status/60777137073958912
;2011-04-20 11:21;5;0;"Another poll, this one from Washington Post, showing Americans are decisively opposed to GOP plan to cut Medicare. http://twitpic.com/4n8r6u";;;;"60739781491040257";https://twitter.com/RepJimMcDermott/status/60739781491040257
;2011-04-20 00:09;0;0;"Must Read: @latimes article on broken corporate tax system by @jimpuzzanghera : http:// lat.ms/dSmAYb .";;@latimes @jimpuzzanghera;;"60570842517614593";https://twitter.com/RepJimMcDermott/status/60570842517614593
;2011-04-19 23:43;4;0;"SNEAK PREVIEW: "Something's wrong w/ the [corporate tax] system... And everyone knows that." In Wed.'s print of LA Times http:// lat.ms/dSmAYb";;;;"60564257401618433";https://twitter.com/RepJimMcDermott/status/60564257401618433
;2011-04-19 19:37;0;0;"@justindignation Why was Seattle's Spring terrible this year? We had fewest #of days over 55F http:// on.fb.me/gKdAnt Feel climate change? I do";;@justindignation;#of;"60502195732365312";https://twitter.com/RepJimMcDermott/status/60502195732365312
;2011-04-19 13:45;1;1;"RT @PPact NYT: attacks on Planned Parenthood are less about saving money, and more about pushing an extreme agenda http://ow.ly/4DBsN";;@PPact;;"60413709641719808";https://twitter.com/RepJimMcDermott/status/60413709641719808
;2011-04-19 13:24;8;2;"Republican plans to cut Medicare and give tax breaks to millionaires is literal antithesis of what Americans want. http://twitpic.com/4mw4i9";;;;"60408560550555648";https://twitter.com/RepJimMcDermott/status/60408560550555648
;2011-04-19 12:50;7;0;"While it's lost US media attention, the democratic revolution continues in the Middle East. Guardian's Live News Blog: http://j.mp/eG8xiG";;;;"60399913539878913";https://twitter.com/RepJimMcDermott/status/60399913539878913
;2011-04-18 20:11;1;0;"Will young'ins play politics w/ economy? “ @washingtonpost : As debt ceiling vote nears-pressure’s on Republican freshmen http:// wapo.st/fXEeZu ”";;@washingtonpost;;"60148541787619328";https://twitter.com/RepJimMcDermott/status/60148541787619328
;2011-04-18 19:22;10;0;"National gas price per/gallon: $3.84. While 1st quarter profits for oil companies up 41%. Absurd: big oil tax breaks continue, on tax day.";;;;"60136069940772866";https://twitter.com/RepJimMcDermott/status/60136069940772866
;2011-04-18 18:31;11;0;"Nuts to think tax breaks 4 oil companies still in place - on tax day, which this year is on the 1 year anniversary of start of BP oil spill";;;;"60123416421863424";https://twitter.com/RepJimMcDermott/status/60123416421863424
