username;date;retweets;favorites;text;geo;mentions;hashtags;id;permalink
;2012-03-26 10:41;6;0;"Big Oil says they *need* tax cuts http:// j.mp/GSkowU . Really, Big Oil needs more taxpayer $$$ when they made $137B in profits last year!?";;;;"184304109162209280";https://twitter.com/RepJimMcDermott/status/184304109162209280
;2012-03-22 10:39;6;0;"Fact #1: Today = 9th Anniversary of Iraq War's start. Fact #2: "Republican Budget Doesn't Even Say The Word 'Veteran'" http:// j.mp/GKO9dD";;;#1 #2;"182854083068174336";https://twitter.com/RepJimMcDermott/status/182854083068174336
;2012-03-20 18:34;8;0;"I believe that a budget is a statement of priorities, and today Republicans clearly revealed who/what they care about: http:// j.mp/GEnsMf";;;;"182248740860596225";https://twitter.com/RepJimMcDermott/status/182248740860596225
;2012-03-20 17:05;10;1;""Should the poor pay for deficit reduction?" http:// j.mp/GBggPs Absolutely not! I just wish House Republicans agreed. #p2";;;#p2;"182226417164095490";https://twitter.com/RepJimMcDermott/status/182226417164095490
;2012-03-20 13:01;14;1;"Another telling headline: "Republican Budget Adds Food Stamps, Welfare Cuts To Medicare-Slashing Plan" http:// j.mp/GBqQWF";;;;"182164945864097792";https://twitter.com/RepJimMcDermott/status/182164945864097792
;2012-03-20 12:03;25;1;"New Republican budget = Tax cuts for rich + big cuts to programs that help the poor + ending Medicare's promise http:// j.mp/GBggPs #p2";;;#p2;"182150396456865794";https://twitter.com/RepJimMcDermott/status/182150396456865794
;2012-03-20 11:59;108;16;"Curious about the details of the Republican's budget? All "savings come from the same source: programs for the poor." http:// j.mp/GBggPs";;;;"182149463945650178";https://twitter.com/RepJimMcDermott/status/182149463945650178
;2012-03-20 11:07;3;0;"The newly unveiled Republican budget, like last year's, would end Medicare, and its promise to seniors, as we know it http:// j.mp/GBnsaJ";;;;"182136283492126721";https://twitter.com/RepJimMcDermott/status/182136283492126721
;2012-03-16 14:07;8;1;"Should insurance cover birth control? In Arizona you might have to prove you're NOT using it to avoid pregnancy http:// j.mp/yLmtdL #insane";;;#insane;"180732025521717248";https://twitter.com/RepJimMcDermott/status/180732025521717248
;2012-03-15 11:51;8;0;"Finally, 1 House Republican supports the millionaires tax! http:// j.mp/w59VbJ Now we just need to get the other 241 House Rs on board. #p2";;;#p2;"180335402991886336";https://twitter.com/RepJimMcDermott/status/180335402991886336
;2012-03-13 13:34;1;0;"Looking forward to joining KUOW's The Conversation w/ Ross Reynolds at 12:20 pm today. Tune in if you can: http:// j.mp/z6P07g @KUOWconvo";;@KUOWconvo;;"179636549443518464";https://twitter.com/RepJimMcDermott/status/179636549443518464
;2012-03-13 10:56;8;0;"POLL: "Big Majority Wants Super PACs Banned" http:// j.mp/yOInlp . American people get it: unlimited corporate $$$ isn't good for democracy";;;;"179596753748766721";https://twitter.com/RepJimMcDermott/status/179596753748766721
;2012-03-02 10:47;4;1;"Sad to hear that my dear friend, Norm Dicks, is retiring. True statesman who has done so much for his constituents and Washington state.";;;;"175623359005069312";https://twitter.com/RepJimMcDermott/status/175623359005069312
;2012-03-01 17:40;13;1;"Im all for debating pressing issues of our time but Republican efforts to turn back the clocks on women’s reproductive rights is disgraceful";;;;"175365020539043840";https://twitter.com/RepJimMcDermott/status/175365020539043840
;2012-02-23 18:32;10;2;"GREAT NEWS: Maryland Senate Passes Marriage Equality Bill -- http:// bit.ly/wVoIuH";;;;"172841278856380416";https://twitter.com/RepJimMcDermott/status/172841278856380416
;2012-02-17 11:42;32;4;"Noted: Residents of 10 "most conservative" states receive more income from fed govt than 10 "most liberal" states http:// j.mp/yR091w #p2";;;#p2;"170563788720971777";https://twitter.com/RepJimMcDermott/status/170563788720971777
;2012-02-16 18:40;17;0;"I honestly wish NJ Gov. Chris Christie had the guts to do the right thing and legalize gay marriage in his state: http:// j.mp/wbpXdp #p2";;;#p2;"170306475091165184";https://twitter.com/RepJimMcDermott/status/170306475091165184
;2012-02-16 18:08;4;0;"NJ Assembly follows WA state's footsteps, passing gay marriage bill. Wish NJ Governor would stand up for equality http:// j.mp/wbpXdp #lgbt";;;#lgbt;"170298642685640704";https://twitter.com/RepJimMcDermott/status/170298642685640704
;2012-02-15 13:31;17;1;"FACT: Top 5 oil companies made a record-high $137 billion in profits in 2011. QUESTION: Why won't Republicans end tax breaks for Big Oil?";;;;"169866491443945474";https://twitter.com/RepJimMcDermott/status/169866491443945474
;2012-02-15 11:39;9;1;"If Republicans just stuck to roads, bridges & mass transit, they wouldnt have such a hard time passing the Highway Bill http:// j.mp/y8lgfs";;;;"169838305909817345";https://twitter.com/RepJimMcDermott/status/169838305909817345
;2012-02-13 15:42;18;1;"It’s official! Marriage equality is now a reality in Washington state. http:// j.mp/yIU2J3 #gaymarriage #lgbt #equality";;;#gaymarriage #lgbt #equality;"169174551824052224";https://twitter.com/RepJimMcDermott/status/169174551824052224
;2012-02-06 15:18;6;0;"GOOD NEWS: Starbucks Endorses Same-Sex Marriage In Washington State http:// j.mp/zqCgAs #lgbt #equality";;;#lgbt #equality;"166631821226934272";https://twitter.com/RepJimMcDermott/status/166631821226934272
;2012-02-03 10:42;12;2;"#Komen gives advice she herself should have heeded: "grants should be administered without controversies that hurt the cause of women."";;;#Komen;"165475193245011968";https://twitter.com/RepJimMcDermott/status/165475193245011968
;2012-02-03 10:33;2;0;"Pleased #Komen foundation reversed their decision - they'll now keep funding Planned Parenthood. Right thing to do! http:// j.mp/AlQSus";;;#Komen;"165472980804190208";https://twitter.com/RepJimMcDermott/status/165472980804190208
;2012-02-02 13:08;10;0;"House Republicans tell Fed Reserve to do LESS for jobs and housing: http:// j.mp/xmhNqH . Do Repubs care at all about struggling Americans?";;;;"165149639551614976";https://twitter.com/RepJimMcDermott/status/165149639551614976
;2012-02-02 12:44;5;0;"Lately, lots of crazy talk among Republicans about the poor -- apparently, they're doing just find. FACT: 50% of U.S. is poor or low-income.";;;;"165143637099954176";https://twitter.com/RepJimMcDermott/status/165143637099954176
;2012-02-01 23:00;42;2;"GREAT NEWS: Washington State Senate approves gay marriage bill: http:// j.mp/zTnGfa #lgbt #equality #p2";;;#lgbt #equality #p2;"164936288594690048";https://twitter.com/RepJimMcDermott/status/164936288594690048
;2012-02-01 18:14;12;0;"By cutting ties with Planned Parenthood, the Komen foundation is undermining their own goal of fighting breast cancer.";;;;"164864230036746240";https://twitter.com/RepJimMcDermott/status/164864230036746240
;2012-01-31 09:47;25;1;"CAUSE: Supreme Court's decision in Citizens United. EFFECT: "Outside ad spending up 1,600%" http:// j.mp/AivwPf #outrage #p2";;;#outrage #p2;"164374210343473152";https://twitter.com/RepJimMcDermott/status/164374210343473152
;2012-01-30 11:28;14;2;"If you're under the illusion that Citizens United hasn't drastically damaged our election process, it has: http:// j.mp/yXZe8c";;;;"164037399490473984";https://twitter.com/RepJimMcDermott/status/164037399490473984
;2012-01-26 16:00;23;1;"Congrats to my friend Barney Frank. If he marries before retiring, he'll be first congressman in a same sex marriage http:// j.mp/zxtBy8";;;;"162656215938248704";https://twitter.com/RepJimMcDermott/status/162656215938248704
;2012-01-25 11:29;4;0;"A (non-energy efficient) light bulb went off in House Republicans heads. Now theyre upset about their do-nothing agenda http:// j.mp/Af0wfT";;;;"162225506991869952";https://twitter.com/RepJimMcDermott/status/162225506991869952
;2012-01-18 17:21;70;12;"Its time to wash our hands clean of #SOPA . We need to do something about online piracy, but SOPA isn't the right approach.";;;#SOPA;"159777527248863232";https://twitter.com/RepJimMcDermott/status/159777527248863232
;2011-12-20 08:45;9;1;"Headline: "Has Speaker John Boehner lost control?" http:// j.mp/sQ5OAT Answer: Yes.";;;;"149138442138288130";https://twitter.com/RepJimMcDermott/status/149138442138288130
;2011-12-19 20:15;16;2;"The Do-Nothing Republican Congress just said the House is doing nothing tonight. They're going to wait til tomorrow to stick it to the 99%.";;;;"148949591881039872";https://twitter.com/RepJimMcDermott/status/148949591881039872
;2011-12-16 14:59;0;0;""Pragmatic" is Webster dictionary's word of the year. No surprise: Republicans have refused to be pragmatic all year http:// politi.co/rOM8Ze";;;;"147783027131555841";https://twitter.com/RepJimMcDermott/status/147783027131555841
;2011-12-16 13:29;2;2;"My views on the end of military operations in Iraq, a conflict I opposed since its start that has cost 4,500 US lives: http:// ow.ly/81Zah";;;;"147760197220315136";https://twitter.com/RepJimMcDermott/status/147760197220315136
;2011-12-15 14:18;13;2;"This morning I spoke in defense of Americans' basic rights and in opposition to the #NDAA which threatens them. http:// youtu.be/iRKLstWVXCo";;;#NDAA;"147410260813021184";https://twitter.com/RepJimMcDermott/status/147410260813021184
;2011-12-14 11:15;22;2;"Health care reform at work: 2.5 million young adults have gained insurance coverage under the new law. http:// ow.ly/7Zmjd #hcworks";;;#hcworks;"147001755119517697";https://twitter.com/RepJimMcDermott/status/147001755119517697
;2011-12-13 16:42;13;1;"If Republicans pass their "UI extension" rather than extend the current law it will cut benefits to 62,000+ Washingtonians. #unacceptable";;;#unacceptable;"146721641907490817";https://twitter.com/RepJimMcDermott/status/146721641907490817
;2011-12-13 15:15;14;0;"1 in 45 American children are homeless. It is not the time to cut programs that help these kids just for meager savings http:// ow.ly/7YnXM";;;;"146699737473617920";https://twitter.com/RepJimMcDermott/status/146699737473617920
;2011-12-13 15:08;1;0;"Just spoke on the floor. I'm disappointed Republicans have resorted to feinting to help unemployed rather than stepping up & extending UI.";;;;"146698094376009729";https://twitter.com/RepJimMcDermott/status/146698094376009729
;2011-12-13 11:32;3;0;"Southwest's $19 billion Boeing order ensures the Seattle area will have good, union jobs today and in the future. http:// ow.ly/7Y6OB";;;;"146643548584951808";https://twitter.com/RepJimMcDermott/status/146643548584951808
;2011-12-13 11:20;6;0;"Good news for the Seattle-area economy. Southwest has placed a record $19 billion order with Boeing. http:// ow.ly/7Y57A";;;;"146640543374516224";https://twitter.com/RepJimMcDermott/status/146640543374516224
;2011-12-09 15:59;5;1;"Republicans have waited til 11th hour to do just about anything. Before year's end extend the state sales tax deduction http:// j.mp/ue8aiC";;;;"145261404977500160";https://twitter.com/RepJimMcDermott/status/145261404977500160
;2011-12-08 17:23;27;2;"The Do Nothing Republican Congress focused on "farm dust" today. Not JOBS, "farm dust" which the EPA doesn't even have plans to regulate.";;;;"144920111382405120";https://twitter.com/RepJimMcDermott/status/144920111382405120
;2011-12-06 11:08;3;0;"Nick Hanauer, "An ordinary middle-class consumer is far more of a job creator than I ever have been or ever will be." http:// ow.ly/7QuA8";;;;"144100802984820736";https://twitter.com/RepJimMcDermott/status/144100802984820736
;2011-12-01 14:27;4;1;"Great Seattle-area news - the Boeing/Machinists deal should put $140 million into the local economy for the holidays http:// ow.ly/7LCq2";;;;"142339147779158017";https://twitter.com/RepJimMcDermott/status/142339147779158017
;2011-11-30 08:51;27;2;"Headline: "Republicans fear losing jobs message war." They're losing it b/c they don't want to create jobs and see Obama get the credit.";;;;"141892211636834305";https://twitter.com/RepJimMcDermott/status/141892211636834305
;2011-11-29 15:04;8;1;"Voters rep'ed by Tea Partiers are realizing the Tea Party are only interested in blocking solutions, not providing them http:// ow.ly/7J20Y";;;;"141623590704517120";https://twitter.com/RepJimMcDermott/status/141623590704517120
;2011-11-29 10:52;3;0;"Vice President Biden in Baghdad to mark the end of a war that we should have never started. #MomentsICanNeverForget";;;#MomentsICanNeverForget;"141560186556002304";https://twitter.com/RepJimMcDermott/status/141560186556002304
;2011-11-28 15:11;9;1;"With #WorldAIDSDay this week (Dec. 1), we launched the Congressional HIV/AIDS Caucus Facebook page. Please support us: http:// j.mp/vZU5RX";;;#WorldAIDSDay;"141263003210366976";https://twitter.com/RepJimMcDermott/status/141263003210366976
;2011-11-17 15:15;14;0;"Disappointing headline: "Republicans won’t allow savings from war drawdowns to go to jobs program" http:// j.mp/sriyRx #WeCantWait";;;#WeCantWait;"137277664435245056";https://twitter.com/RepJimMcDermott/status/137277664435245056
;2011-11-16 17:43;2;0;"Republicans have waited until the 11th hour to do anything this year. Hopefully they'll handle UI benefits differently http:// j.mp/w48gwG";;;;"136952592797417472";https://twitter.com/RepJimMcDermott/status/136952592797417472
;2011-11-14 10:14;7;1;"CAUSE: Congressional Republicans have decided to do nothing to help the economy/create jobs. EFFECT: Congress' approval rating = 11%.";;;;"136114765121593344";https://twitter.com/RepJimMcDermott/status/136114765121593344
;2011-11-09 13:43;14;2;"Must-read article: Republicans have their "foot on the neck of this country’s economy" http:// j.mp/t9EA3W #p2 #thingsyoushouldknow";;;#p2 #thingsyoushouldknow;"134355388479967233";https://twitter.com/RepJimMcDermott/status/134355388479967233
;2011-11-09 13:35;16;1;"I said what needed to be said: "Republicans are willing to sacrifice the health of our economy for political advantage” http:// j.mp/t9EA3W";;;;"134353547553812481";https://twitter.com/RepJimMcDermott/status/134353547553812481
;2011-11-08 13:46;6;0;"News Alert: "A conservative-leaning federal appeals court on Tuesday UPHELD the constitutionality of health care law" http:// j.mp/tGCStV";;;;"133993841563942913";https://twitter.com/RepJimMcDermott/status/133993841563942913
;2011-11-08 11:27;22;4;"If you still aren't on-board w/ taxing the rich, read this article: "23 Mind-Blowing Facts About Inequality In America" http:// j.mp/s5SuzK";;;;"133958730516672512";https://twitter.com/RepJimMcDermott/status/133958730516672512
;2011-11-07 15:11;15;3;"Sad, sad reality: "Republicans are blocking Obama’s good faith efforts to fix the economy for political reasons." http:// j.mp/rPMNRY";;;;"133652812407111680";https://twitter.com/RepJimMcDermott/status/133652812407111680
;2011-11-07 15:08;9;0;""Independents & moderates agree: Republicans deliberately sabotaging Obama jobs policies" http:// j.mp/rPMNRY #DoNothingRepublicanCongress";;;#DoNothingRepublicanCongress;"133651982023004160";https://twitter.com/RepJimMcDermott/status/133651982023004160
;2011-11-03 14:43;5;0;"Poll: "Are Republicans deliberately sabotaging the economy?" 49% of Florida says "yes" http:// j.mp/vek2lG . Sad fact w/ so many hurting #p2";;;#p2;"132181155444293633";https://twitter.com/RepJimMcDermott/status/132181155444293633
;2011-11-01 13:18;3;0;"In the wake of the Great Recession, @speakerboehner continues to urge the Super Committee to shred the social safety net....";;@speakerboehner;;"131435043313815554";https://twitter.com/RepJimMcDermott/status/131435043313815554
;2011-10-31 12:44;37;3;"If @SpeakerBoehner and Republicans really understand “people’s frustrations,” can we now start working on job creation? http:// j.mp/swbA3L";;@SpeakerBoehner;;"131063937235025920";https://twitter.com/RepJimMcDermott/status/131063937235025920
;2011-10-27 12:31;1;0;"MT @wegoted : @RepJimMcDermott joins the show next to discuss @RepPaulRyan's comments. Listen: http:// wegoted.com /";;@wegoted @RepJimMcDermott @RepPaulRyan;;"129611218246840320";https://twitter.com/RepJimMcDermott/status/129611218246840320
;2011-10-27 10:33;0;0;"RT @wegoted : Today on the Ed Schultz Show: @SgtShamarThomas , @RepJohnYarmuth , @RepJimMcDermott , and @Salon Reporter @elliottjustin .";;@wegoted @SgtShamarThomas @RepJohnYarmuth @RepJimMcDermott @Salon @elliottjustin;;"129581541536956417";https://twitter.com/RepJimMcDermott/status/129581541536956417
;2011-10-17 11:15;4;0;"Economies w/ equality grow faster. I believe we must return to an equitable system where the richest pay a fair share. http:// ow.ly/6Zyvu";;;;"125968077388124160";https://twitter.com/RepJimMcDermott/status/125968077388124160
;2011-10-17 10:30;31;3;"Deregulation doesn't lower costs, it just shifts them to workers and consumers in the form of deaths and injuries. http:// ow.ly/6ZxXM";;;;"125956752981241856";https://twitter.com/RepJimMcDermott/status/125956752981241856
;2011-10-17 10:00;9;1;"The US absolutely must invest in infrastructure if we want to remain competitive internationally. http:// ow.ly/6Zu5c";;;;"125949216722919426";https://twitter.com/RepJimMcDermott/status/125949216722919426
;2011-10-17 08:21;0;0;"@czech_mixx should be fixed.Thanks for the heads up.";;@czech_mixx;;"125924505347567616";https://twitter.com/RepJimMcDermott/status/125924505347567616
;2011-10-13 16:55;13;0;"Earlier today on the floor of the House, I made it clear: #HR358 is nothing more than an attack on poor women. http:// ow.ly/6WORa";;;#HR358;"124604316735635456";https://twitter.com/RepJimMcDermott/status/124604316735635456
;2011-10-13 12:10;3;0;"Replying to the claim that 47% don't pay taxes: it's a myth. http:// ow.ly/6WuKO Middle class pays a fair share. Millionaires need to also.";;;;"124532584729423872";https://twitter.com/RepJimMcDermott/status/124532584729423872
;2011-10-13 10:52;4;1;"25% of millionaires pay lower taxes than middle-class. It's time they contribute their fair share. From @ThinkProgress : http:// ow.ly/6WnS2";;@ThinkProgress;;"124512801032118272";https://twitter.com/RepJimMcDermott/status/124512801032118272
;2011-10-13 10:20;10;3;"Why do I oppose #HR358 ? For one, it could deny women access to care when their lives are in danger. From @naral http:// ow.ly/6Wkws";;@naral;#HR358;"124504755509805056";https://twitter.com/RepJimMcDermott/status/124504755509805056
;2011-10-13 09:48;28;0;"I find it highly upsetting the GOP has decided to waste time launching ideological assaults on women's reproductive rights like #HR358 .";;;#HR358;"124496714773168128";https://twitter.com/RepJimMcDermott/status/124496714773168128
;2011-10-06 14:50;9;0;"If we represent Americans and 52% support a bill (39% oppose), shouldn't we be passing it instead of declaring it "dead?" #passthejobsbill";;;#passthejobsbill;"122035966897688576";https://twitter.com/RepJimMcDermott/status/122035966897688576
;2011-10-06 13:36;7;1;"'72-'08 avg US income grew $10k. All growth went to the top 10% while income for the bottom 90% shrank. Take a look: http://ow.ly/6PEUy";;;;"122017481689808896";https://twitter.com/RepJimMcDermott/status/122017481689808896
;2011-10-05 21:31;2;0;"I'm hosting a live video town hall right now and we're using an iPad 2. Join the discussion: http:// j.mp/p3ssC4 #thankyousteve";;;#thankyousteve;"121774448280997888";https://twitter.com/RepJimMcDermott/status/121774448280997888
;2011-10-05 21:24;5;0;"Got a question for a Congressman. I am answering questions right now, through a live streaming broadcast: http:// j.mp/p3ssC4 .";;;;"121772727710388224";https://twitter.com/RepJimMcDermott/status/121772727710388224
;2011-10-05 21:05;2;0;"Started online town hall. Tune in here and ask a question: http:// j.mp/p3ssC4 . #p2";;;#p2;"121768071584153600";https://twitter.com/RepJimMcDermott/status/121768071584153600
;2011-10-05 11:27;2;0;"Do you know how many slaves work for you? This is why the anti-conflict minerals provisions in Dodd-Frank are crucial. http://ow.ly/6Olq7";;;;"121622567210590208";https://twitter.com/RepJimMcDermott/status/121622567210590208
;2011-10-05 11:08;0;0;"Tonight, I'm holding a video town hall. Got questions? Submit them here on my Facebook page and I will answer them: http:// j.mp/qjL2Fe #p2";;;#p2;"121617866498899968";https://twitter.com/RepJimMcDermott/status/121617866498899968
;2011-10-05 10:50;3;1;"We must always strive to move toward a more equitable society, not a divided one. This graph tells a troubling story. http:// ow.ly/i/iAau";;;;"121613123709972480";https://twitter.com/RepJimMcDermott/status/121613123709972480
;2011-10-05 10:23;10;0;"The top 1% of our country takes home 24% of the national income. We need to ask them to pay a fair share. http://ow.ly/6OfGP #fromthe99";;;#fromthe99;"121606517156884481";https://twitter.com/RepJimMcDermott/status/121606517156884481
;2011-10-04 12:23;8;1;""GOP have a problem. People are concerned about unemployment, GOP have nothing to offer them." That's a Reagan advisor. http://ow.ly/6NdRV";;;;"121274139381219328";https://twitter.com/RepJimMcDermott/status/121274139381219328
;2011-10-04 10:29;42;0;"I am disappointed Eric Cantor has decided to ignore the public & declare Obama job package "dead" with no consideration. http://ow.ly/6N4gL";;;;"121245592830750720";https://twitter.com/RepJimMcDermott/status/121245592830750720
;2011-10-03 12:50;6;1;"The #buffettrule could just as easily be going by the name "Reagan Rule" who also advocated for all to pay a fair share. http://ow.ly/6M2FY";;;#buffettrule;"120918637895876608";https://twitter.com/RepJimMcDermott/status/120918637895876608
;2011-09-30 10:52;7;0;"Wednesday (Oct 5) I'll be hosting an online town hall. Twitter is one of the ways to send in questions. Get the word out: http://ow.ly/6JIIi";;;;"119801702898614272";https://twitter.com/RepJimMcDermott/status/119801702898614272
;2011-09-29 11:28;11;1;"1-in-5 US kids live in poverty - 15.5 million kids. This report is evidence for why Congress should work to create jobs http:// j.mp/poARqg";;;;"119448366986964993";https://twitter.com/RepJimMcDermott/status/119448366986964993
;2011-09-29 08:51;108;12;"State-by-state is how we create a universal health care system. Mass. has it, Vermont passed it, & now Montana wants it http:// j.mp/rtzaHd";;;;"119408986058522624";https://twitter.com/RepJimMcDermott/status/119408986058522624
;2011-09-28 11:00;4;0;"Obama jobs plan helps Americans now & in long run. Gets teachers back to work immediately so next gen stays competitive. http://ow.ly/6HsDL";;;;"119079036868755456";https://twitter.com/RepJimMcDermott/status/119079036868755456
;2011-09-28 10:25;9;0;"Economists say Obama jobs plan will get Americans back to work and prevent a return to recession. Via @bloombergnews http://ow.ly/6Hp09";;@bloombergnews;;"119070125801472001";https://twitter.com/RepJimMcDermott/status/119070125801472001
;2011-09-28 09:54;35;2;"73% of Americans want millionaires to start contributing their fair share. #buffettrule http://ow.ly/6Hn7R";;;#buffettrule;"119062400438763520";https://twitter.com/RepJimMcDermott/status/119062400438763520
;2011-09-26 10:00;9;0;"GOP rep moves off party line, "don’t think it’s possible to fix this [debt] problem... without raising taxes." http://ow.ly/6EYY4 Admirable.";;;;"118339175132037121";https://twitter.com/RepJimMcDermott/status/118339175132037121
;2011-09-23 11:17;8;0;"Fact #1: Today's GOP hate EPA. Fact #2: Today's GOP forget that EPA was created GOP President in 1970 (EPA's history: http:// j.mp/mWN8v1 ).";;;#1 #2;"117271263700975616";https://twitter.com/RepJimMcDermott/status/117271263700975616
;2011-09-23 10:40;3;0;"On GOP claims of green support for their backward anti-EPA legislation, "it's either a lie or a mistake." http://ow.ly/6D03v #dirtyairweek";;;#dirtyairweek;"117261965524598784";https://twitter.com/RepJimMcDermott/status/117261965524598784
;2011-09-23 09:30;6;1;""Do the wealthy look to you like victims of class warfare?" Of course not. Via @nytimes http://ow.ly/6CUaB";;@nytimes;;"117244496491716609";https://twitter.com/RepJimMcDermott/status/117244496491716609
;2011-09-22 13:19;18;1;"Ridiculous we're wasting time on a GOP bill to roll back life-saving clean air rules supported by business. http://ow.ly/6C5WU #dirtyairweek";;;#dirtyairweek;"116939765005303809";https://twitter.com/RepJimMcDermott/status/116939765005303809
;2011-09-22 11:18;6;0;"I hope there are still enough adults in the room that we can pass legislation to help struggling, hard working Americans. http://ow.ly/6BWWW";;;;"116909270636838912";https://twitter.com/RepJimMcDermott/status/116909270636838912
;2011-09-22 10:43;6;0;"Wealthy Americans like Warren Buffet & Mark Cuban believe the financial elite must return to paying a fair share. http://ow.ly/6BTp8";;;;"116900332428201984";https://twitter.com/RepJimMcDermott/status/116900332428201984
;2011-09-21 17:05;24;2;"60 sec everyone should watch: progressive hero Elizabeth Warren on the social contract & fallacy of "class warfare." http://ow.ly/6BcdU #p2";;;#p2;"116634087476834304";https://twitter.com/RepJimMcDermott/status/116634087476834304
;2011-09-21 11:45;20;1;"Clear majority of Americans (65%) think #AmericanJobsAct will create new opportunities. Let's honor our commitment to them and #passthebill .";;;#AmericanJobsAct #passthebill;"116553537655279616";https://twitter.com/RepJimMcDermott/status/116553537655279616
;2011-09-21 11:25;5;0;"The number of young people without health insurance has significantly declined. http://ow.ly/6AOEY Just more evidence that #hcrworks";;;#hcrworks;"116548532592312320";https://twitter.com/RepJimMcDermott/status/116548532592312320
;2011-09-21 08:16;8;0;"Good morning read: "Republicans' Latest Ploy to Keep the Economy Lousy through Election Day" ( http:// j.mp/oyM0rf ) by Robert Reich @RBReich";;@RBReich;;"116500954215481344";https://twitter.com/RepJimMcDermott/status/116500954215481344
