username;date;retweets;favorites;text;geo;mentions;hashtags;id;permalink
;2016-11-17 12:23;6;9;"New study by @ZackCooperYale finds 1/5 hurt by surprise ER bills. My End Surprise Billing Act would help patients. http://www. nytimes.com/2016/11/17/ups hot/first-comes-the-emergency-then-comes-the-surprise-out-of-network-bill.html … ?";;@ZackCooperYale;;"799316946806247424";https://twitter.com/RepLloydDoggett/status/799316946806247424
;2016-11-17 07:41;9;29;"Wear purple to #WageHope for everyone with pancreatic cancer. We must raise awareness, fund research, and find a cure. #WPCD pic.twitter.com/60COsevIDq";;;#WageHope #WPCD;"799246195440963584";https://twitter.com/RepLloydDoggett/status/799246195440963584
;2016-11-16 18:20;5;14;"Too many must choose between economic and physical wellbeing. We need drug pricing reform now. Via @kprcbillspencer http://www. click2houston.com/news/as-prescr iption-drug-prices-soar-many-are-left-wondering-how-to-afford-medication …";;@kprcbillspencer;;"799044613222912000";https://twitter.com/RepLloydDoggett/status/799044613222912000
;2016-11-16 18:00;4;5;"What stops @Boeing from flying higher? Hawks risking war with Iran. https:// youtu.be/Mquj-232dGY";;@Boeing;;"799039388760084480";https://twitter.com/RepLloydDoggett/status/799039388760084480
;2016-11-16 17:30;0;11;"Met with leaders from across San Antonio’s Eastside Promise Neighborhood today, from cradle to career -- serving our community. pic.twitter.com/O6KgJYtk6M";;;;"799031828019560448";https://twitter.com/RepLloydDoggett/status/799031828019560448
;2016-11-15 15:13;7;53;"Joined my friend Senator Elizabeth Warren today at the Capitol to discuss our path forward. pic.twitter.com/hruvaxpHc0";;;;"798635109280870400";https://twitter.com/RepLloydDoggett/status/798635109280870400
;2016-11-15 14:20;3;10;"Thank you @AlanWarrickII for bringing Rockstar Eastside Dreamers Academy students to my DC office. pic.twitter.com/YoY2ZNwsK1";;@AlanWarrickII;;"798621701592346624";https://twitter.com/RepLloydDoggett/status/798621701592346624
;2016-11-15 13:32;2;13;"So appreciative to @AustinChronicle readers for once again naming me to the “Best of Austin” List. http://www. austinchronicle.com/best-of-austin /year:2016/poll:readers/category:politics-and-media/lloyd-doggett-best-state-official/ …";;@AustinChronicle;;"798609613193170945";https://twitter.com/RepLloydDoggett/status/798609613193170945
;2016-11-14 18:35;3;14;"Listened to some jazz music at the Dig That Jazz on the Hill Festival, organized by Dee Smith and our friends from @dignowityhill pic.twitter.com/3OutPgexf8";;@dignowityhill;;"798323380315418624";https://twitter.com/RepLloydDoggett/status/798323380315418624
;2016-11-14 17:18;3;9;"Visited with vets at Councilman Roberto Trevino’s Veterans Luncheon held at VFW Post 76, the oldest VFW in Texas. pic.twitter.com/J50uJm0ftv";;;;"798304229513302017";https://twitter.com/RepLloydDoggett/status/798304229513302017
;2016-11-14 12:45;19;39;"pic.twitter.com/cZh31UHMoh";;;;"798235310630895616";https://twitter.com/RepLloydDoggett/status/798235310630895616
;2016-11-12 16:46;5;17;"Continued the tradition of riding w/ Army vet Maj. Val Martinez for SA's Veterans Parade, also joined by Janie Barrera, CEO of @LiftFundUS pic.twitter.com/It2TEj7RBT";;@LiftFundUS;;"797571194719444992";https://twitter.com/RepLloydDoggett/status/797571194719444992
;2016-11-11 15:13;2;11;"Honoring our veterans and their families for their sacrifice today, and every day. http:// mysanantonio.com/opinion/editor ials/article/Honor-our-veterans-today-and-every-day-10607217.php …";;;;"797185402452975616";https://twitter.com/RepLloydDoggett/status/797185402452975616
;2016-11-11 08:56;0;5;"Today, we stand united in thanking our veterans and their families. http://www. mystatesman.com/news/news/opin ion/rivas-rodriguez-remembering-my-fathers-stories-of-/ns6S3/ …";;;;"797090682661928961";https://twitter.com/RepLloydDoggett/status/797090682661928961
;2016-11-09 13:46;4;13;". @BarackObama "the peaceful transition of power is one of the hallmarks of our democracy,"";;@BarackObama;;"796438711252746249";https://twitter.com/RepLloydDoggett/status/796438711252746249
;2016-11-09 11:41;6;11;"pic.twitter.com/vSZfw0OmXJ";;;;"796407485716459522";https://twitter.com/RepLloydDoggett/status/796407485716459522
;2016-11-08 10:03;2;13;"Celebrated the Grand Opening of America Green Solar company on the Eastside. Great to visit w/ Sharron Brown pic.twitter.com/SDecnshcS9";;;;"796020227310047232";https://twitter.com/RepLloydDoggett/status/796020227310047232
;2016-11-08 09:22;0;1;"Thanks DeMonte!";;;;"796010045922283522";https://twitter.com/RepLloydDoggett/status/796010045922283522
;2016-11-07 10:16;1;9;"“A Healthy Taste of the Eastside” showed how tasty healthy eating can be. Tried delicious recipes from Eastside residents & community groups pic.twitter.com/M3S4njO232";;;;"795661331512918017";https://twitter.com/RepLloydDoggett/status/795661331512918017
;2016-11-05 16:01;1;7;"Gathered at Roosevelt Park w/ @BuildSAGreen for Solar Fest. Great to see neighbors & companies together to promote SA as a resilient city. pic.twitter.com/wo5aF5Hxqk";;@BuildSAGreen;;"795008078798352384";https://twitter.com/RepLloydDoggett/status/795008078798352384
;2016-11-05 15:58;1;4;"President Erdogan continues to undermine democracy & #HumanRights in #Turkey w/ arrest of Kurdish leaders. http://www. nytimes.com/2016/11/05/wor ld/europe/turkey-coup-crackdown-kurdish-politicians.html?_r=0 …";;;#HumanRights #Turkey;"795007473509957632";https://twitter.com/RepLloydDoggett/status/795007473509957632
;2016-11-05 11:53;7;16;"Had the chance to meet w @dianeguerrero__ and discuss her tireless advocacy for comprehensive immigration reform pic.twitter.com/OWZ1S6K0Hm";;@dianeguerrero__;;"794945801613180928";https://twitter.com/RepLloydDoggett/status/794945801613180928
;2016-11-04 15:24;2;7;"Historic & ambitious #ParisAgreement becomes law today. While only 1st step, it shows global will to #ActOnClimate . http:// abcnews.go.com/Technology/wir eStory/paris-climate-agreement-international-law-43293709 …";;;#ParisAgreement #ActOnClimate;"794636479750356992";https://twitter.com/RepLloydDoggett/status/794636479750356992
;2016-11-04 13:40;11;9;"Many constituents tell me of struggles to afford insulin as prices soar by 400%. This price gouging can't continue. http://www. nbcnews.com/business/consu mer/insulin-new-epipen-families-facing-sticker-shock-over-400-percent-n667536 …";;;;"794610338440298496";https://twitter.com/RepLloydDoggett/status/794610338440298496
;2016-11-04 11:28;0;3;"Excited to see the opportunities that arise out of the work the Eastside Education and Training Center is doing. http:// therivardreport.com/eastside-educa tion-and-training-center-promises-workforce-development/ …";;;;"794577014288187392";https://twitter.com/RepLloydDoggett/status/794577014288187392
;2016-11-04 09:49;3;8;"Medicare listened to legislators & Alz community, & will now help cover care plans for those w/ Alzheimer’s #EndAlz http:// alz.org/documents_cust om/cms_release_110316.pdf …";;;#EndAlz;"794552144309452800";https://twitter.com/RepLloydDoggett/status/794552144309452800
;2016-11-03 17:02;7;12;". @Chobani CEO, an immigrant employing refugees, knows that helping those in need makes us stronger: http://www. nytimes.com/2016/11/01/bus iness/for-helping-immigrants-chobanis-founder-draws-threats.html …";;@Chobani;;"794298609286070272";https://twitter.com/RepLloydDoggett/status/794298609286070272
;2016-11-03 15:18;0;2;"Excited to welcome the Eastside Dreamers Academy to Washington DC http:// therivardreport.com/eastside-dream ers-councilman-warrick-head-to-washington-d-c/ …";;;;"794272466956906496";https://twitter.com/RepLloydDoggett/status/794272466956906496
;2016-11-03 13:03;2;1;"Deaths caused by cigarettes are as preventable as they are tragic. New data shows 28.6% of cancer deaths due to cigs http://www. nytimes.com/2016/11/01/hea lth/smoking-deaths-cancer.html?_r=0 …";;;;"794238574107443204";https://twitter.com/RepLloydDoggett/status/794238574107443204
;2016-11-03 11:22;2;3;". @Pontifex creates new Beatitude, blesses those who protect "our common home" & planet. This truth binds us all. http://www. wsj.com/articles/popes -beatitudes-highlight-care-for-environment-and-outsiders-1477998680 …";;@Pontifex;;"794213203903467520";https://twitter.com/RepLloydDoggett/status/794213203903467520
;2016-11-03 10:07;1;3;"Alta Vista NA President Erin Zayko and I visited about sustainability & neighborhood issues. Great to see our NA leaders at community events pic.twitter.com/WuHqBj5AsT";;;;"794194391078412288";https://twitter.com/RepLloydDoggett/status/794194391078412288
;2016-11-03 08:22;2;6;"To ensure more affordable higher ed, I will continue to work to #ProtectPell http:// democrats-edworkforce.house.gov/media/press-re leases/more-than-100-house-democrats-push-to-protect-pell-grant-funding …";;;#ProtectPell;"794167841427718145";https://twitter.com/RepLloydDoggett/status/794167841427718145
;2016-11-02 16:26;7;29;"Current events may leave us feeling run up a tree, this constituent just rescued outside my SA office. First cat in Doggett office. pic.twitter.com/0edaM29WFR";;;;"793927337117122560";https://twitter.com/RepLloydDoggett/status/793927337117122560
;2016-11-02 15:30;0;7;"Joined @AlamoColleges1 , @SAISD , and @COSAGov for the grand opening of the EETC, which will provide pathways to quality jobs pic.twitter.com/xbLH9tXnSf";;@AlamoColleges1 @SAISD @COSAGov;;"793913131324043268";https://twitter.com/RepLloydDoggett/status/793913131324043268
;2016-11-02 14:19;4;3;"Presented @SATomorrow2040 sustainability awards at the @COSAGOV Sustainability Summit w/ @BuildSAGreen Executive Director Anita Ledbetter. pic.twitter.com/6xnn4WHfNu";;@SATomorrow2040 @COSAGOV @BuildSAGreen;;"793895309848014849";https://twitter.com/RepLloydDoggett/status/793895309848014849
;2016-11-02 12:56;2;14;"Celebrated Dia de los Muertos w/ @EsperanzaCtr with Executive Director Graciela Sanchez and her parents, Isabel and Enrique. pic.twitter.com/kRjP1sxNYL";;@EsperanzaCtr;;"793874360943644672";https://twitter.com/RepLloydDoggett/status/793874360943644672
;2016-11-01 14:55;14;10;"Our alleged ally, Saudi Arabia, continues war crimes in Yemen. We should not tolerate its human rights abuses http://www. wsj.com/articles/saudi -led-military-airstrikes-kill-at-least-60-in-yemen-1477833192?elqTrackId=65f7370cf68749c693b2863bf5792036&elq=b3cbf95769764d69b7efa3937e21a75b&elqaid=23072&elqat=1&elqCampaignId=14115 …";;;;"793542040051212292";https://twitter.com/RepLloydDoggett/status/793542040051212292
;2016-11-01 13:15;1;3;"Great speaking w/ Ret. Col. Bennie Blansett of the Alamo Chptr of Disabled Veterans & VFW Post 9186 CDR Robert Otto abt issues facing Vets pic.twitter.com/T7SmgRgo6Y";;;;"793516716420689920";https://twitter.com/RepLloydDoggett/status/793516716420689920
;2016-11-01 11:05;1;2;"Visiting w/ Pat Boone of West End Hope in Action at my San Antonio Office, great to catch up on the work they are doing for neighbors. pic.twitter.com/UrZyVyFRI4";;;;"793484114972315648";https://twitter.com/RepLloydDoggett/status/793484114972315648
;2016-10-31 15:34;2;3;"Thanks to servicemembers, veterans, and their families whose sacrifice keeps our democracy secure. http:// laprensasa.com/news/editorial s/honoring-our-veterans/ …";;;;"793189506262466560";https://twitter.com/RepLloydDoggett/status/793189506262466560
;2016-10-31 11:50;0;2;"Joined @NAACPSABranch to honor community leaders at the Freedom Fund Dinner. Great to visit w/ award recipient Rev. Amerson of St. Paul UMC pic.twitter.com/Se4PXdge1G";;@NAACPSABranch;;"793133158346661889";https://twitter.com/RepLloydDoggett/status/793133158346661889
;2016-10-31 09:11;8;19;"Wearing Pink today in support of @ACSSanAntonio Real Men Wear Pink campaign, for all families touched by breast cancer. #RealMenWearPink pic.twitter.com/gcZ7iiC94i";;@ACSSanAntonio;#RealMenWearPink;"793092968517361664";https://twitter.com/RepLloydDoggett/status/793092968517361664
;2016-10-28 08:42;7;17;"Mini-concert in our SA office w/talented members of The Recording Academy TX chapter. Pleased to stand with those who write/produce music pic.twitter.com/YZCL82QqEw";;;;"791998452284653568";https://twitter.com/RepLloydDoggett/status/791998452284653568
;2016-10-27 15:13;4;5;"I urged the USDA to end the brutal practice known as horse soring #animalrights https://www. avma.org/KB/Resources/R eference/AnimalWelfare/Pages/soring-horses.aspx …";;;#animalrights;"791734470265167872";https://twitter.com/RepLloydDoggett/status/791734470265167872
;2016-10-27 13:18;1;4;"Joined the family of the late Dr. Robert L.M. Hilliard’ to break ground on University Health System's Dr. Robert L.M. Hilliard Center. pic.twitter.com/Ba7S2fN72I";;;;"791705592977035264";https://twitter.com/RepLloydDoggett/status/791705592977035264
;2016-10-26 12:11;2;2;". @WashMonthly cover story by @aliciamundy on my efforts to lower prescription drug prices http:// washingtonmonthly.com/magazine/novem berdecember-2016/just-the-medicine/ …";;@WashMonthly @aliciamundy;;"791326439308087296";https://twitter.com/RepLloydDoggett/status/791326439308087296
;2016-10-26 09:57;5;7;"Check out http://www. HealthCare.gov now to look at options for 2017 health care coverage. Open enrollment in the Marketplace starts on Nov. 1";;;;"791292575705665536";https://twitter.com/RepLloydDoggett/status/791292575705665536
;2016-10-25 17:12;2;4;"Green power installations beat fossil fuels worldwide for 1st time in 2015, finds @IEA . Let’s build on progress http://www. bloomberg.com/news/articles/ 2016-10-25/record-green-power-installations-beat-fossil-fuel-for-first-time …";;@IEA;;"791039762983448576";https://twitter.com/RepLloydDoggett/status/791039762983448576
;2016-10-25 15:08;3;14;"Congrats to @lasahighschool 's Josephine Icaro for receiving the 2016 Outstanding Teaching of the Humanities Award! pic.twitter.com/rkuweSdICr";;@lasahighschool;;"791008520930004992";https://twitter.com/RepLloydDoggett/status/791008520930004992
;2016-10-25 13:29;3;2;". @BrookingsInst is right. Early FAFSA filing for students is a “big deal” https://www. brookings.edu/blog/brown-cen ter-chalkboard/2016/10/20/the-gift-of-time-the-opportunity-and-benefit-of-early-fafsa-filing/ …";;@BrookingsInst;;"790983663265673216";https://twitter.com/RepLloydDoggett/status/790983663265673216
;2016-10-25 10:27;0;7;"Happy birthday to Tino Duran, who provided outstanding leadership at La Prensa for many years pic.twitter.com/zpFQvL1e6o";;;;"790937802712158208";https://twitter.com/RepLloydDoggett/status/790937802712158208
;2016-10-24 15:01;0;3;"SAISD Board President @PattiRadle raises 2 important measures to help support our students. http://www. mysanantonio.com/opinion/commen tary/article/Business-support-for-SAISD-speaks-volumes-9999792.php …";;@PattiRadle;;"790644356051066880";https://twitter.com/RepLloydDoggett/status/790644356051066880
;2016-10-24 13:33;3;16;"Libby & I joined @Mexic_Arte Executive Director Sylvia Orozco & Becky Beaver for Dia De Los Muertos themed Catrina Ball. pic.twitter.com/CjEKU63MMO";;@Mexic_Arte;;"790622303847641088";https://twitter.com/RepLloydDoggett/status/790622303847641088
;2016-10-24 13:17;1;6;"Met with SA native & Texas A&M student Alexander Rodriguez to discuss @AmnestyTamu initiatives & our refugee resettlement process. pic.twitter.com/bqdKWDgFao";;@AmnestyTamu;;"790618216607453184";https://twitter.com/RepLloydDoggett/status/790618216607453184
;2016-10-20 12:38;4;9;"Discussed local efforts to conserve & regenerate our environment w/ Anita Ledbetter of @BuildSAGreen & Elizabeth Kertesz of @SA2030District pic.twitter.com/gxXqw6NX8q";;@BuildSAGreen @SA2030District;;"789158826113134592";https://twitter.com/RepLloydDoggett/status/789158826113134592
;2016-10-18 14:44;4;13;"Pleased to receive another “A” on this year’s @HumaneSociety Congressional Scorecard. How we treat animals reflects our humanity.";;@HumaneSociety;;"788465822436040704";https://twitter.com/RepLloydDoggett/status/788465822436040704
;2016-10-18 13:39;1;1;". @LizaGoitein notes secret laws’ costs e.g., impaired accountability and weakened checks & balances system. http://www. nytimes.com/2016/10/18/opi nion/the-governments-addiction-to-secret-law.html …";;@LizaGoitein;;"788449406970363905";https://twitter.com/RepLloydDoggett/status/788449406970363905
;2016-10-17 16:29;0;1;"Enjoyed visiting with Carlos Gonzalez, Herlinda Sifuentes, and Roberto Sifuentes at Academia America’s Dia de la Raza Celebration. pic.twitter.com/XvaN73zYY7";;;;"788129949853057024";https://twitter.com/RepLloydDoggett/status/788129949853057024
;2016-10-17 14:32;0;5;"Productive meeting following the successful Founders Day Parade w/Kyle City Manager & City Council discussing transportation issues & growth pic.twitter.com/1PntgTvbCi";;;;"788100266637701120";https://twitter.com/RepLloydDoggett/status/788100266637701120
;2016-10-17 13:03;2;7;"Tremendous outpouring of support for Choco Meza’s family as we celebrated her lifelong commitment to public service. http://www. expressnews.com/news/news_colu mnists/elaine_ayala/article/Choco-Meza-a-knack-for-getting-people-to-move-9974911.php … pic.twitter.com/ekkVqVXzl9";;;;"788077874892988417";https://twitter.com/RepLloydDoggett/status/788077874892988417
;2016-10-17 10:39;2;11;"I joined Paul Scott and the hardworking staff of @asaustin at the annual #AIDSWalkATX . We lift our feet to lift their hearts. pic.twitter.com/yFR0ie7P4i";;@asaustin;#AIDSWalkATX;"788041839538561025";https://twitter.com/RepLloydDoggett/status/788041839538561025
;2016-10-17 10:33;2;3;"Historic #HFCphasedown agreement shows global will for climate action. Still more to do, but this accord goes far. http:// nyti.ms/2e5mNtn";;;#HFCphasedown;"788040119836082176";https://twitter.com/RepLloydDoggett/status/788040119836082176
;2016-10-16 10:33;2;10;"100 years of empowering women to make their own healthcare decisions. @PPFA is #100YearsStrong";;@PPFA;#100YearsStrong;"787677823993544704";https://twitter.com/RepLloydDoggett/status/787677823993544704
;2016-10-14 16:47;1;4;"Joined @JMurguia_NCLR @EddieforTexas , @SaldanaAISD6 & many other friends for the Nat’l Council of La Raza Texas Community Reception. pic.twitter.com/4ZvmUsrVYY";;@JMurguia_NCLR @EddieforTexas @SaldanaAISD6;;"787047210471002112";https://twitter.com/RepLloydDoggett/status/787047210471002112
;2016-10-14 13:56;1;9;"Celebrated opening of East Meadows with SAHA, @SecretaryCastro , @Judge_wolff , @HUD_PHI, @COSAGOV leaders, and many more pic.twitter.com/8OtDWWphhK";;@SecretaryCastro @Judge_wolff @HUD_PHI @COSAGOV;;"787004289818517505";https://twitter.com/RepLloydDoggett/status/787004289818517505
;2016-10-14 12:54;2;2;"What Saudi attacks on civilians w/ American weapons & support really means for the families caught in the crosshairs http://www. nytimes.com/2016/10/12/wor ld/middleeast/yemen-children-in-a-war-zone.html …";;;;"786988528169345024";https://twitter.com/RepLloydDoggett/status/786988528169345024
;2016-10-14 09:33;0;5;"Read this story of the human cost of what Bush/Cheney claimed was not torture & how it tortures our American values http://www. nytimes.com/2016/10/12/wor ld/cia-torture-abuses-detainee.html …";;;;"786937986785083392";https://twitter.com/RepLloydDoggett/status/786937986785083392
;2016-10-14 05:57;1;6;"Well-deserved prize #BobDylan for "having created new poetic expressions within the great American song tradition." http://www. nytimes.com/2016/10/14/art s/music/bob-dylan-nobel-prize-literature.html?hp&action=click&pgtype=Homepage&clickSource=story-heading&module=photo-spot-region&region=top-news&WT.nav=top-news …";;;#BobDylan;"786883702106324992";https://twitter.com/RepLloydDoggett/status/786883702106324992
;2016-10-13 15:29;1;17;"Great evening coming together with friends to celebrate & commemorate the great Henry B. Gonzalez at his alma matter – @StMarys_Law . pic.twitter.com/6byERJbvdT";;@StMarys_Law;;"786665213512785920";https://twitter.com/RepLloydDoggett/status/786665213512785920
;2016-10-13 13:41;0;5;"Celebrating Dia de la Raza sponsored by the United East Austin Coalition and the Friends of the @MACC_Austin pic.twitter.com/asvtBe5cCF";;@MACC_Austin;;"786638112407576576";https://twitter.com/RepLloydDoggett/status/786638112407576576
;2016-10-13 09:11;8;14;"Consumers shouldn’t be caught in the middle between providers and plans when they need emergency healthcare. https:// twitter.com/ConsumersUnion /status/786563336422895617 …";;;;"786570022089031680";https://twitter.com/RepLloydDoggett/status/786570022089031680
;2016-10-12 15:44;2;9;"Joined @SALighthousePR , @bestdogsinsight , & @VIA_transit to celebrate #WhiteCaneDay and accessibility for the blind and vision impaired. pic.twitter.com/kfkVfV7GMj";;@SALighthousePR @bestdogsinsight @VIA_transit;#WhiteCaneDay;"786306517653827584";https://twitter.com/RepLloydDoggett/status/786306517653827584
;2016-10-12 14:59;1;8;"Great to see @Ah20texas recognized by the San Antonio @LWVTexas for her work as a champion of water conservation. pic.twitter.com/1jYxAutspa";;@Ah20texas @LWVTexas;;"786295191980224512";https://twitter.com/RepLloydDoggett/status/786295191980224512
;2016-10-12 11:00;2;3;". @EIAgov finds lowest carbon emissions in 25 yrs through first 6 months of 2016, a positive trend we must build on http://www. eia.gov/todayinenergy/ detail.php?id=28312 …";;@EIAgov;;"786235114099322880";https://twitter.com/RepLloydDoggett/status/786235114099322880
;2016-10-11 16:08;1;5;"Celebrated San Antonio's commitment to sustainability with @ChooseSA @SXSWEco pic.twitter.com/eIDoRUdpvc";;@ChooseSA @SXSWEco;;"785950206885961728";https://twitter.com/RepLloydDoggett/status/785950206885961728
;2016-10-11 13:25;4;11;"Visited with Allison Hu and @Nicolashes , Directors of Public Space East project, @SXSWEco pic.twitter.com/2hAQKX9r9l";;@Nicolashes @SXSWEco;;"785909183459700736";https://twitter.com/RepLloydDoggett/status/785909183459700736
;2016-10-09 17:40;6;18;"Unexpected loss of Choco Meza, who worked tirelessly for SA & the USA. My thoughts are with her family and friends. http:// outinsa.com/sa-democratic- stalwart-and-ally-choco-gonzalez-meza-has-died/ …";;;;"785248595255578625";https://twitter.com/RepLloydDoggett/status/785248595255578625
;2016-10-07 14:58;3;13;"Inspiring meeting soccer star @abbywambach , who spoke on fight for pay equality & importance of women in leadership. pic.twitter.com/kWTTAzPi0d";;@abbywambach;;"784483113464426496";https://twitter.com/RepLloydDoggett/status/784483113464426496
;2016-10-07 11:21;0;1;"Spoke with @KXAN_News about the need for FAA to heed life-saving advice on balloon safety regs. pic.twitter.com/QEWXFNTKfI";;@KXAN_News;;"784428422839824385";https://twitter.com/RepLloydDoggett/status/784428422839824385
;2016-10-07 09:05;2;2;"Well-deserved commendation for @JuanManSantos Let's hope he can find a way forward to a successful peace http://www. nytimes.com/2016/10/08/wor ld/americas/nobel-peace-prize-juan-manuel-santos-colombia.html?_r=0 …";;@JuanManSantos;;"784394188456615936";https://twitter.com/RepLloydDoggett/status/784394188456615936
;2016-10-06 17:02;2;3;"Read @JinATX article on the need for the FAA to act on NTSB's recommendations for hot air balloon safety. http://www. mystatesman.com/news/news/loca l-govt-politics/faa-passes-on-doggetts-request-for-more-hot-air-ba/nsmYq/ …";;@JinATX;;"784151817210957824";https://twitter.com/RepLloydDoggett/status/784151817210957824
;2016-10-06 15:03;1;9;"Joined friends and supporters of @SAFEatx for their annual celebration. They currently provide a vital resource to the #ATX community. pic.twitter.com/YXBxNNGuTn";;@SAFEatx;#ATX;"784121915308969984";https://twitter.com/RepLloydDoggett/status/784121915308969984
;2016-10-06 13:55;2;2;"@glennwsmith writes on real damage from cynical scapegoating of people for political gain http://www. mystatesman.com/news/news/opin ion/smith-the-rights-unholy-attacks-on-nonexistent-san/nshFR/ …";;@glennwsmith;;"784104749809471488";https://twitter.com/RepLloydDoggett/status/784104749809471488
;2016-10-05 15:47;0;2;"I am also fortunate to have a partner in SMCISD. Happy #WorldTeachersDay ! https:// twitter.com/SMCISD_HR_Dept /status/779747167661543424 …";;;#WorldTeachersDay;"783770661739196416";https://twitter.com/RepLloydDoggett/status/783770661739196416
;2016-10-05 15:19;1;3;"The global ratification of the historic #ParisAgreement gives hope and a boost to the urgent need to #ActOnClimate . http:// reut.rs/2e2urVL";;;#ParisAgreement #ActOnClimate;"783763498513866752";https://twitter.com/RepLloydDoggett/status/783763498513866752
;2016-10-05 12:14;0;11;"Nat'l Night Out with neighborhoods across SA/Austin talking about strengthening community/police relations, making our neighborhoods safer pic.twitter.com/CQBJSypVDT";;;;"783716989680361472";https://twitter.com/RepLloydDoggett/status/783716989680361472
;2016-10-04 14:17;0;4;"Great way to kick off Startup Week with Battle of the Tech Bands, hosted by @ATCouncil pic.twitter.com/93QAGsuYah";;@ATCouncil;;"783385675798286336";https://twitter.com/RepLloydDoggett/status/783385675798286336
;2016-10-04 12:36;1;7;"It's past time for tax reform. When wealthiest few pay little or nothing, working families & small biz pay more http://www. nytimes.com/2016/10/04/bus iness/dealbook/when-it-comes-to-tax-avoidance-donald-trumps-just-a-small-fry.html … ?";;;;"783360122944970752";https://twitter.com/RepLloydDoggett/status/783360122944970752
;2016-10-03 10:26;1;12;"Successful evening in Kyle for the United Way of Hays and Caldwell Counties’ ( @UWHaysCo ) Taste of Hays County event. pic.twitter.com/vHgfEz9s3H";;@UWHaysCo;;"782965027418599425";https://twitter.com/RepLloydDoggett/status/782965027418599425
