username;date;retweets;favorites;text;geo;mentions;hashtags;id;permalink
;2015-03-16 12:48;3;3;"Received a 100% score on the @Defenders of Wildlife Action Fund’s 2014 Conservation Report Card. http:// doggett.house.gov/images/100Scor eDefendersofWildlife.pdf …";;@Defenders;;"577526965718151168";https://twitter.com/RepLloydDoggett/status/577526965718151168
;2015-03-16 09:32;3;1;"Through April 30 there is another chance to get affordable health insurance for the uninsured filing their taxes now #GetCovered";;;#GetCovered;"577477562689011713";https://twitter.com/RepLloydDoggett/status/577477562689011713
;2015-03-11 13:45;2;3;"$1.2 mil in federal funding will help @BrooksCityBase w/ economic expansion & revitalization efforts http://www. therivardreport.com/brooks-city-ba se-demolish-23-derelict-buidlings/ …";;@BrooksCityBase;;"575729199950004224";https://twitter.com/RepLloydDoggett/status/575729199950004224
;2015-03-11 11:21;3;2;"Nuclear negotiation with Iran is a vital foreign policy question our country faces: http://www. washingtonpost.com/blogs/post-par tisan/wp/2015/03/10/gop-senators-letter-to-iran-is-dangerous-and-irresponsible/?hpid=z3 … pic.twitter.com/yMzZQBw9Fk";;;;"575693105904640000";https://twitter.com/RepLloydDoggett/status/575693105904640000
;2015-03-10 18:25;4;0;"Just talked with @UnivisionSATX about ways families can start preparing their apps for #DACA & #DAPA pic.twitter.com/R8A60PJH9u";;@UnivisionSATX;#DACA #DAPA;"575437228010291201";https://twitter.com/RepLloydDoggett/status/575437228010291201
;2015-03-10 17:10;4;0;"Good question at @UnivisionSATX immigration townhall on cost of application for #DACA #DAPA – fee $465 same as previously";;@UnivisionSATX;#DACA #DAPA;"575418431387889665";https://twitter.com/RepLloydDoggett/status/575418431387889665
;2015-03-10 16:16;7;0;"Here at @UnivisionSATX taking calls w immigration attorneys about next steps for our families. Call in 1-877-614-4141 pic.twitter.com/oXaPCSMKdh";;@UnivisionSATX;;"575404849338183680";https://twitter.com/RepLloydDoggett/status/575404849338183680
;2015-03-10 12:38;2;3;"Joined SA leaders to announce nearly $1.2 million in federal funding for economic development of @BrooksCityBase pic.twitter.com/5JwX6P3tr3";;@BrooksCityBase;;"575349950118293504";https://twitter.com/RepLloydDoggett/status/575349950118293504
;2015-03-06 15:01;10;6;"Austin startup-> RT: @Damatok : Many small biz have no retirement plans or costly ones. New @honestdollar has an idea http:// on.wsj.com/1B6ML43";;@Damatok @honestdollar;;"573951546838401024";https://twitter.com/RepLloydDoggett/status/573951546838401024
;2015-03-05 15:37;2;2;"Not even lots of snow prevented @AIA_SA & @AIAAustin joining me to talk abt energy efficiency & historic preservation pic.twitter.com/VMZYFG7vyO";;@AIA_SA @AIAAustin;;"573598265087782912";https://twitter.com/RepLloydDoggett/status/573598265087782912
;2015-03-05 12:31;5;1;"We need to #InvestInKids with critical #EarlyEd funding. Pre-k is a necessity for an educated workforce #ESEA";;;#InvestInKids #EarlyEd #ESEA;"573551524573392896";https://twitter.com/RepLloydDoggett/status/573551524573392896
;2015-03-04 15:39;9;0;"Intro expansion of American Opportunity Tax Credit & other middle class legislation w @rosadelauro & @repsandylevin pic.twitter.com/Uv5ANnph2D";;@rosadelauro @repsandylevin;;"573236462134669312";https://twitter.com/RepLloydDoggett/status/573236462134669312
;2015-03-03 17:04;9;10;"House voted to fully fund DHS today. Although 21 TX Republicans voted against, we defeated their efforts to misuse bill to deport DREAMers";;;;"572895302631346176";https://twitter.com/RepLloydDoggett/status/572895302631346176
;2015-03-02 17:22;5;4;"On @MSNBC I discussed need for diplomacy in Iranian nuclear negotiations & PM Netanyahu’s ill-timed address https://www. youtube.com/watch?v=o6WkpN yZmbQ&feature=youtu.be …";;@MSNBC;;"572537571307335680";https://twitter.com/RepLloydDoggett/status/572537571307335680
;2015-03-02 16:31;27;15;"I agree the best and brightest need the #freedom2innovate . Ready to move forward on #immigration reform pic.twitter.com/eXHgnYfjyU";;;#freedom2innovate #immigration;"572524588321652737";https://twitter.com/RepLloydDoggett/status/572524588321652737
;2015-03-02 10:12;1;0;"I am speaking on @msnbc 1:15 pm CT today abt importance of successfully completing nuclear negotiations w/ Iran & PM Netanyahu speech tmrw";;@msnbc;;"572429188059287552";https://twitter.com/RepLloydDoggett/status/572429188059287552
;2015-02-26 15:53;10;3;"Misguided Republican education bill shrinks school funding and threatens protections for disadvantaged students. https://www. youtube.com/watch?v=4LM7FK H7Ip8&feature=youtu.be …";;;;"571065427444555777";https://twitter.com/RepLloydDoggett/status/571065427444555777
;2015-02-26 15:06;1;0;"A report by @tvkatesnow last year prompted me to write a bill to protect seniors—and today, the NOTICE Act was voted out of the W&M Cmte.";;@tvkatesnow;;"571053604011937796";https://twitter.com/RepLloydDoggett/status/571053604011937796
;2015-02-26 13:02;7;7;"Today, I received a 97% score on @LCVoters 2014 Nat'l Environmental Scorecard, the highest score earned by a TX Rep http:// doggett.house.gov/images/doggett scorecardlcv2014.pdf …";;@LCVoters;;"571022410318815233";https://twitter.com/RepLloydDoggett/status/571022410318815233
;2015-02-26 12:45;3;2;"W/ only hours until Homeland Security funding is terminated, I spoke against GOP family feud risking our security https://www. youtube.com/watch?v=slzWAc mdqF0&feature=youtu.be …";;;;"571018152001314818";https://twitter.com/RepLloydDoggett/status/571018152001314818
;2015-02-26 10:35;1;0;"As @washingtonpost editorial notes, strong negotiated deal with Iran better for Israel and whole Middle East. http://www. washingtonpost.com/opinions/a-com pelling-argument-on-iran/2015/02/24/8062ec44-bc76-11e4-b274-e5209a3bc9a9_story.html …";;@washingtonpost;;"570985487298637824";https://twitter.com/RepLloydDoggett/status/570985487298637824
;2015-02-25 17:40;1;0;"Republicans Grapple w Internal Rifts in Homeland Security Impasse, NYT says McConnell/Boehner haven’t spoken in 2 wks http:// nyti.ms/1JMtUB4";;;;"570730131288956928";https://twitter.com/RepLloydDoggett/status/570730131288956928
;2015-02-25 14:18;12;14;"On Capitol Hill, I urged immigration action to keep families together and let DREAMers contribute their talents. pic.twitter.com/YL3XUF54Fs";;;;"570679368541974529";https://twitter.com/RepLloydDoggett/status/570679368541974529
;2015-02-24 11:15;1;0;""It's just plain wrong." - Rep. King (R-NY) on his party's DHS funding gamesmanship. WATCH → http:// goo.gl/163dOV #DontShutDownOurSecurity";;;#DontShutDownOurSecurity;"570270775984451584";https://twitter.com/RepLloydDoggett/status/570270775984451584
;2015-02-21 16:49;15;10;"Joined Workers Defense Project to help ensure our neighbors have accurate immigration info pic.twitter.com/wSkLmL4x7c";;;;"569267577584795648";https://twitter.com/RepLloydDoggett/status/569267577584795648
;2015-02-20 15:56;2;0;"Today, HHS granted my request to allow uninsured taxpayers paying an ACA penalty another opportunity to #GetCovered http://www. statesman.com/news/news/feds -extend-affordable-care-act-enrollment-period/nkFqw/ …";;;#GetCovered;"568891911534202881";https://twitter.com/RepLloydDoggett/status/568891911534202881
;2015-02-19 13:45;9;9;"Congrats to my friends Sarah Goodfriend & Suzanne Bryant on today becoming first same-sex couple married in Texas! http://www. mystatesman.com/news/news/brea king-news/travis-county-clerk-issues-first-same-sex-marriage/nkD63/ …";;;;"568496526173081601";https://twitter.com/RepLloydDoggett/status/568496526173081601
;2015-02-19 12:52;3;6;"Despite below freezing temps, @UTSA and Texas State @txst students warmly welcomed for Capitol tour. pic.twitter.com/WwyoR2IyPv";;@UTSA @txst;;"568483232494292994";https://twitter.com/RepLloydDoggett/status/568483232494292994
;2015-02-18 13:07;14;12;"I joined @JoaquinCastrotx & immigrant groups in SA regarding supporting #DAPA & #DACA http://www. ksat.com/content/pns/ks at/news/2015/02/17/lawmakers-react-to-judge-s-ruling-on-obama-s-immigration-executi.html …";;@JoaquinCastrotx;#DAPA #DACA;"568124617027670016";https://twitter.com/RepLloydDoggett/status/568124617027670016
;2015-02-18 11:25;3;1;"In meetings with immigration advocates, I encouraged #DACA and #DAPA eligible people to get applications ready http://www. statesman.com/news/news/dogg ett-reassures-deferred-action-applicants/nkCqs/ …";;;#DACA #DAPA;"568099093320503296";https://twitter.com/RepLloydDoggett/status/568099093320503296
;2015-02-17 20:08;1;1;"Spoke with @TheRevAl on @msnbc about judicial overreach re immigration action http://www. msnbc.com/politicsnation /watch/judge-blocks-obama-immigration-order-400622147722 …";;@TheRevAl @msnbc;;"567868337499275264";https://twitter.com/RepLloydDoggett/status/567868337499275264
;2015-02-17 16:06;3;4;"Last minute judicial overreach on legal presidential immigration action heightens uncertainty for young people #DACA pic.twitter.com/dDGKkxrzU7";;;#DACA;"567807368520822785";https://twitter.com/RepLloydDoggett/status/567807368520822785
;2015-02-17 14:04;1;0;"Researchers provide insight on how human activity increases chances of a ‘megadrought’ in the SW. #climateactionnow http:// wapo.st/1B4zV7u";;;#climateactionnow;"567776504001662976";https://twitter.com/RepLloydDoggett/status/567776504001662976
;2015-02-13 12:10;3;0;"Only 2 weeks until @DHSgov shutdown; it's time for GOP to pass clean bill & stop holding national security hostage #DontShutDownOurSecurity";;@DHSgov;#DontShutDownOurSecurity;"566298458852978688";https://twitter.com/RepLloydDoggett/status/566298458852978688
;2015-02-12 14:57;5;5;"I met w/ TX reps from NEA & students w/ @LULAC . We discussed importance of improving our TX public schools. #LULAC15 pic.twitter.com/TKriBbZSXT";;@LULAC;#LULAC15;"565978112421531648";https://twitter.com/RepLloydDoggett/status/565978112421531648
;2015-02-12 13:23;0;4;"I visited with Trustees from @AlamoColleges1 , discussing our shared support for Pell Grants and affordable higher ed. pic.twitter.com/2ZvNWHKCJj";;@AlamoColleges1;;"565954477262667778";https://twitter.com/RepLloydDoggett/status/565954477262667778
;2015-02-12 13:08;1;0;"https://www. youtube.com/watch?v=2cwMBK j3zcI … pic.twitter.com/7ZwbKNJUBZ";;;;"565950688505921536";https://twitter.com/RepLloydDoggett/status/565950688505921536
;2015-02-11 13:33;4;0;"Time to act on climate change is long overdue. Alfredo Padilla, who has family in SA, explains the impact of inaction http://www. nytimes.com/2015/02/10/us/ politics/climate-change-is-of-growing-personal-concern-to-us-hispanics-poll-finds.html …";;;;"565594546239979520";https://twitter.com/RepLloydDoggett/status/565594546239979520
;2015-02-11 12:12;5;0;"House GOP is moving forward w/ a harmful education bill that undermines protections for disadvantaged schools and minority students. #ESEA";;;#ESEA;"565574118196916224";https://twitter.com/RepLloydDoggett/status/565574118196916224
;2015-02-11 11:09;0;0;"Internal GOP finger-pointing on DHS funding: pic.twitter.com/8Eie88mIWp";;;;"565558328441700352";https://twitter.com/RepLloydDoggett/status/565558328441700352
;2015-02-10 16:45;4;2;"Today I met with a group of ACC leaders to discuss ways to improve accessibility & affordability of higher education pic.twitter.com/V5sTRo6HcX";;;;"565280540690219013";https://twitter.com/RepLloydDoggett/status/565280540690219013
;2015-02-06 14:53;7;7;"Pleased to join the Austin Young Chamber of Commerce today in honoring Councilman Greg Casar. pic.twitter.com/rqOlMfxOGT";;;;"563802777080848384";https://twitter.com/RepLloydDoggett/status/563802777080848384
;2015-02-06 13:58;2;0;"Families of victims of 9/11 attacks & the public should have full access to entire investigation report abt attacks http://www. nytimes.com/2015/02/05/us/ claims-against-saudis-cast-new-light-on-secret-pages-of-9-11-report.html?_r=0 …";;;;"563788818684588032";https://twitter.com/RepLloydDoggett/status/563788818684588032
;2015-02-05 15:16;1;0;"Morocco’s former US interrogation “black site” underscores need for holding those who tortured & bosses accountable http:// nyti.ms/1DDoVv7";;;;"563446172443226113";https://twitter.com/RepLloydDoggett/status/563446172443226113
;2015-02-05 12:23;0;0;"Rosa Parks' lifelong Civil Rights activism documented in a display by the Library of Congress http://www. washingtonpost.com/local/artifact s-show-a-rosa-parks-steeped-in-freedom-struggle-from-childhood/2015/02/02/90ee01f4-a7de-11e4-a7c2-03d37af98440_story.html …";;;;"563402666890780673";https://twitter.com/RepLloydDoggett/status/563402666890780673
;2015-02-04 16:31;2;2;"Pleased to address #SAtoDC2015 & meet with @SAHispanicCC President Richard Cavazos, and LeRoy Cavazos today pic.twitter.com/ec5ivdtLjd";;@SAHispanicCC;#SAtoDC2015;"563102536497102848";https://twitter.com/RepLloydDoggett/status/563102536497102848
;2015-02-04 13:04;3;1;"@TXStandingTall visited today to discuss substance abuse, underage drinking, & ways to encourage healthy choices pic.twitter.com/Hz0XFg7uav";;@TXStandingTall;;"563050373716660227";https://twitter.com/RepLloydDoggett/status/563050373716660227
;2015-02-03 17:59;9;10;"Today, I welcomed the San Antonio Chamber of Commerce’s SA to #SAtoDC2015 pic.twitter.com/Nf8ZBu4yck";;;#SAtoDC2015;"562762268119937025";https://twitter.com/RepLloydDoggett/status/562762268119937025
;2015-02-03 13:10;1;2;"Republicans set a vote today to repeal the ACA for the 56th time. Reminder: Only 12 days remain to #GetCovered this year.";;;#GetCovered;"562689722150297601";https://twitter.com/RepLloydDoggett/status/562689722150297601
;2015-02-02 15:25;3;3;"Today is the first day to enroll in Pre-K for SA. Providing quality early education is key to later success! http:// therivardreport.com/spread-word-ti me-enroll-pre-k-4-sa/ …";;;;"562361116744224768";https://twitter.com/RepLloydDoggett/status/562361116744224768
;2015-02-02 10:37;2;1;"GOP shouldn't consider another costly govt shutdown, threaten DHS funding during security concerns. http://www. washingtonpost.com/opinions/gop-h olds-security-hostage-to-immigration/2015/02/01/55776ae8-a8d3-11e4-a06b-9df2002b86a0_story.html …";;;;"562288835707801601";https://twitter.com/RepLloydDoggett/status/562288835707801601
;2015-01-31 09:56;9;9;"Today marks the day the first #SocialSecurity check was paid out 75 yrs ago. Must ensure retirement security continues.";;;#SocialSecurity;"561553640880893955";https://twitter.com/RepLloydDoggett/status/561553640880893955
;2015-01-29 13:16;1;0;"Read joint oped in @RollCall w/ @SenatorDurbin @RepSandyLevin and @SenJackReed regarding curbing inversions http://www. rollcall.com/news/corporati ons_wont_wait_for_tax_reform_so_why_should_congress_commentary-239633-1.html?pg=1&dczone=opinion …";;@RollCall @SenatorDurbin @RepSandyLevin @SenJackReed;;"560879177956884482";https://twitter.com/RepLloydDoggett/status/560879177956884482
;2015-01-28 13:18;8;1;"Difficulty of achieving #ImmigrationReform demonstrated by form letters sent to me today. pic.twitter.com/elVRBhROvd";;;#ImmigrationReform;"560517237506068480";https://twitter.com/RepLloydDoggett/status/560517237506068480
;2015-01-27 13:12;7;4;"Read my op-ed in @MySA concerning Republican attempts to roll back progress on immigration http://www. mysanantonio.com/opinion/commen tary/article/House-GOP-ignores-immigration-middle-ground-6041481.php …";;@MySA;;"560153356120125440";https://twitter.com/RepLloydDoggett/status/560153356120125440
;2015-01-26 09:56;6;0;"Read @statesman re: how the House is addressing immigration in point/counterpoint articles by myself & Rep. McCaul http:// doggett.house.gov/images/doggett mccaulbordersecurityopinions.png …";;@statesman;;"559741595172737024";https://twitter.com/RepLloydDoggett/status/559741595172737024
;2015-01-22 11:17;14;1;"House Republicans are pushing a sweeping bill aimed at taking control away from women. #StopHR7 #TrustWomen";;;#StopHR7 #TrustWomen;"558312550497267714";https://twitter.com/RepLloydDoggett/status/558312550497267714
;2015-01-21 17:10;9;9;"Tomorrow, Republicans will push another anti-women's health bill. But today, I helped intro the Women’s Health Protection Act. #TrustWomen";;;#TrustWomen;"558039048137506818";https://twitter.com/RepLloydDoggett/status/558039048137506818
;2015-01-21 13:15;1;0;"More details re: Stop Corporate Inversions Act I introduced w/ @repsandylevin @SenatorDurbin & @SenJackReed this week http:// thehill.com/policy/finance /230063-dems-seek-new-avenues-to-fight-offshore-tax-deals …";;@repsandylevin @SenatorDurbin @SenJackReed;;"557979770173263872";https://twitter.com/RepLloydDoggett/status/557979770173263872
;2015-01-21 09:52;1;2;"Spoke w/ @TWCNewsAustin about #SOTU - Pleased the President focused on helping working families. See full story here: https://www. youtube.com/watch?v=ejph-i jhR8c …";;@TWCNewsAustin;#SOTU;"557928786763587586";https://twitter.com/RepLloydDoggett/status/557928786763587586
;2015-01-20 16:17;6;2;"A Texas DREAMer will be an honored guest of the President at the State of the Union address #SOTU #ImmigrationAction http://www. msnbc.com/msnbc/meet-the -dreamer-whos-honored-guest-sotu …";;;#SOTU #ImmigrationAction;"557663228000755712";https://twitter.com/RepLloydDoggett/status/557663228000755712
;2015-01-20 14:14;1;1;"We need to ensure SA residents have peace from intrusive train horns. See article by the @Rivardreport http:// therivardreport.com/time-railroad- bypass-san-antonio/ …";;@Rivardreport;;"557632255414505474";https://twitter.com/RepLloydDoggett/status/557632255414505474
;2015-01-20 13:02;5;2;"We can curb unfair big business inversions with the Stop Corporate Inversion Act I helped introduce today. pic.twitter.com/rYUaqUdxCG";;;;"557614105662857217";https://twitter.com/RepLloydDoggett/status/557614105662857217
;2015-01-20 10:11;5;3;"Helping introduce the Stop Corporate Inversions Act with @RepSandyLevin @SenatorDurbin and @SenJackReed";;@RepSandyLevin @SenatorDurbin @SenJackReed;;"557571109047246848";https://twitter.com/RepLloydDoggett/status/557571109047246848
;2015-01-20 09:09;1;3;"I walked with friends in San Antonio to honor the legacy of Dr. Martin Luther King Jr. pic.twitter.com/C7QJLmAkJu";;;;"557555438032789504";https://twitter.com/RepLloydDoggett/status/557555438032789504
;2015-01-16 16:31;1;4;"Pleased to join Socar Chatmon-Thomas, Bill Evans & others at ATX Board of Realtors HQ ribbon cutting pic.twitter.com/Q8FmWbjFIW";;;;"556217174378184704";https://twitter.com/RepLloydDoggett/status/556217174378184704
;2015-01-16 16:03;4;1;"Join me in SA for the MLK march on Monday, Jan 19th at 9am at the Greater Faith Institutional Church pic.twitter.com/pFADSgg3wW";;;;"556210206787772417";https://twitter.com/RepLloydDoggett/status/556210206787772417
;2015-01-16 10:52;5;6;"Time to stop denying #GlobalWarming & start resolving. Listen to science instead of convenient political mythology http://www. nytimes.com/2015/01/17/sci ence/earth/2014-was-hottest-year-on-record-surpassing-2010.html?hp&action=click&pgtype=Homepage&module=first-column-region&region=top-news&WT.nav=top-news&_r=0 …";;;#GlobalWarming;"556132004870492160";https://twitter.com/RepLloydDoggett/status/556132004870492160
;2015-01-15 10:44;2;1;"Today is the deadline to sign up for coverage starting 2/1. #GetCovered at http://www. healthcare.gov";;;#GetCovered;"555767458288898049";https://twitter.com/RepLloydDoggett/status/555767458288898049
;2015-01-15 09:37;2;0;"The @FACTCoalition has highlighted my Stop Tax Haven Abuse Act in a release http:// thefactcoalition.org/fact-coalition -lauds-introduction-of-stop-tax-haven-abuse-act/ …";;@FACTCoalition;;"555750708717576192";https://twitter.com/RepLloydDoggett/status/555750708717576192
;2015-01-14 12:03;7;4;"I joined in reintroducing bipartisan legislation which will protect the approximately 50 million Medicare beneficiaries from identity theft.";;;;"555425058643263490";https://twitter.com/RepLloydDoggett/status/555425058643263490
;2015-01-13 15:20;105;22;"Republicans immigration plan: Deportation now. Deportation tomorrow. Deportation forever. https://www. youtube.com/watch?v=5hdaOE wcsK8&feature=youtu.be …";;;;"555112259241136128";https://twitter.com/RepLloydDoggett/status/555112259241136128
;2015-01-12 13:10;4;5;"See my floor speech congratulating the @spurs on the 2014 Championship. I'm ready for the “Race for Seis! #GoSpursGo https://www. youtube.com/watch?v=i0JgFn xk1hA&feature=youtu.be …";;@spurs;#GoSpursGo;"554716954444181505";https://twitter.com/RepLloydDoggett/status/554716954444181505
;2015-01-09 10:04;4;0;"Excellent exhibition on the 50th anniversary of signing of Civil Rights Act of 1964. Find it online at http://www. loc.gov/exhibits/civil -rights-act …";;;;"553583156713246720";https://twitter.com/RepLloydDoggett/status/553583156713246720
;2015-01-08 16:54;0;3;"Today, I introduced a bipartisan bill that helps those suffering from serious diseases continue clinical trials to help find a cure.";;;;"553323909769363457";https://twitter.com/RepLloydDoggett/status/553323909769363457
;2015-01-08 10:12;5;1;"I stand in solidarity with the French in support of free expression and against extremism.";;;;"553222611199864833";https://twitter.com/RepLloydDoggett/status/553222611199864833
;2015-01-07 15:17;1;2;"GOP began 2015 the way it ended 2014: attempting to pass a gift to Big Banks. I voted against just as I voted against all Big Bank bailouts.";;;;"552937052313235457";https://twitter.com/RepLloydDoggett/status/552937052313235457
;2015-01-07 12:00;0;2;"Congratulations to Tommy Calvert for making history yesterday. He was sworn in as Bexar County Commissioner of Pct. 4 http:// bit.ly/1wUXHuV";;;;"552887461874237441";https://twitter.com/RepLloydDoggett/status/552887461874237441
;2015-01-06 17:01;4;13;"I am an original sponsor of the Respect for Marriage Act to repeal #DOMA pic.twitter.com/7oBvCjmDsq";;;#DOMA;"552600837424689152";https://twitter.com/RepLloydDoggett/status/552600837424689152
;2015-01-06 09:43;1;4;"First day of the new Congress: pic.twitter.com/7QdU4fDYqd";;;;"552490574574796800";https://twitter.com/RepLloydDoggett/status/552490574574796800
;2015-01-01 21:07;10;11;"Began the New Year w/ old friends & new like William Trynoski- UTSA student leader who has registered 650 new voters! pic.twitter.com/8oTwJabtgg";;;;"550850761253322752";https://twitter.com/RepLloydDoggett/status/550850761253322752
;2014-12-30 16:03;2;11;"My wife Libby serves as @usedgov Deputy Asst Secy. She enjoyed giving keynote at @TXST Commencement this month pic.twitter.com/G4Zr2enQFF";;@usedgov @TXST;;"550049552049655808";https://twitter.com/RepLloydDoggett/status/550049552049655808
;2014-12-29 11:55;3;1;"I have been working w/ local immigration groups to inform SA families abt POTUS imm action. See more in @MySA here pic.twitter.com/GzfJ3yKUIl";;@MySA;;"549624815393714177";https://twitter.com/RepLloydDoggett/status/549624815393714177
;2014-12-23 11:23;4;0;"SA Missions Park expansion is important step to preserving unique Alamo City History. Read more in @Rivardreport http://www. therivardreport.com/missions-natio nal-historic-park-expansion-approved/ …";;@Rivardreport;;"547442451355807744";https://twitter.com/RepLloydDoggett/status/547442451355807744
;2014-12-22 12:00;4;4;"My bill expanding SA Missions Park by 137 acres now law-- more park, more visitors, more jobs. See @mySA story http://www. expressnews.com/news/local/art icle/Missions-park-set-to-expand-5972397.php#/0 …";;@mySA;#;"547089390628274176";https://twitter.com/RepLloydDoggett/status/547089390628274176
;2014-12-22 10:41;198;44;"Joined Turkish Texans at State Capitol this weekend to speak out against suppression of democracy in Turkey pic.twitter.com/rNbvOUwzWu";;;;"547069451263574016";https://twitter.com/RepLloydDoggett/status/547069451263574016
;2014-12-16 17:48;5;4;"Wishing everyone in Texas and around the world celebrating #Hanukkah a Happy Festival of Lights!";;;#Hanukkah;"545002432284356609";https://twitter.com/RepLloydDoggett/status/545002432284356609
;2014-12-16 14:44;2;1;"SCOTUS backed 9th Circuit decision blocking anti-choice legislation in AZ. TX women still face similar restrictions http://www. nytimes.com/2014/12/16/us/ politics/justices-let-stand-a-ruling-blocking-an-arizona-abortion-law.html …";;;;"544956289219309568";https://twitter.com/RepLloydDoggett/status/544956289219309568
;2014-12-12 16:50;4;6;"The Senate just approved legislation containing my bill to expand SA Missions Natl Park! Thx to the many who work in support of our Missions";;;;"543538346752880640";https://twitter.com/RepLloydDoggett/status/543538346752880640
;2014-12-12 15:27;3;2;"Political groups spent more than $814 mil to influence last month’s elections. Time to enact #CampaignFinance reform http://www. nytimes.com/2014/12/11/ups hot/outside-groups-set-spending-record-in-midterms-.html?module=Search&mabReward=relbias%3Aw%2C%7B%221%22%3A%22RI%3A6%22%7D&abt=0002&abg=0 …";;;#CampaignFinance;"543517555470512128";https://twitter.com/RepLloydDoggett/status/543517555470512128
;2014-12-12 15:26;2;3;"A @NYTimes editorial rightly condemns the use of brutal tactics during the Bush-Cheney Administration http://www. nytimes.com/2014/12/10/opi nion/the-senate-report-on-the-cias-torture-and-lies.html?partner=rssnyt&emc=rss …";;@NYTimes;;"543517198044520449";https://twitter.com/RepLloydDoggett/status/543517198044520449
;2014-12-11 16:42;3;7;"Clear contrasting views regarding the Senate report on CIA interrogation methods pic.twitter.com/T8G5pbrxQp";;;;"543173996188295168";https://twitter.com/RepLloydDoggett/status/543173996188295168
