username;date;retweets;favorites;text;geo;mentions;hashtags;id;permalink
;2017-06-14 19:30;7;48;"Thank you for all the hard work you do to conserve our environment and protect public health! https:// twitter.com/tlcv/status/87 5044928711254029 …";;;;"875148492137787396";https://twitter.com/RepLloydDoggett/status/875148492137787396
;2017-06-14 17:14;4;16;"I offer my thoughts regarding this morning’s senseless tragedy in Alexandria, Virginia. https:// youtu.be/L5dFTWbl17k";;;;"875114125973757953";https://twitter.com/RepLloydDoggett/status/875114125973757953
;2017-06-14 11:06;15;49;"My full statement on this morning's terrible shooting in Alexandria. pic.twitter.com/R8o1okezww";;;;"875021616207581185";https://twitter.com/RepLloydDoggett/status/875021616207581185
;2017-06-14 08:18;19;93;"Shocked to learn terrible news re: morning shooting. Thinking of @SteveScalise , Capitol Police, others injured, and their families.";;@SteveScalise;;"874979279917940736";https://twitter.com/RepLloydDoggett/status/874979279917940736
;2017-06-13 20:55;27;66;"I offered a resolution to end Trump’s #taxreturns cover-up. Review by “Russia Law Firm of the Year” doesn’t cut it. https:// youtu.be/WVMfRp_Nhig";;;#taxreturns;"874807358068842496";https://twitter.com/RepLloydDoggett/status/874807358068842496
;2017-06-13 16:48;10;31;"And here are my full remarks: https:// youtu.be/WVMfRp_Nhig https:// twitter.com/HughTFerguson/ status/874723546974613504 …";;;;"874745279563665408";https://twitter.com/RepLloydDoggett/status/874745279563665408
;2017-06-13 16:32;16;39;"Offered resolution to end cover-up of Trump’s tax returns. Review by “Russia Law Firm of the Year” doesn’t cut it https://www. c-span.org/video/?c467355 5/rep-doggett-offers-privileged-resolution …";;;;"874741376713359360";https://twitter.com/RepLloydDoggett/status/874741376713359360
;2017-06-13 14:50;43;141;"About to offer a resolution requesting Trump’s #taxreturns on House floor. Tune in to C-Span.";;;#taxreturns;"874715593173336064";https://twitter.com/RepLloydDoggett/status/874715593173336064
;2017-06-13 13:21;52;66;"GOP bans reporters from recording in Senate hallways w/o special permission. This new restriction is appalling. https:// twitter.com/thehill/status /874674485600845825 …";;;;"874693226132905984";https://twitter.com/RepLloydDoggett/status/874693226132905984
;2017-06-13 09:59;9;47;"Trying 2 rid me, GOP gave me chance to rep much of TX but not all at once. Happy 2 talk border issues w Rio Grande Valley frmer constituents pic.twitter.com/dzpgryCblb";;;;"874642445807616000";https://twitter.com/RepLloydDoggett/status/874642445807616000
;2017-06-12 20:47;119;533;"Tomorrow afternoon on the House Floor I will try again to get Trump’s tax returns.";;;;"874442968161292288";https://twitter.com/RepLloydDoggett/status/874442968161292288
;2017-06-12 15:07;0;14;"Celebrated La Tuna Ice House's 25th Anniversary w/ my friends Michael Berrier & Suzanne Martinez. Best wishes for many more years of success pic.twitter.com/2AxXf7nkQB";;;;"874357633658040321";https://twitter.com/RepLloydDoggett/status/874357633658040321
;2017-06-12 12:59;7;14;"Economist Diane Swonk analyzes May jobs report & says POTUS needs to be careful on taking credit for jobs gains. https://www. youtube.com/watch?v=rWEcAa aIxTU …";;;;"874325176367841280";https://twitter.com/RepLloydDoggett/status/874325176367841280
;2017-06-12 11:34;13;44;"One year later, we honor & remember the 49 lives lost at #PulseNightClub & never forget that love will always defeat hate. #OrlandoUnitedDay";;;#PulseNightClub #OrlandoUnitedDay;"874303843336630272";https://twitter.com/RepLloydDoggett/status/874303843336630272
;2017-06-12 09:47;61;72;"ACA repeal push is life or death issue, yet 13 GOP men are doing it in secret, with no witnesses or expert testimony https://www. bostonglobe.com/opinion/2017/0 6/07/why-are-men-behind-closed-doors-writing-health-care-bill/cIqCDEcFo29uxirxbouPbI/story.html …";;;;"874277066233061377";https://twitter.com/RepLloydDoggett/status/874277066233061377
;2017-06-11 20:04;11;93;"My best to new San Antonio Mayor @Ron_Nirenberg & councilmembers with whom I celebrated last night. Looking forward to working together!";;@Ron_Nirenberg;;"874069973739622400";https://twitter.com/RepLloydDoggett/status/874069973739622400
;2017-06-11 13:56;27;87;"Rallying 4 equality, against hate & 4 inclusion @TX Capitol w/ Councilmember @JimmyFlannigan @MayorAdler , concerned Texans. #EqualityMarch pic.twitter.com/cFyVoAYClE";;@TX @JimmyFlannigan @MayorAdler;#EqualityMarch;"873977332704448513";https://twitter.com/RepLloydDoggett/status/873977332704448513
;2017-06-11 10:47;1;31;"Libby and I always enjoy participating in the annual Chisholm Trail Grand Parade and seeing so many of our friends in Lockhart. pic.twitter.com/lHi2bxI1ZV";;;;"873929580469506048";https://twitter.com/RepLloydDoggett/status/873929580469506048
;2017-06-10 16:37;5;23;"Creative neighborhood gatherings with live music and good company from Beacon Hill and Alta Vista during their first PorchFest. pic.twitter.com/ueUwDeNvmM";;;;"873655305913204741";https://twitter.com/RepLloydDoggett/status/873655305913204741
;2017-06-10 14:16;110;119;"GOP sabotaging our healthcare & then using resulting chaos to justify their attacks on critical patient protections https://www. washingtonpost.com/news/powerpost /wp/2017/06/06/republicans-stoking-insurer-panic-cite-uncertainty-as-a-reason-to-pass-health-care-bill/?utm_term=.595d4204ce4c …";;;;"873619806901108738";https://twitter.com/RepLloydDoggett/status/873619806901108738
;2017-06-10 12:55;31;113;"June is LGBTQ Pride Month & I stand in support of LGBTQ community & resist Trump’s divisive, non-inclusive policies. #Pride2017";;;#Pride2017;"873599468968562689";https://twitter.com/RepLloydDoggett/status/873599468968562689
;2017-06-09 14:21;8;24;"Trump sought personal loyalty of FBI Director to him, not our country. More of my thoughts on #JamesComey @KXAN_News https:// youtu.be/h4cqWC-o9RU";;@KXAN_News;#JamesComey;"873258730598666243";https://twitter.com/RepLloydDoggett/status/873258730598666243
;2017-06-09 10:11;9;15;"GOP voted #WrongChoiceAct to undermine cop on the beat that protects consumers against wrongful financial practices. https:// youtu.be/-rMqm_FIinI";;;#WrongChoiceAct;"873195941548916736";https://twitter.com/RepLloydDoggett/status/873195941548916736
;2017-06-09 08:32;1;42;"Thank you for your very kind tweet David. please give my best to your grandparents. https:// twitter.com/texapplawyer/s tatus/873032119550750720 …";;;;"873170955295752192";https://twitter.com/RepLloydDoggett/status/873170955295752192
;2017-06-08 15:46;19;44;"These are dangerous times. Those who remain involved will make a difference. My #JamesComey testimony remarks: https://www. youtube.com/watch?v=ZPHv_n sdvtQ&feature=youtu.be …";;;#JamesComey;"872917709109039104";https://twitter.com/RepLloydDoggett/status/872917709109039104
;2017-06-08 09:15;26;38;"Listen to whether TX GOP officials mouth these Trump talking pts or repudiate his misconduct & interference w/ law enforcement. #JamesComey https:// twitter.com/ZekeJMiller/st atus/872636139697582080 …";;;#JamesComey;"872819406858051584";https://twitter.com/RepLloydDoggett/status/872819406858051584
;2017-06-08 08:08;28;89;"Trump wanted FBI as his own police force, not America’s police force, demanding loyalty to him, not our country. Watch Comey speak @9a CT.";;@9a;;"872802484871475201";https://twitter.com/RepLloydDoggett/status/872802484871475201
;2017-06-07 18:45;14;14;"GOP #WrongChoiceAct shields #WallStreet & handcuffs the cop on the beat, @CFPB , which protects consumers. https:// youtu.be/Gq1kJpixMyE";;@CFPB;#WrongChoiceAct #WallStreet;"872600309209505792";https://twitter.com/RepLloydDoggett/status/872600309209505792
;2017-06-07 17:30;57;167;"Trump wanted FBI as his own police force, not America’s police force, demanding loyalty to him, not our country. Watch Comey speak tmw 9a CT";;;;"872581441158238208";https://twitter.com/RepLloydDoggett/status/872581441158238208
;2017-06-07 15:57;2;6;". @KingWilliamFair & Parade won't be same w/o Sue Duffy. My thoughts & prayers are w/ her family & King William Assoc https:// therivardreport.com/with-stories-a nd-a-parade-family-and-friends-honor-sue-duffy/ …";;@KingWilliamFair;;"872558258531205120";https://twitter.com/RepLloydDoggett/status/872558258531205120
;2017-06-07 14:23;59;109;"Happy to join @RepSwalwell @RepCummings @RepSarbanes @RepAnnaEshoo @RepJerryNadler to demand #independentcommission & #demandtruth . pic.twitter.com/SLmEJIJeDy";;@RepSwalwell @RepCummings @RepSarbanes @RepAnnaEshoo @RepJerryNadler;#independentcommission #demandtruth;"872534556833976320";https://twitter.com/RepLloydDoggett/status/872534556833976320
;2017-06-07 13:19;45;60;"Despicable ad by Trump supporters attacks fired FBI Dir #Comey on eve of his testimony. A new Trump low. http://www. cbsnews.com/news/pro-trump -group-will-play-ad-critical-of-comey-during-his-testimony/ …";;;#Comey;"872518311514341383";https://twitter.com/RepLloydDoggett/status/872518311514341383
;2017-06-07 10:41;4;14;"Pleased to join @CommonCause @public_citizen @4taxfairness & fellow Dem colleagues to demand @POTUS release his tax returns & #demandtruth pic.twitter.com/oCgSRjihUe";;@CommonCause @public_citizen @4taxfairness @POTUS;#demandtruth;"872478702906597381";https://twitter.com/RepLloydDoggett/status/872478702906597381
;2017-06-07 09:44;4;14;"Tune into my FB Live ~11a ET as I speak @a rally @the US Capitol on need for @POTUS to release his #taxreturns https://www. facebook.com/lloyddoggett";;@a @the @POTUS;#taxreturns;"872464401391136769";https://twitter.com/RepLloydDoggett/status/872464401391136769
;2017-06-06 18:20;9;31;"On the 73rd Anniversary of #DDay , we remember those who bravely fought for democracy. To those who served then, and now, thank you. pic.twitter.com/axv41eBFe5";;;#DDay;"872231630156550146";https://twitter.com/RepLloydDoggett/status/872231630156550146
;2017-06-06 17:22;20;27;"SA & Austin on unwelcome top 10 list of cities most affected by mosquitoes, as per Terminix. With threat of Zika, please take precautions.";;;;"872217117743075329";https://twitter.com/RepLloydDoggett/status/872217117743075329
;2017-06-06 14:51;12;25;"Republicans’ #WrongChoiceAct puts Wall Street first, not Main Street, not working families.";;;#WrongChoiceAct;"872179198038814720";https://twitter.com/RepLloydDoggett/status/872179198038814720
;2017-06-06 13:59;4;14;"GOP’s #WrongChoiceAct would drag America in wrong direction, risking financial crisis. We should be moving forward, not backward.";;;#WrongChoiceAct;"872165972102307842";https://twitter.com/RepLloydDoggett/status/872165972102307842
;2017-06-06 13:28;19;37;"I'm pleased that Ethics Office continues to press for compliance from an Admin that thinks rules are just for others https://www. washingtonpost.com/politics/ethic s-office-will-press-white-house-on-undated-conflict-of-interest-waivers/2017/06/02/5700719c-47b0-11e7-a196-a1bb629f64cb_story.html …";;;;"872158335847583744";https://twitter.com/RepLloydDoggett/status/872158335847583744
;2017-06-06 08:51;21;42;"This outrageous behavior by Mylan shows why we need actual Rx price reform, not just performances for the cameras. https://www. nytimes.com/2017/06/04/bus iness/angry-about-epipen-prices-executive-dont-care-much.html …";;;;"872088528984977408";https://twitter.com/RepLloydDoggett/status/872088528984977408
;2017-06-05 13:10;24;36;"Trump disguising latest attempt to shower wealthiest few w/ tax breaks as an infrastructure plan. https://www. nytimes.com/2017/06/03/us/ politics/trump-plans-to-shift-infrastructure-funding-to-cities-states-and-business.html?_r=2 …";;;;"871791396943998979";https://twitter.com/RepLloydDoggett/status/871791396943998979
;2017-06-05 10:17;74;87;". @POTUS continues building his wall—of broken promises. His 100% assurance to save Carrier jobs was phony. https://www. washingtonpost.com/news/wonk/wp/2 017/05/24/here-is-the-number-of-jobs-carrier-is-moving-to-mexico-after-trump-said-hed-save-them/?tid=pm_business_pop&utm_term=.456a79f69a62 …";;@POTUS;;"871747703239303172";https://twitter.com/RepLloydDoggett/status/871747703239303172
;2017-06-04 17:53;11;50;"Thx @KXAN_News for covering my condemnation of Trump’s withdrawal frm #ParisAgreement & @MayorAdler 4 yr leadership https:// youtu.be/2B8nte0M3g0";;@KXAN_News @MayorAdler;#ParisAgreement;"871500250292375552";https://twitter.com/RepLloydDoggett/status/871500250292375552
;2017-06-04 13:54;43;77;"Checks & balances are vital for in a democracy, yet WH orders fed agencies to ignore Democratic oversight requests. http://www. politico.com/story/2017/06/ 02/federal-agencies-oversight-requests-democrats-white-house-239034 …";;;;"871439946241933314";https://twitter.com/RepLloydDoggett/status/871439946241933314
;2017-06-04 10:27;16;75;"My statement on yesterday's horrific tragedy in London. pic.twitter.com/WPc01TOGFX";;;;"871387869230837764";https://twitter.com/RepLloydDoggett/status/871387869230837764
;2017-06-03 14:59;3;11;"Pleased that $10m will go to Mission Reach for FY17. Here I'm w/ @SanAntonioRiver & SA leaders for a final tree planting along Mission Reach pic.twitter.com/Wky4My2Vhm";;@SanAntonioRiver;;"871093898298503168";https://twitter.com/RepLloydDoggett/status/871093898298503168
;2017-06-03 10:57;27;47;"US cities' & companies' leadership will help us #ActOnClimate & live up to #ParisAgreement until Trump is replaced http://www. mystatesman.com/lifestyles/env ironment/austin-officials-withdrawal-from-paris-accord-won-stop-city-plans/Dk3rGyJ8kt0bjgT6cMM1jP/ …";;;#ActOnClimate #ParisAgreement;"871032991858012160";https://twitter.com/RepLloydDoggett/status/871032991858012160
;2017-06-02 12:58;1;19;"Pleased to meet w/ family physicians to discuss health care & the challenges they will face w/ huge proposed state & federal Medicaid cuts. pic.twitter.com/xO11DHT2uE";;;;"870701208654172163";https://twitter.com/RepLloydDoggett/status/870701208654172163
;2017-06-02 09:29;19;28;"#TrumpBudget wants to cut @CDCgov by 17%. This means less $ to prevent diabetes and fight global health crises. https://www. statnews.com/2017/05/22/tru mp-budget-health-science/ …";;@CDCgov;#TrumpBudget;"870648606633717760";https://twitter.com/RepLloydDoggett/status/870648606633717760
;2017-06-01 16:58;46;81;"For those not sure why leaving the #ParisAgreement is a bad idea, @weatherchannel has the proof. #ActonClimate pic.twitter.com/pw0RHHVaQY";;@weatherchannel;#ParisAgreement #ActonClimate;"870399064084324352";https://twitter.com/RepLloydDoggett/status/870399064084324352
;2017-06-01 15:25;97;323;"While Trump keeps disappointing, I find hope in cities like San Antonio & Austin, which are pursuing sustainability. #ActOnClimate";;;#ActOnClimate;"870375667225038848";https://twitter.com/RepLloydDoggett/status/870375667225038848
;2017-06-01 15:06;36;98;"Trump's craven, dogma-driven decision to leave the #ParisAgreement cedes leadership on climate & renewable energy.";;;#ParisAgreement;"870371074684456962";https://twitter.com/RepLloydDoggett/status/870371074684456962
;2017-06-01 14:47;273;580;"With Trump's #ParisAgreement fail, it's clear that the swamp, not science, is running his circus. #ActOnClimate";;;#ParisAgreement #ActOnClimate;"870366100822929412";https://twitter.com/RepLloydDoggett/status/870366100822929412
;2017-06-01 14:35;65;95;"My statement on President Trump withdrawing the United States from the Paris Climate Agreement. pic.twitter.com/PFd8oDpFvm";;;;"870363256937906177";https://twitter.com/RepLloydDoggett/status/870363256937906177
;2017-06-01 14:20;0;4;"City Year often leads to lifetime of community service. We must resist Trump's efforts to terminate similar initiatives across the US.";;;;"870359455648624641";https://twitter.com/RepLloydDoggett/status/870359455648624641
;2017-06-01 14:07;6;7;"Pleased to announce ~$2mil for @CityYearSA w/ the SA delegation. At @SAISD MLK Academy & across SA, I've seen the impact they've made. pic.twitter.com/tbfKDk5798";;@CityYearSA @SAISD;;"870356230602141696";https://twitter.com/RepLloydDoggett/status/870356230602141696
;2017-06-01 12:22;12;30;"During #ImmigrantHeritageMonth , important to recognize the contributions immigrants make to our country & reject hate. #IStandWithImmigrants";;;#ImmigrantHeritageMonth #IStandWithImmigrants;"870329691852476416";https://twitter.com/RepLloydDoggett/status/870329691852476416
;2017-06-01 09:27;3;15;"I support the petition to demand FAA action & respond to @NTSB safety recs. Lockhart tragedy might have not occurred http:// news4sanantonio.com/news/local/fam ilies-of-balloon-crash-victims-petition-white-house-to-increase-oversight …";;@NTSB;;"870285680563408896";https://twitter.com/RepLloydDoggett/status/870285680563408896
;2017-05-31 18:37;5;44;"Serving tacos here with Libby’s recipe for a good cause with @MarchofDimes . pic.twitter.com/uBJ0TERTnW";;@MarchofDimes;;"870061598290972673";https://twitter.com/RepLloydDoggett/status/870061598290972673
;2017-05-31 16:17;10;16;"Trump’s #draintheswamp is more murky bait & switch by blocking efforts to disclose former lobbyists’ ethics waivers. https://www. nytimes.com/2017/05/22/us/ politics/trump-white-house-government-ethics-lobbyists.html?smprod=nytcore-iphone&smid=nytcore-iphone-share&_r=0 …";;;#draintheswamp;"870026544261079041";https://twitter.com/RepLloydDoggett/status/870026544261079041
;2017-05-31 12:57;26;40;"All the more reason to stop the carnage of #TrumpCare as Texas GOP are eager to deny other care to children. https://www. texastribune.org/2017/05/26/dis abled-childrens-therapy-funds-lost-house-yields-senate/ …";;;#TrumpCare;"869976148180127749";https://twitter.com/RepLloydDoggett/status/869976148180127749
;2017-05-31 08:26;12;21;"For #OlderAmericansMonth , I share importance of preserving Social Security & saving health care in @LaPrensa_News https:// laprensasa.com/news/editorial s/protecting-older-americans-strengthens-country/ …";;@LaPrensa_News;#OlderAmericansMonth;"869908002723201024";https://twitter.com/RepLloydDoggett/status/869908002723201024
;2017-05-30 18:44;56;96;"Think of all the good those billions could have done if they actually went to developing cures or lowering prices. https:// twitter.com/ericliptonnyt/ status/869345826346237952 …";;;;"869701033978671107";https://twitter.com/RepLloydDoggett/status/869701033978671107
;2017-05-30 16:41;97;97;"Big Pharma's excuse on price gouging went from “there is no problem" to “it’s not my fault.” @nytimes @ericliptonNYT https://www. nytimes.com/2017/05/29/hea lth/drug-lobbyists-battle-cry-over-prices-blame-the-others.html …";;@nytimes @ericliptonNYT;;"869670018958667777";https://twitter.com/RepLloydDoggett/status/869670018958667777
;2017-05-30 16:10;7;6;"As top Ed Dept financial aide officer quits due to management problems, students will pay the price: https://www. washingtonpost.com/news/grade-poi nt/wp/2017/05/24/federal-student-aid-chief-quits-warning-of-management-issues-under-devos/?utm_term=.91f508b9d80e …";;;;"869662207197532160";https://twitter.com/RepLloydDoggett/status/869662207197532160
;2017-05-30 12:53;4;24;"Grateful to meet w/ Dr. Fred Campbell & American College of Physicians to discuss impacts of skyrocketing Rx drug prices & opioid epidemic. pic.twitter.com/ecVDw27mou";;;;"869612746484199426";https://twitter.com/RepLloydDoggett/status/869612746484199426
;2017-05-30 10:48;17;24;"Trump endangers our security by literally dancing w/ Saudi Arabia, a country w/ history of supporting terrorism. http://www. cnn.com/videos/politic s/2017/05/28/fareeds-take-saudi-arabia-terrorism.cnn …";;;;"869581197374107649";https://twitter.com/RepLloydDoggett/status/869581197374107649
;2017-05-30 09:54;4;11;"Excellent @JeremiSuri #MemorialDay piece on the need for our leaders to more clearly define our national interests & priorities. https:// twitter.com/JeremiSuri/sta tus/867732249726373889 …";;@JeremiSuri;#MemorialDay;"869567677529980928";https://twitter.com/RepLloydDoggett/status/869567677529980928
;2017-05-29 19:10;1;24;"On #MemorialDay , honoring those who have made the ultimate sacrifice. @LaPrensa_News https:// laprensasa.com/news/editorial s/honoring-those-who-have-sacrificed-2/ …";;@LaPrensa_News;#MemorialDay;"869345251206541312";https://twitter.com/RepLloydDoggett/status/869345251206541312
;2017-05-29 16:25;5;46;"Thank you Cheryl Lankford for your work w/ Gold Star Wives. When vets serve, their families also go to war & make sacrifices. #MemorialDay pic.twitter.com/d2FTnv1Mkx";;;#MemorialDay;"869303648421113857";https://twitter.com/RepLloydDoggett/status/869303648421113857
;2017-05-29 12:09;21;72;"These Good Samaritans resisting hate represent the best of our country's values. @washingtonpost https://www. washingtonpost.com/news/post-nati on/wp/2017/05/27/man-fatally-stabs-2-on-portland-ore-train-after-they-interrupted-his-anti-muslim-rants-police-say/ …";;@washingtonpost;;"869239200025018370";https://twitter.com/RepLloydDoggett/status/869239200025018370
;2017-05-29 10:10;9;47;"On #MemorialDay and every day, we honor the military men and women who made the ultimate sacrifice for our freedom. pic.twitter.com/UGBPetnrrq";;;#MemorialDay;"869209221988052992";https://twitter.com/RepLloydDoggett/status/869209221988052992
;2017-05-28 19:18;30;71;"I reject state-sanctioned discrimination that puts prejudice over foster children's best interest. http://www. mystatesman.com/news/opinion/c ommentary-how-legislature-making-texas-foster-care-system-worse/aZ0Z3tOHC7oV4lJocDjylO/ …";;;;"868984974921396226";https://twitter.com/RepLloydDoggett/status/868984974921396226
;2017-05-28 11:56;3;24;"Saluting Cmdr. Gilbert Uriegas, VFW Post 1533 & all vet svc orgs. in honor of #MemorialDay tomorrow. pic.twitter.com/J45t6YjxPd";;;#MemorialDay;"868873574429413377";https://twitter.com/RepLloydDoggett/status/868873574429413377
;2017-05-27 18:02;16;38;"Recent @Gallup poll shows 84% of GOP still support Trump while only 38% of Americans as a whole do. Via @NYTimes https://www. nytimes.com/2017/05/17/us/ politics/trump-scandal-conservatives-media.html …";;@Gallup @NYTimes;;"868603368784134145";https://twitter.com/RepLloydDoggett/status/868603368784134145
;2017-05-27 12:08;19;27;"Ms. Donnellan’s @washingtonpost letter nails it. What will our grandchildren think of the GOP’s actions re Russia? https://www. washingtonpost.com/opinions/reade rs-respond-to-trumps-intelligence-disclosures-to-russia/2017/05/17/1a52321a-3a6a-11e7-a59b-26e0451a96fd_story.html?utm_term=.97e5bbff52b7 …";;@washingtonpost;;"868514257696157696";https://twitter.com/RepLloydDoggett/status/868514257696157696
;2017-05-26 22:08;107;287;"Just as during Watergate, @washingtonpost is connecting the dots & exemplifying its motto: "democracy dies in darkness." Keep the lights on. https:// twitter.com/washingtonpost /status/868241338369691648 …";;@washingtonpost;;"868302744469327873";https://twitter.com/RepLloydDoggett/status/868302744469327873
;2017-05-26 15:22;3;16;"Recently, I visited with Constable Michael Torres, our new Hays County Pct. 2 constable, and Chief Deputy Robert Eller. pic.twitter.com/iOEYCSkDE7";;;;"868200661132996613";https://twitter.com/RepLloydDoggett/status/868200661132996613
;2017-05-26 12:01;24;40;"Our economy & democracy depend on well-educated public. #TrumpBudget proposes cutting $9.2B in edu funding. #TrumpCarnage";;;#TrumpBudget #TrumpCarnage;"868149992581734401";https://twitter.com/RepLloydDoggett/status/868149992581734401
;2017-05-26 08:45;5;9;"In honor of #AAPIHeritageMonth , I support the over 158,000 TX small biz owned by AAPIs & 2mil AAPIs who gained coverage thx to #ACA .";;;#AAPIHeritageMonth #ACA;"868100659727523840";https://twitter.com/RepLloydDoggett/status/868100659727523840
;2017-05-25 14:41;33;128;"We refuse to let America turn backwards. I stand with immigrants against Trump’s discriminatory #MuslimBan . #NoBanNoWall";;;#MuslimBan #NoBanNoWall;"867828014767276033";https://twitter.com/RepLloydDoggett/status/867828014767276033
;2017-05-25 13:50;3;19;"Meeting with Austin and San Antonio area realtors to discuss home ownership issues which Congress should address. Thank you for visiting! pic.twitter.com/Wslok19ZtC";;;;"867815033857769473";https://twitter.com/RepLloydDoggett/status/867815033857769473
;2017-05-25 10:10;36;37;"#CBOScore says premiums for low-income 64-yr-olds could rise as much as 850% under #TrumpCare to outrageous $16k/yr. https://www. washingtonpost.com/news/the-fix/w p/2017/05/24/the-three-numbers-you-need-to-understand-the-cbo-report-on-republicans-health-care-bill/?utm_term=.7fd6cfb70f66 …";;;#CBOScore #TrumpCare;"867759753606426625";https://twitter.com/RepLloydDoggett/status/867759753606426625
;2017-05-24 17:11;1;9;"Thank you for your advocacy and service to your community in Texas. https:// twitter.com/sarahgcandler/ status/867448209278464002 …";;;;"867503329169084418";https://twitter.com/RepLloydDoggett/status/867503329169084418
;2017-05-24 17:02;44;84;"My statement on the #CBOscore . pic.twitter.com/Ewn9DWBnVR";;;#CBOscore;"867501139486535680";https://twitter.com/RepLloydDoggett/status/867501139486535680
;2017-05-24 16:14;159;284;"Awful #CBOScore shows why Ryan rushed #TrumpCare —not to send it to Senate but to pass b4 public knew how truly dreadful the bill is.";;;#CBOScore #TrumpCare;"867489076752117760";https://twitter.com/RepLloydDoggett/status/867489076752117760
;2017-05-24 15:57;17;38;"#CBOscore shows 23 million more people could become uninsured w/ GOP #paymoreforless bill #Trumpcare = #AmericanCarnage";;;#CBOscore #paymoreforless #Trumpcare #AmericanCarnage;"867484610686537729";https://twitter.com/RepLloydDoggett/status/867484610686537729
