username;date;retweets;favorites;text;geo;mentions;hashtags;id;permalink
;2010-10-18 15:46;1;0;"Congrats to Valor Christian High School in Highlands Ranch. 2010 #Colorado 4A boy’s golf state champs.";;;#Colorado;"27767916429";https://twitter.com/RepMikeCoffman/status/27767916429
;2010-10-18 14:25;0;0;"Great piece about Ms. Bren Wolfe & her exceptional #advocacy for adoptive parents. http://bit.ly/aa8rYY #Colorado";;;#advocacy #Colorado;"27762533194";https://twitter.com/RepMikeCoffman/status/27762533194
;2010-10-18 13:51;2;0;"Use tax cuts to grow the economy – read my op-ed in the @DenverPost : http://bit.ly/9stx9b #redco #tcot #hhrs";;@DenverPost;#redco #tcot #hhrs;"27760252981";https://twitter.com/RepMikeCoffman/status/27760252981
;2010-10-15 13:59;1;0;"6th District student Missy Franklin is in the running for the 2010 Sports Illustrated SportsKid of the Year: http://bit.ly/d19B7F";;;;"27469390500";https://twitter.com/RepMikeCoffman/status/27469390500
;2010-10-15 12:43;1;0;"Langone in the @WSJ : Stop Bashing Business, Mr. President http://bit.ly/9NCXMv";;@WSJ;;"27463825773";https://twitter.com/RepMikeCoffman/status/27463825773
;2010-10-15 12:05;0;0;"Red ink alert: federal budget deficit exceeded $1 trillion for 2nd straight year http://bit.ly/9J2nos #hhrs #tcot #gop";;;#hhrs #tcot #gop;"27460717620";https://twitter.com/RepMikeCoffman/status/27460717620
;2010-10-14 14:26;6;0;"Fed judge in FL has ruled that 20 US states can proceed w/ their lawsuit seeking to overturn ObamaCare. #hcr";;;#hcr;"27369489379";https://twitter.com/RepMikeCoffman/status/27369489379
;2010-10-14 12:26;4;0;"Medicare official: seniors may have to dig deeper into their wallets next year thanks to the health care law. http://politi.co/bV2p7Q #tcot";;;#tcot;"27361137296";https://twitter.com/RepMikeCoffman/status/27361137296
;2010-10-14 12:01;1;0;"A #Colorado hero helps rescue trapped miners in #Chile . http://bit.ly/auW4Am";;;#Colorado #Chile;"27359184095";https://twitter.com/RepMikeCoffman/status/27359184095
;2010-10-13 16:51;0;0;"I’m sending out my newsletter on Friday. Do you receive it? If not, sign up here: http://bit.ly/a6MLwY #Colorado #tcot #redco #tlot #hhrs";;;#Colorado #tcot #redco #tlot #hhrs;"27279457163";https://twitter.com/RepMikeCoffman/status/27279457163
;2010-10-13 12:59;10;0;"Today is the 235th birthday of the U.S. Navy. “Without a decisive naval force we can do nothing definitive.” – George Washington";;;;"27263747068";https://twitter.com/RepMikeCoffman/status/27263747068
;2010-10-13 12:25;0;0;"No contest. RT @daveweigel : May be willing to concede that #Colorado is prettier than Delaware.";;@daveweigel;#Colorado;"27261294148";https://twitter.com/RepMikeCoffman/status/27261294148
;2010-10-13 11:26;0;0;"RT @boblatta : @WhiteHouse reflects on "stimulus" pkg, admits GOP tax cuts should have been included http://ow.ly/2SRqK #tcot #jobs";;@boblatta @WhiteHouse;#tcot #jobs;"27256631994";https://twitter.com/RepMikeCoffman/status/27256631994
;2010-10-12 15:34;0;0;"Congrats to 6th District resident Thomas Hendershot - inducted in to the #Colorado Aviation Hall of Fame http://bit.ly/9RzZY4";;;#Colorado;"27171582147";https://twitter.com/RepMikeCoffman/status/27171582147
;2010-10-12 14:38;0;0;"Frost advisory listed for #Colorado tonight. Lows in the 30s. Might want to disconnect your hoses this afternoon.";;;#Colorado;"27167828939";https://twitter.com/RepMikeCoffman/status/27167828939
;2010-10-12 13:35;0;0;"This morning I visited Air Methods at the Centennial Airport – an EMS transport company. http://flic.kr/p/8JukHk";;;;"27163570085";https://twitter.com/RepMikeCoffman/status/27163570085
;2010-10-12 13:06;1;0;"From @WSJ : Govt making money b/c it now controls so much capital, robbing money from priv economy in the process. http://bit.ly/9316Cy";;@WSJ;;"27161631561";https://twitter.com/RepMikeCoffman/status/27161631561
;2010-10-08 15:52;2;0;"My office closed 12 constituent cases ranging from VA benefits to passport help this week. Need help? http://bit.ly/dA8YSP";;;;"26783876514";https://twitter.com/RepMikeCoffman/status/26783876514
;2010-10-08 15:42;0;0;"RT @NatResourcesGOP : #FF Natural Resources Republicans @RepFleming @RepMikeCoffman @jasoninthehouse @CynthiaLummis @RepMcClintock @DrCassidy";;@NatResourcesGOP @RepFleming @RepMikeCoffman @jasoninthehouse @CynthiaLummis @RepMcClintock @DrCassidy;#FF;"26783242961";https://twitter.com/RepMikeCoffman/status/26783242961
;2010-10-08 12:20;0;1;"This week my office helped 2 constituents w/loan mods – lowered their home loans by up to 1/3. Need help? Visit: http://bit.ly/dA8YSP";;;;"26769344276";https://twitter.com/RepMikeCoffman/status/26769344276
;2010-10-08 11:04;4;1;"Just received a call from a local dentist who’s losing his dental assoc-provided coverage due to a 47% rate increase. Repeal, replace. #hcr";;;#hcr;"26762982241";https://twitter.com/RepMikeCoffman/status/26762982241
;2010-10-08 10:58;2;0;"We’ve got snow in the #Colorado high country.";;;#Colorado;"26762415602";https://twitter.com/RepMikeCoffman/status/26762415602
;2010-10-07 15:10;1;0;"Psyched for @NBC30Rock tonight. Jack faces his big day in Congress. Sneak peak: http://bit.ly/91gvW6";;@NBC30Rock;;"26681273042";https://twitter.com/RepMikeCoffman/status/26681273042
;2010-10-07 14:27;0;0;"6th District artist finds his calling in Hollywood; now an Assistant Director for show ‘American Dad’ http://bit.ly/ddjcLr";;;;"26678472519";https://twitter.com/RepMikeCoffman/status/26678472519
;2010-10-07 12:45;3;0;"McDonald’s, Jack in the Box, 28 other companies receive ObamaCare coverage waivers http://usat.ly/aOurJE";;;;"26671741949";https://twitter.com/RepMikeCoffman/status/26671741949
;2010-10-06 15:27;0;0;"#Colorado State Parks Lifetime Pass for Seniors available Nov. 1. Info: http://bit.ly/daKtMh";;;#Colorado;"26582348844";https://twitter.com/RepMikeCoffman/status/26582348844
;2010-10-06 13:32;0;0;"Recovery.gov promised transparency, except, they forgot to disclose $162 million in stimulus funds http://usat.ly/axDFeX #tcot";;;#tcot;"26574902688";https://twitter.com/RepMikeCoffman/status/26574902688
;2010-10-06 12:32;0;0;"Conservative values can help get us back on track http://bit.ly/aEWaAj #tcot #redco #hhrs #gop";;;#tcot #redco #hhrs #gop;"26570997898";https://twitter.com/RepMikeCoffman/status/26570997898
;2010-10-06 11:22;0;0;"POLL: Dislike of healthcare law crosses party lines, 1 in 4 Dems want repeal http://drudge.tw/cxfMvS (via @Drudge_Report )";;@Drudge_Report;;"26565867116";https://twitter.com/RepMikeCoffman/status/26565867116
;2010-10-05 16:44;0;0;"Bernanke calls on Congress to limit federal spending: http://bit.ly/ccEQXR #econ #tcot #hhrs";;;#econ #tcot #hhrs;"26492883668";https://twitter.com/RepMikeCoffman/status/26492883668
;2010-10-05 16:33;0;0;"Bernanke calls on Congress to limit federal spending: http://bit.ly/ccEQXR #econ #tcot #hhrs";;;#econ #tcot #hhrs;"26492070518";https://twitter.com/RepMikeCoffman/status/26492070518
;2010-10-05 11:02;0;0;". @9newsdotcom presents Coloradans w/ 9 great drives around the state: http://bit.ly/a1PB85";;@9newsdotcom;;"26469329601";https://twitter.com/RepMikeCoffman/status/26469329601
;2010-10-04 15:49;6;0;"Coloradans will consider opting out of unconstitutional ‘ObamaCare’ mandates in Nov. http://bit.ly/d0UpvL #hcr";;;#hcr;"26394343088";https://twitter.com/RepMikeCoffman/status/26394343088
;2010-10-04 13:39;2;0;"Luskin column in today’s @WSJ : “…instant double-dip recession, starting at midnight, Dec. 31.” http://bit.ly/cAYRc8 #tcot";;@WSJ;#tcot;"26386806190";https://twitter.com/RepMikeCoffman/status/26386806190
;2010-10-04 11:04;2;0;"RT @SmallBizRepub: Small Biz Cmte Republicans want to hear from you! Share your thoughts on the economy & #smallbiz : http://bit.ly/avGK88";;@SmallBizRepub;#smallbiz;"26375580469";https://twitter.com/RepMikeCoffman/status/26375580469
;2010-10-04 10:35;3;0;"Reminder: Today is the last day to register for November’s vote in #Colorado .";;;#Colorado;"26373154600";https://twitter.com/RepMikeCoffman/status/26373154600
;2010-10-01 16:40;0;0;"Thanks for the RTs! @TweetTeaParty @MrHappy4870 @gscheide @HollyontheHill @photog357 @spearsre @dougdunfee @colorfullizard @nonsumdignus #FF";;@TweetTeaParty @MrHappy4870 @gscheide @HollyontheHill @photog357 @spearsre @dougdunfee @colorfullizard @nonsumdignus;#FF;"26117409385";https://twitter.com/RepMikeCoffman/status/26117409385
;2010-10-01 16:38;0;0;"@haleyakins Right back at you. Thank you for the support.";;@haleyakins;;"26117281227";https://twitter.com/RepMikeCoffman/status/26117281227
;2010-10-01 16:34;1;1;"@nuggetfan4life I appreciate the support AJ. Thank you.";;@nuggetfan4life;;"26117050378";https://twitter.com/RepMikeCoffman/status/26117050378
;2010-10-01 16:32;0;0;"@0402sgrl Thanks for the follow!";;@0402sgrl;;"26116908203";https://twitter.com/RepMikeCoffman/status/26116908203
;2010-10-01 16:30;1;0;"Your Questions, My Answers: What’s on your mind? Submit your questions & I’ll answer the top 3 in a video response. http://bit.ly/9hwCQK";;;;"26116785080";https://twitter.com/RepMikeCoffman/status/26116785080
;2010-10-01 14:20;0;0;"RT @RepCharlesDjou : Our national debt is more than $13 trillion, which means every man, woman and child owes $42,000: http://bit.ly/a45XUL";;@RepCharlesDjou;;"26108204066";https://twitter.com/RepMikeCoffman/status/26108204066
;2010-10-01 13:22;0;0;"A recent White House report gave the stimulus package high marks. Would you? #tcot #tlot #redco #hhrs";;;#tcot #tlot #redco #hhrs;"26104274400";https://twitter.com/RepMikeCoffman/status/26104274400
;2010-10-01 13:04;1;0;"This is wild! RT @9newsdotcom : Woman uses zucchini to fend off bear http://bit.ly/ag9fk6 #9NEWS";;@9newsdotcom;#9NEWS;"26103052710";https://twitter.com/RepMikeCoffman/status/26103052710
;2010-09-30 16:53;2;0;"Study from @ohmygov : GOP widens social media lead http://bit.ly/aJfQHl. Let’s keep it rolling.";;@ohmygov;;"26018086515";https://twitter.com/RepMikeCoffman/status/26018086515
;2010-09-30 15:56;0;0;"I’ve updated some more photos to Flickr recently. Check them out: http://bit.ly/buWxuX #tcot #redco #tlot #hhrs #gop";;;#tcot #redco #tlot #hhrs #gop;"26014085669";https://twitter.com/RepMikeCoffman/status/26014085669
;2010-09-30 14:12;0;0;"Today’s @Heritage Morning Bell: The Bipartisan Fight Against the Obama Tax Hikes http://bit.ly/9wEvM1 #hhrs #tcot";;@Heritage;#hhrs #tcot;"26007093814";https://twitter.com/RepMikeCoffman/status/26007093814
;2010-09-30 13:18;1;1;"Robison article on Bloomberg @BW : Pentagon Losing Control of Bombs to China’s Monopoly http://bit.ly/b1qlpY";;@BW;;"26003386249";https://twitter.com/RepMikeCoffman/status/26003386249
;2010-09-29 20:49;4;0;"Unbelievable. We’re leaving the American people in limbo today. Not voting on #taxes , so Dems can campaign for their jobs. #tcot #hhrs";;;#taxes #tcot #hhrs;"25938601548";https://twitter.com/RepMikeCoffman/status/25938601548
;2010-09-29 18:06;2;0;"I would direct your resentment to @SpeakerPelosi & @LeaderHoyer about voting on #taxes @hbcampbell . American people deserve a vote now.";;@SpeakerPelosi @LeaderHoyer @hbcampbell;#taxes;"25925617839";https://twitter.com/RepMikeCoffman/status/25925617839
;2010-09-29 17:40;1;0;"Today’s vote is an important step toward developing a solution to the rare earths crisis, but we must do more: http://bit.ly/c6L6QZ";;;;"25923712007";https://twitter.com/RepMikeCoffman/status/25923712007
;2010-09-29 15:34;0;0;"I spoke to the Colo. Springs Chamber of Commerce earlier today. Great folks. http://twitpic.com/2t5i98";;;;"25915061402";https://twitter.com/RepMikeCoffman/status/25915061402
;2010-09-29 10:11;0;0;"Currently in HASC; receiving testimony about DoD’s ‘efficiency initiative’ from Hon. Lynn, Hon. Carter & Gen. Cartwright.";;;;"25891376142";https://twitter.com/RepMikeCoffman/status/25891376142
;2010-09-28 15:15;1;0;"Great read: @NewYorkPost column by Stephen Meister: Building the next subprime crisis http://bit.ly/bKsYWJ (h/t @DarrellIssa )";;@NewYorkPost @DarrellIssa;;"25816412392";https://twitter.com/RepMikeCoffman/status/25816412392
;2010-09-28 13:53;4;0;"IMPORTANT: Sept. 27 – Oct. 4 is Absentee Voting Week. Those stationed overseas should visit: www.fvap.gov to get started. #mil";;;#mil;"25810619922";https://twitter.com/RepMikeCoffman/status/25810619922
;2010-09-28 11:11;2;0;"Expecting Dem leadership this week to adjourn the House until after the Nov. 2 election. Punting on tax vote. #tcot";;;#tcot;"25798564650";https://twitter.com/RepMikeCoffman/status/25798564650
;2010-09-28 10:22;3;0;"From @TheHill : Democrats to stuff 20 bills into lame-duck session http://bit.ly/9G4l2p No mention of a budget.";;@TheHill;;"25794313345";https://twitter.com/RepMikeCoffman/status/25794313345
;2010-09-27 15:04;0;0;"RT @SmallBizRepub: What #SmallBiz Cmte members are doing to help small biz - see the latest member activity: http://bit.ly/aDCBUt";;@SmallBizRepub;#SmallBiz;"25716813350";https://twitter.com/RepMikeCoffman/status/25716813350
;2010-09-27 12:49;1;0;"Have a question? Tweet yours or head over to my #Facebook acct: http://bit.ly/apxwXo. I’ll answer 3 in a video response.";;;#Facebook;"25707691150";https://twitter.com/RepMikeCoffman/status/25707691150
;2010-09-27 11:36;0;0;"MLB has changed how baseballs are removed from the humidor & monitored during games. Hope it finally silences the #Rockies critics.";;;#Rockies;"25702286975";https://twitter.com/RepMikeCoffman/status/25702286975
;2010-09-27 10:53;0;0;"A @WashTimes editorial: Furlough the feds http://bit.ly/aY4w60 #tcot #tlot";;@WashTimes;#tcot #tlot;"25698732321";https://twitter.com/RepMikeCoffman/status/25698732321
;2010-09-24 17:25;2;0;"If you still need weekend plans, tomorrow is National Public Lands Day. NPS is waiving all entrance fees. http://bit.ly/bAxkPw";;;;"25444049598";https://twitter.com/RepMikeCoffman/status/25444049598
;2010-09-24 16:53;1;0;"Honored w/2 awards this week: the NTLC “Tax Fighter Award” http://bit.ly/dxUh2u & the @NFIB “Guardian of #SmallBiz " http://bit.ly/bpF8uZ";;@NFIB;#SmallBiz;"25441867725";https://twitter.com/RepMikeCoffman/status/25441867725
;2010-09-24 15:41;1;0;"From @alexismadrigal at @TheAtlantic : Worried About China's Monopoly on Rare Elements? Restart American Production http://bit.ly/atpjgp";;@alexismadrigal @TheAtlantic;;"25437099437";https://twitter.com/RepMikeCoffman/status/25437099437
;2010-09-24 14:07;0;0;"Honoring U.S. #Army CPT Dale Goetz who made the ultimate sacrifice in service to our country http://youtu.be/X_uYacqBqJk #mil";;;#Army #mil;"25430932442";https://twitter.com/RepMikeCoffman/status/25430932442
;2010-09-24 13:44;4;0;"Help me reach 4,000 followers! Please suggest @RepMikeCoffman in your #FF lists today. Thank you for your support!";;@RepMikeCoffman;#FF;"25429443487";https://twitter.com/RepMikeCoffman/status/25429443487
;2010-09-23 14:37;0;0;"Joined the Willis Report yesterday on @FoxBusiness to discuss my fed furlough bill. Video: http://youtu.be/2tvstSHyOnU #tcot";;@FoxBusiness;#tcot;"25335462616";https://twitter.com/RepMikeCoffman/status/25335462616
;2010-09-23 12:18;0;0;"These policies in our #Pledge to America are common sense solutions that reflect our citizens’ priorities. http://bit.ly/ct6EGn";;;#Pledge;"25325962121";https://twitter.com/RepMikeCoffman/status/25325962121
;2010-09-23 09:42;3;0;"Today the House GOP unveiled the #Pledge to America. Watch the preamble: http://youtu.be/yHRMUCZgL9Q Read the Pledge: http://bit.ly/ahWct9";;;#Pledge;"25313050741";https://twitter.com/RepMikeCoffman/status/25313050741
;2010-09-22 16:59;0;0;"#namesomethingawful #Colorado #Rockies losing last 2, falling to 2.5 games back in NL West.";;;#namesomethingawful #Colorado #Rockies;"25248759933";https://twitter.com/RepMikeCoffman/status/25248759933
;2010-09-22 16:20;2;0;"#namesomethingawful “We can absorb a terrorist attack.”";;;#namesomethingawful;"25246195763";https://twitter.com/RepMikeCoffman/status/25246195763
;2010-09-22 15:52;3;0;"A national debt of $13,476,661,616,652.10. #namesomethingawful #tcot";;;#namesomethingawful #tcot;"25244387514";https://twitter.com/RepMikeCoffman/status/25244387514
;2010-09-22 15:49;2;0;"Raising taxes during a recession. #namesomethingawful #tcot";;;#namesomethingawful #tcot;"25244192771";https://twitter.com/RepMikeCoffman/status/25244192771
;2010-09-22 15:47;1;0;"Looks like #namesomethingawful is trending on Twitter right now. Let’s join in shall we?";;;#namesomethingawful;"25244103319";https://twitter.com/RepMikeCoffman/status/25244103319
;2010-09-22 14:28;0;0;"Joined CO State Rep. Joe Rice & Ryan Warner w/CPR’s @ColoradoMatters to talk about #Iraq - listen here: http://bit.ly/d1wsJP #mil";;@ColoradoMatters;#Iraq #mil;"25239073264";https://twitter.com/RepMikeCoffman/status/25239073264
;2010-09-22 12:27;3;0;"Poll: 55% of Americans say “increasing taxes on any American will slow the economy & kill jobs.” http://bit.ly/bmkrOI";;;;"25230647721";https://twitter.com/RepMikeCoffman/status/25230647721
;2010-09-22 11:41;0;0;"TODAY at 3pm MT / 5pm ET: I’m joining the Willis Report on @FoxBusiness to speak about my federal furlough bill. Tune in!";;@FoxBusiness;;"25227214127";https://twitter.com/RepMikeCoffman/status/25227214127
;2010-09-22 10:53;1;0;"The Washington Examiner supports my federal furlough bill: http://bit.ly/b56yBu @dcexaminer #tcot #tlot #redco";;@dcexaminer;#tcot #tlot #redco;"25223308347";https://twitter.com/RepMikeCoffman/status/25223308347
;2010-09-21 16:49;0;0;"IRS to hold free open house for vets and persons w/disabilities this Sat. in Denver - Info: http://bit.ly/dm3yXG";;;;"25154489980";https://twitter.com/RepMikeCoffman/status/25154489980
;2010-09-21 15:44;6;0;"From @PoliticalTicker : Jobs picture gets worse in 27 states http://bit.ly/c3H7Rq #unemployment";;@PoliticalTicker;#unemployment;"25150107989";https://twitter.com/RepMikeCoffman/status/25150107989
;2010-09-21 12:18;0;0;"Your Questions, My Answers: What’s on your mind? Submit your questions & I’ll answer the top 3 in a video response. Plz RT";;;;"25136726008";https://twitter.com/RepMikeCoffman/status/25136726008
;2010-09-21 11:17;0;0;"Joined Fox Business yesterday to talk about my federal furlough bill. Watch here: http://youtu.be/ju4iIhrjSgY #tcot #tlot";;;#tcot #tlot;"25132134995";https://twitter.com/RepMikeCoffman/status/25132134995
;2010-09-21 10:13;3;0;"VIDEO: Census managers flew to Vegas on your dime – I call that govt waste at its worst. http://youtu.be/rgiKR0__Kbc #tcot";;;#tcot;"25126985573";https://twitter.com/RepMikeCoffman/status/25126985573
;2010-09-20 17:22;0;0;"EVENT SATURDAY: U.S. Naval Academy Admissions Forum in Denver. For info: http://bit.ly/a55WKf";;;;"25063073712";https://twitter.com/RepMikeCoffman/status/25063073712
;2010-09-20 16:31;0;0;"From @9newsdotcom : Security experts cite Denver as frontline in fight against homegrown terrorism http://bit.ly/a00y3a";;@9newsdotcom;;"25059392379";https://twitter.com/RepMikeCoffman/status/25059392379
;2010-09-20 15:48;0;0;"@ricktgold Sorry about that – for ‘stimulus’ sign project: http://bit.ly/cX158G";;@ricktgold;;"25056576910";https://twitter.com/RepMikeCoffman/status/25056576910
;2010-09-20 15:09;1;0;"Rep. @DarrellIssa , I have a few ‘stimulus’ signs in CO6. This one on C470 between Yosemite & Quebec: http://twitpic.com/2qec0x";;@DarrellIssa;;"25054112275";https://twitter.com/RepMikeCoffman/status/25054112275
;2010-09-20 14:14;1;0;"TODAY: I’ll be on @FoxNews Business to discuss my federal furlough bill at 5pm MT. Tune in! @ScoreboardFox #tcot #tlot #hhrs #gop #redco";;@FoxNews @ScoreboardFox;#tcot #tlot #hhrs #gop #redco;"25050644551";https://twitter.com/RepMikeCoffman/status/25050644551
;2010-09-20 13:47;1;0;"I'm still concerned with the national security implications in this matter: http://bit.ly/aV1Xve #mil";;;#mil;"25049013902";https://twitter.com/RepMikeCoffman/status/25049013902
;2010-09-20 12:01;0;0;"By @EdatPost : Bill would furlough federal workers for 2 weeks http://bit.ly/cHEExp @washingtonpost #tcot";;@EdatPost @washingtonpost;#tcot;"25041965266";https://twitter.com/RepMikeCoffman/status/25041965266
;2010-09-20 11:30;0;0;"House GOP to unveil governing agenda this Thursday in Sterling, VA: http://bit.ly/ahJTjo #tcot #gop #tlot #redco";;;#tcot #gop #tlot #redco;"25039686529";https://twitter.com/RepMikeCoffman/status/25039686529
;2010-09-17 17:42;1;0;"Just spoke w/Ryan Warner w/CPR’s @ColoradoMatters about Iraq. I’ll post the segment when it's online. #mil";;@ColoradoMatters;#mil;"24797815358";https://twitter.com/RepMikeCoffman/status/24797815358
;2010-09-17 16:53;1;0;"For Colorado wildfire info: Elbert http://bit.ly/9mmvdV Arapahoe http://bit.ly/blmexp (part 2)";;;;"24794705683";https://twitter.com/RepMikeCoffman/status/24794705683
;2010-09-17 16:52;1;0;"For Colorado wildfire fire info: DougCo http://bit.ly/aH5V4j JeffCo http://bit.ly/9eKHkS Park http://bit.ly/dAfzF2 (part 1)";;;;"24794627650";https://twitter.com/RepMikeCoffman/status/24794627650
;2010-09-17 13:01;1;0;"POTUS just bypassed Senate confirmation process & appointed Elizabeth Warren to oversee the CFPB.";;;;"24780039185";https://twitter.com/RepMikeCoffman/status/24780039185
;2010-09-17 11:43;1;0;"Honoring Constitution Day today at my Lone Tree office: http://bit.ly/cw9tTj";;;;"24774121134";https://twitter.com/RepMikeCoffman/status/24774121134
;2010-09-16 14:38;0;0;"Intro'd a bill this week that would save the fed govt over $5.5b w/furloughs & reduced leg branch pay: http://bit.ly/cmCi0q #tcot";;;#tcot;"24691582693";https://twitter.com/RepMikeCoffman/status/24691582693
;2010-09-16 13:53;0;0;"Tomorrow: Constitution Day @my Lone Tree office: http://bit.ly/cw9tTj Plz help spread the word @DenverChannel @cbs4denver @KDVR @kwgndenver";;@my @DenverChannel @cbs4denver @KDVR @kwgndenver;;"24688688623";https://twitter.com/RepMikeCoffman/status/24688688623
;2010-09-16 13:44;0;0;"Tomorrow: Constitution Day at my Lone Tree office: http://bit.ly/cw9tTj Plz help spread the word @NEWSRADIO850KOA @KHOWDenver @9newsdotcom";;@NEWSRADIO850KOA @KHOWDenver @9newsdotcom;;"24688092093";https://twitter.com/RepMikeCoffman/status/24688092093
;2010-09-16 11:40;0;0;"Time is running out for those who qualify for Stop Loss Special Pay. Deadline is 21 Oct. http://bit.ly/c7BrKU #mil";;;#mil;"24679368801";https://twitter.com/RepMikeCoffman/status/24679368801
;2010-09-16 10:52;1;0;"Henninger column in today’s@WSJ: ‘It’s the Spending, Stupid” http://bit.ly/axJPy9 #econ #tcot";;@WSJ;#econ #tcot;"24675540493";https://twitter.com/RepMikeCoffman/status/24675540493
;2010-09-16 10:25;1;0;"Today’s #YouCut vote would save $1billion by req. the collection of unpaid taxes from federal employees. Watch live: http://cs.pn/8uM0FW";;;#YouCut;"24673246152";https://twitter.com/RepMikeCoffman/status/24673246152
;2010-09-15 18:11;1;0;"Pick up your free copy of the Constitution & meet my staff this Friday to mark Constitution Day: http://bit.ly/cw9tTj";;;;"24611878868";https://twitter.com/RepMikeCoffman/status/24611878868
;2010-09-15 14:29;0;0;"Looking for floor speeches or Washington Journal video archives? You can view it all on @CSPAN : http://cs.pn/ddtdQq";;@CSPAN;;"24597256244";https://twitter.com/RepMikeCoffman/status/24597256244
;2010-09-15 11:45;2;0;"In response to Sen. Reid’s plan to add the DREAM Act to Defense Authorization: http://bit.ly/beaKqW #immigration #mil #tcot";;;#immigration #mil #tcot;"24586004760";https://twitter.com/RepMikeCoffman/status/24586004760
;2010-09-15 11:04;0;0;"Just finished a briefing at HASC on Hezbollah, Hamas & similar organizations in the Middle East & U.S. efforts to counter them.";;;;"24582662427";https://twitter.com/RepMikeCoffman/status/24582662427
;2010-09-15 10:42;0;0;"RT @Heritage : Must-read Morning Bell! An Obamacare and Obama tax hike double whammy is hitting America's seniors. http://herit.ag/tfI";;@Heritage;;"24580847676";https://twitter.com/RepMikeCoffman/status/24580847676
;2010-09-14 17:48;0;0;"There are 19 bills scheduled for the House tomorrow: http://bit.ly/cX8aXC";;;;"24515693961";https://twitter.com/RepMikeCoffman/status/24515693961
;2010-09-14 12:27;2;0;"I will do everything I can to stop your taxes from increasing. So will @Senate_GOPs : http://bit.ly/aoeRGf #tcot #smallbiz";;@Senate_GOPs;#tcot #smallbiz;"24494694428";https://twitter.com/RepMikeCoffman/status/24494694428
;2010-09-14 11:07;1;0;"2010 US deficit on pace to reach $1.3 trillion - http://b.globe.com/bmteKi (via @BostonUpdate ) #tcot #econ";;@BostonUpdate;#tcot #econ;"24488324318";https://twitter.com/RepMikeCoffman/status/24488324318
;2010-09-14 10:19;4;0;"My GOP colleagues and I have requested a Nat Resources Cmte hearing on dangerous federal lands near southern border http://bit.ly/ahZtsd";;;;"24484339804";https://twitter.com/RepMikeCoffman/status/24484339804
;2010-09-13 17:55;0;0;"The House returns from the August recess tomorrow. What do you think should take legislative priority? http://bit.ly/crp7PO";;;;"24422345440";https://twitter.com/RepMikeCoffman/status/24422345440
;2010-09-13 16:54;1;0;"From @TheHill : Tension as #Defense bill's fate in limbo: http://bit.ly/cm2U5f #mil";;@TheHill;#Defense #mil;"24418175923";https://twitter.com/RepMikeCoffman/status/24418175923
;2010-09-13 16:26;0;0;"Economic security and national security are one in the same. I advocate for a balanced budget: http://bit.ly/bVKzDY #tcot";;;#tcot;"24416362043";https://twitter.com/RepMikeCoffman/status/24416362043
;2010-09-13 15:27;3;0;"RT @GOPLeader Attn @presssec : Republicans are unified: to boost our economy, we need to stop ALL tax hikes and cut spending now.";;@GOPLeader @presssec;;"24412651128";https://twitter.com/RepMikeCoffman/status/24412651128
;2010-09-13 12:56;1;0;"Don’t raise taxes during a recession. What tax increase has ever created a job? http://bit.ly/cNb8pu #jobs #econ #tcot";;;#jobs #econ #tcot;"24403256401";https://twitter.com/RepMikeCoffman/status/24403256401
