username;date;retweets;favorites;text;geo;mentions;hashtags;id;permalink
;2013-09-10 09:48;2;0;"Work from One Wisconsin inspired bill MT @onewisconsinnow Pocan refinancing bill could do a lot to reduce #studentloan #trilliondollardebt";;@onewisconsinnow;#studentloan #trilliondollardebt;"377443521491267584";https://twitter.com/repmarkpocan/status/377443521491267584
;2013-09-09 16:46;0;0;"Like me on Facebook, & check out photos from my travels across south central #WI this August and September https://www. facebook.com/media/set/?set =a.521279224618489.1073741839.436881033058309&type=1 …";;;#WI;"377186370403332096";https://twitter.com/repmarkpocan/status/377186370403332096
;2013-09-09 14:01;2;0;"From @MadDanWSJ w/ @WiStateJournal : Pocan bill could shrink student loan debt http:// host.madison.com/wsj/news/local /education/on_campus/on-campus-pocan-bill-could-shrink-student-loan-debt/article_c0873fad-0c4f-5219-8451-da7c2cecaa22.html …";;@MadDanWSJ @WiStateJournal;;"377144744033255424";https://twitter.com/repmarkpocan/status/377144744033255424
;2013-09-06 16:55;2;2;"Watch @WKOW tonight to see my interview w/ @anoggle_wkow on why I cannot support current resolution to authorize #Syria military strike";;@WKOW @anoggle_wkow;#Syria;"376101365728030720";https://twitter.com/repmarkpocan/status/376101365728030720
;2013-09-06 12:41;2;1;"Meeting w/ employees of @TheSwissColony in Monroe, taking questions and updating them on my work in DC for #WI pic.twitter.com/u32Py6Zi15";;@TheSwissColony;#WI;"376037566966792192";https://twitter.com/repmarkpocan/status/376037566966792192
;2013-09-06 11:10;2;1;"About to tour @JackLinks in New Glarus. Home to 450 employees. peppered beef steak still my favorite. pic.twitter.com/wvcJoEDobn";;@JackLinks;;"376014623360565248";https://twitter.com/repmarkpocan/status/376014623360565248
;2013-09-05 16:55;8;2;"ICYMI: Catch my interview w/ @edshow on why I cannot support current proposal for military action in #Syria http://www. youtube.com/watch?v=W9y_-F OuGGg&feature=youtu.be …";;@edshow;#Syria;"375738953128607745";https://twitter.com/repmarkpocan/status/375738953128607745
;2013-09-05 15:59;0;0;"Catch me on @msnbc in 5 min talking to @edshow on what I'm hearing from constituents on #Syria . @WeGotEd";;@msnbc @edshow @WeGotEd;#Syria;"375724883604283392";https://twitter.com/repmarkpocan/status/375724883604283392
;2013-09-05 13:46;5;0;"Sara shared her story on how her student loan debt impacts her ability to support her 3 kids, afford home, car pic.twitter.com/8WJ9S9RdEY";;;;"375691442259103744";https://twitter.com/repmarkpocan/status/375691442259103744
;2013-09-05 13:41;7;3;"At @UWMadison to intro bill to allow students to refinance student loans to lowest avail rate #collegeaffordability pic.twitter.com/TedcZE0Ozf";;@UWMadison;#collegeaffordability;"375690166452514816";https://twitter.com/repmarkpocan/status/375690166452514816
;2013-09-05 12:04;2;0;"About to talk with @edshow on #Syria . Hope you can listen in. http:// tunein.com/radio/The-Ed-S chultz-Show-p20211/ …";;@edshow;#Syria;"375665742936825856";https://twitter.com/repmarkpocan/status/375665742936825856
;2013-09-05 08:46;2;0;"Early morning w/ Middleton Chamber of Commerce, speaking on how my office can help #smbiz in south central #WI pic.twitter.com/FNzmGYBJbp";;;#smbiz #WI;"375615945617977344";https://twitter.com/repmarkpocan/status/375615945617977344
;2013-09-04 18:10;3;2;"Congrats to Kathleen Falk of Dane County, the new Region V Director for @HHSGov --excited to see you bring your skills & talent to new role!";;@HHSGov;;"375395493313908738";https://twitter.com/repmarkpocan/status/375395493313908738
;2013-09-04 14:43;6;0;"Great news for #Equality ! @DOJ announces spouses of gay veterans to receive benefits they deserve http://www. huffingtonpost.com/2013/09/04/tit le-38-gay-veterans_n_3867941.html?utm_hp_ref=politics …";;@DOJ;#Equality;"375343340427816961";https://twitter.com/repmarkpocan/status/375343340427816961
;2013-09-04 11:41;2;0;"Watch my interview w/ @WISCTV_News3 on my latest thoughts on #Syria : http:// video.channel3000.com/watch.php?id=5 2832 … Bottom line: should be international response";;@WISCTV_News3;#Syria;"375297598577336321";https://twitter.com/repmarkpocan/status/375297598577336321
;2013-09-03 17:21;4;4;"Ran into @BeckyBlank at @LGBTCC welcome event. Proud to be a Badger! @UWMadison #OnWisconsin pic.twitter.com/a1wQy5kwGl";;@BeckyBlank @LGBTCC @UWMadison;#OnWisconsin;"375020727856291841";https://twitter.com/repmarkpocan/status/375020727856291841
;2013-09-03 16:48;0;2;"Helping to serve ice cream to @UWMadison students at #LGBT Campus Center welcome event! pic.twitter.com/iTWjUux0lG";;@UWMadison;#LGBT;"375012502134083584";https://twitter.com/repmarkpocan/status/375012502134083584
;2013-09-03 11:32;4;2;"Check out my letter in today's @nytimes on why my #RightToVote amendment is best protection for voting rights http://www. nytimes.com/2013/09/03/opi nion/to-protect-voting-rights.html?_r=0 …";;@nytimes;#RightToVote;"374932933322096640";https://twitter.com/repmarkpocan/status/374932933322096640
;2013-09-02 10:35;9;5;"Proud to be a part of organized labor & #wiunion family; look forward to celebrating #LaborDay today at #LaborFest in Janesville & Madison";;;#wiunion #LaborDay #LaborFest;"374556309653168129";https://twitter.com/repmarkpocan/status/374556309653168129
;2013-09-01 16:26;3;0;"Need to engage the international community to find the appropriate response for #Syria , requires broader discussion http:// 1.usa.gov/14bBiBV";;;#Syria;"374282103984111616";https://twitter.com/repmarkpocan/status/374282103984111616
;2013-09-01 16:24;21;5;"In DC 4 emergency #Syria briefing-Not convinced compelling national security interest for attack largely born by US http:// 1.usa.gov/14bBiBV";;;#Syria;"374281685363212288";https://twitter.com/repmarkpocan/status/374281685363212288
;2013-08-31 14:36;7;0;"Headed to DC tomorrow for classified #Syria briefing. What info do you want to know as Congress prepares to debate any role US should take?";;;#Syria;"373892017031774208";https://twitter.com/repmarkpocan/status/373892017031774208
;2013-08-31 12:31;1;1;"RT “ @AFLCIO : Together we are more powerful than we are alone. RT if you’re a proud #unionmember this #LaborDay !”";;@AFLCIO;#unionmember #LaborDay;"373860548854960128";https://twitter.com/repmarkpocan/status/373860548854960128
;2013-08-30 11:30;1;0;"Headed to Iowa County Fair this afternoon! What should I eat while I'm there? #iowacountyfair13";;;#iowacountyfair13;"373482832783368192";https://twitter.com/repmarkpocan/status/373482832783368192
;2013-08-29 15:38;4;3;"I applaud @USTreasury 4 siding w/ #equality & treating all married couples, including my husband & me, the same http:// 1.usa.gov/1dv5f3P #LGBT";;@USTreasury;#equality #LGBT;"373182775005700097";https://twitter.com/repmarkpocan/status/373182775005700097
;2013-08-29 14:17;1;1;"Proud to sign on MT @RepBarbaraLee 53 Members joined my letter to @whitehouse calling 4 full congressional debate on #Syria";;@RepBarbaraLee @whitehouse;#Syria;"373162527326076929";https://twitter.com/repmarkpocan/status/373162527326076929
;2013-08-29 12:57;0;0;"Check out @gazettextra story on how my office was able to help Footville acquire phones through @FCC Lifeline program http:// gazettextra.com/article/201308 28/ARTICLES/130829688 …";;@gazettextra @FCC;;"373142459108163585";https://twitter.com/repmarkpocan/status/373142459108163585
;2013-08-29 11:00;1;2;"Any decision to engage in a military response in #Syria must be done in consultation with & approval of Congress http:// 1.usa.gov/17oIgAx";;;#Syria;"373112925197565952";https://twitter.com/repmarkpocan/status/373112925197565952
;2013-08-29 10:20;0;0;"Had great time sitting down with Tom Demmin of WRDB & chatting about my visit to Reedsburg earlier this week. pic.twitter.com/RrPLIwYTu2";;;;"373102769705459712";https://twitter.com/repmarkpocan/status/373102769705459712
;2013-08-29 07:15;0;0;"I'm on with @JoyCardinShow now. Listen in and call in with your questions! http://www. wpr.org/webcasting/liv e.cfm …";;@JoyCardinShow;;"373056390454980609";https://twitter.com/repmarkpocan/status/373056390454980609
;2013-08-28 16:47;0;2;"Excited to head to Madison Black Chamber of Commerce Relaunch @MononaTerrace tonight. All our sm biz create economic opportunities for #WI";;@MononaTerrace;#WI;"372837878050463744";https://twitter.com/repmarkpocan/status/372837878050463744
;2013-08-28 13:37;4;2;"50 yrs after #marchonwashington , threats to voting rights remain. Why I have intro'd #RightToVote amendment to protect all Americans";;;#marchonwashington #RightToVote;"372790118102228992";https://twitter.com/repmarkpocan/status/372790118102228992
;2013-08-28 13:28;3;2;"The efforts to live up to Dr. King’s call to “make real the promises of democracy” continue #MOW50 #MarchOnWashington http:// 1.usa.gov/17hRP86";;;#MOW50 #MarchOnWashington;"372787863089201152";https://twitter.com/repmarkpocan/status/372787863089201152
;2013-08-28 12:59;1;0;"I had great visit to Sauk County yesterday. Read about it in the @News_Republic article by @WisKidReporter http://www. wiscnews.com/baraboonewsrep ublic/news/local/article_f96ebdd8-f35b-5670-9cd3-b4a8cbe84172.html …";;@News_Republic @WisKidReporter;;"372780560235499520";https://twitter.com/repmarkpocan/status/372780560235499520
;2013-08-28 09:41;0;0;"Speaking w/ @fredhochberg right before @EximBankUS Exporter Forum on how #MadeInWI products sought after across globe pic.twitter.com/EJdiyclJ98";;@fredhochberg @EximBankUS;#MadeInWI;"372730692280414209";https://twitter.com/repmarkpocan/status/372730692280414209
;2013-08-28 08:47;2;2;"My exporter forum w/ @EximBankUS & @fredhochberg is about to start in Madison. Excited for sm biz to learn how to attract foreign customers";;@EximBankUS @fredhochberg;;"372717197228924928";https://twitter.com/repmarkpocan/status/372717197228924928
;2013-08-27 15:45;2;1;"Great visit to Lakeside Foods in Reedsburg, thanks for the tour! pic.twitter.com/KIEKyYUu9D";;;;"372459829530341376";https://twitter.com/repmarkpocan/status/372459829530341376
;2013-08-27 15:00;2;0;"Sign up: http:// 1.usa.gov/14gpTyV MT @ThePeoplesMicWI Pocan discusses his “Exporter Forum” to expand #WI jobs http:// bit.ly/182fBBn";;@ThePeoplesMicWI;#WI;"372448662296608769";https://twitter.com/repmarkpocan/status/372448662296608769
;2013-08-27 14:09;0;0;"Touring Al Ringling Theatre restoration work w/ Executive Director Brian Heller--America's Prettiest Playhouse! pic.twitter.com/TUJxyzY8Wk";;;;"372435619323969536";https://twitter.com/repmarkpocan/status/372435619323969536
;2013-08-27 13:44;0;0;"At Badger Army Ammunition Plant with Joan Kenney, Commander’s Representative, in #Baraboo pic.twitter.com/6wn6tonznf";;;#Baraboo;"372429549968965632";https://twitter.com/repmarkpocan/status/372429549968965632
;2013-08-27 10:22;1;3;"Excited to head to Sauk County today, tour local businesses, and see America's Prettiest Playhouse!";;;;"372378546947096576";https://twitter.com/repmarkpocan/status/372378546947096576
;2013-08-27 09:52;3;0;"Great meeting with @WisLGBTChamber last night. Our biz owners are backbone of our #WI economy pic.twitter.com/ovE4BALPdK";;@WisLGBTChamber;#WI;"372371012479758337";https://twitter.com/repmarkpocan/status/372371012479758337
;2013-08-26 16:51;1;0;"At 5pm CT, I'll be calling into the @ThePeoplesMicWI . Listen in: http://www. iheart.com/live/2665/?aut oplay=true …";;@ThePeoplesMicWI;;"372114179009683456";https://twitter.com/repmarkpocan/status/372114179009683456
;2013-08-26 15:42;5;1;"Today as we honor #WomensEqualityDay & anniversary of 19th amendment, we continue to fight to ensure all women have opportunity to succeed";;;#WomensEqualityDay;"372096759209529344";https://twitter.com/repmarkpocan/status/372096759209529344
;2013-08-26 10:55;0;0;"Thank YOU Abigail for your hard work & inspiration! MT @AbbeysUpNotDown Thank you to all the great advocates involved in @dsbltpridemsn !";;@AbbeysUpNotDown @dsbltpridemsn;;"372024416638484481";https://twitter.com/repmarkpocan/status/372024416638484481
;2013-08-26 09:50;0;0;"Biz owners-Sign up up for Wed Exporter Forum w/ @EximBankUS in Madison. Great resource to grow your foreign sales http:// pocan.house.gov/about/events/a ugust-28-pocan-to-host-exporter-forum-for-wisconsin-small-businesses-with-export …";;@EximBankUS;;"372008273487998976";https://twitter.com/repmarkpocan/status/372008273487998976
;2013-08-23 14:49;4;2;"Thousands in DC this week for 50th anniversary of #MarchOnWashington . As we mark historic event, we continue to work toward full equality";;;#MarchOnWashington;"370996145058639872";https://twitter.com/repmarkpocan/status/370996145058639872
;2013-08-23 13:35;1;1;"Program Alert-Make sure to catch friend Abigail on TVW at 11am Sat as the youth host from Madison's Disability Pride pic.twitter.com/IL1TVN7DCt";;;;"370977689181507584";https://twitter.com/repmarkpocan/status/370977689181507584
;2013-08-23 11:21;2;1;"Proud that @BarackObama recognized innovation happening at @UWSystem yesterday http:// host.madison.com/wsj/ap/nationa l/obama-proposes-new-system-for-rating-colleges-with-a-nod/article_6e6e2250-cc30-5218-8dac-8bfe48ed9c6b.html …";;@BarackObama @UWSystem;;"370943801285566464";https://twitter.com/repmarkpocan/status/370943801285566464
;2013-08-22 12:26;1;1;"Biz Owners: Sign up for my exporter forum w/ @EximBankUS on Wed in Madison to learn how to grow your foreign sales http:// pocan.house.gov/media-center/p ress-releases/august-28-pocan-to-host-exporter-forum-for-wisconsin-small-businesses …";;@EximBankUS;;"370597791992528896";https://twitter.com/repmarkpocan/status/370597791992528896
;2013-08-20 11:21;3;1;"#WI Biz Owners: Hosting Exporter Forum w/ @fredhochberg & @EximBankUS in Madison on Aug. 28. Sign up here: http:// 1.usa.gov/14gpTyV #MadeInWI";;@fredhochberg @EximBankUS;#WI #MadeInWI;"369856728008892416";https://twitter.com/repmarkpocan/status/369856728008892416
;2013-08-20 10:52;0;0;"Congrats to @edshow on move to 5PM on weekdays! Look forward to catching the new show. You're always welcome in #WI !";;@edshow;#WI;"369849552284549122";https://twitter.com/repmarkpocan/status/369849552284549122
;2013-08-16 14:55;5;1;"Congrats to the 3 Madison hospitals named some of most LGBT-Friendly Hospitals In the Nation by @HRC http://www. advocate.com/health/2013/07 /11/these-are-most-lgbt-friendly-hospitals-nation?page=0,46 …";;@HRC;;"368460949012754433";https://twitter.com/repmarkpocan/status/368460949012754433
;2013-08-16 11:26;3;1;"Congrats to @UWMadison researchers on $2M grant to improve our nation's cybersecurity http:// pocan.house.gov/media-center/p ress-releases/pocan-announces-2-million-cybersecurity-grant-for-uw-madison …";;@UWMadison;;"368408500335935488";https://twitter.com/repmarkpocan/status/368408500335935488
;2013-08-15 11:02;2;2;"Congrats to #Beloit -one of the great Main Streets in the US! http://www. travelandleisure.com/articles/ameri cas-greatest-main-streets/17 …";;;#Beloit;"368039961796153344";https://twitter.com/repmarkpocan/status/368039961796153344
;2013-08-15 09:07;2;1;"Headed to Oakwood Village to speak with seniors on my commitment to protecting #Medicare & #SocialSecurity";;;#Medicare #SocialSecurity;"368010981055557633";https://twitter.com/repmarkpocan/status/368010981055557633
;2013-08-14 18:06;2;1;"Happy 78th Bday Social Security-->to celebrate, I will do all I can to strengthen program, not cut benefits 4 those who can least afford it";;;;"367784215464513536";https://twitter.com/repmarkpocan/status/367784215464513536
;2013-08-14 13:52;0;1;"@kevinjk Happy Birthday Kevin!";;@kevinjk;;"367720390996402176";https://twitter.com/repmarkpocan/status/367720390996402176
;2013-08-14 13:36;1;0;"Fantastic news for all those who defend US: @NBCNews Pentagon announces same-sex spouse benefits for military couples http:// usnews.nbcnews.com/_news/2013/08/ 14/20024025-pentagon-announces-same-sex-spouse-benefits-for-military-couples?lite …";;@NBCNews;;"367716422849282048";https://twitter.com/repmarkpocan/status/367716422849282048
;2013-08-14 10:49;1;2;"Thank you! Thrilled to celebrate at home in Madison! MT @mmckeefry Happy Birthday to my Congressman, @repmarkpocan !! #howwillyoucelebrate";;@mmckeefry @repmarkpocan;#howwillyoucelebrate;"367674461304020992";https://twitter.com/repmarkpocan/status/367674461304020992
;2013-08-14 10:36;10;1;"Congress should do all we can to decrease, not increase, hunger in US. Urging @SpeakerBoehner to fully support #SNAP http:// 1.usa.gov/14LHx03";;@SpeakerBoehner;#SNAP;"367671067856220160";https://twitter.com/repmarkpocan/status/367671067856220160
;2013-08-13 13:59;2;0;"New laws in #NC let elected officials choose their voters, not other way around. We need #RightToVote amendment http://www. newsobserver.com/2013/08/12/310 2133/mccrory-signs-voter-id-bill.html …";;;#NC #RightToVote;"367359816819146752";https://twitter.com/repmarkpocan/status/367359816819146752
;2013-08-02 15:14;1;1;"Calling into @SolidaritySly . Listen in! http://www. wekz.com/Streaming.html";;@SolidaritySly;;"363392311847161856";https://twitter.com/repmarkpocan/status/363392311847161856
;2013-08-02 14:45;3;1;"And if enough people like my photo on Facebook, I'll post a video of one of my magic tricks https://www. facebook.com/repmarkpocan?h c_location=timeline …";;;;"363385199507148800";https://twitter.com/repmarkpocan/status/363385199507148800
;2013-08-02 14:28;1;1;"For my summer interns' last day, I performed short magic show for them. Thanks for all your hard work & dedication! pic.twitter.com/nZaWdMkHOe";;;;"363380734959968256";https://twitter.com/repmarkpocan/status/363380734959968256
;2013-08-02 10:12;35;9;"Last day in DC for 5wks. Am I voting on jobs? budget? Nope--40th vote to repeal #ACA . Simply unacceptable. http:// 1.usa.gov/11zzteA";;;#ACA;"363316327596830722";https://twitter.com/repmarkpocan/status/363316327596830722
;2013-08-02 09:13;8;3;"MT @CharlesBurd Joining @TrueColorsFund applauding new bill spnsrd by @RepGwenMoore & Rep. Pocan; RHYA aims to protect homeless #LGBT youth";;@CharlesBurd @TrueColorsFund @RepGwenMoore;#LGBT;"363301653144813570";https://twitter.com/repmarkpocan/status/363301653144813570
;2013-08-02 08:45;2;0;"Economy added 162K new #jobs last month, but with unemployment in #WI at 6.8%, more work to do. 40th vote to repeal #ACA does not equal work";;;#jobs #WI #ACA;"363294544986521602";https://twitter.com/repmarkpocan/status/363294544986521602
;2013-08-01 17:13;3;0;"Proud to intro bill w/ @RepGwenMoore to support #LGBT youth, who are disproportionately at-risk to be homeless http:// pocan.house.gov/media-center/p ress-releases/mark-pocan-and-gwen-moore-introduce-runaway-and-homeless-youth-inclusion …";;@RepGwenMoore;#LGBT;"363060010751754240";https://twitter.com/repmarkpocan/status/363060010751754240
;2013-08-01 13:57;0;2;"Congrats to Madison’s Stratatech on its $47M @HHSGov grant for health care innovation & development in #WI http:// host.madison.com/wsj/business/s tratatech-lands-a-major-government-contract-worth-up-to-million/article_e03718ed-4e5d-50ae-b3f5-211369dc35aa.html …";;@HHSGov;#WI;"363010618241978368";https://twitter.com/repmarkpocan/status/363010618241978368
;2013-08-01 13:23;22;9;"RT @whitehouse It's time to raise the minimum wage because nobody who works full-time should live in poverty pic.twitter.com/a6Ilx96jIl";;@whitehouse;;"363001999127617537";https://twitter.com/repmarkpocan/status/363001999127617537
;2013-08-01 09:57;1;1;"Read my piece for Gay Military Signal on how we can honor our heroes through my Restore Honor to Service Members Act http://www. gaymilitarysignal.com/1308Pocan.html";;;;"362950155017785347";https://twitter.com/repmarkpocan/status/362950155017785347
;2013-07-31 18:11;13;2;"Today's #studentloan bill means relief now, but it worsens problem in future;We must make college affordable 4 all http:// 1.usa.gov/15wwVi5";;;#studentloan;"362712131503800321";https://twitter.com/repmarkpocan/status/362712131503800321
;2013-07-31 15:35;5;1;". @JimPressOffice & I don't agree on everything, but we both believe we should staunchly defend the #RightToVote http://www. usatoday.com/story/opinion/ 2013/07/31/voting-rights-supreme-court-sensenbrenner-column/2599525/ …";;@JimPressOffice;#RightToVote;"362672804077895682";https://twitter.com/repmarkpocan/status/362672804077895682
;2013-07-31 13:45;5;0;"Now: Asking @sr_simone about how we can break down barriers to connecting people w/ jobs & importance of #SNAP in @HouseBudgetDems hearing";;@sr_simone @HouseBudgetDems;#SNAP;"362645252923863040";https://twitter.com/repmarkpocan/status/362645252923863040
;2013-07-31 11:46;1;0;"Watch now: In @HouseBudgetDems hearing on the War on Poverty http:// democrats.budget.house.gov/hearing/war-po verty-progress-report …";;@HouseBudgetDems;;"362615191151710209";https://twitter.com/repmarkpocan/status/362615191151710209
;2013-07-31 10:29;4;5;"Just left meeting w/ @BarackObama on supporting middle class through job growth. Then we sang him Happy Bday. #POTUS pic.twitter.com/LC6dbZ9zdC";;@BarackObama;#POTUS;"362595965212950528";https://twitter.com/repmarkpocan/status/362595965212950528
;2013-07-31 09:52;1;0;"Come out to 101 Albion St from 11am-1pm to meet w/ my staff MT @DaneVarese Edgerton Library for office hrs on behalf of @repmarkpocan in am";;@DaneVarese @repmarkpocan;;"362586493564366848";https://twitter.com/repmarkpocan/status/362586493564366848
;2013-07-31 09:35;0;0;"Look forward to your tweets! RT @BarneyFrank I once said I did not intend to Tweet. As you can tell from reading this, I changed my mind.";;@BarneyFrank;;"362582341736071171";https://twitter.com/repmarkpocan/status/362582341736071171
;2013-07-31 09:07;4;0;"Good news 4 US workers: #NLRB has full board of Senate-approved members for 1st time in decade;NLRB critical to guard workplace protections";;;#NLRB;"362575247595159554";https://twitter.com/repmarkpocan/status/362575247595159554
;2013-07-30 14:03;1;1;"Priority for #WI & me MT @healthylakes Rep. Pocan restore funding for #GreatLakes . 30mil who rely on them for drinking water will thank you";;@healthylakes;#WI #GreatLakes;"362287397871960065";https://twitter.com/repmarkpocan/status/362287397871960065
;2013-07-30 13:24;4;0;"Today we celebrate 48th anniversary of #Medicare & #Medicaid . Read my blog on defending this important promise http:// pocan.house.gov/media-center/b log-posts/48-years-of-medicare …";;;#Medicare #Medicaid;"362277474689748992";https://twitter.com/repmarkpocan/status/362277474689748992
;2013-07-30 12:26;2;0;"Listen live: At 12:30CT/1:30ET, I'll talk with @WeGotEd about need to invest in infrastructure. http:// tunein.com/radio/The-Ed-S chultz-Show-p20211/ … @edshow";;@WeGotEd @edshow;;"362263051593973761";https://twitter.com/repmarkpocan/status/362263051593973761
;2013-07-30 10:19;11;2;"Proud to stand w/ #Dream9 . 32 colleagues & I urging #Obama to take action. RT if you are with us #BringThemHome http:// bit.ly/13q8rUD";;;#Dream9 #Obama #BringThemHome;"362230886160277504";https://twitter.com/repmarkpocan/status/362230886160277504
;2013-07-29 16:16;3;1;"Video: I stopped by @WKOW Capitol City Sunday this weekend to speak about my bill to restore honor to gay #veterans . https://www. youtube.com/watch?v=_C6Z4o dBtUg …";;@WKOW;#veterans;"361958340991008768";https://twitter.com/repmarkpocan/status/361958340991008768
;2013-07-29 13:06;0;0;"Court/public/Constitution all support #Equality MT @JesseRodriguez Gallup-Majority would back gay marriage referendum http:// thehill.com/blogs/blog-bri efing-room/news/314031-gallup-majority-would-back-gay-marriage-referendum …";;@JesseRodriguez;#Equality;"361910533286408193";https://twitter.com/repmarkpocan/status/361910533286408193
;2013-07-29 09:52;2;2;"Ran into 8yo Abigail at Disability Pride Madison. She inspires me w/ her energy, determination, & pride! pic.twitter.com/j8VhyU7S6O";;;;"361861725257072641";https://twitter.com/repmarkpocan/status/361861725257072641
;2013-07-28 09:05;5;2;"Catch me on @WKOW Capitol City Sunday this morning with @gneumann_wkow speaking on my new bill to restore honor to gay #veterans";;@WKOW @gneumann_wkow;#veterans;"361487650571550720";https://twitter.com/repmarkpocan/status/361487650571550720
;2013-07-26 16:30;3;0;"Excited to attend tomorrow! MT @wibpdd Come to Madison this weekend for Disability Pride Festival! http:// ow.ly/n1ooD";;@wibpdd;;"360874800740179968";https://twitter.com/repmarkpocan/status/360874800740179968
;2013-07-26 12:42;1;0;"MT @gneumann_wkow Great Capitol City Sunday this weekend. @repmarkpocan joins me to talk DC.";;@gneumann_wkow @repmarkpocan;;"360817344953585664";https://twitter.com/repmarkpocan/status/360817344953585664
;2013-07-26 11:15;12;2;"Applaud @TheJusticeDept decision to challenge state laws meant to suppress voting. We need a #RightToVote amendment http://www. washingtonpost.com/politics/justi ce-department-to-challenge-states-voting-rights-laws/2013/07/25/c26740b2-f49b-11e2-a2f1-a7acf9bd5d3a_story.html …";;@TheJusticeDept;#RightToVote;"360795584656982017";https://twitter.com/repmarkpocan/status/360795584656982017
;2013-07-25 16:11;0;0;"Cheese curds=perfect food MT @RepLujanGrisham #NM chile beats MD crabs & WI cheese curds in @USATODAY best food list http:// ow.ly/nk3Iz";;@RepLujanGrisham @USATODAY;#NM;"360507592667176960";https://twitter.com/repmarkpocan/status/360507592667176960
;2013-07-25 12:47;7;1;"No gay veteran should be discouraged from having record upgraded to reflect honorable service. Our bill ensures we recognize all who serve";;;;"360456309017018370";https://twitter.com/repmarkpocan/status/360456309017018370
;2013-07-25 12:45;0;0;"Our Restore Honor to Service Members Act finally closes the book on the dark chapter of our history known as #DADT http:// 1.usa.gov/12mHSEO";;;#DADT;"360455784871632896";https://twitter.com/repmarkpocan/status/360455784871632896
