username;date;retweets;favorites;text;geo;mentions;hashtags;id;permalink
;2015-12-08 16:33;9;17;"Proud that Wisconsin is rated #3 in volunteering across the country. #GoVolunteer now: http:// 1.usa.gov/1SzKIM9 pic.twitter.com/GCA4YHVtiu";;;#3 #GoVolunteer;"674356257826996224";https://twitter.com/repmarkpocan/status/674356257826996224
;2015-12-08 10:32;1;7;"Proud of Mount Horeb Board's decision to provide an environment where students are treated with dignity & respect. https:// twitter.com/WiStateJournal /status/674260313395453952 …";;;;"674265183720751105";https://twitter.com/repmarkpocan/status/674265183720751105
;2015-12-03 07:36;5;3;"Joining @bpshow this morning to discuss news of the day. pic.twitter.com/mAIadr7AdY";;@bpshow;;"672409079818625024";https://twitter.com/repmarkpocan/status/672409079818625024
;2015-12-02 17:17;5;4;"Watch my floor statement in support of the Every Student Succeeds Act: https:// youtu.be/AWunQNEGgkg";;;;"672192963867484166";https://twitter.com/repmarkpocan/status/672192963867484166
;2015-12-01 12:45;2;3;"On #WAD2015 , we must unite in the global fight against HIV & work towards the goal of an AIDS-free generation. pic.twitter.com/QCq3tILeaK";;;#WAD2015;"671762065627996160";https://twitter.com/repmarkpocan/status/671762065627996160
;2015-11-30 09:05;1;1;"For today's Magic Monday, I want to do a #magictrick directly with you. Follow along & enjoy: https://www. youtube.com/watch?v=ZwUQ1M neCKc … @sammumnews @IBMMAGIC";;@sammumnews @IBMMAGIC;#magictrick;"671344238215503872";https://twitter.com/repmarkpocan/status/671344238215503872
;2015-11-29 09:24;2;4;"My thoughts go out to all the victims of Friday's horrific & senseless @PPFA shooting in CO. #StandWithPP";;@PPFA;#StandWithPP;"670986722927321089";https://twitter.com/repmarkpocan/status/670986722927321089
;2015-11-28 10:57;7;2;"Today is Small Business Saturday! #ShopSmall to support local businesses & help keep jobs in our communities. pic.twitter.com/4GJTR5Z9M6";;;#ShopSmall;"670647761637916672";https://twitter.com/repmarkpocan/status/670647761637916672
;2015-11-26 14:19;1;2;"Have a wonderful day spending time with friends and family. Happy Thanksgiving! pic.twitter.com/X0OSa7nA42";;;;"669973859022602240";https://twitter.com/repmarkpocan/status/669973859022602240
;2015-11-24 15:07;4;3;"HAPPENING NOW: I'm talking with @devilradio on 92.1 FM about spending an afternoon shadowing a home care worker.";;@devilradio;;"669261058385801217";https://twitter.com/repmarkpocan/status/669261058385801217
;2015-11-23 13:59;3;4;"Thanks for having me. Always a pleasure to talk with you. https:// twitter.com/DeForestTimes/ status/668870427519934465 …";;;;"668881469046136832";https://twitter.com/repmarkpocan/status/668881469046136832
;2015-11-23 12:24;30;13;"The real story behind Pfizer & Allergan's $160-billion merger: a massive tax-avoiding inversion. #CorporateDesertion https://www. washingtonpost.com/news/wonk/wp/2 015/11/23/pfizer-and-allergan-to-merge-in-160-billion-inversion/ …";;;#CorporateDesertion;"668857724474642432";https://twitter.com/repmarkpocan/status/668857724474642432
;2015-11-23 10:48;0;0;"This week's Magic Monday involves a little mind reading: https:// youtu.be/n_yv-MnjN_U @sammumnews @IBMMAGIC #magictrick";;@sammumnews @IBMMAGIC;#magictrick;"668833402792124416";https://twitter.com/repmarkpocan/status/668833402792124416
;2015-11-20 13:48;6;6;"We must take action to stop the epidemic of violence against the transgender community. #Equality4Trans #TDOR pic.twitter.com/TYzgq63NBb";;;#Equality4Trans #TDOR;"667791543818977280";https://twitter.com/repmarkpocan/status/667791543818977280
;2015-11-20 11:38;2;2;"Congratulations to Madison's own @DZorko for being a #ACTFL15 TOY finalist. Thank you for your dedication to teaching. You make us proud!";;@DZorko;#ACTFL15;"667758961131696128";https://twitter.com/repmarkpocan/status/667758961131696128
;2015-11-18 15:05;1;1;"HAPPENING NOW: I'm chatting with @SolidaritySly on the news of the day. Tune in live here: http:// radio.securenetsystems.net/v5/WEKZFM";;@SolidaritySly;;"667086131591270400";https://twitter.com/repmarkpocan/status/667086131591270400
;2015-11-17 09:52;50;83;"Proudly standing with the @LGBTEqCaucus , @NancyPelosi , & @HRC to announce the Transgender Equality Task Force pic.twitter.com/5QkTyBUMGf";;@LGBTEqCaucus @NancyPelosi @HRC;;"666645201327362049";https://twitter.com/repmarkpocan/status/666645201327362049
;2015-11-16 11:27;1;0;"Today's Magic Monday is all about compromise: https://www. youtube.com/watch?v=yYlfOq l37qk … @sammumnews @IBMMAGIC #magictrick";;@sammumnews @IBMMAGIC;#magictrick;"666306525561028609";https://twitter.com/repmarkpocan/status/666306525561028609
;2015-11-11 18:40;1;2;"Had a great time chatting with @chucktodd at @wispolitics 15th anniversary celebration. pic.twitter.com/X6M7sHqtD8";;@chucktodd @wispolitics;;"664603591760412672";https://twitter.com/repmarkpocan/status/664603591760412672
;2015-11-11 12:05;3;5;"Happy #VeteransDay to all the men and women who have served our country. Thank you today and every day! pic.twitter.com/bTXhcbJGAY";;;#VeteransDay;"664504349532516353";https://twitter.com/repmarkpocan/status/664504349532516353
;2015-11-10 14:10;70;115;"Discrimination has no place in our nation's laws. Proud to hear @POTUS supports the #EqualityAct : https://www. washingtonpost.com/politics/obama -supports-altering-civil-rights-act-to-include-gender-discrimination/2015/11/10/3a05107e-87c8-11e5-9a07-453018f9a0ec_story.html?wpisrc=al_alert-COMBO-politics%252Bnation … #EqualityForward";;@POTUS;#EqualityAct #EqualityForward;"664173402379427844";https://twitter.com/repmarkpocan/status/664173402379427844
;2015-11-10 08:56;3;1;"Great piece from @amprog on how unions help Wisconsin workers: https://www. americanprogress.org/issues/economy /report/2015/11/10/125252/wisconsin-unions-and-the-middle-class/ …";;@amprog;;"664094181506359296";https://twitter.com/repmarkpocan/status/664094181506359296
;2015-11-09 11:08;11;7;"I introduced legislation to limit corporate tax inversions to ensure companies contribute their fair share: http:// pocan.house.gov/media-center/p ress-releases/pocan-introduces-legislation-to-limit-corporate-tax-inversions …";;;;"663765196763176962";https://twitter.com/repmarkpocan/status/663765196763176962
;2015-11-09 09:43;3;0;". @RepLindaSanchez joins me for this week's Magic Monday to demonstrate the power of the gavel: https:// youtu.be/suQMnFK-T84 @sammumnews @IBMMAGIC";;@RepLindaSanchez @sammumnews @IBMMAGIC;;"663743792307154945";https://twitter.com/repmarkpocan/status/663743792307154945
;2015-11-08 10:10;8;9;"The #HigherEd Act was signed into law 50 yrs ago! Let’s mark #HEA50 by improving access & college affordability. pic.twitter.com/Gkon8GWrvA";;;#HigherEd #HEA50;"663388060260950016";https://twitter.com/repmarkpocan/status/663388060260950016
;2015-11-06 10:53;1;2;"I requested a meeting with the Kraft Heinz CEO to discuss their decision to close the Oscar Mayer plant: http:// pocan.house.gov/media-center/p ress-releases/pocan-requests-meeting-with-kraft-heinz-ceo-after-decision-to-close …";;;;"662674103896264704";https://twitter.com/repmarkpocan/status/662674103896264704
;2015-11-05 14:19;31;11;"#TPPWorseThanWeThought : #TPP will cost America jobs, increase unsafe food imports & dismantle consumer protections https:// pocan.house.gov/media-center/p ress-releases/pocan-release-of-trans-pacific-partnership-text-confirms-our-fears-about …";;;#TPPWorseThanWeThought #TPP;"662363565924462592";https://twitter.com/repmarkpocan/status/662363565924462592
;2015-11-05 12:07;0;1;"As Veterans Day approaches, @SenBrianSchatz @cbrangel & I urge Congress to pass Restore Honor to Service Members Act http:// pocan.house.gov/media-center/p ress-releases/as-veterans-day-approaches-sen-schatz-reps-pocan-rangel-urge-congress-to …";;@SenBrianSchatz @cbrangel;;"662330477961986048";https://twitter.com/repmarkpocan/status/662330477961986048
;2015-11-05 11:52;31;23;"The TPP hurts American workers and still includes big giveaways to powerful corporations. #TPPWorseThanWeThought pic.twitter.com/kuTzhYJbhm";;;#TPPWorseThanWeThought;"662326524943671297";https://twitter.com/repmarkpocan/status/662326524943671297
;2015-11-05 10:35;11;10;"So the Trans-Pacific Partnership still isn't secret, right? #TPPWorseThanWeThought pic.twitter.com/tPRaEocQxK";;;#TPPWorseThanWeThought;"662307200023576580";https://twitter.com/repmarkpocan/status/662307200023576580
;2015-11-05 09:15;25;42;"Standing with @cbrangel , @SenBrianSchatz , @HRC to support the Restore Honor to Service Members Act pic.twitter.com/o1Ew04KOwO";;@cbrangel @SenBrianSchatz @HRC;;"662287095604621316";https://twitter.com/repmarkpocan/status/662287095604621316
;2015-11-04 15:00;6;8;"The Oscar Mayer factory closing is a devastating blow to workers, their families and our community: https:// pocan.house.gov/media-center/p ress-releases/pocan-calls-oscar-mayer-factory-closing-a-devastating-blow-to-workers …";;;;"662011582810034176";https://twitter.com/repmarkpocan/status/662011582810034176
;2015-11-03 11:24;3;2;"Where Have All The Teachers Gone? Read my piece in @madison_365 on the recent teacher shortages in Wisconsin: http:// madison365.com/index.php/2015 /11/03/where-have-all-the-teachers-gone/ …";;@madison_365;;"661594762198302721";https://twitter.com/repmarkpocan/status/661594762198302721
;2015-11-02 11:21;0;2;"In honor of those still celebrating Halloween in Madison, here's a #magictrick : https://www. youtube.com/watch?v=1NK3cD x4ZGo&feature=youtu.be … @sammumnews @IBMMAGIC";;@sammumnews @IBMMAGIC;#magictrick;"661231687326670848";https://twitter.com/repmarkpocan/status/661231687326670848
;2015-11-01 13:59;1;1;"Read my op-ed on why the Senate needs to #SavePerkinsNow : http://www. huffingtonpost.com/rep-mark-pocan /the-house-did-the-right-t_b_8445772.html …";;;#SavePerkinsNow;"660909042529869824";https://twitter.com/repmarkpocan/status/660909042529869824
;2015-11-01 12:22;1;1;"Are you covered? @HealthCareGov open enrollment starts today. #GetCovered at http:// HealthCare.gov";;@HealthCareGov;#GetCovered;"660884597845061632";https://twitter.com/repmarkpocan/status/660884597845061632
;2015-10-30 13:05;0;1;"Congratulations to La Movida Radio in Madison on marking 15 years on air! http://www. channel3000.com/news/opinion/L a-Movida-Radio-marks-15-years-on-the-air/36143512 …";;;;"660155540794904577";https://twitter.com/repmarkpocan/status/660155540794904577
;2015-10-30 10:36;3;2;". @SenatorBaldwin led a bipartisan letter urging Senate leadership to #SavePerkinsNow : http://www. baldwin.senate.gov/press-releases /baldwin-collins-casey-portman-lead-majority-of-senate-in-bipartisan-effort-to-save-student-loan-program … pic.twitter.com/yHN4qoBEFn";;@SenatorBaldwin;#SavePerkinsNow;"660118000276742144";https://twitter.com/repmarkpocan/status/660118000276742144
;2015-10-29 09:16;5;2;"New report shows 75% of taxpayer-funded vouchers in Wisconsin benefit students already enrolled in private schools: http:// pocan.house.gov/media-center/p ress-releases/new-report-shows-75-of-taxpayer-funded-vouchers-benefit-students-already …";;;;"659735531648122881";https://twitter.com/repmarkpocan/status/659735531648122881
;2015-10-28 16:40;4;4;"Average student loan debt in Wisconsin shot up 74 percent in a decade. It’s long overdue for action on #StudentDebt : http:// bit.ly/1M2sBh8";;;#StudentDebt;"659484981136367616";https://twitter.com/repmarkpocan/status/659484981136367616
;2015-10-28 13:34;1;3;"About to testify at #MIIAWhatsNext hearing on the Future of American Manufacturing & Skills Training Panel. Tune in: https:// youtu.be/s5of10G2kDs";;;#MIIAWhatsNext;"659438123877834752";https://twitter.com/repmarkpocan/status/659438123877834752
;2015-10-27 14:58;16;10;"Restoring unions’ strength is critical to helping #WorkingFamilies receive a fair share of the wealth they create. pic.twitter.com/xXwVFgcxEq";;;#WorkingFamilies;"659096876327804928";https://twitter.com/repmarkpocan/status/659096876327804928
;2015-10-27 10:52;3;6;""For Wisconsinites who are stuck with Scott Walker until 2018, America’s gain is their loss." The @nytimes nails it: http:// nyti.ms/1OU72Sc";;@nytimes;;"659034914118049792";https://twitter.com/repmarkpocan/status/659034914118049792
;2015-10-26 15:54;0;2;"State leaders need to put aside their partisan differences to move Wisconsin forward. Read my @CapTimes op-ed here: http:// host.madison.com/ct/opinion/col umn/rep-mark-pocan-wisconsin-is-turning-into-washington-d-c/article_78464c18-bc35-52b0-b411-3dc12afe2dbc.html …";;@CapTimes;;"658748554417164288";https://twitter.com/repmarkpocan/status/658748554417164288
;2015-10-26 10:15;2;1;"Enjoy a spooky #magictrick for this Halloween edition of Magic Mondays: https://www. youtube.com/watch?v=iIxwdl joP-Y … @sammumnews @IBMMAGIC";;@sammumnews @IBMMAGIC;#magictrick;"658663313782525952";https://twitter.com/repmarkpocan/status/658663313782525952
;2015-10-21 17:10;3;1;"Dismantling the GAB is shortsighted and misguided. Read my op-ed in the Milwaukee @journalsentinel here: http://www. jsonline.com/news/opinion/d ismantling-gab-is-shortsighted-misguided-b99600897z1-335170471.html …";;@journalsentinel;;"656955786074181632";https://twitter.com/repmarkpocan/status/656955786074181632
;2015-10-21 15:30;2;1;"It's bewildering that Senate GOP leadership refuses to #SavePerkinsNow when thousands of students rely on them to make college accessible.";;;#SavePerkinsNow;"656930478369452032";https://twitter.com/repmarkpocan/status/656930478369452032
;2015-10-21 15:13;3;3;"Extremely disappointed that efforts to save Perkins Loans failed again in the Senate. We need to #SavePerkinsNow ! pic.twitter.com/d04pB5JHzH";;;#SavePerkinsNow;"656926360208842752";https://twitter.com/repmarkpocan/status/656926360208842752
;2015-10-20 10:00;5;5;"Stopped by @afscme32 's town hall last night to discuss how unions benefit working families. Thanks for having me! pic.twitter.com/ThyebwX1PX";;@afscme32;;"656485227850788864";https://twitter.com/repmarkpocan/status/656485227850788864
;2015-10-19 15:41;0;3;"Good piece from @BDNConnection on why I'm calling on WI's Joint Finance Committee to release transportation funds: http://www. beloitdailynews.com/news/illinois/ pocan-free-up-highway-funds/article_c3677b92-7475-11e5-af59-9f7774d99c6c.html …";;@BDNConnection;;"656208578701860864";https://twitter.com/repmarkpocan/status/656208578701860864
;2015-10-17 06:19;10;43;"Sorry for the late night spam everyone. My account was hacked. It's all sorted out now.";;;;"655342371006189568";https://twitter.com/repmarkpocan/status/655342371006189568
;2015-10-15 15:31;4;8;"It's #SpiritDay ! Take a stand against bullying and support #LGBT youth today and every day. pic.twitter.com/akrDCMOjgj";;;#SpiritDay #LGBT;"654756441996161024";https://twitter.com/repmarkpocan/status/654756441996161024
;2015-10-15 11:48;2;4;"I'm lucky to have great staffers on my team. Glad they could stop by and learn about @reachoutandread ! https:// twitter.com/navsaria/statu s/654698303116804096 …";;@reachoutandread;;"654700452945096704";https://twitter.com/repmarkpocan/status/654700452945096704
;2015-10-14 12:36;9;4;"I stood with @UWMadison students & administrators to call on the Senate to #SavePerkinsNow . http:// pocan.house.gov/media-center/p ress-releases/pocan-uw-students-and-administrators-call-on-the-senate-to-immediately … pic.twitter.com/HZltYOStD6";;@UWMadison;#SavePerkinsNow;"654350125347786752";https://twitter.com/repmarkpocan/status/654350125347786752
;2015-10-12 13:18;3;2;"For today's Magic Monday, I'm demonstrating just how important choices are. Looking at you, @HouseGOP : https://www. youtube.com/watch?v=JjieCM zBzo4&feature=youtu.be … @sammumnews";;@HouseGOP @sammumnews;;"653635951600758784";https://twitter.com/repmarkpocan/status/653635951600758784
;2015-10-09 09:04;14;2;"Sent a letter to @WhiteHouse urging not to undermine countries' ability to address #climatechange w/ #TPP http:// pocan.house.gov/media-center/p ress-releases/rep-pocan-house-democrats-to-president-obama-free-trade-agreements-must …";;@WhiteHouse;#climatechange #TPP;"652484788436234240";https://twitter.com/repmarkpocan/status/652484788436234240
;2015-10-08 17:35;4;1;"Joined the @USProgressives Special Order Hour to voice my opposition to the #TPP . Watch my floor speech here: https:// youtu.be/zOYvpHqJqcE #NoTPP";;@USProgressives;#TPP #NoTPP;"652250892025131008";https://twitter.com/repmarkpocan/status/652250892025131008
;2015-10-08 10:38;7;3;"Sent letter w/ @RepAdamSchiff @RepBrianHiggins urging @TSA to change screening procedures for transgender passengers: http:// pocan.house.gov/media-center/p ress-releases/members-of-congress-to-tsa-reform-screening-procedures-for-transgender …";;@RepAdamSchiff @RepBrianHiggins @TSA;;"652146051818778625";https://twitter.com/repmarkpocan/status/652146051818778625
;2015-10-06 14:59;18;7;"The Workplace Democracy Act will make it easier for workers to join unions and bargain for better wages & benefits: https:// pocan.house.gov/media-center/p ress-releases/sanders-pocan-introduce-legislation-to-strengthen-workers-rights …";;;;"651487009681371137";https://twitter.com/repmarkpocan/status/651487009681371137
;2015-10-06 13:43;372;609;""When unions grow, the middle class grows and when the middle class grows, America grows." ~ @SenSanders pic.twitter.com/wx7McK4ETT";;@SenSanders;;"651467764067106816";https://twitter.com/repmarkpocan/status/651467764067106816
;2015-10-06 13:39;161;299;"Introducing the Workplace Democracy Act w/ @SenSanders to make it easier for workers to form a union. pic.twitter.com/i2dC1ykso8";;@SenSanders;;"651466952179847168";https://twitter.com/repmarkpocan/status/651466952179847168
;2015-10-06 09:29;3;0;"Congratulations to @UWMadison alum William C. Campbell for receiving a #NobelPrize in Medicine! http:// host.madison.com/news/local/edu cation/university/nobel-prize-winner-william-campbell-says-he-had-freedom-to/article_e93de908-efed-5432-9909-18fea91af270.html … #OnWisconsin";;@UWMadison;#NobelPrize #OnWisconsin;"651403895432957952";https://twitter.com/repmarkpocan/status/651403895432957952
;2015-10-05 11:18;23;5;"#TPP negotiations have ended. I call on the Administration to release the text immediately. Read my statement here: https:// pocan.house.gov/media-center/p ress-releases/pocan-calls-for-immediate-release-of-trans-pacific-partnership-text …";;;#TPP;"651069002299645952";https://twitter.com/repmarkpocan/status/651069002299645952
;2015-10-05 09:59;3;3;"Happy to have my friend and colleague @RepDennyHeck join me for today's Magic Monday: https://www. youtube.com/watch?v=8kWjnO mBCf4 … @IBMMAGIC @sammumnews";;@RepDennyHeck @IBMMAGIC @sammumnews;;"651049087912026112";https://twitter.com/repmarkpocan/status/651049087912026112
;2015-10-02 14:08;4;3;"Investing in advanced manufacturing drives our economy forward and creates a path into the middle class. #MFGDay15 pic.twitter.com/oSZ4eQjZDm";;;#MFGDay15;"650024687540551680";https://twitter.com/repmarkpocan/status/650024687540551680
;2015-10-02 12:07;3;3;"Marty Beil leaves behind a legacy of tireless advocacy on behalf of workers across WI. He will be truly missed: http:// pocan.house.gov/media-center/p ress-releases/pocan-statement-on-passing-of-labor-leader-marty-beil …";;;;"649994195982249984";https://twitter.com/repmarkpocan/status/649994195982249984
;2015-10-01 06:45;8;4;"On @bpshow this morning talking #boehnerresigns #saveperkinsnow #budget pic.twitter.com/GxZWEXqR6E";;@bpshow;#boehnerresigns #saveperkinsnow #budget;"649550584559894528";https://twitter.com/repmarkpocan/status/649550584559894528
;2015-09-30 14:15;7;0;"BREAKING NEWS: @SenAlexander blocks efforts to save the #PerkinsLoans program. Read my full statement here: http:// pocan.house.gov/media-center/p ress-releases/pocan-s-effort-to-reauthorize-perkins-loans-blocked-in-the-senate …";;@SenAlexander;#PerkinsLoans;"649301500880158720";https://twitter.com/repmarkpocan/status/649301500880158720
;2015-09-30 11:45;6;2;"Building safe roads is a basic function of gov't. I call on @GovWalker AGAIN to hold special session on WI's infrastructure funding. (2/2)";;@GovWalker;;"649263900890918912";https://twitter.com/repmarkpocan/status/649263900890918912
;2015-09-30 11:42;3;3;"READ→ 5 more road construction projects are delayed due to @GovWalker 's budget cuts: http://www. jsonline.com/news/statepoli tics/329959171.html … @patrickdmarley (1/2)";;@GovWalker @patrickdmarley;;"649262949815713792";https://twitter.com/repmarkpocan/status/649262949815713792
;2015-09-29 16:20;13;5;"Happy 50th Anniversary to @NEAarts and @NEHgov ! Thanks for sharing your creativity and innovation with us. #ARTS4US pic.twitter.com/Hg8zlFj4xS";;@NEAarts @NEHgov;#ARTS4US;"648970551449526273";https://twitter.com/repmarkpocan/status/648970551449526273
;2015-09-29 12:45;2;3;"Introduced the HIV Clinical Services Improvement Act to expand health care access for people living with HIV/AIDS: http:// pocan.house.gov/media-center/p ress-releases/pocan-introduces-hiv-clinical-services-improvement-act …";;;;"648916481032482816";https://twitter.com/repmarkpocan/status/648916481032482816
;2015-09-29 07:42;8;5;"Joining @cspanwj this morning to discuss avoiding #GOPshutdown #boehnerresigns . Tune into @cspan now to watch. pic.twitter.com/QTrJNRi3lo";;@cspanwj @cspan;#GOPshutdown #boehnerresigns;"648840174814760960";https://twitter.com/repmarkpocan/status/648840174814760960
;2015-09-28 16:50;1;6;"My bill with @RepMikeBishop which reauthorizes #PerkinsLoans just passed the House. Watch my floor speech here: https:// youtu.be/hd5SlvS1wqQ";;@RepMikeBishop;#PerkinsLoans;"648615729516937216";https://twitter.com/repmarkpocan/status/648615729516937216
;2015-09-28 15:37;3;2;"Bottom line: Perkins Loans help students and families struggling to find a way to pay for college. http://www. c-span.org/video/?328389- 3/house-session-part-2&live … #SavePerkinsNow";;;#SavePerkinsNow;"648597512014708736";https://twitter.com/repmarkpocan/status/648597512014708736
;2015-09-28 15:33;1;4;"Now is not the time to turn our backs on students who need Perkins Loans to make college affordable. ~ @RepMikeBishop http://www. c-span.org/video/?328389- 3/house-session-part-2&live …";;@RepMikeBishop;;"648596394455003136";https://twitter.com/repmarkpocan/status/648596394455003136
;2015-09-28 15:30;1;3;"Watch live debate on my bill to reauthorize the Perkins Loan Program now: http://www. c-span.org/video/?328389- 3/house-session-part-2&live …";;;;"648595733663358976";https://twitter.com/repmarkpocan/status/648595733663358976
;2015-09-24 15:44;6;7;"Just introduced the Higher Education Extension Act with @RepMikeBishop to reauthorize Perkins Loans for one year: https:// pocan.house.gov/media-center/p ress-releases/pocan-introduces-bi-partisan-legislation-to-reauthorize-perkins-loan …";;@RepMikeBishop;;"647149561077735424";https://twitter.com/repmarkpocan/status/647149561077735424
;2015-09-24 12:46;3;5;"I urge @GovWalker to hold a special session to fund Wisconsin’s infrastructure in light of Verona Road delay: https:// pocan.house.gov/media-center/p ress-releases/pocan-urges-gov-walker-to-hold-special-session-to-fund-wisconsin-s …";;@GovWalker;;"647104818562093056";https://twitter.com/repmarkpocan/status/647104818562093056
;2015-09-24 09:02;1;4;"Honored to be joined by social justice advocate Sister Maureen McDonnell to hear @Pontifex 's address. #PopeInDC pic.twitter.com/6zPFQiNo8Y";;@Pontifex;#PopeInDC;"647048342040616961";https://twitter.com/repmarkpocan/status/647048342040616961
;2015-09-22 10:43;13;6;"Sent letter with @keithellison & @RepRaulGrijalva urging @SpeakerBoehner to work w/ Democrats to avoid #GOPshutdown : http:// pocan.house.gov/media-center/p ress-releases/cpc-leadership-urge-speaker-boehner-to-work-with-democrats-to-avoid …";;@keithellison @RepRaulGrijalva @SpeakerBoehner;#GOPshutdown;"646349155724599296";https://twitter.com/repmarkpocan/status/646349155724599296
;2015-09-21 12:27;1;3;"Joined by two of my caseworkers in the Madison office for today's Magic Monday: https://www. youtube.com/watch?v=UG0nui gBlOI&feature=youtu.be … @IBMMAGIC @sammumnews #magictrick";;@IBMMAGIC @sammumnews;#magictrick;"646012930249650176";https://twitter.com/repmarkpocan/status/646012930249650176
;2015-09-18 14:31;28;24;"I #StandWithPP and the nearly 61,000 Wisconsin women and men who rely on it for vital health services. pic.twitter.com/nhTgYZdtVl";;;#StandWithPP;"644957050963935232";https://twitter.com/repmarkpocan/status/644957050963935232
;2015-09-17 15:22;3;4;"Challenge accepted, @SenatorBaldwin . Now, it's in your court @CoryBooker ! #5TimesFAFSA https://www. youtube.com/watch?v=FK3D8R q5o28&feature=youtu.be …";;@SenatorBaldwin @CoryBooker;#5TimesFAFSA;"644607313148518404";https://twitter.com/repmarkpocan/status/644607313148518404
;2015-09-17 10:02;1;2;"Social justice advocate, Sister Maureen McDonnell, will be joining me for the Pope's address to Congress next week: http:// pocan.house.gov/media-center/p ress-releases/pocan-to-bring-social-justice-advocate-sister-mcdonnell-as-guest-for …";;;;"644526839000641536";https://twitter.com/repmarkpocan/status/644526839000641536
;2015-09-16 15:08;8;5;"Congratulations to @UWMadison for winning a grant from the Department of @ENERGY for solar energy research: https://www. whitehouse.gov/the-press-offi ce/2015/09/16/fact-sheet-driving-growth-solar-energy-across-country …";;@UWMadison @ENERGY;;"644241528605405184";https://twitter.com/repmarkpocan/status/644241528605405184
;2015-09-16 09:44;2;1;"I talked with Ed Schultz about a possible #GOPshutdown . It's #TimetoNegotiate a budget agreement Americans want: http:// wegoted.com/shows/ed-schul tz-news-and-commentary-wednesday-the-16th-of-september/ …";;;#GOPshutdown #TimetoNegotiate;"644159926445719552";https://twitter.com/repmarkpocan/status/644159926445719552
