username;date;retweets;favorites;text;geo;mentions;hashtags;id;permalink
;2017-06-14 20:17;1;8;"Thanks to everyone in #CO06 who participated in tonight's tele-town hall. Great questions/ideas! pic.twitter.com/zkFIOMqQbr";;;#CO06;"875160380305281025";https://twitter.com/RepMikeCoffman/status/875160380305281025
;2017-06-14 16:01;10;17;"My Statement on Today's Shooting: pic.twitter.com/aBXiTasPAp";;;;"875095990503698433";https://twitter.com/RepMikeCoffman/status/875095990503698433
;2017-06-14 11:21;12;78;"Currently on the House floor with my colleagues as we share a moment of bipartisan solidarity for those injured this morning.";;;;"875025399394205696";https://twitter.com/RepMikeCoffman/status/875025399394205696
;2017-06-14 10:20;2;3;"Honored to be addressing the 2017 @AccelerateCO coalition today in #DC . #ACinDC2017 pic.twitter.com/nDuco1oGpb";;@AccelerateCO;#DC #ACinDC2017;"875009972236689408";https://twitter.com/RepMikeCoffman/status/875009972236689408
;2017-06-14 07:06;31;76;"My thoughts and prayers are with my colleagues and staff who were at the Congressional baseball practice this morning.";;;;"874961304942936064";https://twitter.com/RepMikeCoffman/status/874961304942936064
;2017-06-13 20:33;3;2;"Looking forward to hearing from you tomorrow! Sign up here ➤ http:// goo.gl/cnYDb3 pic.twitter.com/ogWdm2IIJD";;;;"874801980539064322";https://twitter.com/RepMikeCoffman/status/874801980539064322
;2017-06-13 17:04;8;11;"My statement on the passage of the VA Accountability & Whistleblower Protection Act: pic.twitter.com/SoZV4Z5Ltb";;;;"874749378375950337";https://twitter.com/RepMikeCoffman/status/874749378375950337
;2017-06-12 16:50;2;2;"Click here to participate: https:// goo.gl/cnYDb3 pic.twitter.com/MfOBRSAean";;;;"874383355315453952";https://twitter.com/RepMikeCoffman/status/874383355315453952
;2017-06-12 09:16;0;3;"It was an honor to present a Congressional Record to the #CO Korean Chorus at their 12th Annual concert last evening. Great chorus & talent! pic.twitter.com/vaqxVzu7gf";;;#CO;"874269099362267140";https://twitter.com/RepMikeCoffman/status/874269099362267140
;2017-06-10 15:41;6;15;"pic.twitter.com/DOXd8Xd09J";;;;"873641218596581376";https://twitter.com/RepMikeCoffman/status/873641218596581376
;2017-06-09 15:25;7;24;"Prior to leaving for the airport, I got a special visitor in the D.C. office. pic.twitter.com/RgbC5upnJG";;;;"873274809400131586";https://twitter.com/RepMikeCoffman/status/873274809400131586
;2017-06-09 08:18;0;2;"I will be joining @KOANewsRadio at 7:20am MT. Looking forward to having you tune in.";;@KOANewsRadio;;"873167401998798848";https://twitter.com/RepMikeCoffman/status/873167401998798848
;2017-06-08 15:42;1;0;"Looking forward to hearing from you! ➤ https:// goo.gl/cnYDb3 pic.twitter.com/fJT5Hm23hU";;;;"872916800236859392";https://twitter.com/RepMikeCoffman/status/872916800236859392
;2017-06-08 14:59;7;19;"My statement on the #ComeyHearing : pic.twitter.com/lT8ykLGvu3";;;#ComeyHearing;"872905935173373952";https://twitter.com/RepMikeCoffman/status/872905935173373952
;2017-06-08 10:26;0;2;"Great meeting with @AuroraGov Mayor Hogan this morning in DC. pic.twitter.com/uxqMFFImaM";;@AuroraGov;;"872837250371006465";https://twitter.com/RepMikeCoffman/status/872837250371006465
;2017-06-08 09:04;0;3;"I'm voting for the #CHOICEAct today. This will bring financial accountability to both Wall Street & Washington & will help grow our economy. pic.twitter.com/aKaHDFUQvf";;;#CHOICEAct;"872816676932374528";https://twitter.com/RepMikeCoffman/status/872816676932374528
;2017-06-07 17:32;2;2;""The First-Time Homebuyer Savings Account Act is a straightforward and bipartisan solution to this problem"... more https:// goo.gl/Ugvrd8 pic.twitter.com/zNdBLMYmaG";;;;"872582174452707329";https://twitter.com/RepMikeCoffman/status/872582174452707329
;2017-06-07 16:25;2;1;"pic.twitter.com/G7JkCHTMct";;;;"872565198825062400";https://twitter.com/RepMikeCoffman/status/872565198825062400
;2017-06-07 14:14;2;3;"I look forward to updating you on all that is happening in D.C. in the month of June. Sign-up to participate here ➤ https:// goo.gl/cnYDb3 pic.twitter.com/ofE62PuruB";;;;"872532114184572929";https://twitter.com/RepMikeCoffman/status/872532114184572929
;2017-06-07 12:59;2;1;"10 Wins for Americans w/the #ChoiceAct https://www. youtube.com/watch?v=5r2L4H eiS0Q …";;;#ChoiceAct;"872513436873261063";https://twitter.com/RepMikeCoffman/status/872513436873261063
;2017-06-06 22:38;2;3;"ICYMI: Addressing the National #PilotShortage . @RepMikeCoffman @USAirForce @townhallcom http:// bit.ly/2qZwi4G";;@RepMikeCoffman @USAirForce @townhallcom;#PilotShortage;"872296634926981121";https://twitter.com/RepMikeCoffman/status/872296634926981121
;2017-06-06 16:05;0;1;"The VA + $$$ Hotel = Pershing Hall... @RepMikeCoffman @RepPerlmutter @RepJohnDuncanJr & @RepAnnieKuster say no more: https:// goo.gl/a9W9za pic.twitter.com/EwRiNuCrk6";;@RepMikeCoffman @RepPerlmutter @RepJohnDuncanJr @RepAnnieKuster;;"872197776704188417";https://twitter.com/RepMikeCoffman/status/872197776704188417
;2017-06-06 14:44;0;1;"Lots of great things happening in #CO . Congrats @BHGHcolorado c/o 2017. See video here: https:// animoto.com/play/WiHg5yJsw uSVKxxp2262GA …";;@BHGHcolorado;#CO;"872177283271995392";https://twitter.com/RepMikeCoffman/status/872177283271995392
;2017-06-06 12:02;0;2;"Looking forward to speaking with you! Register here ➤ https:// goo.gl/cnYDb3 pic.twitter.com/HFT09pEpO2";;;;"872136553052733442";https://twitter.com/RepMikeCoffman/status/872136553052733442
;2017-06-06 09:34;23;40;"Forever grateful to all those who served. Today marks 73 years since #DDay and the landings in #Normandy . pic.twitter.com/S77h2NPBI2";;;#DDay #Normandy;"872099481654882304";https://twitter.com/RepMikeCoffman/status/872099481654882304
;2017-06-05 13:55;7;16;". @DeptVetAffairs Secretary announces decision on next-generation Electronic Health Record --> https:// goo.gl/0XmWp5 pic.twitter.com/cWlkuNYkm0";;@DeptVetAffairs;;"871802658377564162";https://twitter.com/RepMikeCoffman/status/871802658377564162
;2017-06-04 13:10;4;10;"Honored to have joined the Debreselam Medhanealem Ethiopian Orthodox Tewahedo Church today. pic.twitter.com/B7hdP2VRbN";;;;"871429011934760960";https://twitter.com/RepMikeCoffman/status/871429011934760960
;2017-06-03 18:40;4;20;"Terrible news coming out of the U.K.- We must stand together against terrorism & remain vigilant. Solidarity with the people of #London .";;;#London;"871149576094441475";https://twitter.com/RepMikeCoffman/status/871149576094441475
;2017-06-03 11:26;0;0;"My next newsletter comes out in just hours! Sign up to get your copy here https:// goo.gl/Lkf5GV pic.twitter.com/wcPNMkSgDH";;;;"871040288499871744";https://twitter.com/RepMikeCoffman/status/871040288499871744
;2017-06-02 12:53;0;3;"Great meeting today with Gilberto &a Tony who are with the Chamber of the Americas. We discussed trade between #CO and our hemisphere. pic.twitter.com/kVrSfC5OVv";;;#CO;"870699854124556288";https://twitter.com/RepMikeCoffman/status/870699854124556288
;2017-06-02 07:05;0;2;"I will be joining @KOANewsRadio at 6:10am MT. Looking forward to having you tune in.";;@KOANewsRadio;;"870612365313757184";https://twitter.com/RepMikeCoffman/status/870612365313757184
;2017-06-01 15:08;3;15;"pic.twitter.com/2CL4y3QBEl";;;;"870371590449627137";https://twitter.com/RepMikeCoffman/status/870371590449627137
;2017-06-01 14:37;9;32;"pic.twitter.com/W7rsMGgjyS";;;;"870363622249287681";https://twitter.com/RepMikeCoffman/status/870363622249287681
;2017-05-31 09:10;1;0;"http:// coffman.house.gov/media-center/p ress-releases/coffman-introduces-veteran-urgent-access-to-mental-healthcare-act … -Staff";;;;"869919139669921792";https://twitter.com/RepMikeCoffman/status/869919139669921792
;2017-05-31 08:56;1;4;"ICYMI: https:// twitter.com/csgazette/stat us/869382870443470848 …";;;;"869915565284098048";https://twitter.com/RepMikeCoffman/status/869915565284098048
;2017-05-29 15:24;2;12;"#MemorialDay2017 Honoring those who have served and paid the ultimate sacrifice. Thank you all who came out to the event. pic.twitter.com/S9jaoRDarv";;;#MemorialDay2017;"869288455817359361";https://twitter.com/RepMikeCoffman/status/869288455817359361
;2017-05-29 09:00;7;24;"Home of the Free, Because of the Brave. #memorialday2017 pic.twitter.com/NTVzkBw3vu";;;#memorialday2017;"869191627004411904";https://twitter.com/RepMikeCoffman/status/869191627004411904
;2017-05-27 18:27;1;10;"It was an honor to lay the wreath today at #CO Freedom Memorial in @AuroraGov pic.twitter.com/QKEokx1PqA";;@AuroraGov;#CO;"868609660324114434";https://twitter.com/RepMikeCoffman/status/868609660324114434
;2017-05-26 14:18;1;0;"Get your newsletter here https:// goo.gl/Lkf5GV pic.twitter.com/wKyF0kHFhz";;;;"868184482439933952";https://twitter.com/RepMikeCoffman/status/868184482439933952
;2017-05-26 12:47;7;10;"ICYMI this week, the House: pic.twitter.com/spKMKWXvwC";;;;"868161610594099200";https://twitter.com/RepMikeCoffman/status/868161610594099200
;2017-05-25 14:04;3;4;"Body-Slamming Veteran Suicide & Opioid Addiction.... https:// goo.gl/pgMiqv pic.twitter.com/mVIGa7JuOc";;;;"867818638656647170";https://twitter.com/RepMikeCoffman/status/867818638656647170
;2017-05-25 12:19;1;3;"Honored to be joining & addressing the @AEI Conference on Veterans' Disability. pic.twitter.com/W5o2RDbLTX";;@AEI;;"867792165094793216";https://twitter.com/RepMikeCoffman/status/867792165094793216
;2017-05-25 10:22;2;1;"The House took several steps this week in making sure children across our nation are better protected: https://www. youtube.com/watch?v=cuw2QC BaRV8&feature=youtu.be …";;;;"867762742412890112";https://twitter.com/RepMikeCoffman/status/867762742412890112
;2017-05-24 20:27;1;1;"ICYMI: Today @SecShulkin recognized our efforts on... https:// goo.gl/m1scpC pic.twitter.com/xsOjJ0x73n";;@SecShulkin;;"867552710505054208";https://twitter.com/RepMikeCoffman/status/867552710505054208
;2017-05-24 20:23;4;14;"Can we place bets on this? --Staff";;;;"867551570174595072";https://twitter.com/RepMikeCoffman/status/867551570174595072
;2017-05-24 13:54;3;4;"'Private Act' Criminalizes Non-Consensual Pornography... https:// goo.gl/g0ptPv pic.twitter.com/OB5dda733H";;;;"867453671864401920";https://twitter.com/RepMikeCoffman/status/867453671864401920
;2017-05-24 08:16;4;8;"Every child deserves to have a safe childhood. Voting on 8 bills this week to protect children & punish abusers.... https:// goo.gl/3Syglt";;;;"867368677007642625";https://twitter.com/RepMikeCoffman/status/867368677007642625
;2017-05-23 17:50;9;12;"Passed with a 418-0 vote.... https:// goo.gl/yKXjAA pic.twitter.com/jrf0vP9pbV";;;;"867150887621406720";https://twitter.com/RepMikeCoffman/status/867150887621406720
;2017-05-22 20:13;8;41;"Tragic images coming out of Manchester. My thoughts and prayers are with victims and their families. America stands with the U.K.";;;;"866824446182653952";https://twitter.com/RepMikeCoffman/status/866824446182653952
;2017-05-21 07:06;0;1;"@lourdesgnavarro looking forward to chatting shortly!";;@lourdesgnavarro;;"866263864895311872";https://twitter.com/RepMikeCoffman/status/866263864895311872
;2017-05-21 07:04;0;12;"I will be joining @NPRWeekend in a few minutes to talk about current events. Looking forward to having you tune-in.";;@NPRWeekend;;"866263467065581568";https://twitter.com/RepMikeCoffman/status/866263467065581568
;2017-05-20 21:07;4;10;"Thanks to all who attended our 'Small Business Resources and Lenders Fair'-- great conversations! pic.twitter.com/S7XVJz1fS3";;;;"866113255357517824";https://twitter.com/RepMikeCoffman/status/866113255357517824
;2017-05-20 11:19;2;3;"Looking forward to the small biz fair starting shortly. Special guest @SBAgov ! pic.twitter.com/sjRz4dxnzf";;@SBAgov;;"865965127685877761";https://twitter.com/RepMikeCoffman/status/865965127685877761
;2017-05-20 08:34;7;26;"We salute all of the great men and women who serve our country, both at home and abroad. You are true American heroes. #ArmedForcesDay pic.twitter.com/11KNSdkUf5";;;#ArmedForcesDay;"865923744157634561";https://twitter.com/RepMikeCoffman/status/865923744157634561
;2017-05-19 18:06;0;0;"'Police Week, GI Bill Improvement Act & Mueller'.. some of the topics of my next weekly newsletter . Sign-up here https:// goo.gl/uSCRWc";;;;"865705216355729410";https://twitter.com/RepMikeCoffman/status/865705216355729410
;2017-05-19 16:34;5;11;"It's #NationalPoliceWeek thanks to all LEO: @AuroraPD @CityofLittleton , @Greenwoodgov @CityofBrighton @ArapahoeSO @dcsheriff @AdamsCoSheriff pic.twitter.com/XaHrmFWCn1";;@AuroraPD @CityofLittleton @Greenwoodgov @CityofBrighton @ArapahoeSO @dcsheriff @AdamsCoSheriff;#NationalPoliceWeek;"865682209226633216";https://twitter.com/RepMikeCoffman/status/865682209226633216
;2017-05-19 09:56;1;2;"My latest op-ed in the @aurorasentinel about 'sanctuary cities' & the need for #immigrationreform in the U.S. https:// goo.gl/mgdgdy pic.twitter.com/ajCsuuNULV";;@aurorasentinel;#immigrationreform;"865581856531636224";https://twitter.com/RepMikeCoffman/status/865581856531636224
;2017-05-19 08:09;4;8;". @TGowdySC is a tough and independent former prosecutor who would make a great Chairman for the @GOPoversight committee.";;@TGowdySC @GOPoversight;;"865555110226649088";https://twitter.com/RepMikeCoffman/status/865555110226649088
;2017-05-18 10:53;0;4;"ICYMI: @RepMikeCoffman in the @nytimes 'Wounded Troops Discharged for Misconduct Often Had PTSD or T.B.I.'... https:// goo.gl/0xbt7o";;@RepMikeCoffman @nytimes;;"865234013727969281";https://twitter.com/RepMikeCoffman/status/865234013727969281
;2017-05-17 18:01;11;45;"pic.twitter.com/vL7Q3vtCMs";;;;"864979226033885189";https://twitter.com/RepMikeCoffman/status/864979226033885189
;2017-05-17 16:58;1;2;"This bill helps families of fallen officers collect benefits of loved ones w/a more accountable & transparent process. #NationalPoliceWeek pic.twitter.com/6Y8lw04QrP";;;#NationalPoliceWeek;"864963449931091968";https://twitter.com/RepMikeCoffman/status/864963449931091968
;2017-05-17 14:41;2;3;"#LIVE : I am Chairing the @HASCRepublicans 'Military Personnel Posture: FY 2018' hearing. Watch it live here https:// goo.gl/asnwdJ";;@HASCRepublicans;#LIVE;"864928967270301696";https://twitter.com/RepMikeCoffman/status/864928967270301696
;2017-05-17 11:19;2;1;"We look forward to having you join us! More http:// goo.gl/GBEwNx pic.twitter.com/0YCpTqD7hb";;;;"864878158151069696";https://twitter.com/RepMikeCoffman/status/864878158151069696
;2017-05-17 09:17;1;11;"Yesterday, w/ my support, the House passed yesterday HR. 1616. It's important to help state/local law enforcement fight crime in cyberspace. pic.twitter.com/QETs7ySVkP";;;;"864847373855580160";https://twitter.com/RepMikeCoffman/status/864847373855580160
;2017-05-17 08:59;4;23;"Glad to hear you are doing well @SenThomTillis !";;@SenThomTillis;;"864842867533111296";https://twitter.com/RepMikeCoffman/status/864842867533111296
;2017-05-16 20:38;695;2956;"We need the memos, Comey should testify and I still believe that a special prosecutor should be named.";;;;"864656333580238848";https://twitter.com/RepMikeCoffman/status/864656333580238848
;2017-05-16 17:01;29;130;"pic.twitter.com/AB2jWfxyaG";;;;"864601680633102336";https://twitter.com/RepMikeCoffman/status/864601680633102336
;2017-05-15 16:03;5;10;"Special thanks to Mayor Hogan and @AuroraGov team for all their hard work in making Salvadoran Consulate possible. Great work! pic.twitter.com/MEYxNQCbM5";;@AuroraGov;;"864224789199761413";https://twitter.com/RepMikeCoffman/status/864224789199761413
;2017-05-15 10:18;2;2;"pic.twitter.com/hxm8I9atQv";;;;"864138021934960640";https://twitter.com/RepMikeCoffman/status/864138021934960640
;2017-05-15 08:53;0;3;"Will be #Live on @KOANewsRadio shortly.... Looking forward to having you tune in!";;@KOANewsRadio;#Live;"864116631135563777";https://twitter.com/RepMikeCoffman/status/864116631135563777
;2017-05-14 18:38;1;14;"Happy #MothersDay to my Mom! Thank you for everything you have done for us. We love you! pic.twitter.com/W6IVHEnDK2";;;#MothersDay;"863901413260365824";https://twitter.com/RepMikeCoffman/status/863901413260365824
;2017-05-14 11:28;1;8;"Happy #MothersDay to all Moms who go above & beyond everyday! pic.twitter.com/88NZ05Cuhe";;;#MothersDay;"863793246253830146";https://twitter.com/RepMikeCoffman/status/863793246253830146
;2017-05-12 19:43;7;18;"The Marcus Foundation pledges $38m to help Vets right here in our own community. Honored to have joined them today: https:// goo.gl/VXWH2D pic.twitter.com/fcoACL0flV";;;;"863192886707458048";https://twitter.com/RepMikeCoffman/status/863192886707458048
;2017-05-12 15:34;4;8;"John is independent and tough. I second Senator Gardner's nomination of John Suthers for FBI Director. https:// twitter.com/sencorygardner /status/863059382644465664 …";;;;"863130398364250112";https://twitter.com/RepMikeCoffman/status/863130398364250112
;2017-05-11 17:39;30;142;"pic.twitter.com/AOPFFBLOwa";;;;"862799259262996480";https://twitter.com/RepMikeCoffman/status/862799259262996480
;2017-05-11 13:16;4;7;"ICYMI: Casey, Shaheen, Heller, Nadler, Coffman Reintroduce Bipartisan 'Pregnant Workers Fairness Act'... https:// goo.gl/DdFREY pic.twitter.com/z16odbxbhT";;;;"862733170822828033";https://twitter.com/RepMikeCoffman/status/862733170822828033
;2017-05-11 08:40;3;4;"Let us know if you are coming by clicking here: http:// goo.gl/GBEwNx pic.twitter.com/BqrX7ppJH1";;;;"862663747785162752";https://twitter.com/RepMikeCoffman/status/862663747785162752
;2017-05-10 11:47;17;33;"Rep. Coffman on #ComeyFiring : pic.twitter.com/Y6PVHHNy1Z";;;#ComeyFiring;"862348339299397632";https://twitter.com/RepMikeCoffman/status/862348339299397632
;2017-05-09 19:36;1;4;"Productive meeting today with the Cónsul General of El Salvador, Manuel Castillo. pic.twitter.com/k6w0CFg6GQ";;;;"862104139442130945";https://twitter.com/RepMikeCoffman/status/862104139442130945
;2017-05-09 13:24;1;6;"It was great to visit & talk with the Korean Pastors Association this morning in Aurora. Lots of good things happening in our community. pic.twitter.com/Z9SbWF6Aql";;;;"862010440569815040";https://twitter.com/RepMikeCoffman/status/862010440569815040
;2017-05-09 11:11;0;5;"#ThanksATeacherCO is this week.... RT and tell us who/why is your favorite teacher: pic.twitter.com/J4iEZY9HMx";;;#ThanksATeacherCO;"861977026663768064";https://twitter.com/RepMikeCoffman/status/861977026663768064
;2017-05-09 09:45;3;3;"Own or Run a Small Business? Come to our Resources & Lender Fair: https:// goo.gl/GBEwNx pic.twitter.com/XF2RUncsgU";;;;"861955396445114370";https://twitter.com/RepMikeCoffman/status/861955396445114370
;2017-05-08 14:20;3;4;"Great seeing everyone at today's at @AumhcAurora 13th Annual Spring Benefit luncheon. pic.twitter.com/kyKn3Fd8rt";;@AumhcAurora;;"861662109188358144";https://twitter.com/RepMikeCoffman/status/861662109188358144
;2017-05-07 20:02;0;0;"Great event!";;;;"861385874487087104";https://twitter.com/RepMikeCoffman/status/861385874487087104
;2017-05-06 18:21;3;11;"Honored to have been invited to say a few words at the 18th Annual Indian Dance Festival. Amazing talent! #CO pic.twitter.com/ChSdsyokqc";;;#CO;"860997903317389313";https://twitter.com/RepMikeCoffman/status/860997903317389313
;2017-05-06 13:35;2;5;"A pleasure to join the Korean Academy Year End Ceremony today. Great event. pic.twitter.com/04zTjz0NNd";;;;"860926041933656064";https://twitter.com/RepMikeCoffman/status/860926041933656064
;2017-05-05 18:01;3;9;"Today, I presented the @SBAgov 'Small Business Exporter of the Year' award to Avtech International. Thx also to @AuroraGov Mayor & Council: pic.twitter.com/aFJrPayAE2";;@SBAgov @AuroraGov;;"860630571558608896";https://twitter.com/RepMikeCoffman/status/860630571558608896
;2017-05-05 10:50;3;4;"Good #JobsReport numbers out today as #SmallBusinessWeek ends tomorrow. Support your community, shop local! pic.twitter.com/8ULh1QrFEI";;;#JobsReport #SmallBusinessWeek;"860522137194463233";https://twitter.com/RepMikeCoffman/status/860522137194463233
;2017-05-04 16:30;4;29;"Thx for tweet, hope your little one is doing good.";;;;"860245396391694341";https://twitter.com/RepMikeCoffman/status/860245396391694341
;2017-05-04 13:39;20;211;"Glad to have supported provision where Members of Congress have to live by same laws as the rest of Americans.";;;;"860202134217908224";https://twitter.com/RepMikeCoffman/status/860202134217908224
;2017-05-04 11:24;376;1277;"Coffman on his ‘No’ Vote on AHCA: pic.twitter.com/jcsYqLmVid";;;;"860168260410634241";https://twitter.com/RepMikeCoffman/status/860168260410634241
;2017-05-03 15:01;9;45;"Keeping our government funded and open is at the core of good governing. pic.twitter.com/URudOpCupr";;;;"859860599756533760";https://twitter.com/RepMikeCoffman/status/859860599756533760
;2017-05-03 11:48;7;7;"#SmallBusinessWeek pic.twitter.com/Cq0zeZxrml";;;#SmallBusinessWeek;"859811977698451456";https://twitter.com/RepMikeCoffman/status/859811977698451456
;2017-05-03 10:32;59;85;"My Statement & Position on the AHCA: pic.twitter.com/VdD7QnBNbR";;;;"859792881061683201";https://twitter.com/RepMikeCoffman/status/859792881061683201
;2017-05-02 10:42;0;5;"Great conversation today at #WSJMidMarket . Great questions and feedback on US Healthcare pic.twitter.com/Smh0ZtzA8L";;;#WSJMidMarket;"859432995832385540";https://twitter.com/RepMikeCoffman/status/859432995832385540
;2017-05-02 10:20;1;2;"Happy to be joining #WSJMidMarket today to talk about healthcare in US. pic.twitter.com/MDzfqPwdDe";;;#WSJMidMarket;"859427499780038657";https://twitter.com/RepMikeCoffman/status/859427499780038657
;2017-05-02 09:09;3;5;"#SmallBusinessWeek is taking place across the country this week. Which is your favorite small biz in our community? pic.twitter.com/cSkf0AGREY";;;#SmallBusinessWeek;"859409633991172097";https://twitter.com/RepMikeCoffman/status/859409633991172097
;2017-05-01 11:27;3;6;"This week is #SmallBusinessWeek .... support our community. Shop local. pic.twitter.com/c16zgEpBa5";;;#SmallBusinessWeek;"859081939948621824";https://twitter.com/RepMikeCoffman/status/859081939948621824
;2017-04-29 11:16;1;10;"Thanks to the Vietnam Veterans of America & the American Legion Post 161, for inviting me to speak this morning at their town hall meeting. pic.twitter.com/eYR2KVpx1w";;;;"858354410459729920";https://twitter.com/RepMikeCoffman/status/858354410459729920
;2017-04-27 16:12;3;4;"ICYMI: https:// townhall.com/columnists/con gressmanmikecoffman/2017/04/26/the-veterans-treatment-court-improvement-act-n2318684 …";;;;"857703944830812161";https://twitter.com/RepMikeCoffman/status/857703944830812161
;2017-04-26 16:06;1;3;"ICYMI: This morning I had the opportunity to talk w/US Pacific Commander, ADM. Harry Harris about N. Korea & + Threats. See video here: pic.twitter.com/60IL4IN2gM";;;;"857340063885209600";https://twitter.com/RepMikeCoffman/status/857340063885209600
;2017-04-26 14:11;1;3;"Coffman, @JeffFlake Introduce Bill Expanding Veteran Access to Treatment Courts https:// goo.gl/4ayl2v pic.twitter.com/PUx5dJeFm5";;@JeffFlake;;"857311285930848256";https://twitter.com/RepMikeCoffman/status/857311285930848256
;2017-04-26 13:43;74;186;"As I have said from the beginning... https:// twitter.com/mj_lee/status/ 852317483814055938 …";;;;"857304084839366657";https://twitter.com/RepMikeCoffman/status/857304084839366657
;2017-04-26 09:28;3;4;"This morning, I joined the @ColoradoREA as they traveled to #DC to discuss electric coops. Thanks to all who attended! pic.twitter.com/XmNCNc6ugx";;@ColoradoREA;#DC;"857240065726193664";https://twitter.com/RepMikeCoffman/status/857240065726193664
;2017-04-25 14:04;2;2;"Catch the 2017 Congressional Art Competition s' here https:// goo.gl/HflltK pic.twitter.com/bebg9m50Ml";;;;"856947140979040256";https://twitter.com/RepMikeCoffman/status/856947140979040256
;2017-04-24 13:29;4;15;"#HolocaustRemembranceDay pic.twitter.com/MXVtaFoi77";;;#HolocaustRemembranceDay;"856575778150125568";https://twitter.com/RepMikeCoffman/status/856575778150125568
;2017-04-24 12:00;1;1;"I will be joining @wolfblitzer today at 1pm ET / 1am MT. Look forward to your comments/tweets.";;@wolfblitzer;;"856553550830284801";https://twitter.com/RepMikeCoffman/status/856553550830284801
;2017-04-23 15:03;5;11;"Joined the Peruvian #CO community today for the victims and those left homeless in Peru due to recent storms. The US stands w/Peru. pic.twitter.com/WwGsf5fiDl";;;#CO;"856237016429862912";https://twitter.com/RepMikeCoffman/status/856237016429862912
;2017-04-22 15:59;4;8;"#HappeningNow : In Littleton looking at this years submissions of the 2017 Congressional Art Competition. A lot of talent in our district! pic.twitter.com/PAxuA68d4m";;;#HappeningNow;"855888939164545024";https://twitter.com/RepMikeCoffman/status/855888939164545024
;2017-04-21 12:21;14;30;"Coffman Urges U.S. Treasury To Keep Russian Sanctions in Place https:// goo.gl/gyqgIM";;;;"855471598614319104";https://twitter.com/RepMikeCoffman/status/855471598614319104
;2017-04-21 11:14;3;3;"National Park Week.... #FindYourPark here https:// goo.gl/iFsJCr pic.twitter.com/QBDhvtFFQM";;;#FindYourPark;"855454784622645248";https://twitter.com/RepMikeCoffman/status/855454784622645248
;2017-04-20 16:22;9;16;"Coming up next #Live on @MeetThePress Daily: pic.twitter.com/pmcHzwj2gj";;@MeetThePress;#Live;"855169703500804096";https://twitter.com/RepMikeCoffman/status/855169703500804096
;2017-04-20 15:43;2;6;"Will be joining @chucktodd today at 3pm MT/5pm ET on @MeetThePress to district district work period, town hall & the 115th Congress!";;@chucktodd @MeetThePress;;"855160001173827584";https://twitter.com/RepMikeCoffman/status/855160001173827584
;2017-04-19 18:18;3;6;"Veterans’ Choice Program Signed Into Law https:// goo.gl/42HkfC";;;;"854836746630115328";https://twitter.com/RepMikeCoffman/status/854836746630115328
