username;date;retweets;favorites;text;geo;mentions;hashtags;id;permalink
;2013-08-20 13:32;3;0;"We must do more for our #veterans and end this #VAbacklog now http:// washingtonexaminer.com/va-progress-on -claims-backlog-is-a-statistical-illusion-vets-groups-say/article/2534453 …";;;#veterans #VAbacklog;"369889817489711104";https://twitter.com/RepMikeCoffman/status/369889817489711104
;2013-08-19 14:47;2;1;"I hope you'll be able to join me this weekend in #Aurora http:// coffman.house.gov/index.php?opti on=com_content&task=view&id=832&Itemid=58 …";;;#Aurora;"369546165349404672";https://twitter.com/RepMikeCoffman/status/369546165349404672
;2013-08-16 18:07;2;0;"I want to thank the Brighton Banner for their coverage of my trip to the Salud Clinic in their community yesterday: http://www. localcolormag.com/images/DailyPo st.pdf …";;;;"368509364258095105";https://twitter.com/RepMikeCoffman/status/368509364258095105
;2013-08-15 22:49;4;0;"Hosted a Job Skills Seminar in Aurora this morning, then traveled to Brighton to visit the Salud Clinic and the Vestas wind turbine plant.";;;;"368218051113521152";https://twitter.com/RepMikeCoffman/status/368218051113521152
;2013-08-15 09:31;4;0;"This mismanagement is hurting our #veterans and our community in #Aurora http://www. denverpost.com/breakingnews/c i_23863888/va-demands-proof-from-kiewit-that-aurora-hospital …";;;#veterans #Aurora;"368017052792913920";https://twitter.com/RepMikeCoffman/status/368017052792913920
;2013-08-14 21:34;2;1;"5 months ago, Sen Mark Udall and I created a PTSD Taskforce to help our returning vets. We had a public hearing today at the State Capitol.";;;;"367836546600144898";https://twitter.com/RepMikeCoffman/status/367836546600144898
;2013-08-13 16:17;3;1;".@RepKirkpatrick and I just sent letter to VA demanding answers for #Veterans and #SmallBusiness http://www. coffman.house.gov/index.php?opti on=com_content&task=view&id=831&Itemid=8 …";;@RepKirkpatrick;#Veterans #SmallBusiness;"367394576400515072";https://twitter.com/RepMikeCoffman/status/367394576400515072
;2013-08-12 18:34;1;0;"I was honored to be part of the Hinkley Freshman Family Orientation Day last week: http:// aurorak12.org/2013/08/12/hin kley-freshmen-get-head-start-at-family-orientation-day/ …";;;;"367066654972198912";https://twitter.com/RepMikeCoffman/status/367066654972198912
;2013-08-07 15:40;7;2;"I hope you'll join me and @MarkUdall on 8/14 to discuss #PTSD and health programs for our #Veterans http:// coffman.house.gov/index.php?opti on=com_content&view=article&id=828%3Asenator-mark-udall-rep-mike-coffman-bipartisan-post-traumatic-stress-taskforce-to-convene-public-meeting-at-state-capitol&catid=53%3Aupcoming-events&Itemid=54 …";;@MarkUdall;#PTSD #Veterans;"365210750702190593";https://twitter.com/RepMikeCoffman/status/365210750702190593
;2013-08-07 15:19;2;0;"Great meeting today with constituents at the Holly Creek Retirement Community. Thanks @HollyCreek for having me out.";;@HollyCreek;;"365205529225723904";https://twitter.com/RepMikeCoffman/status/365205529225723904
;2013-08-06 19:54;2;0;"It was great to address and interact with students, faculty, teachers, and staff at Hinkley HS, in Aurora yesterday, during Orientation Day.";;;;"364912493757345792";https://twitter.com/RepMikeCoffman/status/364912493757345792
;2013-08-05 15:33;3;3;"US funds must not fall to terrorists http://www. foxnews.com/politics/2013/ 08/05/army-wont-suspend-contracts-with-al-qaeda-tied-companies/ … This is why I co-wrote HR2912 with @jasoninthehouse http:// thomas.loc.gov/cgi-bin/bdquer y/z?d113:h.r.2912 … :";;@jasoninthehouse;;"364484391579303936";https://twitter.com/RepMikeCoffman/status/364484391579303936
;2013-08-02 14:17;8;2;"I supported @RepTomPrice 's bill to #StoptheIRS and defund #Obamacare which the House passed 232-185. http:// clerk.house.gov/evs/2013/roll4 47.xml …";;@RepTomPrice;#StoptheIRS #Obamacare;"363378076073213952";https://twitter.com/RepMikeCoffman/status/363378076073213952
;2013-08-01 08:29;1;0;"Happy #ColoradoDay ! What makes you proud to be a #Coloradan on this 137th birthday of our home state? Share your #ColoradoPride !";;;#ColoradoDay #Coloradan #ColoradoPride;"362928177636585473";https://twitter.com/RepMikeCoffman/status/362928177636585473
;2013-07-31 09:53;2;0;"See my latest efforts in Congress to fight for #Colorado #Veterans and #SmallBusiness http:// coffman.house.gov/index.php?opti on=com_content&task=view&id=818&Itemid=8 …";;;#Colorado #Veterans #SmallBusiness;"362586803540209664";https://twitter.com/RepMikeCoffman/status/362586803540209664
;2013-07-30 11:09;1;0;"My continued thoughts and prayers are with @HerreraBeutler as she prepares to bring her new baby daughter home http:// redalertpolitics.com/2013/07/29/rep -jaime-herrera-beutler-has-her-miracle-baby/ …";;@HerreraBeutler;;"362243573699198977";https://twitter.com/RepMikeCoffman/status/362243573699198977
;2013-07-26 13:07;4;1;"Great article in @USATODAY about why #rareearths are so important for America. http://www. usatoday.com/story/money/bu siness/2013/07/21/gold-rush-era-discards-could-fuel-cellphones-tvs/2572761/ …";;@USATODAY;#rareearths;"360823602733531136";https://twitter.com/RepMikeCoffman/status/360823602733531136
;2013-07-25 13:54;2;0;"While Colorado has prepared itself, Administration delays #ObamaCare , see my recent interview with @VillagerDenver http://www. villagerpublishing.com/coffman-predic ts-supports-more-delays-in-obamacare/ …";;@VillagerDenver;#ObamaCare;"360473209532973056";https://twitter.com/RepMikeCoffman/status/360473209532973056
;2013-07-25 08:15;46;32;"I supported @repjustinamash amendment on #NSA data collection last night, sorry to see it fail, this is a debate worth continuing.";;@repjustinamash;#NSA;"360387832990281729";https://twitter.com/RepMikeCoffman/status/360387832990281729
;2013-07-24 12:31;1;0;"On 7/24/98 police officers John Gibson & JJ Chestnut were killed defending our Capitol. At 3:40 we take a moment of silence in their honor.";;;;"360089779590803457";https://twitter.com/RepMikeCoffman/status/360089779590803457
;2013-07-19 15:48;2;1;"My statement on the first anniversary of the Aurora shooting. http://www. coffman.house.gov/index.php?opti on=com_content&view=article&id=807:rep-coffmans-statement-on-first-anniversary-of-aurora-shooting&catid=36:latest-news&Itemid=10 …";;;;"358327447340589057";https://twitter.com/RepMikeCoffman/status/358327447340589057
;2013-07-11 12:17;8;2;"Read my recent press release on repealing the individual mandate. http://www. coffman.house.gov/index.php?opti on=com_content&task=view&id=802&Itemid=8 …";;;;"355375185127407616";https://twitter.com/RepMikeCoffman/status/355375185127407616
;2013-07-10 19:11;8;4;"The mismanagement of the new VA hospital, by the VA, is garnering more scrutiny. Our veterans deserve better: http://www. coffman.house.gov/index.php?opti on=com_content&view=article&id=798:chronic-mismanagement-on-va-hospital-projects&catid=36:latest-news&Itemid=10 …";;;;"355117062475104257";https://twitter.com/RepMikeCoffman/status/355117062475104257
;2013-07-10 11:22;23;2;"It is possible to cut the military budget without jeopardizing our national defense. Please share if you agree: http://www. coffman.house.gov/index.php?opti on=com_content&view=article&id=796:a-veteran-in-congress-takes-aim-at-pentagon-waste&catid=36:latest-news&Itemid=10 …";;;;"354999093271076865";https://twitter.com/RepMikeCoffman/status/354999093271076865
;2013-07-03 18:36;4;2;"Please take time to reflect, on Thursday, upon the concepts, sacrifices, and courage put forth by our Founding Fathers some 237 years ago.";;;;"352571675084193793";https://twitter.com/RepMikeCoffman/status/352571675084193793
;2013-07-02 14:05;1;0;"Our veterans deserve better than this: http://www. denverpost.com/news/ci_235805 25/colorados-new-va-hospital-will-be-late-and …";;;;"352141018092675072";https://twitter.com/RepMikeCoffman/status/352141018092675072
;2013-06-28 12:25;3;0;"My statement on the passage of the Senate Immigration Reform bill. http://www. coffman.house.gov/index.php?opti on=com_content&view=article&id=787:rep-coffman-statement-on-passage-of-senate-immigration-bill&catid=36:latest-news&Itemid=10 …";;;;"350666275766284289";https://twitter.com/RepMikeCoffman/status/350666275766284289
;2013-06-24 15:40;1;1;"Great meeting this morning with local board of Ed members and superintendents to discuss No Child Left Behind.";;;;"349265697202896901";https://twitter.com/RepMikeCoffman/status/349265697202896901
;2013-06-24 15:37;0;0;"https://www. youtube.com/watch?v=kVNjfQ 6M1yo&list=UUBCe9Os3VRutyBw3aLhYq5g&feature=player_embedded …";;;;"349264988445229056";https://twitter.com/RepMikeCoffman/status/349264988445229056
;2013-06-19 11:18;1;0;"This week is Nat'l Small Business Week. I applaud the efforts of entrepreneurs everywhere since you really did build your own business.";;;;"347387903111991296";https://twitter.com/RepMikeCoffman/status/347387903111991296
;2013-06-14 11:31;1;1;"My thoughts and prayers go out to those impacted by the #Colorado #wildfires .";;;#Colorado #wildfires;"345579219696353281";https://twitter.com/RepMikeCoffman/status/345579219696353281
;2013-06-13 13:53;3;1;"Partisanship is not a factor for military veterans on the House Armed Services Committee: http://www. nationaljournal.com/congress/legis lative-comrades-in-arms-tend-to-put-politics-aside-20130612 …";;;;"345252696443453441";https://twitter.com/RepMikeCoffman/status/345252696443453441
;2013-06-05 16:19;2;1;"More reason to support for my Military Enlistment and Opportunity Act http://www. nbcnews.com/video/nightly- news/52077438?lite&lite=obnetwork#51494832 … and http://www. nbcnews.com/video/nightly- news/52077438?lite&lite=obnetwork#51494785 …";;;#51494832 #51494785;"342390277669003264";https://twitter.com/RepMikeCoffman/status/342390277669003264
;2013-06-05 15:02;2;1;"This is unacceptable. http://www. politico.com/story/2013/06/ computer-hacking-veterans-affairs-department-92227.html …";;;;"342370929260769280";https://twitter.com/RepMikeCoffman/status/342370929260769280
;2013-06-03 16:49;3;1;"Democrats and Republicans are calling on the president take direct action to end the backlog of cases at the VA: http://www. coffman.house.gov/index.php?opti on=com_content&view=article&id=765:democrats-and-republicans-in-congress-press-obama-to-end-backlog-of-veterans-claims&catid=36:latest-news&Itemid=10 …";;;;"341672933204320257";https://twitter.com/RepMikeCoffman/status/341672933204320257
;2013-05-28 11:47;3;1;"More can and should be done to help our veterans who have given so much to this country. Read more: http://www. coffman.house.gov/index.php?opti on=com_content&view=article&id=762:coffman-and-murphy-lead-letter-to-obama-urging-action-on-the-va-claims-backlog&catid=36:latest-news&Itemid=10 …";;;;"339422765163638785";https://twitter.com/RepMikeCoffman/status/339422765163638785
;2013-05-22 11:34;1;0;"Find out how #immigration reform can help the #military . http:// coffman.house.gov/index.php?opti on=com_content&view=article&id=758:enlistment-opportunity-act-serves-military-needs&catid=42:opinion-editorials&Itemid=11 …";;;#immigration #military;"337245195919847427";https://twitter.com/RepMikeCoffman/status/337245195919847427
;2013-05-21 17:21;2;2;"My bill, Improving Job Opportunities for Veterans, passed the House today. Read more: http:// blogs.denverpost.com/thespot/2013/0 5/21/rep-mike-coffmans-veterans-to-work-bill-overwhelmingly-passes-full-house/96666/ …";;;;"336970081512853504";https://twitter.com/RepMikeCoffman/status/336970081512853504
;2013-05-15 15:57;3;2;"I have submitted a local example of taxpayer abuse to be included in in any investigation of the IRS: http://www. coffman.house.gov/index.php?opti on=com_content&view=article&id=756%3Acoffman-submits-local-example-to-be-included-in-investigation-of-irs-&catid=36%3Alatest-news&Itemid=10 …";;;;"334774533661794304";https://twitter.com/RepMikeCoffman/status/334774533661794304
;2013-05-15 12:36;1;0;"Hosting one-on-one constituent meetings, from 9:30 - 11AM this Saturday, at Koelbel Library - 5955 S. Holly St. in Centennial.";;;;"334723988645367809";https://twitter.com/RepMikeCoffman/status/334723988645367809
;2013-05-15 12:15;4;0;"Today is Nat'l Peace Officers Memorial Day. 41 law enforcement officers, across the nation, died in the line of duty so far this year.";;;;"334718655076134913";https://twitter.com/RepMikeCoffman/status/334718655076134913
;2013-05-14 17:53;5;0;"May 12 - 18 is National Police Week. Thank your local law enforcement officials for all they do in your community. Share if you agree.";;;;"334441245516627968";https://twitter.com/RepMikeCoffman/status/334441245516627968
;2013-05-10 10:51;0;0;"Great meeting this morning with the Colorado Space Coalition. Aerospace is a critical part of Colorado's economy. Thanks for having me.";;;;"332885506700476416";https://twitter.com/RepMikeCoffman/status/332885506700476416
;2013-05-09 09:31;8;1;"Re-tweet this link if you agree that we need to end governments exemption from Obamacare. https://www. youtube.com/watch?list=UUB Ce9Os3VRutyBw3aLhYq5g&feature=player_embedded&v=KEVRgL5IeOs …";;;;"332502982140772352";https://twitter.com/RepMikeCoffman/status/332502982140772352
;2013-05-08 17:04;0;0;"My statement on the Working Families Flexibility Act. Re-tweet if you agree with this commonsense legislation. http://www. coffman.house.gov/index.php?opti on=com_content&view=article&id=752:house-passes-the-working-families-flexibility-act-of-2013&catid=36:latest-news&Itemid=10 …";;;;"332254653465100289";https://twitter.com/RepMikeCoffman/status/332254653465100289
;2013-05-08 10:22;3;0;"Today, the House Veteran’s Affairs Committee unanimously approved two of my bills to assist our veterans. http://www. coffman.house.gov/index.php?opti on=com_content&view=article&id=750:house-committee-for-veterans-affairs-unanimously-approves-coffman-bills-that-help-veterans&catid=36:latest-news&Itemid=10 …";;;;"332153458620768258";https://twitter.com/RepMikeCoffman/status/332153458620768258
;2013-05-07 15:39;2;0;"The process the VA employs to build its healthcare facilities is abysmal and leads to delays in care for veterans. This is not acceptable.";;;;"331870813085122560";https://twitter.com/RepMikeCoffman/status/331870813085122560
;2013-05-06 18:47;6;0;"I'm introducing an amendment to strike $3 billion in funding for the Abrams tank that the Army did not request and does not want. Retweet";;;;"331555779826040832";https://twitter.com/RepMikeCoffman/status/331555779826040832
;2013-05-02 17:25;27;2;"We need a constitutional amendment that strips the power from congress to continually spend money that we don’t have. Re-tweet if you agree.";;;;"330085684360646657";https://twitter.com/RepMikeCoffman/status/330085684360646657
;2013-05-01 15:46;2;0;"Western Caucus hearing on wildfires at the Colorado State Capitol Tomorrow http://www. westerncaucus.pearce.house.gov/press-releases /congressional-western-caucus-announces-witnesses-for-field-hearing-in-colorado/ …";;;;"329698358170103808";https://twitter.com/RepMikeCoffman/status/329698358170103808
;2013-05-01 13:54;7;0;"Our VA hospitals should be held to the same infectious disease reporting standards as private hospitals. Re-tweet if you agree.";;;;"329670284661641216";https://twitter.com/RepMikeCoffman/status/329670284661641216
;2013-05-01 11:36;3;1;"It was an honor to join the students from Aurora and Cherry Creek Schools last night at the Aurora Scholars Award presentation.";;;;"329635518222589952";https://twitter.com/RepMikeCoffman/status/329635518222589952
;2013-04-30 17:24;0;0;"Spoke today at the DTC/Greenwood Village Chamber of Commerce luncheon. Great group of business leaders.";;;;"329360704886960129";https://twitter.com/RepMikeCoffman/status/329360704886960129
;2013-04-29 15:45;3;0;"I introduced legislation that requires the VA to report cases of infectious diseases to the appropriate state agency. http://www. coffman.house.gov/index.php?opti on=com_content&view=article&id=743:coffman-introduces-legislation-after-his-oversight-and-investigation-hearing-uncovered-a-legionella-outbreak-at-a-pittsburgh-va-hospital&catid=36:latest-news&Itemid=10 …";;;;"328973231182733312";https://twitter.com/RepMikeCoffman/status/328973231182733312
;2013-04-25 16:16;3;1;"Today the VA Subcommittee on Economic Opportunity approved my legislative proposals aimed at helping veterans. http://www. coffman.house.gov/index.php?opti on=com_content&view=article&id=742:veterans-subcommittee-on-economic-opportunity-passes-rep-coffmans-legislative-proposals-to-help-veterans&catid=36:latest-news&Itemid=10 …";;;;"327531473257246722";https://twitter.com/RepMikeCoffman/status/327531473257246722
;2013-04-25 11:26;3;0;"The Western Congressional Caucus to be in Denver, on May 2nd,for an important hearing at the State Capitol: http://www. westerncaucus.pearce.house.gov/press-releases /congressional-western-caucus-announces-witnesses-for-field-hearing-in-colorado/ …";;;;"327458727655534592";https://twitter.com/RepMikeCoffman/status/327458727655534592
;2013-04-24 17:08;3;0;"Congratulations to Aurora Mayor Steve Hogan for being honored as "Man of the Year" at the 58th Aurora Chamber Annual Awards Banquet!";;;;"327182323428757505";https://twitter.com/RepMikeCoffman/status/327182323428757505
;2013-04-22 12:03;2;0;"Attended the kick-off meeting for the bipartisan PTSD taskforce this morning with @MarkUdall . Important work ahead to help our #veterans .";;@MarkUdall;#veterans;"326380798766886912";https://twitter.com/RepMikeCoffman/status/326380798766886912
;2013-04-19 20:12;2;0;"Kudos to the various law enforcement agencies, and for the many tips from the public, that helped capture the remaining bombing suspect.";;;;"325416661878468609";https://twitter.com/RepMikeCoffman/status/325416661878468609
;2013-04-18 11:25;8;2;"Given the state of our modern military, we do not need Selective Service. http://www. coffman.house.gov/index.php?opti on=com_content&view=article&id=736:coffman-defazio-request-elimination-of-funding-for-the-selective-service-system&catid=36:latest-news&Itemid=10 …";;;;"324921712359665664";https://twitter.com/RepMikeCoffman/status/324921712359665664
;2013-04-16 13:13;2;1;"My thoughts and prayers go out to the victims and their families of this horrific terrorist attack in Boston yesterday.";;;;"324224108579659776";https://twitter.com/RepMikeCoffman/status/324224108579659776
;2013-04-15 17:37;1;0;"“Just watched the President speak on the Boston Marathon bombing. My thoughts and prayers are with those affected.”";;;;"323928199241281537";https://twitter.com/RepMikeCoffman/status/323928199241281537
;2013-04-15 15:08;3;0;"My thoughts and prayers go out to those affected by the explosion during the Boston Marathon today.";;;;"323890497699602432";https://twitter.com/RepMikeCoffman/status/323890497699602432
;2013-04-15 12:54;1;0;"Today is Tax Day, and Congress is poised to spend money we don’t have. A Balanced Budget Amendment is needed to stop the spiraling debt.";;;;"323856946027438080";https://twitter.com/RepMikeCoffman/status/323856946027438080
;2013-04-10 14:28;2;0;"I introduced legislation today, HR 1412, to help our veterans make the transition to the civilian workforce: http://www. coffman.house.gov/index.php?opti on=com_content&view=article&id=726:coffman-bill-to-expand-job-training-for-vets&catid=36:latest-news&Itemid=10 …";;;;"322068581464567808";https://twitter.com/RepMikeCoffman/status/322068581464567808
;2013-04-09 16:09;1;2;"Today I introduced legislation aimed at expanding job training opportunities for veterans. Read more here: http://www. coffman.house.gov/index.php?opti on=com_content&view=article&id=726:coffman-bill-to-expand-job-training-for-vets&catid=36:latest-news&Itemid=10 …";;;;"321731501345611776";https://twitter.com/RepMikeCoffman/status/321731501345611776
;2013-04-08 14:18;0;0;"So sorry to hear that we have lost a gallant figure like former British Prime Minister Margaret Thatcher. She was truly a world leader.";;;;"321341176756183040";https://twitter.com/RepMikeCoffman/status/321341176756183040
;2013-04-04 15:26;2;0;"Working with Senator Michael Bennet, in a bipartisan effort, to promote Colorado's aerospace industry: http://www. coffman.house.gov/index.php?opti on=com_content&view=article&id=720:bennet-coffman-launch-working-group-to-further-reform-aerospace-export-regulations-&catid=36:latest-news&Itemid=10 …";;;;"319908909995421697";https://twitter.com/RepMikeCoffman/status/319908909995421697
;2013-04-03 19:12;0;0;"I appreciated being invited by the Colorado Forum to discuss national and foreign issues with their members today.";;;;"319603409579810817";https://twitter.com/RepMikeCoffman/status/319603409579810817
;2013-04-01 19:00;1;0;"I enjoyed interacting with state and local elected officials and community leaders at the Midterm Legislators' Breakfast in Aurora today.";;;;"318875612360085505";https://twitter.com/RepMikeCoffman/status/318875612360085505
;2013-03-29 16:07;0;1;"I met with about 120 members of the Aurora Association of Realtors yesterday to discuss current housing market issues.";;;;"317744760267890688";https://twitter.com/RepMikeCoffman/status/317744760267890688
;2013-03-28 14:44;2;0;"Great meeting at Buckley AFB yesterday. Toured the Aerospace Data Facility and met with Gen. John Flourney of the Air Reserve Personnel Ctr";;;;"317361588527050752";https://twitter.com/RepMikeCoffman/status/317361588527050752
;2013-03-27 17:45;1;0;"I had a great meeting yesterday evening with the Brighton City Council and city department heads.";;;;"317044733342011392";https://twitter.com/RepMikeCoffman/status/317044733342011392
;2013-03-27 14:10;0;0;"I'm looking forward to seeing the artistic talent of high school students, in my district, next month. http://www. coffman.house.gov/index.php?opti on=com_content&task=view&id=713&Itemid=10 …";;;;"316990582193008640";https://twitter.com/RepMikeCoffman/status/316990582193008640
;2013-03-25 15:54;8;2;"Today, I introduced the Veteran Paralympics Act that supports adaptive sports programs for disabled veterans. http://www. coffman.house.gov/index.php?opti on=com_content&view=article&id=714:coffman-aims-to-extend-paralympic-program-that-helps-disabled-veterans-recover&catid=36:latest-news&Itemid=10 …";;;;"316292100146741249";https://twitter.com/RepMikeCoffman/status/316292100146741249
;2013-03-21 14:32;73;9;"After a decade at war, over 500,000 veterans are stuck in the VA disability claims backlog. This is unacceptable! Retweet, if you agree.";;;;"314821914667384832";https://twitter.com/RepMikeCoffman/status/314821914667384832
;2013-03-20 14:24;5;1;"Bipartisanship oversight in Washington, DC is possible and necessary: http://www. politico.com/story/2013/03/ watchdog-caucus-bolsters-oversight-89028.html …";;;;"314457527184130049";https://twitter.com/RepMikeCoffman/status/314457527184130049
;2013-03-19 10:09;3;1;"My statement on the 10 year anniversary of the Iraq War: http://www. coffman.house.gov/index.php?opti on=com_content&view=article&id=711:coffman-statement-on-10-year-anniversary-of-iraq-war-&catid=36:latest-news&Itemid=10 …";;;;"314030797642412032";https://twitter.com/RepMikeCoffman/status/314030797642412032
;2013-03-15 17:28;3;3;"Our veterans deserve better! http://www. coffman.house.gov/index.php?opti on=com_content&view=article&id=709:epic-waits-gaming-the-books-at-some-va-hospitals-testimony-reveals&catid=36:latest-news&Itemid=10 …";;;;"312691766295949312";https://twitter.com/RepMikeCoffman/status/312691766295949312
;2013-03-13 15:30;916;116;"I'm co-sponsoring a bill to restore tuition aid for our military by cutting funds to Egypt. Retweet if you agree. http:// coffman.house.gov/index.php?opti on=com_content&view=article&id=709:coffman-opposes-end-to-tuition-assistance-for-military-wants-egypt-aid-cut-to-restore-funding&catid=36:latest-news&Itemid=10 …";;;;"311937401771659265";https://twitter.com/RepMikeCoffman/status/311937401771659265
;2013-03-08 14:45;0;1;"My statement on the capture of Bin Laden's son-in-law. http://www. coffman.house.gov/index.php?opti on=com_content&view=article&id=704:coffman-statement-on-capture-of-bin-ladens-son-in-law&catid=36:latest-news&Itemid=10 …";;;;"310129173026979841";https://twitter.com/RepMikeCoffman/status/310129173026979841
;2013-03-07 14:15;10;4;"Yesterday I introduced a bill to eliminate the Selective Service that will save taxpayers $24 million a year. http://www. coffman.house.gov/index.php?opti on=com_content&view=article&id=701:coffman-defazio-introduce-bill-to-eliminate-selective-services-system&catid=36:latest-news&Itemid=10 …";;;;"309759331480514561";https://twitter.com/RepMikeCoffman/status/309759331480514561
;2013-03-06 12:22;7;1;"Over 600 of my constituents from Colorado’s 6th district have been affected by the White House tour cancellations.";;;;"309368351191351296";https://twitter.com/RepMikeCoffman/status/309368351191351296
;2013-02-28 12:11;3;1;"#VAWA will bring violent criminals to justice. http:// coffman.house.gov/index.php?opti on=com_content&view=article&id=696:coffman-statement-on-passage-of-the-violence-against-women-act&catid=36:latest-news&Itemid=10 … #COPolitics";;;#VAWA #COPolitics;"307191207015104512";https://twitter.com/RepMikeCoffman/status/307191207015104512
;2013-02-28 12:10;5;1;"#VAWA is necessary to protect the health & safety of women who are victims of sexual assault & domestic violence. #COPolitics";;;#VAWA #COPolitics;"307191073262940161";https://twitter.com/RepMikeCoffman/status/307191073262940161
;2013-02-28 12:09;3;2;"I am pleased the House passed the Senate version of the Violence Against Women Act today. #COPolitics #VAWA";;;#COPolitics #VAWA;"307190800402509824";https://twitter.com/RepMikeCoffman/status/307190800402509824
