username;date;retweets;favorites;text;geo;mentions;hashtags;id;permalink
;2015-06-25 07:37;0;0;"Watch my interview with CSPAN about life in #Congress , #family and my #priorities @CSPANVL http://www. c-span.org/video/?326628- 1/conversation-freshman-representative-john-ratcliffe-rtx …";;@CSPANVL;#Congress #family #priorities;"614049838502707200";https://twitter.com/RepRatcliffe/status/614049838502707200
;2015-06-24 15:32;0;0;"UPDATE: Texas Disaster information - Individuals should register with @fema by July 29. Find out how: http:// bit.ly/floodresources4";;@fema;;"613806808428253184";https://twitter.com/RepRatcliffe/status/613806808428253184
;2015-06-24 12:45;1;0;"Heading to @HouseHomeland shortly to start #OPMhack hearing to get answers from admin on OPM failures. Watch live: https:// twitter.com/HouseHomeland/ status/613757249807237121 …";;@HouseHomeland;#OPMhack;"613764796261859328";https://twitter.com/RepRatcliffe/status/613764796261859328
;2015-06-23 17:20;4;3;"My bill #HR1637 just passed the house to curb fraud, waste and abuse at #DHS http:// bit.ly/oversightDHS";;;#HR1637 #DHS;"613471619881676800";https://twitter.com/RepRatcliffe/status/613471619881676800
;2015-06-23 17:17;0;0;"Thanks for coming to visit @rbtbrooks https:// twitter.com/rbtbrooks/stat us/613452700957675521 …";;@rbtbrooks;;"613470847160840192";https://twitter.com/RepRatcliffe/status/613470847160840192
;2015-06-23 15:40;1;0;"I'll be on the floor this evening, speaking about my bill: #HR1637 @cspan watch live: http://www. c-span.org/video/?326659- 2/us-house-legislative-business&live …";;@cspan;#HR1637;"613446441558642692";https://twitter.com/RepRatcliffe/status/613446441558642692
;2015-06-23 14:48;0;0;"I have a duty to my constituents and the American people to protect taxpayer dollars from fraud, waste and abuse, all #Conservatives do.";;;#Conservatives;"613433359788716032";https://twitter.com/RepRatcliffe/status/613433359788716032
;2015-06-23 12:46;3;2;"As a #limitedgovernment #conservative , we should be reducing the over regulation of the American lifestyle, not bury it in more red tape.";;;#limitedgovernment #conservative;"613402647324790784";https://twitter.com/RepRatcliffe/status/613402647324790784
;2015-06-22 11:29;1;0;"UPDATE: Click for updated County by County Flood Map: http:// bit.ly/floodresources4 #TexasFlood pic.twitter.com/UIWmf3ot8k";;;#TexasFlood;"613020890016542720";https://twitter.com/RepRatcliffe/status/613020890016542720
;2015-06-21 11:08;0;1;"As the father of two daughters, I want to wish a #HappyFathersDay to all the dads out there. pic.twitter.com/Ux02LiX8ZG";;;#HappyFathersDay;"612653325075525632";https://twitter.com/RepRatcliffe/status/612653325075525632
;2015-06-19 10:55;1;3;"On @FoxBusiness with @TrishIntel talking #OPMhack pic.twitter.com/kX0xqyKdzE";;@FoxBusiness @TrishIntel;#OPMhack;"611925196082147329";https://twitter.com/RepRatcliffe/status/611925196082147329
;2015-06-18 13:18;1;2;"Grateful to join @RepBrianBabin @RepLouBarletta intro no funds to be used 4 office space for Pres. #ExecutiveAmnesty http:// bit.ly/DefundAmnesty";;@RepBrianBabin @RepLouBarletta;#ExecutiveAmnesty;"611598763816189952";https://twitter.com/RepRatcliffe/status/611598763816189952
;2015-06-18 12:20;1;1;"I'll be going on LIVE with @TrishIntel at 2:30p.m. ET on @FoxBusiness Tune In to hear me talk about the #OPMhack";;@TrishIntel @FoxBusiness;#OPMhack;"611584184709046272";https://twitter.com/RepRatcliffe/status/611584184709046272
;2015-06-18 11:47;1;0;"My thoughts and prayers go out to the families and folks impacted in the #SouthCarolina tragedy.";;;#SouthCarolina;"611575948530597888";https://twitter.com/RepRatcliffe/status/611575948530597888
;2015-06-18 10:41;1;3;"Health care is about patients, not politics. We're working this week to fix that. #HeathcareNotObamacare pic.twitter.com/w5m5chKbDc";;;#HeathcareNotObamacare;"611559260493746177";https://twitter.com/RepRatcliffe/status/611559260493746177
;2015-06-17 13:20;2;0;"Want to work for the 4th District of Texas this fall semester? https:// twitter.com/GOPJobBank/sta tus/611228024839761920 …";;;;"611237097995960320";https://twitter.com/RepRatcliffe/status/611237097995960320
;2015-06-16 15:50;1;1;"Everyone stay safe tonight in #TX04 #TSBill #tropicalstormbill";;;#TX04 #TSBill #tropicalstormbill;"610912265097744387";https://twitter.com/RepRatcliffe/status/610912265097744387
;2015-06-16 15:12;4;4;"Thanks to all the essay winners from the Rural Electric Coop contest that came to DC today - great questions pic.twitter.com/YaCk8NaxSC";;;;"610902736498896896";https://twitter.com/RepRatcliffe/status/610902736498896896
;2015-06-16 14:28;0;0;"Last night, I took to the floor to let admin officials know that #OperationChokePoint is flat out wrong: https:// youtu.be/ho4sgC5D0LY";;;#OperationChokePoint;"610891602471456768";https://twitter.com/RepRatcliffe/status/610891602471456768
;2015-06-16 13:15;0;0;"When you “weaponize” gov to go after folks you don't like & target political enemies, that’s how Third World govs operate. #OpChokePt";;;#OpChokePt;"610873236130140160";https://twitter.com/RepRatcliffe/status/610873236130140160
;2015-06-16 12:35;1;0;"Result of Op Choke Point, legitimate businesses in Texas have been forced to close, due to activist bureaucrats w/agenda #OpChokePt";;;#OpChokePt;"610863176654032897";https://twitter.com/RepRatcliffe/status/610863176654032897
;2015-06-16 11:40;1;0;"Folks all across the 4th dist. of Texas, want to run businesses & enjoy their freedoms without the fear of persecution #OperationChokePoint";;;#OperationChokePoint;"610849336142868481";https://twitter.com/RepRatcliffe/status/610849336142868481
;2015-06-16 10:59;0;0;"Under Pres. health care law, unelected bureaucrats in Washington have power to make Americans' health care decisions for them #Thatswrong";;;#Thatswrong;"610839013029601280";https://twitter.com/RepRatcliffe/status/610839013029601280
;2015-06-16 10:31;1;1;"In US, we are innocent until proven guilty. Operation Choke Point turns that sacred tenet on its head. #OperationChokePointisWrong";;;#OperationChokePointisWrong;"610831963373481984";https://twitter.com/RepRatcliffe/status/610831963373481984
;2015-06-15 14:15;5;3;"Cutting gov spending, lowering taxes & balancing the fed. budget are critical to giving youth a fair shot at the American dream #CutSpending";;;#CutSpending;"610525946353836032";https://twitter.com/RepRatcliffe/status/610525946353836032
;2015-06-15 12:30;0;0;"Want to see my latest "Ratcliffe Report" make sure you sign up for my enewsletter: http:// bit.ly/RatcliffeRepor temail … pic.twitter.com/iADyUQ4uIr";;;;"610499560553644032";https://twitter.com/RepRatcliffe/status/610499560553644032
;2015-06-14 11:50;2;4;"Happy #FlagDay2015 238 years ago, on this day the 2nd Continental Congress adopted the flag that still waves today pic.twitter.com/hKOyXo0v2t";;;#FlagDay2015;"610127077086400512";https://twitter.com/RepRatcliffe/status/610127077086400512
;2015-06-12 09:43;0;2;"Grateful to have my family come to Washington and see the #CongressionalBaseball game for charity. pic.twitter.com/kNNviSOf20";;;#CongressionalBaseball;"609370366578921472";https://twitter.com/RepRatcliffe/status/609370366578921472
;2015-06-11 13:48;0;0;"#TX04 Flood Map Update, FEMA Designated counties, Grayson, Fannin, Lamar, Bowie, Cass. http:// bit.ly/floodresources4 pic.twitter.com/QNPAl3RoFi";;;#TX04;"609069598739054592";https://twitter.com/RepRatcliffe/status/609069598739054592
;2015-06-11 12:50;0;0;"UDPATE: New #TX04 Counties qualify for PA from #FEMA - Grayson, Fannin, Lamar, Bowie, Cass -find out what to do here: http:// bit.ly/floodresources4";;;#TX04 #FEMA;"609055027324329984";https://twitter.com/RepRatcliffe/status/609055027324329984
;2015-06-11 07:01;0;1;"Talking to @MarkDavis this morning shortly, tune in: http:// bit.ly/ratclifferadio #Conservative";;@MarkDavis;#Conservative;"608967300574785536";https://twitter.com/RepRatcliffe/status/608967300574785536
;2015-06-10 14:30;0;1;"Thanks to all the students from Red Lick Middle School in #Texarkana . I think I was wearing the wrong color suit... pic.twitter.com/smH9Tx8FuK";;;#Texarkana;"608717808604577792";https://twitter.com/RepRatcliffe/status/608717808604577792
;2015-06-10 10:50;0;0;"This can be a large problem with both IRS scammers and FEMA scams, Be aware! #scam #TX04 https:// twitter.com/myssnews/statu s/607264428011102208 …";;;#scam #TX04;"608662531729666048";https://twitter.com/RepRatcliffe/status/608662531729666048
;2015-06-10 10:37;1;1;"Beware of phone scammers claiming to be IRS officials, looks like it's going around @myssnews http:// bit.ly/IRSSSScan";;@myssnews;;"608659140190167040";https://twitter.com/RepRatcliffe/status/608659140190167040
;2015-06-09 15:37;3;1;"Thanks to @SIAonline for having me as the keynote speaker at your summit and talk about #cybersecurity pic.twitter.com/tbBNljwrHx";;@SIAonline;#cybersecurity;"608372449013583872";https://twitter.com/RepRatcliffe/status/608372449013583872
;2015-06-08 14:01;0;2;"Thanks to everyone at the #Fate City Hall Groundbreaking ceremony. #TX04 @CityOfFate @HeraldBannerRC pic.twitter.com/rKo8vbotxx";;@CityOfFate @HeraldBannerRC;#Fate #TX04;"607985715020890112";https://twitter.com/RepRatcliffe/status/607985715020890112
;2015-06-05 11:43;1;0;"UDPATE: New information for #BowieCounty #TexasFlood http:// bit.ly/floodresources4";;;#BowieCounty #TexasFlood;"606864005022498816";https://twitter.com/RepRatcliffe/status/606864005022498816
;2015-06-04 16:04;3;1;"The president severely overstepped his constitutional authority when he attempted to legislate from the Oval Office #FreshmanAdvice";;;#FreshmanAdvice;"606567109544378368";https://twitter.com/RepRatcliffe/status/606567109544378368
;2015-06-04 15:15;2;4;"Just like comprehensive healthcare reform failed, we can’t make same mistake w/immigration. Start by securing the border. #FreshmanAdvice";;;#FreshmanAdvice;"606554785349693440";https://twitter.com/RepRatcliffe/status/606554785349693440
;2015-06-04 14:31;1;0;"The "Obama" economy should be much stronger, like the recovery we had in #Texas - #limitedGovernment #ProGrowth #FreshmanAdvice";;;#Texas #limitedGovernment #ProGrowth #FreshmanAdvice;"606543714173882371";https://twitter.com/RepRatcliffe/status/606543714173882371
;2015-06-04 13:15;2;0;"Our #nationaldebt is stifling economic growth and American prosperity. Washington must balance the budget. #FreshmanAdvice";;;#nationaldebt #FreshmanAdvice;"606524595349258240";https://twitter.com/RepRatcliffe/status/606524595349258240
;2015-06-04 12:15;0;0;"Yesterday I voted to prevent Obama from using taxpayer funds to defend the President’s #executiveamnesty in court http:// bit.ly/overreach2";;;#executiveamnesty;"606509508555206657";https://twitter.com/RepRatcliffe/status/606509508555206657
;2015-06-04 11:32;2;0;"Serious effort should be taken to counter #ISIS ' message & make it a “losing brand” in the world #FreshmanAdvice https:// youtu.be/m_ELYKaIhjk";;;#ISIS #FreshmanAdvice;"606498661741125632";https://twitter.com/RepRatcliffe/status/606498661741125632
;2015-06-04 10:30;1;0;"Washington has been too involved in health care for too long. Obamacare must be repealed and control given back to states. #FreshmanAdvice";;;#FreshmanAdvice;"606483102676844544";https://twitter.com/RepRatcliffe/status/606483102676844544
;2015-06-03 11:32;0;0;"UPDATE: Flood conditions and county by county information #TexasFlood http:// bit.ly/floodresources4";;;#TexasFlood;"606136279663673345";https://twitter.com/RepRatcliffe/status/606136279663673345
;2015-06-03 09:20;2;0;"Today's hearing in @HouseHomeland "Terror Gone Viral" Broadcast live: http:// bit.ly/viralterror";;@HouseHomeland;;"606103080157876224";https://twitter.com/RepRatcliffe/status/606103080157876224
;2015-06-02 14:41;1;0;"RECENT UPDATE: Find out what has changed regarding new flood and severe weather in #TX04 http:// bit.ly/floodresources4";;;#TX04;"605821452722405377";https://twitter.com/RepRatcliffe/status/605821452722405377
;2015-06-02 13:39;0;0;"Thanks to students at #UnionGrove High School for skyping! http:// bit.ly/UnionGroveHS";;;#UnionGrove;"605805842957410304";https://twitter.com/RepRatcliffe/status/605805842957410304
;2015-06-02 12:38;0;1;"Make sure that if you've had flood damage, you stay alert on possible fraud scenarios: http:// bit.ly/floodscams";;;;"605790497647398912";https://twitter.com/RepRatcliffe/status/605790497647398912
;2015-06-01 14:05;1;3;"Photos of storm damage in #SulphurSpringsTX - Get informed on #Flood and #StormDamage info: http:// bit.ly/floodresources4 pic.twitter.com/qbDeyE101E";;;#SulphurSpringsTX #Flood #StormDamage;"605449997396541440";https://twitter.com/RepRatcliffe/status/605449997396541440
;2015-06-01 13:02;1;0;"Beware of #scams and #fraud #insurance in aftermath of #disasterrecovery - know what's real and what's fake: http:// bit.ly/floodscams";;;#scams #fraud #insurance #disasterrecovery;"605434148887535618";https://twitter.com/RepRatcliffe/status/605434148887535618
;2015-05-29 17:15;0;0;"Congrats to Marciela Hernandez for winning the #ViewersChoice award for her artwork - The Dance. pic.twitter.com/IhJ3rXN5nk";;;#ViewersChoice;"604410668813422592";https://twitter.com/RepRatcliffe/status/604410668813422592
;2015-05-29 11:01;2;0;"Working with local officials to assess flood damage, my website has new information to keep you up to date: http:// bit.ly/floodresources4";;;;"604316544638713856";https://twitter.com/RepRatcliffe/status/604316544638713856
;2015-05-28 12:26;1;1;"Make sure you vote on your favorite... voting ends tomorrow! #ArtCompetition http:// bit.ly/ArtCompTX04 pic.twitter.com/OegPyn77s1";;;#ArtCompetition;"603975537900421121";https://twitter.com/RepRatcliffe/status/603975537900421121
;2015-05-27 14:16;1;2;"Just talked to @KTENnews about flood conditions in #TX04 and #LakeTexoma pic.twitter.com/cqz4zC25yM";;@KTENnews;#TX04 #LakeTexoma;"603641036611702784";https://twitter.com/RepRatcliffe/status/603641036611702784
;2015-05-27 13:55;0;0;"Make sure to let loved ones know you're safe and sound #TexasFlood https:// safeandwell.communityos.org/cms/index.php";;;#TexasFlood;"603635558674403330";https://twitter.com/RepRatcliffe/status/603635558674403330
;2015-05-27 12:39;2;0;"Thanks to everyone in #SulphurSpringsTX for attending #CoffeeWithYourCongressman this morning @ketrradio @myssnews pic.twitter.com/maKCQDiStF";;@ketrradio @myssnews;#SulphurSpringsTX #CoffeeWithYourCongressman;"603616417930346496";https://twitter.com/RepRatcliffe/status/603616417930346496
;2015-05-27 11:33;1;0;"Even though the House has voted to block admin's #WOTUS rules, their moving to greatly expand control over nation's waterways #overrreach";;;#WOTUS #overrreach;"603599827490897920";https://twitter.com/RepRatcliffe/status/603599827490897920
;2015-05-26 13:08;3;0;"Last week I went on the offensive, questioning the DOJ about the issues businesses face due to #OperationChokePoint https://www. youtube.com/watch?v=5ojmLa D5vTU&feature=youtu.be …";;;#OperationChokePoint;"603261337729282049";https://twitter.com/RepRatcliffe/status/603261337729282049
;2015-05-25 15:41;0;0;"Be careful out there, severe weather is happening all over #TX04";;;#TX04;"602937550156738562";https://twitter.com/RepRatcliffe/status/602937550156738562
;2015-05-25 15:34;1;2;"This #Memorial Day, we honor those who gave the ultimate sacrifice http:// on.fb.me/1IW6590";;;#Memorial;"602935837983121408";https://twitter.com/RepRatcliffe/status/602935837983121408
;2015-05-23 15:32;3;2;"Join with me and remember the true reason we honor those who have given the ultimate sacrifice #MemorialDayWeekend pic.twitter.com/2AA3zBnGqu";;;#MemorialDayWeekend;"602210403347640321";https://twitter.com/RepRatcliffe/status/602210403347640321
;2015-05-22 15:33;0;1;"Thanks to everyone who participated in my #TelephoneTownHall last night. I'm back in the district all next week! Great to be back.";;;#TelephoneTownHall;"601848446916648960";https://twitter.com/RepRatcliffe/status/601848446916648960
;2015-05-21 16:30;0;2;"Want to stream my #TelephoneTownHall live? http:// vekeo.buzz/s1J Starts at 7p.m. CT";;;#TelephoneTownHall;"601500268174254081";https://twitter.com/RepRatcliffe/status/601500268174254081
;2015-05-21 11:43;0;1;"#TownHall via telephone tonight: You can sign up here (DEADLINE 4pm CT) http:// vekeo.buzz/j1e pic.twitter.com/nGuSWUnj8I";;;#TownHall;"601427999469080577";https://twitter.com/RepRatcliffe/status/601427999469080577
;2015-05-20 10:15;0;0;"@the_USO making care packages with my staff to send to our deployed troops. #thankyouforyourservice pic.twitter.com/jimRtxjxqI";;@the_USO;#thankyouforyourservice;"601043522024820736";https://twitter.com/RepRatcliffe/status/601043522024820736
;2015-05-19 16:51;3;2;"With a nat'l debt over $18.2T, this program is not the best use of taxpayer's dollars - I'm grateful my amd passed https:// youtu.be/lPqePKFGmZE";;;;"600780766059069441";https://twitter.com/RepRatcliffe/status/600780766059069441
;2015-05-19 13:42;0;0;"Great talking with folks in #GrapevineTexas that care about #cybersecurity , direct from #Washington pic.twitter.com/ibbEHA316I";;;#GrapevineTexas #cybersecurity #Washington;"600733264542859265";https://twitter.com/RepRatcliffe/status/600733264542859265
;2015-05-18 15:12;2;0;"Great talking with Union Grove HS students via @Skype http://www. gilmermirror.com/view/full_stor y/26641121/article-U-S--Rep--John-Ratcliffe-Skype-with-Union-Grove-High-School?instance=lead_story_left_column … pic.twitter.com/TaREttCRmk";;@Skype;;"600393425846980608";https://twitter.com/RepRatcliffe/status/600393425846980608
;2015-05-18 12:22;0;0;"Congrats to all recent grads! #DidYouKnow Texas is a great place to start your new career: http://www. inc.com/zoe-henry/why- the-lone-star-state-wins-big-for-recent-grads.html …";;;#DidYouKnow;"600350651466416128";https://twitter.com/RepRatcliffe/status/600350651466416128
;2015-05-16 09:31;8;12;"Thank you for all that you do, for the hard work, daily sacrifice and selfless service #ArmedForcesDay #USmilitary pic.twitter.com/xhKGZGhtQb";;;#ArmedForcesDay #USmilitary;"599583026578862080";https://twitter.com/RepRatcliffe/status/599583026578862080
;2015-05-15 06:58;1;0;"Check out the #RepRatcliffeVekeo event at http:// vekeo.buzz/j1f via @vekeo #whatdoyouthink be sure to sign up before May 20th.";;@vekeo;#RepRatcliffeVekeo #whatdoyouthink;"599182175351795712";https://twitter.com/RepRatcliffe/status/599182175351795712
;2015-05-14 16:16;1;1;"I'll be hosting a live telephone town hall on may 21, sign up here http:// vekeo.buzz/j1e pic.twitter.com/nBDctt2twB";;;;"598959996789915650";https://twitter.com/RepRatcliffe/status/598959996789915650
;2015-05-14 09:11;3;1;"Thanks @robmckenna @CheriFMcGuire @MicrosoftDCU @FBI for allowing me to speak on fighting #cybercrime #MSFTCyberSec pic.twitter.com/0GgTGgI1Eh";;@robmckenna @CheriFMcGuire @MicrosoftDCU @FBI;#cybercrime #MSFTCyberSec;"598853262587142145";https://twitter.com/RepRatcliffe/status/598853262587142145
;2015-05-13 13:54;4;4;"Check out all of the #CongressionalArtCompetition finalists: vote on your favorite http:// on.fb.me/1JFIhDl";;;#CongressionalArtCompetition;"598561868278435840";https://twitter.com/RepRatcliffe/status/598561868278435840
;2015-05-13 12:55;1;1;"You've spoken: 75% say Yes to The Pain Capable Unborn Child Protection Act. Take part: https:// ratcliffe.house.gov/contact/newsle tter … pic.twitter.com/poElvWMjJE";;;;"598547035969585152";https://twitter.com/RepRatcliffe/status/598547035969585152
;2015-05-13 11:01;9;11;"Congrats to @RoyseCityHS student @_Aaron_Tamez_45 for winning the #CongressionalArtCompetition http:// go.usa.gov/3kppP";;@RoyseCityHS @_Aaron_Tamez_45;#CongressionalArtCompetition;"598518541650792448";https://twitter.com/RepRatcliffe/status/598518541650792448
;2015-05-11 11:28;1;0;"#ICYMI , I talked ISIS, lone wolf terrorism, and what we're doing about it on #lonestarpolitics @NBCDFW http://www. nbcdfw.com/news/politics/ 303216661.html …";;@NBCDFW;#ICYMI #lonestarpolitics;"597800342361767937";https://twitter.com/RepRatcliffe/status/597800342361767937
;2015-05-10 16:13;3;1;"Stay safe up in #Texoma #texomawx don't risk it!";;;#Texoma #texomawx;"597509776118050818";https://twitter.com/RepRatcliffe/status/597509776118050818
;2015-05-10 10:03;3;1;"#HappyMothersDay to my wonderful mother, and wonderful wife! pic.twitter.com/L1wqTaYSsL";;;#HappyMothersDay;"597416573469491200";https://twitter.com/RepRatcliffe/status/597416573469491200
;2015-05-10 08:11;2;0;"Going to be on live @NBCDFW @gromerjeffers #lonestarpolitics around 8:30 this morning. Tune in!";;@NBCDFW @gromerjeffers;#lonestarpolitics;"597388381891465217";https://twitter.com/RepRatcliffe/status/597388381891465217
;2015-05-08 12:59;8;5;"70 yrs ago today, US & Allied forces achieved the long fought victory over Germany, ending #WWII in Europe #VEDay70 pic.twitter.com/W4XtNFRk09";;;#WWII #VEDay70;"596736083846565888";https://twitter.com/RepRatcliffe/status/596736083846565888
;2015-05-08 11:29;1;0;"My #Texoma office in Sherman will host a grand opening today, come on by: https:// ratcliffe.house.gov/media-center/p ress-releases/congressman-ratcliffe-s-sherman-office-holds-grand-opening …";;;#Texoma;"596713434760118272";https://twitter.com/RepRatcliffe/status/596713434760118272
;2015-05-07 12:30;4;1;"We can be one voice, united in prayer as we strive to overcome the challenges before us. #NationalDayofPrayer http://www. nationalreview.com/article/418014 /open-letter-america-prayer-j-randy-forbes …";;;#NationalDayofPrayer;"596366436857040896";https://twitter.com/RepRatcliffe/status/596366436857040896
;2015-05-07 11:49;3;3;"Have a blessed day on this #NationalDayofPrayer pic.twitter.com/Sl3mVDB16K";;;#NationalDayofPrayer;"596356080608776193";https://twitter.com/RepRatcliffe/status/596356080608776193
;2015-05-06 13:49;5;1;"It was a privilege to cut the ribbon today at @TexasHealthRock and to meet some great nurses for #NationalNursesWeek pic.twitter.com/rlPyWGgC8a";;@TexasHealthRock;#NationalNursesWeek;"596024126327922688";https://twitter.com/RepRatcliffe/status/596024126327922688
;2015-05-05 13:40;2;2;"Great meeting teachers in the classroom in @paristexasusa #NationalTeacherAppreciation pic.twitter.com/bsVVVB8srM";;@paristexasusa;#NationalTeacherAppreciation;"595659236492750848";https://twitter.com/RepRatcliffe/status/595659236492750848
;2015-05-04 15:58;6;6;"Thanks to @go2grayson @ParisJC @TxkCollege and @ntcceagles for meeting to discuss higher education in #TX04 pic.twitter.com/eUBJsqXjsJ";;@go2grayson @ParisJC @TxkCollege @ntcceagles;#TX04;"595331565439295489";https://twitter.com/RepRatcliffe/status/595331565439295489
;2015-05-04 14:40;1;1;"No place in our society for senseless acts of terror that threaten our const. right to freedom of expression http:// go.usa.gov/3KBSV #garland";;;#garland;"595311939699499009";https://twitter.com/RepRatcliffe/status/595311939699499009
;2015-05-02 12:09;2;0;"Make sure to read @TxkGazette Opinion for why #Admin 's proposed expansion of floodplains could cost millions for Texarkana";;@TxkGazette;#Admin;"594549180997050368";https://twitter.com/RepRatcliffe/status/594549180997050368
;2015-05-01 14:50;0;0;"#RedRiverArmyDepot plays a vital role in the defense of our nation http:// go.usa.gov/3Bzvk pic.twitter.com/iwBTIQGBpu";;;#RedRiverArmyDepot;"594227299144204288";https://twitter.com/RepRatcliffe/status/594227299144204288
;2015-05-01 13:55;0;0;"The Depot has supported the war fighter since 1941. My amendment prohibits another round of #BRAC http:// go.usa.gov/3Bzvk #RedRiverArmyDepot";;;#BRAC #RedRiverArmyDepot;"594213461774630912";https://twitter.com/RepRatcliffe/status/594213461774630912
;2015-05-01 13:10;0;0;"My staff saying farewell to our first congressional intern Debbie. #texas04 pic.twitter.com/Sfj2kKmku7";;;#texas04;"594202226056425472";https://twitter.com/RepRatcliffe/status/594202226056425472
;2015-05-01 12:51;0;0;"It is a vital job creator for northeast Texas, and a critical component of our national defense #RedRiverArmyDepot http://www. defensecommunities.org/headlines/milc on-spending-bill-includes-missile-site-brac-amendments/#…";;;#RedRiverArmyDepot #;"594197362483965952";https://twitter.com/RepRatcliffe/status/594197362483965952
;2015-04-30 13:01;0;1;"#40thanniversary of fall of Saigon, Remembering great sacrifices. glad to get this flag 2 our #VietnamVets in #TXK pic.twitter.com/Hx7tTUdTAE";;;#40thanniversary #VietnamVets #TXK;"593837479356018689";https://twitter.com/RepRatcliffe/status/593837479356018689
;2015-04-30 11:45;3;2;"#GeorgeWashington sworn in as 1st #POTUS today in 1789, knew that being elected wasn't meant to be a permanent job. pic.twitter.com/eOEKuZeXlB";;;#GeorgeWashington #POTUS;"593818367481413632";https://twitter.com/RepRatcliffe/status/593818367481413632
;2015-04-29 18:00;0;0;"Going to be speaking on the house floor soon! http://www. c-span.org/video/?325576- 3/us-house-debate-fy-2016-spending-bills&live … Watch Live @cspan";;@cspan;;"593550423501500416";https://twitter.com/RepRatcliffe/status/593550423501500416
;2015-04-29 14:20;0;0;"Remember, rising tides lift all boats #OpportunityEconomy pic.twitter.com/vh4VBa0fBr";;;#OpportunityEconomy;"593494987049807874";https://twitter.com/RepRatcliffe/status/593494987049807874
;2015-04-29 10:05;1;1;"On the @visitthecapitol floor about to hear PM of Japan speak. #congress2015 Watch live on @cspan";;@visitthecapitol @cspan;#congress2015;"593431038195593216";https://twitter.com/RepRatcliffe/status/593431038195593216
;2015-04-27 16:55;2;0;"Thanks to everyone at Guardline in Atlanta TX, making protective gear so everyone stays safe #TX04 pic.twitter.com/E3f0JJOLX4";;;#TX04;"592809213740482560";https://twitter.com/RepRatcliffe/status/592809213740482560
