username;date;retweets;favorites;text;geo;mentions;hashtags;id;permalink
;2013-01-10 15:20;1;0;"Talked 2 the Wilsonville Rotary abt tackling our debt by putting good policy above good politics. We need 2 act now. #policyoverpolitics";;;#policyoverpolitics;"289481790027096065";https://twitter.com/RepSchrader/status/289481790027096065
;2013-01-01 22:21;2;1;"Schrader Statement on House Passage of "Fiscal Cliff" Deal http:// tinyurl.com/ap7uxsv";;;;"286326201583288320";https://twitter.com/RepSchrader/status/286326201583288320
;2013-01-01 22:19;45;6;"The fiscal cliff deal passed by the House tonight neither tackles the largest drivers of our deficits, nor says we will do so in the future";;;;"286325917905735680";https://twitter.com/RepSchrader/status/286325917905735680
;2012-12-25 12:03;0;2;"Wishing you and your family a very Merry Christmas today. May your holiday be peaceful and joyous.";;;;"283634165419749376";https://twitter.com/RepSchrader/status/283634165419749376
;2012-12-13 14:44;2;3;"Going on @MarkandDave on @1190KEX at 1 PM PST to talk about the looming "fiscal cliff." Please tune in and send me some feedback!";;@MarkandDave @1190KEX;;"279325995792752641";https://twitter.com/RepSchrader/status/279325995792752641
;2012-12-13 12:16;3;3;"My Improper Payments bill passed the House 402-0 today. It will cut billions of waste, fraud & abuse in gov spending. http:// tinyurl.com/cvgsm97";;;;"279288739220566017";https://twitter.com/RepSchrader/status/279288739220566017
;2012-11-01 15:28;1;1;"Discussed sequestration and the fiscal cliff w/ OR. Business Association members.";;;;"264101617685639168";https://twitter.com/RepSchrader/status/264101617685639168
;2012-11-01 14:01;0;1;"Safeway Distribution Center is an example of major employer in OR. working hard on energy efficiency.";;;;"264079809171316736";https://twitter.com/RepSchrader/status/264079809171316736
;2012-11-01 12:25;3;1;"Toured Fred Meyer Bakery and Distribution center, which employs 1200. Fred Meyer's been a driver of OR econ. for generations.";;;;"264055690824400898";https://twitter.com/RepSchrader/status/264055690824400898
;2012-10-31 16:17;2;1;"Visited the classrooms and garden at Grant Comm. School in Salem. Go Grizzlies!";;;;"263751611241885696";https://twitter.com/RepSchrader/status/263751611241885696
;2012-10-31 13:38;1;1;"Helped UPS deliver to Salem businesses. UPS is an energy innovator for the delivery sector.";;;;"263711538391699456";https://twitter.com/RepSchrader/status/263711538391699456
;2012-10-30 16:41;0;1;"Just finished talking current events w/ Lakeridge Con. Law students. I'm very impressed with their understanding of the issues.";;;;"263395294295756800";https://twitter.com/RepSchrader/status/263395294295756800
;2012-10-30 13:17;3;2;"This morning I visited Auto Svcs. Tech @PCC Sylvania. Top-notch facility and students.";;@PCC;;"263344006631657472";https://twitter.com/RepSchrader/status/263344006631657472
;2012-10-26 17:27;2;1;"Had a productive Q & A session with Rural Health Conf. attendees. Discussed a variety of healthcare access issues.";;;;"261957156327288832";https://twitter.com/RepSchrader/status/261957156327288832
;2012-10-26 14:36;1;1;"Toured the Rogue Brewery in Newport. OR company supporting 150 jobs. Maybe I can convince them to give me a tour of the hop farm nxt...";;;;"261914204557152257";https://twitter.com/RepSchrader/status/261914204557152257
;2012-10-25 14:32;2;1;"Just toured TLC FCU in Tillamook. The new branch is ergonomic and complete with a "quiet room", making it staff- and customer - friendly.";;;;"261550947317202945";https://twitter.com/RepSchrader/status/261550947317202945
;2012-10-25 12:17;3;1;"Just attended a briefing re: Portland Harbor Superfund. We've come a long way…still more to do.";;;;"261516968631365632";https://twitter.com/RepSchrader/status/261516968631365632
;2012-10-24 18:53;2;1;"Just checked out Dr. Gregory and team's new regenerative medicine lab @OHSU.";;@OHSU;;"261254177521532928";https://twitter.com/RepSchrader/status/261254177521532928
;2012-10-24 14:15;4;2;"Jughandle Project Grand Opening was a success. Amazing rapid bridge construction - http:// tinyurl.com/bt36h62 .";;;;"261184055205326848";https://twitter.com/RepSchrader/status/261184055205326848
;2012-10-23 12:03;3;1;"Just finished talking w/ students @Ackerman Center about civic involvement. I'm impressed w/ their amount of engagement!";;@Ackerman;;"260788539015438336";https://twitter.com/RepSchrader/status/260788539015438336
;2012-10-22 12:26;1;1;"This morning I visited the Children's Center. The new facility is comfortable, clean, and professional and supports children.";;;;"260431840937123842";https://twitter.com/RepSchrader/status/260431840937123842
;2012-10-19 18:00;2;1;"Was honored to speak at the new Animal Sc. Pavilion at OSU. Wish they had had such cutting-edge facilities when I was studying to be a vet!";;;;"259428735864946688";https://twitter.com/RepSchrader/status/259428735864946688
;2012-10-18 18:36;2;1;"Just participated in ribbon cutting for new repack rm. @Marion Polk Food Share. This expansion will help them better serve.";;@Marion;;"259075597798617089";https://twitter.com/RepSchrader/status/259075597798617089
;2012-10-18 15:56;1;0;"Just met w/OR Capital Branch of ASCE. Civil Engineers are key players in transportation and infrastructure and ultimately, jobs.";;;;"259035120550432768";https://twitter.com/RepSchrader/status/259035120550432768
;2012-10-18 13:47;2;1;"I got to speak at Comcast Cable Store in Salem Grand Opening. This store is interactive and will serve the Mid-Willamette Valley well.";;;;"259002893301075971";https://twitter.com/RepSchrader/status/259002893301075971
;2012-10-18 12:30;1;1;"Coca-Cola tour done…glad to see such state-of-the art manufacturing and distributing here in Wilsonville!";;;;"258983508637270016";https://twitter.com/RepSchrader/status/258983508637270016
;2012-10-17 13:24;3;3;"Toured new Oregon Tech campus in Wilsonville. OIT is an Oregon University System Institution getting folks ready for jobs in tech.";;;;"258634527386267649";https://twitter.com/RepSchrader/status/258634527386267649
;2012-10-17 10:49;2;1;"This a.m. I met stakeholders at Marion County Re-Entry event. Re-entry impacts the entire community and these folks do a fantastic job.";;;;"258595593843261440";https://twitter.com/RepSchrader/status/258595593843261440
;2012-10-16 12:25;2;0;"This a.m. I got to see how packaging and paper products are made at the Boise Inc. plant. Hardhats on!";;;;"258257375893532673";https://twitter.com/RepSchrader/status/258257375893532673
;2012-10-14 17:17;2;1;"This afternoon I addressed a crowd in celebration of the Arch Bridge, which connects West Linn and Oregon City.";;;;"257606089489657858";https://twitter.com/RepSchrader/status/257606089489657858
;2012-10-12 17:29;0;0;"Just attended the groundbreaking ceremony for the Nesmith Readiness Center in Dallas. What a great resource for the community and the 162nd!";;;;"256884236076863488";https://twitter.com/RepSchrader/status/256884236076863488
;2012-10-09 19:28;1;0;"Thanks to North Clackamas Ed. Assoc.: what a committed group serving children in North Clackamas County!";;;;"255827173133410304";https://twitter.com/RepSchrader/status/255827173133410304
;2012-10-09 12:52;0;0;"This a.m. I had met with Bldg. Trades leaders - they've got the vision for enhancing Oregon's built environment!";;;;"255727406160150529";https://twitter.com/RepSchrader/status/255727406160150529
;2012-10-08 15:13;1;1;"Today I addressed the OR Forest Ind. Council re: stable forests and sustainable investments. Healthy forests + Forest jobs = Oregon wins!";;;;"255400533605625856";https://twitter.com/RepSchrader/status/255400533605625856
;2012-10-02 14:31;1;1;"Joined OR Dems today to call for an investigation into the unfair subsidies China provides to its paper manufacturers http:// 1.usa.gov/PUS91o";;;;"253215764226637824";https://twitter.com/RepSchrader/status/253215764226637824
;2012-09-27 16:50;0;0;"Just stopped by Capitol Auto Group to check in on the auto biz in Salem. Might be time to trade in my old pickup for some new Detroit steel!";;;;"251438708044214272";https://twitter.com/RepSchrader/status/251438708044214272
;2012-09-27 10:49;3;0;"Had a very interesting lunch at the Oregon Wave Week conf. yesterday. If we can get it right, wave energy will be a huge deal for Oregon";;;;"251347896694345729";https://twitter.com/RepSchrader/status/251347896694345729
;2012-09-26 18:12;1;0;"Earlier today, I met with Ecotrust’s leadership team in PDX. An impressive group of Oregonians doing great things around the globe.";;;;"251097029349089280";https://twitter.com/RepSchrader/status/251097029349089280
;2012-09-26 16:31;0;0;"I'll be on the air with Mark & Dave today at 3:15 and 5:15. Be sure to tune in to 1190 KEX for a little drive time fun!";;;;"251071530916773888";https://twitter.com/RepSchrader/status/251071530916773888
;2012-09-26 16:13;0;0;"$4 mil grant to wave energy test facility off Oregon Coast will further OR's commitment to renewable energy innovation. http:// tinyurl.com/8tkwynk";;;;"251067086602895360";https://twitter.com/RepSchrader/status/251067086602895360
;2012-09-26 16:01;0;0;"This AM I stopped in to meet w/members of the Clack Co. Econ Dev Comm to disc econ dev & a path forward for the co. & state.";;;;"251063959858327552";https://twitter.com/RepSchrader/status/251063959858327552
;2012-09-26 11:20;1;0;"$6.3 mil FAA grant to @newportOR Municipal Airport is great news for the economic recovery of our coastal communities. http:// tinyurl.com/d7bft7j";;@newportOR;;"250993252243746816";https://twitter.com/RepSchrader/status/250993252243746816
;2012-09-25 11:50;1;0;"Visited McKesson’s Wilsonville pharmaceutical dist. facility today. Impressive operation and great employer with 110 hard working Oregonians";;;;"250638309330665472";https://twitter.com/RepSchrader/status/250638309330665472
;2012-09-25 10:45;1;1;"Just met w/the Clackamas County Business Alliance. Great opp to disc localissues & get feedback.";;;;"250622022441377792";https://twitter.com/RepSchrader/status/250622022441377792
;2012-09-19 12:07;1;0;"As Oregon's housing market recovers, OHSI can assist you with mortgage payment, loan refinancing and loan preservation. http:// tinyurl.com/25tdbm9";;;;"248468268279549952";https://twitter.com/RepSchrader/status/248468268279549952
;2012-09-11 08:56;1;0;"Today, we #Remember911 and honor the victims, families, first responders & service members that have sacrificed so much for our country.";;;#Remember911;"245521188229611520";https://twitter.com/RepSchrader/status/245521188229611520
;2012-09-06 17:27;1;1;"This pm I toured Kettle Foods. Kettle makes my favorite Buffalo Bleu chips right here in Salem! pic.twitter.com/Z0UNhBg4";;;;"243837889849479168";https://twitter.com/RepSchrader/status/243837889849479168
;2012-09-04 20:14;0;0;"This pm I was able to tour CAPACES in Woodburn. The new building is impressive & will serve as a hub for a #of organizations.";;;#of;"243155105078202368";https://twitter.com/RepSchrader/status/243155105078202368
;2012-09-04 17:59;0;0;"This pm Rep. Komp & I held a town hall @Country Meadows Village. It was a great opp for us to disc local issues & get feedback.";;@Country;;"243121072877228032";https://twitter.com/RepSchrader/status/243121072877228032
;2012-08-31 17:05;2;0;"I’ll be on KGW News Channel 8 tomorrow night for Straight Talk with Laurel Porter. Be sure to tune in at 6:30.";;;;"241657952174481408";https://twitter.com/RepSchrader/status/241657952174481408
;2012-08-30 18:56;0;0;"I was pleased to participate in a Alzheimer's forum @Salem Hospital this pm. I heard a lot of great ideas & plan on taking back to DC.";;@Salem;;"241323514710339586";https://twitter.com/RepSchrader/status/241323514710339586
;2012-08-30 18:30;0;1;"After visiting EPiC, I stopped by Garmin AT, for a site tour… And driving directions. pic.twitter.com/IoAuOVxp";;;;"241316881582145537";https://twitter.com/RepSchrader/status/241316881582145537
;2012-08-30 17:22;1;1;"Toured EPiC in Salem w/ owner & developer John Miller. EPiC houses two local cos, that specialize in green food prod. pic.twitter.com/MKt9m1Gl";;;;"241299850782703616";https://twitter.com/RepSchrader/status/241299850782703616
;2012-08-29 18:11;2;3;"Visited the OR State Fair, site of so much OR history. Susan B. Anthony visit in 1871, JFK visit in 1960 and today, the two foot corn dog";;;;"240949869341184000";https://twitter.com/RepSchrader/status/240949869341184000
;2012-08-29 15:33;2;0;"This am I sat down to meet w/OR hunger advocates. In July, I advocated for OR families by standing up against further reductions in SNAP.";;;;"240909950212263936";https://twitter.com/RepSchrader/status/240909950212263936
;2012-08-29 14:02;0;0;"Disc campaign fin w/ Move to Amend. I've intro a constitutional amend that would ensure that the voice of the maj remains > the $ of a few.";;;;"240887085798658048";https://twitter.com/RepSchrader/status/240887085798658048
;2012-08-29 12:57;1;1;"Today I stopped by the Hallie Ford Museum of Art @Willamette University in Salem to tour OR's third largest art museum pic.twitter.com/i5NuBhvN";;@Willamette;;"240870853179486209";https://twitter.com/RepSchrader/status/240870853179486209
;2012-08-29 12:06;3;0;"Today I was honored to receive RetireSafe's Standing Up for America's Seniors Award for 2012. pic.twitter.com/6VsWUeKY";;;;"240857966474063873";https://twitter.com/RepSchrader/status/240857966474063873
;2012-08-28 18:09;1;0;"Last weekend 17 students graduated from Springdale Jobs Corps. Congrats to all & good luck w/ your future endeavors.";;;;"240586855958056961";https://twitter.com/RepSchrader/status/240586855958056961
;2012-08-28 12:51;1;0;"This AM I met w/HMCC board members. Great discussion about promoting small business ownership & the Hispanic community. pic.twitter.com/2yCpX0lb";;;;"240507019432456192";https://twitter.com/RepSchrader/status/240507019432456192
;2012-08-27 21:23;2;0;"This PM I was honored to speak @the Alaska Air PDX-DCA Inaugural Reception. New non-stop flight opens economic doors starting tomorrow AM.";;@the;;"240273363443011584";https://twitter.com/RepSchrader/status/240273363443011584
;2012-08-27 15:43;1;0;"Just met w/Matt Perry @Big Dog Coffee to disc issues impt to our soldiers. They deserve the best we have to offer for their service.";;@Big;;"240187883783331840";https://twitter.com/RepSchrader/status/240187883783331840
;2012-08-27 14:40;3;1;"Walked thru Ulven Forging today. Family owned business with 178 great employees where they forge the "Scotty Cameron" putter.";;;;"240171978345033728";https://twitter.com/RepSchrader/status/240171978345033728
;2012-08-27 11:10;10;0;"This am I sat down w/PANCAN members to disc the effects of pancreatic cancer & my supp of HR 733 the Pancreatic Cancer Research & Edu Act.";;;;"240119177925496833";https://twitter.com/RepSchrader/status/240119177925496833
;2012-08-08 18:43;1;0;"Enjoyed meeting w/ members of the Salem Rotary this afternoon to discuss our fiscal future, local issues & the budget crisis back in DC.";;;;"233347803894648832";https://twitter.com/RepSchrader/status/233347803894648832
;2012-08-08 13:14;0;0;"This am I had the opp to speak @the Keizer Transit Center groundbreaking. It's a great project & will improve service & access to transit.";;@the;;"233264847733784576";https://twitter.com/RepSchrader/status/233264847733784576
;2012-07-30 17:34;0;0;"This is huge econ news for the Willamette Valley. Will reduce traffic, allow biz to enhance commerce and create long term job & growth opp.";;;;"230068781924376576";https://twitter.com/RepSchrader/status/230068781924376576
;2012-07-30 17:32;8;1;"Very pleased to announce @oregondot has been awarded $3.3 mil for the reconstruction of the I-5 Woodburn Interchange. http:// tinyurl.com/bnwywmo";;@oregondot;;"230068312665636864";https://twitter.com/RepSchrader/status/230068312665636864
;2012-07-27 11:05;0;0;"RT @cityofmilwaukie Milwaukie Daze wknd opens tonight! Tons of fun for the entire family! Full schedule of events here: http:// tinyurl.com/cw9w4h7";;@cityofmilwaukie;;"228883930688925697";https://twitter.com/RepSchrader/status/228883930688925697
;2012-07-27 10:45;2;1;"Good luck to all of our Oregon athletes competing on behalf of our great country in the 2012 #London #Olympics . Your hard work will pay off!";;;#London #Olympics;"228878692246511616";https://twitter.com/RepSchrader/status/228878692246511616
;2012-07-25 15:38;6;3;"Today I opposed opening up the Oregon Coast to potential offshore drilling. http:// tinyurl.com/cymxdls";;;;"228227719052283905";https://twitter.com/RepSchrader/status/228227719052283905
;2012-07-25 13:14;1;0;"Two of my bills to streamline process for OR tribes to take land into trust were heard in @NatResources subcommittee. http:// tinyurl.com/dxubmyk";;@NatResources;;"228191504882073601";https://twitter.com/RepSchrader/status/228191504882073601
;2012-07-24 15:14;1;0;"I introduced legislation today to strengthen the VA pension program and protect retired veterans from fraud. http:// tinyurl.com/clhly2n";;;;"227859287349796864";https://twitter.com/RepSchrader/status/227859287349796864
;2012-07-24 13:39;2;0;"Congrats to @Cherriots on their @FTA_DOT grant of over $589K to replace paratransit buses in the greater Salem area. http:// tinyurl.com/c4eowrg";;@Cherriots @FTA_DOT;;"227835512965193728";https://twitter.com/RepSchrader/status/227835512965193728
;2012-07-23 09:26;11;2;"Congrats to @oregonstateuniv on being awarded $1.7 million by the National Science Foundation to fund several studies http:// tinyurl.com/c88ogo5";;@oregonstateuniv;;"227409408387342337";https://twitter.com/RepSchrader/status/227409408387342337
;2012-07-20 08:41;1;0;"My heart goes out to the victims, their families and all Coloradans today following the awful tragedy in Aurora.";;;;"226310973298978816";https://twitter.com/RepSchrader/status/226310973298978816
;2012-07-20 08:28;0;0;"#FF Oregon Dems @RepBonamici @WydenPress @RonWyden @SenJeffMerkley @BlumenauerMedia @RepPeterDeFazio";;@RepBonamici @WydenPress @RonWyden @SenJeffMerkley @BlumenauerMedia @RepPeterDeFazio;#FF;"226307532367486978";https://twitter.com/RepSchrader/status/226307532367486978
;2012-07-19 17:23;5;0;"Yes, I do. @KATUPolitics Oregon's Kurt Schrader has harsh words about the latest defense spending deal in the House. http:// k2ne.ws/MuECeZ";;@KATUPolitics;;"226079758998441985";https://twitter.com/RepSchrader/status/226079758998441985
;2012-07-19 13:55;0;0;"ICYMI: There is not a strategic need to increase the defense base budget beyond the BCA agreement. http:// tinyurl.com/cxlt3yk";;;;"226027401182863361";https://twitter.com/RepSchrader/status/226027401182863361
;2012-07-19 12:37;1;0;"I'll be on the floor shortly to talk about the need for Dept of Defense to be as dedicated to federal deficit reduction as everyone else.";;;;"226007824415735808";https://twitter.com/RepSchrader/status/226007824415735808
;2012-07-19 09:58;7;1;"It's critical Congress pass the 2012 Farm Bill before the current bill expires in Sept leaving US farmers in the cold. http:// tinyurl.com/84mnver";;;;"225967791302389760";https://twitter.com/RepSchrader/status/225967791302389760
;2012-07-18 16:18;0;0;"I am going to be on @LarsLarsonShow on 101 FM KXL here in a minute to talk about the Farm Bill and SNAP. Tune in and give me some feedback!";;@LarsLarsonShow;;"225701140778590208";https://twitter.com/RepSchrader/status/225701140778590208
;2012-07-18 13:56;0;0;"RT @mrose_SJ Oregon has the highest level of residential building permits since November 2008. #economy #realestate http:// bit.ly/MJ81iX";;@mrose_SJ;#economy #realestate;"225665244205285376";https://twitter.com/RepSchrader/status/225665244205285376
;2012-07-18 12:32;1;0;"Our military leaders have said the biggest threat to national security is not a military one, but a fiscal threat driven by debt & deficits.";;;;"225644217890897921";https://twitter.com/RepSchrader/status/225644217890897921
;2012-07-18 12:29;2;0;"I spoke on the House floor today on the need to bring our brave troops home & make economic investments here in the US. http:// tinyurl.com/7s4ge9j";;;;"225643469715144708";https://twitter.com/RepSchrader/status/225643469715144708
;2012-07-18 10:51;0;0;"Enough is enough. We must be focusing on the deficit, economy and creating jobs like the American people want us to. http:// tinyurl.com/6mjnkfo";;;;"225618913948467201";https://twitter.com/RepSchrader/status/225618913948467201
;2012-07-18 10:24;0;1;"Great work by @TravelOregon . Must work to protect our coastal treasures, so this good economic news continues for us. http:// budurl.com/juuj";;@TravelOregon;;"225611961012994048";https://twitter.com/RepSchrader/status/225611961012994048
;2012-07-16 09:00;2;0;"ICYMI: I was on @KATUNews to talk about recent SCOTUS rulings, creating Oregon jobs and campaign finance reform. http:// tinyurl.com/7ttnm2h";;@KATUNews;;"224866177317482496";https://twitter.com/RepSchrader/status/224866177317482496
;2012-07-11 09:14;1;1;"House must move forward. Reduce the deficit, strengthen economy to boost investor confidence and create good, US jobs to compete globally.";;;;"223057697547886592";https://twitter.com/RepSchrader/status/223057697547886592
;2012-07-11 09:12;3;0;"The House Majority will vote to repeal the health care law for the 31st time today, while Oregonians are still wondering where are the jobs?";;;;"223057174023258112";https://twitter.com/RepSchrader/status/223057174023258112
;2012-07-06 08:19;1;0;"Read my guest column in The @Oregonian : Farm bill works for real agriculture reform for the 21st Century http:// tinyurl.com/bplg74a";;@Oregonian;;"221231898909876224";https://twitter.com/RepSchrader/status/221231898909876224
;2012-07-05 18:55;1;0;"Just finished visiting seniors at Pheasant Pointe. I had a great visit with folks and enjoyed updating them on my work in Washington.";;;;"221029564263043074";https://twitter.com/RepSchrader/status/221029564263043074
;2012-07-05 18:27;1;0;"After touring the Buckeroo Mayor Clarke & I stopped by OR Mortgage, Wild Bill's Gun Shop & Jasper's to meet w/sb owners in Molalla.";;;;"221022581980004352";https://twitter.com/RepSchrader/status/221022581980004352
;2012-07-05 17:37;0;0;"Took a "behind the scenes" tour of the Molalla Buckeroo w/ Tim. It's been an OR tradition since 1913 & is one of my favorites";;;;"221010037315862529";https://twitter.com/RepSchrader/status/221010037315862529
;2012-07-05 15:37;0;0;"Enjoyed lunch w/ members of the Clackamas Rotary @the Old Spaghetti Factory. It was a great opp to disc local issues & our fiscal future.";;@the;;"220979847621648384";https://twitter.com/RepSchrader/status/220979847621648384
;2012-07-02 15:40;1;0;"Met w/ OSBC members in Keizer & had a great disc w/ folks on ways we can increase access to capital & cut through unnecessary red tape.";;;;"219893391465525248";https://twitter.com/RepSchrader/status/219893391465525248
;2012-06-30 15:23;1;1;"Met w/ folks this am to disc the hazards of tsunami debris & identified steps moving forward to help ensure the safety of our nav channels.";;;;"219164302387580928";https://twitter.com/RepSchrader/status/219164302387580928
;2012-06-29 14:37;3;0;"I applaud trans reauthorization by Congress. Gives OR rural communs, undergrads and transportation biz certainty to plan for success.";;;;"218790269737369601";https://twitter.com/RepSchrader/status/218790269737369601
;2012-06-28 16:27;5;0;"There was no proof of any impropriety by AG Eric Holder. While he has not been a proponent of gun rights, Amer ppl deserve a better process.";;;;"218455712853000192";https://twitter.com/RepSchrader/status/218455712853000192
;2012-06-28 16:18;4;1;"Schrader Statement on U.S. Attorney General Contempt Resolution http:// tinyurl.com/cbh8gwu";;;;"218453417285267458";https://twitter.com/RepSchrader/status/218453417285267458
;2012-06-28 13:41;0;0;"Tune into @MarkandDave on KEX1190 now to hear my reaction to the #SCOTUS decision upholding the Affordable Care Act.";;@MarkandDave;#SCOTUS;"218413814843064321";https://twitter.com/RepSchrader/status/218413814843064321
;2012-06-28 09:58;4;0;"Shrader Statement on Supreme Court Ruling on Affordable Care Act http:// tinyurl.com/89bkebl";;;;"218357710289244160";https://twitter.com/RepSchrader/status/218357710289244160
;2012-06-27 17:17;2;0;"The House must pass legislation to keep student loan interest rates reduced for Oregon undergrads http:// tinyurl.com/7pv3lta #dontdoublemyrate";;;#dontdoublemyrate;"218105764194156544";https://twitter.com/RepSchrader/status/218105764194156544
;2012-06-25 17:09;7;0;"Today the Supreme Court again equated money to free speech, allowing unlimited amounts of $ to influence our elections. http:// tinyurl.com/7dfqgqn";;;;"217378937087606784";https://twitter.com/RepSchrader/status/217378937087606784
;2012-06-21 14:29;2;0;"I encourage my colleagues to stand with the bipartisan @FixCongressNow Caucus and promote the #NoBudgetNoPay Act http:// youtu.be/oItX9wHr1fs";;@FixCongressNow;#NoBudgetNoPay;"215889165785645056";https://twitter.com/RepSchrader/status/215889165785645056
;2012-06-21 12:28;3;0;"Would affect 120K Oregon undergrads on an average of an extra $1K/yr. Congress must act for our young folks to have an affordable uni edu.";;;;"215858704350851072";https://twitter.com/RepSchrader/status/215858704350851072
;2012-06-21 12:24;4;0;"Only 4 leg days left until federal student loan interest rates double to 6.8% for Oregon undergrads and their families. #DontDoubleMyRate";;;#DontDoubleMyRate;"215857640373354497";https://twitter.com/RepSchrader/status/215857640373354497
;2012-06-20 17:17;1;1;"I want to congratulate Emma Kennard from West Linn, the 2012 Congressional Art Competition Winner of OR's 5th District. pic.twitter.com/3DWdAiJe";;;;"215569119758651392";https://twitter.com/RepSchrader/status/215569119758651392
