username;date;retweets;favorites;text;geo;mentions;hashtags;id;permalink
;2015-07-06 13:26;10;3;"#ECAA MUST-READ: Sen. Alexander op-ed in @Tennessean on ending federal #CommonCore mandate http:// tinyurl.com/nszp3yv";;@Tennessean;#ECAA #CommonCore;"618123932948910082";https://twitter.com/SenAlexander/status/618123932948910082
;2015-07-02 12:20;1;0;"READ in @TimesFreePress : Alexander says #ChickLock announcement is “good news for #Tennessee ”: http:// bit.ly/1JAeH5K";;@TimesFreePress;#ChickLock #Tennessee;"616657816397475841";https://twitter.com/SenAlexander/status/616657816397475841
;2015-07-01 14:04;5;1;"Alexander announces that reconstruction on #ChickLock will start this year, which is good for #Tennessee #jobs : http:// 1.usa.gov/1gbMMwC";;;#ChickLock #Tennessee #jobs;"616321415445356544";https://twitter.com/SenAlexander/status/616321415445356544
;2015-07-01 13:38;3;2;"Sen. Alexander announces that U.S. Army Corps will provide $3 million for #ChickLock : http:// 1.usa.gov/1gbMMwC";;;#ChickLock;"616314828240650241";https://twitter.com/SenAlexander/status/616314828240650241
;2015-06-30 15:11;1;1;"READ abt. what Sen. Alexander has been working on this month and SIGN-UP for future newsletters: http:// 1.usa.gov/1eY0WBf";;;;"615976046681309184";https://twitter.com/SenAlexander/status/615976046681309184
;2015-06-30 14:56;1;3;"Alexander hosted an #education roundtable in Jackson to discuss fixing No Child Left Behind & simplifying the FAFSA: http:// 1.usa.gov/1eY0WBf";;;#education;"615972090454409216";https://twitter.com/SenAlexander/status/615972090454409216
;2015-06-30 13:51;4;2;"READ-IN June Newsletter: Alexander votes for free trade because “free trade means jobs”: http:// 1.usa.gov/1eY0WBf";;;;"615955809571336192";https://twitter.com/SenAlexander/status/615955809571336192
;2015-06-25 11:25;3;4;"Alexander statement on #KingvBurwell decision by @USSupremeCourt : http:// 1.usa.gov/1IAPGlb #SCOTUS #Obamacare";;@USSupremeCourt;#KingvBurwell #SCOTUS #Obamacare;"614107189104504832";https://twitter.com/SenAlexander/status/614107189104504832
;2015-06-25 10:37;8;6;"Alexander says on #SCOTUS decision, “ #Obamacare was an historic mistake”: http:// 1.usa.gov/1IAPGlb #KingvBurwell";;;#SCOTUS #Obamacare #KingvBurwell;"614095163099582464";https://twitter.com/SenAlexander/status/614095163099582464
;2015-06-25 09:34;2;2;"ICYMI: Alexander votes for free #trade which would bring even more #jobs to #Tennessee : http:// 1.usa.gov/1FCVZma";;;#trade #jobs #Tennessee;"614079200455168000";https://twitter.com/SenAlexander/status/614079200455168000
;2015-06-24 17:48;2;3;"Sen. Alexander votes for #TPA saying, “free trade means jobs”: http:// 1.usa.gov/1Nca4wD";;;#TPA;"613841186365833216";https://twitter.com/SenAlexander/status/613841186365833216
;2015-06-24 16:06;1;4;"… “when suggesting to 3.5 million teachers exactly how to do their job in helping 50 million students in 100,000 public schools.” 3/3";;;;"613815429744627714";https://twitter.com/SenAlexander/status/613815429744627714
;2015-06-24 16:05;4;4;"“Those of us who aren’t close to the child, who are at a distance, such as U.S. senators, ought to exercise some humility” 2/3";;;;"613815332449460224";https://twitter.com/SenAlexander/status/613815332449460224
;2015-06-24 16:05;2;3;"ICYMI: Sen. Alexander talks with @usnews about gov’t overreach in #education : http:// bit.ly/1SJWapc 1/3";;@usnews;#education;"613815133576556544";https://twitter.com/SenAlexander/status/613815133576556544
;2015-06-24 12:07;2;5;"READ: Sen. Alexander discusses “No Child Left Behind” and higher #education in @usnews : http:// bit.ly/1SJWapc";;@usnews;#education;"613755260797108228";https://twitter.com/SenAlexander/status/613755260797108228
;2015-06-23 15:57;3;1;"Alexander on @VW and @gestamp announcement: “Today, one-third of #TN manufacturing #jobs are auto-related”: http:// 1.usa.gov/1e1Nr2c";;@VW @gestamp;#TN #jobs;"613450801302884352";https://twitter.com/SenAlexander/status/613450801302884352
;2015-06-23 13:20;5;5;"Alexander says it is a “dangerous practice” for Dems to block #funding bills just bc #Obama has threatened to veto: http:// 1.usa.gov/1RpUFKd";;;#funding #Obama;"613411258033901568";https://twitter.com/SenAlexander/status/613411258033901568
;2015-06-23 12:35;5;6;"Sen. Alexander says @vwfactoryusa and @gestamp announcement of Chattanooga expansion is “good news”: http:// 1.usa.gov/1e1Nr2c #jobs";;@vwfactoryusa @gestamp;#jobs;"613399929378226180";https://twitter.com/SenAlexander/status/613399929378226180
;2015-06-23 12:20;3;2;"READ-IN Sen. Alexander’s Weekly Column, “Setting Priorities in Federal Spending”: http:// 1.usa.gov/1RpUFKd";;;;"613396241028902913";https://twitter.com/SenAlexander/status/613396241028902913
;2015-06-22 16:03;14;12;"Alexander: “flag to fly is the #American flag because it is a symbol that this is one country & we are all Americans": http:// 1.usa.gov/1CoTC6x";;;#American;"613090025224466432";https://twitter.com/SenAlexander/status/613090025224466432
;2015-06-22 13:41;6;1;"Alexander: “I hope they remove a flag that many see as a symbol of racial intolerance”: http:// 1.usa.gov/1CoTC6x";;;;"613054111811043329";https://twitter.com/SenAlexander/status/613054111811043329
;2015-06-22 10:33;1;0;"READ-IN @ClaibProgressTN : Alexander: “Stop telling students they can’t afford college”: http:// bit.ly/1Lpj7N7 #affordablecollege";;@ClaibProgressTN;#affordablecollege;"613006992274259968";https://twitter.com/SenAlexander/status/613006992274259968
;2015-06-22 10:18;3;5;"VIDEO: Sen. Alexander congratulates @SenBobCorker for championing U.S. leadership, receiving @USGLC award: http:// bit.ly/1Co8Rwz";;@SenBobCorker @USGLC;;"613003176023879680";https://twitter.com/SenAlexander/status/613003176023879680
;2015-06-19 11:43;9;5;"ICYMI: @thehill ’s AB Stoddard writes that Sen Alexander is poised to end the federal mandate on #CommonCore : http:// tinyurl.com/pufmur9";;@thehill;#CommonCore;"611937282698924032";https://twitter.com/SenAlexander/status/611937282698924032
;2015-06-19 09:35;4;1;""Democrats should have worked with Republicans to “improve this legislation to help keep the American people safe.” #ISIS #NationalSecurity";;;#ISIS #NationalSecurity;"611905259145986048";https://twitter.com/SenAlexander/status/611905259145986048
;2015-06-19 09:35;2;1;"On @DeptofDefense funding: "I voted for bipartisan legislation that supports our troops & national defense.” #ISIS http:// tinyurl.com/o9lagjr";;@DeptofDefense;#ISIS;"611905157316636672";https://twitter.com/SenAlexander/status/611905157316636672
;2015-06-18 16:23;0;2;"National Defense Authorization Act passes #Senate & authorizes funding for @DeptofDefense , @ENERGY : http:// 1.usa.gov/1QFuEM0";;@DeptofDefense @ENERGY;#Senate;"611645387720552448";https://twitter.com/SenAlexander/status/611645387720552448
;2015-06-18 14:28;3;3;"Alexander votes for Defense Authorization Act that supports #military and #nationalsecurity : http:// 1.usa.gov/1QFuEM0";;;#military #nationalsecurity;"611616435530518528";https://twitter.com/SenAlexander/status/611616435530518528
;2015-06-18 14:11;3;3;"Funding bill pushes back on @EPA regulations that “mean higher costs for #TN families, farmers & businesses”: http:// 1.usa.gov/1Fpavho";;@EPA;#TN;"611612162948210688";https://twitter.com/SenAlexander/status/611612162948210688
;2015-06-18 14:04;2;2;"Alexander voted for approps. bill that would fund @GSMNP , Cherokee Nat’l Forest, Dale Hollow & Erwin Fish Hatcheries: http:// 1.usa.gov/1Fpavho";;@GSMNP;;"611610570475839488";https://twitter.com/SenAlexander/status/611610570475839488
;2015-06-18 13:05;2;0;"AUDIO: “It is a dangerous practice to say that we are going to stop” b/c President #Obama threatens a #veto .: http:// 1.usa.gov/1BqdpqW [1:16]";;;#Obama #veto;"611595689626337280";https://twitter.com/SenAlexander/status/611595689626337280
;2015-06-18 12:57;5;1;"Sen. Alexander votes to support #Tennessee outdoors and restrain @EPA regulations: http:// 1.usa.gov/1Fpavho";;@EPA;#Tennessee;"611593488757583872";https://twitter.com/SenAlexander/status/611593488757583872
;2015-06-18 07:24;2;1;"VIDEO: Alexander discusses “unleashing #nuclear power & doubling basic #energy research to create #jobs ” http:// 1.usa.gov/1JY6eI5";;;#nuclear #energy #jobs;"611509889282777088";https://twitter.com/SenAlexander/status/611509889282777088
;2015-06-17 15:37;0;3;"VIDEO: Alexander says protecting the great American #outdoors is a top priority: http:// 1.usa.gov/1JY6eI5";;;#outdoors;"611271451119890432";https://twitter.com/SenAlexander/status/611271451119890432
;2015-06-17 11:16;6;9;"Sen. Alexander welcomes @TNELECTRIC ‘s Washington Youth Tour essay winners to the U.S. Capitol: pic.twitter.com/IP70JLH0Qc";;@TNELECTRIC;;"611205868546322433";https://twitter.com/SenAlexander/status/611205868546322433
;2015-06-17 10:40;0;3;"VIDEO: Sen. Alexander: free enterprise system will provide clean, cheap, reliable #energy : http:// 1.usa.gov/1JY6eI5";;;#energy;"611196718475046912";https://twitter.com/SenAlexander/status/611196718475046912
;2015-06-17 09:25;2;4;"#TN students on the Capitol steps discussing what they did to be selected as finalists for TN History Day: pic.twitter.com/ujk74PhGjs";;;#TN;"611177937275121666";https://twitter.com/SenAlexander/status/611177937275121666
;2015-06-16 13:21;2;4;"Sen. Alexander enjoyed visiting w/ Riverdale Elementary students at this morning’s #Tennessee constituent breakfast: pic.twitter.com/hCWjzh6SrL";;;#Tennessee;"610874841525297153";https://twitter.com/SenAlexander/status/610874841525297153
;2015-06-15 12:51;4;1;"Alexander:Give colleges/universities “skin in the game” to keep costs down & keep students from borrowing too much $: http:// bit.ly/1MFgNyO";;;;"610504896996098050";https://twitter.com/SenAlexander/status/610504896996098050
;2015-06-11 13:44;3;0;"Says #Democrats should drop threats to “block consideration of legislation that is so important to keeping the #American people safe.”";;;#Democrats #American;"609068601455337472";https://twitter.com/SenAlexander/status/609068601455337472
;2015-06-11 13:43;1;0;"Votes for appropriations bills to set budget priorities & support “our troops, national defense and law enforcement” http:// tinyurl.com/qgtrjbu";;;;"609068505502248960";https://twitter.com/SenAlexander/status/609068505502248960
;2015-06-11 10:48;4;3;"Sen. Alexander asks @natlparkservice to support legislation to study Polk Home in Columbia, #Tennessee : http:// 1.usa.gov/1JMEKow";;@natlparkservice;#Tennessee;"609024444108038144";https://twitter.com/SenAlexander/status/609024444108038144
;2015-06-10 14:30;9;6;"Alexander gets commitment from @natlparkservice to support legislation that preserves President Polk’s home and belongings.";;@natlparkservice;;"608717873360592896";https://twitter.com/SenAlexander/status/608717873360592896
;2015-06-10 11:15;4;1;"TUNE-IN @2:30: Alexander talks abt. preserving President James K. Polk home @Energy & Nat. Resources Cmte. hearing: http:// 1.usa.gov/1b8RL8a";;@2 @Energy;;"608668833780498432";https://twitter.com/SenAlexander/status/608668833780498432
;2015-06-09 16:08;6;9;"Sen. Alexander enjoyed spending time with Jessica Meyer, the 2015 Children’s Miracle Network Champion for #TN . pic.twitter.com/MXp5NmWGJi";;;#TN;"608380136220725249";https://twitter.com/SenAlexander/status/608380136220725249
;2015-06-09 14:19;1;4;"Sen. Alexander's office was glad to welcome the Nashville songwriters to DC today. pic.twitter.com/DxTRbHh5x8";;;;"608352726913826816";https://twitter.com/SenAlexander/status/608352726913826816
;2015-06-09 10:48;1;1;"Alexander talks abt. supercomputing & doubling basic #energy research with America COMPETES. #jobs #nationalsecurity : https:// youtu.be/X4lUqmP0DP4";;;#energy #jobs #nationalsecurity;"608299650114834433";https://twitter.com/SenAlexander/status/608299650114834433
;2015-06-09 08:35;0;0;"TUNE-IN: Sen. Alexander @10: Alexander #energy hearing on accountability and reform legislation: http:// 1.usa.gov/1b8RL8a";;@10;#energy;"608266195524034562";https://twitter.com/SenAlexander/status/608266195524034562
;2015-06-08 14:06;8;3;"WATCH: Sen. Alexander special on C-SPAN talking abt. his career & #Tennessee history: http://www. c-span.org/video/?326343- 1/senator-lamar-alexander-office-tour …";;;#Tennessee;"607987008481460225";https://twitter.com/SenAlexander/status/607987008481460225
;2015-06-08 13:51;3;0;"ICYMI: Sen. Alexander on C-SPAN’s American History TV: http://www. c-span.org/video/?326343- 1/senator-lamar-alexander-office-tour …";;;;"607983318873833472";https://twitter.com/SenAlexander/status/607983318873833472
;2015-06-05 12:36;3;5;"Alexander discusses his #ECAA bill to #FixNCLB , among other topics, with the @TimesFreePress editorial board today. pic.twitter.com/rD9LrhT7y0";;@TimesFreePress;#ECAA #FixNCLB;"606877242736713729";https://twitter.com/SenAlexander/status/606877242736713729
;2015-06-05 12:05;5;1;"Alexander cosponsors bill by @SenJohnThune to delay “burdensome regulations” from #EPA on #ozone standards http:// tinyurl.com/opgzcuy";;@SenJohnThune;#EPA #ozone;"606869464806768640";https://twitter.com/SenAlexander/status/606869464806768640
;2015-06-04 14:07;3;6;"Time to “preserve President Polk’s home and belongings and elevate the site to the nat’l treasure it deserves to be”: http:// 1.usa.gov/1M7LpZx";;;;"606537714146680833";https://twitter.com/SenAlexander/status/606537714146680833
;2015-06-04 13:16;3;2;"Alexander introduces study bill to preserve James K. Polk Home in Columbia, #TN as national treasure: http:// 1.usa.gov/1M7LpZx";;;#TN;"606524969862987776";https://twitter.com/SenAlexander/status/606524969862987776
;2015-06-03 15:52;6;5;"Sen. Alexander enjoyed having Madison Co. 4-H in his office today and talking abt. simplifying the #FAFSA pic.twitter.com/kMsGVl30D9";;;#FAFSA;"606201745669279744";https://twitter.com/SenAlexander/status/606201745669279744
;2015-06-03 09:31;3;2;"READ-IN: May Newsletter – Alexander proposes doubling basic #energy research, helping facilities in Oak Ridge: http:// 1.usa.gov/1K7xbcJ";;;#energy;"606105877133836289";https://twitter.com/SenAlexander/status/606105877133836289
;2015-06-02 16:30;0;1;"READ IN: This month’s newsletter – Alexander votes for a balanced #budget : http:// 1.usa.gov/1K7xbcJ";;;#budget;"605849009391964162";https://twitter.com/SenAlexander/status/605849009391964162
;2015-06-02 15:56;1;2;"Alexander welcomes students from @baylorschool to Tennessee Tuesday this morning. pic.twitter.com/VMm4zXyon8";;@baylorschool;;"605840449652146177";https://twitter.com/SenAlexander/status/605840449652146177
;2015-06-02 15:21;1;0;"READ IN: May newsletter – Alexander holds roundtable on low-cost #energy : http:// 1.usa.gov/1K7xbcJ";;;#energy;"605831556893044736";https://twitter.com/SenAlexander/status/605831556893044736
;2015-06-01 15:15;5;2;"Sen. Alexander monitoring incident of #anthrax shipment to TN labs": http:// tnne.ws/1Fjvun0";;;#anthrax;"605467845007405057";https://twitter.com/SenAlexander/status/605467845007405057
;2015-06-01 14:12;1;2;"Wants to simplify financial aid programs to “save students time and money and stop discouraging so many students”: http:// bit.ly/1LXtXqt";;;;"605451972058193920";https://twitter.com/SenAlexander/status/605451972058193920
;2015-06-01 12:49;7;1;"ICYMI: Alexander holds roundtable to discuss getting Washington out of schools & eliminating #CommonCore mandate: http:// bit.ly/1LXtXqt";;;#CommonCore;"605431110831587328";https://twitter.com/SenAlexander/status/605431110831587328
;2015-05-29 15:37;2;11;"Wants to "eliminate Washington red tape to make it easier to go to college" by removing obstacles like the #FAFSA pic.twitter.com/FSagK0V7Zw";;;#FAFSA;"604386150313299968";https://twitter.com/SenAlexander/status/604386150313299968
;2015-05-29 15:11;4;5;"Plans to #FixNCLb by "restoring responsibility to states & local govt, reversing trend to nat'l school board, & ending #CommonCore mandate”";;;#FixNCLb #CommonCore;"604379506036641792";https://twitter.com/SenAlexander/status/604379506036641792
;2015-05-29 15:11;9;2;"Alexander hosted roundtable in Jackson to discuss his bill to #FixNCLB & his plan to simplify the #FAFSA http:// 1.usa.gov/1HSDRvv";;;#FixNCLB #FAFSA;"604379470548635649";https://twitter.com/SenAlexander/status/604379470548635649
;2015-05-29 14:38;5;9;"Sen. Alexander checks out the #CountryMusic selection at the @CrackerBarrel in Jackson, #Tennessee pic.twitter.com/qQdDdYQXQr";;@CrackerBarrel;#CountryMusic #Tennessee;"604371338174828544";https://twitter.com/SenAlexander/status/604371338174828544
;2015-05-27 14:45;3;0;"Alexander writes that #TVA 's announcement is "good news for the businesses that create #jobs and depend on fishing in Tennessee" @knoxnews";;@knoxnews;#TVA #jobs;"603648333211656192";https://twitter.com/SenAlexander/status/603648333211656192
;2015-05-27 14:06;1;1;". @USFWSHQ director told Alexander " #TVA 's announcement reps a 'permanent solution' to keep TN's hatcheries open for yrs to come" @knoxnews";;@USFWSHQ @knoxnews;#TVA;"603638408049745921";https://twitter.com/SenAlexander/status/603638408049745921
;2015-05-27 14:05;3;0;"ICYMI: Check out Alexander's op-ed in @knoxnews , "Lamar Alexander: TVA, hatcheries solution good for Erwin, anglers" http:// bit.ly/1FZoiBY";;@knoxnews;;"603638068457906177";https://twitter.com/SenAlexander/status/603638068457906177
;2015-05-25 13:37;3;8;"3/3: "We owe all the men and women who have worn the uniform of our Armed Services a debt of gratitude that we couldn’t possibly repay."";;;;"602906467453247488";https://twitter.com/SenAlexander/status/602906467453247488
;2015-05-25 13:37;0;6;"2/3: "We are especially grateful to those who continue to serve our country on active duty and in the reserves and in the National Guard..”";;;;"602906320694603776";https://twitter.com/SenAlexander/status/602906320694603776
;2015-05-25 13:36;3;6;"1/3: “Today we remember the countless Americans and their families who have sacrificed so much to preserve our freedoms and way of life ...";;;;"602906071695499264";https://twitter.com/SenAlexander/status/602906071695499264
;2015-05-23 21:33;4;6;"Greeting Kallen Esperian after her beautiful performance at #MemphisInMay right before he takes the stage. pic.twitter.com/DjNu8DRiHx";;;#MemphisInMay;"602301448722853888";https://twitter.com/SenAlexander/status/602301448722853888
;2015-05-23 21:05;9;18;"A little Elvis to get the crowd going. #MemphisInMay pic.twitter.com/wdNkDDgNpG";;;#MemphisInMay;"602294353671815168";https://twitter.com/SenAlexander/status/602294353671815168
;2015-05-23 20:35;10;14;"Up next after intermission. #MemphisInMay pic.twitter.com/bKgqeGezGr";;;#MemphisInMay;"602286840310202368";https://twitter.com/SenAlexander/status/602286840310202368
;2015-05-23 19:24;6;5;"Pre-show prep. #MemphisInMay pic.twitter.com/UFonP8kNlN";;;#MemphisInMay;"602268843898081280";https://twitter.com/SenAlexander/status/602268843898081280
;2015-05-23 19:23;8;9;"Great crowd out for tonight's Sunset Symphony. #MemphisInMay pic.twitter.com/i1X9g0tr0b";;;#MemphisInMay;"602268745654906880";https://twitter.com/SenAlexander/status/602268745654906880
;2015-05-23 15:05;4;2;"@3onyourside asked how he learned to play piano: "My mother started me and she wouldn't let me stop." #MemphisInMay pic.twitter.com/2bT7dgP61W";;@3onyourside;#MemphisInMay;"602203608545763328";https://twitter.com/SenAlexander/status/602203608545763328
;2015-05-23 14:56;4;6;""People are hungry for community and family, and that's what the Sunset Symphony is all about." #MemphisInMay";;;#MemphisInMay;"602201446335942656";https://twitter.com/SenAlexander/status/602201446335942656
;2015-05-23 10:08;2;2;"READ IN: Alexander's op-ed in @memphisnews about #Memphis music & tonight's Sunset Symphony: http://www. commercialappeal.com/opinion/column ists/guest-column-sunset-symphony-has-been-showcase-for-citys-contributions-to-music_82424384 … #MemphisInMay";;@memphisnews;#Memphis #MemphisInMay;"602128879138971650";https://twitter.com/SenAlexander/status/602128879138971650
;2015-05-22 16:31;2;4;"@AP story on Sen. Alexander's 3rd & final performance tomorrow night at @memphisinmay : http://www. usnews.com/news/politics/ articles/2015/05/22/senators-sing-blues-over-impasse-gop-hopefuls-stuck-in-dc … #memphisinmay";;@AP @memphisinmay;#memphisinmay;"601863097977065473";https://twitter.com/SenAlexander/status/601863097977065473
;2015-05-21 15:49;0;1;"Alexander: Approval of E & W approps legislation is ex. of setting priorities & “getting the Senate working again.” http:// 1.usa.gov/1AhXiLG";;;;"601490116004151297";https://twitter.com/SenAlexander/status/601490116004151297
;2015-05-21 14:45;0;1;"Approps cmte passes bipartisan legislation 26-4, setting priorities on #energy , waterways and national security: http:// 1.usa.gov/1AhXiLG";;;#energy;"601473999382654977";https://twitter.com/SenAlexander/status/601473999382654977
;2015-05-21 11:57;2;0;"Alexander says #Washington spending problem is out-of-control entitlements. #fixthedebt #budget2015";;;#Washington #fixthedebt #budget2015;"601431554678771712";https://twitter.com/SenAlexander/status/601431554678771712
;2015-05-21 11:12;2;5;"Alexander says Senate has "poor record" of passing approps bills—that needs to change in order to set #budget priorities"";;;#budget;"601420287012413440";https://twitter.com/SenAlexander/status/601420287012413440
;2015-05-21 10:45;2;2;"Alexander: E & W Approps Bill doubles basic energy research/ strengthens and rebuilds waterways and ports: http:// 1.usa.gov/1LnaKyR";;;;"601413398115577857";https://twitter.com/SenAlexander/status/601413398115577857
;2015-05-21 09:06;1;2;"TUNE IN @11: Alexander Energy and Water bill comes before Appropriations Committee: http:// 1.usa.gov/1LnaKyR";;@11;;"601388661855395840";https://twitter.com/SenAlexander/status/601388661855395840
;2015-05-20 12:30;8;4;"To maintain our brainpower advantage & create clean, cheap, reliable #energy , "we need to fuel innovation” in free market. #COMPETES";;;#energy #COMPETES;"601077564900298753";https://twitter.com/SenAlexander/status/601077564900298753
;2015-05-20 12:26;12;7;"Alexander, bipartisan grp of senators intro bill to reauth #energy programs in America #COMPETES to help create #jobs http:// 1.usa.gov/1cON22t";;;#energy #COMPETES #jobs;"601076455766884352";https://twitter.com/SenAlexander/status/601076455766884352
;2015-05-19 16:56;4;1;"Says today’s subcmte vote means "we are 1 step closer to doubling basic #energy research, removing major obstacles to #nuclear power"";;;#energy #nuclear;"600782107640733696";https://twitter.com/SenAlexander/status/600782107640733696
;2015-05-19 16:53;1;1;"Alexander: E&W Approps Bill Supports #Energy Research, Waterways and National Security http:// 1.usa.gov/1Ei4nH3 pic.twitter.com/TnN9aCoxCT";;;#Energy;"600781313398931456";https://twitter.com/SenAlexander/status/600781313398931456
;2015-05-19 12:59;0;1;"TUNE IN @2:30: Alexander chairs Approps subcmte consideration of Energy & Water bill: http:// 1.usa.gov/1JXpsM2";;@2;;"600722491129073664";https://twitter.com/SenAlexander/status/600722491129073664
;2015-05-18 13:54;0;1;"Alexander asks why #TVA would consider relying on "unreliable, high-cost renewable power,” like wind pic.twitter.com/VrmfHgHUeO";;;#TVA;"600373994672500736";https://twitter.com/SenAlexander/status/600373994672500736
;2015-05-18 13:46;1;5;"Alexander: "If we want more good #jobs & higher family incomes, #TVA should stick to its mission of low rates" http:// 1.usa.gov/1JtC3IK";;;#jobs #TVA;"600372010829635584";https://twitter.com/SenAlexander/status/600372010829635584
;2015-05-18 11:21;3;4;"Sen. Alexander and @SenBobCorker host a roundtable on #TVA 's long-term power plan @HowardBakerCntr today pic.twitter.com/JYI9UgBayJ";;@SenBobCorker @HowardBakerCntr;#TVA;"600335513007034368";https://twitter.com/SenAlexander/status/600335513007034368
;2015-05-14 08:40;1;2;"TUNE IN @10am: Labor Approps hearing on the president's #budget request for #NLRB http:// 1.usa.gov/1JgKffp";;@10am;#budget #NLRB;"598845385776443392";https://twitter.com/SenAlexander/status/598845385776443392
;2015-05-13 10:59;4;6;""Relying on wind when #nuclear plants are available is like going to war in sailboats when nuclear ships are available”";;;#nuclear;"598517954259623936";https://twitter.com/SenAlexander/status/598517954259623936
;2015-05-13 10:23;0;4;""We need to do everything we can" to make sure #nuclear power continues to provide US w a large amount of clean, cheap, reliable electricity";;;#nuclear;"598508909645672448";https://twitter.com/SenAlexander/status/598508909645672448
;2015-05-13 09:38;2;2;"Alexander spoke @NEI event abt overcoming obstacles for #nuclear power to help ensure a bright #energy future in US http:// 1.usa.gov/1IxGWRR";;@NEI;#nuclear #energy;"598497670160896000";https://twitter.com/SenAlexander/status/598497670160896000
;2015-05-11 15:30;3;2;"ICYMI: In commencement speech, Alexander told @WaltersState grads to "find the good & praise it" http:// bit.ly/1KBttFQ @CitizenTribune";;@WaltersState @CitizenTribune;;"597861277780811777";https://twitter.com/SenAlexander/status/597861277780811777
;2015-05-11 11:59;2;3;""Now #TVA will have an even greater role in making sure Tennesseans continue to enjoy some of the best trout fishing in the country" @JCPress";;@JCPress;#TVA;"597808332745891840";https://twitter.com/SenAlexander/status/597808332745891840
;2015-05-11 11:45;2;2;"via @JCPress , "Alexander: Fish Hatchery funding solution is 'permanent,'" on agreement announced w/ #TVA today: http:// bit.ly/1Rvv4Cq";;@JCPress;#TVA;"597804611882381312";https://twitter.com/SenAlexander/status/597804611882381312
;2015-05-11 11:35;6;6;"Alexander tours Erwin National Fish Hatchery after announcement of permanent solution to keep TN fish hatcheries open pic.twitter.com/AJOcpliVza";;;;"597802335688069120";https://twitter.com/SenAlexander/status/597802335688069120
