username;date;retweets;favorites;text;geo;mentions;hashtags;id;permalink
;2017-06-14 16:13;27;98;"Thank you to the Capitol Police officers who keep watch and help keep us safe today and every day. pic.twitter.com/lvpamGxsrl";;;;"875098862595321856";https://twitter.com/SenAlexander/status/875098862595321856
;2017-06-14 09:07;25;40;"Statement on the shooting this morning: pic.twitter.com/ghh2SDNgZt";;;;"874991711017197568";https://twitter.com/SenAlexander/status/874991711017197568
;2017-06-13 09:15;2;15;"It is important that we work together to conduct this fact-finding in a bipartisan way.";;;;"874631406906998784";https://twitter.com/SenAlexander/status/874631406906998784
;2017-06-13 09:15;1;3;"This is a discussion that affects the well-being of every American family.";;;;"874631381355286528";https://twitter.com/SenAlexander/status/874631381355286528
;2017-06-13 09:15;3;4;"Our focus today is on what happens to the cost of the drug after it is approved by the FDA.";;;;"874631223175516160";https://twitter.com/SenAlexander/status/874631223175516160
;2017-06-13 09:14;2;2;"Over the years this committee has produced important laws to reduce the cost of drugs before they are approved by the FDA";;;;"874631121132298240";https://twitter.com/SenAlexander/status/874631121132298240
;2017-06-13 09:09;4;16;"Americans want to know who pays for prescription drugs and where that money goes.";;;;"874629844885266438";https://twitter.com/SenAlexander/status/874629844885266438
;2017-06-13 09:08;3;3;"The purpose of this first hearing is to see if we can better understand this complex subject and agree on some basic facts. https:// twitter.com/GOPHELP/status /874626434953859072 …";;;;"874629667470417920";https://twitter.com/SenAlexander/status/874629667470417920
;2017-06-13 09:03;9;7;"Alexander: Mike Dunavant is a well-qualified & dedicated prosecutor who will serve West Tennesseans with integrity: http:// bit.ly/2soissF";;;;"874628352912621568";https://twitter.com/SenAlexander/status/874628352912621568
;2017-06-12 16:07;11;74;"Happy birthday to President @GeorgeHWBush ! pic.twitter.com/90NX5pKVMs";;@GeorgeHWBush;;"874372520862003200";https://twitter.com/SenAlexander/status/874372520862003200
;2017-06-09 13:28;5;2;"Sign-up for Sen. Alexander’s newsletter -- Latest from Lamar – & find out what he is working on in TN & DC: http:// bit.ly/2ekOPRK";;;;"873245377193009152";https://twitter.com/SenAlexander/status/873245377193009152
;2017-06-09 08:02;3;4;"Acosta right to withdraw #jointemployer guidance & restore wage & hour investigators' focus on worker protections. http:// buff.ly/2sjZm6V";;;#jointemployer;"873163351265771525";https://twitter.com/SenAlexander/status/873163351265771525
;2017-06-08 17:03;9;18;"Alexander votes to give Dept. of Veterans Affairs more authority to make employees accountable http:// buff.ly/2r14A3x";;;;"872937061455732736";https://twitter.com/SenAlexander/status/872937061455732736
;2017-06-08 16:07;5;8;"Alexander: Sec. Acosta begins rollback of Obama-era assault on franchise model, restores focus to worker protections http:// buff.ly/2sjZSS2";;;;"872922978132144128";https://twitter.com/SenAlexander/status/872922978132144128
;2017-06-07 16:02;15;27;"Sen. Alexander: We must solve the 25-year-old stalemate over what to do with used fuel from our nuclear reactors http:// buff.ly/2rWbBFW pic.twitter.com/9JK1iinb38";;;;"872559302069846018";https://twitter.com/SenAlexander/status/872559302069846018
;2017-06-07 15:01;9;5;"Alexander: Interim private storage could be the quickest, least expensive way to break nuclear waste stalemate http:// buff.ly/2qXODuX";;;;"872544012862935040";https://twitter.com/SenAlexander/status/872544012862935040
;2017-06-07 13:30;4;6;"At 2:30 PM | Alexander chairs Energy & Water Approps. subcommittee hearing on Nuclear Regulatory Commission budget https://www. appropriations.senate.gov/hearings/revie w-of-the-fy2018-budget-request-for-the-nuclear-regulatory-commission …";;;;"872521071727083527";https://twitter.com/SenAlexander/status/872521071727083527
;2017-06-06 17:28;9;10;"Alexander: Francis Collins continuing to head NIH is "good news for the country," one of POTUS "best appointments" http:// buff.ly/2ryRgpB";;;;"872218641231732737";https://twitter.com/SenAlexander/status/872218641231732737
;2017-06-06 16:04;5;6;"“This is Bill Hoffman, a hero who helped free a continent and end a war.” #DDay http:// buff.ly/2rycfst";;;#DDay;"872197407378944002";https://twitter.com/SenAlexander/status/872197407378944002
;2017-06-06 12:02;10;14;"This #DDay : Read about the late Bill Hoffman of Memphis who stormed the cliffs at Pointe du Hoc http:// buff.ly/2sAdCFQ";;;#DDay;"872136544475373568";https://twitter.com/SenAlexander/status/872136544475373568
;2017-06-01 13:28;183;469;"On this day in 1796, Tennessee became the 16th state admitted to the union. Happy Birthday, Tennessee! pic.twitter.com/pvXmtoWv33";;;;"870346222942523392";https://twitter.com/SenAlexander/status/870346222942523392
;2017-05-31 10:57;9;9;"The U.S. Senate owes patients and their families a prompt, bipartisan reauthorization of the FDA user fee agreements to fund the FDA. pic.twitter.com/T5BVcMfp59";;;;"869945834405638146";https://twitter.com/SenAlexander/status/869945834405638146
;2017-05-30 10:29;6;6;"VIDEO: Senator Alexander on the importance of an on-time reauthorization of the FDA User Fee Agreements. pic.twitter.com/NTAAheuHOb";;;;"869576388885348352";https://twitter.com/SenAlexander/status/869576388885348352
;2017-05-24 15:02;6;22;"All ages are welcome at Tennessee Tuesday! Click here to join Sen. Alexander & Sen. Corker at their weekly breakfast http:// buff.ly/2rAYmed pic.twitter.com/uXoqdL29bS";;;;"867470796968652800";https://twitter.com/SenAlexander/status/867470796968652800
;2017-05-23 09:31;3;1;"On @Medium | Sen. Alexander explains what the bipartisan FDA User Fee Agreements are and why they’re important http:// buff.ly/2rIQ6ps";;@Medium;;"867025073705766915";https://twitter.com/SenAlexander/status/867025073705766915
;2017-05-23 07:32;13;33;"Congratulations to the @PredsNHL — heading to their first Stanley Cup Finals! #StandWithUs pic.twitter.com/Az1w4vfA0m";;@PredsNHL;#StandWithUs;"866995131592966144";https://twitter.com/SenAlexander/status/866995131592966144
;2017-05-22 17:02;47;136;"Thanks to @SecretaryPerry for coming to Tennessee to visit @ORNL and @y12nsc to see all of the great work being done here! pic.twitter.com/C980UMLVRt";;@SecretaryPerry @ORNL @y12nsc;;"866776216623304705";https://twitter.com/SenAlexander/status/866776216623304705
;2017-05-22 16:33;3;4;"What are the consequences if there is a delay in the reauthorization of the FDA user fee agreements? Find out here: http:// buff.ly/2rIFQNX";;;;"866768884636020736";https://twitter.com/SenAlexander/status/866768884636020736
;2017-05-22 11:52;4;1;"Via @Medium | Q & A with Senator Alexander on FDA User Fee Agreements http:// buff.ly/2rIN5pn";;@Medium;;"866698173284311045";https://twitter.com/SenAlexander/status/866698173284311045
;2017-05-18 16:31;8;10;"Great to welcome students from Jasper Middle School (Jasper) & T.A. Dugger Jr High School (Elizabethton) to Washington D.C. this week! pic.twitter.com/xkjfTe4scL";;;;"865318834886123522";https://twitter.com/SenAlexander/status/865318834886123522
;2017-05-18 11:07;10;9;"Alexander introduced Nashvillian Bill Hagerty, nominee for Ambassador to Japan, at his hearing before Senate Foreign Relations Committee pic.twitter.com/gGDU9QubLe";;;;"865237382764875777";https://twitter.com/SenAlexander/status/865237382764875777
;2017-05-16 13:58;4;14;"The sooner we pass this legislation, the better—to give patients, doctors, FDA reviewers, and companies certainty.";;;;"864555746331066369";https://twitter.com/SenAlexander/status/864555746331066369
;2017-05-16 13:57;2;3;"A delay in reauthorizing these agreements would delay the reviews of drugs and devices submitted after April 1";;;;"864555539010908160";https://twitter.com/SenAlexander/status/864555539010908160
;2017-05-16 13:54;5;4;"If we do not move to pass these agreements in late July, the FDA will be forced to send layoff notices to more than 5,000 FDA employees";;;;"864554572353867777";https://twitter.com/SenAlexander/status/864554572353867777
;2017-05-16 13:52;4;5;"The FDA Reauthorization Act, sponsored by me & Senator Murray, reauthorizes the four user fee agreements that expire at the end of September";;;;"864554264940695552";https://twitter.com/SenAlexander/status/864554264940695552
;2017-05-16 13:51;3;7;"The FDA is the agency responsible for making sure the promise of the 21st Century Cures Act actually reaches America’s patients";;;;"864554018676363264";https://twitter.com/SenAlexander/status/864554018676363264
;2017-05-16 13:51;5;5;"Now the next step ... is to fund the Food and Drug Administration.";;;;"864553950166626304";https://twitter.com/SenAlexander/status/864553950166626304
;2017-05-16 13:51;4;9;"21st Century Cures became law last year and provided $4.8 billion for medical research, on top of the support Congress already provides";;;;"864553790728544256";https://twitter.com/SenAlexander/status/864553790728544256
;2017-05-16 13:49;2;3;"This was legislation to spur research and development of cures, devices and treatments for some of the most deadly illnesses and diseases";;;;"864553450037796865";https://twitter.com/SenAlexander/status/864553450037796865
;2017-05-16 13:49;2;2;"Just five months back , 94 members of this body voted for a bill called the 21st Century Cures Act.";;;;"864553387035119617";https://twitter.com/SenAlexander/status/864553387035119617
;2017-05-16 13:49;3;3;"Happening now. Watch here: https://www. senate.gov/floor/ https:// twitter.com/SenAlexander/s tatus/864552621184622594 …";;;;"864553349693284352";https://twitter.com/SenAlexander/status/864553349693284352
;2017-05-16 13:46;3;2;"WATCH: Around 3:00 p.m. ET Senator Alexander will speak on the floor about the bipartisan FDA user fee agreements https://www. senate.gov/floor/";;;;"864552621184622594";https://twitter.com/SenAlexander/status/864552621184622594
;2017-05-11 16:02;4;5;""Our committee took an important step in the timely reauthorization of the user fee agreements that fund the FDA " http:// buff.ly/2r4lltZ";;;;"862774921071644672";https://twitter.com/SenAlexander/status/862774921071644672
;2017-05-11 12:14;5;3;"Alexander: Senate Health Committee advances “critical” bipartisan FDA user fee agreements by vote of 21-2 http:// buff.ly/2q7wb4N";;;;"862717486147547136";https://twitter.com/SenAlexander/status/862717486147547136
;2017-05-11 08:44;5;6;"A delay in reauthorizing the user fees would threaten biomedical industry jobs and America’s global leadership in biomedical innovation";;;;"862664645248782336";https://twitter.com/SenAlexander/status/862664645248782336
;2017-05-11 08:43;7;4;"FDA will be forced to begin sending layoff notices to more than 5,000 employees";;;;"862664553313816576";https://twitter.com/SenAlexander/status/862664553313816576
;2017-05-11 08:43;4;5;"Here is the problem with missing the goal of having this to the President’s desk before August recess:";;;;"862664502256578562";https://twitter.com/SenAlexander/status/862664502256578562
;2017-05-11 08:43;3;4;"We need to make sure we can get user fee reauthorization done by Aug recess—meaning we need to report this legislation to Senate floor today";;;;"862664359599886336";https://twitter.com/SenAlexander/status/862664359599886336
;2017-05-11 08:41;3;4;"The FDA Reauthorization Act, sponsored by me & Senator Murray, reauthorizes the four user fee agreements that expire at the end of September";;;;"862664008725409793";https://twitter.com/SenAlexander/status/862664008725409793
;2017-05-11 08:41;3;4;"We have followed the same sort of bipartisan process on how we continue funding the FDA";;;;"862663887237283840";https://twitter.com/SenAlexander/status/862663887237283840
;2017-05-11 08:41;4;3;"The year before that, we worked in a bipartisan way to fix No Child Left Behind.";;;;"862663853934608385";https://twitter.com/SenAlexander/status/862663853934608385
;2017-05-11 08:40;4;4;"We ended last year passing the 21st Century Cures Act, which Leader McConnell called “the most important piece of legislation” that year.";;;;"862663825832783873";https://twitter.com/SenAlexander/status/862663825832783873
;2017-05-11 08:40;8;6;"Happening now – Senate health committee hearing on bipartisan FDA user fee agreements";;;;"862663674489696256";https://twitter.com/SenAlexander/status/862663674489696256
;2017-05-10 11:45;10;21;"Sen. Alexander statement on FBI Director James Comey http:// buff.ly/2q3buXO";;;;"862347784674041857";https://twitter.com/SenAlexander/status/862347784674041857
;2017-05-09 14:51;2;4;"I look forward to the Senate approving Dr. Gottlieb’s confirmation.";;;;"862032230285283328";https://twitter.com/SenAlexander/status/862032230285283328
;2017-05-09 14:42;1;2;"Dr. Gottlieb has broad support from an array of patient, industry and research organizations.";;;;"862030079727202304";https://twitter.com/SenAlexander/status/862030079727202304
;2017-05-09 14:36;2;2;"Dr. Gottlieb has impressive qualifications from nearly every perspective.";;;;"862028604942712832";https://twitter.com/SenAlexander/status/862028604942712832
;2017-05-09 14:36;2;2;"Dr. Gottlieb is the right person to lead the FDA in its vital mission and move the agency forward";;;;"862028526811271168";https://twitter.com/SenAlexander/status/862028526811271168
;2017-05-09 14:35;3;3;"HAPPENING NOW: Senator Alexander on the Senate floor discussing Dr. Gottlieb’s nomination to head the FDA. https://www. senate.gov/floor/";;;;"862028394086748161";https://twitter.com/SenAlexander/status/862028394086748161
;2017-05-08 11:07;2;6;"Congrats to the @PredsNHL on advancing to the Western Conference finals! http://www. tennessean.com/story/sports/n hl/predators/2017/05/07/live-updates-predators-vs-blues-game-6/101405126/ …";;@PredsNHL;;"861613464615346176";https://twitter.com/SenAlexander/status/861613464615346176
;2017-05-04 16:02;24;23;"READ: Sen. Alexander on goals for Senate health care bill after House passage of #AHCA http:// buff.ly/2parL9y pic.twitter.com/mMguv4mx7I";;;#AHCA;"860238114924752897";https://twitter.com/SenAlexander/status/860238114924752897
;2017-05-04 13:57;11;17;"Chairman Alexander statement on goals for Senate health care bill http:// buff.ly/2pDUxD2 pic.twitter.com/qe5WLv9wQf";;;;"860206650128551939";https://twitter.com/SenAlexander/status/860206650128551939
;2017-05-02 15:39;7;15;"Charter schools enable teachers to succeed by giving them the freedom to use their firsthand knowledge. #CharterSchoolsWeek";;;#CharterSchoolsWeek;"859507561145528324";https://twitter.com/SenAlexander/status/859507561145528324
;2017-05-02 15:38;2;10;"Charter schools enable students to learn and succeed. #CharterSchoolsWeek";;;#CharterSchoolsWeek;"859507524537647104";https://twitter.com/SenAlexander/status/859507524537647104
;2017-05-02 15:38;9;21;"Charter schools enable parents to help their children get a real opportunity, choose better schools for them to attend.";;;;"859507490479886341";https://twitter.com/SenAlexander/status/859507490479886341
;2017-05-02 15:37;8;12;"Charter schools are serving over 3.1 million students. Over 6 percent of all public school students in the USA now attend charters.";;;;"859507258887217152";https://twitter.com/SenAlexander/status/859507258887217152
;2017-05-02 15:34;3;8;"I am here to celebrate 18th annual National #CharterSchoolsWeek and thank students, parents, teachers, & leaders of charter schools";;;#CharterSchoolsWeek;"859506320101310464";https://twitter.com/SenAlexander/status/859506320101310464
;2017-05-02 15:32;3;7;"Tune in now: Senator Alexander to speak about #CharterSchoolsWeek https://www. senate.gov/floor/";;;#CharterSchoolsWeek;"859505850146312192";https://twitter.com/SenAlexander/status/859505850146312192
;2017-05-02 13:32;11;11;"Charters are on the forefront of helping to create new opportunities for more than 3 million public school children http:// buff.ly/2pUBIgp pic.twitter.com/SkGvlSBV1H";;;;"859475648338956289";https://twitter.com/SenAlexander/status/859475648338956289
;2017-04-28 13:07;3;9;"Alexander Acosta sworn in as U.S. labor secretary. Here's chairman's stmt after yesterday's vote http:// buff.ly/2qnr5Pn pic.twitter.com/Rd1zFlrJ1g";;;;"858019746821931010";https://twitter.com/SenAlexander/status/858019746821931010
;2017-04-27 18:04;3;8;"Alexander: New Labor Sec. “can now begin work to create a better environment to help more American workers succeed” http:// buff.ly/2qc77rm";;;;"857732120588029952";https://twitter.com/SenAlexander/status/857732120588029952
;2017-04-27 17:43;8;25;"Congrats to Alexander Acosta who was just confirmed by the Senate 60 – 38 to serve as Labor Secretary.";;;;"857727010843578368";https://twitter.com/SenAlexander/status/857727010843578368
;2017-04-27 16:16;14;30;"Sen. Alexander welcomed Challenger the Bald Eagle – a symbol of the spirit of freedom and sovereignty of the United States – to Washington. pic.twitter.com/pCotNKfiwy";;;;"857704946514382848";https://twitter.com/SenAlexander/status/857704946514382848
;2017-04-27 13:58;4;11;"I look forward to Mr. Acosta’s confirmation today.";;;;"857670272983412736";https://twitter.com/SenAlexander/status/857670272983412736
;2017-04-27 13:58;6;20;"We are fortunate that someone of Mr. Acosta’s intelligence and experience is willing to serve as our United States Secretary of Labor.";;;;"857670240246927361";https://twitter.com/SenAlexander/status/857670240246927361
;2017-04-27 13:45;4;5;"Supporters of Acosta’s nomination include @USChamber , @NRFnews , @NFIB , @ShopFloorNAM , @Franchising411 , & @AmeriBev .";;@USChamber @NRFnews @NFIB @ShopFloorNAM @Franchising411 @AmeriBev;;"857667144951222272";https://twitter.com/SenAlexander/status/857667144951222272
;2017-04-27 13:44;3;2;"Mr. Acosta understands that a good-paying job is critical to helping workers realize the American dream for themselves & for their families.";;;;"857666661402456065";https://twitter.com/SenAlexander/status/857666661402456065
;2017-04-27 13:43;1;3;"Mr. Acosta has excellent credentials and is well-qualified for the position.";;;;"857666631367053316";https://twitter.com/SenAlexander/status/857666631367053316
;2017-04-27 13:43;1;1;"WATCH: Sen. Alexander heading to Senate floor soon to discuss nomination of Acosta to serve as Labor Secretary. https://www. senate.gov/floor/";;;;"857666550081441792";https://twitter.com/SenAlexander/status/857666550081441792
;2017-04-27 09:07;2;7;"Dr. Gottlieb strikes me as the kind of nominee that is easy to support.";;;;"857597141279268865";https://twitter.com/SenAlexander/status/857597141279268865
;2017-04-27 09:07;3;5;"He has served as a practicing physician and hospitalist as well as a former FDA Deputy Commissioner, and he is also a cancer survivor.";;;;"857597115962449922";https://twitter.com/SenAlexander/status/857597115962449922
;2017-04-27 09:07;1;1;"He is supported by former FDA commissioners Robert Califf, Margaret Hamburg and Mark McClellan.";;;;"857597077001560064";https://twitter.com/SenAlexander/status/857597077001560064
;2017-04-27 09:05;4;4;"I believe throughout this process Dr. Gottlieb has demonstrated that he is the right person to lead the FDA on its vital mission.";;;;"857596455502180353";https://twitter.com/SenAlexander/status/857596455502180353
;2017-04-27 09:04;2;2;"Dr. Gottlieb has been through an exhaustive vetting process.";;;;"857596213566328832";https://twitter.com/SenAlexander/status/857596213566328832
;2017-04-27 09:03;2;0;"WATCH HERE: @GOPHELP committee executive session on Dr. Gottlieb’s nomination to head FDA https://www. help.senate.gov/hearings/s652- s920-s916-s849-and-the-nomination-of-scott-gottlieb-to-serve-as-the-commissioner-of-food-and-drug …";;@GOPHELP;;"857596151398313986";https://twitter.com/SenAlexander/status/857596151398313986
;2017-04-27 09:00;5;2;"Happening soon: @GOPHELP committee executive session on Dr. Gottlieb’s nomination to head FDA https://www. help.senate.gov/hearings/s652- s920-s916-s849-and-the-nomination-of-scott-gottlieb-to-serve-as-the-commissioner-of-food-and-drug …";;@GOPHELP;;"857595332103995392";https://twitter.com/SenAlexander/status/857595332103995392
;2017-04-27 08:27;3;3;"HELP Committee sends 4 bipartisan public health bills to Senate floor http:// buff.ly/2qfmO0b";;;;"857586895529836546";https://twitter.com/SenAlexander/status/857586895529836546
;2017-04-26 16:02;3;5;"READ: “Today our committee continues its tradition of working together to get results for American families.” http:// buff.ly/2oMNV2x";;;;"857339022783508486";https://twitter.com/SenAlexander/status/857339022783508486
;2017-04-26 15:07;3;8;"I am glad to see the president appoint Philip Miscimarra as chairman of the NLRB.";;;;"857325315214979073";https://twitter.com/SenAlexander/status/857325315214979073
;2017-04-26 09:29;11;9;"Ahead this week for @GOPHELP chairman: Senate to confirm Labor nominee Acosta, committee to approve Gottlieb for FDA. pic.twitter.com/YBcMCU0R69";;@GOPHELP;;"857240135636799488";https://twitter.com/SenAlexander/status/857240135636799488
;2017-04-20 17:03;4;26;""If you want to see the Smokies, you’ll drive the Foothills Parkway b/c it’s the only road that gives you such a spectacular view..." pic.twitter.com/8MgUSb9JYC";;;;"855180058520166400";https://twitter.com/SenAlexander/status/855180058520166400
;2017-04-20 16:07;6;26;"Sen. Alexander was at the groundbreaking ceremony for the final project to complete the "missing link" of the NPS Foothills Parkway pic.twitter.com/gX95WCH9kY";;;;"855165943290482688";https://twitter.com/SenAlexander/status/855165943290482688
;2017-04-19 13:03;2;7;"I enjoyed touring @BCMBristol yesterday and learning more about the 1927 Bristol Sessions! pic.twitter.com/wSW5MaH1hl";;@BCMBristol;;"854757255811563526";https://twitter.com/SenAlexander/status/854757255811563526
;2017-04-18 16:01;7;12;"Great to speak to Elizabethton Kiwanis Club today and meet with Unaka HS Key Club members who serve the community. pic.twitter.com/T12B5XjGUf";;;;"854439764119998464";https://twitter.com/SenAlexander/status/854439764119998464
;2017-04-15 13:39;25;64;"This week is National Park Week! It’s a great time to celebrate what’s right with America. #FindYourPark pic.twitter.com/NUngMHs5lS";;;#FindYourPark;"853316778948251649";https://twitter.com/SenAlexander/status/853316778948251649
;2017-04-14 11:20;2;1;"Senate, Health leaders release discussion draft of FDA user fees reauthorization: http:// bit.ly/2nMXsdq";;;;"852919533274845185";https://twitter.com/SenAlexander/status/852919533274845185
;2017-04-13 19:51;5;14;"Alexander: Secretary Price is taking an important step to begin stabilizing collapsing individual insurance market https://www. alexander.senate.gov/public/index.c fm/pressreleases?ID=5ECCD4A0-663F-465F-8BBC-6D1EFEDB3CFB …";;;;"852685655306063872";https://twitter.com/SenAlexander/status/852685655306063872
;2017-04-13 16:02;6;17;"“Next week is National Park Week. It’s a great time to celebrate what’s right with America…” #FindYourPark http:// buff.ly/2ocBHPD";;;#FindYourPark;"852627967951986688";https://twitter.com/SenAlexander/status/852627967951986688
;2017-04-13 14:47;2;10;"“Next week is National Park Week. It’s a great time to celebrate what’s right with America…” #FindYourPark https:// medium.com/@SenAlexander/ national-park-week-a-great-time-to-celebrate-whats-right-with-america-5f2cbcf073de …";;@SenAlexander;#FindYourPark;"852609296198225921";https://twitter.com/SenAlexander/status/852609296198225921
;2017-04-13 13:40;6;14;"READ:Sen. Alexander writes “National Park Week: A great time to celebrate what’s right with America.” #FindYourPark http:// bit.ly/2oa9FFb";;;#FindYourPark;"852592398475694084";https://twitter.com/SenAlexander/status/852592398475694084
;2017-04-12 09:11;8;32;"Senator Alexander is working to make sure President Polk’s home in Columbia, TN, is included in the National Park System. pic.twitter.com/aHUsYgZXGx";;;;"852162157441466368";https://twitter.com/SenAlexander/status/852162157441466368
;2017-04-11 15:14;6;20;"WATCH: Sen. Alexander was in Columbia for Mule Day and to tour President James K. Polk’s home pic.twitter.com/FgjIcBmM3H";;;;"851891114978164736";https://twitter.com/SenAlexander/status/851891114978164736
;2017-04-07 17:48;6;8;"Alexander on selection of Tennessean Mark Green as Secretary of the Army: pic.twitter.com/oQ6yQ5k7rL";;;;"850480425185288193";https://twitter.com/SenAlexander/status/850480425185288193
;2017-04-07 16:32;11;42;""Judge Gorsuch is enormously well-qualified ... He will be a superior new member of the United States Supreme Court.” pic.twitter.com/gGKudHEtwJ";;;;"850461181470924800";https://twitter.com/SenAlexander/status/850461181470924800
;2017-04-07 13:13;4;15;"VIDEO: Senator Alexander on voting to confirm Judge Gorsuch to the Supreme Court. https://www. alexander.senate.gov/public//index. cfm?p=PressReleases&id=1DF285E6-998C-4E46-9070-3722324A8DDB … pic.twitter.com/A8lstHmmwg";;;;"850411123341905920";https://twitter.com/SenAlexander/status/850411123341905920
;2017-04-07 10:17;7;15;"Sen. Alexander’s statement on U.S. missile strike in Syria. http:// buff.ly/2nlX711 pic.twitter.com/yO3vSrXVnQ";;;;"850366814446125057";https://twitter.com/SenAlexander/status/850366814446125057
;2017-04-06 12:50;6;8;"READ Sen. Alexander’s full op-ed in the @Tennessean here: http://www. tennessean.com/story/opinion/ 2017/04/06/gorsuch-nomination-should-decided-simple-majority/100111660/ … https:// twitter.com/SenAlexander/s tatus/850042541047152642 …";;@Tennessean;;"850042924775690240";https://twitter.com/SenAlexander/status/850042924775690240
