username;date;retweets;favorites;text;geo;mentions;hashtags;id;permalink
;2012-11-15 13:12;7;1;"Sen. Stabenow Applauds Chrysler for Continuing to Invest in Michigan Manufacturing Plants, Create New Michigan Jobs: http:// go.usa.gov/gqkj";;;;"269155933295362048";https://twitter.com/SenStabenow/status/269155933295362048
;2012-11-09 08:29;5;1;"via @detnews : It's 'back to work' for Stabenow after victory http://www. detroitnews.com/article/201211 09/POLITICS01/211090354 … #Michigan";;@detnews;#Michigan;"266910446420905984";https://twitter.com/SenStabenow/status/266910446420905984
;2012-10-26 09:39;1;0;"Ag. Chairwoman Stabenow Statement Following Disaster Designation for Bay and Saginaw Counties http:// go.usa.gov/Ydbd";;;;"261839541244162049";https://twitter.com/SenStabenow/status/261839541244162049
;2012-10-17 13:24;6;0;"Agriculture Chairwoman Stabenow Announces Support for Small Businesses in Rural Communities: http:// go.usa.gov/YRRV";;;;"258634493907320832";https://twitter.com/SenStabenow/status/258634493907320832
;2012-10-09 15:15;2;0;"Sen. Stabenow Statement Following Discovery of Positive Asian Carp eDNA Samples Beyond Electric Barrier: http:// go.usa.gov/YBqA";;;;"255763521885855744";https://twitter.com/SenStabenow/status/255763521885855744
;2012-10-05 11:07;2;0;"Sen. Stabenow: Army Corps' Refusal to Follow Law, Submit Complete Asian Carp Plan 'Unacceptable' http:// go.usa.gov/YD5B";;;;"254251560354332672";https://twitter.com/SenStabenow/status/254251560354332672
;2012-10-03 14:38;1;0;"Sen. Stabenow Announces Support for XG Sciences in Lansing http:// go.usa.gov/YTP9";;;;"253579768442785792";https://twitter.com/SenStabenow/status/253579768442785792
;2012-10-02 13:09;3;0;"Senators Stabenow, Levin Announce Support to Stop Invasive Species http:// go.usa.gov/Y4s3";;;;"253195066741497856";https://twitter.com/SenStabenow/status/253195066741497856
;2012-10-01 14:01;6;1;"Agriculture Chairwoman Stabenow Announces Support for Michigan Farmers http:// go.usa.gov/YgD4";;;;"252845609772539904";https://twitter.com/SenStabenow/status/252845609772539904
;2012-09-26 09:43;4;0;"Senator Stabenow Announces Support for Michigan Law Enforcement http:// go.usa.gov/Y38w";;;;"250968765225897984";https://twitter.com/SenStabenow/status/250968765225897984
;2012-09-25 11:08;5;1;"Sen. Stabenow Statement on Discovery of Asian Carp eDNA in Western Lake Erie http:// go.usa.gov/rhEz";;;;"250627854201667585";https://twitter.com/SenStabenow/status/250627854201667585
;2012-09-17 11:48;1;0;"Trade Enforcement Unit Championed by Sen. Stabenow Spurs Trade Case Against China: http:// go.usa.gov/r6DB";;;;"247738820211130368";https://twitter.com/SenStabenow/status/247738820211130368
;2012-09-12 15:55;3;0;"Michigan Agriculture Leaders Join Chairwoman Stabenow to Call for a "Farm Bill Now!" https:// go.usa.gov/shorturl";;;;"245988969555308544";https://twitter.com/SenStabenow/status/245988969555308544
;2012-09-12 06:54;0;0;"Senator Stabenow will be on WKZO in just a minute to talk about the need for a Farm Bill for West #Michigan farmers! http:// wkzo.com/listen-live/";;;#Michigan;"245852761919471616";https://twitter.com/SenStabenow/status/245852761919471616
;2012-09-12 05:47;4;0;"If you're in West Michigan, Sen. Stabenow will be on @wwmtnews Channel 3 in just a few talking about how #Michigan farmers need a #FarmBill .";;@wwmtnews;#Michigan #FarmBill;"245836088013357057";https://twitter.com/SenStabenow/status/245836088013357057
;2012-09-12 03:53;1;0;"Good morning! Sen Stabenow will be talking about the urgent need for a new #FarmBill at 6:00am with #WakeUpWithAl on the Weather Channel.";;;#FarmBill #WakeUpWithAl;"245807421728096257";https://twitter.com/SenStabenow/status/245807421728096257
;2012-09-11 09:50;2;1;"Senator Stabenow Statement on the 11th Anniversary of September 11th: http:// go.usa.gov/rfYJ";;;;"245534864785436672";https://twitter.com/SenStabenow/status/245534864785436672
;2012-09-10 13:43;6;0;"Senator Stabenow Cosponsors Legislation to Help Michigan Businesses Hire Veterans http:// go.usa.gov/rw4k";;;;"245231115634372608";https://twitter.com/SenStabenow/status/245231115634372608
;2012-09-05 13:29;6;0;"Chairwoman Stabenow: We Need a Farm Bill Now! http:// go.usa.gov/ryA3";;;;"243415586363826176";https://twitter.com/SenStabenow/status/243415586363826176
;2012-08-30 08:31;8;0;"All 83 #Michigan counties declared disaster areas because of #drought . Senator Stabenow's statement: http:// go.usa.gov/rQZm";;;#Michigan #drought;"241166223105204224";https://twitter.com/SenStabenow/status/241166223105204224
;2012-08-29 14:55;2;0;"Check out Sen. Stabenow's Michigan Brief: Only in America do you see stories like this... http://www. stabenow.senate.gov/mibrief/082912 .html …";;;;"240900525468569600";https://twitter.com/SenStabenow/status/240900525468569600
;2012-08-23 10:12;1;0;"Check out this week's Michigan Brief: Stabenow bringing new jobs to Michigan http:// go.usa.gov/r8vj";;;;"238654909405335552";https://twitter.com/SenStabenow/status/238654909405335552
;2012-08-17 11:38;0;0;"This week's #Michigan Brief: Lifeline for Michigan's farmers http:// go.usa.gov/7Xw #FarmBill #agchat";;;#Michigan #FarmBill #agchat;"236502338133716993";https://twitter.com/SenStabenow/status/236502338133716993
;2012-08-10 15:38;3;0;"Chairwoman Stabenow Applauds USDA Measures to Cut Down on Food Stamp Abuse http:// go.usa.gov/7qZ";;;;"234025877434929152";https://twitter.com/SenStabenow/status/234025877434929152
;2012-08-09 16:03;1;0;"Sen. Stabenow Returns Home to Gladwin, Delivers Keynote at Gladwin County Chamber of Commerce http:// go.usa.gov/Gec";;;;"233669848843055104";https://twitter.com/SenStabenow/status/233669848843055104
;2012-08-09 12:32;3;0;"Stabenow's Statewide "Jobs of the Future" Tour Continues in Cadillac http:// go.usa.gov/GLp";;;;"233616711990005761";https://twitter.com/SenStabenow/status/233616711990005761
;2012-07-26 13:25;0;0;"Sen. Stabenow Introduces Bipartisan China Fair Trade Act http:// go.usa.gov/ftU";;;;"228556574250110977";https://twitter.com/SenStabenow/status/228556574250110977
;2012-07-20 15:52;1;0;"Sen. Stabenow urges President Obama to challenge Japan's anti-competitive trade practices http:// go.usa.gov/fRM";;;;"226419295876435969";https://twitter.com/SenStabenow/status/226419295876435969
;2012-07-20 15:50;1;0;"Sen. Stabenow Continues to Stand Up for the American Auto Industry! http:// go.usa.gov/fRM";;;;"226418942762180609";https://twitter.com/SenStabenow/status/226418942762180609
;2012-07-19 13:49;87;4;"Sen. Stabenow's Bring Jobs Home Act gets majority vote but is blocked by Republican filibuster: http:// go.usa.gov/f0V";;;;"226025938364796928";https://twitter.com/SenStabenow/status/226025938364796928
;2012-07-18 14:25;5;0;"Michigan Business and Labor Leaders join Sen. Stabenow to push for passage of her Bring Jobs Home Act! http:// go.usa.gov/fW5";;;;"225672703762370560";https://twitter.com/SenStabenow/status/225672703762370560
;2012-07-17 10:50;3;0;"Senate to consider Stabenow's Bring Jobs Home Act this week http:// go.usa.gov/fg2";;;;"225256281160695809";https://twitter.com/SenStabenow/status/225256281160695809
;2012-07-16 17:11;6;1;"Read Senator Stabenow's Statement on the DISCLOSE Act http:// go.usa.gov/f1p";;;;"224989606108602370";https://twitter.com/SenStabenow/status/224989606108602370
;2012-07-13 16:28;2;0;"Sen. Stabenow Statement on Discovery of Asian Carp eDNA in Lake Erie http:// go.usa.gov/f3I";;;;"223891556103487488";https://twitter.com/SenStabenow/status/223891556103487488
;2012-07-13 11:07;0;1;"Senator Stabenow Attends Opening of New Elijah J. McCoy Detroit Patent Office http:// go.usa.gov/fqe";;;;"223810853215014913";https://twitter.com/SenStabenow/status/223810853215014913
;2012-07-11 12:45;2;0;"Read Sen. Stabenow's guest editorial in the Grand Rapids Press! http:// goo.gl/Y6yNS";;;;"223110868529987584";https://twitter.com/SenStabenow/status/223110868529987584
;2012-07-10 13:00;0;0;"Sen. Stabenow Statement on Air Force Request for Cuts at Selfridge Air National Guard Base http:// go.usa.gov/woA";;;;"222752055339659264";https://twitter.com/SenStabenow/status/222752055339659264
;2012-07-09 14:47;5;1;"Chairwoman Stabenow Visits West Michigan Fruit Farms, Discusses Support for Michigan Growers in Bipartisan Farm Bill http:// go.usa.gov/wfb";;;;"222416676891795457";https://twitter.com/SenStabenow/status/222416676891795457
;2012-07-05 13:31;2;0;"Senator Stabenow Applauds U.S. Challenge to China’s Illegal Duties on American-Made Automobiles http:// goo.gl/LlFIv";;;;"220948150314205184";https://twitter.com/SenStabenow/status/220948150314205184
;2012-06-29 18:44;2;0;"via @GRPress : Asian carp containment strategy for Great Lakes gets a boost from Congress http://www. mlive.com/news/index.ssf /2012/06/asian_carp_containment_strateg.html … #Michigan #GreatLakes";;@GRPress;#Michigan #GreatLakes;"218852437468004352";https://twitter.com/SenStabenow/status/218852437468004352
;2012-06-29 18:27;2;0;"Stabenow-Camp bill to be signed into law via @Freep : Congress orders Army Corps to speed up Asian carp containment http://www. freep.com/article/201206 29/NEWS06/120629043/asian-carp-army-corps-great-lakes …";;@Freep;;"218848070551617537";https://twitter.com/SenStabenow/status/218848070551617537
;2012-06-29 17:30;1;0;"Montford Point Marines from #Michigan were honored with the Congressional Gold Medal for their heroism and bravery: http://www. stabenow.senate.gov/?p=press_relea se&id=782 …";;;#Michigan;"218833727780950018";https://twitter.com/SenStabenow/status/218833727780950018
;2012-06-29 15:00;7;0;"Senate passes Stabenow-cosponsored student loan bill: http://www. stabenow.senate.gov/?p=press_relea se&id=785 … #DontDoubleMyRate";;;#DontDoubleMyRate;"218795978369679360";https://twitter.com/SenStabenow/status/218795978369679360
;2012-06-29 14:35;0;0;"Honoring the Montford Point Marines: http:// flic.kr/p/cnPJmf";;;;"218789711924305921";https://twitter.com/SenStabenow/status/218789711924305921
;2012-06-29 14:30;6;1;"Stabenow-Camp Legislation to Stop Asian Carp Passes; President to Sign: http://www. stabenow.senate.gov/?p=press_relea se&id=784 … #Michigan";;;#Michigan;"218788455503761408";https://twitter.com/SenStabenow/status/218788455503761408
;2012-06-29 14:28;0;0;"Legislation to Stop Asian Carp Passes Congress; President to Sign http://www. stabenow.senate.gov/?p=press_relea se&id=784 … #Michigan";;;#Michigan;"218787950085943296";https://twitter.com/SenStabenow/status/218787950085943296
;2012-06-27 14:04;5;0;"Bipartisan Stabenow Measure to Ensure New Medications are Tested and Safe for Women to Become Law http://www. stabenow.senate.gov/?p=press_relea se&id=778 … #women #health";;;#women #health;"218057348307095552";https://twitter.com/SenStabenow/status/218057348307095552
;2012-06-27 12:51;2;0;"Senator Stabenow Applauds U.S. Challenge to China’s Illegal Restrictions on Rare Earth Elements http://www. stabenow.senate.gov/?p=press_relea se&id=779 …";;;;"218038775824134146";https://twitter.com/SenStabenow/status/218038775824134146
;2012-06-18 09:37;9;0;"Editorial: A farm bill worth renewing http:// on.freep.com/M1tyqR via @freep #farmbillnow";;@freep;#farmbillnow;"214728630222327810";https://twitter.com/SenStabenow/status/214728630222327810
;2012-06-07 11:57;1;0;"Thanks for your support! RT @AFBFLYNNE: @stabenowpress Thanks for your leadership. #farmbillnow";;@AFBFLYNNE @stabenowpress;#farmbillnow;"210777423468433408";https://twitter.com/SenStabenow/status/210777423468433408
;2012-05-17 15:05;1;0;"MT @tedfioraliso : Sen. Stabenow talks to me about her Bring Jobs Home Act ABC 12 News at 5:30 http:// goo.gl/JYZKj";;@tedfioraliso;;"203214556774928384";https://twitter.com/SenStabenow/status/203214556774928384
;2012-05-16 17:24;6;1;"Senator Stabenow calls on Speaker Boehner to pass the Violence Against Women Act: http://www. youtube.com/watch?v=95kT2j jwfag … #VAWA";;;#VAWA;"202887268883640320";https://twitter.com/SenStabenow/status/202887268883640320
;2012-05-09 15:31;0;0;"@gregmgeorge Will be available soon on THOMAS: http:// hdl.loc.gov/loc.uscongress /legislation.112s2884 …";;@gregmgeorge;;"200322116061634560";https://twitter.com/SenStabenow/status/200322116061634560
;2012-05-08 13:13;11;0;"If Congress Does Not Act by July 1, Stafford Student Loan Interest Rates Will Double for over 300,000 Michigan Students http:// go.usa.gov/VEl";;;;"199924885340950529";https://twitter.com/SenStabenow/status/199924885340950529
;2012-05-08 13:12;2;0;"Legislation to Stop Student Loan Interest Rates from Doubling Blocked as Deadline Looms http:// go.usa.gov/VEl";;;;"199924677462867969";https://twitter.com/SenStabenow/status/199924677462867969
;2012-05-08 12:42;1;0;"We need to be exporting our products, not our jobs http:// go.usa.gov/VP9 #BringJobsHome";;;#BringJobsHome;"199917304484593664";https://twitter.com/SenStabenow/status/199917304484593664
;2012-05-08 12:40;6;0;"Stabenow’s Bring Jobs Home Act Would End Tax Breaks for Companies that Send Jobs Overseas http:// go.usa.gov/VP9 #BringJobsHome";;;#BringJobsHome;"199916662504439809";https://twitter.com/SenStabenow/status/199916662504439809
;2012-05-08 12:39;10;2;"Stabenow’s Bring Jobs Home Act Would Provide 20% Tax Credit to U.S. Companies that Bring Jobs Back to America http:// go.usa.gov/VP9";;;;"199916355640758273";https://twitter.com/SenStabenow/status/199916355640758273
;2012-05-08 11:47;5;1;"Army Corps Will Accelerate Efforts to Stop Asian Carp http:// go.usa.gov/VPU #GreatLakes #Michigan";;;#GreatLakes #Michigan;"199903430943322112";https://twitter.com/SenStabenow/status/199903430943322112
;2012-05-08 11:39;12;1;"Stabenow Bill to Cut Taxes for Companies Who Move Jobs to U.S. Introduced; @whitehouse Urges Congress to Pass It http:// go.usa.gov/VP9";;@whitehouse;;"199901253160017920";https://twitter.com/SenStabenow/status/199901253160017920
;2012-05-08 11:37;5;0;"Widespread Praise for the 2012 Farm Bill http:// go.usa.gov/VP8";;;;"199900730092556289";https://twitter.com/SenStabenow/status/199900730092556289
;2012-05-04 15:00;3;0;"Stabenow and Camp Call for Action Following Failure of Electronic Asian Carp Barriers: http://www. stabenow.senate.gov/?p=press_relea se&id=713 … #Michigan";;;#Michigan;"198502433029230593";https://twitter.com/SenStabenow/status/198502433029230593
;2012-04-30 16:29;6;0;"Senator Stabenow Unveils New “Bring Jobs Home Act” http:// go.usa.gov/Viq";;;;"197075233520361473";https://twitter.com/SenStabenow/status/197075233520361473
;2012-04-26 15:04;3;0;"Agriculture Committee Passes Farm Bill - Stabenow’s Proposal will Reduce Deficit, Eliminate Unnecessary Subsidies http:// go.usa.gov/yFk";;;;"195604268688998400";https://twitter.com/SenStabenow/status/195604268688998400
;2012-04-26 14:58;1;0;"Senate Committee Passes Key Provision Based on Bipartisan Stabenow, Camp Legislation to Stop Asian Carp http:// go.usa.gov/yFj #GreatLakes";;;#GreatLakes;"195602836984299520";https://twitter.com/SenStabenow/status/195602836984299520
;2012-04-25 13:51;2;0;"Stabenow Receives Annual Alzheimer's Award http:// go.usa.gov/yGP http:// goo.gl/ngRdp";;;;"195223564926988288";https://twitter.com/SenStabenow/status/195223564926988288
;2012-04-25 10:28;2;0;"Sen. Stabenow received an honorary Doctorate of Laws from @almacollege before giving the graduation keynote speech http:// goo.gl/RRrNP";;@almacollege;;"195172505789542400";https://twitter.com/SenStabenow/status/195172505789542400
;2012-04-19 16:10;8;0;"Bipartisan Bill to Stop Asian Carp Introduced http:// go.usa.gov/ykl #GreatLakes";;;#GreatLakes;"193084184288428033";https://twitter.com/SenStabenow/status/193084184288428033
;2012-04-18 11:30;2;0;"Equal Pay Day Recognizes Hard Work of Michigan Women http:// go.usa.gov/y2g";;;;"192651417335513088";https://twitter.com/SenStabenow/status/192651417335513088
;2012-04-18 10:43;2;0;"Henry Ford Health System Receives Malcolm Baldrige National Quality Award http:// go.usa.gov/y4L";;;;"192639379905327104";https://twitter.com/SenStabenow/status/192639379905327104
;2012-04-18 10:28;1;0;"Bio-based Manufacturing, Clean Energy Economy at Midland Area Chamber of Commerce http:// go.usa.gov/y4V";;;;"192635801979457537";https://twitter.com/SenStabenow/status/192635801979457537
;2012-04-09 15:41;0;0;"Boosting Exports, Spurring Job Growth, and Increasing Access to Capital for Michigan Small Businesses http:// go.usa.gov/mmG";;;;"189452970247716864";https://twitter.com/SenStabenow/status/189452970247716864
;2012-04-09 15:40;3;0;"President Signs Law Making Insider Trading Illegal for Members of Congress http:// go.usa.gov/mmf";;;;"189452827255513089";https://twitter.com/SenStabenow/status/189452827255513089
;2012-03-29 12:17;0;0;"Michigan Housing Agencies to Receive Grants for Homeless Veterans http:// go.usa.gov/EtF";;;;"185415445082419200";https://twitter.com/SenStabenow/status/185415445082419200
;2012-03-28 13:05;4;0;"Senate Unanimously Passes Stabenow Resolution Opposing Bonuses for MF Global Executives http:// go.usa.gov/EHz";;;;"185065093946552321";https://twitter.com/SenStabenow/status/185065093946552321
;2012-03-27 17:26;5;0;"Stabenow Opposes Bonuses for MF Global Executives, Introduces Resolution http:// go.usa.gov/EAg";;;;"184768353729126400";https://twitter.com/SenStabenow/status/184768353729126400
;2012-03-22 13:18;7;0;"Legislation to prohibit Members of Congress from engaging in insider trading today passed the Senate http:// go.usa.gov/E9v";;;;"182894064444768257";https://twitter.com/SenStabenow/status/182894064444768257
;2012-03-21 11:27;1;0;"Michigan Snowmobile Association Honors Stabenow http:// go.usa.gov/EWn pic.twitter.com/PP7K1yRq";;;;"182503806968414208";https://twitter.com/SenStabenow/status/182503806968414208
;2012-03-19 16:30;3;0;"Stabenow Urges Colleagues to Promote U.S. Exports, New Export-Import Detroit Office in Danger Without Reauthorization http:// go.usa.gov/ECH";;;;"181855294924664832";https://twitter.com/SenStabenow/status/181855294924664832
;2012-03-19 12:58;2;1;"Stabenow Leads 188 Members Urging President to Confront China on Auto Parts http:// go.usa.gov/ExA #jobs";;;#jobs;"181801714154872834";https://twitter.com/SenStabenow/status/181801714154872834
;2012-03-15 16:22;1;0;"Stabenow Urges Farm Program Reforms http:// go.usa.gov/PJC #agchat";;;#agchat;"180403619512852480";https://twitter.com/SenStabenow/status/180403619512852480
;2012-03-15 16:21;3;0;"Stabenow, @SenateAg Members: No bonuses for MF Global Executives http:// go.usa.gov/PJa";;@SenateAg;;"180403399039270912";https://twitter.com/SenStabenow/status/180403399039270912
;2012-03-13 14:06;0;1;"U.S. Challenges China on Rare Earths http:// go.usa.gov/Pw8";;;;"179644583674789888";https://twitter.com/SenStabenow/status/179644583674789888
;2012-03-08 19:02;7;0;"Endorsed by the @uschamber , Stabenow's legislation gives a tax cut to entrepreneurs and innovators http:// go.usa.gov/P0y #energy #jobs";;@uschamber;#energy #jobs;"177922227512152066";https://twitter.com/SenStabenow/status/177922227512152066
;2012-03-08 17:11;2;0;"Senator Stabenow introduces measure to cut taxes for clean energy companies, job creators http:// go.usa.gov/P0y #energy #jobs";;;#energy #jobs;"177894261050712065";https://twitter.com/SenStabenow/status/177894261050712065
;2012-03-08 17:02;2;1;"Senator Stabenow introduces measure to cut taxes for clean energy companies, job creators http:// go.usa.gov/P0y";;;;"177892088665489408";https://twitter.com/SenStabenow/status/177892088665489408
;2012-03-08 15:30;3;1;"Stabenow Introduces Measure to Boost Clean Energy Jobs, Michigan Businesses http:// go.usa.gov/P0y";;;;"177868813721812992";https://twitter.com/SenStabenow/status/177868813721812992
;2012-03-08 14:32;1;0;"Sen. Stabenow's amendment endorsed by @uschamber : cuts taxes for clean #energy businesses and job creators. #energy #jobs";;@uschamber;#energy #energy #jobs;"177854405939429376";https://twitter.com/SenStabenow/status/177854405939429376
;2012-03-08 13:23;1;0;"Stabenow Leading Effort in Farm Bill to Crack Down on Food Assistance Abuse http:// go.usa.gov/PkT";;;;"177837046411436032";https://twitter.com/SenStabenow/status/177837046411436032
;2012-03-08 11:47;0;0;"Stabenow Deeply Concerned about Air National Guard Reductions http:// go.usa.gov/PKQ";;;;"177812845927473152";https://twitter.com/SenStabenow/status/177812845927473152
;2012-03-08 11:46;0;0;"New Export-Import Office Opening in Detroit http:// go.usa.gov/PKN";;;;"177812673478656000";https://twitter.com/SenStabenow/status/177812673478656000
;2012-03-05 11:45;1;0;"Direct Flight from Lansing to D.C. Will Continue http:// go.usa.gov/Pi7";;;;"176725209355792384";https://twitter.com/SenStabenow/status/176725209355792384
;2012-03-01 11:52;3;0;"Senate Defeats Blunt Amendment http:// go.usa.gov/U62";;;;"175277336567095298";https://twitter.com/SenStabenow/status/175277336567095298
;2012-02-28 12:49;0;0;"Here is the updated link http:// go.usa.gov/Uy0 RT @StabenowPress See the impact of the middle class tax cut we passed today, county by county";;@StabenowPress;;"174566791891271680";https://twitter.com/SenStabenow/status/174566791891271680
;2012-02-28 12:37;0;0;"Senator Stabenow has been fighting for tougher trade enforcement since 2005. Today, the President made it happen http:// go.usa.gov/UyW #jobs";;;#jobs;"174563946311852032";https://twitter.com/SenStabenow/status/174563946311852032
;2012-02-23 12:47;1;0;"Manufacturing and Agriculture are the two largest sectors in #Michigan - #biobased manufacturing creates jobs in both";;;#Michigan #biobased;"172754553282891776";https://twitter.com/SenStabenow/status/172754553282891776
;2012-02-23 12:03;0;0;"#Biobased manufacturing is a new industry with the potential to create new jobs & reduce our dependence on foreign oil http:// go.usa.gov/U1j";;;#Biobased;"172743315396100096";https://twitter.com/SenStabenow/status/172743315396100096
;2012-02-22 17:53;2;0;"Senator Stabenow Celebrates the Groundbreaking for the Smithsonian African American History And Culture Museum http:// go.usa.gov/Urt";;;;"172469187879501824";https://twitter.com/SenStabenow/status/172469187879501824
;2012-02-22 17:04;3;0;"#biobased manufacturing could create more than 100,000 jobs in the next few years http:// go.usa.gov/U1j";;;#biobased;"172456660055502849";https://twitter.com/SenStabenow/status/172456660055502849
;2012-02-22 13:54;2;0;"Chairwoman Stabenow Announces New “Grow it Here, Make it Here” Initiatives to Advance #Biobased Industry in Holland http:// go.usa.gov/U1j";;;#Biobased;"172408867727224832";https://twitter.com/SenStabenow/status/172408867727224832
;2012-02-21 15:53;4;0;"When we grow things in MI and make things in MI, we get jobs in MI http:// goo.gl/Vk7Mf #biobased";;;#biobased;"172076471161077761";https://twitter.com/SenStabenow/status/172076471161077761
;2012-02-21 15:45;2;0;"Chairwoman Stabenow Announces New “Grow it Here, Make it Here” Initiatives Advancing #Biobased Industry in Lansing http:// go.usa.gov/UOF";;;#Biobased;"172074389217607680";https://twitter.com/SenStabenow/status/172074389217607680
;2012-02-21 13:17;6;0;"In Flint, Chairwoman Stabenow Announces New Initiatives to Spur #Biobased Manufacturing http:// go.usa.gov/U3X pic.twitter.com/68e0Grqw";;;#Biobased;"172037322227974144";https://twitter.com/SenStabenow/status/172037322227974144
;2012-02-21 10:57;1;0;"Every Chevy Volt made in Michigan comes with #biobased foam seats http:// go.usa.gov/Ul7";;;#biobased;"172001957752483840";https://twitter.com/SenStabenow/status/172001957752483840
;2012-02-21 09:57;3;0;"Chairwoman Stabenow Announces “Grow it Here, Make it Here” Initiative to Advance Emerging Michigan Industry http:// go.usa.gov/Ul7 #BioBased";;;#BioBased;"171986843666096129";https://twitter.com/SenStabenow/status/171986843666096129
;2012-02-17 15:59;0;0;"See the impact of the middle class tax cut we passed today, county by county - http:// go.usa.gov/QS4 #Jobs #Michigan #40Dollars";;;#Jobs #Michigan #40Dollars;"170628346873516034";https://twitter.com/SenStabenow/status/170628346873516034
;2012-02-17 15:16;2;0;"Senator Stabenow Praises Passage of Middle Class Tax Cut http:// go.usa.gov/QS4 #jobs #40dollars";;;#jobs #40dollars;"170617579285655552";https://twitter.com/SenStabenow/status/170617579285655552
;2012-02-17 13:00;1;0;"MLIVE: Stabenow receives American Medical Association's top government service award http:// goo.gl/kzN6k (by @SueThoms for @MLive )";;@SueThoms @MLive;;"170583373742473216";https://twitter.com/SenStabenow/status/170583373742473216
;2012-02-17 11:30;2;0;"New Tax Credit Now Available to Michigan Businesses for Hiring Veterans http:// go.usa.gov/QJj #vets #vabenefit #jobs";;;#vets #vabenefit #jobs;"170560849029763072";https://twitter.com/SenStabenow/status/170560849029763072
;2012-02-15 09:28;0;1;"Stabenow Honored by @AmerMedicalAssn 's Dr. Nathan Davis Award for her Leadership on Health Issues http:// go.usa.gov/QGJ pic.twitter.com/nRugXWt6";;@AmerMedicalAssn;;"169805351510753280";https://twitter.com/SenStabenow/status/169805351510753280
;2012-02-15 07:00;1;0;"Tune in to WDTW 1310AM in Detroit or listen online at http:// ihr.fm/r2uN . I'll be talking with Tony Trupiano in just a moment.";;;;"169768077351854083";https://twitter.com/SenStabenow/status/169768077351854083
;2012-02-13 15:51;0;0;"ICYMI: Sen. Stabenow visits Houghton, commends local business - http:// goo.gl/m8aR2 #Michigan #UpperPeninsula #LoveDaUP";;;#Michigan #UpperPeninsula #LoveDaUP;"169176940777971712";https://twitter.com/SenStabenow/status/169176940777971712
;2012-02-07 14:05;1;0;"Chairwoman Stabenow Announces Farm Bill Hearing Schedule for February, March http:// go.usa.gov/QYn #agchat";;;#agchat;"166976007012749312";https://twitter.com/SenStabenow/status/166976007012749312
;2012-02-06 14:12;2;0;"Senator Stabenow Shines Spotlight on Chinese Attempt to Force Michigan Business Owner to Hand Over Technology http:// go.usa.gov/QcT";;;;"166615283744772098";https://twitter.com/SenStabenow/status/166615283744772098
