username;date;retweets;favorites;text;geo;mentions;hashtags;id;permalink
;2016-10-21 16:12;4;10;"Great brews, music, food, and art at @gallery_brewery in Portland! pic.twitter.com/3gusSWvuiK";;@gallery_brewery;;"789575062810562560";https://twitter.com/SenStabenow/status/789575062810562560
;2016-10-21 14:56;0;8;"So many beautiful quilts at Around the Block Quilt Shop in Portland! pic.twitter.com/kd64ZOi7tL";;;;"789555935228272640";https://twitter.com/SenStabenow/status/789555935228272640
;2016-10-20 17:55;4;14;"So impressed to see what Stewart Industries is doing to create jobs in Battle Creek! @SI_assembly pic.twitter.com/q8yUrPlUev";;@SI_assembly;;"789238522129608708";https://twitter.com/SenStabenow/status/789238522129608708
;2016-10-20 15:41;4;14;"If you love music, you'll love @DickersonMusic9 in Albion! pic.twitter.com/tCXlMliKFv";;@DickersonMusic9;;"789204934612746240";https://twitter.com/SenStabenow/status/789204934612746240
;2016-10-20 12:19;2;23;"Just bought great toys for my grandkids at Hall of Toys in Battle Creek! Congrats Bret & Melanie on your creativity! pic.twitter.com/ypY7FQEZBE";;;;"789153993348046848";https://twitter.com/SenStabenow/status/789153993348046848
;2016-10-20 10:50;4;21;". @station66bc has great ice cream, donuts, MI products and cool stuff for history buffs! Way to go Curt and Janette! pic.twitter.com/Nr22sULZi9";;@station66bc;;"789131702731964416";https://twitter.com/SenStabenow/status/789131702731964416
;2016-10-18 12:33;0;8;"Great to be with the Bay Area Chamber in #BayCity . I appreciate the special award. pic.twitter.com/kP3dPgoEBS";;;#BayCity;"788432914916704256";https://twitter.com/SenStabenow/status/788432914916704256
;2016-10-14 15:33;3;18;"As a musician, it was great fun to visit Ardis Music. Way to go Megan and Jeff! pic.twitter.com/wLn4kUb1Xu";;;;"787028500645416961";https://twitter.com/SenStabenow/status/787028500645416961
;2016-10-14 15:26;1;4;"Can't wait for O'Halloran's Public House to open in Mt. Clemens!! pic.twitter.com/eVw6Iobce3";;;;"787026801847480320";https://twitter.com/SenStabenow/status/787026801847480320
;2016-10-14 15:20;1;11;"Great to be in Mt. Clemens with the Mayor at Orleans Sports Cafe. Fantastic place! pic.twitter.com/ilLtppaRnZ";;;;"787025218799677440";https://twitter.com/SenStabenow/status/787025218799677440
;2016-10-14 12:50;1;2;"Great visit with Wolverine Broach! Go manufacturing! pic.twitter.com/CdtSV1nrLP";;;;"786987674166931457";https://twitter.com/SenStabenow/status/786987674166931457
;2016-10-12 12:46;7;16;"So happy to honor @EVEincLansing with the Purple Purse Award. Thanks to @AllstateGr8Lake for helping victims of domestic violence! pic.twitter.com/RYL25ZYwyb";;@EVEincLansing @AllstateGr8Lake;;"786261863755554816";https://twitter.com/SenStabenow/status/786261863755554816
;2016-10-10 14:26;10;29;"We need full funding for the Excellence in Mental Health Act so communities can provide services to all in need. #WorldMentalHealthDay";;;#WorldMentalHealthDay;"785562059039801344";https://twitter.com/SenStabenow/status/785562059039801344
;2016-10-07 12:55;3;12;"This $480,000 grant will help ensure that Flint students get the support they need to succeed in the classroom. http://www. mlive.com/news/flint/ind ex.ssf/2016/10/flint_schools_to_get_480k_for.html#incart_river_home …";;;#incart_river_home;"784452207244611585";https://twitter.com/SenStabenow/status/784452207244611585
;2016-10-06 10:41;2;8;"Excited to see the healthy dishes our two Flint students make with @FLOTUS today at the White House! #LetsMove http://www. mlive.com/news/flint/ind ex.ssf/2016/10/michelle_obama_to_host_pair_of.html#incart_2box_news_flint …";;@FLOTUS;#LetsMove #incart_2box_news_flint;"784056014274461696";https://twitter.com/SenStabenow/status/784056014274461696
;2016-10-05 14:56;7;8;". @Ford is making some #BoldMoves by bringing back the Bronco SUV and building it right here in Michigan! http://www. freep.com/story/money/ca rs/ford/2016/10/04/bronco-destined-return-fords-lineup/91540380/ …";;@Ford;#BoldMoves;"783757886845517824";https://twitter.com/SenStabenow/status/783757886845517824
;2016-10-05 12:31;0;5;"Lark's Bar-B-Que on the move. Yum! Can't beat it! pic.twitter.com/Et0V2OwQG8";;;;"783721371293679616";https://twitter.com/SenStabenow/status/783721371293679616
;2016-10-05 12:16;1;10;"Thank you Ethel for providing support to women looking for work as well as your great Murfee's Boutique in Benton Harbor! pic.twitter.com/GAhIhGvHZh";;;;"783717483412852736";https://twitter.com/SenStabenow/status/783717483412852736
;2016-10-05 11:54;2;11;"Vineyard 2121 is absolutely beautiful. Jeff and Debbie have every reason to be proud! pic.twitter.com/gEtGR0rGHp";;;;"783711879239602176";https://twitter.com/SenStabenow/status/783711879239602176
;2016-10-05 09:25;0;7;"Ginger makes beautiful jewelry at Edgin Creations in Paw Paw! pic.twitter.com/hEOkzJnSEK";;;;"783674388264656896";https://twitter.com/SenStabenow/status/783674388264656896
;2016-10-05 08:54;0;7;"Enjoyed a yummy latte at Greg's Paw Paw Blend! pic.twitter.com/mqmqGA28G5";;;;"783666580983050241";https://twitter.com/SenStabenow/status/783666580983050241
;2016-10-04 14:51;0;7;"Impressive work at Dancing Dogs Quilt Shop in Plainwell! pic.twitter.com/RY3OIiq9sT";;;;"783394177388208128";https://twitter.com/SenStabenow/status/783394177388208128
;2016-10-04 14:40;1;7;"Beautiful flowers at Plainwell's! Way to go, Pam! pic.twitter.com/rc0FZLaRnX";;;;"783391474197159937";https://twitter.com/SenStabenow/status/783391474197159937
;2016-10-04 14:25;1;3;"Great to visit @RWE_Wellness in Plainwell. Awesome food! pic.twitter.com/pyndfwdnNP";;@RWE_Wellness;;"783387477356707840";https://twitter.com/SenStabenow/status/783387477356707840
;2016-10-01 11:48;3;31;"Beautiful day to walk for Alzheimer's in Detroit. Huge crowd! pic.twitter.com/nQtHcG7jZQ";;;;"782260908533882881";https://twitter.com/SenStabenow/status/782260908533882881
;2016-09-28 14:18;11;35;"Shimon Peres was a dedicated and lifelong public servant for the state of Israel. His inspiring leadership will be missed around the world.";;;;"781211579232780288";https://twitter.com/SenStabenow/status/781211579232780288
;2016-09-28 10:57;23;30;"Here is my statement following negotiations to address aid for Flint in the House Water Resources Development Act: pic.twitter.com/Wwkuc8w93Q";;;;"781160844751212544";https://twitter.com/SenStabenow/status/781160844751212544
;2016-09-27 16:06;3;3;"People from all over Michigan are getting a chance to see the powerful and inspiring exhibits at the @NMAAHC ! http://www. detroitnews.com/story/entertai nment/arts/2016/09/26/smithsonian-national-african-american-musem-history-culture/91140468 …";;@NMAAHC;;"780876321521930240";https://twitter.com/SenStabenow/status/780876321521930240
;2016-09-27 11:22;42;72;"Enough is enough. There is no excuse. We need to get help to families in #Flint . They’ve had to wait too long! pic.twitter.com/huSXnGBVL7";;;#Flint;"780804873960972288";https://twitter.com/SenStabenow/status/780804873960972288
;2016-09-27 10:28;9;14;"At 11:30am, watch live as we tell the Republican-led Congress to include urgent aid for #Flint in the spending bill: https://www. youtube.com/watch?v=mG952c f1Wz0 …";;;#Flint;"780791343425597440";https://twitter.com/SenStabenow/status/780791343425597440
;2016-09-26 15:01;34;49;"My new bill will create new opportunities for urban farmers, improve access to healthy food & support healthy cities! #urbanagriculture pic.twitter.com/nr6GZ62Xyi";;;#urbanagriculture;"780497428537638912";https://twitter.com/SenStabenow/status/780497428537638912
;2016-09-26 14:33;16;29;"Today I’m announcing the Urban Agriculture Act of 2016 that will help urban farmers! Learn more at http:// stabenow.senate.gov ! pic.twitter.com/yTNb80BsyW";;;;"780490456677380096";https://twitter.com/SenStabenow/status/780490456677380096
;2016-09-26 13:44;31;44;"It's unacceptable how R’s demand disaster relief in their own states but deny help to Flint children & families for nearly a year #DoYourJob";;;#DoYourJob;"780478054183337984";https://twitter.com/SenStabenow/status/780478054183337984
;2016-09-26 13:09;32;32;"Congress must act to pass aid for Flint. The people of Flint have waited too long! http://www. mlive.com/news/flint/ind ex.ssf/2016/09/congress_must_pass_flint_water.html … @FlintJournal";;@FlintJournal;;"780469375681695744";https://twitter.com/SenStabenow/status/780469375681695744
;2016-09-25 14:03;9;33;"Thanks @SigmaKappa for all of your efforts to end Alzheimer's! pic.twitter.com/plGOo3y4O0";;@SigmaKappa;;"780120448210206720";https://twitter.com/SenStabenow/status/780120448210206720
;2016-09-25 11:39;5;31;"About to start the walk to end Alzheimer's in Lansing w/ @alzassociation pic.twitter.com/M1Q3rnIzaY";;@alzassociation;;"780084207594987520";https://twitter.com/SenStabenow/status/780084207594987520
;2016-09-24 13:45;1;12;"I love this shirt!! @EasternMarket pic.twitter.com/L3p28iKtdk";;@EasternMarket;;"779753604450168832";https://twitter.com/SenStabenow/status/779753604450168832
;2016-09-24 11:46;2;14;"Beautiful day at @EasternMarket in #Detroit ! pic.twitter.com/5rWdKml2CH";;@EasternMarket;#Detroit;"779723702921334784";https://twitter.com/SenStabenow/status/779723702921334784
;2016-09-24 09:48;3;17;"Today marks the opening of the long-awaited Museum of African-American History and Culture. Don’t miss it next time you’re in DC! @NMAAHC";;@NMAAHC;;"779693970691686400";https://twitter.com/SenStabenow/status/779693970691686400
;2016-09-23 10:07;75;109;"I told @Maddow that it is easy to include funding for both Flint & Louisiana in gov't funding bill. No more excuses! http://www. msnbc.com/rachel-maddow/ watch/congressional-gop-turn-their-backs-on-flint-771582531775 …";;@Maddow;;"779336278957522944";https://twitter.com/SenStabenow/status/779336278957522944
;2016-09-22 20:43;24;42;"Joining @Maddow soon to talk about urgently-needed aid for Flint. No reason govt funding bill can't include aid for both Louisiana & Flint!";;@Maddow;;"779134004222042112";https://twitter.com/SenStabenow/status/779134004222042112
;2016-09-22 16:08;14;24;"Donald Trump needs to release his tax returns. What is he hiding? pic.twitter.com/RqaHROnt2D";;;;"779064971590242304";https://twitter.com/SenStabenow/status/779064971590242304
;2016-09-22 10:11;9;34;"We will all miss seeing Carmen Harlan on @Local4News ! Best wishes!";;@Local4News;;"778974895166394368";https://twitter.com/SenStabenow/status/778974895166394368
;2016-09-22 09:51;12;10;"Help for Flint is fully paid-for & just passed with 95 votes in the Senate. The House needs to act! http://www. detroitnews.com/story/opinion/ editorials/2016/09/22/house-flint-relief/90821466/ … @DetNewsOpinion";;@DetNewsOpinion;;"778970035205398528";https://twitter.com/SenStabenow/status/778970035205398528
;2016-09-21 16:11;6;16;"What happens on the Supreme Court matters for families in this country. Senate Republicans, #DoYourJob and fill this seat now!";;;#DoYourJob;"778703113498734594";https://twitter.com/SenStabenow/status/778703113498734594
;2016-09-21 16:09;14;36;"Heading to the Senate floor now to tell Senate GOP: #DoYourJob and fill the opening on the Supreme Court. This really matters to families!";;;#DoYourJob;"778702652905435141";https://twitter.com/SenStabenow/status/778702652905435141
;2016-09-20 13:54;8;23;"But Celebrity Apprentice: Supreme Court Edition is not a show I want to watch! Senate Republicans, it’s time to #DoYourJob !";;;#DoYourJob;"778306284516962304";https://twitter.com/SenStabenow/status/778306284516962304
;2016-09-20 13:53;7;16;"Republicans haven’t acted on the SCOTUS nominee for the simple reason that they are saving a spot for future President Trump to fill.";;;;"778306114454753280";https://twitter.com/SenStabenow/status/778306114454753280
;2016-09-20 13:49;17;35;"Heading to the Senate floor now to call on Senate GOP to #DoYourJob and hold a vote on Judge Merrick Garland";;;#DoYourJob;"778305186456596480";https://twitter.com/SenStabenow/status/778305186456596480
;2016-09-17 10:20;6;44;"It was an honor to be presented with the John Conyers, Jr. Public Service Award at last night's MI CBC reception. pic.twitter.com/kDJvg69RFG";;;;"777165356418883584";https://twitter.com/SenStabenow/status/777165356418883584
;2016-09-15 18:21;25;30;"The crisis in Flint is far from over. The US House needs to pass this bill immediately and send it to the President. http://www. nytimes.com/2016/09/16/us/ politics/flint-michigan-water-senate-aid.html?ref=topics&_r=0 …";;;;"776561522164142080";https://twitter.com/SenStabenow/status/776561522164142080
;2016-09-15 17:31;29;22;"This is incredibly important for fixing and replacing the pipes in Flint. Flint families have waited too long! https://www. washingtonpost.com/news/powerpost /wp/2016/09/15/senate-clears-flint-aid-package-but-house-action-still-in-doubt/ …";;;;"776548964678135809";https://twitter.com/SenStabenow/status/776548964678135809
;2016-09-15 16:30;8;14;"The Senate has finally passed urgently needed help for families in Flint. US House must take action immediately! http://www. freep.com/story/news/loc al/michigan/flint-water-crisis/2016/09/15/us-senate-passes-bill-100-million-flint/90411042/ …";;;;"776533578087825408";https://twitter.com/SenStabenow/status/776533578087825408
;2016-09-15 14:29;14;21;"My statement on the Senate passage of urgently needed help for Flint families: pic.twitter.com/cJx0kDjrFo";;;;"776503180184215552";https://twitter.com/SenStabenow/status/776503180184215552
;2016-09-14 17:12;0;36;"Honored to receive Congressional Champion award from Visiting Nurses Association of America! Keep up the good work! pic.twitter.com/HDgAQGdulq";;;;"776181789324898304";https://twitter.com/SenStabenow/status/776181789324898304
;2016-09-14 12:31;22;47;"Flint citizens stand with us as Senate about to pass urgently needed aid to fix pipes @SenGaryPeters @RepDanKildee pic.twitter.com/oKFtnWQsAP";;@SenGaryPeters @RepDanKildee;;"776111136798302208";https://twitter.com/SenStabenow/status/776111136798302208
;2016-09-13 18:54;19;73;"Honored to be part of #POLITICO50 with two great Americans, Khizr and Ghazala Khan. Thank you for your courage! pic.twitter.com/c4qUKR2C5Z";;;#POLITICO50;"775845109971705856";https://twitter.com/SenStabenow/status/775845109971705856
;2016-09-13 12:04;11;26;"Announced today the US govt is filing suit to stop China’s illegal trade practices that hurt our farmers. pic.twitter.com/QwNGlC5YV3";;;;"775742082786918400";https://twitter.com/SenStabenow/status/775742082786918400
;2016-09-13 09:48;0;8;"Thank you. Flint families have waited too long! https:// twitter.com/ruthal/status/ 775673133009211393 …";;;;"775707723816169473";https://twitter.com/SenStabenow/status/775707723816169473
;2016-09-13 09:47;7;7;"ICYMI: I told @MorningEdition about our efforts to secure urgently-needed aid. Flint families have waited too long! http://www. npr.org/2016/09/13/493 721836/senate-to-vote-on-package-to-give-more-funds-toward-flints-drinking-water-crisis …";;@MorningEdition;;"775707391346311168";https://twitter.com/SenStabenow/status/775707391346311168
;2016-09-13 05:15;10;32;"I'm joining @MorningEdition at 6:20am to talk about the Senate's vote last night to move forward with aid for #Flint and other communities";;@MorningEdition;#Flint;"775638913398480896";https://twitter.com/SenStabenow/status/775638913398480896
;2016-09-12 14:19;0;4;". @collinjonkman - next time say hi!";;@collinjonkman;;"775413608217915392";https://twitter.com/SenStabenow/status/775413608217915392
;2016-09-11 11:57;8;28;"Today we come together as a country to pay tribute to thousands of Americans, including first responders, who lost their lives 15 years ago.";;;;"775015524845715456";https://twitter.com/SenStabenow/status/775015524845715456
;2016-09-08 12:43;22;48;"Americans need Republicans to #DoYourJob and protect their families from #Zika and security threats. pic.twitter.com/CBdLz2Hfz2";;;#DoYourJob #Zika;"773939828765392897";https://twitter.com/SenStabenow/status/773939828765392897
;2016-09-07 17:08;9;29;"I'm very pleased the Senate has begun consideration of our bipartisan agreement to help Flint as part of the WRDA bill";;;;"773644221068738565";https://twitter.com/SenStabenow/status/773644221068738565
;2016-09-07 15:53;2;9;"This is tremendous! River Raisin is one step closer to getting a clean bill of health. http://www. detroitnews.com/story/news/loc al/michigan/2016/09/07/river-raisin/89952036/ … pic.twitter.com/l5LSA3sI9q";;;;"773625351599783937";https://twitter.com/SenStabenow/status/773625351599783937
;2016-09-07 15:12;9;3;"175 days and counting. Still Senate Rs refuse to give Judge Garland a hearing. http://www. npr.org/2016/09/06/492 857860/173-days-and-counting-gop-unlikely-to-end-blockade-on-garland-nomination-soon …";;;;"773614992763518976";https://twitter.com/SenStabenow/status/773614992763518976
;2016-09-07 15:12;5;8;"Congress is back in session and the Supreme Court still only has 8 justices. #WeNeedNine";;;#WeNeedNine;"773614854380847104";https://twitter.com/SenStabenow/status/773614854380847104
;2016-09-07 15:11;7;12;"Calling on my GOP colleagues to #DoYourJob and confirm Judge Garland.";;;#DoYourJob;"773614783639777280";https://twitter.com/SenStabenow/status/773614783639777280
;2016-09-07 15:11;6;11;"Senate R’s fail to realize that #WeNeedNine on the Supreme Court and that Judge Garland deserves hearing.";;;#WeNeedNine;"773614583336603648";https://twitter.com/SenStabenow/status/773614583336603648
;2016-09-07 15:10;6;6;"Judge Garland’s former clerks call him a “brilliant legal mind” but Senate Rs have failed to give him a hearing. https:// amp.twimg.com/v/15053e16-79d c-48f2-a16f-5bebf4f9966f …";;;;"773614492961927168";https://twitter.com/SenStabenow/status/773614492961927168
;2016-09-07 15:10;6;13;"Your long summer recess is over, Senate Rs. Time to #DoYourJob and give Judge Garland a hearing and a vote.";;;#DoYourJob;"773614355690561536";https://twitter.com/SenStabenow/status/773614355690561536
;2016-09-07 12:23;6;21;"It is totally irresponsible that Republicans have been playing politics with #Zika . Another F for the Republican report card.";;;#Zika;"773572501909671936";https://twitter.com/SenStabenow/status/773572501909671936
;2016-09-07 09:23;28;30;"Senate Rs are failing Government 101. The refusal to hold hearings on Judge Garland's nomination to the Supreme Court is unprecedented.";;;;"773527050917449728";https://twitter.com/SenStabenow/status/773527050917449728
;2016-09-07 08:46;8;19;"Our Fall Roadmap for Senate Rs is simple. Reverse their failing grades and #DoYourJob for American families. http:// thehill.com/opinion/op-ed/ 294688-a-fall-roadmap-for-senate-democrats …";;;#DoYourJob;"773517808193957888";https://twitter.com/SenStabenow/status/773517808193957888
;2016-09-06 19:56;10;12;". @SenSchumer & I have called for Senate Rs to #DoYouJob and address the must-do items they've failed to accomplish. http:// thehill.com/opinion/op-ed/ 294688-a-fall-roadmap-for-senate-democrats …";;@SenSchumer;#DoYouJob;"773323920988573700";https://twitter.com/SenStabenow/status/773323920988573700
;2016-09-06 18:37;13;15;"The clock is ticking on #Zika . It’s irresponsible to not move forward w the bipartisan agreement we passed in May! http://www. thedailybeast.com/articles/2016/ 09/06/congress-is-finally-freaking-out-over-zika.html …";;;#Zika;"773304231881302016";https://twitter.com/SenStabenow/status/773304231881302016
;2016-08-29 14:17;6;10;"Serious reminder from @RonaldKlain about what could happen if Senate Rs continue to ignore the threat of #Zika . http:// blogs.wsj.com/washwire/2016/ 08/28/the-zika-undercount-and-the-viruss-growing-threat-to-public-health/ …";;@RonaldKlain;#Zika;"770339560358305792";https://twitter.com/SenStabenow/status/770339560358305792
;2016-08-26 12:25;1;15;"Excited to welcome back another great MI Olympian, Leland’s own @aglass6 ! http://www. mlive.com/sports/2016/08 /alisha_glass_olympic_bronze_me.html …";;@aglass6;;"769224221780242436";https://twitter.com/SenStabenow/status/769224221780242436
;2016-08-26 12:24;1;4;"Canton Township has some great hometown Olympic heroes! http://www. detroitnews.com/story/sports/o lympics/2016/08/25/metro-area-celebrates-rio-olympians-return/89378516/ …";;;;"769224121217613824";https://twitter.com/SenStabenow/status/769224121217613824
;2016-08-25 17:18;2;9;"Opening soon in Jackson- Gilbert Chocolates! pic.twitter.com/LLiFen79hx";;;;"768935671880744961";https://twitter.com/SenStabenow/status/768935671880744961
;2016-08-25 17:02;4;13;"￼Chilango's Chop House in Jackson is making great salads with products grown in MI! pic.twitter.com/z7HlX5fn0U";;;;"768931512976670720";https://twitter.com/SenStabenow/status/768931512976670720
;2016-08-25 16:20;2;16;"Cheers to John and the talented mixologists at Grand River Brewery in Jackson! pic.twitter.com/YmbF4NGffL";;;;"768921032090673154";https://twitter.com/SenStabenow/status/768921032090673154
;2016-08-25 14:50;3;8;"The Glidden Parker Mural Project in Jackson will be a cornerstone of the community! pic.twitter.com/FXTAZDMcBj";;;;"768898238468415488";https://twitter.com/SenStabenow/status/768898238468415488
;2016-08-25 12:45;8;25;"Happy 100th Birthday, @NatlParkService ! Who doesn’t love Michigan’s parks! Find your favorite one! #NPS100 pic.twitter.com/bN1xJBAnCR";;@NatlParkService;#NPS100;"768866914038710272";https://twitter.com/SenStabenow/status/768866914038710272
;2016-08-25 12:06;4;19;"Commemorating 100 years of our @NatlParkService at the River Raisin National Battlefield Park in Monroe #NPS100 pic.twitter.com/RpC4GJ0Wop";;@NatlParkService;#NPS100;"768857188311961600";https://twitter.com/SenStabenow/status/768857188311961600
;2016-08-25 08:13;5;11;"I love my Detroit Bike! https:// twitter.com/NewYorker/stat us/768659231461498880 …";;;;"768798508329603072";https://twitter.com/SenStabenow/status/768798508329603072
;2016-08-24 13:31;5;24;"Great things are happening in downtown Bay City! The items at @Ferne_Boutique are just beautiful. pic.twitter.com/cyqd5UXSSB";;@Ferne_Boutique;;"768516091870052352";https://twitter.com/SenStabenow/status/768516091870052352
;2016-08-24 13:01;1;6;"Great to stop by Tavern 101 in Bay City and meet their hardworking team! pic.twitter.com/fjc9zu9JIk";;;;"768508544165433345";https://twitter.com/SenStabenow/status/768508544165433345
;2016-08-24 12:21;3;18;"What a treat to visit St. Laurent Brothers candy store, a staple of downtown Bay City! pic.twitter.com/wNjIeZUVgZ";;;;"768498423200903168";https://twitter.com/SenStabenow/status/768498423200903168
;2016-08-17 12:28;2;6;"Good luck @Claressashields ! We're all rooting for you! https:// twitter.com/freepsports/st atus/765962068428283904 …";;@Claressashields;;"765963477009723392";https://twitter.com/SenStabenow/status/765963477009723392
;2016-08-15 08:49;6;16;"Social Security continues to create economic security for millions of Americans. 81-years-old and going strong!";;;;"765183703463124992";https://twitter.com/SenStabenow/status/765183703463124992
;2016-08-11 14:44;5;27;"So proud of Michigan Olympian, Allison Schmitt and the women’s 4x200 freestyle relay team for bringing home the gold! #TeamUSA";;;#TeamUSA;"763823444731494400";https://twitter.com/SenStabenow/status/763823444731494400
;2016-08-11 08:57;3;3;"This would be great for Battle Creek and the region. Michigan remains in a strong position. http:// wwmt.com/news/local/bat tle-creek-atop-short-list-of-sites-for-new-missile-defense-system …";;;;"763735988875190272";https://twitter.com/SenStabenow/status/763735988875190272
;2016-08-11 08:56;4;9;"When entrepreneurs have access to the right resources they can grow their businesses. Thx @MCS4Biz for coming to MI! http://www. wzzm13.com/news/local/gra nd-rapids-central/us-sen-debbie-stabenow-in-grand-rapids-highlighting-hispanic-business/292353149 …";;@MCS4Biz;;"763735799531728900";https://twitter.com/SenStabenow/status/763735799531728900
;2016-08-09 16:36;8;18;"A pleasure to recognize the entrepreneurial spirit of the West Michigan Hispanic Chamber of Commerce! #SBAinMI pic.twitter.com/3c4JacmioU";;;#SBAinMI;"763126740893962240";https://twitter.com/SenStabenow/status/763126740893962240
;2016-08-09 16:05;2;10;"Great roundtable discussion with business owners and the Greater Lansing Hispanic Chamber of Commerce. #SBAinMI pic.twitter.com/Lr3Ua20TFN";;;#SBAinMI;"763118993481822208";https://twitter.com/SenStabenow/status/763118993481822208
;2016-08-09 12:11;6;13;"Alzheimer’s is a heartbreaking disease that affects the whole family. Caregiver support & cure have to be priority http://www. lansingstatejournal.com/story/opinion/ contributors/viewpoints/2016/08/08/johns-hope-alzheimers-disease-push-michigan/88443792/ … ”";;;;"763060201247412226";https://twitter.com/SenStabenow/status/763060201247412226
;2016-08-09 09:55;5;17;"Great to welcome @MCS4Biz in Michigan for a small business roundtable with Hispanic business leaders! #SBAinMI pic.twitter.com/PKHjbTmLQ3";;@MCS4Biz;#SBAinMI;"763025955774488576";https://twitter.com/SenStabenow/status/763025955774488576
;2016-08-09 08:38;0;23;"Great job, Lilly King, for winning gold in the 100-meter breaststroke last night! Go team #USA !";;;#USA;"763006666044350470";https://twitter.com/SenStabenow/status/763006666044350470
;2016-08-08 07:26;2;18;"Katie Ledecky's world record 400 freestyle last night was amazing! #USA";;;#USA;"762626016787308546";https://twitter.com/SenStabenow/status/762626016787308546
;2016-08-08 07:25;2;16;"Congratulations to @MichaelPhelps and Team #USA";;@MichaelPhelps;#USA;"762625785727373314";https://twitter.com/SenStabenow/status/762625785727373314
;2016-08-04 15:21;1;20;"Happy Birthday, @USCG ! #TBT to meeting the brave men and women serving in Grand Haven. pic.twitter.com/inSJ2XplFN";;@USCG;#TBT;"761296039383076864";https://twitter.com/SenStabenow/status/761296039383076864
