username;date;retweets;favorites;text;geo;mentions;hashtags;id;permalink
;2017-06-14 13:39;20;70;"Sending special prayers to Matt Mika and his family during this difficult time. https:// twitter.com/FOX2News/statu s/875043225311956992 …";;;;"875060076410580992";https://twitter.com/SenStabenow/status/875060076410580992
;2017-06-14 10:58;23;87;"My thoughts are w/ @SteveScalise , staffers, @CapitolPolice & first responders affected by this horrific attack. Thank you for your bravery.";;@SteveScalise @CapitolPolice;;"875019664040054784";https://twitter.com/SenStabenow/status/875019664040054784
;2017-06-13 16:00;25;76;"TUNE IN: Senate Democratic women live on Facebook to talk about how disastrous Trumpcare would be for women & fams → https://www. facebook.com/USSenateDemocr ats/ …";;;;"874733114714619908";https://twitter.com/SenStabenow/status/874733114714619908
;2017-06-13 13:52;3;25;"I was honored to author a bill last year to make this possible along with @SenGaryPeters and @RepFredUpton .";;@SenGaryPeters @RepFredUpton;;"874701062111997952";https://twitter.com/SenStabenow/status/874701062111997952
;2017-06-13 13:52;8;58;"Great news that Private First Class James McCloughan is finally getting the recognition he deserves! https:// twitter.com/detroitnews/st atus/874655185133596672 …";;;;"874700960756576256";https://twitter.com/SenStabenow/status/874700960756576256
;2017-06-09 12:07;14;47;"What a wonderful way to start the @dmweekend festival and pay tribute to legend @ArethaFranklin ! https:// twitter.com/freep/status/8 72983877324754944 …";;@dmweekend @ArethaFranklin;;"873225159641112578";https://twitter.com/SenStabenow/status/873225159641112578
;2017-06-09 11:41;7;33;"Thanks to all the volunteers at this morning's @Deloitte #Detroit Impact Day! Your service makes a real difference. pic.twitter.com/O4sllpgiR9";;@Deloitte;#Detroit;"873218575326216193";https://twitter.com/SenStabenow/status/873218575326216193
;2017-06-08 17:36;883;1624;"Today I asked Sec Tom Price why he thinks the cost of lifesaving drugs should be tens of thousands of dollars. He didn't have a good answer. pic.twitter.com/aruE0OBVjW";;;;"872945421991239680";https://twitter.com/SenStabenow/status/872945421991239680
;2017-06-07 11:23;7;48;"Thank you Alexander Nitz for your dedication to science and for being proud of your Michigan roots! https:// twitter.com/freep/status/8 72287282157330433 …";;;;"872489247583895553";https://twitter.com/SenStabenow/status/872489247583895553
;2017-06-06 11:24;10;27;"Congratulations Claire Juip for winning #LettersAboutLiterature ! You are truly an inspiration and Michigan is incredibly proud of you! https:// twitter.com/freep/status/8 71920101599068164 …";;;#LettersAboutLiterature;"872127055961477120";https://twitter.com/SenStabenow/status/872127055961477120
;2017-06-05 15:10;20;58;"I sat down with @RickAlbinWoodTV to discuss how the latest budget cuts hurt our Great Lakes and our Michigan way of life. https:// twitter.com/woodtv/status/ 871376732615585793 …";;@RickAlbinWoodTV;;"871821512214544384";https://twitter.com/SenStabenow/status/871821512214544384
;2017-06-02 12:16;39;111;"Did you know that the Soo Locks are our #1 infrastructure priority? I'm here today talking about why they need an upgrade! pic.twitter.com/W2NzbfZm0U";;;#1;"870690654816419840";https://twitter.com/SenStabenow/status/870690654816419840
;2017-06-02 11:12;23;58;"The #SooLocks are critical to our Michigan economy and need to be upgraded. Read my oped in @freep for more: http://www. freep.com/story/opinion/ contributors/2017/06/02/stabenow-economy-invest-soo-locks/362539001/ …";;@freep;#SooLocks;"870674560848416768";https://twitter.com/SenStabenow/status/870674560848416768
;2017-06-02 09:58;19;64;"Our Michigan delegation is touring the Soo Locks right now. Critical economic and national security infrastructure. pic.twitter.com/VOcjf8t3Hz";;;;"870655811097329667";https://twitter.com/SenStabenow/status/870655811097329667
;2017-06-01 13:08;14;13;"Announced exciting next phase of autonomous military vehicle testing along I-69 corridor! w/ @TARDEC_PAO @MichiganDOT #MPC17 pic.twitter.com/uyTbDQdzNN";;@TARDEC_PAO @MichiganDOT;#MPC17;"870341318899314688";https://twitter.com/SenStabenow/status/870341318899314688
;2017-06-01 12:44;9;33;"The Locks are absolutely critical to Michigan and our country's economy and security! #MPC17";;;#MPC17;"870335356654235649";https://twitter.com/SenStabenow/status/870335356654235649
;2017-06-01 12:42;29;77;"Announced new bill to fund critical Soo Locks upgrade @RepJackBergman @SenGaryPeters @RepFredUpton @RepWalberg @RepDanKildee @RepDebDingell pic.twitter.com/u5oyz0mcQk";;@RepJackBergman @SenGaryPeters @RepFredUpton @RepWalberg @RepDanKildee @RepDebDingell;;"870334731832963073";https://twitter.com/SenStabenow/status/870334731832963073
;2017-05-31 05:54;10;59;"Congratulations to my friend, Mitch Albom, and all of this years wonderful inductees to our Sports Hall of Fame! http:// on.freep.com/2scddt5";;;;"869869736124985346";https://twitter.com/SenStabenow/status/869869736124985346
;2017-05-30 14:46;1;10;"Branham's Jewelry In East Tawas is amazing! So beautiful! pic.twitter.com/6EYQzrlM4z";;;;"869641280678223872";https://twitter.com/SenStabenow/status/869641280678223872
;2017-05-30 12:32;97;312;"The @realDonaldTrump Administration needs to understand that the Great Lakes are a national priority! https:// twitter.com/MoveOn/status/ 867926327726415874 …";;@realDonaldTrump;;"869607343981555715";https://twitter.com/SenStabenow/status/869607343981555715
;2017-05-29 15:37;21;100;"Honored to lay a wreath in remembrance at the River Raisin National Battlefield Park pic.twitter.com/YFKw1lsiL9";;;;"869291738728464389";https://twitter.com/SenStabenow/status/869291738728464389
;2017-05-29 12:49;11;82;"Great to be part of honoring our fallen heroes in Dearborn today. Beautiful tribute! pic.twitter.com/tenxbZtXhy";;;;"869249257752203264";https://twitter.com/SenStabenow/status/869249257752203264
;2017-05-28 13:56;12;73;"St.Clair Shores Memorial Day parade was awesome as usual! pic.twitter.com/bMtMMb4UVb";;;;"868903916058161153";https://twitter.com/SenStabenow/status/868903916058161153
;2017-05-27 11:40;35;116;"Thank you, @StopFeetPain , for caring about our veterans! So important! So inspirational! http:// on.freep.com/2rqtMUE";;@StopFeetPain;;"868507119074631682";https://twitter.com/SenStabenow/status/868507119074631682
;2017-05-26 14:00;19;167;"Ramadan Mubarak to all of my Muslim friends. Wishing you and your families a blessed holy month filled with happiness and joy!";;;;"868180082266968064";https://twitter.com/SenStabenow/status/868180082266968064
;2017-05-26 13:42;20;38;"We can't allow China to manipulate its currency! @RealDonaldTrump , will you keep your promise to Michigan workers? https://www. nytimes.com/2017/05/26/bus iness/dealbook/china-currency.html?_r=0 …";;@RealDonaldTrump;;"868175523305881602";https://twitter.com/SenStabenow/status/868175523305881602
;2017-05-25 16:23;11;66;"@SenGaryPeters and I are ensuring the protection of our Great Lakes by requiring stronger safeguards and oversight of pipelines. https:// twitter.com/detroitnews/st atus/867821321408831488 …";;@SenGaryPeters;;"867853701918056449";https://twitter.com/SenStabenow/status/867853701918056449
;2017-05-25 16:12;448;805;"I asked OMB Dir. Mulvaney why the Trump budget fails to protect our Great Lakes. His answer is unacceptable! pic.twitter.com/EyJtNFIGQm";;;;"867850862676160512";https://twitter.com/SenStabenow/status/867850862676160512
;2017-05-24 17:38;18;70;"I’m ready to work across the aisle to lower costs and improve care for Michigan families, but this plan makes people pay more for less.";;;;"867510262198394880";https://twitter.com/SenStabenow/status/867510262198394880
;2017-05-24 17:38;21;48;"If you or your family member has a preexisting condition like cancer, pregnancy, or diabetes, you could lose coverage or pay a lot more.";;;;"867510195584454657";https://twitter.com/SenStabenow/status/867510195584454657
;2017-05-24 17:37;18;37;"It raises costs and takes us back to the days when insurance companies were in charge of your health care.";;;;"867509988176146432";https://twitter.com/SenStabenow/status/867509988176146432
;2017-05-24 17:37;124;382;"Today’s non-partisan #CBO report confirms once again that Trumpcare is a bad deal for Michigan families.";;;#CBO;"867509935986405377";https://twitter.com/SenStabenow/status/867509935986405377
;2017-05-24 15:40;8;27;"Congratulations @LaurenDuski on becoming runner-up on @NBCTheVoice . Michigan couldn’t be more proud of you! https:// twitter.com/MLive/status/8 67242357141508096 …";;@LaurenDuski @NBCTheVoice;;"867480484556800001";https://twitter.com/SenStabenow/status/867480484556800001
;2017-05-24 15:00;2;16;"So great to meet such bright, motivated @CloseUp_DC students from Canton Prep! pic.twitter.com/rVEELf7Izt";;@CloseUp_DC;;"867470264426151937";https://twitter.com/SenStabenow/status/867470264426151937
;2017-05-24 14:39;13;27;"We have lost too many lives in Michigan due to opioid overdose. I just spoke with @WLNS about what Congress is going to do to combat it. pic.twitter.com/b7kEVkfCUR";;@WLNS;;"867465135308320769";https://twitter.com/SenStabenow/status/867465135308320769
;2017-05-23 17:30;144;267;"DeVos & the admin. want to implement policies nationwide that have already failed children in MI instead of working to improve our schools!";;;;"867145620804562944";https://twitter.com/SenStabenow/status/867145620804562944
;2017-05-23 17:00;66;183;"POTUS's budget plan guts Medicaid and hurts seniors across Michigan who depend on nursing home care. Shame on them!";;;;"867138067466919936";https://twitter.com/SenStabenow/status/867138067466919936
;2017-05-23 16:43;179;297;"President Trump's budget just came out. Terrible news for the Great Lakes! We need you to speak out and get involved! pic.twitter.com/U3H4PLMuWS";;;;"867133841890308096";https://twitter.com/SenStabenow/status/867133841890308096
;2017-05-22 20:19;26;197;"Terrible news from the U.K. tonight. My heart goes out to the victims and their families.";;;;"866825965925789698";https://twitter.com/SenStabenow/status/866825965925789698
;2017-05-20 16:31;20;94;"Sending gratitude to the men and women who bravely serve in our @USArmy @USMC @USNavy @usairforce and @USCG on this #ArmedForcesDay";;@USArmy @USMC @USNavy @usairforce @USCG;#ArmedForcesDay;"866043713600069632";https://twitter.com/SenStabenow/status/866043713600069632
;2017-05-19 13:02;7;38;"This is so very tragic and senseless. My thoughts and prayers are with Alyssa's family and friends. https:// twitter.com/freep/status/8 65312100431929345 …";;;;"865628815908683777";https://twitter.com/SenStabenow/status/865628815908683777
;2017-05-18 14:00;36;177;"Women should not have to worry about losing basic health care. We must stand together to protect women & families in MI. #WomensHealthWeek";;;#WomensHealthWeek;"865280830935109633";https://twitter.com/SenStabenow/status/865280830935109633
;2017-05-18 10:17;10;54;"100 years of great food and happy memories! Happy anniversary to Detroit’s @AmericanConey ! https:// twitter.com/freep/status/8 65200079489175553 …";;@AmericanConey;;"865224852302700544";https://twitter.com/SenStabenow/status/865224852302700544
;2017-05-17 18:29;27;181;"Welcome news of special counsel for Trump-Russia investigation. Read my statement here: https://www. stabenow.senate.gov/news/stabenow- statement-on-appointment-of-robert-mueller-as-special-counsel-in-russia-investigation …";;;;"864986314567020544";https://twitter.com/SenStabenow/status/864986314567020544
;2017-05-17 18:00;9;43;"Thanking and honoring those who have fallen and those who put their lives on the line to protect our communities #NationalPoliceWeek";;;#NationalPoliceWeek;"864978842615771136";https://twitter.com/SenStabenow/status/864978842615771136
;2017-05-17 13:00;7;20;"Congrats @LaurenDuski for making it to the finals of @NBCTheVoice ! http:// s.mlive.com/KNwswJf";;@LaurenDuski @NBCTheVoice;;"864903356698861568";https://twitter.com/SenStabenow/status/864903356698861568
;2017-05-17 10:44;14;55;"Stay strong, @MazieHirono ! We will keep you in our thoughts and hope for a speedy recovery. https:// twitter.com/maziehirono/st atus/864572689528303618 …";;@MazieHirono;;"864869157422104576";https://twitter.com/SenStabenow/status/864869157422104576
;2017-05-17 10:43;1;22;"Glad to hear it! Wishing you the best @SenThomTillis https:// twitter.com/SenThomTillis/ status/864839398575280136 …";;@SenThomTillis;;"864868999951245313";https://twitter.com/SenStabenow/status/864868999951245313
;2017-05-16 17:57;66;296;"Stunning news of how POTUS tried to influence the FBI’s Russia investigation. We need answers and an independent special prosecutor. https:// twitter.com/nytimes/status /864592260964511745 …";;;;"864615858932461568";https://twitter.com/SenStabenow/status/864615858932461568
;2017-05-16 07:53;11;46;"Families in Michigan are losing too many loved ones to opioid addiction. Read my oped in #Marquette Mining Journal: http://www. miningjournal.net/opinion/column s/2017/05/helping-michigan-families-tackle-drug-addiction/ …";;;#Marquette;"864463871129649152";https://twitter.com/SenStabenow/status/864463871129649152
;2017-05-15 17:23;96;310;"Once again, deeply alarmed. POTUS leaking highly classified information to Russians puts lives at risk. https:// twitter.com/washingtonpost /status/864224477693005826 …";;;;"864244819845148673";https://twitter.com/SenStabenow/status/864244819845148673
;2017-05-14 16:05;10;122;"Celebrating my wonderful mother, Ann Greer, today and every day and Michelle and Sara, the beautiful mothers of my grandchildren! pic.twitter.com/szyGlbN6Gq";;;;"863862744671453185";https://twitter.com/SenStabenow/status/863862744671453185
;2017-05-13 07:59;5;46;"Great to be back at the @KomenDetroit #RacefortheCure this morning with Kids Kicking Cancer! pic.twitter.com/rfAazMQ1uM";;@KomenDetroit;#RacefortheCure;"863378195185377284";https://twitter.com/SenStabenow/status/863378195185377284
;2017-05-12 13:27;8;27;"Thank you for also serving and for loving and supporting our #military members. #MilitarySpouseAppreciationDay";;;#military #MilitarySpouseAppreciationDay;"863098398957871105";https://twitter.com/SenStabenow/status/863098398957871105
;2017-05-12 11:51;15;59;"Exciting to see the new @qlinedetroit connecting Detroiters & visitors to wonderful businesses & destinations across Detroit! #WeMoveDetroit pic.twitter.com/HMfmaWfHDM";;@qlinedetroit;#WeMoveDetroit;"863074268241944576";https://twitter.com/SenStabenow/status/863074268241944576
;2017-05-12 09:59;16;55;"Riding the @qlinedetroit with @RepLawrence ! pic.twitter.com/Ovd6aHKogn";;@qlinedetroit @RepLawrence;;"863045898527494144";https://twitter.com/SenStabenow/status/863045898527494144
;2017-05-12 09:01;17;76;"Come on down for the grand opening of the QLINE! pic.twitter.com/4hGsAidNpg";;;;"863031474425143297";https://twitter.com/SenStabenow/status/863031474425143297
;2017-05-11 16:12;53;126;"Stood w @PattyMurray @SenGillibrand @SenatorHassan to oppose House R health plan - it imposes a pregnancy tax on women! Bad for families! pic.twitter.com/Cpc7SKXQhx";;@PattyMurray @SenGillibrand @SenatorHassan;;"862777552636694529";https://twitter.com/SenStabenow/status/862777552636694529
;2017-05-11 10:32;101;323;"This is not a partisan or a R or D issue; it is about the security of the US and protecting our country from Russia! http://www. detroitnews.com/story/news/pol itics/2017/05/10/mich-dems-seek-independent-russia-probe/101509500/ …";;;;"862691969369341952";https://twitter.com/SenStabenow/status/862691969369341952
;2017-05-10 20:00;15;52;"So great to meet with high school students from @OakridgeSchools who came to D.C. to advocate for @AmeriCorps and its important work! pic.twitter.com/NAlc5P7oYu";;@OakridgeSchools @AmeriCorps;;"862472332140576774";https://twitter.com/SenStabenow/status/862472332140576774
;2017-05-10 18:01;13;63;"Honored to receive this recognition from Gary Kushner and the Small Business Council of America pic.twitter.com/N9d9NfviDg";;;;"862442415520657408";https://twitter.com/SenStabenow/status/862442415520657408
;2017-05-10 15:09;72;166;"Thank you, Rod Nelson, CEO of #Mackinac Straits Health System, for explaining how #Trumpcare would hurt rural communities in #Michigan . pic.twitter.com/aP0KdNuEpI";;;#Mackinac #Trumpcare #Michigan;"862399262080020483";https://twitter.com/SenStabenow/status/862399262080020483
;2017-05-10 15:02;73;146;"Thank you, Cyndi and @MomsRising for sharing your story. #Trumpcare threatens coverage for Cyndi’s daughter, who has Down syndrome. pic.twitter.com/pZgXEFgScs";;@MomsRising;#Trumpcare;"862397348747640836";https://twitter.com/SenStabenow/status/862397348747640836
;2017-05-10 14:59;68;139;"If we had #Trumpcare , Michael would have been denied coverage for cancer treatment based on a preexisting condition. #AmericaSpeaksOut pic.twitter.com/xn2QuljvfI";;;#Trumpcare #AmericaSpeaksOut;"862396741462765570";https://twitter.com/SenStabenow/status/862396741462765570
;2017-05-10 14:58;28;90;"Gina just shared her story about getting lifesaving care thanks to @PPFA . Thank you, Gina! #AmericaSpeaksOut pic.twitter.com/uet1T8XFvt";;@PPFA;#AmericaSpeaksOut;"862396345000353798";https://twitter.com/SenStabenow/status/862396345000353798
;2017-05-10 14:31;41;139;"We need your voices to fight #Trumpcare , which hits Michigan families with a triple whammy: less coverage, higher costs, more taxes!";;;#Trumpcare;"862389708902588416";https://twitter.com/SenStabenow/status/862389708902588416
;2017-05-10 14:16;10;14;"Watch live! #AmericaSpeaksOut https:// twitter.com/MomsRising/sta tus/862382393017208837 …";;;#AmericaSpeaksOut;"862385932112191488";https://twitter.com/SenStabenow/status/862385932112191488
;2017-05-10 14:13;9;17;"Watch as people from across the country tell @SenateDems how #Trumpcare hurts them. LIVE: https://www. c-span.org/video/?428282- 1/democrats-hold-hearing-impact-housepassed-health-care-bill … #AmericaSpeaksOut @cspan";;@SenateDems @cspan;#Trumpcare #AmericaSpeaksOut;"862385120321392642";https://twitter.com/SenStabenow/status/862385120321392642
;2017-05-10 14:11;7;13;"With #Trumpcare , Michael would face significantly higher premiums because of the age tax!";;;#Trumpcare;"862384518333960192";https://twitter.com/SenStabenow/status/862384518333960192
;2017-05-10 14:10;6;17;"…he was able to sign up for insurance on #Virginia ’s marketplace despite his preexisting condition.";;;#Virginia;"862384432203935745";https://twitter.com/SenStabenow/status/862384432203935745
;2017-05-10 14:08;5;16;"Michael Dunkley was diagnosed with stage 4 lymphoma in 2013 but his insurance was set to expire at the end of the year…";;;;"862383890723463171";https://twitter.com/SenStabenow/status/862383890723463171
;2017-05-10 14:07;12;26;"So Carol moved to #Maryland and was able to get covered through Medicaid. #Trumpcare threatens her health!";;;#Maryland #Trumpcare;"862383546006208513";https://twitter.com/SenStabenow/status/862383546006208513
;2017-05-10 14:06;8;14;"For most of her life, her MS was manageable and she was uninsured. But it got worse in 2013 and she did not qualify for affordable care…";;;;"862383365722439680";https://twitter.com/SenStabenow/status/862383365722439680
;2017-05-10 14:06;7;17;"Carol Fisher Hardaway is a 63-year-old substitute teacher who has lived with multiple sclerosis since 1990…";;;;"862383269681168384";https://twitter.com/SenStabenow/status/862383269681168384
;2017-05-10 13:56;30;124;"Thanks to early detection and treatment from @PPFA Gina was able to become mother of three!";;@PPFA;;"862380900000182277";https://twitter.com/SenStabenow/status/862380900000182277
;2017-05-10 13:56;6;34;"Gina Walkington from #Wisconsin used @PPFA preventive services to detect and remove pre-cancerous cells.";;@PPFA;#Wisconsin;"862380736359391233";https://twitter.com/SenStabenow/status/862380736359391233
;2017-05-10 13:49;4;19;"…but now because of Medicaid, Cyndi can get her daughter the care she needs and get her family out of medical debt.";;;;"862379142892990464";https://twitter.com/SenStabenow/status/862379142892990464
;2017-05-10 13:48;5;21;"We’re joined by Cyndi Johnson from #Indiana . Her daughter was born with a preexisting condition & was nearing the lifetime cap...";;;#Indiana;"862378954832957442";https://twitter.com/SenStabenow/status/862378954832957442
;2017-05-10 13:36;11;14;"NOW: How will #Trumpcare affect you? Share your story using the hashtag #AmericaSpeaksOut . pic.twitter.com/EgUq08i52C";;;#Trumpcare #AmericaSpeaksOut;"862375870106914816";https://twitter.com/SenStabenow/status/862375870106914816
;2017-05-10 13:00;7;16;"Happening in 30 minutes https:// twitter.com/senstabenow/st atus/862332867556323328 …";;;;"862366724267671552";https://twitter.com/SenStabenow/status/862366724267671552
;2017-05-10 10:45;25;34;"Tune in LIVE at 2:30pm as @SenateDems hear from people across the country who would be hurt by #Trumpcare https://www. youtube.com/watch?v=0CrirD WLzXM …";;@SenateDems;#Trumpcare;"862332867556323328";https://twitter.com/SenStabenow/status/862332867556323328
;2017-05-09 18:50;510;1342;"Deeply troubling that President Trump fired FBI Dir. Comey, who was leading Trump-Russia investigation. We need an independent prosecutor!";;;;"862092453234573312";https://twitter.com/SenStabenow/status/862092453234573312
;2017-05-09 14:19;11;49;"Thankful the @USNavy has made sure Machinist Mate First Class Fred M. Jones will return to his final resting place in Port Huron. https:// twitter.com/thetimesherald /status/861590057425149952 …";;@USNavy;;"862024190307819520";https://twitter.com/SenStabenow/status/862024190307819520
;2017-05-06 11:47;7;29;"Michigan Farm Bill Field Hearing Press Conference https://www. pscp.tv/w/a9ykHDFEWktv WVlrYURnRWF8MWRSS1pBdnBCVlZ4QpxLDgAhtBhcbhAzEj8Z-nKMzYaL4MIua7fRlb_UOch2 …";;;;"860898803741638657";https://twitter.com/SenStabenow/status/860898803741638657
;2017-05-05 16:22;5;32;"Great to visit the Buechler family farm. Very impressive conservation leaders! @MichFarmBureau pic.twitter.com/bMHk7lumkc";;@MichFarmBureau;;"860605600014774272";https://twitter.com/SenStabenow/status/860605600014774272
;2017-05-05 15:52;142;222;"Republicans are crafting a health care bill that will affect millions of women w no women in the room. Hmm..Will maternity care be covered?? https:// twitter.com/sahilkapur/sta tus/860522339301302272 …";;;;"860598106815156224";https://twitter.com/SenStabenow/status/860598106815156224
;2017-05-04 13:20;77;333;"The House Republican plan is bad for Michigan and I will oppose it in the Senate!";;;;"860197480935436289";https://twitter.com/SenStabenow/status/860197480935436289
;2017-05-04 12:53;44;77;"If your mom or dad has a preexisting condition like arthritis, heart disease, breast cancer, or kidney disease they might not get covered.";;;;"860190611655282688";https://twitter.com/SenStabenow/status/860190611655282688
;2017-05-04 12:52;23;46;"If your son or daughter has a preexisting condition like diabetes, autism, a heart condition, cancer they might not get covered.";;;;"860190445221142528";https://twitter.com/SenStabenow/status/860190445221142528
;2017-05-04 12:52;15;33;"Their bill would kick 24 million people off their health insurance and create chaos in the health care system.";;;;"860190337620377600";https://twitter.com/SenStabenow/status/860190337620377600
;2017-05-04 12:51;17;43;"House Republicans instead are voting on a plan that raises costs for less care & takes us back to days when insurance co's were in charge.";;;;"860190222847549440";https://twitter.com/SenStabenow/status/860190222847549440
;2017-05-04 12:51;38;193;"We need to work across the aisle to lower health care costs for Michigan families & small biz, bring down prescription drug costs & more.";;;;"860190095357378560";https://twitter.com/SenStabenow/status/860190095357378560
;2017-05-03 16:03;3;8;"Warmest congratulations to talented Gaylord native, @LaurenDuski , for becoming a @NBCTheVoice Top 10 finalist! Michigan is rooting for you!";;@LaurenDuski @NBCTheVoice;;"859876165217026049";https://twitter.com/SenStabenow/status/859876165217026049
;2017-05-03 13:28;25;112;"Instead of this bill, we need to work together to bring down the costs of premiums and copays for Michigan families and businesses";;;;"859837097515130888";https://twitter.com/SenStabenow/status/859837097515130888
;2017-05-03 13:28;20;68;"If your child has a heart condition or cancer, would you rather know your child is protected or put insurance cos. back in charge?";;;;"859836972122218502";https://twitter.com/SenStabenow/status/859836972122218502
;2017-05-03 13:27;69;156;"Republicans are getting ready to vote on a healthcare bill that’s even worse than before!";;;;"859836915058606080";https://twitter.com/SenStabenow/status/859836915058606080
;2017-05-02 12:05;3;25;"I can’t thank you enough for all the work you do, #SmallBiz owners. I won’t stop fighting for you in Congress! #SmallBusinessWeek";;;#SmallBiz #SmallBusinessWeek;"859453928655790086";https://twitter.com/SenStabenow/status/859453928655790086
;2017-05-02 12:05;3;16;"While touring Fenton, I stopped at @crustabakingco which is famous for their sea salt chocolate chip cookies! #SmallBusinessWeek pic.twitter.com/DKfFx9kPcJ";;@crustabakingco;#SmallBusinessWeek;"859453776238977024";https://twitter.com/SenStabenow/status/859453776238977024
;2017-05-02 12:04;1;6;"In St. Ignace, I got to see all the great items at The Voyageur Trading Post. #SmallBusinessWeek pic.twitter.com/WrSePHUJUb";;;#SmallBusinessWeek;"859453604905857024";https://twitter.com/SenStabenow/status/859453604905857024
