username;date;retweets;favorites;text;geo;mentions;hashtags;id;permalink
;2015-07-26 18:46;5;4;"I'm on #Instagram ! Follow me to see snapshots of what I do daily to serve Indiana's Fifth District. #IN05 pic.twitter.com/Etusa5u8vm";;;#Instagram #IN05;"625452113808728064";https://twitter.com/SusanWBrooks/status/625452113808728064
;2015-07-26 17:54;2;4;"What an exciting race! #Brickyard400 https:// twitter.com/ims/status/625 438194507513856 …";;;#Brickyard400;"625439175265927168";https://twitter.com/SusanWBrooks/status/625439175265927168
;2015-07-23 15:09;3;4;"Women from #NASA and across public and private sector #STEM fields gathered yesterday at the #WPISTEMFair pic.twitter.com/29kMv1oo9A";;;#NASA #STEM #WPISTEMFair;"624310353439010816";https://twitter.com/SusanWBrooks/status/624310353439010816
;2015-07-23 15:06;1;3;"Research has shown that girls might not be choosing to pursue #STEM fields due to the absence of… https:// instagram.com/p/5dFeQkscIt/";;;#STEM;"624309665975812096";https://twitter.com/SusanWBrooks/status/624309665975812096
;2015-07-20 08:42;7;10;"Congrats to @PikeHighSchool 's Lynna Irby on winning a gold medal at the u-17 World Youth Championships this weekend! http:// indy.st/1Ly59r1";;@PikeHighSchool;;"623125903690829824";https://twitter.com/SusanWBrooks/status/623125903690829824
;2015-07-17 15:04;9;8;"Sat down w/ Sara, a #GirlScout Gold Award recipient, to tell my story for @girlscouts #PortraitsInLeadership project. pic.twitter.com/YWObvHTdHZ";;@girlscouts;#GirlScout #PortraitsInLeadership;"622134795708067840";https://twitter.com/SusanWBrooks/status/622134795708067840
;2015-07-13 17:26;2;6;"Just learned our interns starred in a school play together! See this fun snapshot of them onstage and in the office https:// instagram.com/p/5F4IvkMcEQ/";;;;"620720890402242561";https://twitter.com/SusanWBrooks/status/620720890402242561
;2015-07-10 10:39;33;24;"Celebrating passage of #Cures2015 with @HouseCommerce colleagues. Big win for patients across the nation! pic.twitter.com/9RkRUSA4po";;@HouseCommerce;#Cures2015;"619531409628209152";https://twitter.com/SusanWBrooks/status/619531409628209152
;2015-07-10 08:16;10;9;"Supporting #Cures2015 in honor of a dear friend who passed away on Sunday and those we hope to save in the future. http:// tiny.cc/22of0x";;;#Cures2015;"619495377637634048";https://twitter.com/SusanWBrooks/status/619495377637634048
;2015-07-09 16:47;7;12;"Headed to the house floor to speak in support of #Cures2015 early this evening. Watch live on http:// c-span.org .";;;#Cures2015;"619261666258231296";https://twitter.com/SusanWBrooks/status/619261666258231296
;2015-07-09 14:28;2;6;"Today @Rep_JaniceHahn and I introduced a bill to award the WWII Merchant Marine with the Congressional Gold Medal: http:// tinyurl.com/o9ayoys";;@Rep_JaniceHahn;;"619226673586786305";https://twitter.com/SusanWBrooks/status/619226673586786305
;2015-07-09 09:38;4;3;"Here's 6 things to know about #Cures2015 . So excited about this transformative effort to improve and save lives. http:// tiny.cc/mw9d0x";;;#Cures2015;"619153710019702785";https://twitter.com/SusanWBrooks/status/619153710019702785
;2015-07-08 17:51;9;16;"I had a great time meeting with these bright students from Carmel High School involved with @NationalFCCLA ! #2015NLC pic.twitter.com/znShmnLeZg";;@NationalFCCLA;#2015NLC;"618915280660639744";https://twitter.com/SusanWBrooks/status/618915280660639744
;2015-07-07 17:47;5;10;"Good luck to Sawyer Morgan from Fishers competing on @Jeopardy tonight at 7:30pm. #IN05 will be cheering on Sawyer! #jeopardy #GoSawyer";;@Jeopardy;#IN05 #jeopardy #GoSawyer;"618551935344492544";https://twitter.com/SusanWBrooks/status/618551935344492544
;2015-07-06 13:14;1;5;"I am so grateful to Officer Renn and to all police who work tirelessly to protect and serve their fellow Americans. https:// twitter.com/FOX59/status/6 18104647127969792 …";;;;"618120961011924992";https://twitter.com/SusanWBrooks/status/618120961011924992
;2015-07-05 19:58;3;11;"Congrats to the #USWNT on an amazing World Cup win! Indy's @laurenholiday12 scored an awesome goal! #TeamUSA";;@laurenholiday12;#USWNT #TeamUSA;"617860214595919872";https://twitter.com/SusanWBrooks/status/617860214595919872
;2015-07-04 10:24;7;7;"Happy #4thofJuly to all of #IN05 and everyone across our wonderful nation. #IndependenceDay pic.twitter.com/TdfBEISkeO";;;#4thofJuly #IN05 #IndependenceDay;"617353217224085504";https://twitter.com/SusanWBrooks/status/617353217224085504
;2015-07-01 12:29;1;2;"Congratulations to the U.S. Women's National Team and #Hoosier @laurenholiday12 on advancing to the FIFA Women’s World Cup Final! #FIFAWWC";;@laurenholiday12;#Hoosier #FIFAWWC;"616297542322679809";https://twitter.com/SusanWBrooks/status/616297542322679809
;2015-06-25 13:09;5;6;"Thanks @TechPointInd @InnovateIndiana for leading the #ed2employ conversation - my District Director is in attendance http://www. e2eindiana.com /";;@TechPointInd @InnovateIndiana;#ed2employ;"614133274458345473";https://twitter.com/SusanWBrooks/status/614133274458345473
;2015-06-24 18:08;2;6;"Go Women of Congress! Beat the press at tonight's @CWSoftballGame ! pic.twitter.com/caB3Cc9udP";;@CWSoftballGame;;"613846190996758528";https://twitter.com/SusanWBrooks/status/613846190996758528
;2015-06-24 17:24;2;10;"Great to meet with Abigail, Jennifer and James from Fishers today! We share a passion for #education opportunities! pic.twitter.com/SOjAuZJ4xs";;;#education;"613835096966234112";https://twitter.com/SusanWBrooks/status/613835096966234112
;2015-06-23 13:51;4;4;"Thanks to the panelists and all the #Millennials attending today's hearing! Great to see a full house #GOPFuture pic.twitter.com/yBkqnPZY8X";;;#Millennials #GOPFuture;"613419234681561088";https://twitter.com/SusanWBrooks/status/613419234681561088
;2015-06-23 13:01;1;2;"" #Indy is a city that allows citizens to innovate on different platforms" @KSoltisAnderson on #Millennials ability to innovate. #GOPFuture";;@KSoltisAnderson;#Indy #Millennials #GOPFuture;"613406473788497920";https://twitter.com/SusanWBrooks/status/613406473788497920
;2015-06-23 12:34;4;6;"Millennials, we want to hear from you - we need your solutions, ideas, energy and intellect. #GOPFuture pic.twitter.com/zRCobmnbUE";;;#GOPFuture;"613399621008818177";https://twitter.com/SusanWBrooks/status/613399621008818177
;2015-06-23 12:09;1;3;"Join the #GOP and #millennials conversation at #GOPFuture and watch the hearing live at https://www. youtube.com/watch?v=lvY1_h bSbYY … pic.twitter.com/E54cnFrJvu";;;#GOP #millennials #GOPFuture;"613393511111634944";https://twitter.com/SusanWBrooks/status/613393511111634944
;2015-06-23 10:25;5;4;"Can't wait for today's " #Millennials and the #GOP " hearing. Thnx to @RepLukeMesser and @RepStefanik for leading! #GOPFuture";;@RepLukeMesser @RepStefanik;#Millennials #GOP #GOPFuture;"613367159255867392";https://twitter.com/SusanWBrooks/status/613367159255867392
;2015-06-22 10:07;5;2;"Great tour of Ascension Health Ministry Service today. Beautiful work spaces and a lot of hard working people. pic.twitter.com/yrKRrvmqoH";;;;"613000339348959232";https://twitter.com/SusanWBrooks/status/613000339348959232
;2015-06-19 09:26;3;3;"During #NationalWeekofMaking2015 I applaud all the entrepreneurs and #makers bringing new #ideas to life in Indiana! pic.twitter.com/3fVQ620DJg";;;#NationalWeekofMaking2015 #makers #ideas;"611902803406102528";https://twitter.com/SusanWBrooks/status/611902803406102528
;2015-06-18 11:40;2;7;"I am pleased the #House voted to repeal the Medical Device Tax - this is a victory for thousands of #Hoosier workers! http:// tinyurl.com/qd2pazw";;;#House #Hoosier;"611574159437602816";https://twitter.com/SusanWBrooks/status/611574159437602816
;2015-06-17 17:31;6;7;"Introduced legislation today aiming to stem the growing tide of prescription painkiller and heroin abuse. http:// tiny.cc/imyizx";;;;"611300202213974016";https://twitter.com/SusanWBrooks/status/611300202213974016
;2015-06-17 12:58;1;5;"These Hoosier students have a passion for history! Enjoyed meeting with them as part of #NationalHistoryDay #NHD2015 pic.twitter.com/SDXtupNxOu";;;#NationalHistoryDay #NHD2015;"611231360347426816";https://twitter.com/SusanWBrooks/status/611231360347426816
;2015-06-16 14:20;1;8;"Congrats to Carmel High School for ranking top 10 out of 5,000 competing teams in the SIFMA Annual Stock Market Game. pic.twitter.com/fa8cpOXN2T";;;;"610889741114994688";https://twitter.com/SusanWBrooks/status/610889741114994688
;2015-06-10 13:36;2;8;"So glad we were able to give @girlscouts Troop 1880 from Zionsville a tour today! #IN05 pic.twitter.com/7OMkOuhzGW";;@girlscouts;#IN05;"608704242786926592";https://twitter.com/SusanWBrooks/status/608704242786926592
;2015-06-06 09:44;13;12;"@GoodwillIndy thanks for showing me your facilities yesterday! I appreciate the good work you do in Indy communities. pic.twitter.com/LkwS2qR89R";;@GoodwillIndy;;"607196356260851712";https://twitter.com/SusanWBrooks/status/607196356260851712
;2015-06-05 13:36;5;6;"Great to serve with the @Deloitte team today as part of the company's national day of service #ImpactThatMatters pic.twitter.com/TGnCePidIE";;@Deloitte;#ImpactThatMatters;"606892388834017280";https://twitter.com/SusanWBrooks/status/606892388834017280
;2015-06-05 13:31;3;14;"Enjoyed serving with the @Deloitte Indy team today #ImpactThatMatters pic.twitter.com/iL91Czt5Co";;@Deloitte;#ImpactThatMatters;"606891184443805698";https://twitter.com/SusanWBrooks/status/606891184443805698
;2015-06-02 17:50;6;7;"Adding Harriet Tubman to one of our banknotes will inspire kids to dream big and build upon her impressive legacy http:// tiny.cc/va4yyx";;;;"605869211538169856";https://twitter.com/SusanWBrooks/status/605869211538169856
;2015-06-02 17:43;5;8;"Proud to support legislation placing Harriet Tubman on a U.S. Currency Note. http:// tiny.cc/va4yyx";;;;"605867245311377408";https://twitter.com/SusanWBrooks/status/605867245311377408
;2015-05-26 14:19;3;4;"Congrats to 10 new Anderson Fire Department firefighters and 1 new Anderson Police officer who were sworn in today pic.twitter.com/WiRHkQ1asc";;;;"603279199844102144";https://twitter.com/SusanWBrooks/status/603279199844102144
;2015-05-22 09:39;3;4;"Thank you to the friendly @RickerStores team for showing me the ropes today! #NACSInStore pic.twitter.com/XoAWjRdzq8";;@RickerStores;#NACSInStore;"601759395878477824";https://twitter.com/SusanWBrooks/status/601759395878477824
;2015-05-22 09:11;1;5;"Ringing up a customer this morning @RickerStores as part of #NACSInStore @NACSonline pic.twitter.com/OWCpV12IXC";;@RickerStores @NACSonline;#NACSInStore;"601752244099383296";https://twitter.com/SusanWBrooks/status/601752244099383296
;2015-05-22 08:36;1;5;"Enjoyed my visit to @RickerStores this morning. Thanks for the coffee and breakfast burrito! pic.twitter.com/admY8YZAf1";;@RickerStores;;"601743324685434880";https://twitter.com/SusanWBrooks/status/601743324685434880
;2015-05-20 14:28;1;2;"Honored to meet fellow Hoosier, Sergeant Anna Lloyd, US Marine Corps at the Women in Military Wreath Laying Ceremony. pic.twitter.com/UXMFbrYq8L";;;;"601107267950354433";https://twitter.com/SusanWBrooks/status/601107267950354433
;2015-05-20 11:20;10;12;"Today I visited @ArlingtonNatl to lay a wreath as a symbol of our collective gratitude to women who serve our nation. pic.twitter.com/QXnaz69trG";;@ArlingtonNatl;;"601060053496537090";https://twitter.com/SusanWBrooks/status/601060053496537090
;2015-05-20 09:02;4;3;"Honored to be at today's ceremony in remembrance of women in the military who made the ultimate sacrifice. #heroes pic.twitter.com/aSRa6njeHO";;;#heroes;"601025221471141888";https://twitter.com/SusanWBrooks/status/601025221471141888
;2015-05-19 17:18;5;21;"What an achievement to earn the Girl Scouts Gold Award! So pleased to celebrate this young woman and the @girlscouts pic.twitter.com/ABNNU58BrI";;@girlscouts;;"600787762858561536";https://twitter.com/SusanWBrooks/status/600787762858561536
;2015-05-18 14:10;8;23;"Excited to be with @google and @Disney today celebrating opportunities for girls to succeed in computer science! pic.twitter.com/Gv9lMwu47M";;@google @Disney;;"600378061155135488";https://twitter.com/SusanWBrooks/status/600378061155135488
;2015-05-14 17:12;1;6;"I spoke on the House Floor today in honor of #NationalPoliceWeek and our fallen heroes http:// tiny.cc/ymp4xx";;;#NationalPoliceWeek;"598974114049748993";https://twitter.com/SusanWBrooks/status/598974114049748993
;2015-05-14 14:32;5;10;"So honored to visit with @IMPD_News and @TiptonCoSheriff Officers during #NationalPoliceWeek pic.twitter.com/nVgSVkpT9F";;@IMPD_News @TiptonCoSheriff;#NationalPoliceWeek;"598933967652450304";https://twitter.com/SusanWBrooks/status/598933967652450304
;2015-05-13 09:12;5;4;"Really enjoyed yesterday's #Hack4Congress event working to make gov more tech savvy, transparent and accountable. http:// tiny.cc/3bn2xx";;;#Hack4Congress;"598491129957502977";https://twitter.com/SusanWBrooks/status/598491129957502977
;2015-05-12 11:32;6;5;"#Hack4Congress winners shared their "hacks" connecting #politics and #tech . Fantastic to hear #innovative ideas! pic.twitter.com/wA1KqxdcP3";;;#Hack4Congress #politics #tech #innovative;"598163905911881728";https://twitter.com/SusanWBrooks/status/598163905911881728
;2015-05-11 11:18;3;5;"Thank you to all of the wonderful students and teachers I met on my visit to Tipton High School today. pic.twitter.com/FPBZOS7TaA";;;;"597797884097081344";https://twitter.com/SusanWBrooks/status/597797884097081344
;2015-05-09 09:03;1;4;"Everyone is excited for the @IvyTechCC graduation ceremony today. Congrats to all students! pic.twitter.com/CwswjWXFfR";;@IvyTechCC;;"597039205324353537";https://twitter.com/SusanWBrooks/status/597039205324353537
;2015-05-08 10:52;1;0;"Discussing #HiTechHoosiers on this weekend's @IIB episode. Always great chatting with @GerryDick ! TV listings here: http:// tiny.cc/oojvxx .";;@IIB @GerryDick;#HiTechHoosiers;"596704221933756416";https://twitter.com/SusanWBrooks/status/596704221933756416
;2015-05-08 09:49;0;3;"Enjoying my visit at Eastern Jr./Sr. High School this morning. Great to see all the technology used in the classroom pic.twitter.com/WbfmSt1K0M";;;;"596688376570499072";https://twitter.com/SusanWBrooks/status/596688376570499072
;2015-05-07 08:44;1;2;"Honored to attend the @Lowes Customer Support Center Grand Opening in Indy this morning. pic.twitter.com/NdmaUtp21W";;@Lowes;;"596309658933075968";https://twitter.com/SusanWBrooks/status/596309658933075968
;2015-05-06 12:16;3;1;"Panel 2 of Connecting Careers & Classrooms focusing on school and business collaborations #HiTechHoosiers pic.twitter.com/SZAejrEyf5";;;#HiTechHoosiers;"596000584588795904";https://twitter.com/SusanWBrooks/status/596000584588795904
;2015-05-06 12:09;3;3;"Thank you @soards and @ATTIndiana for participating. Let's make sure our students are #FutureReady ! #HiTechHoosiers";;@soards @ATTIndiana;#FutureReady #HiTechHoosiers;"595998906691022848";https://twitter.com/SusanWBrooks/status/595998906691022848
;2015-05-06 12:07;3;2;"Educators at our Connecting Careers and Classrooms #Startup Showcase talking to Stratostar. #HiTechHoosiers pic.twitter.com/H6dieJGzbS";;;#Startup #HiTechHoosiers;"595998388832890881";https://twitter.com/SusanWBrooks/status/595998388832890881
;2015-05-06 10:02;6;5;"Thanks to @PikeHighSchool for highlighting their Youth Career Connect program at Connecting Careers & Classrooms pic.twitter.com/R2QVEMyRBH";;@PikeHighSchool;;"595966909528563712";https://twitter.com/SusanWBrooks/status/595966909528563712
;2015-05-06 09:13;4;0;"Panel 1 of today's Connecting Careers & Classrooms focusing on tech sector workforce needs #HiTechHoosiers pic.twitter.com/61y0bCffTQ";;;#HiTechHoosiers;"595954506313129985";https://twitter.com/SusanWBrooks/status/595954506313129985
;2015-05-06 08:36;5;1;"John Wechsler of @LaunchFishers welcoming CC&C participants. Ready for a great day! #HiTechHoosiers #FutureReady pic.twitter.com/1l2lUZTfTn";;@LaunchFishers;#HiTechHoosiers #FutureReady;"595945333647081472";https://twitter.com/SusanWBrooks/status/595945333647081472
;2015-05-06 08:31;3;1;"Full house at today's Connecting Careers and Classrooms event focusing on tech industry. #HiTechHoosiers #IN05 pic.twitter.com/YbwD7ef85O";;;#HiTechHoosiers #IN05;"595943988881928193";https://twitter.com/SusanWBrooks/status/595943988881928193
;2015-05-05 18:38;2;5;"Thankful to the students, parents and teachers who came out to our inaugural art competition reception in Noblesville pic.twitter.com/LRzdEWBZWz";;;;"595734330963566592";https://twitter.com/SusanWBrooks/status/595734330963566592
;2015-05-01 10:49;2;4;"Congrats to @MUGSCoffeeTea on the opening of their new location at 1909 University in Anderson! pic.twitter.com/gCZyRvG9fk";;@MUGSCoffeeTea;;"594166878509146112";https://twitter.com/SusanWBrooks/status/594166878509146112
;2015-05-01 10:42;4;0;"My next “Connect" event is Fri., May 8 in Howard County from 11:30-1:00 at the Greentown Historical Society. Details: http:// 1.usa.gov/1x7wNBw";;;;"594164879449292801";https://twitter.com/SusanWBrooks/status/594164879449292801
;2015-04-29 09:56;0;1;"Japan's Prime Minister @AbeShinzo addresses Congress today at 11 AM. Watch live: http:// speaker.gov/live . pic.twitter.com/Rh8xE5hFeM";;@AbeShinzo;;"593428600424136704";https://twitter.com/SusanWBrooks/status/593428600424136704
;2015-04-28 16:32;2;1;"Helping people live better. #Curesin4Words";;;#Curesin4Words;"593165994723561472";https://twitter.com/SusanWBrooks/status/593165994723561472
;2015-04-28 16:31;4;4;"More Innovation. New Discoveries. #Curesin4Words";;;#Curesin4Words;"593165789320077312";https://twitter.com/SusanWBrooks/status/593165789320077312
;2015-04-24 07:59;2;8;"Special thanks to all of the first responders who were quick to act in last night's stage collapse at Westfield HS. #WestfieldStrong";;;#WestfieldStrong;"591587342131015680";https://twitter.com/SusanWBrooks/status/591587342131015680
;2015-04-23 22:21;9;9;"Prayers go out to students, faculty and parents at Westfield High School tonight.";;;;"591441904266514432";https://twitter.com/SusanWBrooks/status/591441904266514432
;2015-04-23 16:23;3;6;"Enjoyed hosting Kaylyn and Makala from @GirlsIncIndy on Take Our Daughters to Work Day! pic.twitter.com/OnZN9ryD2y";;@GirlsIncIndy;;"591351802995548160";https://twitter.com/SusanWBrooks/status/591351802995548160
;2015-04-23 15:49;0;0;"@RepMullin always great to see you during @HouseCommerce hearings, especially with a good cup of coffee in hand!";;@RepMullin @HouseCommerce;;"591343045444038656";https://twitter.com/SusanWBrooks/status/591343045444038656
;2015-04-23 09:44;0;0;"A member of my staff will be in Marion today until 4 to meet with constituents and address their concerns. Details: http:// susanwbrooks.house.gov/services/satel lite-office-hours …";;;;"591251400086134785";https://twitter.com/SusanWBrooks/status/591251400086134785
;2015-04-23 09:30;0;1;"The deadline to submit pieces for the Congressional Art Competition is tomorrow! Details: http:// susanwbrooks.house.gov/services/art-c ompetition …";;;;"591247733496934400";https://twitter.com/SusanWBrooks/status/591247733496934400
;2015-04-17 11:05;3;1;"Reminder that Art Competition entries are due in 1 week to either my Carmel or Anderson District Office. More details http:// 1.usa.gov/1M5T6ON";;;;"589097258957803520";https://twitter.com/SusanWBrooks/status/589097258957803520
;2015-04-15 16:25;2;2;"I encourage IN05 students in grades 8-12 to participate in my Youth Advisory Group. Next meeting: Sat. 4/18. Details: http:// 1.usa.gov/1aNmYV4";;;;"588453117169012736";https://twitter.com/SusanWBrooks/status/588453117169012736
;2015-04-15 14:18;6;14;"On the 150th anniversary of President #AbrahamLincoln 's death, we remember a great man who forever changed our nation pic.twitter.com/idGp5kIXTs";;;#AbrahamLincoln;"588421125367062528";https://twitter.com/SusanWBrooks/status/588421125367062528
;2015-04-14 16:53;2;1;"I encourage IN05 students in grades 8-12 to participate in my Youth Advisory Group. Next meeting: Sat. 4/18. Details: http:// 1.usa.gov/1aNmYV4";;;;"588097724282761216";https://twitter.com/SusanWBrooks/status/588097724282761216
;2015-04-10 10:22;0;3;"Excited to receive the NAM Award for Manufacturing Legislative Excellence @shopfloorNAM pic.twitter.com/mTyjeSB4eB";;@shopfloorNAM;;"586549777577422848";https://twitter.com/SusanWBrooks/status/586549777577422848
;2015-04-10 08:52;1;4;"Visiting with the Pike @robodevil1018 at Pike HS pic.twitter.com/myYzOxUMdk";;@robodevil1018;;"586527219029307392";https://twitter.com/SusanWBrooks/status/586527219029307392
;2015-04-09 12:52;1;3;"Enjoyed breaking ground on the new @Cummins Distribution HQ in #Indy . #GoodNews pic.twitter.com/RIP86nSttL";;@Cummins;#Indy #GoodNews;"586225268320247808";https://twitter.com/SusanWBrooks/status/586225268320247808
;2015-04-09 11:10;1;2;"Enjoyed meeting the members of Indy SHRM today and sharing updates from Washington DC. #IN05 pic.twitter.com/7oYkggxwbj";;;#IN05;"586199463070404608";https://twitter.com/SusanWBrooks/status/586199463070404608
;2015-04-09 08:37;2;3;"I encourage IN05 students in grades 8-12 to participate in my Youth Advisory Group. Next meeting: Sat. 4/18. Details: http:// 1.usa.gov/1aNmYV4";;;;"586160993945919488";https://twitter.com/SusanWBrooks/status/586160993945919488
;2015-04-08 10:32;5;2;"A young entrepreneur sharing her business pitch with me at today's @Indynawbo Luncheon. pic.twitter.com/VibyrAOLKK";;@Indynawbo;;"585827481590095872";https://twitter.com/SusanWBrooks/status/585827481590095872
;2015-04-07 16:51;2;4;"Thrilled to be speaking at the grand opening of the new Tom Wood Honda in Anderson. pic.twitter.com/ekn4FUgKbn";;;;"585560457144053760";https://twitter.com/SusanWBrooks/status/585560457144053760
;2015-04-07 10:17;1;3;"Thanks to management and staff at Kleenco in Alexandria for being such wonderful hosts today! Great visit! pic.twitter.com/BHg4vqKhPh";;;;"585461385825542144";https://twitter.com/SusanWBrooks/status/585461385825542144
;2015-04-06 20:15;4;9;"#Indy is ready to host the #ChampionshipGame ! Should be a great evening of basketball! pic.twitter.com/BwieY2rc3K";;;#Indy #ChampionshipGame;"585249569887379456";https://twitter.com/SusanWBrooks/status/585249569887379456
;2015-04-04 14:47;6;4;"Enjoyed meeting @BillWalton today. Pretty sure he could still hang with the guys in today's #FinalFour games! pic.twitter.com/v7UqctBHsI";;@BillWalton;#FinalFour;"584442275561865217";https://twitter.com/SusanWBrooks/status/584442275561865217
;2015-04-04 14:26;2;3;"Honored to speak at today's Kennedy King Memorial Initiative April 4th Commemoration. pic.twitter.com/UkKNoTHFeq";;;;"584436868760133632";https://twitter.com/SusanWBrooks/status/584436868760133632
;2015-04-04 08:48;0;2;"Talking medical innovation with folks at McKesson in downtown Indy this morning. We're discussing #FinalFour too! pic.twitter.com/AuxoPOPva6";;;#FinalFour;"584351727454916608";https://twitter.com/SusanWBrooks/status/584351727454916608
;2015-04-02 18:31;13;18;"So proud to be at Indy FOP tonight honoring the life and legacy of @IMPD_News Officer Perry Renn. pic.twitter.com/h5e7qAGWYj";;@IMPD_News;;"583773820445655040";https://twitter.com/SusanWBrooks/status/583773820445655040
;2015-04-02 13:40;3;2;"Thanks to Hamilton County Trustees Association for hosting me this afternoon. pic.twitter.com/txnRInAUSq";;;;"583700458117660672";https://twitter.com/SusanWBrooks/status/583700458117660672
;2015-04-02 10:37;1;0;"Enjoyed visiting the Merciful H.E.L.P Center food pantry today. Thanks to staff and volunteers for their great work! pic.twitter.com/2eKnZR7FvB";;;;"583654570540273664";https://twitter.com/SusanWBrooks/status/583654570540273664
;2015-04-01 16:27;4;8;"“Our laws need to catch up with technology.” Read my chat with @fedscoop for its D.C’s Top 50 Women in Tech list. http:// tiny.cc/873ewx";;@fedscoop;;"583380247833419776";https://twitter.com/SusanWBrooks/status/583380247833419776
;2015-04-01 11:02;11;15;"So honored to be named among D.C.'s Top 50 Women in Tech. Learn more about leading #womenintechnology here: http:// tiny.cc/873ewx";;;#womenintechnology;"583298334351331328";https://twitter.com/SusanWBrooks/status/583298334351331328
;2015-03-31 13:53;2;1;"Join me for another "Connect" event in Marion this evening. Details: http:// 1.usa.gov/1x7wNBw";;;;"582978947392106498";https://twitter.com/SusanWBrooks/status/582978947392106498
;2015-03-31 13:45;0;3;"Happy to be speaking with residents at Suite Living in Grant County this afternoon. pic.twitter.com/JK5ht9Dkvo";;;;"582977020071698432";https://twitter.com/SusanWBrooks/status/582977020071698432
;2015-03-30 12:01;3;3;"Happy to be at the Indiana District Precision Metalforming Association's Executive Roundtable in Indianapolis this AM pic.twitter.com/8s14lVv17I";;;;"582588571598610433";https://twitter.com/SusanWBrooks/status/582588571598610433
;2015-03-29 11:16;17;20;"Congratulations to @ParkTudorBB and @Guerinhoops for their wins in the Indiana state basketball finals yesterday! #IN05";;@ParkTudorBB @Guerinhoops;#IN05;"582214663380844545";https://twitter.com/SusanWBrooks/status/582214663380844545
;2015-03-25 09:48;2;2;"Address to Congress from #Afghanistan Pres @AshrafGhani begins at 11 AM ET. Watch on http:// Speaker.gov/live";;@AshrafGhani;#Afghanistan;"580743122143080448";https://twitter.com/SusanWBrooks/status/580743122143080448
;2015-03-24 15:16;1;2;"Enjoyed today’s @HouseCommerce #SubCMT hearing. #IoT improves our lives and strengthens our economy.";;@HouseCommerce;#SubCMT #IoT;"580463342273314816";https://twitter.com/SusanWBrooks/status/580463342273314816
