username;date;retweets;favorites;text;geo;mentions;hashtags;id;permalink
;2017-02-23 16:41;1;0;"The building was placed on the US National Register of Historic Places in 1991, & was sold last year. http://www. indystar.com/story/news/201 6/04/08/indys-oldest-african-american-church-sold-hotel-space/82765744/ …";;;;"834895893098868739";https://twitter.com/SusanWBrooks/status/834895893098868739
;2017-02-23 16:36;1;3;"In 1867, the Bethel "mother church" was built, & played an important role in Indy after the Civil War. @IndyNAACP was founded there.";;@IndyNAACP;;"834894672900329472";https://twitter.com/SusanWBrooks/status/834894672900329472
;2017-02-23 16:33;2;2;"News of the church's support for the abolition of slavery was not well received...& in 1862 the original church building was burnt down.";;;;"834894088839233536";https://twitter.com/SusanWBrooks/status/834894088839233536
;2017-02-23 16:32;1;1;"A small congregation met in Quinn's log cabin until the church was built in 1841. #BlackHistoryMonth";;;#BlackHistoryMonth;"834893839487942656";https://twitter.com/SusanWBrooks/status/834893839487942656
;2017-02-23 16:32;1;1;"The AME Church, then known as the Indianapolis Station, was founded by William Paul Quinn & Augustus Turner in 1836 http:// bit.ly/2m8wwjU";;;;"834893750795137025";https://twitter.com/SusanWBrooks/status/834893750795137025
;2017-02-23 16:31;2;2;"The 1st African Methodist Episcopal(AME) Church in @VisitIndy was active in the Underground Railroad. #BlackHistoryMonth pic.twitter.com/Fk8d2XfnLY";;@VisitIndy;#BlackHistoryMonth;"834893597484937216";https://twitter.com/SusanWBrooks/status/834893597484937216
;2017-02-22 15:18;0;3;"Want to learn more about Japanese companies in #IN05 ? Check out this map from @Indiana_EDC to learn more: http://www. iedc.in.gov/materials/down loads/Download/e73e249c-34ce-6748-857a-ff0000c19905/ … pic.twitter.com/UWmFyO3TKp";;@Indiana_EDC;#IN05;"834512812391149568";https://twitter.com/SusanWBrooks/status/834512812391149568
;2017-02-22 13:59;1;5;"She lives in @VisitIndy w/ her family. Read more about her career from @IBJnews - http:// bit.ly/2kNbuKG";;@VisitIndy @IBJnews;;"834492765253820420";https://twitter.com/SusanWBrooks/status/834492765253820420
;2017-02-22 13:57;0;5;"Previously, she was a producer for @whiotv as well as an English teacher for @DaytonSchools in Ohio.";;@whiotv @DaytonSchools;;"834492407093817344";https://twitter.com/SusanWBrooks/status/834492407093817344
;2017-02-22 13:57;2;7;". @terricopewalton , a @CentralState87 alum w/ a B.A. in English Lit., has had many jobs @rtv6 , including AM producer & community affairs lead";;@terricopewalton @CentralState87 @rtv6;;"834492209391099905";https://twitter.com/SusanWBrooks/status/834492209391099905
;2017-02-22 13:54;12;36;"Today's #BlackHistoryMonth spotlight is on Terri Cope-Walton, @theindychannel News Director & Indy's 1st black TV news director. pic.twitter.com/VjsEgdyMpn";;@theindychannel;#BlackHistoryMonth;"834491519763619841";https://twitter.com/SusanWBrooks/status/834491519763619841
;2017-02-21 17:29;1;0;"Today, the @EdnaMartinCtr continues to serve our community w/ social services, child care, vocation training & job placement, to name a few.";;@EdnaMartinCtr;;"834183309538291712";https://twitter.com/SusanWBrooks/status/834183309538291712
;2017-02-21 17:28;1;1;"In 1946, @EdnaMartinCtr became a home mission of the @AmericanBaptist & was named for Martin in 1974 after her death.";;@EdnaMartinCtr @AmericanBaptist;;"834183008718553088";https://twitter.com/SusanWBrooks/status/834183008718553088
;2017-02-21 17:25;0;0;"After high school, she married Early Martin & started a daycare program with 2 children in an apartment she rented with her household money.";;;;"834182242582855680";https://twitter.com/SusanWBrooks/status/834182242582855680
;2017-02-21 17:25;0;0;"Martin was a community #activist & was inspired by the worsening conditions of her Martindale-Brightwood neighborhood to help local kids.";;;#activist;"834182171602612229";https://twitter.com/SusanWBrooks/status/834182171602612229
;2017-02-21 17:24;0;0;"Edna Mae Barnes was born into a southern migrant, working-class African American family in @VisitIndy in the early 1900's.";;@VisitIndy;;"834182018682478595";https://twitter.com/SusanWBrooks/status/834182018682478595
;2017-02-21 17:24;1;3;"Today for #BlackHistoryMonth , we're recognizing the founder of @EdnaMartinCtr , Edna Barnes Martin. pic.twitter.com/SX3BIMDQEY";;@EdnaMartinCtr;#BlackHistoryMonth;"834181932388847616";https://twitter.com/SusanWBrooks/status/834181932388847616
;2017-02-21 16:32;4;12;"Lunch w/ @DowChemical @DowAgro @dowcorning Japan team & Dow Japan President Peter Jennings. @DowAgro employs 1,500 Hoosiers in #IN05 . pic.twitter.com/qlvUVsKAfz";;@DowChemical @DowAgro @dowcorning @DowAgro;#IN05;"834168927173349376";https://twitter.com/SusanWBrooks/status/834168927173349376
;2017-02-21 16:21;1;5;"Honored to meet Japanese PM @AbeShinzo to talk about critical importance of US-Japan trade to Hoosiers and to our country. https:// twitter.com/CongStudyGroup s/status/833664113221869568 …";;@AbeShinzo;;"834166120785596425";https://twitter.com/SusanWBrooks/status/834166120785596425
;2017-02-21 16:17;0;1;"More about how #HR1121 protects coverage for people w/ pre-existing conditions from @heraldbulletin @KendelaBastide http:// bit.ly/2kHQrsK";;@heraldbulletin @KendelaBastide;#HR1121;"834165172126236672";https://twitter.com/SusanWBrooks/status/834165172126236672
;2017-02-21 08:07;0;5;"Learned more from the Ministry of Economy, Trade & Industry about Japanese companies & industry that support Hoosier jobs & economic growth. https:// twitter.com/CongStudyGroup s/status/833706861152972800 …";;;;"834041790562967553";https://twitter.com/SusanWBrooks/status/834041790562967553
;2017-02-21 07:48;0;1;"It's one reason that I am committed to continuing to work together w/ state & local partners to address this national crisis.";;;;"834037165977960448";https://twitter.com/SusanWBrooks/status/834037165977960448
;2017-02-21 07:47;4;3;"35,000 Hoosier kids were the victims of abuse & neglect in 2016 & the drug epidemic is a big contributing factor: http://www. pal-item.com/story/news/loc al/2017/02/18/official-drugs-fuel-skyrocketing-neglect-cases/97993874/ …";;;;"834036916827852801";https://twitter.com/SusanWBrooks/status/834036916827852801
;2017-02-20 20:11;0;0;"The @walkertheatre on #Indiana Ave in @VisitIndy was the headquarters & manufacturing plant of Madam CJ Walker Hair Care & Beauty Products.";;@walkertheatre @VisitIndy;#Indiana;"833861705742577664";https://twitter.com/SusanWBrooks/status/833861705742577664
;2017-02-20 20:08;0;1;"She became one of the wealthiest African American women in the country, & one of the most successful African-American business owners ever.";;;;"833861005163761664";https://twitter.com/SusanWBrooks/status/833861005163761664
;2017-02-20 20:07;0;0;"She went on to move to @VisitIndy where she founded the Madame C.J. Walker Manufacturing Company, selling beauty and hair products.";;@VisitIndy;;"833860743825072132";https://twitter.com/SusanWBrooks/status/833860743825072132
;2017-02-20 20:07;0;0;"She was born to enslaved parents in Louisiana, the first child in her family of 6 to be born after the Emancipation Proclamation.";;;;"833860643912634368";https://twitter.com/SusanWBrooks/status/833860643912634368
;2017-02-20 20:06;0;2;"Walker was born in 1867. She was an African American entrepreneur, philanthropist, and a political and social activist.";;;;"833860345836007425";https://twitter.com/SusanWBrooks/status/833860345836007425
;2017-02-20 20:05;10;22;"Today we celebrate the 1st female self-made millionaire, Madam C. J. Walker, born Sarah Breedlove. #BlackHistoryMonth pic.twitter.com/idbI9KZvNl";;;#BlackHistoryMonth;"833860148007464966";https://twitter.com/SusanWBrooks/status/833860148007464966
;2017-02-19 20:42;0;1;"Brown was inducted into the Indianapolis Broadcasters Hall Of Fame in 2007. #BlackHistoryMonth";;;#BlackHistoryMonth;"833507078715088896";https://twitter.com/SusanWBrooks/status/833507078715088896
;2017-02-19 20:40;0;3;"Through his 4-decade-long career, he worked at the @IndyRecorder , @1067WTLC , Radio One & @PraiseIndy";;@IndyRecorder @1067WTLC @PraiseIndy;;"833506481559465984";https://twitter.com/SusanWBrooks/status/833506481559465984
;2017-02-19 20:39;0;2;"Brown was known for giving the voiceless a voice, a dedicated public servant working for #socialjustice & #equality in @VisitIndy";;@VisitIndy;#socialjustice #equality;"833506328068894720";https://twitter.com/SusanWBrooks/status/833506328068894720
;2017-02-19 20:38;1;8;"Today we remember my friend, @PraiseIndy radio host Amos Brown #BlackHistoryMonth pic.twitter.com/0RlmGslvLO";;@PraiseIndy;#BlackHistoryMonth;"833506169897549825";https://twitter.com/SusanWBrooks/status/833506169897549825
;2017-02-18 12:39;0;1;"In 1955, President Eisenhower named him an Alternate Delegate to the @UN . He continued to fight for #civilrights until his death.";;@UN;#civilrights;"833023126174851072";https://twitter.com/SusanWBrooks/status/833023126174851072
;2017-02-18 12:37;0;2;"He did so by establishing an impartial voter registration board & improving opportunities for African Americans serving in the @INGuardsman .";;@INGuardsman;;"833022731943804931";https://twitter.com/SusanWBrooks/status/833022731943804931
;2017-02-18 12:37;0;1;"1 of the laws he authored focused on fair employment practices, improving voter registration & election participation among minorities.";;;;"833022544240328704";https://twitter.com/SusanWBrooks/status/833022544240328704
;2017-02-18 12:36;1;2;"In 1940, Brokenburr made history by becoming the 1st African American elected to the Indiana State Senate. #BlackHistoryMonth";;;#BlackHistoryMonth;"833022387255808004";https://twitter.com/SusanWBrooks/status/833022387255808004
;2017-02-18 12:35;2;2;"Brokenburr earned his law degree from @HowardU in 1909 & represented his friend, Madam C.J. Walker, in court.";;@HowardU;;"833022220842704897";https://twitter.com/SusanWBrooks/status/833022220842704897
;2017-02-18 12:34;2;5;"#BlackHistoryMonth continues & today we remember Robert Lee Brokenburr, a #civilrights leader & son of a former slave. pic.twitter.com/pZxxp1NPfd";;;#BlackHistoryMonth #civilrights;"833022004995510272";https://twitter.com/SusanWBrooks/status/833022004995510272
;2017-02-17 16:16;0;0;"Episode 5 of #WhatImHearing is focused on protecting coverage for people w/ pre-existing conditions. Watch here: https:// youtu.be/gIL0on2gUJQ";;;#WhatImHearing;"832715410352922625";https://twitter.com/SusanWBrooks/status/832715410352922625
;2017-02-17 15:02;0;3;"Judge Jimison pioneered IN's #DrugTreatment Court & encouraged addicts to pursue second chances to improve their lives. #BlackHistoryMonth";;;#DrugTreatment #BlackHistoryMonth;"832696655501619201";https://twitter.com/SusanWBrooks/status/832696655501619201
;2017-02-17 15:01;0;5;"As a graduate of @IndianaUniv & @OhioState Law School, she began her career as a trial attorney: https://www. in.gov/icw/files/2015 -03-20_Z_Mae_Jimison.pdf …";;@IndianaUniv @OhioState;;"832696429185421312";https://twitter.com/SusanWBrooks/status/832696429185421312
;2017-02-17 15:00;1;12;"Today we honor Z. Mae Jimison, the 1st African American woman judge to serve on the Marion County Superior Court from 1996 to 2002. pic.twitter.com/RiUuYSUTEZ";;;;"832696298457358338";https://twitter.com/SusanWBrooks/status/832696298457358338
;2017-02-17 09:08;0;0;"Im joining a bipartisan group of my colleagues on the trip to discuss security, workforce dev. & trade - https://www. facebook.com/CongresswomanS usanWBrooks/posts/1360864393960463:0 …";;;;"832607742623899649";https://twitter.com/SusanWBrooks/status/832607742623899649
;2017-02-17 09:08;0;4;"This week, I met w/ members of the Japanese Diet to prepare for my trip to visit Indiana's largest Asian trading partner - Japan! pic.twitter.com/V7KXqRspn3";;;;"832607558229704704";https://twitter.com/SusanWBrooks/status/832607558229704704
;2017-02-16 17:53;29;56;"Proud original co-sponsor of #HR1211 , which protects coverage for people w/ pre-existing conditions. Read more here: http:// bit.ly/2lTsA6e pic.twitter.com/RU9Pp4G3KS";;;#HR1211;"832377467067367425";https://twitter.com/SusanWBrooks/status/832377467067367425
;2017-02-16 16:41;3;9;"Today, I introduced a bill to help veterans get the most of the education benefits they've earned. Read more here: http:// bit.ly/2lp0Jx1 pic.twitter.com/Zx3P1SSNW6";;;;"832359151011508224";https://twitter.com/SusanWBrooks/status/832359151011508224
;2017-02-16 15:20;0;5;"Pleased that @SpeakerRyan & @IsraeliPM had a productive meeting & that we continue to strengthen the alliance between the U.S. & Israel. https:// twitter.com/SpeakerRyan/st atus/832235079401287680 …";;@SpeakerRyan @IsraeliPM;;"832338866669551617";https://twitter.com/SusanWBrooks/status/832338866669551617
;2017-02-16 12:24;0;1;"She and her husband John lived in @NewAlbanyIN until her death in 1915.";;@NewAlbanyIN;;"832294637654122500";https://twitter.com/SusanWBrooks/status/832294637654122500
;2017-02-16 12:22;0;1;"Lucy was an honorary member of the G.A.R., the Grand Army of the Republic #BlackHistoryMonth http://www. in.gov/history/marker s/4121.htm …";;;#BlackHistoryMonth;"832294154902335488";https://twitter.com/SusanWBrooks/status/832294154902335488
;2017-02-16 12:22;1;0;"In 1895, Lucy & 55 veterans of the 23rd petitioned Congress and in 1898, a Special Act of Congress awarded her pension.";;;;"832293996764463105";https://twitter.com/SusanWBrooks/status/832293996764463105
;2017-02-16 12:21;1;2;"She gained her freedom in 1862 by escaping to the 23rd Regiment, Indiana Volunteers camped nearby her home in TN.";;;;"832293891265200130";https://twitter.com/SusanWBrooks/status/832293891265200130
;2017-02-16 12:20;2;7;"Lucy Higgs Nichols was born a slave, but escaped & became a nurse for the Union Army during the Civil War. #BlackHistoryMonth pic.twitter.com/4n31irDS9I";;;#BlackHistoryMonth;"832293704622800896";https://twitter.com/SusanWBrooks/status/832293704622800896
;2017-02-15 16:03;2;1;"Dr. Obeime is the current medical director of the @MyFranciscan Neighborhood Health Center @GarfieldPkNbors in @VisitIndy";;@MyFranciscan @GarfieldPkNbors @VisitIndy;;"831987346023260164";https://twitter.com/SusanWBrooks/status/831987346023260164
;2017-02-15 16:01;1;2;"The Mercy Foundation is a #nonprofit #healthcare org that Obeime started to help combat HIV-AIDS in Nigeria.";;;#nonprofit #healthcare;"831986796854702081";https://twitter.com/SusanWBrooks/status/831986796854702081
;2017-02-15 15:59;2;6;"Dr. Mercy Obeime, MD, is a native of #Nigeria & is the Director of the Mercy Foundation: http:// mercyfoundationinc.org/html/dr_mercy_ obeime.html … #BlackHistoryMonth pic.twitter.com/itxOWQqN0a";;;#Nigeria #BlackHistoryMonth;"831986225166897152";https://twitter.com/SusanWBrooks/status/831986225166897152
;2017-02-15 13:02;1;4;"Enjoyed a belated #ValentinesDay breakfast with @RepStefanik @RosLehtinen @RepMimiWalters @RepComstock & @SamsPressShop this morning! pic.twitter.com/PgAj8T9U7H";;@RepStefanik @RosLehtinen @RepMimiWalters @RepComstock @SamsPressShop;#ValentinesDay;"831941731792912388";https://twitter.com/SusanWBrooks/status/831941731792912388
;2017-02-15 12:01;10;30;"Spoke to a group of engineering students & professionals about the need for more women in engineering. #girlday2017 pic.twitter.com/RitU6C3K8K";;;#girlday2017;"831926465944047617";https://twitter.com/SusanWBrooks/status/831926465944047617
;2017-02-15 10:07;0;4;"Great conversation about the future of #Medicaid in #IN05 this morning w/ a Hoosier actuary visiting DC pic.twitter.com/7qdDHPzNPq";;;#Medicaid #IN05;"831897642984681472";https://twitter.com/SusanWBrooks/status/831897642984681472
;2017-02-14 16:38;0;2;"She is 93 & lives in @VisitIndy https://www. poets.org/poetsorg/poet/ mari-evans …";;@VisitIndy;;"831633767815118848";https://twitter.com/SusanWBrooks/status/831633767815118848
;2017-02-14 16:37;1;1;"Her noted works include: Night Star, Where is the Music, A Dark & Splendid Mass, Harlem River Press, I am a Black Woman. #BlackHistoryMonth";;;#BlackHistoryMonth;"831633525560459265";https://twitter.com/SusanWBrooks/status/831633525560459265
;2017-02-14 16:37;0;0;"Evans wrote, directed & produced "The Black Experience" for @WTTVNews pic.twitter.com/qhbKuUoexm";;@WTTVNews;;"831633378202046466";https://twitter.com/SusanWBrooks/status/831633378202046466
;2017-02-14 16:35;0;0;"Mari Evans, an African American poet, served as a writer in residence at @IUPUI & @IndianaUniv #BlackHistoryMonth";;@IUPUI @IndianaUniv;#BlackHistoryMonth;"831632946536783872";https://twitter.com/SusanWBrooks/status/831632946536783872
;2017-02-14 13:18;0;0;". @TOS_Mitchell & her team are in D.C. today-learned more about their important work, esp. efforts to help Hoosiers save for college. pic.twitter.com/kVbKJiqeZA";;@TOS_Mitchell;;"831583437546991616";https://twitter.com/SusanWBrooks/status/831583437546991616
;2017-02-14 12:03;0;0;"Got to visit w/ this group from @VisitIndy before their @uscapitol tour today. Thanks for stopping by the office! pic.twitter.com/QgQWlMsjdh";;@VisitIndy @uscapitol;;"831564579150954496";https://twitter.com/SusanWBrooks/status/831564579150954496
;2017-02-13 14:47;0;1;"Officer Baker was assigned to juvenile court in the probation dept. from 1922-1938. She retired from @IMPDNews in 1939";;@IMPDNews;;"831243299872763906";https://twitter.com/SusanWBrooks/status/831243299872763906
;2017-02-13 14:46;0;2;"By 1921, Officer Baker’s unit grew to include 23 officers – the largest unit of policewomen in the world at the time. #BlackHistoryMonth";;;#BlackHistoryMonth;"831243049560899584";https://twitter.com/SusanWBrooks/status/831243049560899584
;2017-02-13 14:45;0;3;"Emma Christy Baker was recruited during WWI & became @VisitIndy ‘s 1st woman & 1st African American woman to serve @IMPDNews pic.twitter.com/26Yz52hfRY";;@VisitIndy @IMPDNews;;"831242794849021952";https://twitter.com/SusanWBrooks/status/831242794849021952
;2017-02-13 13:37;8;5;"Headed to D.C. for #SpringBreak ? Submit your request today for @uscapitol , #SCOTUS , @librarycongress , etc. http:// bit.ly/1jIrjdj pic.twitter.com/LKLJnjdus8";;@uscapitol @librarycongress;#SpringBreak #SCOTUS;"831225752771260416";https://twitter.com/SusanWBrooks/status/831225752771260416
;2017-02-12 17:37;4;12;"Congrats to Indy for being selected by @ATT as 1 of 2 "5G Evolution Markets" cities! Read more in the @indystar >> http:// indy.st/2kDEtx5";;@ATT @indystar;;"830923927773929472";https://twitter.com/SusanWBrooks/status/830923927773929472
;2017-02-12 13:04;0;2;"... he campaigned against segregationist policies in racing until his death in 1979 #BlackHistoryMonth http:// bit.ly/2kvi449";;;#BlackHistoryMonth;"830854989811625985";https://twitter.com/SusanWBrooks/status/830854989811625985
;2017-02-12 13:03;0;0;"After a career-ending crash, he continued to mentor young drivers &....";;;;"830854738107174913";https://twitter.com/SusanWBrooks/status/830854738107174913
;2017-02-12 13:02;0;1;"As a mechanic, he was credited w/ helping the 1934 Champion Bill Cummings’s racing team win the #Indy500 .";;;#Indy500;"830854489506738176";https://twitter.com/SusanWBrooks/status/830854489506738176
;2017-02-12 13:01;0;0;"Born in @EvansvilleINGov , he moved to @VisitIndy in 1922 & bought an auto repair shop on the Southside.";;@EvansvilleINGov @VisitIndy;;"830854237022203905";https://twitter.com/SusanWBrooks/status/830854237022203905
;2017-02-12 13:00;1;6;"#BlackHistoryMonth – Charlie Wiggins was a race car driver and mechanic who won the Gold & Glory Sweepstakes 4 times between 1926-1935 pic.twitter.com/a8vSyFSm4t";;;#BlackHistoryMonth;"830853991307345921";https://twitter.com/SusanWBrooks/status/830853991307345921
;2017-02-11 14:35;3;19;"Who invented the gasoline pump? Sylvanus Freelove Bowser from Fort Wayne, IN- my home town- did in 1885! #NationalInventorsDay";;;#NationalInventorsDay;"830515502615138304";https://twitter.com/SusanWBrooks/status/830515502615138304
;2017-02-11 14:30;2;18;"In 1874 William Blackstone of IN built a bday present for his wife to help her clean clothes-the 1st washing machine! #NationalInventorsDay";;;#NationalInventorsDay;"830514246375071749";https://twitter.com/SusanWBrooks/status/830514246375071749
;2017-02-11 13:08;0;0;"Hardin also founded the Indianapolis Sickle Cell Center &was active in the #civilrights movement: http:// bit.ly/2lsm5Gr #BlackHistoryMonth";;;#civilrights #BlackHistoryMonth;"830493611091456000";https://twitter.com/SusanWBrooks/status/830493611091456000
;2017-02-11 13:07;1;1;"And encouraged their students to change their lives through #education";;;#education;"830493356987817984";https://twitter.com/SusanWBrooks/status/830493356987817984
;2017-02-11 13:06;1;2;"Father Hardin & Sister Jane Schilling founded @MartinU1977 to serve low-income, minority, & adult learners";;@MartinU1977;;"830493104947892225";https://twitter.com/SusanWBrooks/status/830493104947892225
;2017-02-11 13:05;5;3;"#BlackHistoryMonth Father Boniface Hardin, founder & former president of @MartinU1977 . http:// bit.ly/2kM5Jtg pic.twitter.com/AvrHIFhGQl";;@MartinU1977;#BlackHistoryMonth;"830492855475044353";https://twitter.com/SusanWBrooks/status/830492855475044353
;2017-02-11 12:00;1;2;"Thanks to @IndWes students working w/ Marion Housing Authority to bring exercise classes to @cityofMarion1 seniors: http:// bit.ly/2llGUr6";;@IndWes @cityofMarion1;;"830476501258641408";https://twitter.com/SusanWBrooks/status/830476501258641408
;2017-02-11 10:16;1;9;"Great to see local & state government working together to address substance abuse in Blackford County & our state. http:// bit.ly/2jlnx12";;;;"830450328201986048";https://twitter.com/SusanWBrooks/status/830450328201986048
;2017-02-11 09:15;0;5;"This week, I met w/ @DrugFreeAction Marion County & discussed the impact of substance abuse on young Hoosiers & how to address it pic.twitter.com/wxI5ZNTgP8";;@DrugFreeAction;;"830434973345669120";https://twitter.com/SusanWBrooks/status/830434973345669120
;2017-02-10 15:35;1;7;"I am pleased to see the Senate confirmed @RepTomPrice to lead @HHSGov . He will be an essential asset for rebuilding our #healthcare system";;@RepTomPrice @HHSGov;#healthcare;"830168392233533441";https://twitter.com/SusanWBrooks/status/830168392233533441
;2017-02-10 15:30;1;4;"And the answer to today's #trivia question on #ethics is... pic.twitter.com/2Vlx4L6rMT";;;#trivia #ethics;"830166963607334912";https://twitter.com/SusanWBrooks/status/830166963607334912
;2017-02-10 13:52;5;13;"She retired in 2015 as the 1st woman to lead a @Cummins main biz unit, & spent her career advocating for women, people of color & veterans.";;@Cummins;;"830142515378536448";https://twitter.com/SusanWBrooks/status/830142515378536448
;2017-02-10 13:52;1;6;"...the 1st woman to be elected to the office of Attorney General in the nation & served from 1993-1997.";;;;"830142383434104833";https://twitter.com/SusanWBrooks/status/830142383434104833
;2017-02-10 13:52;2;14;"She became the 1st African American to serve as @VisitIndiana Attorney General, but was also...";;@VisitIndiana;;"830142324009205760";https://twitter.com/SusanWBrooks/status/830142324009205760
;2017-02-10 13:51;7;26;"#BlackHistoryMonth Pamela Carter was 14 when she marched w/ Dr. Martin Luther King pic.twitter.com/cMGbnLI85T";;;#BlackHistoryMonth;"830142216983179268";https://twitter.com/SusanWBrooks/status/830142216983179268
;2017-02-10 09:43;1;2;"Check back at the end of the day for the answer";;;;"830079864300531713";https://twitter.com/SusanWBrooks/status/830079864300531713
;2017-02-10 09:43;2;2;"What's your guess for today's #trivia on the House #Ethics Committee? pic.twitter.com/zP7ALANMyI";;;#trivia #Ethics;"830079655025704960";https://twitter.com/SusanWBrooks/status/830079655025704960
;2017-02-09 08:52;3;3;"Happy Birthday @ToddRokita ! Hope it's a great one!";;@ToddRokita;;"829704486960640005";https://twitter.com/SusanWBrooks/status/829704486960640005
;2017-02-08 16:21;1;1;"My team attended @hartfordcityIN State of the City address today - thanks Mayor Hodgin! #HartfordCityProud pic.twitter.com/UgbLT7CFLi";;@hartfordcityIN;#HartfordCityProud;"829455232266559493";https://twitter.com/SusanWBrooks/status/829455232266559493
;2017-02-08 15:16;1;2;"One his paintings, titled Little Brown Girl, is a part of the @imamuseum collection. #BlackHistoryMonth http:// collection.imamuseum.org/artwork/56169/ pic.twitter.com/CwHrUNAXPK";;@imamuseum;#BlackHistoryMonth;"829438858114785286";https://twitter.com/SusanWBrooks/status/829438858114785286
;2017-02-08 15:15;1;3;"He enrolled in the Herron School of Art in 1910, & to finance his education, worked at the Indianapolis Stove Foundry & sold newspapers.";;;;"829438449249837064";https://twitter.com/SusanWBrooks/status/829438449249837064
;2017-02-08 15:14;3;6;"John Wesley Hardrick earned state-wide & national recognition for his #paintings of landscapes, still lifes, & portraits #BlackHistoryMonth pic.twitter.com/jpXz1Rn2PK";;;#paintings #BlackHistoryMonth;"829438249991028737";https://twitter.com/SusanWBrooks/status/829438249991028737
;2017-02-08 10:54;1;2;"The @boyscouts began 107 yrs ago. 22 members attended the 1st event. Now there are millions of Scouts. Happy #NationalBoyScoutsDay ! #tbt pic.twitter.com/SMIa4admcc";;@boyscouts;#NationalBoyScoutsDay #tbt;"829372913602199553";https://twitter.com/SusanWBrooks/status/829372913602199553
;2017-02-08 08:33;1;9;"Speaking w/ National Narcotic's Officers Association's Coalition this AM about efforts to address the heroin & opioid crisis & keep us safe. pic.twitter.com/RaCDYaJLld";;;;"829337414846013441";https://twitter.com/SusanWBrooks/status/829337414846013441
