username;date;retweets;favorites;text;geo;mentions;hashtags;id;permalink
;2016-06-29 12:31;0;2;"Watch @DanSpehler #INFocus this weekend for more on our #BenghaziReport . pic.twitter.com/uUy8eODfDt";;@DanSpehler;#INFocus #BenghaziReport;"748207226142203904";https://twitter.com/SusanWBrooks/status/748207226142203904
;2016-06-29 09:16;5;7;"Frustrated by yesterday's vote in the Senate to deny funding to prevent & treat #Zika . We need a solution. @HouseGOP passed bill last week.";;@HouseGOP;#Zika;"748158250097467392";https://twitter.com/SusanWBrooks/status/748158250097467392
;2016-06-28 19:18;8;7;"I'm horrified by the attacks in Istanbul, & my heart is w/ the victims & their families. I stand w/ the people of #Turkey against terrorism.";;;#Turkey;"747947382709567488";https://twitter.com/SusanWBrooks/status/747947382709567488
;2016-06-28 16:36;18;46;"Watch live at 6 pm w/ @BretBaier . Chairman @TGowdySC and I to talk @HouseBenghazi #BenghaziReport new facts.";;@BretBaier @TGowdySC @HouseBenghazi;#BenghaziReport;"747906648354729984";https://twitter.com/SusanWBrooks/status/747906648354729984
;2016-06-28 13:09;30;26;"Our foreign policy failed in Libya - read more from me @indystar http://www. indystar.com/story/opinion/ 2016/06/28/susan-brooks-us-foreign-policy-failed-benghazi/86475048/ …";;@indystar;;"747854413507723264";https://twitter.com/SusanWBrooks/status/747854413507723264
;2016-06-28 12:16;35;33;"Have questions about some of the new information in our report? Please watch our video. #BenghaziReport https:// twitter.com/HouseBenghazi/ status/747834108764524549 …";;;#BenghaziReport;"747841002417889280";https://twitter.com/SusanWBrooks/status/747841002417889280
;2016-06-28 09:00;2;6;"Getting ready to go live w/ #benghzireport & @HouseBenghazi to talk about our new findings. pic.twitter.com/EopmtiYybx";;@HouseBenghazi;#benghzireport;"747791826686455809";https://twitter.com/SusanWBrooks/status/747791826686455809
;2016-06-28 07:30;50;38;"Our work has confirmed & uncovered deficiencies at every government agency involved. #BenghaziReport https:// twitter.com/HouseBenghazi/ status/747768387519021060 …";;;#BenghaziReport;"747769214577033218";https://twitter.com/SusanWBrooks/status/747769214577033218
;2016-06-25 14:21;7;36;"So blessed to have introduced the @DalaiLama today in @VisitIndy ! Inspirational message of compassionate action. pic.twitter.com/IBPPPq4msq";;@DalaiLama @VisitIndy;;"746785291093041152";https://twitter.com/SusanWBrooks/status/746785291093041152
;2016-06-25 10:17;0;14;"Got to ring the opening bell @CarmelFarmMrkt this morning. If you missed it today, it's open every Sat. until 11:30! pic.twitter.com/fQGCqBtkCZ";;@CarmelFarmMrkt;;"746724102774329346";https://twitter.com/SusanWBrooks/status/746724102774329346
;2016-06-24 18:33;2;8;"Great to be @TCMIndy for the opening of #BeyondSpaceshipEarth ! Challenge your horizons! pic.twitter.com/oXrPmHajzF";;@TCMIndy;#BeyondSpaceshipEarth;"746486487546462208";https://twitter.com/SusanWBrooks/status/746486487546462208
;2016-06-24 10:31;1;3;"Our tax system should work for us, not against us. That's why we've created #ABetterWay -simple, fair & pro-growth: http:// better.gop";;;#ABetterWay;"746365017520488448";https://twitter.com/SusanWBrooks/status/746365017520488448
;2016-06-23 14:43;2;16;"Joined @GOPLeader McCarthy & the @HouseGOP iTeam to talk to @sherylsandberg about innovation & tech of the future. pic.twitter.com/OQGFZ4hKkt";;@GOPLeader @HouseGOP @sherylsandberg;;"746066203173621760";https://twitter.com/SusanWBrooks/status/746066203173621760
;2016-06-23 13:31;0;1;"Staff are at Marion City Hall until 4 p.m. today for office hours. We're here to help. http:// susanwbrooks.house.gov/services/satel lite-office-hours …";;;;"746048034220478464";https://twitter.com/SusanWBrooks/status/746048034220478464
;2016-06-23 11:34;1;1;"This morning, the House passed vital funding to protect us from #Zika & promote vaccine research. http:// 1.usa.gov/28ZRsnZ";;;#Zika;"746018561697660928";https://twitter.com/SusanWBrooks/status/746018561697660928
;2016-06-22 11:06;4;12;"HR2646 passed @HouseCommerce & helps people & families struggling w/ mental illness. Proud to support these reforms. pic.twitter.com/io5q4Bm6z9";;@HouseCommerce;;"745649185081417728";https://twitter.com/SusanWBrooks/status/745649185081417728
;2016-06-22 10:53;0;4;"Thanks for visiting with my office! https:// twitter.com/NPAF_tweets/st atus/745624911348006912 …";;;;"745645792963198976";https://twitter.com/SusanWBrooks/status/745645792963198976
;2016-06-22 10:52;0;1;"Glad you were able to visit w/ Helen in our office. Thanks for your advocacy! https:// twitter.com/ArmstrongHelto n/status/745631884676333568 …";;;;"745645669252218881";https://twitter.com/SusanWBrooks/status/745645669252218881
;2016-06-22 06:35;6;3;"Live w/ @WHBU and talking #ABetterWay . Check out our plan for the future at http:// better.gop !";;@WHBU;#ABetterWay;"745581060407205889";https://twitter.com/SusanWBrooks/status/745581060407205889
;2016-06-21 16:00;1;0;"I'll be on @WHBU tomorrow w/ Doug Zook to talk about how I'm working to improve public health. Tune in at 7:32 a.m.";;@WHBU;;"745360648230572032";https://twitter.com/SusanWBrooks/status/745360648230572032
;2016-06-21 15:43;1;6;"#NationalSelfieDay w/ Cynthia Yue - 2016 Presidential Scholar from Carmel HS! @chsinfo @myccs @CITYOFCARMELIN pic.twitter.com/NKkMY6STWl";;@chsinfo @myccs @CITYOFCARMELIN;#NationalSelfieDay;"745356549418328064";https://twitter.com/SusanWBrooks/status/745356549418328064
;2016-06-21 15:17;39;97;"Tomorrow, @HouseGOP will release our plan to replace Obamacare, putting patients first. #BetterWay";;@HouseGOP;#BetterWay;"745350030836572160";https://twitter.com/SusanWBrooks/status/745350030836572160
;2016-06-21 14:46;2;10;"It's #NationalSelfieDay & @PanCAN is on the Hill to #WageHope . Thanks for your advocacy! pic.twitter.com/1252aCV8PY";;@PanCAN;#NationalSelfieDay #WageHope;"745342158304083968";https://twitter.com/SusanWBrooks/status/745342158304083968
;2016-06-21 09:21;1;4;"1st human trials approved for #Zika vaccine - good progress towards finding an effective countermeasure. https://www. statnews.com/2016/06/20/zik a-vaccine-inovio/ …";;;#Zika;"745260469141798912";https://twitter.com/SusanWBrooks/status/745260469141798912
;2016-06-20 15:09;2;1;"Until 11pm, severe t-storm watch for #IN05 : Blackford, Boone, Grant, Hamilton, Howard, Madison, Marion & Tipton Counties. Stay safe tonight!";;;#IN05;"744985549383970816";https://twitter.com/SusanWBrooks/status/744985549383970816
;2016-06-20 15:01;0;3;"Happy 1st Day of Summer! Are you headed to DC on vacation? Contact me for tours: https:// susanwbrooks.house.gov/services/tours -and-tickets … pic.twitter.com/BVUZ4yOBGM";;;;"744983629105860608";https://twitter.com/SusanWBrooks/status/744983629105860608
;2016-06-20 11:45;1;0;"Last week, I introduced a bill renaming @VAIndianapolis Veterans House in honor of Gov 'Doc' Bowen's legacy of care. http:// bit.ly/28JlTC5";;@VAIndianapolis;;"744934121160458241";https://twitter.com/SusanWBrooks/status/744934121160458241
;2016-06-17 17:46;0;3;"Thanks for a great tour @INCulturalTrail @Pacersbikeshare ! Awesome new way to explore our great city! pic.twitter.com/lXW0WQc7xd";;@INCulturalTrail @Pacersbikeshare;;"743937936928956417";https://twitter.com/SusanWBrooks/status/743937936928956417
;2016-06-17 16:38;2;4;"Headed into Fountain Square-lots of new restaurants & shops along the way! @INCulturalTrail pic.twitter.com/BQGywtifOk";;@INCulturalTrail;;"743920711186653184";https://twitter.com/SusanWBrooks/status/743920711186653184
;2016-06-17 16:25;0;3;"Love the transit stops along @INCulturalTrail that feature poetry by Hoosier poets! pic.twitter.com/1wnmCRSaHr";;@INCulturalTrail;;"743917529966456833";https://twitter.com/SusanWBrooks/status/743917529966456833
;2016-06-17 16:18;0;2;"Another sparking piece of art along the way! @INCulturalTrail @Pacersbikeshare pic.twitter.com/n8IZTCKlTX";;@INCulturalTrail @Pacersbikeshare;;"743915719692267520";https://twitter.com/SusanWBrooks/status/743915719692267520
;2016-06-17 16:15;2;8;"Corner of Indiana Ave. & St. Clair - beautiful stained glass sculpture, especially w/ today's sunshine! pic.twitter.com/hmB8xPElrx";;;;"743914895570251776";https://twitter.com/SusanWBrooks/status/743914895570251776
;2016-06-17 16:09;0;3;"Quick break at MLK Ave & St. Clair before we ride by the Madam CJ Walker Theatre. @INCulturalTrail pic.twitter.com/pfQHAWtzWJ";;@INCulturalTrail;;"743913483587158016";https://twitter.com/SusanWBrooks/status/743913483587158016
;2016-06-17 15:42;0;3;"Can you guess where we are? @INCulturalTrail is 8 miles of walking, running & biking in @IndyDT ! pic.twitter.com/JW7OSRWjkx";;@INCulturalTrail @IndyDT;;"743906623459037184";https://twitter.com/SusanWBrooks/status/743906623459037184
;2016-06-17 15:37;1;6;"Thanks @Pacersbikeshare for the wheels to ride the @INCulturalTrail ! Perfect day for a bike ride. pic.twitter.com/3qDicYhLMF";;@Pacersbikeshare @INCulturalTrail;;"743905379772424192";https://twitter.com/SusanWBrooks/status/743905379772424192
;2016-06-17 15:29;0;2;"And we're off! What's your favorite part of the @INCulturalTrail ? pic.twitter.com/GFZg2BYFX8";;@INCulturalTrail;;"743903442268192768";https://twitter.com/SusanWBrooks/status/743903442268192768
;2016-06-17 15:27;1;2;"Getting ready to check out the @INCulturalTrail w/ staff via bike! pic.twitter.com/vU6f8ageD5";;@INCulturalTrail;;"743903028470816768";https://twitter.com/SusanWBrooks/status/743903028470816768
;2016-06-17 11:54;1;9;"Congrats to Justin Phillips, founder of @overdoselifelin & @JeffersonAwards winner! Powerful advocate for Hoosiers. pic.twitter.com/t3udFhIrFt";;@overdoselifelin @JeffersonAwards;;"743849260253384704";https://twitter.com/SusanWBrooks/status/743849260253384704
;2016-06-15 18:37;1;4;"Be safe out there! Flash flood warning in effect until 9:15 pm for Central Indiana.";;;;"743225882572099584";https://twitter.com/SusanWBrooks/status/743225882572099584
;2016-06-15 13:31;3;4;"Unanimous, bipartisan support for this important set of reforms. https:// twitter.com/HouseCommerce/ status/743148865541505024 …";;;;"743149045686935553";https://twitter.com/SusanWBrooks/status/743149045686935553
;2016-06-15 11:24;2;8;"Proud to have worked on this legislation w/ @RepTimMurphy @RepLarryBucshon @HouseCommerce . https:// twitter.com/namiindiana/st atus/743115073724375040 …";;@RepTimMurphy @RepLarryBucshon @HouseCommerce;;"743116999077859328";https://twitter.com/SusanWBrooks/status/743116999077859328
;2016-06-15 10:54;17;16;"Yesterday, @HouseGOP released A #BetterWay to Grow Our Economy - add jobs, spur innovation & cut red tape. pic.twitter.com/ttMgA4oGru";;@HouseGOP;#BetterWay;"743109323904176128";https://twitter.com/SusanWBrooks/status/743109323904176128
;2016-06-14 17:28;4;4;"Had some help posting a #INYTDC16 Snapchat from @NRECANews @IndianaEC Youth leaders! Thanks guys! pic.twitter.com/PuxxnoqGpV";;@NRECANews @IndianaEC;#INYTDC16;"742846086864351232";https://twitter.com/SusanWBrooks/status/742846086864351232
;2016-06-14 17:20;0;5;"Happy Birthday to the @USArmy ! Forever grateful for all you do to protect our freedom. #ArmyBDay https:// twitter.com/USArmy/status/ 742693078482309121 …";;@USArmy;#ArmyBDay;"742844211993673728";https://twitter.com/SusanWBrooks/status/742844211993673728
;2016-06-14 17:10;1;4;"Great to meet you Leah! https:// twitter.com/elfskills/stat us/742838773239713794 …";;;;"742841724448444416";https://twitter.com/SusanWBrooks/status/742841724448444416
;2016-06-14 15:37;1;0;"We can do more to prevent domestic terror. Read more from @WISH_TV http:// wishtv.com/2016/06/14/rep -brooks-congress-can-do-more-to-battle-domestic-terror/ …";;@WISH_TV;;"742818140107739136";https://twitter.com/SusanWBrooks/status/742818140107739136
;2016-06-14 14:18;4;4;"Tomorrow, @HouseCommerce will be talking about how we can better treat mental illness. Read a preview here: http:// thehill.com/blogs/pundits- blog/healthcare/283254-delivering-action-on-mental-health …";;@HouseCommerce;;"742798465957306368";https://twitter.com/SusanWBrooks/status/742798465957306368
;2016-06-14 12:46;0;5;"Got to meet w/ Hoosier #gsGoldAward winner Kamna to talk about her global project to provide shoes to those in need. pic.twitter.com/5Rr9CEwQUR";;;#gsGoldAward;"742775312094793728";https://twitter.com/SusanWBrooks/status/742775312094793728
;2016-06-14 09:33;6;15;"Happy Flag Day! Long may it wave. Today honors the adoption of our flag by the 2nd Continental Congress in 1777. pic.twitter.com/PGZcovwA8Q";;;;"742726708500017152";https://twitter.com/SusanWBrooks/status/742726708500017152
;2016-06-14 09:20;1;4;"Congrats to @chsinfo Carmel High School for finishing in the top 10 of @SIFMA 's #StockMarketGame ! http:// blog.nj.com/north_american _precis_syndicate/2016/06/young_investors_win.html …";;@chsinfo @SIFMA;#StockMarketGame;"742723503674265600";https://twitter.com/SusanWBrooks/status/742723503674265600
;2016-06-14 09:01;0;0;"#SubHealth @HouseCommerce hearing on antibiotic resistant infections, #superbugs , is about to begin. Watch live: http:// 1.usa.gov/22YkR66";;@HouseCommerce;#SubHealth #superbugs;"742718505418690560";https://twitter.com/SusanWBrooks/status/742718505418690560
;2016-06-13 16:51;1;2;"Tomorrow is #WorldBloodDonorDay ! Find a local blood bank near you or head to Monument Circle to donate tomorrow! http://www. indianablood.org/locations/Page s/default.aspx …";;;#WorldBloodDonorDay;"742474516077645824";https://twitter.com/SusanWBrooks/status/742474516077645824
;2016-06-13 13:05;2;2;"Today @NoblesvilleIN celebrates its namesake, James Noble, w/ @mayorditslear @IndianaArchives & White River Militia. pic.twitter.com/ttPKyFBR2d";;@NoblesvilleIN @mayorditslear @IndianaArchives;;"742417635468562433";https://twitter.com/SusanWBrooks/status/742417635468562433
;2016-06-13 12:57;0;0;"Welcome to #IN05 @Determine ! Looking forward to your big move to @CITYOFCARMELIN . http:// bit.ly/1tsydM9";;@Determine @CITYOFCARMELIN;#IN05;"742415488014295040";https://twitter.com/SusanWBrooks/status/742415488014295040
;2016-06-12 09:25;6;17;"Praying for the victims, their families, the first responders & the Orlando community after last night's tragic act of terror & violence.";;;;"741999919502741504";https://twitter.com/SusanWBrooks/status/741999919502741504
;2016-06-09 14:14;0;1;"We're working on a #BetterWay to keep America Safe & Free. Read more: http:// abetterway.speaker.gov / pic.twitter.com/SaEnyn0cjO";;;#BetterWay;"740985375187959808";https://twitter.com/SusanWBrooks/status/740985375187959808
;2016-06-08 14:44;2;19;"Talking to students from @MiamiUniversity before they start their DC internships for the summer! pic.twitter.com/FAxaHHOOoo";;@MiamiUniversity;;"740630617356918785";https://twitter.com/SusanWBrooks/status/740630617356918785
;2016-06-08 10:30;4;16;"So pleased to have KP Singh of Indianapolis here for the Joint Session of Congress address by India's PM Modi. pic.twitter.com/2BGxswrC0p";;;;"740566648214724608";https://twitter.com/SusanWBrooks/status/740566648214724608
;2016-06-07 16:29;1;1;"I'll be on w/ @WHBU tomorrow at 7:32 a.m. to talk #BetterWay and @HouseCommerce action on #HR3299 . Tune in here: http:// rdo.to/WHBU";;@WHBU @HouseCommerce;#BetterWay #HR3299;"740294685579563009";https://twitter.com/SusanWBrooks/status/740294685579563009
;2016-06-07 16:07;1;0;"Watch the opening statements on #HR3299 in #SubHealth @HouseCommerce live here: https:// youtu.be/9YKTqxm7wJc";;@HouseCommerce;#HR3299 #SubHealth;"740289051371184128";https://twitter.com/SusanWBrooks/status/740289051371184128
;2016-06-07 14:12;0;1;"Getting ready for the beginning of @HouseCommerce #HealthSub markup of my bill #HR3299 . https:// energycommerce.house.gov/hearings-and-v otes/markups/health-subcommittee-vote-hr-3299-and-hr-921 …";;@HouseCommerce;#HealthSub #HR3299;"740260274079432704";https://twitter.com/SusanWBrooks/status/740260274079432704
;2016-06-07 11:43;14;33;"When a legal outcome doesn't suit you, personal attacks against the presiding judge are not the answer. (4/4)";;;;"740222747033370624";https://twitter.com/SusanWBrooks/status/740222747033370624
;2016-06-07 11:43;7;14;"As member of Congress and a former U.S. Attorney, I have tremendous respect for our courts and our judges. (3/4)";;;;"740222679953854464";https://twitter.com/SusanWBrooks/status/740222679953854464
;2016-06-07 11:43;10;18;"The Constitution provides for a separate but equal third branch of government, the judiciary. (2/4)";;;;"740222609372090368";https://twitter.com/SusanWBrooks/status/740222609372090368
;2016-06-07 11:43;14;40;"I continue to have deep concerns about Mr. Trump's rhetoric. His comments about Judge Curiel are completely inappropriate. (1/4)";;;;"740222546759553024";https://twitter.com/SusanWBrooks/status/740222546759553024
;2016-06-06 14:54;13;17;"A #BetterWay forward for a #ConfidentAmerica begins tomorrow. http:// abetterway.speaker.gov/?Source=GovD https:// twitter.com/SpeakerRyan/st atus/739861282606702592 …";;;#BetterWay #ConfidentAmerica;"739908464873504768";https://twitter.com/SusanWBrooks/status/739908464873504768
;2016-06-06 13:40;3;2;"ICYMI: Read my op-ed in today's @PowerPost about the actions we've taken to protect the U.S. from Zika virus. http:// wapo.st/1TWsPMy";;@PowerPost;;"739889660466466818";https://twitter.com/SusanWBrooks/status/739889660466466818
;2016-06-06 11:01;5;11;"Remembering the brave Americans who lost their lives on this day in 1944. Thank you for your service & sacrifice. pic.twitter.com/xRLMbKCIMK";;;;"739849738321825792";https://twitter.com/SusanWBrooks/status/739849738321825792
;2016-06-03 18:27;1;0;"The next Connect w/ Your Congresswoman event is 6/29 in @CityofWestfield ! Details here: http:// 1.usa.gov/1x7wNBw";;@CityofWestfield;;"738874746834694144";https://twitter.com/SusanWBrooks/status/738874746834694144
;2016-06-03 15:34;8;7;"Proud to join Rep. @LamarSmithTX21 in support of #STEM and computer science education for K-12 students. http:// 1.usa.gov/1TABfnt";;@LamarSmithTX21;#STEM;"738831150337101824";https://twitter.com/SusanWBrooks/status/738831150337101824
;2016-06-03 14:38;1;0;"Happy #NationalDonutDay ! Grab an afternoon treat at one of these #IN05 bakeries: http://www. indystar.com/story/entertai nment/dining/2015/06/04/get-free-doughnuts-nationaldoughnutday/28464205/ …";;;#NationalDonutDay #IN05;"738817146604670976";https://twitter.com/SusanWBrooks/status/738817146604670976
;2016-06-02 16:38;1;4;"Congrats to @IndyMonumental on the big announcement tonight! @CNOFinancial pic.twitter.com/wZ5yCQIadz";;@IndyMonumental @CNOFinancial;;"738485086128050176";https://twitter.com/SusanWBrooks/status/738485086128050176
;2016-06-02 10:49;0;0;"Staff are at Marion City Hall today to help w/ your questions until 4 p.m. Come visit us at satellite office hours! http:// susanwbrooks.house.gov/services/satel lite-office-hours …";;;;"738397112371666944";https://twitter.com/SusanWBrooks/status/738397112371666944
;2016-06-01 15:27;3;4;"June is Alzheimer's Awareness Month. Learn the early signs of Alzheimer's w/ @AlzIndiana : http:// alz.org/alzheimers_dis ease_10_signs_of_alzheimers.asp … pic.twitter.com/BG4HeAIbSs";;@AlzIndiana;;"738104800873750529";https://twitter.com/SusanWBrooks/status/738104800873750529
;2016-05-31 16:20;2;1;"Opioid prescriptions dropped for the first time ever - good progress to help reduce opioid abuse in Indiana. http:// indianapublicmedia.org/news/indiana-o pioid-prescriptions-drop-time-99421/ …";;;;"737755757261803520";https://twitter.com/SusanWBrooks/status/737755757261803520
;2016-05-31 15:22;1;1;"New developments in the fight against Zika virus, & important warnings from @WHO if you're planning summer travel: http://www. nbcnews.com/storyline/zika -virus-outbreak/who-issues-stricter-safe-sex-guidelines-prevent-zika-n583031 …";;@WHO;;"737741155090206720";https://twitter.com/SusanWBrooks/status/737741155090206720
;2016-05-30 18:37;3;7;"Praying for the family & friends of Hoosier Army veteran Craig Vanbrunt who died after honoring fallen Americans at #RollingThunder .";;;#RollingThunder;"737427865126510592";https://twitter.com/SusanWBrooks/status/737427865126510592
;2016-05-30 10:33;2;13;"My office attended today's moving ceremony to honor the fallen at Marion National Cemetery. #MemorialDay2016 pic.twitter.com/Icf4w31WoF";;;#MemorialDay2016;"737305940794310657";https://twitter.com/SusanWBrooks/status/737305940794310657
;2016-05-30 09:21;16;46;"To all who have served & sacrificed their lives for our country, today we honor & remember you. #MemorialDay2016 pic.twitter.com/OY32GgvA9E";;;#MemorialDay2016;"737287920885870592";https://twitter.com/SusanWBrooks/status/737287920885870592
;2016-05-29 13:21;1;9;"Beautiful day @IMS for the 100th #Indy500 ! pic.twitter.com/3vhOAYqksn";;@IMS;#Indy500;"736985735132286980";https://twitter.com/SusanWBrooks/status/736985735132286980
;2016-05-28 16:48;9;13;"Legends Day @IMS w/ @blakeshelton firing up the crowd! pic.twitter.com/LJwyv8qaHE";;@IMS @blakeshelton;;"736675646303309824";https://twitter.com/SusanWBrooks/status/736675646303309824
;2016-05-28 16:39;1;6;"Got to meet @Buddy500Lazier & see @PippaMann today @IMS . Looking forward to tomorrow's #Indy500 ! pic.twitter.com/2hlLsSSZFf";;@Buddy500Lazier @PippaMann @IMS;#Indy500;"736673300890411009";https://twitter.com/SusanWBrooks/status/736673300890411009
;2016-05-27 13:27;0;7;"Great to be in Indy for the #Indy500 Memorial Service today! #MemorialDay #IN05 pic.twitter.com/BocB6UhjC6";;;#Indy500 #MemorialDay #IN05;"736262625953222657";https://twitter.com/SusanWBrooks/status/736262625953222657
;2016-05-26 16:45;1;0;"Great to be @RiverviewHosp to celebrate the retirement of CEO and President Pat Fox! pic.twitter.com/RhqkzIO7sb";;@RiverviewHosp;;"735949987989848064";https://twitter.com/SusanWBrooks/status/735949987989848064
;2016-05-26 13:21;0;2;"Today we officially submitted our #IN05 Art Competition winner's work to be hung in the @uscapitol ! Congrats Melany! pic.twitter.com/HLyHnscTbS";;@uscapitol;#IN05;"735898628863197184";https://twitter.com/SusanWBrooks/status/735898628863197184
;2016-05-25 17:28;1;1;"My statement on the report released today by the State Dept. Inspector General: http:// 1.usa.gov/1TABfnt";;;;"735598416869371904";https://twitter.com/SusanWBrooks/status/735598416869371904
;2016-05-25 14:38;0;0;"Going to be a special weekend in @VisitIndy ! @IMS #Indy500 sold out 4 the 1st time: http:// bit.ly/1WjAO6L pic.twitter.com/3bv9SwW1zO";;@VisitIndy @IMS;#Indy500;"735555772055212032";https://twitter.com/SusanWBrooks/status/735555772055212032
;2016-05-25 08:50;1;1;"Moving tribute to women lost in service from @USArmy Master Sergeant Mariel Morgan. #MemorialDay pic.twitter.com/rTWeNcoJNq";;@USArmy;#MemorialDay;"735468017811902464";https://twitter.com/SusanWBrooks/status/735468017811902464
;2016-05-25 08:45;5;7;"Today's honorees from each branch of our military. Thank you for your service & leadership! #MemorialDay pic.twitter.com/X7qB6lgavS";;;#MemorialDay;"735466722472300544";https://twitter.com/SusanWBrooks/status/735466722472300544
;2016-05-25 08:39;3;5;"A beautiful ceremony to remember the servicewomen we have lost & to honor the women currently serving. #MemorialDay pic.twitter.com/zF1B3zy6Wt";;;#MemorialDay;"735465189903044608";https://twitter.com/SusanWBrooks/status/735465189903044608
;2016-05-25 08:16;2;9;"This morning we honor the more than 1,000 women who have lost their lives in service. @ArlingtonNatl #MemorialDay pic.twitter.com/LCG4stVXO9";;@ArlingtonNatl;#MemorialDay;"735459637416349700";https://twitter.com/SusanWBrooks/status/735459637416349700
;2016-05-24 09:52;0;2;"Good luck to Tristan & the 13 other Hoosier students competing as the @ScrippsBee #spellingbee begins! http://www. heraldbulletin.com/news/local_new s/local-spelling-wunderkind-takes-national-stage/article_e594bb1c-ee81-52ef-bded-5bd507b15815.html …";;@ScrippsBee;#spellingbee;"735121208002420736";https://twitter.com/SusanWBrooks/status/735121208002420736
;2016-05-23 17:16;2;15;"Honored to be recognized by @CARE for my work on the Global Food Security Act. They visited my Carmel office today! pic.twitter.com/FXJ6LoYGdP";;@CARE;;"734870624544403456";https://twitter.com/SusanWBrooks/status/734870624544403456
;2016-05-23 15:27;5;17;"Spotted @INDairport this morning-old @IMS IndyCar w/ a @Cummins engine. Ready for the greatest spectacle in racing! pic.twitter.com/IjVdXLlztn";;@INDairport @IMS @Cummins;;"734843100183560194";https://twitter.com/SusanWBrooks/status/734843100183560194
;2016-05-21 13:29;9;10;"This #ArmedForcesDay please join me in thanking our servicemen & women for their service to our country. pic.twitter.com/LnNLiSrtaf";;;#ArmedForcesDay;"734088646295310336";https://twitter.com/SusanWBrooks/status/734088646295310336
;2016-05-20 13:34;1;8;"Happy Birthday to Norman Burns, @ConnerPrairie President and CEO! pic.twitter.com/TEu3XE7ACP";;@ConnerPrairie;;"733727493484601344";https://twitter.com/SusanWBrooks/status/733727493484601344
;2016-05-20 13:32;2;6;"Loved getting to see spring at @ConnerPrairie - baby animals, blooming flowers and #IN05 history! pic.twitter.com/Po3Ti1HIRF";;@ConnerPrairie;#IN05;"733727211505737728";https://twitter.com/SusanWBrooks/status/733727211505737728
;2016-05-20 10:41;0;0;"Great to be with you this morning! https:// twitter.com/giantssports/s tatus/733680585483399168 …";;;;"733684121503997953";https://twitter.com/SusanWBrooks/status/733684121503997953
;2016-05-20 10:19;2;4;"Thanks to this group of #IN05 Vietnam veterans for their service! pic.twitter.com/Tai4G0ih9Q";;;#IN05;"733678474494398464";https://twitter.com/SusanWBrooks/status/733678474494398464
;2016-05-20 09:46;0;0;"Checking out the veteran's resource fair in Blackford County. It's open until 2 pm today @hartfordcityIN Elks Lodge. pic.twitter.com/A3bcCwWWN9";;@hartfordcityIN;;"733670262059749376";https://twitter.com/SusanWBrooks/status/733670262059749376
