username;date;retweets;favorites;text;geo;mentions;hashtags;id;permalink
;2012-01-24 22:34;1;0;"#SOTU Fact Americans losing access to care they like under #Obamacare http:// shar.es/f3OWE #SOTUGOP";;;#SOTU #Obamacare #SOTUGOP;"162030436112011264";https://twitter.com/TomRooney/status/162030436112011264
;2012-01-24 22:30;0;0;"#SOTU Fact #Obamacare driving health care costs higher http:// shar.es/f3OWE #SOTUGOP";;;#SOTU #Obamacare #SOTUGOP;"162029431643320320";https://twitter.com/TomRooney/status/162029431643320320
;2012-01-24 22:26;2;0;"#SOTU Fact House passed full-year payroll tax relief. Senate didnt http:// shar.es/f3OWE #SOTUGOP";;;#SOTU #SOTUGOP;"162028429275955200";https://twitter.com/TomRooney/status/162028429275955200
;2012-01-24 22:22;2;1;"#SOTU Fact 50% of small business income hit by Obama tax hike proposals http:// shar.es/f3OWE #SOTUGOP";;;#SOTU #SOTUGOP;"162027418100576256";https://twitter.com/TomRooney/status/162027418100576256
;2012-01-24 22:18;3;0;"#SOTU Fact Obama administration has 3,118 regulations in the pipeline http:// shar.es/f3OWE #SOTUGOP";;;#SOTU #SOTUGOP;"162026411715067904";https://twitter.com/TomRooney/status/162026411715067904
;2012-01-24 22:14;1;0;"#SOTU Fact: House has passed 27 bills to create jobs, reduce regulations, expand energy production http:// shar.es/f3OWE #SOTUGOP";;;#SOTU #SOTUGOP;"162025409205125120";https://twitter.com/TomRooney/status/162025409205125120
;2012-01-24 22:10;0;1;"#SOTU Fact: Unemployment above 8% for 35 straight months http:// shar.es/f3OWE #SOTUGOP";;;#SOTU #SOTUGOP;"162024396968558593";https://twitter.com/TomRooney/status/162024396968558593
;2012-01-24 22:06;1;0;"#SOTU Fact: Gas prices doubled in last 3 years http:// shar.es/f3OWE #SOTUGOP";;;#SOTU #SOTUGOP;"162023388808884225";https://twitter.com/TomRooney/status/162023388808884225
;2012-01-24 21:58;1;1;"#SOTU Fact: 600,000 jobs lost since #Stimulus passed http:// shar.es/f3OWE";;;#SOTU #Stimulus;"162021379175219200";https://twitter.com/TomRooney/status/162021379175219200
;2012-01-24 21:52;1;0;"#SOTU Fact: Rejecting #Keystone killed 20,000 jobs, hurt American energy security http:// shar.es/f3OWE";;;#SOTU #Keystone;"162019882756616192";https://twitter.com/TomRooney/status/162019882756616192
;2012-01-24 21:50;1;1;"Actions speak louder than words. President has zero credibility when he talks about jobs. #SOTU http:// shar.es/f3OWE #SOTUGOP";;;#SOTU #SOTUGOP;"162019369944231936";https://twitter.com/TomRooney/status/162019369944231936
;2012-01-24 21:43;2;0;"Anyone who expected more than a campaign speech aimed at liberal base must be sorely disappointed #SOTU http:// shar.es/f3OWE #SOTUGOP";;;#SOTU #SOTUGOP;"162017704658735104";https://twitter.com/TomRooney/status/162017704658735104
;2012-01-24 21:42;0;0;"More of the same failed policies #SOTU http:// shar.es/f3OWE #SOTUGOP";;;#SOTU #SOTUGOP;"162017440920911872";https://twitter.com/TomRooney/status/162017440920911872
;2012-01-24 21:20;0;0;"What did you think of the President's speech? #SOTU";;;#SOTU;"162012016943435776";https://twitter.com/TomRooney/status/162012016943435776
;2012-01-24 18:28;1;0;"Want an alternative to the more taxes, borrowing, & stimulus plan POTUS will lay out tonight? Check out my jobs plan http:// shar.es/f3Y4K";;;;"161968540281356289";https://twitter.com/TomRooney/status/161968540281356289
;2012-01-24 17:48;4;0;"Flashback: In 2009 #StateOfTheUnion , President pledged to cut deficit in half by end of 1st term. #BrokenPromises";;;#StateOfTheUnion #BrokenPromises;"161958460433514496";https://twitter.com/TomRooney/status/161958460433514496
;2012-01-24 17:04;2;0;"Our national debt is greater than the size of economy for first time since World War II #StateOfTheUnion";;;#StateOfTheUnion;"161947387844231168";https://twitter.com/TomRooney/status/161947387844231168
;2012-01-24 16:30;0;0;"Gas prices have doubled since Obama took office #StateOfTheUnion #Keystone #Solyndra";;;#StateOfTheUnion #Keystone #Solyndra;"161938846840401921";https://twitter.com/TomRooney/status/161938846840401921
;2012-01-24 16:00;0;0;"Unemployment has been stuck above 8 percent for nearly three years #StateOfTheUnion #stimulus #4Jobs";;;#StateOfTheUnion #stimulus #4Jobs;"161931327149576192";https://twitter.com/TomRooney/status/161931327149576192
;2012-01-24 15:30;1;0;"Obama promised to cut deficit in half. It’s more than doubled in last 3 years. #StateOfTheUnion #1000Days";;;#StateOfTheUnion #1000Days;"161923744540012544";https://twitter.com/TomRooney/status/161923744540012544
;2012-01-24 15:00;3;0;"Harry Reid: “There’s no need to have a Democratic budget in my opinion…it would be foolish” #1000Days w/o Senate budget http:// shar.es/fXqR4";;;#1000Days;"161916239499902976";https://twitter.com/TomRooney/status/161916239499902976
;2012-01-24 14:30;0;0;"Obama: “The least we can do is meet our responsibilities to produce a budget. That’s not too much to ask for.” #1000Days w/o Senate budget h";;;#1000Days;"161908635402911745";https://twitter.com/TomRooney/status/161908635402911745
;2012-01-24 13:58;2;0;"U.S. Constitution could have been drafted, approved & enacted twice in #1000Days . Not enough time for Senate Dems to pass a budget? http://s";;;#1000Days;"161900582481821696";https://twitter.com/TomRooney/status/161900582481821696
;2012-01-24 12:30;1;0;"Former Dem Budget Chairman John Spratt: “If you can’t budget, you can’t govern.” #1000Days w/o a Senate budget http:// shar.es/fXqR4";;;#1000Days;"161878444555239425";https://twitter.com/TomRooney/status/161878444555239425
;2012-01-24 11:51;0;1;"RT @k8xian @TomRooney I will get my whole law degree in #1000days";;@k8xian @TomRooney;#1000days;"161868622057320448";https://twitter.com/TomRooney/status/161868622057320448
;2012-01-24 11:38;1;0;"Counting down top 5 things to watch for in tonight's #StateOfTheUnion this afternoon at http:// facebook.com/reptomrooney .";;;#StateOfTheUnion;"161865537369022464";https://twitter.com/TomRooney/status/161865537369022464
;2012-01-24 11:00;0;0;"RT @RepublicanStudy You'd never heard of the iPad #LastTimeSenateDemsPassedABudget http:// bit.ly/AwB3ek #1000Days";;@RepublicanStudy;#LastTimeSenateDemsPassedABudget #1000Days;"161855852490395651";https://twitter.com/TomRooney/status/161855852490395651
;2012-01-24 09:25;5;0;"Our national debt has grown by more than $4 trillion in #1000Days since Senate passed a budget. http:// shar.es/fXqR4";;;#1000Days;"161831879962669057";https://twitter.com/TomRooney/status/161831879962669057
;2012-01-24 08:45;3;0;"In #1000Days you could travel to Mars & back twice. When you landed, Senate Dems still wouldn’t have a budget. http:// shar.es/fXqR4";;;#1000Days;"161821810025963520";https://twitter.com/TomRooney/status/161821810025963520
;2012-01-24 08:38;0;0;"lol RT @KRenner2 I could have 3.5 babies in #1000days . @SenateDems";;@KRenner2 @SenateDems;#1000days;"161820247333146624";https://twitter.com/TomRooney/status/161820247333146624
;2012-01-24 07:55;3;1;"Senate hasn’t passed a budget in #1000Days . What could you do in 1,000 days?";;;#1000Days;"161809226908442624";https://twitter.com/TomRooney/status/161809226908442624
;2012-01-24 07:15;0;0;"Can’t get out of debt without a plan. Senate doesn’t have one. #1000Days w/o a Senate budget.";;;#1000Days;"161799164563423232";https://twitter.com/TomRooney/status/161799164563423232
;2012-01-24 06:30;4;1;"Today marks #1000Days since the Senate passed a budget. Where’s their plan for debt crisis?";;;#1000Days;"161787843700719616";https://twitter.com/TomRooney/status/161787843700719616
;2012-01-23 16:39;1;0;"What would you like to hear in tomorrow's #StateOfTheUnion ? Please share your thoughts at http:// facebook.com/reptomrooney";;;#StateOfTheUnion;"161578942833233920";https://twitter.com/TomRooney/status/161578942833233920
;2012-01-23 13:42;0;0;"Another abdication of leadership from the campaigner in chief - "Obama delays 2013 budget" http:// bit.ly/wP5FJB via @AddThis";;@AddThis;;"161534233607806976";https://twitter.com/TomRooney/status/161534233607806976
;2012-01-23 13:09;4;0;"Thank u to everyone who came to DC to participate in #MarchforLife . I stand w/ you in your efforts to defend the sanctity of life #prolife";;;#MarchforLife #prolife;"161525900217823232";https://twitter.com/TomRooney/status/161525900217823232
;2012-01-23 11:24;1;0;"in @SSNAlerts : DC should follow FL's lead on jobs http:// bit.ly/yk3MvR";;@SSNAlerts;;"161499646039035905";https://twitter.com/TomRooney/status/161499646039035905
;2012-01-23 11:19;0;0;"@Jim6058 I always appreciate your calls & emails, & I appreciate you taking the time to share your thoughts w/me. Pls stay in touch.";;@Jim6058;;"161498339660144641";https://twitter.com/TomRooney/status/161498339660144641
;2012-01-23 08:54;1;0;"#SOTU preview: more jobs, more borrowing, more spending. Same old policies from the anti-jobs President. http:// youtu.be/H2r_YevgDj4";;;#SOTU;"161461911530115072";https://twitter.com/TomRooney/status/161461911530115072
;2012-01-22 20:56;4;1;"Thanks @GabbyGiffords for your service and your inspirational courage over the last year.";;@GabbyGiffords;;"161281022405787651";https://twitter.com/TomRooney/status/161281022405787651
;2012-01-20 10:39;1;0;"FL unemployment dropped 2.1% in 2011, US just .9%. Washington should follow Florida’s lead #4jobs http:// shar.es/WNmMP #sayfie";;;#4jobs #sayfie;"160401169112510464";https://twitter.com/TomRooney/status/160401169112510464
;2012-01-19 13:37;1;0;"Even Washington Post says President made "Wrong call on Keystone" http://www. washingtonpost.com/opinions/obama s-keystone-pipeline-rejection-is-hard-to-accept/2012/01/18/gIQAf9UG9P_story.html?tid=sm_btn_tw …";;;;"160083517433319424";https://twitter.com/TomRooney/status/160083517433319424
;2012-01-19 12:42;0;0;"@saintluciewes you can also find my jobs bill here http:// shar.es/WPbo0";;@saintluciewes;;"160069614737432578";https://twitter.com/TomRooney/status/160069614737432578
;2012-01-19 12:41;0;0;". @saintluciewes the House has passed 27 bipartisan jobs bills that are stuck in the Senate.";;@saintluciewes;;"160069499389874176";https://twitter.com/TomRooney/status/160069499389874176
;2012-01-19 11:44;6;2;"President Obama, welcome to Florida. Where are the jobs?";;;;"160054918525366273";https://twitter.com/TomRooney/status/160054918525366273
;2012-01-19 11:40;0;0;"The Anti-Jobs President. "Obama's pandering is sadder, though everything the country stands to lose is saddest." http:// on.wsj.com/y4sC8n";;;;"160053915847626752";https://twitter.com/TomRooney/status/160053915847626752
;2012-01-18 16:58;1;1;"This is not the end of the fight #4jobs #Keystone http:// shar.es/WS2mP #sayfie";;;#4jobs #Keystone #sayfie;"159771559626678272";https://twitter.com/TomRooney/status/159771559626678272
;2012-01-18 16:24;1;0;"Blocking #Keystone cost 100,000+ jobs – &removed any remaining shred of credibility Obama has on jobs. http:// shar.es/WS2mP #4jobs #sayfie";;;#Keystone #4jobs #sayfie;"159763063208288256";https://twitter.com/TomRooney/status/159763063208288256
;2012-01-18 15:55;1;0;"Obama says NO to 100,000+ jobs, new energy resource, stronger national security. #Keystone http:// shar.es/WS2mP #safie #4jobs";;;#Keystone #safie #4jobs;"159755902059151360";https://twitter.com/TomRooney/status/159755902059151360
;2012-01-18 15:55;2;0;"Obama says No to #Keystone . OPEC, Venzuela, China celebrate. http:// shar.es/WS2mP #safie #4jobs";;;#Keystone #safie #4jobs;"159755806017990658";https://twitter.com/TomRooney/status/159755806017990658
;2012-01-18 15:42;0;0;"Obama #Keystone decision costs jobs, hurts national security http:// shar.es/WS2mP #safie #4jobs";;;#Keystone #safie #4jobs;"159752646805295104";https://twitter.com/TomRooney/status/159752646805295104
;2012-01-18 15:09;0;0;"Video - national debt stifling growth, jobs. House has a budget. President, Senate need to step up. http:// youtu.be/0HA1FyJD5Cs #sayfie";;;#sayfie;"159744355349954562";https://twitter.com/TomRooney/status/159744355349954562
;2012-01-18 14:18;0;0;"Video: Spoke today on the impact of skyrocketing debt on our economy, jobs, children's future http:// youtu.be/0HA1FyJD5Cs";;;;"159731408078782464";https://twitter.com/TomRooney/status/159731408078782464
;2012-01-18 12:35;0;0;"Paid-for, two-year doc fix needed to protect FL seniors' access to medical care http:// shar.es/WTB3E";;;;"159705469571706880";https://twitter.com/TomRooney/status/159705469571706880
;2012-01-18 10:49;0;0;"Obama jobs council pushes ideas backed by Republicans http:// usat.ly/wjybcL Will he listen??";;;;"159678716409155584";https://twitter.com/TomRooney/status/159678716409155584
;2012-01-17 14:51;0;0;"Obama jobs council endorses ideas in my jobs bill – will President Obama listen? http:// shar.es/WBmOZ";;;;"159377317540544512";https://twitter.com/TomRooney/status/159377317540544512
;2012-01-09 10:27;2;1;"Amendment to kill extra engine named a “Key Vote” of 2011 http:// shar.es/WxO75";;;;"156411716152995840";https://twitter.com/TomRooney/status/156411716152995840
;2012-01-06 14:05;0;0;""Defense strategy signals weakness" http://www. palmbeachpost.com/news/state/208 3159.html …";;;;"155379456654061569";https://twitter.com/TomRooney/status/155379456654061569
;2012-01-06 12:03;0;0;"Obama's Military Cuts 'Dangerous' http://www. newsmax.com/InsideCover/ro oney-obama-military-cuts/2012/01/05/id/423212 …";;;;"155348782333177856";https://twitter.com/TomRooney/status/155348782333177856
;2012-01-05 13:34;1;0;"Appeasement and retreat not effective defense strategies http:// shar.es/WjMTj";;;;"155009273171152897";https://twitter.com/TomRooney/status/155009273171152897
;2011-12-20 10:28;1;0;"I'll be on 850 WFTL w/ @joyceonair today at 12:05 to talk about 2011, look ahead to 2012. Listen live at http://www. 850wftl.com";;@joyceonair;;"149164387809234944";https://twitter.com/TomRooney/status/149164387809234944
;2011-12-16 12:06;1;0;"FL creating jobs by cutting regs, trimming govt, selling itself as good place for small biz. Fed govt should do same http:// shar.es/oNsbb";;;;"147739363218956288";https://twitter.com/TomRooney/status/147739363218956288
;2011-12-14 09:01;0;0;"House passed bipartisan bill to prevent middle class tax hike & help create private secotr jobs. Senate - clock is ticking.";;;;"146968047079538688";https://twitter.com/TomRooney/status/146968047079538688
;2011-12-13 12:19;0;0;"Tax relief & jobs package critical for Florida’s middle class families, small businesses, seniors http:// shar.es/oBs99";;;;"146655374924193792";https://twitter.com/TomRooney/status/146655374924193792
;2011-12-13 11:23;3;0;"People already losing jobs bc of President's delay on #KXL pipeline: http:// bit.ly/ttgP4N Ask POTUS to put American jobs above his own";;;#KXL;"146641347753947137";https://twitter.com/TomRooney/status/146641347753947137
;2011-12-09 11:41;1;0;"Beginning to see impact of supercommittee failure, massive defense cuts as army to cut 8,700 jobs http://www. washingtonpost.com/blogs/federal- eye/post/army-slashing-8700-jobs-as-budget-cuts-begin/2011/12/08/gIQAOWRxhO_blog.html?tid=sm_btn_tw …";;;;"145196464681922560";https://twitter.com/TomRooney/status/145196464681922560
;2011-12-09 09:48;3;0;"Merry Christmas from the U.S. Capitol! Cool time-lapse video of the Capitol Christmas tree set-up &lighting: http:// j.mp/shMrcV";;;;"145167867845947392";https://twitter.com/TomRooney/status/145167867845947392
;2011-12-09 08:43;0;0;"RT @GOPConference See who's on the naughty list this year... VIDEO: http:// bit.ly/t9paa7 #4jobs";;@GOPConference;#4jobs;"145151607254953984";https://twitter.com/TomRooney/status/145151607254953984
;2011-12-07 16:42;0;0;"House-passed #REINS Act will help small businesses create jobs. Senate needs to act. http:// shar.es/oKRnF";;;#REINS;"144547477733900288";https://twitter.com/TomRooney/status/144547477733900288
;2011-12-07 13:46;0;0;"Guess my colleagues who say regs dont hurt jobs disagree w/ Pres. Obama, who said rules "have had a chilling effect on growth and jobs."";;;;"144503111782903809";https://twitter.com/TomRooney/status/144503111782903809
;2011-12-07 13:14;1;0;"Named to bicameral conference cmte to finalize National Defense Authorization Act. Takes care of troops, keeps US safe http:// shar.es/oKC6X";;;;"144494959649759232";https://twitter.com/TomRooney/status/144494959649759232
;2011-12-07 10:24;1;0;"#REINS Act "would produce far more sensible and moderate regulation than we've seen out of this Administration" http:// on.wsj.com/t0DWi6";;;#REINS;"144452296728776704";https://twitter.com/TomRooney/status/144452296728776704
;2011-12-07 09:43;0;0;"Very proud of youth in district 16 RT @theaward More youth from @TomRooney 's district earned Congressional Award than any other last month!";;@theaward @TomRooney;;"144441849036275714";https://twitter.com/TomRooney/status/144441849036275714
;2011-12-07 09:40;2;0;"On the 70th anniversary of the attack on Pearl Harbor, we honor the Greatest Generation who fought to preserve freedom around the world.";;;;"144441268792082432";https://twitter.com/TomRooney/status/144441268792082432
;2011-12-06 09:27;1;0;"Federal red tape costs economy $1.75 trillion each yr. House will vote on #REINS Act this wk to grow economy, create jobs. Senate?";;;#REINS;"144075547176222722";https://twitter.com/TomRooney/status/144075547176222722
;2011-12-02 12:58;0;0;"GE decision to terminate extra engine right for taxpayers; great for Palm Beach, Treasure Coast http:// shar.es/olcF2";;;;"142678944091611136";https://twitter.com/TomRooney/status/142678944091611136
;2011-12-02 10:03;2;0;"315K Americans gave up job search in November, highlighting failure of big govt, big spending policies. Need new plan http:// shar.es/olaB3";;;;"142635048506630144";https://twitter.com/TomRooney/status/142635048506630144
;2011-12-01 09:17;0;0;"Photos: Visited VFW in Indiantown to survey tornado damage. Proud of support from our community to help rebuild. http:// goo.gl/VbS7u";;;;"142261107330007041";https://twitter.com/TomRooney/status/142261107330007041
;2011-11-30 13:18;0;0;"Photos: Honored to speak on Veterans Day at American Legion Post 271 in Tequesta http:// goo.gl/jY7dI";;;;"141959415896080384";https://twitter.com/TomRooney/status/141959415896080384
;2011-11-30 13:17;0;0;"Photos: Had a blast as a guest judge at Tequesta chili cookoff benefiting Honor Flight http:// goo.gl/FfmzI";;;;"141959027981684736";https://twitter.com/TomRooney/status/141959027981684736
;2011-11-30 09:06;4;0;"Cosponsored the #STOCKAct to make it illegal for members of Congress to engage in insider trading http:// shar.es/oYQ9u";;;#STOCKAct;"141895786802839552";https://twitter.com/TomRooney/status/141895786802839552
;2011-11-23 11:04;1;0;"CBO: Stimulus hurts economy in the long run: http:// wtim.es/tQTDJi . #Stimulus2 not the answer. My plan #4Jobs : http:// shar.es/otK54";;;#Stimulus2 #4Jobs;"139388935183933440";https://twitter.com/TomRooney/status/139388935183933440
;2011-11-23 09:01;4;0;"This Saturday is #SmallBusinessSaturday . Great chance to support local small businesses, which create 7 out of 10 new American jobs.";;;#SmallBusinessSaturday;"139357961372966912";https://twitter.com/TomRooney/status/139357961372966912
;2011-11-21 16:12;3;0;"Devastating cuts to nat'l defense w/o deficit agreement. Economy & security will suffer. Need to find the savings to prevent defense cuts";;;;"138741707222159361";https://twitter.com/TomRooney/status/138741707222159361
;2011-11-21 16:11;3;0;"Federal gov't will spend $44 trillion over next 10 yrs. Deficit cmte hasn't found $1.2 trillion in cuts? This is why approval rate is 9%.";;;;"138741345203404800";https://twitter.com/TomRooney/status/138741345203404800
;2011-11-21 12:02;2;0;"Glad to see Pres. sign into law our bill to encourage veteran hiring, repeal 3% withholding tax. Will help small biz grow, create jobs.";;;;"138678753265061888";https://twitter.com/TomRooney/status/138678753265061888
;2011-11-18 13:19;3;0;"49 states, millions of families & small biz balance budgets - disappointed Washington wont do same http:// shar.es/oWlQz . #BBA #4Jobs";;;#BBA #4Jobs;"137610942191120385";https://twitter.com/TomRooney/status/137610942191120385
;2011-11-18 09:26;1;0;"Pls read & RT my op-ed in today's @pbpost on the devastating consequences of $1 trillion in defense cuts http://www. palmbeachpost.com/opinion/commen tary/1976866.html …";;@pbpost;;"137552276972765184";https://twitter.com/TomRooney/status/137552276972765184
;2011-11-18 08:11;0;0;"@edsak I agree on #GOBIG . Pls watch http://www. youtube.com/user/Congressm anRooney#p/a/u/0/cvMisSeBUCw …";;@edsak;#GOBIG #p;"137533388692271104";https://twitter.com/TomRooney/status/137533388692271104
;2011-11-18 08:01;2;0;"Krauthammer on Keystone delay: "It’s hard to think of a more clear-cut case of putting politics over nation." http://www. washingtonpost.com/opinions/obama s-politically-strategic-inaction/2011/11/17/gIQAPCbCWN_story.html?tid=sm_btn_twitter …";;;;"137530819433603072";https://twitter.com/TomRooney/status/137530819433603072
;2011-11-17 14:15;2;0;"Sent letter to Pres Obama asking him to put American security & economy above politics, stop blocking keystone pipeline http:// shar.es/obODj";;;;"137262588185686016";https://twitter.com/TomRooney/status/137262588185686016
;2011-11-17 09:42;1;0;"Great video from @RepPaulRyan on the need to tackle our #15trillion debt http:// youtu.be/X-yVjQzq7W0";;@RepPaulRyan;#15trillion;"137194012921696256";https://twitter.com/TomRooney/status/137194012921696256
;2011-11-16 14:57;3;0;"National debt just hit #15trillion . Time for a balanced budget amendment.";;;#15trillion;"136910895010942976";https://twitter.com/TomRooney/status/136910895010942976
;2011-11-16 13:08;0;0;"National debt will hit #15trillion today. Washington must stop spending money we don’t have #BBA http://www. usdebtclock.org /";;;#15trillion #BBA;"136883260235059201";https://twitter.com/TomRooney/status/136883260235059201
;2011-11-16 11:49;1;0;"Repealing 3% withholding tax will help small businesses grow, hire new workers. Good bipartisan action #4Jobs . http:// shar.es/o3Cp5";;;#4Jobs;"136863380173623296";https://twitter.com/TomRooney/status/136863380173623296
;2011-11-16 11:47;2;0;"House voting tonight on tax credit for hiring unemployed veterans. Good step to help our heroes find jobs http:// shar.es/o3Cp5";;;;"136862996382232576";https://twitter.com/TomRooney/status/136862996382232576
;2011-11-16 11:30;3;0;"#NationalDebt will soon pass $15 trillion. http://www. usdebtclock.org / We're voting on Balanced Budget Amendment #BBA this week. Do you support?";;;#NationalDebt #BBA;"136858726819831808";https://twitter.com/TomRooney/status/136858726819831808
;2011-11-16 09:15;0;0;"Sunshine State News: Defense cuts would undermine national security http:// shar.es/o3okq";;;;"136824799958810624";https://twitter.com/TomRooney/status/136824799958810624
;2011-11-15 16:32;0;0;"I'll be on CNBC tomorrow 8 AM to discuss need for joint deficit cmte to go big & impact on defense if agreement isnt reached. Tune in!";;;;"136572300442083329";https://twitter.com/TomRooney/status/136572300442083329
;2011-11-15 14:17;0;0;"Defense cuts under sequestration would be 'devastating.' Must reach agreement to cut deficits w/o gutting security. http:// shar.es/o0OX7";;;;"136538239883411457";https://twitter.com/TomRooney/status/136538239883411457
;2011-11-15 08:34;2;0;"Disappointed Dems who supported #BalancedBudget in 1995 now opposing SAME measure. Same leaders refused to write budget while in Majority.";;;#BalancedBudget;"136451981945487360";https://twitter.com/TomRooney/status/136451981945487360
;2011-11-14 17:09;1;0;"Just spoke on House floor on my bill to name courthouse in Ft. Pierce in honor Chief Justice Alto Adams. Vote tonight. http://www. youtube.com/watch?v=7SjBFD -oU1o&feature=share …";;;;"136219289635127296";https://twitter.com/TomRooney/status/136219289635127296
;2011-11-14 11:19;2;1;"RT @GOPLeader Today's House schedule includes @TomRooney @JudgeCarter @RepMichaelGrimm @McCaulPressShop @RepLouBarletta http:// majorityleader.gov/Floor/";;@GOPLeader @TomRooney @JudgeCarter @RepMichaelGrimm @McCaulPressShop @RepLouBarletta;;"136131050035355649";https://twitter.com/TomRooney/status/136131050035355649
;2011-11-14 11:17;3;0;"Very pleased Supreme ct agreed to hear challenge to Obamacare. Firmly believe the req't to purchase health insurance is unconstitutional.";;;;"136130611063693312";https://twitter.com/TomRooney/status/136130611063693312
;2011-11-11 11:41;0;0;"Great Veterans Day event at American Legion Post 271, Tequesta, this AM. Now heading to Benjamin School for a Veterans Day Award Ceremony.";;;;"135049452678418433";https://twitter.com/TomRooney/status/135049452678418433
;2011-11-11 09:58;2;0;"A heartfelt thank you to our nation's veterans for your courageous service and sacrifice http:// shar.es/bMUcT";;;;"135023707646197761";https://twitter.com/TomRooney/status/135023707646197761
;2011-11-10 13:56;2;0;"Pls check out the "Nation Give Thanks" app, where you can send messages of thanks to our troops & their families, at http:// facebook.com/reptomrooney";;;;"134721116450193409";https://twitter.com/TomRooney/status/134721116450193409
;2011-11-10 09:01;2;0;"Happy 236th birthday to the US Marine Corps @USMC #SemperFi";;@USMC;#SemperFi;"134646973318971392";https://twitter.com/TomRooney/status/134646973318971392
;2011-11-09 13:24;3;0;"Disappointed in Pres’s comments re: PM Netanyahu. Lend credence to doubts over his commitment to strong relationship http:// shar.es/bStca";;;;"134350718810341377";https://twitter.com/TomRooney/status/134350718810341377
;2011-11-08 14:05;1;0;"Hope to see you at one of these events honoring our nation's veterans this weekend. Schedule here: http:// shar.es/bBhRI";;;;"133998709934534657";https://twitter.com/TomRooney/status/133998709934534657
